Bus Hound 6.00 capture on Windows Vista (x64). Complements of www.perisoft.net

  Device - Device ID (followed by the endpoint for USB devices)
            (6) USB Root Hub (USB 3.0)
            (8) USB Mass Storage Device
            (10) USB2.0 Digital Camera
            (11) USB Composite Device
            (15) Generic Flash Disk [ROM=8.07]
            (20) EarPods
            (21) USB Input Device
            (22) USB Input Device
            (28) HID-compliant consumer control device
            (29) HID-compliant vendor-defined device
            (31) HID Keyboard Device
            (32) HID-compliant consumer control device
            (33) HID-compliant system controller
            (34) HID-compliant vendor-defined device
            (35) HID-compliant vendor-defined device
            (37) HID Keyboard Device
            (38) HID-compliant mouse
            (39) HID-compliant mouse
  Address - FireWire async address or channel number
  Length - Total transfer length
  Phase  - Phase Type
            ASTS  ATA task file status       NTSTS NTSTATUS value
            ATA   ATA task file command      OUT   Data out transfer
            BRB   Bluetooth request block    RESET bus reset
            CMD   SCSI/ATAPI command         SENSE SCSI sense data
            CTL   USB control transfer       SSTS  SCSI request block status
            IN    Data in transfer           USTS  USB status
            ISOC  Isochronous transfer       ok    command complete
            LOCK  FireWire lock transaction
  Data   - Hex dump of the data transferred
  Delta  - Elapsed time from the previous phase to the current phase
  Cmd... - Position in the captured data


Device  Address              Length    Phase  Data                      Delta  Cmd.Phase.Ofs(rep)
------  -------------------  --------  -----  ------------------------  -----  ------------------
  15                                   CMD    00 00 00 00  00 00        227ms         1.1.0        
   8.1                             31  OUT    55 53 42 43  50 f0 fd 30  154us         2.1.0        
                                              00 00 00 00  00 00 06 00                2.1.8        
                                              00 00 00 00  00 00 00 00                2.1.16       
                                              00 00 00 00  00 00 00                   2.1.24       
   8.2                             13  IN     55 53 42 53  50 f0 fd 30  116us         3.1.0        
                                              00 00 00 00  00                         3.1.8        
  15                                   ok                                 7us         1.2.0        
  10.0                                 CTL    80 06 00 01  00 00 12 00   18sc        58.1.0        
  10.0                             18  IN     12 01 00 02  00 00 00 40   90us        58.2.0        
                                              48 44 70 56  40 1b 01 02               58.2.8        
                                              00 01                                  58.2.16       
  10.0                                 CTL    80 06 00 03  00 00 02 00   21us        59.1.0        
  10.0                              2  IN     04 03                      53us        59.2.0        
  10.0                                 CTL    80 06 00 03  00 00 04 00   16us        60.1.0        
  10.0                              4  IN     04 03 09 04               120us        60.2.0        
  10.0                                 CTL    80 06 01 03  09 04 02 00   12us        61.1.0        
  10.0                              2  IN     06 03                      70us        61.2.0        
  10.0                                 CTL    80 06 01 03  09 04 06 00   17us        62.1.0        
  10.0                              6  IN     06 03 54 00  33 00        150us        62.2.0        
  10.0                                 CTL    80 06 02 03  09 04 02 00   20us        63.1.0        
  10.0                              2  IN     1a 03                      75us        63.2.0        
  10.0                                 CTL    80 06 02 03  09 04 1a 00   15us        64.1.0        
  10.0                             26  IN     1a 03 52 00  48 00 30 00  138us        64.2.0        
                                              37 00 36 00  31 00 30 00               64.2.8        
                                              30 00 39 00  30 00 31 00               64.2.16       
                                              34 00                                  64.2.24       
  10.0                                 CTL    80 06 00 03  09 04 02 00   15us        65.1.0        
  10.0                              2  IN     04 03                      45us        65.2.0        
  10.0                                 CTL    80 06 00 03  09 04 04 00   16us        66.1.0        
  10.0                              4  IN     04 03 09 04                52us        66.2.0        
  10.0                                 CTL    80 06 02 03  09 04 02 00  426us        67.1.0        
  10.0                              2  IN     1a 03                      75us        67.2.0        
  10.0                                 CTL    80 06 02 03  09 04 1a 00   13us        68.1.0        
  10.0                             26  IN     1a 03 52 00  48 00 30 00   64us        68.2.0        
                                              37 00 36 00  31 00 30 00               68.2.8        
                                              30 00 39 00  30 00 31 00               68.2.16       
                                              34 00                                  68.2.24       
  10.0                                 CTL    80 06 01 03  00 00 20 00  165us        69.1.0        
  10.0                              6  IN     06 03 54 00  33 00        130us        69.2.0        
  10.0                                 CTL    c0 e1 00 00  00 00 04 00   36us        70.1.0        
  10.0                              4  IN     05 0b 00 00               872us        70.2.0        
  10.0                                 CTL    c0 b4 00 00  00 00 01 00   35us        71.1.0(2)     
  10.0                              1  IN     74                         70us        71.2.0        
  10.0                                 CTL    c0 e1 00 00  04 00 40 00  137us        73.1.0        
  10.0                             64  IN     00 00 00 00  01 01 00 00  3.9ms        73.2.0        
                                              11 44 61 68  65 6e 67 20               73.2.8        
                                              49 6d 61 76  69 73 69 6f               73.2.16       
                                              6e 00 20 00  00 00 01 01               73.2.24       
                                              00 00 0f 4d  45 52 2d 31               73.2.32       
                                              33 30 2d 33  30 55 4d 2d               73.2.40       
                                              4c 00 80 00  00 00 01 01               73.2.48       
                                              00 00 0d 52  48 30 37 36               73.2.56       
  10.0                                 CTL    c0 b4 00 00  00 00 01 00   90us        74.1.0(2)     
  10.0                              1  IN     74                        816us        74.2.0        
  10.0                                 CTL    c0 e1 00 00  44 00 40 00  169us        76.1.0        
  10.0                             64  IN     31 30 30 39  30 31 34 00  3.5ms        76.2.0        
                                              90 00 00 00  01 01 00 00               76.2.8        
                                              03 36 37 00  04 01 00 00               76.2.16       
                                              01 01 00 00  0a 31 32 33               76.2.24       
                                              34 56 33 32  30 33 00 14               76.2.32       
                                              01 00 00 01  01 00 00 0e               76.2.40       
                                              31 2e 31 2e  31 33 30 35               76.2.48       
                                              2e 39 33 30  31 00 00 02               76.2.56       
  10.0                                 CTL    c0 b4 00 00  00 00 01 00  1.5ms        77.1.0(2)     
  10.0                              1  IN     74                        919us        77.2.0        
  10.0                                 CTL    80 06 02 03  00 00 20 00  2.4ms        79.1.0        
  10.0                             26  IN     1a 03 52 00  48 00 30 00   88us        79.2.0        
                                              37 00 36 00  31 00 30 00               79.2.8        
                                              30 00 39 00  30 00 31 00               79.2.16       
                                              34 00                                  79.2.24       
  10.0                                 CTL    80 06 00 01  00 00 12 00  428us        80.1.0        
  10.0                             18  IN     12 01 00 02  00 00 00 40   60us        80.2.0        
                                              48 44 70 56  40 1b 01 02               80.2.8        
                                              00 01                                  80.2.16       
  10.0                                 CTL    80 06 00 03  00 00 02 00   17us        81.1.0        
  10.0                              2  IN     04 03                      44us        81.2.0        
  10.0                                 CTL    80 06 00 03  00 00 04 00   12us        82.1.0        
  10.0                              4  IN     04 03 09 04                44us        82.2.0        
  10.0                                 CTL    80 06 01 03  09 04 02 00   16us        83.1.0        
  10.0                              2  IN     06 03                     778us        83.2.0        
  10.0                                 CTL    80 06 01 03  09 04 06 00   17us        84.1.0        
  10.0                              6  IN     06 03 54 00  33 00         74us        84.2.0        
  10.0                                 CTL    80 06 02 03  09 04 02 00   12us        85.1.0        
  10.0                              2  IN     1a 03                      71us        85.2.0        
  10.0                                 CTL    80 06 02 03  09 04 1a 00   13us        86.1.0        
  10.0                             26  IN     1a 03 52 00  48 00 30 00   70us        86.2.0        
                                              37 00 36 00  31 00 30 00               86.2.8        
                                              30 00 39 00  30 00 31 00               86.2.16       
                                              34 00                                  86.2.24       
  10.0                                 CTL    80 06 00 03  09 04 02 00   12us        87.1.0        
  10.0                              2  IN     04 03                     151us        87.2.0        
  10.0                                 CTL    80 06 00 03  09 04 04 00   15us        88.1.0        
  10.0                              4  IN     04 03 09 04                50us        88.2.0        
  10.0                                 CTL    80 06 02 03  09 04 02 00  900us        89.1.0        
  10.0                              2  IN     1a 03                      73us        89.2.0        
  10.0                                 CTL    80 06 02 03  09 04 1a 00   14us        90.1.0        
  10.0                             26  IN     1a 03 52 00  48 00 30 00   69us        90.2.0        
                                              37 00 36 00  31 00 30 00               90.2.8        
                                              30 00 39 00  30 00 31 00               90.2.16       
                                              34 00                                  90.2.24       
  10.0                                 CTL    80 06 01 03  00 00 20 00  106us        91.1.0        
  10.0                              6  IN     06 03 54 00  33 00        901us        91.2.0        
  10.0                                 CTL    c0 e1 00 00  00 00 04 00   71us        92.1.0        
  10.0                              4  IN     05 0b 00 00               1.5ms        92.2.0        
  10.0                                 CTL    c0 b4 00 00  00 00 01 00  1.5ms        93.1.0(2)     
  10.0                              1  IN     74                        751us        93.2.0        
  10.0                                 CTL    c0 e1 00 00  04 00 40 00  870us        95.1.0        
  10.0                             64  IN     00 00 00 00  01 01 00 00  3.3ms        95.2.0        
                                              11 44 61 68  65 6e 67 20               95.2.8        
                                              49 6d 61 76  69 73 69 6f               95.2.16       
                                              6e 00 20 00  00 00 01 01               95.2.24       
                                              00 00 0f 4d  45 52 2d 31               95.2.32       
                                              33 30 2d 33  30 55 4d 2d               95.2.40       
                                              4c 00 80 00  00 00 01 01               95.2.48       
                                              00 00 0d 52  48 30 37 36               95.2.56       
  10.0                                 CTL    c0 b4 00 00  00 00 01 00   66us        96.1.0(2)     
  10.0                              1  IN     74                         85us        96.2.0        
  10.0                                 CTL    c0 e1 00 00  44 00 40 00  153us        98.1.0        
  10.0                             64  IN     31 30 30 39  30 31 34 00  4.5ms        98.2.0        
                                              90 00 00 00  01 01 00 00               98.2.8        
                                              03 36 37 00  04 01 00 00               98.2.16       
                                              01 01 00 00  0a 31 32 33               98.2.24       
                                              34 56 33 32  30 33 00 14               98.2.32       
                                              01 00 00 01  01 00 00 0e               98.2.40       
                                              31 2e 31 2e  31 33 30 35               98.2.48       
                                              2e 39 33 30  31 00 00 02               98.2.56       
  10.0                                 CTL    c0 b4 00 00  00 00 01 00   37us        99.1.0(2)     
  10.0                              1  IN     74                         78us        99.2.0        
  10.0                                 CTL    80 06 02 03  00 00 20 00  186us       101.1.0        
  10.0                             26  IN     1a 03 52 00  48 00 30 00   76us       101.2.0        
                                              37 00 36 00  31 00 30 00              101.2.8        
                                              30 00 39 00  30 00 31 00              101.2.16       
                                              34 00                                 101.2.24       
  10.0                                 CTL    80 06 00 01  00 00 12 00   22ms       102.1.0        
  10.0                             18  IN     12 01 00 02  00 00 00 40  107us       102.2.0        
                                              48 44 70 56  40 1b 01 02              102.2.8        
                                              00 01                                 102.2.16       
  10.0                                 CTL    80 06 00 03  00 00 02 00   21us       103.1.0        
  10.0                              2  IN     04 03                      73us       103.2.0        
  10.0                                 CTL    80 06 00 03  00 00 04 00   12us       104.1.0        
  10.0                              4  IN     04 03 09 04                48us       104.2.0        
  10.0                                 CTL    80 06 01 03  09 04 02 00   12us       105.1.0        
  10.0                              2  IN     06 03                      62us       105.2.0        
  10.0                                 CTL    80 06 01 03  09 04 06 00   76us       106.1.0        
  10.0                              6  IN     06 03 54 00  33 00         80us       106.2.0        
  10.0                                 CTL    80 06 02 03  09 04 02 00   13us       107.1.0        
  10.0                              2  IN     1a 03                      64us       107.2.0        
  10.0                                 CTL    80 06 02 03  09 04 1a 00   11us       108.1.0        
  10.0                             26  IN     1a 03 52 00  48 00 30 00   64us       108.2.0        
                                              37 00 36 00  31 00 30 00              108.2.8        
                                              30 00 39 00  30 00 31 00              108.2.16       
                                              34 00                                 108.2.24       
  10.0                                 CTL    80 06 00 03  09 04 02 00   11us       109.1.0        
  10.0                              2  IN     04 03                      42us       109.2.0        
  10.0                                 CTL    80 06 00 03  09 04 04 00   12us       110.1.0        
  10.0                              4  IN     04 03 09 04                62us       110.2.0        
  10.0                                 CTL    80 06 02 03  09 04 02 00  407us       111.1.0        
  10.0                              2  IN     1a 03                      71us       111.2.0        
  10.0                                 CTL    80 06 02 03  09 04 1a 00   12us       112.1.0        
  10.0                             26  IN     1a 03 52 00  48 00 30 00   64us       112.2.0        
                                              37 00 36 00  31 00 30 00              112.2.8        
                                              30 00 39 00  30 00 31 00              112.2.16       
                                              34 00                                 112.2.24       
  10.0                                 CTL    80 06 02 03  00 00 20 00  101us       113.1.0        
  10.0                             26  IN     1a 03 52 00  48 00 30 00   72us       113.2.0        
                                              37 00 36 00  31 00 30 00              113.2.8        
                                              30 00 39 00  30 00 31 00              113.2.16       
                                              34 00                                 113.2.24       
  10                                   RESET                             15us       114.1.0        
   6                                   CMD    00 00 00 00  00 00 00 00   10us       115.1.0(3)     
                                              01 00 00 00  00 00 00 00              115.1.8        
                                              00 00 00 00  00 00 00 00              115.1.16       
                                              70 c8 13 2d  0a 95 ff ff              115.1.24       
                                              00 00 00 00  00 00 00 00              115.1.32       
                                              00 00 00 00  00 00 00 00              115.1.40       
                                              00 00 00 00  00 00 00 00              115.1.48       
                                              00 00 00 00  00 00 00 00              115.1.56       
                                              00 00 00 00  00 00 00 00              115.1.64       
                                              00 00 13 02  62 66 75 53              115.1.72       
                                              00 00 00 00  00 00 00 00              115.1.80       
                                              14 01 00 00  e4 3b 5f 30              115.1.88       
                                              0a 95 ff ff  00 00 00 00              115.1.96       
                                              00 00 00 00  00 00 00 00              115.1.104      
                                              00 00 00 00  00 00 00 00              115.1.112      
                                              00 00 00 00  00 00 00 00              115.1.120      
                                              00 00 00 00  00 00 00 00              115.1.128      
                                              00 00 00 00  00 00 00 00              115.1.136      
                                              00 00 00 00  00 00                    115.1.144      
   6                                   SSTS   00                          8us       115.2.0        
   6.0                                 CTL    23 03 04 00  08 00 00 00  356us       118.1.0        
   6                                4  OUT    00 01 00 00                55ms       119.1.0        
   6.0                                 CTL    a3 00 00 00  08 00 04 00   31us       120.1.0        
   6.0                              4  IN     03 05 10 00                20us       120.2.0        
   6.0                                 CTL    23 01 14 00  08 00 00 00    9us       121.1.0        
   6.0                                 CTL    a3 00 00 00  08 00 04 00   14us       122.1.0        
   6.0                              4  IN     03 05 00 00                 2us       122.2.0        
   6                                4  OUT    00 00 00 00               128us       123.1.0        
   6                                   CMD    00 00 00 00  00 00 00 00   20us       124.1.0        
                                              01 00 00 00  00 00 00 00              124.1.8        
                                              00 00 00 00  00 00 00 00              124.1.16       
                                              70 c8 13 2d  0a 95 ff ff              124.1.24       
                                              00 00 00 00  00 00 00 00              124.1.32       
                                              00 00 00 00  00 00 00 00              124.1.40       
                                              00 00 00 00  00 00 00 00              124.1.48       
                                              00 00 00 00  00 00 00 00              124.1.56       
                                              00 00 00 00  00 00 00 00              124.1.64       
                                              00 00 13 02  62 66 75 53              124.1.72       
                                              00 00 00 00  00 00 00 00              124.1.80       
                                              14 01 00 00  e4 3b 5f 30              124.1.88       
                                              0a 95 ff ff  00 00 00 00              124.1.96       
                                              00 00 00 00  00 00 00 00              124.1.104      
                                              00 00 00 00  00 00 00 00              124.1.112      
                                              00 00 00 00  00 00 00 00              124.1.120      
                                              00 00 00 00  00 00 00 00              124.1.128      
                                              00 00 00 00  00 00 00 00              124.1.136      
                                              00 00 00 00  00 00                    124.1.144      
   6                                   SSTS   00                        197us       124.2.0        
   6.0                                 CTL    80 06 00 01  00 00 40 00   32ms       125.1.0        
   6.0                             18  IN     12 01 00 02  00 00 00 40  120us       125.2.0        
                                              48 44 70 56  40 1b 01 02              125.2.8        
                                              00 01                                 125.2.16       
   6.0                                 CTL    23 03 04 00  08 00 00 00   14us       126.1.0        
   6                                4  OUT    00 01 00 00                56ms       127.1.0        
   6.0                                 CTL    a3 00 00 00  08 00 04 00   13us       128.1.0        
   6.0                              4  IN     03 05 10 00                13us       128.2.0        
   6.0                                 CTL    23 01 14 00  08 00 00 00    5us       129.1.0        
   6.0                                 CTL    a3 00 00 00  08 00 04 00    6us       130.1.0        
   6.0                              4  IN     03 05 00 00                 2us       130.2.0        
   6                                4  OUT    00 00 00 00                91us       131.1.0        
   6                                   CMD    00 00 00 00  00 00 00 00   11us       132.1.0        
                                              01 00 00 00  00 00 00 00              132.1.8        
                                              00 00 00 00  00 00 00 00              132.1.16       
                                              70 c8 13 2d  0a 95 ff ff              132.1.24       
                                              00 00 00 00  00 00 00 00              132.1.32       
                                              00 00 00 00  00 00 00 00              132.1.40       
                                              00 00 00 00  00 00 00 00              132.1.48       
                                              00 00 00 00  00 00 00 00              132.1.56       
                                              00 00 00 00  00 00 00 00              132.1.64       
                                              00 00 13 02  62 66 75 53              132.1.72       
                                              00 00 00 00  00 00 00 00              132.1.80       
                                              14 01 00 00  e4 3b 5f 30              132.1.88       
                                              0a 95 ff ff  00 00 00 00              132.1.96       
                                              00 00 00 00  00 00 00 00              132.1.104      
                                              00 00 00 00  00 00 00 00              132.1.112      
                                              00 00 00 00  00 00 00 00              132.1.120      
                                              00 00 00 00  00 00 00 00              132.1.128      
                                              00 00 00 00  00 00 00 00              132.1.136      
                                              00 00 00 00  00 00                    132.1.144      
   6                                   SSTS   00                          7us       132.2.0        
   6.0                                 CTL    80 06 00 01  00 00 12 00   43ms       134.1.0        
   6.0                             18  IN     12 01 00 02  00 00 00 40   85us       134.2.0        
                                              48 44 70 56  40 1b 01 02              134.2.8        
                                              00 01                                 134.2.16       
   6.0                                 CTL    00 09 01 00  00 00 00 00   31us       135.1.0        
   6                                   CMD    00 00 00 00  00 00 00 00   52us       136.1.0        
                                              01 00 00 00  00 00 00 00              136.1.8        
                                              00 00 00 00  00 00 00 00              136.1.16       
                                              70 c8 13 2d  0a 95 ff ff              136.1.24       
                                              00 00 00 00  00 00 00 00              136.1.32       
                                              00 00 00 00  00 00 00 00              136.1.40       
                                              00 00 00 00  00 00 00 00              136.1.48       
                                              00 00 00 00  00 00 00 00              136.1.56       
                                              00 00 00 00  00 00 00 00              136.1.64       
                                              00 00 13 02  62 66 75 53              136.1.72       
                                              00 00 00 00  00 00 00 00              136.1.80       
                                              14 01 00 00  e4 3b 5f 30              136.1.88       
                                              0a 95 ff ff  00 00 00 00              136.1.96       
                                              00 00 00 00  00 00 00 00              136.1.104      
                                              00 00 00 00  00 00 00 00              136.1.112      
                                              00 00 00 00  00 00 00 00              136.1.120      
                                              00 00 00 00  00 00 00 00              136.1.128      
                                              00 00 00 00  00 00 00 00              136.1.136      
                                              00 00 00 00  00 00                    136.1.144      
   6                                   SSTS   00                        431us       136.2.0        
  10                                   ok                                93us       114.2.0        
  10.2                                 RESET                             41us       137.1.0        
   6.0                                 CTL    02 01 00 00  82 00 00 00   13us       138.1.0        
   6                                   CMD    00 00 00 00  00 00 00 00   53us       139.1.0        
                                              01 00 00 00  00 00 00 00              139.1.8        
                                              00 00 00 00  00 00 00 00              139.1.16       
                                              70 c8 13 2d  0a 95 ff ff              139.1.24       
                                              00 00 00 00  00 00 00 00              139.1.32       
                                              00 00 00 00  00 00 00 00              139.1.40       
                                              00 00 00 00  00 00 00 00              139.1.48       
                                              00 00 00 00  00 00 00 00              139.1.56       
                                              00 00 00 00  00 00 00 00              139.1.64       
                                              00 00 13 02  62 66 75 53              139.1.72       
                                              00 00 00 00  00 00 00 00              139.1.80       
                                              14 01 00 00  e4 3b 5f 30              139.1.88       
                                              0a 95 ff ff  00 00 00 00              139.1.96       
                                              00 00 00 00  00 00 00 00              139.1.104      
                                              00 00 00 00  00 00 00 00              139.1.112      
                                              00 00 00 00  00 00 00 00              139.1.120      
                                              00 00 00 00  00 00 00 00              139.1.128      
                                              00 00 00 00  00 00 00 00              139.1.136      
                                              00 00 00 00  00 00                    139.1.144      
   6                                   SSTS   00                        352us       139.2.0        
  10.0                                 CTL    80 06 01 03  00 00 20 00   53us       140.1.0        
  10.0                              6  IN     06 03 54 00  33 00         76us       140.2.0        
  10.0                                 CTL    40 b2 03 00  00 00 03 00   35us       141.1.0        
  10.0                              3  OUT    f3 f3 fd                  1.3ms       141.2.0        
  10.0                                 CTL    c0 b4 00 00  00 00 01 00   54us       142.1.0(2)     
  10.0                              1  IN     74                        137us       142.2.0        
  10.0                                 CTL    c0 e1 00 00  00 00 04 00  5.4ms       144.1.0        
  10.0                              4  IN     05 0b 00 00               871us       144.2.0        
  10.0                                 CTL    c0 b4 00 00  00 00 01 00   33us       145.1.0(2)     
  10.0                              1  IN     74                        124us       145.2.0        
  10.0                                 CTL    c0 e1 00 00  04 00 40 00  135us       147.1.0        
  10.0                             64  IN     00 00 00 00  01 01 00 00  3.3ms       147.2.0        
                                              11 44 61 68  65 6e 67 20              147.2.8        
                                              49 6d 61 76  69 73 69 6f              147.2.16       
                                              6e 00 20 00  00 00 01 01              147.2.24       
                                              00 00 0f 4d  45 52 2d 31              147.2.32       
                                              33 30 2d 33  30 55 4d 2d              147.2.40       
                                              4c 00 80 00  00 00 01 01              147.2.48       
                                              00 00 0d 52  48 30 37 36              147.2.56       
  10.0                                 CTL    c0 b4 00 00  00 00 01 00   45us       148.1.0(2)     
  10.0                              1  IN     74                        122us       148.2.0        
  10.0                                 CTL    c0 e1 00 00  44 00 40 00  126us       150.1.0        
  10.0                             64  IN     31 30 30 39  30 31 34 00  3.9ms       150.2.0        
                                              90 00 00 00  01 01 00 00              150.2.8        
                                              03 36 37 00  04 01 00 00              150.2.16       
                                              01 01 00 00  0a 31 32 33              150.2.24       
                                              34 56 33 32  30 33 00 14              150.2.32       
                                              01 00 00 01  01 00 00 0e              150.2.40       
                                              31 2e 31 2e  31 33 30 35              150.2.48       
                                              2e 39 33 30  31 00 00 02              150.2.56       
  10.0                                 CTL    c0 b4 00 00  00 00 01 00   60us       151.1.0(2)     
  10.0                              1  IN     74                         82us       151.2.0        
  10.0                                 CTL    c0 e1 00 00  84 00 40 00  220us       153.1.0        
  10.0                             64  IN     00 00 04 01  00 00 00 05  3.3ms       153.2.0        
                                              00 00 04 02  00 00 04 01              153.2.8        
                                              00 00 00 04  00 00 08 02              153.2.16       
                                              00 00 04 01  00 00 00 05              153.2.24       
                                              00 00 0c 02  00 00 04 01              153.2.32       
                                              00 00 00 04  00 00 10 02              153.2.40       
                                              00 00 04 03  00 00 00 00              153.2.48       
                                              00 00 14 02  00 00 04 03              153.2.56       
  10.0                                 CTL    c0 b4 00 00  00 00 01 00   54us       154.1.0(2)     
  10.0                              1  IN     74                         75us       154.2.0        
  10.0                                 CTL    c0 e1 00 00  c4 00 40 00  180us       156.1.0        
  10.0                             64  IN     00 00 00 00  00 00 18 02  3.3ms       156.2.0        
                                              00 00 04 03  00 00 00 05              156.2.8        
                                              00 00 1c 02  00 00 04 03              156.2.16       
                                              00 00 00 04  00 00 20 02              156.2.24       
                                              00 00 04 01  00 00 00 00              156.2.32       
                                              00 00 24 02  00 00 04 01              156.2.40       
                                              00 00 00 00  00 00 28 02              156.2.48       
                                              00 00 04 01  00 00 04 00              156.2.56       
  10.0                                 CTL    c0 b4 00 00  00 00 01 00   28us       157.1.0(2)     
  10.0                              1  IN     74                         73us       157.2.0        
  10.0                                 CTL    c0 e1 00 00  04 01 40 00  100us       159.1.0        
  10.0                             64  IN     00 00 2c 02  00 00 04 01  4.0ms       159.2.0        
                                              00 00 04 00  00 00 30 02              159.2.8        
                                              00 00 04 01  00 00 fc 04              159.2.16       
                                              00 00 34 02  00 00 04 01              159.2.24       
                                              00 00 fc 03  00 00 38 02              159.2.32       
                                              00 00 04 01  00 00 00 05              159.2.40       
                                              00 00 3c 02  00 00 04 01              159.2.48       
                                              00 00 00 04  00 00 40 02              159.2.56       
  10.0                                 CTL    c0 b4 00 00  00 00 01 00   32us       160.1.0(2)     
  10.0                              1  IN     74                        149us       160.2.0        
  10.0                                 CTL    c0 e1 00 00  44 01 40 00  119us       162.1.0        
  10.0                             64  IN     00 00 04 01  00 00 04 00  3.3ms       162.2.0        
                                              00 00 44 02  00 00 04 01              162.2.8        
                                              00 00 04 00  00 00 48 02              162.2.16       
                                              00 00 04 01  00 00 04 00              162.2.24       
                                              00 00 4c 02  00 00 04 01              162.2.32       
                                              00 00 04 00  00 00 70 02              162.2.40       
                                              00 00 04 03  00 00 00 00              162.2.48       
                                              00 00 74 02  00 00 04 03              162.2.56       
  10.0                                 CTL    c0 b4 00 00  00 00 01 00   40us       163.1.0(2)     
  10.0                              1  IN     74                         75us       163.2.0        
  10.0                                 CTL    c0 e1 00 00  84 01 40 00  110us       165.1.0        
  10.0                             64  IN     00 00 00 00  00 00 78 02  3.3ms       165.2.0        
                                              00 00 04 01  00 00 02 00              165.2.8        
                                              00 00 7c 02  00 00 04 01              165.2.16       
                                              00 00 02 00  00 00 80 02              165.2.24       
                                              00 00 04 01  00 00 00 00              165.2.32       
                                              00 00 84 02  00 00 04 01              165.2.40       
                                              00 00 00 00  00 00 88 02              165.2.48       
                                              00 00 04 01  00 00 01 00              165.2.56       
  10.0                                 CTL    c0 b4 00 00  00 00 01 00   34us       166.1.0(2)     
  10.0                              1  IN     74                        133us       166.2.0        
  10.0                                 CTL    c0 e1 00 00  c4 01 40 00  119us       168.1.0        
  10.0                             64  IN     00 00 8c 02  00 00 04 01  3.3ms       168.2.0        
                                              00 00 01 00  00 00 9c 02              168.2.8        
                                              00 00 02 03  00 00 01 00              168.2.16       
                                              08 01 02 00  00 00 01 00              168.2.24       
                                              08 01 03 00  10 01 70 03              168.2.32       
                                              00 00 04 01  00 00 00 00              168.2.40       
                                              14 00 00 04  00 00 02 03              168.2.48       
                                              00 00 02 00  00 00 03 00              168.2.56       
  10.0                                 CTL    c0 b4 00 00  00 00 01 00   37us       169.1.0(2)     
  10.0                              1  IN     74                        127us       169.2.0        
  10.0                                 CTL    c0 e1 00 00  04 02 40 00  115us       171.1.0        
  10.0                             64  IN     00 00 00 00  00 00 01 00  3.3ms       171.2.0        
                                              00 00 02 00  00 00 10 04              171.2.8        
                                              00 00 04 03  00 00 02 00              171.2.16       
                                              00 00 14 04  00 00 04 01              171.2.24       
                                              00 00 01 00  00 00 18 04              171.2.32       
                                              00 00 04 01  00 00 0a 00              171.2.40       
                                              00 00 1c 04  00 00 04 01              171.2.48       
                                              00 00 01 00  00 00 20 04              171.2.56       
  10.0                                 CTL    c0 b4 00 00  00 00 01 00   36us       172.1.0(2)     
  10.0                              1  IN     74                        128us       172.2.0        
  10.0                                 CTL    c0 e1 00 00  44 02 40 00  128us       174.1.0        
  10.0                             64  IN     00 00 04 03  00 00 0c 00  3.3ms       174.2.0        
                                              00 00 24 04  00 00 04 01              174.2.8        
                                              00 00 00 00  00 00 28 04              174.2.16       
                                              00 00 04 01  00 00 0c 00              174.2.24       
                                              00 00 2c 04  00 00 04 01              174.2.32       
                                              00 00 01 00  00 00 30 04              174.2.40       
                                              00 00 02 03  00 00 00 00              174.2.48       
                                              00 00 02 00  00 00 00 00              174.2.56       
  10.0                                 CTL    c0 b4 00 00  00 00 01 00   43us       175.1.0(2)     
  10.0                              1  IN     74                         76us       175.2.0        
  10.0                                 CTL    c0 e1 00 00  84 02 40 00  160us       177.1.0        
  10.0                             64  IN     00 00 01 00  00 00 3c 04  3.3ms       177.2.0        
                                              00 00 02 03  00 00 01 00              177.2.8        
                                              00 00 02 00  00 00 00 00              177.2.16       
                                              00 00 01 00  00 00 50 04              177.2.24       
                                              00 00 02 03  00 00 01 00              177.2.32       
                                              00 00 02 00  00 00 00 00              177.2.40       
                                              00 00 01 00  00 00 58 04              177.2.48       
                                              00 00 04 03  00 00 30 75              177.2.56       
  10.0                                 CTL    c0 b4 00 00  00 00 01 00   38us       178.1.0(2)     
  10.0                              1  IN     74                         93us       178.2.0        
  10.0                                 CTL    c0 e1 00 00  c4 02 40 00  174us       180.1.0        
  10.0                             64  IN     00 00 5c 04  00 00 04 01  3.3ms       180.2.0        
                                              00 00 20 01  00 00 60 04              180.2.8        
                                              00 00 04 01  00 00 40 42              180.2.16       
                                              0f 00 64 04  00 00 04 01              180.2.24       
                                              00 00 01 00  00 00 68 04              180.2.32       
                                              00 00 02 03  00 00 00 00              180.2.40       
                                              00 00 02 00  00 00 00 00              180.2.48       
                                              00 00 01 00  00 00 70 04              180.2.56       
  10.0                                 CTL    c0 b4 00 00  00 00 01 00   35us       181.1.0(2)     
  10.0                              1  IN     74                         73us       181.2.0        
  10.0                                 CTL    c0 e1 00 00  04 03 40 00  207us       183.1.0        
  10.0                             64  IN     00 00 04 03  00 00 b7 03  3.3ms       183.2.0        
                                              00 00 74 04  00 00 04 01              183.2.8        
                                              00 00 01 00  00 00 78 04              183.2.16       
                                              00 00 04 01  00 00 ff 3f              183.2.24       
                                              00 00 7c 04  00 00 04 01              183.2.32       
                                              00 00 01 00  00 00 80 04              183.2.40       
                                              00 00 04 03  00 00 00 00              183.2.48       
                                              00 00 84 04  00 00 04 01              183.2.56       
  10.0                                 CTL    c0 b4 00 00  00 00 01 00   33us       184.1.0(2)     
  10.0                              1  IN     74                         75us       184.2.0        
  10.0                                 CTL    c0 e1 00 00  44 03 40 00  132us       186.1.0        
  10.0                             64  IN     00 00 00 00  00 00 88 04  3.3ms       186.2.0        
                                              00 00 04 01  00 00 e8 03              186.2.8        
                                              00 00 8c 04  00 00 04 01              186.2.16       
                                              00 00 64 00  00 00 90 04              186.2.24       
                                              00 00 04 03  00 00 00 00              186.2.32       
                                              00 00 94 04  00 00 04 01              186.2.40       
                                              00 00 00 00  00 00 98 04              186.2.48       
                                              00 00 04 01  00 00 e8 03              186.2.56       
  10.0                                 CTL    c0 b4 00 00  00 00 01 00   36us       187.1.0(2)     
  10.0                              1  IN     74                        121us       187.2.0        
  10.0                                 CTL    c0 e1 00 00  84 03 40 00  137us       189.1.0        
  10.0                             64  IN     00 00 9c 04  00 00 04 01  3.3ms       189.2.0        
                                              00 00 64 00  00 00 04 06              189.2.8        
                                              00 00 04 03  00 00 01 00              189.2.16       
                                              00 00 08 06  00 00 02 03              189.2.24       
                                              00 00 00 00  00 00 02 00              189.2.32       
                                              00 00 00 00  00 00 01 00              189.2.40       
                                              00 00 0c 06  00 00 02 03              189.2.48       
                                              00 00 01 00  00 00 02 00              189.2.56       
  10.0                                 CTL    c0 b4 00 00  00 00 01 00   50us       190.1.0(2)     
  10.0                              1  IN     74                         78us       190.2.0        
  10.0                                 CTL    c0 e1 00 00  c4 03 40 00  147us       192.1.0        
  10.0                             64  IN     00 00 00 00  00 00 01 00  3.3ms       192.2.0        
                                              00 00 00 07  00 00 02 03              192.2.8        
                                              00 00 00 00  00 00 02 00              192.2.16       
                                              00 00 00 00  00 00 01 00              192.2.24       
                                              00 00 04 07  00 00 04 03              192.2.32       
                                              00 00 08 00  00 00 08 07              192.2.40       
                                              00 00 04 03  00 00 08 00              192.2.48       
                                              00 00 0c 07  00 00 04 03              192.2.56       
  10.0                                 CTL    c0 b4 00 00  00 00 01 00   33us       193.1.0(2)     
  10.0                              1  IN     74                        136us       193.2.0        
  10.0                                 CTL    c0 e1 00 00  04 04 40 00  140us       195.1.0        
  10.0                             64  IN     00 00 08 00  00 00 10 07  3.3ms       195.2.0        
                                              00 00 04 03  00 00 08 00              195.2.8        
                                              00 00 14 07  00 00 04 03              195.2.16       
                                              00 00 08 00  00 00 18 07              195.2.24       
                                              00 00 04 01  00 00 00 00              195.2.32       
                                              00 00 1c 07  00 00 04 01              195.2.40       
                                              00 00 00 00  00 00 20 07              195.2.48       
                                              00 00 04 01  00 00 00 00              195.2.56       
  10.0                                 CTL    c0 b4 00 00  00 00 01 00   79us       196.1.0(2)     
  10.0                              1  IN     74                        120us       196.2.0        
  10.0                                 CTL    c0 e1 00 00  44 04 40 00   93us       198.1.0        
  10.0                             64  IN     00 00 24 07  00 00 04 01  3.3ms       198.2.0        
                                              00 00 00 00  00 00 28 07              198.2.8        
                                              00 00 04 01  00 00 00 00              198.2.16       
                                              00 00 2c 07  00 00 04 01              198.2.24       
                                              00 00 3f 00  00 00 30 07              198.2.32       
                                              00 00 04 01  00 00 3f 00              198.2.40       
                                              00 00 34 07  00 00 04 01              198.2.48       
                                              00 00 3f 00  00 00 38 07              198.2.56       
  10.0                                 CTL    c0 b4 00 00  00 00 01 00   42us       199.1.0(2)     
  10.0                              1  IN     74                         73us       199.2.0        
  10.0                                 CTL    c0 e1 00 00  84 04 40 00   97us       201.1.0        
  10.0                             64  IN     00 00 04 01  00 00 3f 00  3.3ms       201.2.0        
                                              00 00 3c 07  00 00 04 01              201.2.8        
                                              00 00 3f 00  00 00 40 07              201.2.16       
                                              00 00 04 01  00 00 01 00              201.2.24       
                                              00 00 44 07  00 00 04 01              201.2.32       
                                              00 00 01 00  00 00 48 07              201.2.40       
                                              00 00 04 01  00 00 01 00              201.2.48       
                                              00 00 4c 07  00 00 04 01              201.2.56       
  10.0                                 CTL    c0 b4 00 00  00 00 01 00   40us       202.1.0(2)     
  10.0                              1  IN     74                        135us       202.2.0        
  10.0                                 CTL    c0 e1 00 00  c4 04 40 00  121us       204.1.0        
  10.0                             64  IN     00 00 01 00  00 00 50 07  3.3ms       204.2.0        
                                              00 00 04 01  00 00 01 00              204.2.8        
                                              00 00 54 07  00 00 02 03              204.2.16       
                                              00 00 01 00  00 00 02 00              204.2.24       
                                              00 00 00 00  00 00 01 00              204.2.32       
                                              00 00 58 07  00 00 04 03              204.2.40       
                                              00 00 00 00  00 00 5c 07              204.2.48       
                                              00 00 04 03  00 00 00 00              204.2.56       
  10.0                                 CTL    c0 b4 00 00  00 00 01 00   71us       205.1.0(2)     
  10.0                              1  IN     74                         72us       205.2.0        
  10.0                                 CTL    c0 e1 00 00  04 05 40 00  104us       207.1.0        
  10.0                             64  IN     00 00 60 07  00 00 04 03  3.3ms       207.2.0        
                                              00 00 00 00  00 00 64 07              207.2.8        
                                              00 00 04 03  00 00 00 00              207.2.16       
                                              00 00 68 07  00 00 04 03              207.2.24       
                                              00 00 00 00  00 00 6c 07              207.2.32       
                                              00 00 04 01  00 00 01 ff              207.2.40       
                                              ff ff 70 07  00 00 04 01              207.2.48       
                                              00 00 01 ff  ff ff 74 07              207.2.56       
  10.0                                 CTL    c0 b4 00 00  00 00 01 00   69us       208.1.0(2)     
  10.0                              1  IN     74                         72us       208.2.0        
  10.0                                 CTL    c0 e1 00 00  44 05 40 00  107us       210.1.0        
  10.0                             64  IN     00 00 04 01  00 00 01 ff  3.3ms       210.2.0        
                                              ff ff 78 07  00 00 04 01              210.2.8        
                                              00 00 01 ff  ff ff 7c 07              210.2.16       
                                              00 00 04 01  00 00 01 ff              210.2.24       
                                              ff ff 80 07  00 00 04 01              210.2.32       
                                              00 00 ff 00  00 00 84 07              210.2.40       
                                              00 00 04 01  00 00 ff 00              210.2.48       
                                              00 00 88 07  00 00 04 01              210.2.56       
  10.0                                 CTL    c0 b4 00 00  00 00 01 00   50us       211.1.0(2)     
  10.0                              1  IN     74                         80us       211.2.0        
  10.0                                 CTL    c0 e1 00 00  84 05 40 00  139us       213.1.0        
  10.0                             64  IN     00 00 ff 00  00 00 8c 07  3.3ms       213.2.0        
                                              00 00 04 01  00 00 ff 00              213.2.8        
                                              00 00 90 07  00 00 04 01              213.2.16       
                                              00 00 ff 00  00 00 94 07              213.2.24       
                                              00 00 04 01  00 00 01 00              213.2.32       
                                              00 00 98 07  00 00 04 01              213.2.40       
                                              00 00 01 00  00 00 9c 07              213.2.48       
                                              00 00 04 01  00 00 01 00              213.2.56       
  10.0                                 CTL    c0 b4 00 00  00 00 01 00   30us       214.1.0(2)     
  10.0                              1  IN     74                        154us       214.2.0        
  10.0                                 CTL    c0 e1 00 00  c4 05 40 00  161us       216.1.0        
  10.0                             64  IN     00 00 a0 07  00 00 04 01  3.3ms       216.2.0        
                                              00 00 01 00  00 00 a4 07              216.2.8        
                                              00 00 04 01  00 00 01 00              216.2.16       
                                              00 00 d4 07  00 00 02 03              216.2.24       
                                              00 00 00 00  00 00 02 00              216.2.32       
                                              00 00 00 00  00 00 01 00              216.2.40       
                                              00 00 00 09  00 00 02 01              216.2.48       
                                              00 00 00 00  00 00 01 00              216.2.56       
  10.0                                 CTL    c0 b4 00 00  00 00 01 00   43us       217.1.0(2)     
  10.0                              1  IN     74                         78us       217.2.0        
  10.0                                 CTL    c0 e1 00 00  04 06 40 00   99us       219.1.0        
  10.0                             64  IN     00 00 00 00  00 00 00 20  3.3ms       219.2.0        
                                              00 00 04 03  00 00 02 00              219.2.8        
                                              00 00 04 20  00 00 04 01              219.2.16       
                                              00 00 00 00  00 00 08 20              219.2.24       
                                              00 00 04 01  00 00 03 00              219.2.32       
                                              00 00 0c 20  00 00 04 01              219.2.40       
                                              00 00 01 00  00 00 10 20              219.2.48       
                                              00 00 04 03  00 00 00 00              219.2.56       
  10.0                                 CTL    c0 b4 00 00  00 00 01 00   72us       220.1.0(2)     
  10.0                              1  IN     74                         70us       220.2.0        
  10.0                                 CTL    c0 e1 00 00  44 06 40 00  165us       222.1.0        
  10.0                             64  IN     00 00 14 20  00 00 04 03  3.3ms       222.2.0        
                                              00 00 00 00  00 00 18 20              222.2.8        
                                              00 00 04 01  00 00 f7 ff              222.2.16       
                                              ff ff 1c 20  00 00 04 01              222.2.24       
                                              00 00 e7 ff  ff ff 20 20              222.2.32       
                                              00 00 04 01  00 00 f6 07              222.2.40       
                                              00 00 24 20  00 00 04 01              222.2.48       
                                              00 00 e6 07  00 00 28 20              222.2.56       
  10.0                                 CTL    c0 b4 00 00  00 00 01 00   38us       223.1.0(2)     
  10.0                              1  IN     74                        132us       223.2.0        
  10.0                                 CTL    c0 e1 00 00  84 06 40 00  164us       225.1.0        
  10.0                             64  IN     00 00 04 01  00 00 01 00  3.3ms       225.2.0        
                                              00 00 2c 20  00 00 04 01              225.2.8        
                                              00 00 01 00  00 00 68 20              225.2.16       
                                              00 00 04 01  00 00 00 04              225.2.24       
                                              00 00 80 20  00 00 04 03              225.2.32       
                                              00 00 78 00  00 00 84 20              225.2.40       
                                              00 00 04 01  00 00 14 00              225.2.48       
                                              00 00 88 20  00 00 04 01              225.2.56       
  10.0                                 CTL    c0 b4 00 00  00 00 01 00   79us       226.1.0(2)     
  10.0                              1  IN     74                         76us       226.2.0        
  10.0                                 CTL    c0 e1 00 00  c4 06 40 00  168us       228.1.0        
  10.0                             64  IN     00 00 ff 00  00 00 8c 20  3.3ms       228.2.0        
                                              00 00 04 01  00 00 01 00              228.2.8        
                                              00 00 90 20  00 00 02 03              228.2.16       
                                              00 00 00 00  00 00 03 00              228.2.24       
                                              00 00 00 00  00 00 01 00              228.2.32       
                                              00 00 02 00  00 00 00 21              228.2.40       
                                              00 00 04 03  00 00 00 00              228.2.48       
                                              00 00 04 21  00 00 04 03              228.2.56       
  10.0                                 CTL    c0 b4 00 00  00 00 01 00   23us       229.1.0(2)     
  10.0                              1  IN     74                         71us       229.2.0        
  10.0                                 CTL    c0 e1 00 00  04 07 40 00  121us       231.1.0        
  10.0                             64  IN     00 00 00 00  00 00 08 21  3.3ms       231.2.0        
                                              00 00 04 03  00 00 00 05              231.2.8        
                                              00 00 0c 21  00 00 04 03              231.2.16       
                                              00 00 00 04  00 00 10 21              231.2.24       
                                              00 00 04 03  00 00 08 00              231.2.32       
                                              00 00 14 21  00 00 04 03              231.2.40       
                                              00 00 3f 00  00 00 18 21              231.2.48       
                                              00 00 04 03  00 00 20 01              231.2.56       
  10.0                                 CTL    c0 b4 00 00  00 00 01 00   45us       232.1.0(2)     
  10.0                              1  IN     74                        132us       232.2.0        
  10.0                                 CTL    c0 e1 00 00  44 07 40 00  167us       234.1.0        
  10.0                             64  IN     00 00 1c 21  00 00 04 03  3.3ms       234.2.0        
                                              00 00 40 42  0f 00 00 22              234.2.8        
                                              00 00 04 03  00 00 01 00              234.2.16       
                                              00 00 00 50  00 00 01 11              234.2.24       
                                              00 00 08 44  61 68 65 6e              234.2.32       
                                              67 2e 00 50  50 00 00 04              234.2.40       
                                              01 00 00 80  00 00 00 54              234.2.48       
                                              50 00 00 04  01 00 00 00              234.2.56       
  10.0                                 CTL    c0 b4 00 00  00 00 01 00   45us       235.1.0(2)     
  10.0                              1  IN     74                        103us       235.2.0        
  10.0                                 CTL    c0 e1 00 00  84 07 40 00  105us       237.1.0        
  10.0                             64  IN     00 00 00 58  50 00 00 02  3.3ms       237.2.0        
                                              13 00 00 00  00 00 00 04              237.2.8        
                                              00 00 00 00  00 00 00 01              237.2.16       
                                              00 00 00 02  00 00 00 03              237.2.24       
                                              00 00 00 60  50 00 00 01              237.2.32       
                                              01 00 00 24  00 00 00 00              237.2.40       
                                              00 05 00 00  00 04 00 00              237.2.48       
                                              01 01 00 00  80 02 00 00              237.2.56       
  10.0                                 CTL    c0 b4 00 00  00 00 01 00   34us       238.1.0(2)     
  10.0                              1  IN     74                         77us       238.2.0        
  10.0                                 CTL    c0 e1 00 00  c4 07 40 00   99us       240.1.0        
  10.0                             64  IN     00 02 00 00  02 02 00 00  3.3ms       240.2.0        
                                              40 01 00 00  00 01 00 00              240.2.8        
                                              64 50 00 00  01 01 00 00              240.2.16       
                                              08 02 00 00  00 02 01 00              240.2.24       
                                              00 68 50 00  00 04 01 00              240.2.32       
                                              00 05 00 0c  00 00 00 01              240.2.40       
                                              00 04 01 00  00 01 00 00              240.2.48       
                                              00 04 00 01  00 04 01 00              240.2.56       
  10.0                                 CTL    c0 b4 00 00  00 00 01 00   35us       241.1.0(2)     
  10.0                              1  IN     74                         73us       241.2.0        
  10.0                                 CTL    c0 e1 00 00  04 08 40 00  154us       243.1.0        
  10.0                             64  IN     00 01 00 00  00 08 00 01  3.3ms       243.2.0        
                                              00 04 01 00  00 01 00 00              243.2.8        
                                              00 0c 00 01  00 04 01 00              243.2.16       
                                              00 01 00 00  00 10 00 01              243.2.24       
                                              00 04 01 00  00 00 00 00              243.2.32       
                                              00 14 00 01  00 04 01 00              243.2.40       
                                              00 00 00 00  00 18 00 01              243.2.48       
                                              00 04 01 00  00 01 00 00              243.2.56       
  10.0                                 CTL    c0 b4 00 00  00 00 01 00   48us       244.1.0(2)     
  10.0                              1  IN     74                        128us       244.2.0        
  10.0                                 CTL    c0 e1 00 00  44 08 40 00  115us       246.1.0        
  10.0                             64  IN     00 1c 00 01  00 04 01 00  3.3ms       246.2.0        
                                              00 01 00 00  00 2c 00 01              246.2.8        
                                              00 04 01 00  00 15 00 00              246.2.16       
                                              00 30 00 01  00 04 01 00              246.2.24       
                                              00 01 00 00  00 34 00 01              246.2.32       
                                              00 04 01 00  00 00 00 00              246.2.40       
                                              00 38 00 01  00 04 01 00              246.2.48       
                                              00 00 00 00  00 40 00 01              246.2.56       
  10.0                                 CTL    c0 b4 00 00  00 00 01 00   36us       247.1.0(2)     
  10.0                              1  IN     74                        126us       247.2.0        
  10.0                                 CTL    c0 e1 00 00  84 08 40 00  112us       249.1.0        
  10.0                             64  IN     00 04 01 00  00 0f 00 00  3.3ms       249.2.0        
                                              00 44 00 01  00 04 01 00              249.2.8        
                                              00 07 00 00  00 48 00 01              249.2.16       
                                              00 04 01 00  00 00 00 00              249.2.24       
                                              00 4c 00 01  00 04 01 00              249.2.32       
                                              00 07 00 00  00 54 00 01              249.2.40       
                                              00 04 01 00  00 07 00 00              249.2.48       
                                              00 58 00 01  00 04 01 00              249.2.56       
  10.0                                 CTL    c0 b4 00 00  00 00 01 00   33us       250.1.0(2)     
  10.0                              1  IN     74                        130us       250.2.0        
  10.0                                 CTL    c0 e1 00 00  c4 08 40 00  111us       252.1.0        
  10.0                             64  IN     00 00 00 00  00 5c 00 01  3.3ms       252.2.0        
                                              00 04 01 00  00 01 00 00              252.2.8        
                                              00 60 00 01  00 04 01 00              252.2.16       
                                              00 01 00 00  00 64 00 01              252.2.24       
                                              00 04 01 00  00 01 00 00              252.2.32       
                                              00 68 00 01  00 04 01 00              252.2.40       
                                              00 01 00 00  00 6c 00 01              252.2.48       
                                              00 04 01 00  00 07 00 00              252.2.56       
  10.0                                 CTL    c0 b4 00 00  00 00 01 00   29us       253.1.0(2)     
  10.0                              1  IN     74                        136us       253.2.0        
  10.0                                 CTL    c0 e1 00 00  04 09 40 00  109us       255.1.0        
  10.0                             64  IN     00 70 00 01  00 04 01 00  3.3ms       255.2.0        
                                              00 00 00 00  00 78 00 01              255.2.8        
                                              00 04 01 00  00 01 00 00              255.2.16       
                                              00 7c 00 01  00 04 01 00              255.2.24       
                                              00 07 00 00  00 80 00 01              255.2.32       
                                              00 04 01 00  00 07 00 00              255.2.40       
                                              00 84 00 01  00 04 01 00              255.2.48       
                                              00 07 00 00  00 88 00 01              255.2.56       
  10.0                                 CTL    c0 b4 00 00  00 00 01 00   62us       256.1.0(2)     
  10.0                              1  IN     74                         73us       256.2.0        
  10.0                                 CTL    c0 e1 00 00  44 09 40 00  108us       258.1.0        
  10.0                             64  IN     00 04 01 00  00 01 00 00  3.3ms       258.2.0        
                                              00 8c 00 01  00 04 01 00              258.2.8        
                                              00 01 00 00  00 90 00 01              258.2.16       
                                              00 04 01 00  00 01 00 00              258.2.24       
                                              00 94 00 01  00 04 01 00              258.2.32       
                                              00 01 00 00  00 98 00 01              258.2.40       
                                              00 04 01 00  00 01 00 00              258.2.48       
                                              00 9c 00 01  00 04 01 00              258.2.56       
  10.0                                 CTL    c0 b4 00 00  00 00 01 00   41us       259.1.0(2)     
  10.0                              1  IN     74                         75us       259.2.0        
  10.0                                 CTL    c0 e1 00 00  84 09 40 00  112us       261.1.0        
  10.0                             64  IN     00 07 00 00  00 00 01 01  3.3ms       261.2.0        
                                              00 04 01 00  00 01 00 00              261.2.8        
                                              00 04 01 01  00 04 01 00              261.2.16       
                                              00 01 00 00  00 08 01 01              261.2.24       
                                              00 04 01 00  00 01 00 00              261.2.32       
                                              00 0c 01 01  00 04 01 00              261.2.40       
                                              00 01 00 00  00 10 01 01              261.2.48       
                                              00 04 01 00  00 01 00 00              261.2.56       
  10.0                                 CTL    c0 b4 00 00  00 00 01 00   28us       262.1.0(2)     
  10.0                              1  IN     74                         73us       262.2.0        
  10.0                                 CTL    c0 e1 00 00  c4 09 40 00  123us       264.1.0        
  10.0                             64  IN     00 24 01 01  00 04 01 00  3.3ms       264.2.0        
                                              00 01 00 00  00 28 01 01              264.2.8        
                                              00 04 01 00  00 01 00 00              264.2.16       
                                              00 2c 01 01  00 04 01 00              264.2.24       
                                              00 01 00 00  00 34 01 01              264.2.32       
                                              00 04 01 00  00 01 00 00              264.2.40       
                                              00 38 01 01  00 04 01 00              264.2.48       
                                              00 01 00 00  00 3c 01 01              264.2.56       
  10.0                                 CTL    c0 b4 00 00  00 00 01 00   27us       265.1.0(2)     
  10.0                              1  IN     74                        103us       265.2.0        
  10.0                                 CTL    c0 e1 00 00  04 0a 40 00  117us       267.1.0        
  10.0                             64  IN     00 04 01 00  00 07 00 00  3.3ms       267.2.0        
                                              00 40 01 01  00 04 01 00              267.2.8        
                                              00 01 00 00  00 44 01 01              267.2.16       
                                              00 04 01 00  00 0f 00 00              267.2.24       
                                              00 48 01 01  00 04 01 00              267.2.32       
                                              00 01 00 00  00 4c 01 01              267.2.40       
                                              00 04 01 00  00 01 00 00              267.2.48       
                                              00 50 01 01  00 04 01 00              267.2.56       
  10.0                                 CTL    c0 b4 00 00  00 00 01 00   34us       268.1.0(2)     
  10.0                              1  IN     74                         73us       268.2.0        
  10.0                                 CTL    c0 e1 00 00  44 0a 40 00   83us       270.1.0        
  10.0                             64  IN     00 01 00 00  00 54 01 01  3.3ms       270.2.0        
                                              00 04 01 00  00 01 00 00              270.2.8        
                                              00 58 01 01  00 04 01 00              270.2.16       
                                              00 01 00 00  00 5c 01 01              270.2.24       
                                              00 04 01 00  00 01 00 00              270.2.32       
                                              00 60 01 01  00 04 01 00              270.2.40       
                                              00 1f 00 00  00 64 01 01              270.2.48       
                                              00 04 01 00  00 01 00 00              270.2.56       
  10.0                                 CTL    c0 b4 00 00  00 00 01 00   32us       271.1.0(2)     
  10.0                              1  IN     74                        149us       271.2.0        
  10.0                                 CTL    c0 e1 00 00  84 0a 40 00  137us       273.1.0        
  10.0                             64  IN     00 68 01 01  00 04 01 00  3.3ms       273.2.0        
                                              00 01 00 00  00 6c 01 01              273.2.8        
                                              00 04 01 00  00 01 00 00              273.2.16       
                                              00 70 01 01  00 04 01 00              273.2.24       
                                              00 01 00 00  00 74 01 01              273.2.32       
                                              00 04 01 00  00 01 00 00              273.2.40       
                                              00 78 01 01  00 04 01 00              273.2.48       
                                              00 01 00 00  00 7c 01 01              273.2.56       
  10.0                                 CTL    c0 b4 00 00  00 00 01 00   60us       274.1.0(2)     
  10.0                              1  IN     74                         80us       274.2.0        
  10.0                                 CTL    c0 e1 00 00  c4 0a 40 00  122us       276.1.0        
  10.0                             64  IN     00 04 01 00  00 07 00 00  3.3ms       276.2.0        
                                              00 80 01 01  00 04 01 00              276.2.8        
                                              00 03 00 00  00 84 01 01              276.2.16       
                                              00 04 01 00  00 01 00 00              276.2.24       
                                              00 88 01 01  00 04 01 00              276.2.32       
                                              00 00 00 00  00 8c 01 01              276.2.40       
                                              00 04 01 00  00 01 00 00              276.2.48       
                                              00 94 01 01  00 04 01 00              276.2.56       
  10.0                                 CTL    c0 b4 00 00  00 00 01 00   22us       277.1.0(2)     
  10.0                              1  IN     74                         74us       277.2.0        
  10.0                                 CTL    c0 e1 00 00  04 0b 05 00  110us       279.1.0        
  10.0                              5  IN     00 01 00 00  00           949us       279.2.0        
  10.0                                 CTL    c0 b4 00 00  00 00 01 00   35us       280.1.0(2)     
  10.0                              1  IN     74                         66us       280.2.0        
  10.0                                 CTL    40 ce 00 00  10 02 04 00  371us       282.1.0        
  10.0                              4  OUT    00 00 00 00               525us       282.2.0        
  10.0                                 CTL    c0 b4 00 00  00 00 01 00   31us       283.1.0(2)     
  10.0                              1  IN     74                         73us       283.2.0        
  10.0                                 CTL    40 ce 00 00  14 02 04 00   94us       285.1.0        
  10.0                              4  OUT    00 00 00 00               552us       285.2.0        
  10.0                                 CTL    c0 b4 00 00  00 00 01 00   33us       286.1.0(2)     
  10.0                              1  IN     74                         66us       286.2.0        
  10.0                                 CTL    40 ce 00 00  18 02 04 00  117us       288.1.0        
  10.0                              4  OUT    00 05 00 00               1.0ms       288.2.0        
  10.0                                 CTL    c0 b4 00 00  00 00 01 00   68us       289.1.0(2)     
  10.0                              1  IN     74                         70us       289.2.0        
  10.0                                 CTL    40 ce 00 00  1c 02 04 00  115us       291.1.0        
  10.0                              4  OUT    00 04 00 00               536us       291.2.0        
  10.0                                 CTL    c0 b4 00 00  00 00 01 00   63us       292.1.0(2)     
  10.0                              1  IN     74                         66us       292.2.0        
  10.0                                 CTL    40 ce 00 00  70 02 04 00   94us       294.1.0        
  10.0                              4  OUT    00 00 00 00               907us       294.2.0        
  10.0                                 CTL    c0 b4 00 00  00 00 01 00   15us       295.1.0(2)     
  10.0                              1  IN     74                        201us       295.2.0        
  10.0                                 CTL    40 ce 00 00  10 02 04 00  108us       297.1.0        
  10.0                              4  OUT    00 00 00 00               515us       297.2.0        
  10.0                                 CTL    c0 b4 00 00  00 00 01 00   64us       298.1.0(2)     
  10.0                              1  IN     74                        113us       298.2.0        
  10.0                                 CTL    40 ce 00 00  14 02 04 00   97us       300.1.0        
  10.0                              4  OUT    00 00 00 00               517us       300.2.0        
  10.0                                 CTL    c0 b4 00 00  00 00 01 00   71us       301.1.0(2)     
  10.0                              1  IN     74                        115us       301.2.0        
  10.0                                 CTL    40 ce 00 00  18 02 04 00  103us       303.1.0        
  10.0                              4  OUT    00 05 00 00               1.0ms       303.2.0        
  10.0                                 CTL    c0 b4 00 00  00 00 01 00   41us       304.1.0(2)     
  10.0                              1  IN     74                         85us       304.2.0        
  10.0                                 CTL    40 ce 00 00  1c 02 04 00  144us       306.1.0        
  10.0                              4  OUT    00 04 00 00               531us       306.2.0        
  10.0                                 CTL    c0 b4 00 00  00 00 01 00   66us       307.1.0(2)     
  10.0                              1  IN     74                         71us       307.2.0        
  10.0                                 CTL    40 ce 00 00  74 02 04 00  181us       309.1.0        
  10.0                              4  OUT    00 00 00 00               920us       309.2.0        
  10.0                                 CTL    c0 b4 00 00  00 00 01 00   70us       310.1.0(2)     
  10.0                              1  IN     74                         98us       310.2.0        
  10.0                                 CTL    40 ce 00 00  10 02 04 00  191us       312.1.0        
  10.0                              4  OUT    00 00 00 00               501us       312.2.0        
  10.0                                 CTL    c0 b4 00 00  00 00 01 00   27us       313.1.0(2)     
  10.0                              1  IN     74                         73us       313.2.0        
  10.0                                 CTL    40 ce 00 00  14 02 04 00  104us       315.1.0        
  10.0                              4  OUT    00 00 00 00               514us       315.2.0        
  10.0                                 CTL    c0 b4 00 00  00 00 01 00   67us       316.1.0(2)     
  10.0                              1  IN     74                         70us       316.2.0        
  10.0                                 CTL    40 ce 00 00  18 02 04 00  102us       318.1.0        
  10.0                              4  OUT    00 05 00 00               1.0ms       318.2.0        
  10.0                                 CTL    c0 b4 00 00  00 00 01 00   67us       319.1.0(2)     
  10.0                              1  IN     74                         69us       319.2.0        
  10.0                                 CTL    40 ce 00 00  1c 02 04 00  113us       321.1.0        
  10.0                              4  OUT    00 04 00 00               534us       321.2.0        
  10.0                                 CTL    c0 b4 00 00  00 00 01 00   27us       322.1.0(2)     
  10.0                              1  IN     74                         76us       322.2.0        
  10.0                                 CTL    40 ce 00 00  9c 02 04 00  118us       324.1.0        
  10.0                              4  OUT    01 00 08 01               860us       324.2.0        
  10.0                                 CTL    c0 b4 00 00  00 00 01 00   64us       325.1.0(2)     
  10.0                              1  IN     74                         70us       325.2.0        
  10.0                                 CTL    40 ce 00 00  10 04 04 00  103us       327.1.0        
  10.0                              4  OUT    02 00 00 00               212us       327.2.0        
  10.0                                 CTL    c0 b4 00 00  00 00 01 00   17us       328.1.0(2)     
  10.0                              1  IN     74                         65us       328.2.0        
  10.0                                 CTL    40 ce 00 00  20 04 04 00  104us       330.1.0        
  10.0                              4  OUT    0c 00 00 00               872us       330.2.0        
  10.0                                 CTL    c0 b4 00 00  00 00 01 00   66us       331.1.0(2)     
  10.0                              1  IN     74                         69us       331.2.0        
  10.0                                 CTL    40 ce 00 00  30 04 04 00  102us       333.1.0        
  10.0                              4  OUT    00 00 00 00               703us       333.2.0        
  10.0                                 CTL    c0 b4 00 00  00 00 01 00   63us       334.1.0(2)     
  10.0                              1  IN     74                        111us       334.2.0        
  10.0                                 CTL    40 ce 00 00  3c 04 04 00  100us       336.1.0        
  10.0                              4  OUT    01 00 00 00               318us       336.2.0        
  10.0                                 CTL    c0 b4 00 00  00 00 01 00   59us       337.1.0(2)     
  10.0                              1  IN     74                         69us       337.2.0        
  10.0                                 CTL    40 ce 00 00  50 04 04 00  100us       339.1.0        
  10.0                              4  OUT    01 00 00 00               357us       339.2.0        
  10.0                                 CTL    c0 b4 00 00  00 00 01 00   65us       340.1.0(2)     
  10.0                              1  IN     74                         68us       340.2.0        
  10.0                                 CTL    40 ce 00 00  58 04 04 00  142us       342.1.0        
  10.0                              4  OUT    30 75 00 00               708us       342.2.0        
  10.0                                 CTL    c0 b4 00 00  00 00 01 00   84us       343.1.0(2)     
  10.0                              1  IN     74                         71us       343.2.0        
  10.0                                 CTL    40 ce 00 00  80 04 04 00  109us       345.1.0        
  10.0                              4  OUT    00 00 00 00               339us       345.2.0        
  10.0                                 CTL    c0 b4 00 00  00 00 01 00   69us       346.1.0(2)     
  10.0                              1  IN     74                         70us       346.2.0        
  10.0                                 CTL    40 ce 00 00  90 04 04 00  101us       348.1.0        
  10.0                              4  OUT    00 00 00 00               375us       348.2.0        
  10.0                                 CTL    c0 b4 00 00  00 00 01 00   79us       349.1.0(2)     
  10.0                              1  IN     74                         84us       349.2.0        
  10.0                                 CTL    40 ce 00 00  04 06 04 00  128us       351.1.0        
  10.0                              4  OUT    01 00 00 00               338us       351.2.0        
  10.0                                 CTL    c0 b4 00 00  00 00 01 00   18us       352.1.0(2)     
  10.0                              1  IN     74                         65us       352.2.0        
  10.0                                 CTL    40 ce 00 00  08 06 04 00  106us       354.1.0        
  10.0                              4  OUT    00 00 00 00               350us       354.2.0        
  10.0                                 CTL    c0 b4 00 00  00 00 01 00   62us       355.1.0(2)     
  10.0                              1  IN     74                         70us       355.2.0        
  10.0                                 CTL    40 ce 00 00  0c 06 04 00  133us       357.1.0        
  10.0                              4  OUT    01 00 00 00               339us       357.2.0        
  10.0                                 CTL    c0 b4 00 00  00 00 01 00   62us       358.1.0(2)     
  10.0                              1  IN     74                         69us       358.2.0        
  10.0                                 CTL    40 ce 00 00  04 07 04 00  102us       360.1.0        
  10.0                              4  OUT    08 00 00 00               559us       360.2.0        
  10.0                                 CTL    c0 b4 00 00  00 00 01 00   20us       361.1.0(2)     
  10.0                              1  IN     74                         65us       361.2.0        
  10.0                                 CTL    40 ce 00 00  08 07 04 00  103us       363.1.0        
  10.0                              4  OUT    08 00 00 00               592us       363.2.0        
  10.0                                 CTL    c0 b4 00 00  00 00 01 00   70us       364.1.0(2)     
  10.0                              1  IN     74                         71us       364.2.0        
  10.0                                 CTL    40 ce 00 00  0c 07 04 00  135us       366.1.0        
  10.0                              4  OUT    08 00 00 00               663us       366.2.0        
  10.0                                 CTL    c0 b4 00 00  00 00 01 00   33us       367.1.0(2)     
  10.0                              1  IN     74                         76us       367.2.0        
  10.0                                 CTL    40 ce 00 00  10 07 04 00  150us       369.1.0        
  10.0                              4  OUT    08 00 00 00               548us       369.2.0        
  10.0                                 CTL    c0 b4 00 00  00 00 01 00   28us       370.1.0(2)     
  10.0                              1  IN     74                        128us       370.2.0        
  10.0                                 CTL    40 ce 00 00  14 07 04 00  102us       372.1.0        
  10.0                              4  OUT    08 00 00 00               550us       372.2.0        
  10.0                                 CTL    c0 b4 00 00  00 00 01 00   33us       373.1.0(2)     
  10.0                              1  IN     74                         76us       373.2.0        
  10.0                                 CTL    40 ce 00 00  54 07 04 00  111us       375.1.0        
  10.0                              4  OUT    01 00 00 00               582us       375.2.0        
  10.0                                 CTL    c0 b4 00 00  00 00 01 00   75us       376.1.0(2)     
  10.0                              1  IN     74                         98us       376.2.0        
  10.0                                 CTL    40 ce 00 00  58 07 04 00  103us       378.1.0        
  10.0                              4  OUT    00 00 00 00               1.7ms       378.2.0        
  10.0                                 CTL    c0 b4 00 00  00 00 01 00   88us       379.1.0(2)     
  10.0                              1  IN     74                         78us       379.2.0        
  10.0                                 CTL    40 ce 00 00  5c 07 04 00  138us       381.1.0        
  10.0                              4  OUT    00 00 00 00               583us       381.2.0        
  10.0                                 CTL    c0 b4 00 00  00 00 01 00   70us       382.1.0(2)     
  10.0                              1  IN     74                        115us       382.2.0        
  10.0                                 CTL    40 ce 00 00  60 07 04 00  102us       384.1.0        
  10.0                              4  OUT    00 00 00 00               567us       384.2.0        
  10.0                                 CTL    c0 b4 00 00  00 00 01 00   25us       385.1.0(2)     
  10.0                              1  IN     74                        129us       385.2.0        
  10.0                                 CTL    40 ce 00 00  64 07 04 00   97us       387.1.0        
  10.0                              4  OUT    00 00 00 00               580us       387.2.0        
  10.0                                 CTL    c0 b4 00 00  00 00 01 00   66us       388.1.0(2)     
  10.0                              1  IN     74                         69us       388.2.0        
  10.0                                 CTL    40 ce 00 00  68 07 04 00  128us       390.1.0        
  10.0                              4  OUT    00 00 00 00               613us       390.2.0        
  10.0                                 CTL    c0 b4 00 00  00 00 01 00   28us       391.1.0(2)     
  10.0                              1  IN     74                         69us       391.2.0        
  10.0                                 CTL    40 ce 00 00  00 20 04 00  144us       393.1.0        
  10.0                              4  OUT    02 00 00 00               355us       393.2.0        
  10.0                                 CTL    c0 b4 00 00  00 00 01 00   95us       394.1.0(2)     
  10.0                              1  IN     74                         69us       394.2.0        
  10.0                                 CTL    40 ce 00 00  10 20 04 00  121us       396.1.0        
  10.0                              4  OUT    00 00 00 00               1.0ms       396.2.0        
  10.0                                 CTL    c0 b4 00 00  00 00 01 00   17us       397.1.0(2)     
  10.0                              1  IN     74                         63us       397.2.0        
  10.0                                 CTL    40 ce 00 00  14 20 04 00   98us       399.1.0        
  10.0                              4  OUT    00 00 00 00               601us       399.2.0        
  10.0                                 CTL    c0 b4 00 00  00 00 01 00   90us       400.1.0(3)     
  10.0                              1  IN     74                         68us       400.2.0        
  10.0                                 CTL    c0 cd 04 00  00 00 04 00  199us       403.1.0        
  10.0                              4  IN     02 00 88 00               128us       403.2.0        
  10.0                                 CTL    c0 b4 00 00  00 00 01 00   16us       404.1.0(2)     
  10.0                              1  IN     74                         62us       404.2.0        
  10.0                                 CTL    40 ce 00 00  30 04 04 00   27ms       406.1.0        
  10.0                              4  OUT    00 00 00 00               739us       406.2.0        
  10.0                                 CTL    c0 b4 00 00  00 00 01 00   49us       407.1.0(2)     
  10.0                              1  IN     74                         78us       407.2.0        
  10.0                                 CTL    80 06 02 03  00 00 20 00  4.2ms       409.1.0        
  10.0                             26  IN     1a 03 52 00  48 00 30 00   83us       409.2.0        
                                              37 00 36 00  31 00 30 00              409.2.8        
                                              30 00 39 00  30 00 31 00              409.2.16       
                                              34 00                                 409.2.24       
  10.0                                 CTL    c0 c7 00 00  1a 00 02 00   47us       410.1.0        
  10.0                              2  IN     01 ff                     378us       410.2.0        
  10.0                                 CTL    c0 b4 00 00  00 00 01 00   35us       411.1.0(2)     
  10.0                              1  IN     74                        139us       411.2.0        
  10.0                                 CTL    c0 ca 00 00  00 00 04 00  102us       413.1.0        
  10.0                              4  IN     00 00 00 1a               454us       413.2.0        
  10.0                                 CTL    c0 b4 00 00  00 00 01 00   29us       414.1.0(2)     
  10.0                              1  IN     74                         71us       414.2.0        
  10.0                                 CTL    40 bc 01 00  00 00 01 00  2.4ms       416.1.0        
  10.0                              1  OUT    01                        442us       416.2.0        
  15                                   CMD    00 00 00 00  00 00         61ms       417.1.0        
   8.1                             31  OUT    55 53 42 43  50 f0 fd 30   88us       418.1.0        
                                              00 00 00 00  00 00 06 00              418.1.8        
                                              00 00 00 00  00 00 00 00              418.1.16       
                                              00 00 00 00  00 00 00                 418.1.24       
   8.2                             13  IN     55 53 42 53  50 f0 fd 30   52us       419.1.0        
                                              00 00 00 00  00                       419.1.8        
  15                                   ok                                 5us       417.2.0        
  10.0                                 CTL    40 bc 00 00  00 00 01 00  5.9sc       435.1.0        
  10.0                              1  OUT    00                        480us       435.2.0        
  10.0                                 CTL    c0 b4 00 00  00 00 01 00   37us       436.1.0        
  10.0                              1  IN     74                         77us       436.2.0        
  10.2                                 RESET                            1.3ms       437.1.0        
   6.0                                 CTL    02 01 00 00  82 00 00 00   10us       438.1.0        
  10.2                                 RESET                              5us       439.1.0        
   6                                   CMD    00 00 00 00  00 00 00 00   48us       440.1.0        
                                              01 00 00 00  00 00 00 00              440.1.8        
                                              00 00 00 00  00 00 00 00              440.1.16       
                                              70 c8 13 2d  0a 95 ff ff              440.1.24       
                                              00 00 00 00  00 00 00 00              440.1.32       
                                              00 00 00 00  00 00 00 00              440.1.40       
                                              00 00 00 00  00 00 00 00              440.1.48       
                                              00 00 00 00  00 00 00 00              440.1.56       
                                              00 00 00 00  00 00 00 00              440.1.64       
                                              00 00 13 02  62 66 75 53              440.1.72       
                                              00 00 00 00  00 00 00 00              440.1.80       
                                              14 01 00 00  e4 3b 5f 30              440.1.88       
                                              0a 95 ff ff  00 00 00 00              440.1.96       
                                              00 00 00 00  00 00 00 00              440.1.104      
                                              00 00 00 00  00 00 00 00              440.1.112      
                                              00 00 00 00  00 00 00 00              440.1.120      
                                              00 00 00 00  00 00 00 00              440.1.128      
                                              00 00 00 00  00 00 00 00              440.1.136      
                                              00 00 00 00  00 00                    440.1.144      
   6                                   SSTS   00                        365us       440.2.0        
   6.0                                 CTL    02 01 00 00  82 00 00 00   22us       441.1.0        
   6                                   CMD    00 00 00 00  00 00 00 00   67us       442.1.0        
                                              01 00 00 00  00 00 00 00              442.1.8        
                                              00 00 00 00  00 00 00 00              442.1.16       
                                              70 c8 13 2d  0a 95 ff ff              442.1.24       
                                              00 00 00 00  00 00 00 00              442.1.32       
                                              00 00 00 00  00 00 00 00              442.1.40       
                                              00 00 00 00  00 00 00 00              442.1.48       
                                              00 00 00 00  00 00 00 00              442.1.56       
                                              00 00 00 00  00 00 00 00              442.1.64       
                                              00 00 13 02  62 66 75 53              442.1.72       
                                              00 00 00 00  00 00 00 00              442.1.80       
                                              14 01 00 00  e4 3b 5f 30              442.1.88       
                                              0a 95 ff ff  00 00 00 00              442.1.96       
                                              00 00 00 00  00 00 00 00              442.1.104      
                                              00 00 00 00  00 00 00 00              442.1.112      
                                              00 00 00 00  00 00 00 00              442.1.120      
                                              00 00 00 00  00 00 00 00              442.1.128      
                                              00 00 00 00  00 00 00 00              442.1.136      
                                              00 00 00 00  00 00                    442.1.144      
   6                                   SSTS   00                        333us       442.2.0        
  10.0                                 CTL    40 ce 00 00  30 04 04 00   46ms       443.1.0        
  10.0                              4  OUT    01 00 00 00               734us       443.2.0        
  10.0                                 CTL    c0 b4 00 00  00 00 01 00   46us       444.1.0(2)     
  10.0                              1  IN     74                         77us       444.2.0        
  10.0                                 CTL    80 06 02 03  00 00 20 00  2.1ms       446.1.0        
  10.0                             26  IN     1a 03 52 00  48 00 30 00   81us       446.2.0        
                                              37 00 36 00  31 00 30 00              446.2.8        
                                              30 00 39 00  30 00 31 00              446.2.16       
                                              34 00                                 446.2.24       
  10.0                                 CTL    c0 c7 00 00  1a 00 02 00   41us       447.1.0        
  10.0                              2  IN     01 ff                     379us       447.2.0        
  10.0                                 CTL    c0 b4 00 00  00 00 01 00   33us       448.1.0(2)     
  10.0                              1  IN     74                         74us       448.2.0        
  10.0                                 CTL    40 bc 01 00  00 00 01 00  2.1ms       450.1.0        
  10.0                              1  OUT    01                        448us       450.2.0        
  10.0                                 CTL    40 ce 00 00  34 04 04 00  389us       451.1.0        
  10.0                              4  OUT    01 00 00 00               913us       451.2.0        
  10.0                                 CTL    c0 b4 00 00  00 00 01 00   63us       452.1.0(2)     
  10.0                              1  IN     54                        139us       452.2.0        
  15                                   CMD    00 00 00 00  00 00        4.7ms       454.1.0        
   8.1                             31  OUT    55 53 42 43  50 f0 fd 30   86us       455.1.0        
                                              00 00 00 00  00 00 06 00              455.1.8        
                                              00 00 00 00  00 00 00 00              455.1.16       
                                              00 00 00 00  00 00 00                 455.1.24       
   8.2                             13  IN     55 53 42 53  50 f0 fd 30   33us       456.1.0        
                                              00 00 00 00  00                       456.1.8        
  15                                   ok                                 5us       454.2.0        
  10.0                                 CTL    40 ce 00 00  34 04 04 00  1.1sc       460.1.0        
  10.0                              4  OUT    01 00 00 00               1.6ms       460.2.0        
  10.0                                 CTL    c0 b4 00 00  00 00 01 00  121us       461.1.0(2)     
  10.0                              1  IN     54                         80us       461.2.0        
  15                                   CMD    00 00 00 00  00 00        802ms       463.1.0        
   8.1                             31  OUT    55 53 42 43  50 f0 fd 30   56us       464.1.0        
                                              00 00 00 00  00 00 06 00              464.1.8        
                                              00 00 00 00  00 00 00 00              464.1.16       
                                              00 00 00 00  00 00 00                 464.1.24       
   8.2                             13  IN     55 53 42 53  50 f0 fd 30  153us       465.1.0        
                                              00 00 00 00  00                       465.1.8        
  15                                   ok                                 8us       463.2.0        
  10.0                                 CTL    40 ce 00 00  34 04 04 00  398ms       466.1.0        
  10.0                              4  OUT    01 00 00 00               1.0ms       466.2.0        
  10.0                                 CTL    c0 b4 00 00  00 00 01 00   90us       467.1.0(2)     
  10.0                              1  IN     54                         77us       467.2.0        
  15                                   CMD    00 00 00 00  00 00        600ms       469.1.0        
   8.1                             31  OUT    55 53 42 43  50 f0 fd 30   52us       470.1.0        
                                              00 00 00 00  00 00 06 00              470.1.8        
                                              00 00 00 00  00 00 00 00              470.1.16       
                                              00 00 00 00  00 00 00                 470.1.24       
   8.2                             13  IN     55 53 42 53  50 f0 fd 30   77us       471.1.0        
                                              00 00 00 00  00                       471.1.8        
  15                                   ok                                 6us       469.2.0        
  10.0                                 CTL    40 ce 00 00  34 04 04 00  599ms       472.1.0        
  10.0                              4  OUT    01 00 00 00               952us       472.2.0        
  10.0                                 CTL    c0 b4 00 00  00 00 01 00   90us       473.1.0(2)     
  10.0                              1  IN     54                         68us       473.2.0        
  15                                   CMD    00 00 00 00  00 00        400ms       475.1.0        
   8.1                             31  OUT    55 53 42 43  50 f0 fd 30  101us       476.1.0        
                                              00 00 00 00  00 00 06 00              476.1.8        
                                              00 00 00 00  00 00 00 00              476.1.16       
                                              00 00 00 00  00 00 00                 476.1.24       
   8.2                             13  IN     55 53 42 53  50 f0 fd 30   48us       477.1.0        
                                              00 00 00 00  00                       477.1.8        
  15                                   ok                                 6us       475.2.0        
  10.0                                 CTL    40 ce 00 00  34 04 04 00  799ms       478.1.0        
  10.0                              4  OUT    01 00 00 00               1.0ms       478.2.0        
  10.0                                 CTL    c0 b4 00 00  00 00 01 00   87us       479.1.0(2)     
  10.0                              1  IN     54                        138us       479.2.0        
  15                                   CMD    00 00 00 00  00 00        199ms       481.1.0        
   8.1                             31  OUT    55 53 42 43  50 f0 fd 30  116us       482.1.0        
                                              00 00 00 00  00 00 06 00              482.1.8        
                                              00 00 00 00  00 00 00 00              482.1.16       
                                              00 00 00 00  00 00 00                 482.1.24       
   8.2                             13  IN     55 53 42 53  50 f0 fd 30   59us       483.1.0        
                                              00 00 00 00  00                       483.1.8        
  15                                   ok                                 7us       481.2.0        
  10.0                                 CTL    40 bc 00 00  00 00 01 00  1.0sc       487.1.0        
  10.0                              1  OUT    00                        521us       487.2.0        
  10.0                                 CTL    c0 b4 00 00  00 00 01 00   39us       488.1.0        
  10.0                              1  IN     74                        125us       488.2.0        
  10.2                                 RESET                            1.1ms       489.1.0        
   6.0                                 CTL    02 01 00 00  82 00 00 00   10us       490.1.0        
  10.2                                 RESET                              2us       491.1.0        
   6                                   CMD    00 00 00 00  00 00 00 00  137us       492.1.0        
                                              01 00 00 00  00 00 00 00              492.1.8        
                                              00 00 00 00  00 00 00 00              492.1.16       
                                              70 c8 13 2d  0a 95 ff ff              492.1.24       
                                              00 00 00 00  00 00 00 00              492.1.32       
                                              00 00 00 00  00 00 00 00              492.1.40       
                                              00 00 00 00  00 00 00 00              492.1.48       
                                              00 00 00 00  00 00 00 00              492.1.56       
                                              00 00 00 00  00 00 00 00              492.1.64       
                                              00 00 13 02  62 66 75 53              492.1.72       
                                              00 00 00 00  00 00 00 00              492.1.80       
                                              14 01 00 00  e4 3b 5f 30              492.1.88       
                                              0a 95 ff ff  00 00 00 00              492.1.96       
                                              00 00 00 00  00 00 00 00              492.1.104      
                                              00 00 00 00  00 00 00 00              492.1.112      
                                              00 00 00 00  00 00 00 00              492.1.120      
                                              00 00 00 00  00 00 00 00              492.1.128      
                                              00 00 00 00  00 00 00 00              492.1.136      
                                              00 00 00 00  00 00                    492.1.144      
   6                                   SSTS   00                        442us       492.2.0        
   6.0                                 CTL    02 01 00 00  82 00 00 00   15us       493.1.0        
   6                                   CMD    00 00 00 00  00 00 00 00  142us       494.1.0        
                                              01 00 00 00  00 00 00 00              494.1.8        
                                              00 00 00 00  00 00 00 00              494.1.16       
                                              70 c8 13 2d  0a 95 ff ff              494.1.24       
                                              00 00 00 00  00 00 00 00              494.1.32       
                                              00 00 00 00  00 00 00 00              494.1.40       
                                              00 00 00 00  00 00 00 00              494.1.48       
                                              00 00 00 00  00 00 00 00              494.1.56       
                                              00 00 00 00  00 00 00 00              494.1.64       
                                              00 00 13 02  62 66 75 53              494.1.72       
                                              00 00 00 00  00 00 00 00              494.1.80       
                                              14 01 00 00  e4 3b 5f 30              494.1.88       
                                              0a 95 ff ff  00 00 00 00              494.1.96       
                                              00 00 00 00  00 00 00 00              494.1.104      
                                              00 00 00 00  00 00 00 00              494.1.112      
                                              00 00 00 00  00 00 00 00              494.1.120      
                                              00 00 00 00  00 00 00 00              494.1.128      
                                              00 00 00 00  00 00 00 00              494.1.136      
                                              00 00 00 00  00 00                    494.1.144      
   6                                   SSTS   00                        450us       494.2.0        
  15                                   CMD    00 00 00 00  00 00        997ms       495.1.0        
   8.1                             31  OUT    55 53 42 43  50 f0 fd 30   55us       496.1.0        
                                              00 00 00 00  00 00 06 00              496.1.8        
                                              00 00 00 00  00 00 00 00              496.1.16       
                                              00 00 00 00  00 00 00                 496.1.24       
   8.2                             13  IN     55 53 42 53  50 f0 fd 30   81us       497.1.0        
                                              00 00 00 00  00                       497.1.8        
  15                                   ok                                 6us       495.2.0        
