Bus Hound 6.00 capture on Windows Vista (x64). Complements of www.perisoft.net

  Device - Device ID (followed by the endpoint for USB devices)
            (6) USB Root Hub (USB 3.0)
            (8) USB Mass Storage Device
            (10) USB2.0 Digital Camera
            (11) USB Composite Device
            (15) Generic Flash Disk [ROM=8.07]
            (20) EarPods
            (21) USB Input Device
            (22) USB Input Device
            (28) HID-compliant consumer control device
            (29) HID-compliant vendor-defined device
            (31) HID Keyboard Device
            (32) HID-compliant consumer control device
            (33) HID-compliant system controller
            (34) HID-compliant vendor-defined device
            (35) HID-compliant vendor-defined device
            (37) HID Keyboard Device
            (38) HID-compliant mouse
            (39) HID-compliant mouse
  Address - FireWire async address or channel number
  Length - Total transfer length
  Phase  - Phase Type
            ASTS  ATA task file status       NTSTS NTSTATUS value
            ATA   ATA task file command      OUT   Data out transfer
            BRB   Bluetooth request block    RESET bus reset
            CMD   SCSI/ATAPI command         SENSE SCSI sense data
            CTL   USB control transfer       SSTS  SCSI request block status
            IN    Data in transfer           USTS  USB status
            ISOC  Isochronous transfer       ok    command complete
            LOCK  FireWire lock transaction
  Data   - Hex dump of the data transferred
  Delta  - Elapsed time from the previous phase to the current phase
  Cmd... - Position in the captured data


Device  Address              Length    Phase  Data                      Delta  Cmd.Phase.Ofs(rep)
------  -------------------  --------  -----  ------------------------  -----  ------------------
  10.2                         524288  IN     60 00 53 00  60 00 52 00   27ms         1.1.0        
                                              60 00 55 00  63 00 55 00                1.1.8        
                                              64 00 56 00  61 00 58 00                1.1.16       
                                              62 00 52 00  63 00 56 00                1.1.24       
                                              60 00 57 00  63 00 55 00                1.1.32       
                                              61 00 59 00  64 00 55 00                1.1.40       
                                              67 00 59 00  63 00 55 00                1.1.48       
                                              61 00 58 00  64 00 59 00                1.1.56       
                                              66 00 54 00  63 00 57 00                1.1.64       
                                              63 00 58 00  62 00 56 00                1.1.72       
                                              65 00 58 00  61 00 56 00                1.1.80       
                                              64 00 57 00  66 00 59 00                1.1.88       
                                              60 00 54 00  63 00 55 00                1.1.96       
                                              63 00 57 00  63 00 56 00                1.1.104      
                                              65 00 5b 00  63 00 56 00                1.1.112      
                                              61 00 57 00  64 00 57 00                1.1.120      
                                              65 00 58 00  63 00 54 00                1.1.128      
                                              61 00 57 00  64 00 56 00                1.1.136      
                                              62 00 57 00  64 00 58 00                1.1.144      
                                              63 00 58 00  64 00 5a 00                1.1.152      
                                              64 00 59 00  64 00 55 00                1.1.160      
                                              60 00 54 00  65 00 59 00                1.1.168      
                                              61 00 56 00  64 00 58 00                1.1.176      
                                              63 00 59 00  68 00 58 00                1.1.184      
                                              62 00 56 00  62 00 56 00                1.1.192      
  10.2                         524288  IN     5f 00 54 00  5f 00 52 00   13ms         2.1.0        
                                              5e 00 50 00  5c 00 51 00                2.1.8        
                                              5d 00 53 00  5f 00 53 00                2.1.16       
                                              5e 00 53 00  5e 00 52 00                2.1.24       
                                              5e 00 51 00  5e 00 52 00                2.1.32       
                                              5f 00 53 00  5c 00 55 00                2.1.40       
                                              5e 00 53 00  5e 00 52 00                2.1.48       
                                              5f 00 53 00  5e 00 53 00                2.1.56       
                                              61 00 52 00  5e 00 50 00                2.1.64       
                                              5f 00 53 00  5e 00 51 00                2.1.72       
                                              5f 00 51 00  5f 00 51 00                2.1.80       
                                              5e 00 51 00  5c 00 53 00                2.1.88       
                                              5e 00 52 00  5e 00 51 00                2.1.96       
                                              60 00 52 00  60 00 51 00                2.1.104      
                                              5d 00 50 00  5f 00 53 00                2.1.112      
                                              5d 00 52 00  5f 00 50 00                2.1.120      
                                              5c 00 53 00  60 00 53 00                2.1.128      
                                              5e 00 55 00  5e 00 51 00                2.1.136      
                                              5f 00 51 00  5e 00 54 00                2.1.144      
                                              5e 00 50 00  5e 00 52 00                2.1.152      
                                              5f 00 52 00  5e 00 52 00                2.1.160      
                                              5c 00 53 00  5d 00 53 00                2.1.168      
                                              5e 00 51 00  5e 00 4f 00                2.1.176      
                                              5d 00 50 00  5c 00 50 00                2.1.184      
                                              5c 00 51 00  5b 00 55 00                2.1.192      
  10.2                         524288  IN     55 00 5c 00  51 00 5f 00   26ms         3.1.0        
                                              54 00 5f 00  52 00 5d 00                3.1.8        
                                              51 00 5e 00  52 00 5e 00                3.1.16       
                                              51 00 5e 00  53 00 5f 00                3.1.24       
                                              52 00 5f 00  53 00 60 00                3.1.32       
                                              51 00 60 00  51 00 5f 00                3.1.40       
                                              51 00 61 00  53 00 5f 00                3.1.48       
                                              52 00 5f 00  52 00 5e 00                3.1.56       
                                              54 00 5f 00  52 00 63 00                3.1.64       
                                              52 00 61 00  4f 00 5c 00                3.1.72       
                                              51 00 5f 00  51 00 5f 00                3.1.80       
                                              52 00 5f 00  50 00 60 00                3.1.88       
                                              54 00 5e 00  52 00 5e 00                3.1.96       
                                              50 00 5e 00  53 00 5c 00                3.1.104      
                                              52 00 60 00  52 00 5f 00                3.1.112      
                                              51 00 5d 00  51 00 5c 00                3.1.120      
                                              51 00 5e 00  52 00 60 00                3.1.128      
                                              53 00 5f 00  53 00 5e 00                3.1.136      
                                              53 00 5f 00  51 00 5d 00                3.1.144      
                                              53 00 5f 00  51 00 5e 00                3.1.152      
                                              51 00 60 00  51 00 5e 00                3.1.160      
                                              53 00 5b 00  51 00 5f 00                3.1.168      
                                              52 00 5d 00  51 00 5c 00                3.1.176      
                                              53 00 5d 00  52 00 5e 00                3.1.184      
                                              53 00 60 00  52 00 5f 00                3.1.192      
  10.2                         524288  IN     5d 00 51 00  5e 00 51 00  5.7ms         4.1.0        
                                              5e 00 53 00  60 00 53 00                4.1.8        
                                              5f 00 51 00  5e 00 53 00                4.1.16       
                                              5f 00 51 00  5c 00 53 00                4.1.24       
                                              5e 00 53 00  5e 00 51 00                4.1.32       
                                              60 00 51 00  5e 00 53 00                4.1.40       
                                              5e 00 53 00  60 00 53 00                4.1.48       
                                              5e 00 52 00  5f 00 51 00                4.1.56       
                                              5f 00 53 00  5f 00 50 00                4.1.64       
                                              5e 00 52 00  61 00 54 00                4.1.72       
                                              60 00 51 00  60 00 54 00                4.1.80       
                                              5f 00 50 00  5c 00 51 00                4.1.88       
                                              5d 00 52 00  60 00 53 00                4.1.96       
                                              5e 00 53 00  5c 00 51 00                4.1.104      
                                              5e 00 51 00  5f 00 52 00                4.1.112      
                                              5f 00 53 00  60 00 52 00                4.1.120      
                                              60 00 53 00  60 00 52 00                4.1.128      
                                              5f 00 53 00  5b 00 54 00                4.1.136      
                                              5f 00 53 00  5e 00 51 00                4.1.144      
                                              5f 00 54 00  5f 00 53 00                4.1.152      
                                              5f 00 51 00  5f 00 52 00                4.1.160      
                                              60 00 52 00  5e 00 52 00                4.1.168      
                                              5e 00 50 00  5e 00 53 00                4.1.176      
                                              5e 00 53 00  5e 00 51 00                4.1.184      
                                              5f 00 53 00  60 00 51 00                4.1.192      
  10.2                         524288  IN     52 00 5c 00  52 00 5c 00  9.5ms         5.1.0        
                                              50 00 5e 00  50 00 5f 00                5.1.8        
                                              51 00 5c 00  52 00 60 00                5.1.16       
                                              52 00 5f 00  52 00 5e 00                5.1.24       
                                              50 00 5f 00  55 00 5e 00                5.1.32       
                                              53 00 5d 00  52 00 5e 00                5.1.40       
                                              53 00 5c 00  4f 00 5e 00                5.1.48       
                                              51 00 5f 00  52 00 5e 00                5.1.56       
                                              52 00 5e 00  52 00 5e 00                5.1.64       
                                              52 00 60 00  53 00 60 00                5.1.72       
                                              50 00 5c 00  54 00 5d 00                5.1.80       
                                              51 00 60 00  53 00 60 00                5.1.88       
                                              54 00 5f 00  52 00 5e 00                5.1.96       
                                              51 00 5e 00  53 00 5e 00                5.1.104      
                                              51 00 60 00  53 00 5e 00                5.1.112      
                                              54 00 5c 00  50 00 5e 00                5.1.120      
                                              51 00 5f 00  51 00 5f 00                5.1.128      
                                              54 00 5e 00  53 00 5f 00                5.1.136      
                                              54 00 62 00  53 00 60 00                5.1.144      
                                              52 00 5e 00  52 00 60 00                5.1.152      
                                              53 00 5e 00  4f 00 5e 00                5.1.160      
                                              52 00 5e 00  53 00 60 00                5.1.168      
                                              54 00 5f 00  52 00 5e 00                5.1.176      
                                              52 00 60 00  53 00 5d 00                5.1.184      
                                              4f 00 60 00  53 00 5c 00                5.1.192      
  10.2                             31  IN     1a 00 00 00  01 00 02 00  1.8ms         6.1.0        
                                              31 84 00 01  04 00 0e 1a                6.1.8        
                                              00 00 01 01  04 00 00 00                6.1.16       
                                              00 00 00 55  aa 55 aa                   6.1.24       
  10.2                         524288  IN     63 00 53 00  62 00 58 00  244ms         7.1.0        
                                              62 00 56 00  62 00 57 00                7.1.8        
                                              62 00 54 00  62 00 57 00                7.1.16       
                                              61 00 53 00  64 00 54 00                7.1.24       
                                              60 00 57 00  63 00 58 00                7.1.32       
                                              63 00 57 00  63 00 59 00                7.1.40       
                                              65 00 59 00  61 00 58 00                7.1.48       
                                              64 00 58 00  66 00 59 00                7.1.56       
                                              64 00 55 00  64 00 59 00                7.1.64       
                                              65 00 59 00  61 00 55 00                7.1.72       
                                              66 00 57 00  61 00 57 00                7.1.80       
                                              64 00 56 00  67 00 56 00                7.1.88       
                                              5f 00 56 00  64 00 56 00                7.1.96       
                                              64 00 5a 00  66 00 5a 00                7.1.104      
                                              64 00 5a 00  65 00 58 00                7.1.112      
                                              64 00 57 00  64 00 5a 00                7.1.120      
                                              64 00 58 00  64 00 53 00                7.1.128      
                                              61 00 56 00  64 00 58 00                7.1.136      
                                              66 00 58 00  63 00 5b 00                7.1.144      
                                              67 00 59 00  64 00 59 00                7.1.152      
                                              66 00 58 00  64 00 55 00                7.1.160      
                                              61 00 55 00  67 00 58 00                7.1.168      
                                              62 00 57 00  65 00 57 00                7.1.176      
                                              62 00 59 00  64 00 57 00                7.1.184      
                                              62 00 57 00  62 00 59 00                7.1.192      
  10.2                         524288  IN     5e 00 51 00  5e 00 53 00   13ms         8.1.0        
                                              5c 00 51 00  5e 00 52 00                8.1.8        
                                              5e 00 53 00  60 00 50 00                8.1.16       
                                              5e 00 50 00  5f 00 51 00                8.1.24       
                                              5f 00 52 00  5e 00 51 00                8.1.32       
                                              5c 00 51 00  5f 00 51 00                8.1.40       
                                              5e 00 51 00  5d 00 54 00                8.1.48       
                                              5e 00 51 00  5f 00 53 00                8.1.56       
                                              5c 00 51 00  5e 00 52 00                8.1.64       
                                              5e 00 53 00  5e 00 53 00                8.1.72       
                                              61 00 51 00  5c 00 51 00                8.1.80       
                                              5e 00 53 00  5f 00 53 00                8.1.88       
                                              5e 00 55 00  5f 00 51 00                8.1.96       
                                              5d 00 51 00  5e 00 51 00                8.1.104      
                                              5d 00 52 00  5f 00 53 00                8.1.112      
                                              5c 00 50 00  60 00 50 00                8.1.120      
                                              5e 00 52 00  5c 00 53 00                8.1.128      
                                              60 00 51 00  5e 00 54 00                8.1.136      
                                              5f 00 51 00  5e 00 52 00                8.1.144      
                                              60 00 51 00  5f 00 50 00                8.1.152      
                                              5e 00 51 00  5d 00 51 00                8.1.160      
                                              5c 00 51 00  5e 00 53 00                8.1.168      
                                              60 00 51 00  5f 00 50 00                8.1.176      
                                              5d 00 51 00  5d 00 50 00                8.1.184      
                                              5d 00 4f 00  5e 00 53 00                8.1.192      
  10.2                         524288  IN     55 00 5e 00  52 00 60 00   12ms         9.1.0        
                                              52 00 61 00  52 00 5f 00                9.1.8        
                                              4f 00 5f 00  52 00 61 00                9.1.16       
                                              51 00 5f 00  51 00 60 00                9.1.24       
                                              51 00 5f 00  53 00 61 00                9.1.32       
                                              51 00 60 00  53 00 60 00                9.1.40       
                                              51 00 61 00  53 00 5f 00                9.1.48       
                                              53 00 61 00  53 00 60 00                9.1.56       
                                              51 00 60 00  53 00 60 00                9.1.64       
                                              54 00 5f 00  52 00 60 00                9.1.72       
                                              52 00 5f 00  53 00 5e 00                9.1.80       
                                              53 00 60 00  51 00 5f 00                9.1.88       
                                              53 00 60 00  52 00 5e 00                9.1.96       
                                              55 00 5d 00  54 00 60 00                9.1.104      
                                              51 00 5f 00  53 00 5f 00                9.1.112      
                                              52 00 5c 00  53 00 60 00                9.1.120      
                                              51 00 5f 00  53 00 60 00                9.1.128      
                                              53 00 5f 00  53 00 5d 00                9.1.136      
                                              51 00 5f 00  53 00 5f 00                9.1.144      
                                              53 00 60 00  51 00 60 00                9.1.152      
                                              53 00 5f 00  54 00 5f 00                9.1.160      
                                              54 00 5f 00  53 00 60 00                9.1.168      
                                              54 00 60 00  53 00 60 00                9.1.176      
                                              53 00 5e 00  51 00 61 00                9.1.184      
                                              51 00 60 00  53 00 60 00                9.1.192      
  10.2                         524288  IN     5e 00 52 00  5e 00 52 00   13ms        10.1.0        
                                              5f 00 52 00  62 00 52 00               10.1.8        
                                              5e 00 51 00  5f 00 54 00               10.1.16       
                                              5f 00 52 00  62 00 51 00               10.1.24       
                                              5f 00 53 00  60 00 51 00               10.1.32       
                                              5f 00 51 00  5e 00 52 00               10.1.40       
                                              5f 00 52 00  5e 00 53 00               10.1.48       
                                              60 00 54 00  5e 00 53 00               10.1.56       
                                              61 00 52 00  5f 00 54 00               10.1.64       
                                              60 00 53 00  60 00 55 00               10.1.72       
                                              63 00 54 00  5e 00 51 00               10.1.80       
                                              5e 00 51 00  5f 00 53 00               10.1.88       
                                              60 00 53 00  5e 00 54 00               10.1.96       
                                              60 00 54 00  5e 00 55 00               10.1.104      
                                              5e 00 53 00  5f 00 53 00               10.1.112      
                                              60 00 52 00  5f 00 53 00               10.1.120      
                                              60 00 54 00  60 00 53 00               10.1.128      
                                              60 00 54 00  5e 00 53 00               10.1.136      
                                              5d 00 54 00  5e 00 53 00               10.1.144      
                                              60 00 51 00  60 00 53 00               10.1.152      
                                              5e 00 52 00  61 00 52 00               10.1.160      
                                              5f 00 51 00  60 00 53 00               10.1.168      
                                              61 00 53 00  60 00 53 00               10.1.176      
                                              60 00 55 00  5d 00 53 00               10.1.184      
                                              5f 00 53 00  5c 00 4f 00               10.1.192      
  10.2                         524288  IN     52 00 5c 00  53 00 5c 00   13ms        11.1.0        
                                              53 00 5e 00  4f 00 5e 00               11.1.8        
                                              51 00 5c 00  52 00 5e 00               11.1.16       
                                              52 00 5e 00  52 00 5f 00               11.1.24       
                                              51 00 5e 00  52 00 5e 00               11.1.32       
                                              55 00 60 00  51 00 5e 00               11.1.40       
                                              51 00 5b 00  52 00 5d 00               11.1.48       
                                              50 00 5d 00  50 00 5b 00               11.1.56       
                                              54 00 60 00  54 00 5e 00               11.1.64       
                                              54 00 5e 00  51 00 5e 00               11.1.72       
                                              53 00 5c 00  51 00 5f 00               11.1.80       
                                              52 00 5f 00  55 00 5f 00               11.1.88       
                                              53 00 5d 00  53 00 5e 00               11.1.96       
                                              52 00 5e 00  52 00 5f 00               11.1.104      
                                              53 00 5d 00  52 00 5e 00               11.1.112      
                                              51 00 61 00  51 00 60 00               11.1.120      
                                              52 00 5f 00  54 00 60 00               11.1.128      
                                              55 00 60 00  52 00 5f 00               11.1.136      
                                              51 00 60 00  52 00 60 00               11.1.144      
                                              52 00 5f 00  53 00 60 00               11.1.152      
                                              51 00 60 00  51 00 5e 00               11.1.160      
                                              53 00 5e 00  51 00 60 00               11.1.168      
                                              53 00 5e 00  51 00 5d 00               11.1.176      
                                              4f 00 60 00  52 00 5f 00               11.1.184      
                                              53 00 60 00  52 00 5c 00               11.1.192      
  10.2                             31  IN     1a 00 00 00  01 00 02 00   37us        12.1.0        
                                              31 84 00 01  04 00 0f 1a               12.1.8        
                                              00 00 01 01  04 00 00 00               12.1.16       
                                              00 00 00 55  aa 55 aa                  12.1.24       
  10.2                         524288  IN     61 00 51 00  61 00 55 00  249ms        13.1.0        
                                              62 00 57 00  64 00 54 00               13.1.8        
                                              63 00 54 00  61 00 54 00               13.1.16       
                                              62 00 52 00  62 00 54 00               13.1.24       
                                              60 00 57 00  62 00 54 00               13.1.32       
                                              61 00 57 00  61 00 5a 00               13.1.40       
                                              64 00 59 00  63 00 55 00               13.1.48       
                                              66 00 59 00  63 00 59 00               13.1.56       
                                              64 00 56 00  63 00 59 00               13.1.64       
                                              63 00 57 00  63 00 55 00               13.1.72       
                                              64 00 59 00  61 00 56 00               13.1.80       
                                              63 00 58 00  62 00 59 00               13.1.88       
                                              60 00 55 00  62 00 55 00               13.1.96       
                                              62 00 57 00  62 00 54 00               13.1.104      
                                              67 00 5a 00  65 00 57 00               13.1.112      
                                              62 00 59 00  66 00 59 00               13.1.120      
                                              66 00 57 00  62 00 55 00               13.1.128      
                                              62 00 57 00  66 00 56 00               13.1.136      
                                              63 00 57 00  63 00 5b 00               13.1.144      
                                              64 00 57 00  66 00 59 00               13.1.152      
                                              64 00 58 00  64 00 56 00               13.1.160      
                                              62 00 55 00  66 00 59 00               13.1.168      
                                              61 00 56 00  64 00 58 00               13.1.176      
                                              64 00 5a 00  65 00 59 00               13.1.184      
                                              63 00 57 00  62 00 58 00               13.1.192      
  10.2                         524288  IN     5d 00 52 00  5f 00 51 00   12ms        14.1.0        
                                              5c 00 52 00  5f 00 53 00               14.1.8        
                                              5d 00 55 00  5e 00 51 00               14.1.16       
                                              5e 00 50 00  5e 00 51 00               14.1.24       
                                              60 00 51 00  5e 00 51 00               14.1.32       
                                              5f 00 51 00  5c 00 51 00               14.1.40       
                                              5e 00 53 00  5e 00 50 00               14.1.48       
                                              61 00 51 00  5c 00 51 00               14.1.56       
                                              5b 00 51 00  60 00 4e 00               14.1.64       
                                              5e 00 4f 00  5d 00 51 00               14.1.72       
                                              5d 00 50 00  5c 00 51 00               14.1.80       
                                              5d 00 52 00  5e 00 51 00               14.1.88       
                                              5c 00 51 00  5e 00 52 00               14.1.96       
                                              5f 00 52 00  5f 00 52 00               14.1.104      
                                              60 00 4f 00  5c 00 50 00               14.1.112      
                                              5c 00 4f 00  5e 00 50 00               14.1.120      
                                              5e 00 51 00  5d 00 51 00               14.1.128      
                                              60 00 53 00  5e 00 53 00               14.1.136      
                                              5e 00 51 00  5e 00 53 00               14.1.144      
                                              5e 00 51 00  5c 00 51 00               14.1.152      
                                              5e 00 53 00  5e 00 52 00               14.1.160      
                                              5e 00 52 00  5c 00 51 00               14.1.168      
                                              5c 00 53 00  60 00 51 00               14.1.176      
                                              5e 00 51 00  5e 00 51 00               14.1.184      
                                              5c 00 52 00  5e 00 52 00               14.1.192      
  10.2                         524288  IN     56 00 5e 00  53 00 60 00   13ms        15.1.0        
                                              51 00 60 00  51 00 60 00               15.1.8        
                                              53 00 60 00  55 00 5e 00               15.1.16       
                                              51 00 5e 00  51 00 5e 00               15.1.24       
                                              51 00 5c 00  51 00 60 00               15.1.32       
                                              52 00 61 00  51 00 5f 00               15.1.40       
                                              53 00 5f 00  53 00 5f 00               15.1.48       
                                              51 00 62 00  53 00 5e 00               15.1.56       
                                              51 00 60 00  51 00 62 00               15.1.64       
                                              53 00 60 00  54 00 5e 00               15.1.72       
                                              51 00 5c 00  50 00 5e 00               15.1.80       
                                              52 00 5f 00  52 00 5e 00               15.1.88       
                                              52 00 60 00  53 00 5f 00               15.1.96       
                                              51 00 5e 00  52 00 60 00               15.1.104      
                                              52 00 5f 00  52 00 60 00               15.1.112      
                                              51 00 5f 00  50 00 5d 00               15.1.120      
                                              51 00 5f 00  53 00 61 00               15.1.128      
                                              52 00 5e 00  51 00 5e 00               15.1.136      
                                              4f 00 61 00  52 00 5f 00               15.1.144      
                                              53 00 5f 00  53 00 5f 00               15.1.152      
                                              51 00 5f 00  4f 00 5e 00               15.1.160      
                                              55 00 5d 00  52 00 5e 00               15.1.168      
                                              51 00 5f 00  51 00 5e 00               15.1.176      
                                              51 00 5d 00  52 00 5f 00               15.1.184      
                                              51 00 5e 00  54 00 5e 00               15.1.192      
  10.2                         524288  IN     5e 00 54 00  60 00 53 00   13ms        16.1.0        
                                              5e 00 51 00  5f 00 53 00               16.1.8        
                                              5e 00 51 00  5f 00 53 00               16.1.16       
                                              5c 00 55 00  60 00 53 00               16.1.24       
                                              61 00 53 00  60 00 51 00               16.1.32       
                                              5f 00 51 00  60 00 51 00               16.1.40       
                                              61 00 53 00  5f 00 52 00               16.1.48       
                                              5d 00 51 00  5e 00 50 00               16.1.56       
                                              60 00 54 00  5f 00 51 00               16.1.64       
                                              5f 00 53 00  5f 00 51 00               16.1.72       
                                              60 00 50 00  60 00 52 00               16.1.80       
                                              5f 00 52 00  5f 00 55 00               16.1.88       
                                              60 00 54 00  5e 00 52 00               16.1.96       
                                              60 00 54 00  5f 00 52 00               16.1.104      
                                              5e 00 55 00  5e 00 53 00               16.1.112      
                                              5f 00 54 00  5f 00 50 00               16.1.120      
                                              5d 00 52 00  61 00 53 00               16.1.128      
                                              5d 00 52 00  60 00 54 00               16.1.136      
                                              5f 00 52 00  5e 00 53 00               16.1.144      
                                              5e 00 51 00  5d 00 52 00               16.1.152      
                                              5f 00 51 00  61 00 53 00               16.1.160      
                                              5f 00 51 00  5d 00 52 00               16.1.168      
                                              5c 00 52 00  5e 00 53 00               16.1.176      
                                              5f 00 51 00  5e 00 53 00               16.1.184      
                                              5d 00 52 00  61 00 54 00               16.1.192      
  10.2                         524288  IN     51 00 5d 00  51 00 5f 00   12ms        17.1.0        
                                              53 00 60 00  53 00 5e 00               17.1.8        
                                              51 00 60 00  54 00 5e 00               17.1.16       
                                              52 00 60 00  51 00 5f 00               17.1.24       
                                              52 00 60 00  53 00 5e 00               17.1.32       
                                              53 00 5e 00  52 00 5e 00               17.1.40       
                                              52 00 5e 00  53 00 5f 00               17.1.48       
                                              51 00 5f 00  50 00 5e 00               17.1.56       
                                              53 00 5e 00  51 00 5c 00               17.1.64       
                                              52 00 5f 00  52 00 60 00               17.1.72       
                                              53 00 5c 00  54 00 5c 00               17.1.80       
                                              53 00 60 00  54 00 5e 00               17.1.88       
                                              53 00 5f 00  53 00 5e 00               17.1.96       
                                              51 00 60 00  50 00 61 00               17.1.104      
                                              51 00 5e 00  54 00 60 00               17.1.112      
                                              51 00 5e 00  55 00 60 00               17.1.120      
                                              52 00 5f 00  53 00 5e 00               17.1.128      
                                              54 00 5e 00  51 00 5c 00               17.1.136      
                                              51 00 61 00  53 00 60 00               17.1.144      
                                              52 00 61 00  52 00 5e 00               17.1.152      
                                              53 00 5e 00  52 00 60 00               17.1.160      
                                              53 00 5f 00  51 00 63 00               17.1.168      
                                              55 00 5f 00  51 00 5c 00               17.1.176      
                                              51 00 61 00  51 00 5d 00               17.1.184      
                                              53 00 61 00  53 00 5e 00               17.1.192      
  10.2                             31  IN     1a 00 00 00  01 00 02 00   29us        18.1.0        
                                              31 84 00 01  04 00 10 1a               18.1.8        
                                              00 00 01 01  04 00 00 00               18.1.16       
                                              00 00 00 55  aa 55 aa                  18.1.24       
  10.2                         524288  IN     60 00 55 00  60 00 55 00  250ms        19.1.0        
                                              60 00 56 00  62 00 55 00               19.1.8        
                                              62 00 55 00  60 00 57 00               19.1.16       
                                              60 00 55 00  63 00 57 00               19.1.24       
                                              61 00 55 00  60 00 57 00               19.1.32       
                                              61 00 57 00  62 00 58 00               19.1.40       
                                              67 00 59 00  61 00 55 00               19.1.48       
                                              63 00 55 00  68 00 58 00               19.1.56       
                                              64 00 56 00  63 00 58 00               19.1.64       
                                              63 00 57 00  60 00 57 00               19.1.72       
                                              64 00 57 00  62 00 58 00               19.1.80       
                                              5f 00 56 00  64 00 59 00               19.1.88       
                                              61 00 55 00  60 00 55 00               19.1.96       
                                              64 00 57 00  62 00 57 00               19.1.104      
                                              62 00 57 00  66 00 57 00               19.1.112      
                                              64 00 57 00  68 00 5a 00               19.1.120      
                                              64 00 56 00  62 00 55 00               19.1.128      
                                              60 00 55 00  62 00 57 00               19.1.136      
                                              63 00 5b 00  63 00 59 00               19.1.144      
                                              64 00 59 00  66 00 5d 00               19.1.152      
                                              64 00 58 00  64 00 55 00               19.1.160      
                                              5f 00 57 00  67 00 59 00               19.1.168      
                                              64 00 57 00  64 00 57 00               19.1.176      
                                              64 00 5a 00  66 00 56 00               19.1.184      
                                              65 00 55 00  62 00 56 00               19.1.192      
  10.2                         524288  IN     5d 00 53 00  5c 00 52 00   13ms        20.1.0        
                                              5c 00 52 00  5e 00 50 00               20.1.8        
                                              5e 00 51 00  5f 00 52 00               20.1.16       
                                              5c 00 4f 00  5c 00 51 00               20.1.24       
                                              5f 00 4e 00  5e 00 53 00               20.1.32       
                                              60 00 53 00  5c 00 53 00               20.1.40       
                                              5f 00 53 00  5f 00 50 00               20.1.48       
                                              60 00 51 00  5e 00 51 00               20.1.56       
                                              5f 00 52 00  5b 00 52 00               20.1.64       
                                              61 00 51 00  5d 00 52 00               20.1.72       
                                              5d 00 51 00  5e 00 50 00               20.1.80       
                                              5d 00 52 00  5c 00 53 00               20.1.88       
                                              5f 00 52 00  5e 00 52 00               20.1.96       
                                              60 00 51 00  5e 00 51 00               20.1.104      
                                              60 00 52 00  5e 00 4e 00               20.1.112      
                                              5e 00 52 00  5e 00 51 00               20.1.120      
                                              5d 00 51 00  5d 00 4f 00               20.1.128      
                                              5d 00 52 00  60 00 51 00               20.1.136      
                                              5d 00 52 00  5f 00 52 00               20.1.144      
                                              5d 00 52 00  5e 00 51 00               20.1.152      
                                              5f 00 51 00  5f 00 50 00               20.1.160      
                                              5e 00 51 00  5b 00 51 00               20.1.168      
                                              5c 00 52 00  5e 00 52 00               20.1.176      
                                              5e 00 51 00  5c 00 50 00               20.1.184      
                                              5e 00 4f 00  5c 00 53 00               20.1.192      
  10.2                         524288  IN     54 00 5e 00  51 00 5e 00   12ms        21.1.0        
                                              4f 00 5f 00  50 00 5f 00               21.1.8        
                                              51 00 60 00  52 00 5e 00               21.1.16       
                                              50 00 5f 00  52 00 5d 00               21.1.24       
                                              53 00 5d 00  53 00 5e 00               21.1.32       
                                              51 00 5e 00  53 00 5e 00               21.1.40       
                                              53 00 5e 00  53 00 5f 00               21.1.48       
                                              53 00 5f 00  53 00 60 00               21.1.56       
                                              51 00 5e 00  52 00 5f 00               21.1.64       
                                              51 00 5e 00  53 00 5e 00               21.1.72       
                                              50 00 5d 00  51 00 5e 00               21.1.80       
                                              51 00 60 00  53 00 5f 00               21.1.88       
                                              51 00 5f 00  51 00 5e 00               21.1.96       
                                              54 00 5d 00  51 00 5f 00               21.1.104      
                                              53 00 5d 00  53 00 5c 00               21.1.112      
                                              52 00 60 00  53 00 5e 00               21.1.120      
                                              53 00 5d 00  53 00 60 00               21.1.128      
                                              52 00 5f 00  51 00 5c 00               21.1.136      
                                              4f 00 5e 00  51 00 5f 00               21.1.144      
                                              51 00 5e 00  53 00 5e 00               21.1.152      
                                              54 00 5e 00  52 00 5e 00               21.1.160      
                                              53 00 5c 00  53 00 60 00               21.1.168      
                                              51 00 5e 00  52 00 5c 00               21.1.176      
                                              53 00 5e 00  53 00 5c 00               21.1.184      
                                              54 00 5f 00  54 00 60 00               21.1.192      
  10.2                         524288  IN     5d 00 54 00  5e 00 52 00   12ms        22.1.0        
                                              60 00 54 00  60 00 53 00               22.1.8        
                                              5c 00 52 00  62 00 51 00               22.1.16       
                                              5f 00 51 00  5d 00 51 00               22.1.24       
                                              5e 00 53 00  60 00 53 00               22.1.32       
                                              60 00 50 00  60 00 51 00               22.1.40       
                                              5c 00 52 00  5f 00 52 00               22.1.48       
                                              5c 00 52 00  5c 00 53 00               22.1.56       
                                              5f 00 52 00  5f 00 53 00               22.1.64       
                                              5e 00 55 00  60 00 53 00               22.1.72       
                                              5f 00 54 00  60 00 56 00               22.1.80       
                                              5e 00 54 00  5e 00 52 00               22.1.88       
                                              5f 00 53 00  5f 00 51 00               22.1.96       
                                              5e 00 52 00  5e 00 53 00               22.1.104      
                                              5e 00 53 00  5e 00 53 00               22.1.112      
                                              5f 00 53 00  5f 00 53 00               22.1.120      
                                              5e 00 53 00  60 00 4f 00               22.1.128      
                                              5f 00 54 00  5f 00 56 00               22.1.136      
                                              5b 00 52 00  61 00 54 00               22.1.144      
                                              5e 00 53 00  5e 00 53 00               22.1.152      
                                              5e 00 51 00  5f 00 53 00               22.1.160      
                                              5f 00 52 00  5f 00 52 00               22.1.168      
                                              5e 00 51 00  5e 00 51 00               22.1.176      
                                              60 00 51 00  5f 00 53 00               22.1.184      
                                              5f 00 53 00  5e 00 51 00               22.1.192      
  10.2                         524288  IN     53 00 5f 00  53 00 5d 00   13ms        23.1.0        
                                              52 00 60 00  51 00 5e 00               23.1.8        
                                              51 00 5e 00  51 00 5e 00               23.1.16       
                                              53 00 5e 00  51 00 5e 00               23.1.24       
                                              53 00 60 00  53 00 5e 00               23.1.32       
                                              53 00 5c 00  54 00 5f 00               23.1.40       
                                              52 00 5f 00  50 00 5f 00               23.1.48       
                                              50 00 5f 00  51 00 5f 00               23.1.56       
                                              51 00 5d 00  51 00 5f 00               23.1.64       
                                              53 00 5f 00  52 00 60 00               23.1.72       
                                              56 00 5f 00  54 00 5f 00               23.1.80       
                                              50 00 5e 00  50 00 5f 00               23.1.88       
                                              53 00 60 00  53 00 5f 00               23.1.96       
                                              52 00 60 00  52 00 60 00               23.1.104      
                                              55 00 5f 00  52 00 62 00               23.1.112      
                                              51 00 5e 00  51 00 5e 00               23.1.120      
                                              55 00 60 00  53 00 60 00               23.1.128      
                                              55 00 5d 00  54 00 5e 00               23.1.136      
                                              53 00 61 00  54 00 60 00               23.1.144      
                                              54 00 5e 00  51 00 5f 00               23.1.152      
                                              52 00 5f 00  51 00 5e 00               23.1.160      
                                              52 00 5e 00  51 00 5f 00               23.1.168      
                                              54 00 61 00  52 00 5e 00               23.1.176      
                                              52 00 5c 00  51 00 60 00               23.1.184      
                                              53 00 64 00  51 00 60 00               23.1.192      
  10.2                             31  IN     1a 00 00 00  01 00 02 00   40us        24.1.0        
                                              31 84 00 01  04 00 11 1a               24.1.8        
                                              00 00 01 01  04 00 00 00               24.1.16       
                                              00 00 00 55  aa 55 aa                  24.1.24       
  10.2                         524288  IN     60 00 55 00  5f 00 55 00  253ms        25.1.0        
                                              60 00 56 00  61 00 57 00               25.1.8        
                                              63 00 57 00  62 00 57 00               25.1.16       
                                              61 00 55 00  63 00 55 00               25.1.24       
                                              5f 00 57 00  63 00 55 00               25.1.32       
                                              62 00 55 00  62 00 58 00               25.1.40       
                                              65 00 59 00  63 00 54 00               25.1.48       
                                              63 00 57 00  65 00 59 00               25.1.56       
                                              64 00 54 00  62 00 5a 00               25.1.64       
                                              65 00 55 00  62 00 57 00               25.1.72       
                                              63 00 5b 00  64 00 57 00               25.1.80       
                                              64 00 57 00  65 00 59 00               25.1.88       
                                              64 00 55 00  62 00 57 00               25.1.96       
                                              62 00 59 00  63 00 56 00               25.1.104      
                                              66 00 5c 00  65 00 57 00               25.1.112      
                                              63 00 57 00  64 00 57 00               25.1.120      
                                              64 00 59 00  64 00 55 00               25.1.128      
                                              62 00 57 00  62 00 57 00               25.1.136      
                                              64 00 55 00  64 00 5b 00               25.1.144      
                                              65 00 57 00  64 00 59 00               25.1.152      
                                              67 00 58 00  62 00 56 00               25.1.160      
                                              60 00 55 00  66 00 59 00               25.1.168      
                                              62 00 57 00  64 00 58 00               25.1.176      
                                              62 00 59 00  68 00 59 00               25.1.184      
                                              63 00 58 00  67 00 59 00               25.1.192      
  10.2                         524288  IN     5c 00 53 00  5f 00 51 00  9.3ms        26.1.0        
                                              5c 00 53 00  5c 00 52 00               26.1.8        
                                              5e 00 52 00  5f 00 52 00               26.1.16       
                                              5d 00 51 00  5c 00 50 00               26.1.24       
                                              5d 00 50 00  5e 00 51 00               26.1.32       
                                              5e 00 51 00  5e 00 53 00               26.1.40       
                                              5d 00 53 00  5e 00 50 00               26.1.48       
                                              63 00 53 00  5d 00 50 00               26.1.56       
                                              5e 00 4f 00  5f 00 51 00               26.1.64       
                                              5f 00 53 00  5e 00 4f 00               26.1.72       
                                              5e 00 52 00  5e 00 50 00               26.1.80       
                                              5c 00 52 00  5e 00 51 00               26.1.88       
                                              60 00 53 00  5e 00 53 00               26.1.96       
                                              60 00 50 00  5e 00 53 00               26.1.104      
                                              5e 00 51 00  5f 00 54 00               26.1.112      
                                              60 00 50 00  5f 00 54 00               26.1.120      
                                              5f 00 50 00  5e 00 53 00               26.1.128      
                                              5e 00 51 00  60 00 51 00               26.1.136      
                                              5d 00 51 00  5c 00 51 00               26.1.144      
                                              5c 00 51 00  60 00 51 00               26.1.152      
                                              60 00 51 00  5d 00 51 00               26.1.160      
                                              5e 00 4f 00  5b 00 52 00               26.1.168      
                                              5f 00 51 00  5b 00 53 00               26.1.176      
                                              5e 00 52 00  5e 00 50 00               26.1.184      
                                              5d 00 4f 00  5c 00 53 00               26.1.192      
  10.2                         524288  IN     56 00 5f 00  53 00 5f 00   13ms        27.1.0        
                                              51 00 5e 00  50 00 60 00               27.1.8        
                                              53 00 60 00  51 00 60 00               27.1.16       
                                              51 00 5f 00  53 00 5e 00               27.1.24       
                                              52 00 5c 00  52 00 5f 00               27.1.32       
                                              50 00 5f 00  52 00 5c 00               27.1.40       
                                              50 00 60 00  53 00 60 00               27.1.48       
                                              52 00 60 00  51 00 60 00               27.1.56       
                                              53 00 5e 00  50 00 61 00               27.1.64       
                                              51 00 5f 00  53 00 5f 00               27.1.72       
                                              4f 00 5f 00  53 00 5f 00               27.1.80       
                                              53 00 5f 00  51 00 5e 00               27.1.88       
                                              51 00 5e 00  51 00 5e 00               27.1.96       
                                              53 00 5d 00  53 00 60 00               27.1.104      
                                              53 00 60 00  50 00 5e 00               27.1.112      
                                              51 00 5e 00  53 00 5c 00               27.1.120      
                                              51 00 5f 00  52 00 5f 00               27.1.128      
                                              53 00 5e 00  53 00 5c 00               27.1.136      
                                              52 00 5e 00  51 00 5e 00               27.1.144      
                                              53 00 5e 00  52 00 5e 00               27.1.152      
                                              52 00 60 00  52 00 5e 00               27.1.160      
                                              54 00 60 00  55 00 5f 00               27.1.168      
                                              55 00 5f 00  51 00 5e 00               27.1.176      
                                              54 00 60 00  50 00 5f 00               27.1.184      
                                              52 00 5e 00  53 00 5d 00               27.1.192      
  10.2                         524288  IN     5d 00 53 00  5d 00 55 00   15ms        28.1.0        
                                              5d 00 53 00  60 00 52 00               28.1.8        
                                              5e 00 52 00  5f 00 53 00               28.1.16       
                                              5d 00 55 00  60 00 54 00               28.1.24       
                                              60 00 53 00  60 00 53 00               28.1.32       
                                              5e 00 4f 00  5e 00 51 00               28.1.40       
                                              60 00 53 00  5f 00 51 00               28.1.48       
                                              5f 00 51 00  5c 00 51 00               28.1.56       
                                              60 00 52 00  5e 00 52 00               28.1.64       
                                              60 00 53 00  60 00 53 00               28.1.72       
                                              5f 00 54 00  5f 00 52 00               28.1.80       
                                              5d 00 52 00  5e 00 51 00               28.1.88       
                                              60 00 51 00  60 00 52 00               28.1.96       
                                              60 00 53 00  5e 00 53 00               28.1.104      
                                              5e 00 55 00  60 00 53 00               28.1.112      
                                              60 00 52 00  60 00 50 00               28.1.120      
                                              5f 00 53 00  60 00 53 00               28.1.128      
                                              5e 00 54 00  5e 00 54 00               28.1.136      
                                              5c 00 53 00  5e 00 55 00               28.1.144      
                                              5e 00 52 00  60 00 53 00               28.1.152      
                                              60 00 51 00  5f 00 52 00               28.1.160      
                                              5e 00 51 00  5e 00 51 00               28.1.168      
                                              5f 00 51 00  60 00 52 00               28.1.176      
                                              61 00 52 00  5e 00 52 00               28.1.184      
                                              60 00 51 00  61 00 53 00               28.1.192      
  10.2                         524288  IN     53 00 5f 00  51 00 5f 00   12ms        29.1.0        
                                              53 00 61 00  51 00 5f 00               29.1.8        
                                              53 00 5e 00  51 00 61 00               29.1.16       
                                              53 00 5f 00  53 00 60 00               29.1.24       
                                              52 00 60 00  52 00 60 00               29.1.32       
                                              53 00 60 00  55 00 60 00               29.1.40       
                                              52 00 5f 00  4f 00 5e 00               29.1.48       
                                              55 00 60 00  53 00 60 00               29.1.56       
                                              52 00 5c 00  51 00 5f 00               29.1.64       
                                              53 00 60 00  54 00 61 00               29.1.72       
                                              53 00 5d 00  57 00 61 00               29.1.80       
                                              52 00 61 00  54 00 62 00               29.1.88       
                                              52 00 60 00  53 00 60 00               29.1.96       
                                              54 00 60 00  53 00 5f 00               29.1.104      
                                              53 00 63 00  53 00 5e 00               29.1.112      
                                              54 00 60 00  53 00 5e 00               29.1.120      
                                              54 00 60 00  52 00 60 00               29.1.128      
                                              52 00 60 00  54 00 5f 00               29.1.136      
                                              52 00 61 00  55 00 5e 00               29.1.144      
                                              54 00 60 00  52 00 5f 00               29.1.152      
                                              52 00 5f 00  4f 00 5f 00               29.1.160      
                                              51 00 5f 00  52 00 62 00               29.1.168      
                                              53 00 5f 00  51 00 5f 00               29.1.176      
                                              51 00 5f 00  52 00 5e 00               29.1.184      
                                              53 00 62 00  52 00 5e 00               29.1.192      
  10.2                             31  IN     1a 00 00 00  01 00 02 00   45us        30.1.0        
                                              31 84 00 01  04 00 12 1a               30.1.8        
                                              00 00 01 01  04 00 00 00               30.1.16       
                                              00 00 00 55  aa 55 aa                  30.1.24       
  10.2                         524288  IN     62 00 52 00  5e 00 54 00  248ms        31.1.0        
                                              62 00 55 00  62 00 57 00               31.1.8        
                                              62 00 57 00  64 00 55 00               31.1.16       
                                              62 00 55 00  66 00 55 00               31.1.24       
                                              60 00 57 00  62 00 55 00               31.1.32       
                                              61 00 56 00  64 00 59 00               31.1.40       
                                              66 00 55 00  62 00 56 00               31.1.48       
                                              64 00 56 00  66 00 59 00               31.1.56       
                                              63 00 57 00  64 00 57 00               31.1.64       
                                              64 00 57 00  63 00 57 00               31.1.72       
                                              63 00 59 00  62 00 58 00               31.1.80       
                                              61 00 56 00  64 00 58 00               31.1.88       
                                              61 00 56 00  64 00 57 00               31.1.96       
                                              62 00 55 00  62 00 57 00               31.1.104      
                                              64 00 59 00  64 00 59 00               31.1.112      
                                              63 00 58 00  65 00 57 00               31.1.120      
                                              64 00 59 00  60 00 57 00               31.1.128      
                                              62 00 57 00  66 00 57 00               31.1.136      
                                              62 00 59 00  62 00 58 00               31.1.144      
                                              64 00 57 00  66 00 59 00               31.1.152      
                                              68 00 55 00  66 00 55 00               31.1.160      
                                              60 00 57 00  67 00 57 00               31.1.168      
                                              60 00 56 00  64 00 57 00               31.1.176      
                                              62 00 59 00  66 00 56 00               31.1.184      
                                              62 00 56 00  62 00 57 00               31.1.192      
  10.2                         524288  IN     5b 00 52 00  61 00 53 00   12ms        32.1.0        
                                              5e 00 52 00  5c 00 52 00               32.1.8        
                                              5e 00 53 00  5e 00 53 00               32.1.16       
                                              5f 00 51 00  5f 00 54 00               32.1.24       
                                              5f 00 4f 00  60 00 52 00               32.1.32       
                                              5f 00 4f 00  5f 00 53 00               32.1.40       
                                              5d 00 50 00  5e 00 51 00               32.1.48       
                                              61 00 51 00  5c 00 53 00               32.1.56       
                                              60 00 53 00  5c 00 51 00               32.1.64       
                                              5d 00 51 00  5e 00 52 00               32.1.72       
                                              5e 00 53 00  5e 00 53 00               32.1.80       
                                              5e 00 52 00  60 00 54 00               32.1.88       
                                              5e 00 50 00  5f 00 54 00               32.1.96       
                                              5e 00 4f 00  5e 00 4f 00               32.1.104      
                                              5d 00 50 00  5e 00 50 00               32.1.112      
                                              5e 00 52 00  60 00 53 00               32.1.120      
                                              5e 00 51 00  5c 00 51 00               32.1.128      
                                              5d 00 53 00  5f 00 53 00               32.1.136      
                                              5f 00 53 00  60 00 55 00               32.1.144      
                                              5c 00 51 00  60 00 51 00               32.1.152      
                                              60 00 52 00  60 00 53 00               32.1.160      
                                              5c 00 50 00  5c 00 50 00               32.1.168      
                                              5e 00 51 00  5e 00 52 00               32.1.176      
                                              5c 00 54 00  5f 00 51 00               32.1.184      
                                              5d 00 4f 00  5f 00 54 00               32.1.192      
  10.2                         524288  IN     54 00 60 00  4f 00 60 00   12ms        33.1.0        
                                              52 00 5f 00  52 00 5d 00               33.1.8        
                                              53 00 5d 00  52 00 5f 00               33.1.16       
                                              53 00 5f 00  51 00 5c 00               33.1.24       
                                              51 00 5e 00  53 00 5f 00               33.1.32       
                                              53 00 61 00  51 00 60 00               33.1.40       
                                              52 00 60 00  53 00 60 00               33.1.48       
                                              53 00 5e 00  52 00 5e 00               33.1.56       
                                              54 00 5e 00  53 00 60 00               33.1.64       
                                              52 00 60 00  50 00 60 00               33.1.72       
                                              52 00 5e 00  53 00 60 00               33.1.80       
                                              51 00 5f 00  51 00 5f 00               33.1.88       
                                              51 00 5e 00  52 00 5e 00               33.1.96       
                                              54 00 5d 00  50 00 5f 00               33.1.104      
                                              52 00 5f 00  52 00 5f 00               33.1.112      
                                              52 00 5e 00  51 00 5f 00               33.1.120      
                                              52 00 5e 00  52 00 62 00               33.1.128      
                                              50 00 5e 00  54 00 5c 00               33.1.136      
                                              51 00 5f 00  51 00 5e 00               33.1.144      
                                              51 00 5f 00  54 00 5d 00               33.1.152      
                                              53 00 5e 00  51 00 5f 00               33.1.160      
                                              52 00 5d 00  53 00 5e 00               33.1.168      
                                              4f 00 5e 00  51 00 5e 00               33.1.176      
                                              54 00 5d 00  52 00 5e 00               33.1.184      
                                              51 00 60 00  53 00 5e 00               33.1.192      
  10.2                         524288  IN     5e 00 54 00  60 00 53 00   14ms        34.1.0        
                                              5e 00 56 00  60 00 53 00               34.1.8        
                                              60 00 50 00  5e 00 57 00               34.1.16       
                                              5d 00 52 00  5f 00 52 00               34.1.24       
                                              61 00 54 00  5f 00 52 00               34.1.32       
                                              5e 00 50 00  5d 00 51 00               34.1.40       
                                              60 00 54 00  5f 00 51 00               34.1.48       
                                              5f 00 53 00  5e 00 53 00               34.1.56       
                                              5f 00 55 00  5f 00 54 00               34.1.64       
                                              5f 00 53 00  61 00 52 00               34.1.72       
                                              5e 00 51 00  60 00 53 00               34.1.80       
                                              5f 00 53 00  5c 00 53 00               34.1.88       
                                              5e 00 53 00  5e 00 53 00               34.1.96       
                                              5f 00 55 00  5d 00 53 00               34.1.104      
                                              5f 00 53 00  5f 00 53 00               34.1.112      
                                              61 00 53 00  5e 00 51 00               34.1.120      
                                              5f 00 54 00  60 00 52 00               34.1.128      
                                              5f 00 55 00  5f 00 52 00               34.1.136      
                                              60 00 53 00  5f 00 53 00               34.1.144      
                                              5f 00 50 00  5c 00 52 00               34.1.152      
                                              5f 00 54 00  5f 00 53 00               34.1.160      
                                              5e 00 51 00  5e 00 53 00               34.1.168      
                                              5e 00 4f 00  5f 00 51 00               34.1.176      
                                              5e 00 53 00  5f 00 53 00               34.1.184      
                                              5e 00 56 00  5f 00 52 00               34.1.192      
  10.2                         524288  IN     53 00 60 00  51 00 5e 00   12ms        35.1.0        
                                              53 00 5e 00  51 00 5f 00               35.1.8        
                                              51 00 5f 00  54 00 5f 00               35.1.16       
                                              53 00 5f 00  53 00 60 00               35.1.24       
                                              52 00 60 00  53 00 5e 00               35.1.32       
                                              54 00 5e 00  54 00 60 00               35.1.40       
                                              53 00 5e 00  51 00 5f 00               35.1.48       
                                              51 00 60 00  53 00 5f 00               35.1.56       
                                              51 00 5e 00  52 00 5f 00               35.1.64       
                                              51 00 5d 00  52 00 5e 00               35.1.72       
                                              54 00 5f 00  56 00 60 00               35.1.80       
                                              53 00 5f 00  55 00 5c 00               35.1.88       
                                              55 00 5f 00  51 00 5f 00               35.1.96       
                                              52 00 60 00  53 00 60 00               35.1.104      
                                              53 00 5f 00  54 00 5e 00               35.1.112      
                                              53 00 5e 00  53 00 5d 00               35.1.120      
                                              55 00 5e 00  53 00 60 00               35.1.128      
                                              55 00 5f 00  54 00 5f 00               35.1.136      
                                              52 00 62 00  53 00 5f 00               35.1.144      
                                              53 00 5d 00  50 00 5e 00               35.1.152      
                                              54 00 5e 00  52 00 62 00               35.1.160      
                                              53 00 5f 00  51 00 60 00               35.1.168      
                                              56 00 5f 00  52 00 60 00               35.1.176      
                                              4e 00 5d 00  51 00 5f 00               35.1.184      
                                              54 00 63 00  51 00 5f 00               35.1.192      
  10.2                             31  IN     1a 00 00 00  01 00 02 00   47us        36.1.0        
                                              31 84 00 01  04 00 13 1a               36.1.8        
                                              00 00 01 01  04 00 00 00               36.1.16       
                                              00 00 00 55  aa 55 aa                  36.1.24       
  10.2                         524288  IN     60 00 55 00  62 00 55 00  250ms        37.1.0        
                                              62 00 56 00  62 00 55 00               37.1.8        
                                              64 00 55 00  62 00 58 00               37.1.16       
                                              61 00 55 00  62 00 57 00               37.1.24       
                                              5e 00 57 00  62 00 56 00               37.1.32       
                                              61 00 58 00  61 00 57 00               37.1.40       
                                              65 00 58 00  5e 00 56 00               37.1.48       
                                              62 00 59 00  66 00 59 00               37.1.56       
                                              63 00 55 00  63 00 57 00               37.1.64       
                                              64 00 57 00  5f 00 57 00               37.1.72       
                                              64 00 58 00  60 00 57 00               37.1.80       
                                              63 00 57 00  65 00 59 00               37.1.88       
                                              62 00 55 00  62 00 58 00               37.1.96       
                                              63 00 57 00  63 00 56 00               37.1.104      
                                              64 00 5b 00  64 00 58 00               37.1.112      
                                              63 00 5a 00  67 00 59 00               37.1.120      
                                              63 00 5a 00  64 00 57 00               37.1.128      
                                              62 00 59 00  63 00 57 00               37.1.136      
                                              64 00 59 00  62 00 5b 00               37.1.144      
                                              65 00 59 00  68 00 5c 00               37.1.152      
                                              66 00 59 00  60 00 57 00               37.1.160      
                                              61 00 55 00  66 00 59 00               37.1.168      
                                              63 00 57 00  65 00 55 00               37.1.176      
                                              63 00 5a 00  64 00 58 00               37.1.184      
                                              64 00 56 00  64 00 59 00               37.1.192      
  10.2                         524288  IN     5e 00 52 00  5e 00 50 00   11ms        38.1.0        
                                              5d 00 54 00  5e 00 51 00               38.1.8        
                                              5d 00 53 00  5e 00 53 00               38.1.16       
                                              5d 00 50 00  5d 00 51 00               38.1.24       
                                              5f 00 4e 00  60 00 50 00               38.1.32       
                                              5d 00 50 00  5d 00 4f 00               38.1.40       
                                              5f 00 51 00  60 00 51 00               38.1.48       
                                              62 00 4f 00  5c 00 53 00               38.1.56       
                                              5d 00 51 00  5d 00 52 00               38.1.64       
                                              5d 00 50 00  5a 00 51 00               38.1.72       
                                              5e 00 4f 00  5a 00 53 00               38.1.80       
                                              5c 00 51 00  5f 00 52 00               38.1.88       
                                              5e 00 50 00  5d 00 51 00               38.1.96       
                                              5e 00 4f 00  5b 00 53 00               38.1.104      
                                              5f 00 51 00  5c 00 51 00               38.1.112      
                                              5c 00 51 00  5e 00 51 00               38.1.120      
                                              5c 00 50 00  5e 00 52 00               38.1.128      
                                              5f 00 50 00  5c 00 52 00               38.1.136      
                                              5d 00 50 00  5d 00 50 00               38.1.144      
                                              5e 00 51 00  5c 00 51 00               38.1.152      
                                              5c 00 51 00  5e 00 50 00               38.1.160      
                                              5e 00 52 00  5e 00 53 00               38.1.168      
                                              5e 00 52 00  5e 00 4f 00               38.1.176      
                                              5c 00 4f 00  5e 00 51 00               38.1.184      
                                              5d 00 51 00  5f 00 52 00               38.1.192      
  10.2                         524288  IN     56 00 5c 00  52 00 5e 00   13ms        39.1.0        
                                              53 00 5c 00  51 00 5d 00               39.1.8        
                                              53 00 5f 00  53 00 5f 00               39.1.16       
                                              53 00 60 00  53 00 5e 00               39.1.24       
                                              53 00 5e 00  52 00 60 00               39.1.32       
                                              52 00 5f 00  53 00 60 00               39.1.40       
                                              54 00 60 00  51 00 60 00               39.1.48       
                                              54 00 60 00  53 00 5f 00               39.1.56       
                                              53 00 5e 00  51 00 61 00               39.1.64       
                                              51 00 5f 00  51 00 5d 00               39.1.72       
                                              51 00 5e 00  52 00 5d 00               39.1.80       
                                              51 00 5f 00  4f 00 5f 00               39.1.88       
                                              50 00 5f 00  53 00 5b 00               39.1.96       
                                              53 00 60 00  51 00 5e 00               39.1.104      
                                              51 00 5e 00  51 00 5c 00               39.1.112      
                                              52 00 60 00  52 00 60 00               39.1.120      
                                              51 00 5e 00  51 00 5e 00               39.1.128      
                                              52 00 5f 00  51 00 60 00               39.1.136      
                                              51 00 5f 00  4f 00 5e 00               39.1.144      
                                              52 00 5d 00  53 00 60 00               39.1.152      
                                              53 00 5b 00  52 00 5f 00               39.1.160      
                                              52 00 5e 00  53 00 60 00               39.1.168      
                                              51 00 5e 00  52 00 5e 00               39.1.176      
                                              53 00 5e 00  53 00 60 00               39.1.184      
                                              53 00 5e 00  51 00 5e 00               39.1.192      
  10.2                         524288  IN     5e 00 55 00  5e 00 55 00   13ms        40.1.0        
                                              5e 00 57 00  60 00 51 00               40.1.8        
                                              5f 00 52 00  5f 00 54 00               40.1.16       
                                              5f 00 55 00  5d 00 52 00               40.1.24       
                                              60 00 55 00  60 00 54 00               40.1.32       
                                              5e 00 52 00  5e 00 52 00               40.1.40       
                                              61 00 51 00  5e 00 53 00               40.1.48       
                                              5e 00 51 00  5e 00 52 00               40.1.56       
                                              60 00 53 00  5e 00 53 00               40.1.64       
                                              5e 00 56 00  5e 00 53 00               40.1.72       
                                              5e 00 52 00  5e 00 52 00               40.1.80       
                                              5e 00 52 00  5f 00 51 00               40.1.88       
                                              5f 00 53 00  5f 00 55 00               40.1.96       
                                              5f 00 53 00  60 00 52 00               40.1.104      
                                              5e 00 54 00  5f 00 52 00               40.1.112      
                                              5d 00 51 00  61 00 53 00               40.1.120      
                                              5f 00 52 00  61 00 51 00               40.1.128      
                                              5f 00 55 00  60 00 56 00               40.1.136      
                                              5c 00 52 00  60 00 53 00               40.1.144      
                                              5d 00 51 00  5e 00 53 00               40.1.152      
                                              60 00 53 00  5d 00 51 00               40.1.160      
                                              5e 00 53 00  5e 00 51 00               40.1.168      
                                              5e 00 53 00  5e 00 54 00               40.1.176      
                                              61 00 51 00  5c 00 53 00               40.1.184      
                                              5e 00 51 00  5e 00 52 00               40.1.192      
  10.2                         524288  IN     53 00 5e 00  54 00 5e 00   13ms        41.1.0        
                                              50 00 5e 00  51 00 5e 00               41.1.8        
                                              55 00 61 00  53 00 60 00               41.1.16       
                                              53 00 60 00  4f 00 5f 00               41.1.24       
                                              53 00 5e 00  53 00 60 00               41.1.32       
                                              54 00 60 00  54 00 60 00               41.1.40       
                                              52 00 60 00  51 00 5d 00               41.1.48       
                                              50 00 5e 00  53 00 60 00               41.1.56       
                                              53 00 5f 00  51 00 5f 00               41.1.64       
                                              52 00 60 00  51 00 5e 00               41.1.72       
                                              54 00 60 00  53 00 5d 00               41.1.80       
                                              51 00 5e 00  53 00 5e 00               41.1.88       
                                              53 00 60 00  52 00 5f 00               41.1.96       
                                              52 00 5f 00  52 00 5f 00               41.1.104      
                                              55 00 5c 00  51 00 5f 00               41.1.112      
                                              53 00 60 00  53 00 60 00               41.1.120      
                                              53 00 61 00  53 00 61 00               41.1.128      
                                              55 00 61 00  55 00 62 00               41.1.136      
                                              53 00 62 00  54 00 60 00               41.1.144      
                                              4f 00 5e 00  51 00 5e 00               41.1.152      
                                              53 00 5e 00  51 00 5d 00               41.1.160      
                                              51 00 5f 00  53 00 61 00               41.1.168      
                                              52 00 62 00  54 00 5e 00               41.1.176      
                                              53 00 5f 00  52 00 61 00               41.1.184      
                                              54 00 65 00  53 00 5f 00               41.1.192      
  10.2                             31  IN     1a 00 00 00  01 00 02 00   38us        42.1.0        
                                              31 84 00 01  04 00 14 1a               42.1.8        
                                              00 00 01 01  04 00 00 00               42.1.16       
                                              00 00 00 55  aa 55 aa                  42.1.24       
  10.2                         524288  IN     62 00 55 00  61 00 57 00  249ms        43.1.0        
                                              62 00 58 00  61 00 52 00               43.1.8        
                                              62 00 56 00  62 00 59 00               43.1.16       
                                              61 00 54 00  64 00 57 00               43.1.24       
                                              5f 00 57 00  61 00 57 00               43.1.32       
                                              62 00 57 00  62 00 59 00               43.1.40       
                                              66 00 58 00  60 00 56 00               43.1.48       
                                              62 00 56 00  61 00 58 00               43.1.56       
                                              61 00 56 00  64 00 58 00               43.1.64       
                                              65 00 58 00  61 00 56 00               43.1.72       
                                              64 00 56 00  62 00 56 00               43.1.80       
                                              64 00 56 00  66 00 59 00               43.1.88       
                                              60 00 54 00  62 00 54 00               43.1.96       
                                              64 00 55 00  63 00 57 00               43.1.104      
                                              65 00 5a 00  62 00 57 00               43.1.112      
                                              60 00 5a 00  64 00 57 00               43.1.120      
                                              67 00 59 00  64 00 56 00               43.1.128      
                                              60 00 56 00  65 00 58 00               43.1.136      
                                              63 00 58 00  64 00 5b 00               43.1.144      
                                              62 00 56 00  66 00 58 00               43.1.152      
                                              62 00 58 00  62 00 54 00               43.1.160      
                                              60 00 56 00  64 00 58 00               43.1.168      
                                              61 00 59 00  66 00 56 00               43.1.176      
                                              64 00 59 00  64 00 56 00               43.1.184      
                                              62 00 57 00  64 00 56 00               43.1.192      
  10.2                         524288  IN     5e 00 54 00  60 00 53 00   13ms        44.1.0        
                                              5c 00 4f 00  5c 00 50 00               44.1.8        
                                              5f 00 52 00  60 00 53 00               44.1.16       
                                              5f 00 51 00  5d 00 53 00               44.1.24       
                                              5e 00 52 00  5e 00 51 00               44.1.32       
                                              5c 00 51 00  5e 00 4f 00               44.1.40       
                                              5f 00 51 00  5b 00 51 00               44.1.48       
                                              5f 00 52 00  5c 00 52 00               44.1.56       
                                              5f 00 51 00  5e 00 53 00               44.1.64       
                                              5c 00 50 00  5e 00 51 00               44.1.72       
                                              5d 00 53 00  5e 00 51 00               44.1.80       
                                              5c 00 55 00  5d 00 54 00               44.1.88       
                                              5c 00 4f 00  5c 00 4f 00               44.1.96       
                                              5e 00 50 00  5a 00 51 00               44.1.104      
                                              5c 00 53 00  5d 00 52 00               44.1.112      
                                              5c 00 50 00  5e 00 51 00               44.1.120      
                                              60 00 51 00  5e 00 53 00               44.1.128      
                                              5e 00 51 00  5c 00 50 00               44.1.136      
                                              5e 00 50 00  5c 00 52 00               44.1.144      
                                              5d 00 4f 00  60 00 51 00               44.1.152      
                                              5e 00 4d 00  5d 00 51 00               44.1.160      
                                              5d 00 51 00  5c 00 50 00               44.1.168      
                                              5c 00 50 00  5c 00 53 00               44.1.176      
                                              5f 00 51 00  5c 00 50 00               44.1.184      
                                              5e 00 4e 00  5e 00 52 00               44.1.192      
  10.2                         524288  IN     54 00 5d 00  50 00 60 00   13ms        45.1.0        
                                              53 00 60 00  51 00 5f 00               45.1.8        
                                              51 00 5f 00  53 00 5e 00               45.1.16       
                                              52 00 60 00  53 00 5e 00               45.1.24       
                                              53 00 60 00  51 00 5f 00               45.1.32       
                                              51 00 5f 00  53 00 5f 00               45.1.40       
                                              53 00 5f 00  52 00 5e 00               45.1.48       
                                              52 00 5e 00  52 00 5c 00               45.1.56       
                                              53 00 5f 00  54 00 60 00               45.1.64       
                                              52 00 5f 00  52 00 5f 00               45.1.72       
                                              53 00 5d 00  53 00 5f 00               45.1.80       
                                              51 00 60 00  53 00 5e 00               45.1.88       
                                              53 00 60 00  54 00 5d 00               45.1.96       
                                              54 00 5e 00  52 00 5f 00               45.1.104      
                                              51 00 5f 00  51 00 60 00               45.1.112      
                                              51 00 5d 00  54 00 5e 00               45.1.120      
                                              53 00 5f 00  4f 00 5f 00               45.1.128      
                                              52 00 5f 00  53 00 5c 00               45.1.136      
                                              53 00 61 00  52 00 5c 00               45.1.144      
                                              51 00 5e 00  53 00 5c 00               45.1.152      
                                              53 00 5d 00  51 00 5e 00               45.1.160      
                                              55 00 60 00  53 00 5e 00               45.1.168      
                                              53 00 5e 00  51 00 5e 00               45.1.176      
                                              52 00 5e 00  51 00 5f 00               45.1.184      
                                              53 00 60 00  51 00 60 00               45.1.192      
  10.2                         524288  IN     60 00 52 00  5f 00 53 00   12ms        46.1.0        
                                              5d 00 51 00  60 00 51 00               46.1.8        
                                              5f 00 54 00  5e 00 53 00               46.1.16       
                                              5e 00 53 00  5e 00 53 00               46.1.24       
                                              60 00 57 00  60 00 53 00               46.1.32       
                                              5f 00 50 00  60 00 53 00               46.1.40       
                                              60 00 53 00  5f 00 53 00               46.1.48       
                                              5f 00 55 00  5c 00 52 00               46.1.56       
                                              60 00 55 00  60 00 53 00               46.1.64       
                                              5e 00 51 00  61 00 52 00               46.1.72       
                                              61 00 54 00  63 00 52 00               46.1.80       
                                              5f 00 52 00  62 00 52 00               46.1.88       
                                              61 00 53 00  60 00 55 00               46.1.96       
                                              60 00 55 00  5e 00 53 00               46.1.104      
                                              5d 00 54 00  5e 00 52 00               46.1.112      
                                              5d 00 51 00  5e 00 52 00               46.1.120      
                                              5e 00 53 00  60 00 51 00               46.1.128      
                                              5f 00 52 00  5d 00 55 00               46.1.136      
                                              5d 00 51 00  5e 00 53 00               46.1.144      
                                              60 00 52 00  5f 00 53 00               46.1.152      
                                              60 00 53 00  5f 00 51 00               46.1.160      
                                              5f 00 53 00  5f 00 51 00               46.1.168      
                                              5f 00 51 00  5f 00 51 00               46.1.176      
                                              60 00 51 00  5f 00 54 00               46.1.184      
                                              5f 00 52 00  5f 00 53 00               46.1.192      
  10.2                         524288  IN     53 00 5f 00  51 00 60 00   13ms        47.1.0        
                                              50 00 62 00  53 00 60 00               47.1.8        
                                              53 00 5e 00  53 00 5e 00               47.1.16       
                                              52 00 5f 00  52 00 60 00               47.1.24       
                                              54 00 60 00  54 00 5d 00               47.1.32       
                                              53 00 5e 00  55 00 61 00               47.1.40       
                                              53 00 5f 00  53 00 61 00               47.1.48       
                                              52 00 5e 00  53 00 5e 00               47.1.56       
                                              52 00 60 00  53 00 5c 00               47.1.64       
                                              52 00 5f 00  53 00 5d 00               47.1.72       
                                              53 00 5f 00  52 00 60 00               47.1.80       
                                              54 00 5f 00  55 00 60 00               47.1.88       
                                              52 00 5f 00  55 00 5d 00               47.1.96       
                                              51 00 5f 00  53 00 62 00               47.1.104      
                                              52 00 5e 00  56 00 60 00               47.1.112      
                                              53 00 5f 00  52 00 5e 00               47.1.120      
                                              52 00 60 00  53 00 60 00               47.1.128      
                                              55 00 5f 00  53 00 5f 00               47.1.136      
                                              53 00 60 00  52 00 5f 00               47.1.144      
                                              53 00 5e 00  53 00 5c 00               47.1.152      
                                              55 00 5e 00  53 00 62 00               47.1.160      
                                              53 00 5e 00  51 00 62 00               47.1.168      
                                              53 00 60 00  52 00 5f 00               47.1.176      
                                              53 00 5f 00  4f 00 5d 00               47.1.184      
                                              53 00 62 00  53 00 60 00               47.1.192      
  10.2                             31  IN     1a 00 00 00  01 00 02 00   35us        48.1.0        
                                              31 84 00 01  04 00 15 1a               48.1.8        
                                              00 00 01 01  04 00 00 00               48.1.16       
                                              00 00 00 55  aa 55 aa                  48.1.24       
  10.2                         524288  IN     61 00 55 00  5f 00 53 00  249ms        49.1.0        
                                              61 00 53 00  61 00 55 00               49.1.8        
                                              61 00 54 00  62 00 57 00               49.1.16       
                                              61 00 55 00  64 00 56 00               49.1.24       
                                              61 00 58 00  62 00 56 00               49.1.32       
                                              61 00 58 00  62 00 57 00               49.1.40       
                                              65 00 58 00  61 00 57 00               49.1.48       
                                              63 00 57 00  65 00 57 00               49.1.56       
                                              62 00 55 00  62 00 59 00               49.1.64       
                                              63 00 56 00  64 00 56 00               49.1.72       
                                              64 00 57 00  60 00 56 00               49.1.80       
                                              65 00 55 00  65 00 57 00               49.1.88       
                                              63 00 55 00  63 00 57 00               49.1.96       
                                              63 00 58 00  64 00 55 00               49.1.104      
                                              64 00 59 00  65 00 56 00               49.1.112      
                                              63 00 57 00  66 00 58 00               49.1.120      
                                              66 00 57 00  63 00 56 00               49.1.128      
                                              61 00 58 00  64 00 55 00               49.1.136      
                                              60 00 57 00  65 00 5b 00               49.1.144      
                                              64 00 57 00  64 00 58 00               49.1.152      
                                              64 00 57 00  64 00 55 00               49.1.160      
                                              60 00 53 00  66 00 58 00               49.1.168      
                                              61 00 55 00  65 00 57 00               49.1.176      
                                              64 00 59 00  65 00 59 00               49.1.184      
                                              64 00 57 00  66 00 55 00               49.1.192      
  10.2                         524288  IN     5d 00 52 00  5e 00 51 00   13ms        50.1.0        
                                              5f 00 53 00  5d 00 51 00               50.1.8        
                                              5f 00 53 00  5d 00 53 00               50.1.16       
                                              5c 00 51 00  5e 00 53 00               50.1.24       
                                              5e 00 4f 00  5e 00 53 00               50.1.32       
                                              5c 00 51 00  5f 00 4f 00               50.1.40       
                                              5e 00 53 00  5e 00 4f 00               50.1.48       
                                              62 00 4f 00  5d 00 53 00               50.1.56       
                                              5f 00 50 00  5f 00 51 00               50.1.64       
                                              5c 00 50 00  5f 00 4e 00               50.1.72       
                                              5e 00 51 00  5c 00 50 00               50.1.80       
                                              5e 00 54 00  5f 00 52 00               50.1.88       
                                              5c 00 51 00  5e 00 51 00               50.1.96       
                                              60 00 51 00  5f 00 52 00               50.1.104      
                                              5f 00 51 00  5e 00 4f 00               50.1.112      
                                              5c 00 51 00  5f 00 51 00               50.1.120      
                                              5d 00 52 00  5e 00 52 00               50.1.128      
                                              5e 00 52 00  5e 00 4f 00               50.1.136      
                                              60 00 51 00  5c 00 52 00               50.1.144      
                                              5c 00 51 00  5d 00 53 00               50.1.152      
                                              5e 00 53 00  5e 00 53 00               50.1.160      
                                              5b 00 53 00  5d 00 51 00               50.1.168      
                                              5f 00 51 00  5c 00 52 00               50.1.176      
                                              5d 00 4f 00  5c 00 51 00               50.1.184      
                                              5c 00 50 00  5e 00 53 00               50.1.192      
  10.2                         524288  IN     56 00 5e 00  4f 00 5c 00   12ms        51.1.0        
                                              4f 00 5e 00  50 00 5e 00               51.1.8        
                                              50 00 5f 00  50 00 5f 00               51.1.16       
                                              50 00 60 00  4f 00 5e 00               51.1.24       
                                              51 00 5f 00  52 00 5e 00               51.1.32       
                                              51 00 60 00  51 00 5e 00               51.1.40       
                                              51 00 5e 00  4f 00 5e 00               51.1.48       
                                              53 00 5e 00  51 00 5e 00               51.1.56       
                                              51 00 5c 00  51 00 62 00               51.1.64       
                                              52 00 5d 00  52 00 5f 00               51.1.72       
                                              52 00 5e 00  4f 00 5e 00               51.1.80       
                                              53 00 5e 00  53 00 5e 00               51.1.88       
                                              51 00 5f 00  51 00 5e 00               51.1.96       
                                              54 00 5b 00  52 00 60 00               51.1.104      
                                              52 00 60 00  4d 00 5f 00               51.1.112      
                                              51 00 5d 00  4f 00 5c 00               51.1.120      
                                              52 00 5e 00  51 00 5e 00               51.1.128      
                                              51 00 5e 00  4f 00 60 00               51.1.136      
                                              52 00 5d 00  51 00 5e 00               51.1.144      
                                              51 00 5e 00  53 00 5e 00               51.1.152      
                                              52 00 5e 00  53 00 5d 00               51.1.160      
                                              54 00 5d 00  52 00 5d 00               51.1.168      
                                              50 00 5e 00  51 00 60 00               51.1.176      
                                              53 00 60 00  51 00 5c 00               51.1.184      
                                              53 00 60 00  51 00 5f 00               51.1.192      
  10.2                         524288  IN     5c 00 53 00  60 00 53 00   13ms        52.1.0        
                                              5f 00 52 00  61 00 52 00               52.1.8        
                                              60 00 54 00  60 00 53 00               52.1.16       
                                              5c 00 51 00  60 00 53 00               52.1.24       
                                              5e 00 54 00  60 00 53 00               52.1.32       
                                              5c 00 53 00  5e 00 53 00               52.1.40       
                                              61 00 55 00  61 00 52 00               52.1.48       
                                              5e 00 53 00  61 00 53 00               52.1.56       
                                              61 00 53 00  62 00 53 00               52.1.64       
                                              61 00 55 00  62 00 53 00               52.1.72       
                                              5e 00 55 00  5f 00 51 00               52.1.80       
                                              5e 00 53 00  60 00 53 00               52.1.88       
                                              60 00 53 00  5f 00 54 00               52.1.96       
                                              5e 00 54 00  5c 00 53 00               52.1.104      
                                              5f 00 52 00  5e 00 53 00               52.1.112      
                                              5f 00 55 00  5f 00 51 00               52.1.120      
                                              5c 00 51 00  60 00 53 00               52.1.128      
                                              60 00 55 00  60 00 55 00               52.1.136      
                                              5f 00 51 00  60 00 53 00               52.1.144      
                                              60 00 52 00  5f 00 53 00               52.1.152      
                                              61 00 51 00  5e 00 52 00               52.1.160      
                                              5d 00 52 00  5e 00 51 00               52.1.168      
                                              60 00 53 00  5e 00 51 00               52.1.176      
                                              60 00 51 00  5e 00 51 00               52.1.184      
                                              60 00 51 00  5f 00 53 00               52.1.192      
  10.2                         524288  IN     50 00 5d 00  51 00 5e 00   12ms        53.1.0        
                                              53 00 5e 00  53 00 5d 00               53.1.8        
                                              51 00 60 00  51 00 5e 00               53.1.16       
                                              51 00 5e 00  51 00 5f 00               53.1.24       
                                              52 00 5e 00  56 00 5e 00               53.1.32       
                                              53 00 5e 00  51 00 5f 00               53.1.40       
                                              53 00 5e 00  52 00 61 00               53.1.48       
                                              53 00 5d 00  53 00 5f 00               53.1.56       
                                              50 00 5e 00  52 00 60 00               53.1.64       
                                              51 00 5c 00  54 00 5e 00               53.1.72       
                                              51 00 5e 00  53 00 60 00               53.1.80       
                                              53 00 5e 00  53 00 60 00               53.1.88       
                                              54 00 5f 00  51 00 5e 00               53.1.96       
                                              52 00 5e 00  54 00 5e 00               53.1.104      
                                              50 00 5e 00  51 00 5e 00               53.1.112      
                                              53 00 5c 00  53 00 5f 00               53.1.120      
                                              51 00 5e 00  52 00 60 00               53.1.128      
                                              53 00 5c 00  53 00 60 00               53.1.136      
                                              51 00 60 00  52 00 5f 00               53.1.144      
                                              51 00 5f 00  51 00 5e 00               53.1.152      
                                              52 00 5e 00  51 00 60 00               53.1.160      
                                              51 00 5e 00  4e 00 62 00               53.1.168      
                                              55 00 5f 00  4f 00 5f 00               53.1.176      
                                              4f 00 60 00  53 00 5e 00               53.1.184      
                                              51 00 62 00  53 00 5e 00               53.1.192      
  10.2                             31  IN     1a 00 00 00  01 00 02 00   44us        54.1.0        
                                              31 84 00 01  04 00 16 1a               54.1.8        
                                              00 00 01 01  04 00 00 00               54.1.16       
                                              00 00 00 55  aa 55 aa                  54.1.24       
  10.2                         524288  IN     62 00 54 00  61 00 56 00  249ms        55.1.0        
                                              5f 00 58 00  60 00 54 00               55.1.8        
                                              63 00 55 00  61 00 57 00               55.1.16       
                                              63 00 55 00  64 00 55 00               55.1.24       
                                              5e 00 56 00  63 00 56 00               55.1.32       
                                              63 00 59 00  62 00 5a 00               55.1.40       
                                              64 00 57 00  61 00 55 00               55.1.48       
                                              62 00 56 00  64 00 5a 00               55.1.56       
                                              63 00 55 00  64 00 56 00               55.1.64       
                                              63 00 56 00  63 00 54 00               55.1.72       
                                              64 00 57 00  63 00 57 00               55.1.80       
                                              64 00 55 00  66 00 58 00               55.1.88       
                                              62 00 57 00  63 00 54 00               55.1.96       
                                              62 00 58 00  63 00 57 00               55.1.104      
                                              64 00 5b 00  64 00 58 00               55.1.112      
                                              64 00 5a 00  64 00 57 00               55.1.120      
                                              65 00 58 00  62 00 56 00               55.1.128      
                                              60 00 56 00  65 00 57 00               55.1.136      
                                              62 00 57 00  64 00 5b 00               55.1.144      
                                              64 00 57 00  66 00 5b 00               55.1.152      
                                              64 00 57 00  62 00 56 00               55.1.160      
                                              60 00 55 00  63 00 59 00               55.1.168      
                                              62 00 58 00  64 00 55 00               55.1.176      
                                              65 00 59 00  66 00 58 00               55.1.184      
                                              65 00 55 00  63 00 57 00               55.1.192      
  10.2                         524288  IN     5f 00 50 00  5c 00 52 00   13ms        56.1.0        
                                              5e 00 51 00  5c 00 51 00               56.1.8        
                                              5f 00 52 00  60 00 52 00               56.1.16       
                                              5e 00 53 00  5c 00 53 00               56.1.24       
                                              5f 00 53 00  5c 00 50 00               56.1.32       
                                              5e 00 51 00  5c 00 53 00               56.1.40       
                                              60 00 53 00  5e 00 51 00               56.1.48       
                                              5e 00 52 00  5c 00 50 00               56.1.56       
                                              61 00 50 00  5e 00 51 00               56.1.64       
                                              60 00 51 00  5c 00 51 00               56.1.72       
                                              5e 00 51 00  5d 00 4f 00               56.1.80       
                                              5c 00 53 00  5c 00 51 00               56.1.88       
                                              5e 00 51 00  5c 00 53 00               56.1.96       
                                              5e 00 4f 00  5f 00 4f 00               56.1.104      
                                              5c 00 4f 00  5f 00 50 00               56.1.112      
                                              5c 00 51 00  5d 00 51 00               56.1.120      
                                              5f 00 51 00  5e 00 51 00               56.1.128      
                                              5e 00 50 00  5e 00 51 00               56.1.136      
                                              5d 00 51 00  5e 00 53 00               56.1.144      
                                              5d 00 52 00  5d 00 53 00               56.1.152      
                                              5d 00 51 00  5e 00 51 00               56.1.160      
                                              5e 00 51 00  5c 00 51 00               56.1.168      
                                              5e 00 52 00  5c 00 4f 00               56.1.176      
                                              5d 00 51 00  5d 00 51 00               56.1.184      
                                              5d 00 4e 00  5d 00 53 00               56.1.192      
  10.2                         524288  IN     57 00 5e 00  4f 00 5f 00   12ms        57.1.0        
                                              50 00 5e 00  4f 00 5d 00               57.1.8        
                                              52 00 5c 00  53 00 62 00               57.1.16       
                                              52 00 60 00  54 00 5f 00               57.1.24       
                                              51 00 5d 00  54 00 60 00               57.1.32       
                                              52 00 60 00  51 00 5f 00               57.1.40       
                                              52 00 5f 00  52 00 5f 00               57.1.48       
                                              53 00 60 00  51 00 5e 00               57.1.56       
                                              52 00 5e 00  51 00 60 00               57.1.64       
                                              52 00 5e 00  52 00 5f 00               57.1.72       
                                              51 00 5e 00  51 00 5e 00               57.1.80       
                                              54 00 60 00  51 00 5f 00               57.1.88       
                                              51 00 5f 00  51 00 5f 00               57.1.96       
                                              52 00 60 00  51 00 5e 00               57.1.104      
                                              53 00 5e 00  53 00 5e 00               57.1.112      
                                              54 00 60 00  51 00 5f 00               57.1.120      
                                              52 00 5e 00  52 00 5e 00               57.1.128      
                                              51 00 5d 00  52 00 5f 00               57.1.136      
                                              53 00 5f 00  53 00 5c 00               57.1.144      
                                              52 00 5e 00  53 00 5f 00               57.1.152      
                                              53 00 5f 00  51 00 5f 00               57.1.160      
                                              53 00 5d 00  4f 00 5d 00               57.1.168      
                                              52 00 62 00  50 00 5d 00               57.1.176      
                                              52 00 5e 00  51 00 5d 00               57.1.184      
                                              53 00 60 00  55 00 5f 00               57.1.192      
  10.2                         524288  IN     5d 00 53 00  5d 00 51 00   12ms        58.1.0        
                                              5d 00 52 00  5f 00 50 00               58.1.8        
                                              5d 00 54 00  5e 00 51 00               58.1.16       
                                              5d 00 51 00  5f 00 51 00               58.1.24       
                                              5e 00 50 00  5e 00 52 00               58.1.32       
                                              5d 00 52 00  5c 00 52 00               58.1.40       
                                              5e 00 53 00  5d 00 54 00               58.1.48       
                                              5e 00 52 00  5d 00 4f 00               58.1.56       
                                              60 00 53 00  5f 00 51 00               58.1.64       
                                              5c 00 52 00  60 00 52 00               58.1.72       
                                              5e 00 51 00  5e 00 51 00               58.1.80       
                                              5a 00 4f 00  5e 00 51 00               58.1.88       
                                              5c 00 50 00  5f 00 51 00               58.1.96       
                                              60 00 51 00  5f 00 52 00               58.1.104      
                                              5f 00 51 00  5f 00 50 00               58.1.112      
                                              5d 00 51 00  5c 00 50 00               58.1.120      
                                              5f 00 51 00  5f 00 53 00               58.1.128      
                                              5e 00 55 00  5e 00 53 00               58.1.136      
                                              5f 00 53 00  5f 00 51 00               58.1.144      
                                              5c 00 52 00  5c 00 51 00               58.1.152      
                                              5e 00 51 00  5e 00 53 00               58.1.160      
                                              5d 00 51 00  5f 00 51 00               58.1.168      
                                              5e 00 4e 00  5e 00 52 00               58.1.176      
                                              60 00 54 00  5f 00 50 00               58.1.184      
                                              5d 00 4f 00  5e 00 51 00               58.1.192      
  10.2                         524288  IN     53 00 5f 00  50 00 5e 00   13ms        59.1.0        
                                              52 00 60 00  52 00 5e 00               59.1.8        
                                              55 00 5e 00  53 00 5c 00               59.1.16       
                                              51 00 5f 00  50 00 5e 00               59.1.24       
                                              51 00 60 00  52 00 5f 00               59.1.32       
                                              54 00 5c 00  53 00 62 00               59.1.40       
                                              52 00 5c 00  52 00 60 00               59.1.48       
                                              51 00 5f 00  53 00 5e 00               59.1.56       
                                              51 00 5f 00  54 00 5f 00               59.1.64       
                                              50 00 5f 00  53 00 5e 00               59.1.72       
                                              52 00 5c 00  54 00 5e 00               59.1.80       
                                              53 00 5d 00  54 00 5f 00               59.1.88       
                                              55 00 61 00  53 00 5e 00               59.1.96       
                                              51 00 60 00  51 00 64 00               59.1.104      
                                              53 00 60 00  52 00 5d 00               59.1.112      
                                              52 00 60 00  51 00 5f 00               59.1.120      
                                              55 00 5d 00  53 00 60 00               59.1.128      
                                              52 00 5f 00  53 00 60 00               59.1.136      
                                              53 00 5f 00  52 00 60 00               59.1.144      
                                              52 00 5e 00  52 00 5c 00               59.1.152      
                                              52 00 5e 00  4f 00 5f 00               59.1.160      
                                              53 00 5e 00  53 00 61 00               59.1.168      
                                              55 00 5f 00  53 00 61 00               59.1.176      
                                              51 00 5f 00  51 00 5f 00               59.1.184      
                                              50 00 60 00  52 00 5d 00               59.1.192      
  10.2                             31  IN     1a 00 00 00  01 00 02 00   43us        60.1.0        
                                              31 84 00 01  04 00 17 1a               60.1.8        
                                              00 00 01 01  04 00 00 00               60.1.16       
                                              00 00 00 55  aa 55 aa                  60.1.24       
  10.2                         524288  IN     61 00 55 00  5d 00 55 00  249ms        61.1.0        
                                              60 00 57 00  62 00 56 00               61.1.8        
                                              60 00 57 00  62 00 55 00               61.1.16       
                                              60 00 53 00  61 00 56 00               61.1.24       
                                              5e 00 57 00  62 00 55 00               61.1.32       
                                              62 00 58 00  61 00 59 00               61.1.40       
                                              64 00 5b 00  63 00 58 00               61.1.48       
                                              61 00 58 00  63 00 5b 00               61.1.56       
                                              64 00 55 00  62 00 58 00               61.1.64       
                                              64 00 57 00  63 00 58 00               61.1.72       
                                              61 00 58 00  61 00 57 00               61.1.80       
                                              64 00 59 00  62 00 57 00               61.1.88       
                                              62 00 57 00  61 00 56 00               61.1.96       
                                              64 00 57 00  64 00 55 00               61.1.104      
                                              65 00 5a 00  65 00 56 00               61.1.112      
                                              64 00 58 00  67 00 57 00               61.1.120      
                                              63 00 55 00  63 00 53 00               61.1.128      
                                              60 00 59 00  62 00 59 00               61.1.136      
                                              61 00 57 00  63 00 5b 00               61.1.144      
                                              65 00 58 00  64 00 5a 00               61.1.152      
                                              65 00 59 00  63 00 53 00               61.1.160      
                                              60 00 56 00  66 00 5a 00               61.1.168      
                                              62 00 58 00  63 00 58 00               61.1.176      
                                              64 00 59 00  66 00 58 00               61.1.184      
                                              64 00 54 00  62 00 57 00               61.1.192      
  10.2                         524288  IN     5c 00 50 00  5d 00 4f 00   13ms        62.1.0        
                                              5d 00 52 00  5f 00 50 00               62.1.8        
                                              5f 00 51 00  60 00 54 00               62.1.16       
                                              5e 00 51 00  5c 00 53 00               62.1.24       
                                              5c 00 51 00  5e 00 50 00               62.1.32       
                                              5e 00 4f 00  5e 00 53 00               62.1.40       
                                              5e 00 51 00  5e 00 50 00               62.1.48       
                                              60 00 52 00  5c 00 51 00               62.1.56       
                                              5c 00 51 00  5e 00 53 00               62.1.64       
                                              5e 00 53 00  5c 00 51 00               62.1.72       
                                              5d 00 52 00  5d 00 51 00               62.1.80       
                                              5d 00 52 00  60 00 4f 00               62.1.88       
                                              5f 00 52 00  5f 00 51 00               62.1.96       
                                              5d 00 51 00  5d 00 53 00               62.1.104      
                                              5e 00 50 00  5c 00 50 00               62.1.112      
                                              5c 00 52 00  5c 00 51 00               62.1.120      
                                              5f 00 4f 00  5c 00 51 00               62.1.128      
                                              5f 00 51 00  5e 00 50 00               62.1.136      
                                              5d 00 51 00  5c 00 51 00               62.1.144      
                                              5b 00 50 00  5d 00 51 00               62.1.152      
                                              5d 00 51 00  5d 00 55 00               62.1.160      
                                              5d 00 53 00  5a 00 51 00               62.1.168      
                                              5c 00 51 00  5e 00 4f 00               62.1.176      
                                              5c 00 52 00  5e 00 51 00               62.1.184      
                                              5d 00 52 00  5e 00 50 00               62.1.192      
  10.2                         524288  IN     53 00 60 00  4f 00 5d 00   13ms        63.1.0        
                                              51 00 5c 00  52 00 5e 00               63.1.8        
                                              54 00 5e 00  50 00 5e 00               63.1.16       
                                              50 00 60 00  51 00 5e 00               63.1.24       
                                              50 00 5f 00  50 00 5e 00               63.1.32       
                                              53 00 5f 00  53 00 60 00               63.1.40       
                                              50 00 5f 00  52 00 61 00               63.1.48       
                                              53 00 62 00  53 00 5f 00               63.1.56       
                                              53 00 5e 00  53 00 5f 00               63.1.64       
                                              54 00 5e 00  54 00 5e 00               63.1.72       
                                              50 00 5e 00  53 00 5e 00               63.1.80       
                                              53 00 60 00  51 00 60 00               63.1.88       
                                              50 00 60 00  50 00 5e 00               63.1.96       
                                              53 00 5e 00  52 00 5e 00               63.1.104      
                                              52 00 5c 00  53 00 5d 00               63.1.112      
                                              51 00 5e 00  51 00 5e 00               63.1.120      
                                              53 00 5e 00  53 00 60 00               63.1.128      
                                              50 00 5e 00  52 00 5e 00               63.1.136      
                                              50 00 5f 00  52 00 5b 00               63.1.144      
                                              50 00 60 00  50 00 5e 00               63.1.152      
                                              52 00 5f 00  53 00 5e 00               63.1.160      
                                              53 00 5c 00  53 00 5e 00               63.1.168      
                                              51 00 5e 00  53 00 5e 00               63.1.176      
                                              53 00 5e 00  53 00 5e 00               63.1.184      
                                              52 00 60 00  51 00 5e 00               63.1.192      
  10.2                         524288  IN     5d 00 52 00  5d 00 53 00   12ms        64.1.0        
                                              5e 00 52 00  61 00 52 00               64.1.8        
                                              5f 00 55 00  5d 00 52 00               64.1.16       
                                              5e 00 54 00  5d 00 53 00               64.1.24       
                                              5e 00 55 00  5f 00 51 00               64.1.32       
                                              5e 00 51 00  60 00 51 00               64.1.40       
                                              5e 00 51 00  5e 00 52 00               64.1.48       
                                              5d 00 51 00  60 00 52 00               64.1.56       
                                              61 00 52 00  5e 00 53 00               64.1.64       
                                              5f 00 53 00  5f 00 53 00               64.1.72       
                                              5f 00 52 00  5f 00 53 00               64.1.80       
                                              5f 00 51 00  5d 00 51 00               64.1.88       
                                              5d 00 52 00  5e 00 53 00               64.1.96       
                                              61 00 50 00  5d 00 52 00               64.1.104      
                                              5e 00 55 00  5b 00 53 00               64.1.112      
                                              5f 00 55 00  5c 00 4f 00               64.1.120      
                                              5e 00 51 00  61 00 52 00               64.1.128      
                                              5f 00 51 00  5d 00 52 00               64.1.136      
                                              60 00 53 00  5f 00 53 00               64.1.144      
                                              5e 00 52 00  5c 00 55 00               64.1.152      
                                              60 00 53 00  60 00 52 00               64.1.160      
                                              5f 00 53 00  5e 00 53 00               64.1.168      
                                              60 00 54 00  5f 00 53 00               64.1.176      
                                              5e 00 53 00  5e 00 52 00               64.1.184      
                                              5e 00 51 00  5f 00 51 00               64.1.192      
  10.2                         524288  IN     53 00 5e 00  52 00 5d 00   13ms        65.1.0        
                                              50 00 5e 00  53 00 5e 00               65.1.8        
                                              53 00 5e 00  51 00 5f 00               65.1.16       
                                              53 00 5f 00  51 00 5e 00               65.1.24       
                                              51 00 61 00  53 00 5d 00               65.1.32       
                                              51 00 60 00  53 00 5c 00               65.1.40       
                                              51 00 5f 00  53 00 5e 00               65.1.48       
                                              52 00 5f 00  53 00 5c 00               65.1.56       
                                              52 00 5c 00  52 00 5c 00               65.1.64       
                                              52 00 5d 00  52 00 5d 00               65.1.72       
                                              4f 00 5f 00  52 00 5f 00               65.1.80       
                                              51 00 5e 00  52 00 5e 00               65.1.88       
                                              54 00 60 00  53 00 5f 00               65.1.96       
                                              52 00 5f 00  52 00 5f 00               65.1.104      
                                              51 00 5f 00  53 00 5e 00               65.1.112      
                                              52 00 60 00  51 00 5d 00               65.1.120      
                                              52 00 5e 00  54 00 60 00               65.1.128      
                                              51 00 5e 00  51 00 5e 00               65.1.136      
                                              54 00 60 00  52 00 5e 00               65.1.144      
                                              51 00 5f 00  53 00 5d 00               65.1.152      
                                              52 00 5e 00  51 00 5e 00               65.1.160      
                                              53 00 5e 00  52 00 61 00               65.1.168      
                                              55 00 5e 00  4f 00 5e 00               65.1.176      
                                              51 00 5f 00  50 00 5f 00               65.1.184      
                                              51 00 60 00  51 00 60 00               65.1.192      
  10.2                             31  IN     1a 00 00 00  01 00 02 00   50us        66.1.0        
                                              31 84 00 01  04 00 18 1a               66.1.8        
                                              00 00 01 01  04 00 00 00               66.1.16       
                                              00 00 00 55  aa 55 aa                  66.1.24       
  10.0                                 CTL    80 06 00 01  00 00 12 00  116ms        67.1.0        
  10.0                             18  IN     12 01 00 02  00 00 00 40  103us        67.2.0        
                                              48 44 70 56  40 1b 01 02               67.2.8        
                                              00 01                                  67.2.16       
  10.0                                 CTL    80 06 00 03  00 00 02 00   15us        68.1.0        
  10.0                              2  IN     04 03                      43us        68.2.0        
  10.0                                 CTL    80 06 00 03  00 00 04 00   13us        69.1.0        
  10.0                              4  IN     04 03 09 04                44us        69.2.0        
  10.0                                 CTL    80 06 01 03  09 04 02 00    9us        70.1.0        
  10.0                              2  IN     06 03                      65us        70.2.0        
  10.0                                 CTL    80 06 01 03  09 04 06 00   11us        71.1.0        
  10.0                              6  IN     06 03 54 00  33 00         65us        71.2.0        
  10.0                                 CTL    80 06 02 03  09 04 02 00   25us        72.1.0        
  10.0                              2  IN     1a 03                      91us        72.2.0        
  10.0                                 CTL    80 06 02 03  09 04 1a 00   12us        73.1.0        
  10.0                             26  IN     1a 03 52 00  48 00 31 00   71us        73.2.0        
                                              30 00 31 00  35 00 30 00               73.2.8        
                                              30 00 35 00  30 00 32 00               73.2.16       
                                              31 00                                  73.2.24       
  10.0                                 CTL    80 06 00 03  09 04 02 00   12us        74.1.0        
  10.0                              2  IN     04 03                      44us        74.2.0        
  10.0                                 CTL    80 06 00 03  09 04 04 00   11us        75.1.0        
  10.0                              4  IN     04 03 09 04                51us        75.2.0        
  10.0                                 CTL    80 06 02 03  09 04 02 00  580us        76.1.0        
  10.0                              2  IN     1a 03                      73us        76.2.0        
  10.0                                 CTL    80 06 02 03  09 04 1a 00   10us        77.1.0        
  10.0                             26  IN     1a 03 52 00  48 00 31 00   66us        77.2.0        
                                              30 00 31 00  35 00 30 00               77.2.8        
                                              30 00 35 00  30 00 32 00               77.2.16       
                                              31 00                                  77.2.24       
  10.0                                 CTL    80 06 01 03  00 00 20 00  143us        78.1.0        
  10.0                              6  IN     06 03 54 00  33 00         72us        78.2.0        
  10.0                                 CTL    c0 e1 00 00  00 00 04 00   22us        79.1.0        
  10.0                              4  IN     03 0b 00 00               1.5ms        79.2.0        
  10.0                                 CTL    c0 b4 00 00  00 00 01 00   22us        80.1.0(2)     
  10.0                              1  IN     54                         81us        80.2.0        
  10.0                                 CTL    c0 e1 00 00  04 00 40 00  108us        82.1.0        
  10.0                             64  IN     00 00 00 00  01 01 00 00  4.0ms        82.2.0        
                                              0f 44 61 68  65 6e 67 20               82.2.8        
                                              49 6d 61 67  69 6e 67 00               82.2.16       
                                              20 00 00 00  01 01 00 00               82.2.24       
                                              0f 4d 45 52  2d 31 33 30               82.2.32       
                                              2d 33 30 55  4d 2d 4c 00               82.2.40       
                                              80 00 00 00  01 01 00 00               82.2.48       
                                              0d 52 48 31  30 31 35 30               82.2.56       
  10.0                                 CTL    c0 b4 00 00  00 00 01 00   32us        83.1.0(2)     
  10.0                              1  IN     54                         72us        83.2.0        
  10.0                                 CTL    c0 e1 00 00  44 00 40 00  160us        85.1.0        
  10.0                             64  IN     30 35 30 32  31 00 90 00  4.0ms        85.2.0        
                                              00 00 01 01  00 00 03 36               85.2.8        
                                              37 00 04 01  00 00 01 01               85.2.16       
                                              00 00 0a 31  32 33 34 56               85.2.24       
                                              33 32 30 33  00 14 01 00               85.2.32       
                                              00 01 01 00  00 0e 31 2e               85.2.40       
                                              31 2e 31 33  30 35 2e 39               85.2.48       
                                              33 30 31 00  00 02 00 00               85.2.56       
  10.0                                 CTL    c0 b4 00 00  00 00 01 00   44us        86.1.0(2)     
  10.0                              1  IN     54                         75us        86.2.0        
  10.0                                 CTL    80 06 02 03  00 00 20 00  129us        88.1.0        
  10.0                             26  IN     1a 03 52 00  48 00 31 00   77us        88.2.0        
                                              30 00 31 00  35 00 30 00               88.2.8        
                                              30 00 35 00  30 00 32 00               88.2.16       
                                              31 00                                  88.2.24       
  10.0                                 CTL    80 06 00 01  00 00 12 00  824us        89.1.0        
  10.0                             18  IN     12 01 00 02  00 00 00 40   55us        89.2.0        
                                              48 44 70 56  40 1b 01 02               89.2.8        
                                              00 01                                  89.2.16       
  10.0                                 CTL    80 06 00 03  00 00 02 00   17us        90.1.0        
  10.0                              2  IN     04 03                      53us        90.2.0        
  10.0                                 CTL    80 06 00 03  00 00 04 00    9us        91.1.0        
  10.0                              4  IN     04 03 09 04                45us        91.2.0        
  10.0                                 CTL    80 06 01 03  09 04 02 00   12us        92.1.0        
  10.0                              2  IN     06 03                      70us        92.2.0        
  10.0                                 CTL    80 06 01 03  09 04 06 00   11us        93.1.0        
  10.0                              6  IN     06 03 54 00  33 00         68us        93.2.0        
  10.0                                 CTL    80 06 02 03  09 04 02 00   14us        94.1.0        
  10.0                              2  IN     1a 03                      64us        94.2.0        
  10.0                                 CTL    80 06 02 03  09 04 1a 00   11us        95.1.0        
  10.0                             26  IN     1a 03 52 00  48 00 31 00   66us        95.2.0        
                                              30 00 31 00  35 00 30 00               95.2.8        
                                              30 00 35 00  30 00 32 00               95.2.16       
                                              31 00                                  95.2.24       
  10.0                                 CTL    80 06 00 03  09 04 02 00   11us        96.1.0        
  10.0                              2  IN     04 03                      43us        96.2.0        
  10.0                                 CTL    80 06 00 03  09 04 04 00   14us        97.1.0        
  10.0                              4  IN     04 03 09 04                49us        97.2.0        
  10.0                                 CTL    80 06 02 03  09 04 02 00  541us        98.1.0        
  10.0                              2  IN     1a 03                      83us        98.2.0        
  10.0                                 CTL    80 06 02 03  09 04 1a 00    8us        99.1.0        
  10.0                             26  IN     1a 03 52 00  48 00 31 00   66us        99.2.0        
                                              30 00 31 00  35 00 30 00               99.2.8        
                                              30 00 35 00  30 00 32 00               99.2.16       
                                              31 00                                  99.2.24       
  10.0                                 CTL    80 06 01 03  00 00 20 00  133us       100.1.0        
  10.0                              6  IN     06 03 54 00  33 00         72us       100.2.0        
  10.0                                 CTL    c0 e1 00 00  00 00 04 00   20us       101.1.0        
  10.0                              4  IN     03 0b 00 00               1.5ms       101.2.0        
  10.0                                 CTL    c0 b4 00 00  00 00 01 00   40us       102.1.0(2)     
  10.0                              1  IN     54                         85us       102.2.0        
  10.0                                 CTL    c0 e1 00 00  04 00 40 00  107us       104.1.0        
  10.0                             64  IN     00 00 00 00  01 01 00 00  4.0ms       104.2.0        
                                              0f 44 61 68  65 6e 67 20              104.2.8        
                                              49 6d 61 67  69 6e 67 00              104.2.16       
                                              20 00 00 00  01 01 00 00              104.2.24       
                                              0f 4d 45 52  2d 31 33 30              104.2.32       
                                              2d 33 30 55  4d 2d 4c 00              104.2.40       
                                              80 00 00 00  01 01 00 00              104.2.48       
                                              0d 52 48 31  30 31 35 30              104.2.56       
  10.0                                 CTL    c0 b4 00 00  00 00 01 00   35us       105.1.0(2)     
  10.0                              1  IN     54                         87us       105.2.0        
  10.0                                 CTL    c0 e1 00 00  44 00 40 00  153us       107.1.0        
  10.0                             64  IN     30 35 30 32  31 00 90 00  4.0ms       107.2.0        
                                              00 00 01 01  00 00 03 36              107.2.8        
                                              37 00 04 01  00 00 01 01              107.2.16       
                                              00 00 0a 31  32 33 34 56              107.2.24       
                                              33 32 30 33  00 14 01 00              107.2.32       
                                              00 01 01 00  00 0e 31 2e              107.2.40       
                                              31 2e 31 33  30 35 2e 39              107.2.48       
                                              33 30 31 00  00 02 00 00              107.2.56       
  10.0                                 CTL    c0 b4 00 00  00 00 01 00   34us       108.1.0(2)     
  10.0                              1  IN     54                         74us       108.2.0        
  10.0                                 CTL    80 06 02 03  00 00 20 00  139us       110.1.0        
  10.0                             26  IN     1a 03 52 00  48 00 31 00  123us       110.2.0        
                                              30 00 31 00  35 00 30 00              110.2.8        
                                              30 00 35 00  30 00 32 00              110.2.16       
                                              31 00                                 110.2.24       
  10.2                         524288  IN     60 00 54 00  62 00 57 00  108ms       111.1.0        
                                              60 00 55 00  62 00 53 00              111.1.8        
                                              62 00 57 00  61 00 56 00              111.1.16       
                                              61 00 53 00  62 00 55 00              111.1.24       
                                              60 00 57 00  63 00 58 00              111.1.32       
                                              61 00 57 00  62 00 59 00              111.1.40       
                                              68 00 57 00  63 00 58 00              111.1.48       
                                              62 00 58 00  64 00 5a 00              111.1.56       
                                              62 00 55 00  64 00 56 00              111.1.64       
                                              64 00 55 00  62 00 53 00              111.1.72       
                                              63 00 56 00  61 00 57 00              111.1.80       
                                              61 00 56 00  62 00 58 00              111.1.88       
                                              60 00 57 00  60 00 56 00              111.1.96       
                                              61 00 55 00  64 00 53 00              111.1.104      
                                              65 00 5c 00  66 00 57 00              111.1.112      
                                              64 00 59 00  64 00 5a 00              111.1.120      
                                              63 00 59 00  63 00 56 00              111.1.128      
                                              63 00 55 00  63 00 59 00              111.1.136      
                                              63 00 56 00  63 00 57 00              111.1.144      
                                              61 00 57 00  65 00 57 00              111.1.152      
                                              65 00 59 00  64 00 55 00              111.1.160      
                                              61 00 54 00  65 00 55 00              111.1.168      
                                              62 00 56 00  64 00 59 00              111.1.176      
                                              63 00 59 00  66 00 57 00              111.1.184      
                                              64 00 57 00  62 00 55 00              111.1.192      
  10.2                         524288  IN     5e 00 55 00  5c 00 50 00   12ms       112.1.0        
                                              5e 00 51 00  5e 00 51 00              112.1.8        
                                              60 00 51 00  5e 00 52 00              112.1.16       
                                              5e 00 54 00  62 00 51 00              112.1.24       
                                              5e 00 51 00  5e 00 51 00              112.1.32       
                                              5f 00 52 00  5c 00 54 00              112.1.40       
                                              5f 00 54 00  5d 00 53 00              112.1.48       
                                              62 00 52 00  5d 00 51 00              112.1.56       
                                              5d 00 51 00  5c 00 53 00              112.1.64       
                                              5f 00 53 00  5d 00 4f 00              112.1.72       
                                              60 00 50 00  5e 00 53 00              112.1.80       
                                              5c 00 52 00  5e 00 53 00              112.1.88       
                                              5e 00 53 00  5e 00 51 00              112.1.96       
                                              60 00 53 00  5f 00 50 00              112.1.104      
                                              5f 00 51 00  5e 00 52 00              112.1.112      
                                              5c 00 51 00  5f 00 51 00              112.1.120      
                                              60 00 53 00  5c 00 51 00              112.1.128      
                                              5d 00 51 00  5e 00 51 00              112.1.136      
                                              60 00 4f 00  5f 00 53 00              112.1.144      
                                              5c 00 52 00  5c 00 52 00              112.1.152      
                                              5f 00 4f 00  5f 00 52 00              112.1.160      
                                              5c 00 50 00  5e 00 51 00              112.1.168      
                                              5d 00 52 00  5c 00 50 00              112.1.176      
                                              5f 00 51 00  60 00 53 00              112.1.184      
                                              5e 00 52 00  5e 00 53 00              112.1.192      
  10.2                         524288  IN     53 00 5f 00  52 00 60 00   12ms       113.1.0        
                                              51 00 5e 00  51 00 60 00              113.1.8        
                                              51 00 5f 00  52 00 60 00              113.1.16       
                                              50 00 60 00  52 00 5f 00              113.1.24       
                                              53 00 5f 00  51 00 5f 00              113.1.32       
                                              53 00 5d 00  53 00 5e 00              113.1.40       
                                              53 00 5e 00  53 00 60 00              113.1.48       
                                              54 00 60 00  55 00 61 00              113.1.56       
                                              51 00 60 00  53 00 61 00              113.1.64       
                                              54 00 61 00  52 00 5c 00              113.1.72       
                                              4f 00 5f 00  54 00 5c 00              113.1.80       
                                              53 00 60 00  53 00 5f 00              113.1.88       
                                              51 00 61 00  53 00 5e 00              113.1.96       
                                              55 00 5e 00  52 00 5f 00              113.1.104      
                                              54 00 5f 00  53 00 5f 00              113.1.112      
                                              55 00 60 00  53 00 5e 00              113.1.120      
                                              53 00 60 00  52 00 5e 00              113.1.128      
                                              52 00 60 00  50 00 5c 00              113.1.136      
                                              51 00 5f 00  51 00 5e 00              113.1.144      
                                              54 00 5f 00  52 00 5e 00              113.1.152      
                                              52 00 5e 00  51 00 5d 00              113.1.160      
                                              55 00 5f 00  52 00 5b 00              113.1.168      
                                              52 00 5f 00  51 00 5d 00              113.1.176      
                                              52 00 5e 00  52 00 5e 00              113.1.184      
                                              53 00 5e 00  51 00 5f 00              113.1.192      
  10.2                         524288  IN     60 00 52 00  5f 00 51 00   13ms       114.1.0        
                                              5e 00 51 00  60 00 53 00              114.1.8        
                                              5f 00 52 00  5d 00 53 00              114.1.16       
                                              60 00 52 00  60 00 55 00              114.1.24       
                                              5f 00 55 00  5e 00 52 00              114.1.32       
                                              5e 00 51 00  5e 00 51 00              114.1.40       
                                              5e 00 55 00  5f 00 50 00              114.1.48       
                                              5d 00 53 00  5d 00 55 00              114.1.56       
                                              5e 00 51 00  60 00 52 00              114.1.64       
                                              5e 00 54 00  62 00 54 00              114.1.72       
                                              61 00 53 00  5f 00 53 00              114.1.80       
                                              5e 00 53 00  5e 00 52 00              114.1.88       
                                              5e 00 55 00  60 00 51 00              114.1.96       
                                              5f 00 52 00  5d 00 50 00              114.1.104      
                                              5f 00 54 00  5c 00 51 00              114.1.112      
                                              5e 00 54 00  5d 00 53 00              114.1.120      
                                              5e 00 52 00  62 00 52 00              114.1.128      
                                              5d 00 51 00  5f 00 57 00              114.1.136      
                                              5c 00 53 00  5e 00 53 00              114.1.144      
                                              5f 00 51 00  5d 00 51 00              114.1.152      
                                              5e 00 52 00  60 00 52 00              114.1.160      
                                              60 00 51 00  5c 00 52 00              114.1.168      
                                              60 00 52 00  61 00 53 00              114.1.176      
                                              61 00 51 00  5f 00 53 00              114.1.184      
                                              5e 00 53 00  5e 00 52 00              114.1.192      
  10.2                         524288  IN     4f 00 5c 00  53 00 5f 00   13ms       115.1.0        
                                              53 00 61 00  53 00 60 00              115.1.8        
                                              53 00 5f 00  55 00 60 00              115.1.16       
                                              51 00 5f 00  51 00 5f 00              115.1.24       
                                              51 00 5e 00  53 00 5d 00              115.1.32       
                                              53 00 5d 00  51 00 5e 00              115.1.40       
                                              53 00 5e 00  50 00 61 00              115.1.48       
                                              50 00 5c 00  53 00 5e 00              115.1.56       
                                              53 00 5e 00  52 00 5f 00              115.1.64       
                                              51 00 5f 00  54 00 5f 00              115.1.72       
                                              54 00 5e 00  55 00 5e 00              115.1.80       
                                              51 00 5e 00  54 00 5e 00              115.1.88       
                                              53 00 5f 00  53 00 5e 00              115.1.96       
                                              52 00 60 00  52 00 5f 00              115.1.104      
                                              52 00 5e 00  52 00 60 00              115.1.112      
                                              52 00 5f 00  53 00 5c 00              115.1.120      
                                              54 00 5f 00  51 00 5f 00              115.1.128      
                                              54 00 5f 00  54 00 5f 00              115.1.136      
                                              52 00 60 00  52 00 5e 00              115.1.144      
                                              50 00 5e 00  52 00 5e 00              115.1.152      
                                              51 00 5e 00  51 00 5e 00              115.1.160      
                                              51 00 60 00  51 00 63 00              115.1.168      
                                              53 00 60 00  51 00 5d 00              115.1.176      
                                              51 00 60 00  52 00 5f 00              115.1.184      
                                              53 00 61 00  51 00 5f 00              115.1.192      
  10.2                             31  IN     1a 00 00 00  01 00 02 00   36us       116.1.0        
                                              31 84 00 01  04 00 19 1a              116.1.8        
                                              00 00 01 01  04 00 00 00              116.1.16       
                                              00 00 00 55  aa 55 aa                 116.1.24       
  10.2                         524288  IN     61 00 55 00  5e 00 53 00  249ms       117.1.0        
                                              60 00 56 00  62 00 54 00              117.1.8        
                                              64 00 56 00  61 00 55 00              117.1.16       
                                              61 00 51 00  65 00 54 00              117.1.24       
                                              61 00 56 00  65 00 55 00              117.1.32       
                                              60 00 59 00  60 00 57 00              117.1.40       
                                              64 00 57 00  62 00 54 00              117.1.48       
                                              64 00 57 00  64 00 5a 00              117.1.56       
                                              63 00 56 00  62 00 59 00              117.1.64       
                                              64 00 59 00  62 00 56 00              117.1.72       
                                              63 00 53 00  5f 00 57 00              117.1.80       
                                              64 00 56 00  64 00 58 00              117.1.88       
                                              62 00 57 00  64 00 55 00              117.1.96       
                                              63 00 58 00  66 00 57 00              117.1.104      
                                              64 00 5b 00  64 00 58 00              117.1.112      
                                              64 00 59 00  64 00 59 00              117.1.120      
                                              63 00 57 00  63 00 54 00              117.1.128      
                                              61 00 58 00  66 00 55 00              117.1.136      
                                              64 00 57 00  63 00 58 00              117.1.144      
                                              63 00 5a 00  66 00 5a 00              117.1.152      
                                              66 00 56 00  63 00 56 00              117.1.160      
                                              61 00 53 00  62 00 59 00              117.1.168      
                                              60 00 56 00  67 00 57 00              117.1.176      
                                              64 00 59 00  66 00 57 00              117.1.184      
                                              64 00 55 00  64 00 57 00              117.1.192      
  10.2                         524288  IN     5f 00 50 00  5e 00 50 00   12ms       118.1.0        
                                              5d 00 53 00  5d 00 53 00              118.1.8        
                                              5e 00 50 00  5f 00 50 00              118.1.16       
                                              5c 00 51 00  5f 00 51 00              118.1.24       
                                              5f 00 4f 00  5e 00 52 00              118.1.32       
                                              5d 00 50 00  5e 00 51 00              118.1.40       
                                              5f 00 53 00  5d 00 50 00              118.1.48       
                                              5e 00 52 00  5e 00 51 00              118.1.56       
                                              5e 00 52 00  5c 00 52 00              118.1.64       
                                              5d 00 53 00  5f 00 50 00              118.1.72       
                                              5e 00 51 00  5c 00 53 00              118.1.80       
                                              60 00 51 00  5d 00 53 00              118.1.88       
                                              5e 00 50 00  5d 00 50 00              118.1.96       
                                              60 00 51 00  5e 00 50 00              118.1.104      
                                              5e 00 50 00  5e 00 50 00              118.1.112      
                                              5e 00 51 00  5c 00 52 00              118.1.120      
                                              5c 00 52 00  60 00 52 00              118.1.128      
                                              5f 00 51 00  5e 00 51 00              118.1.136      
                                              5e 00 51 00  5e 00 53 00              118.1.144      
                                              5c 00 52 00  5c 00 50 00              118.1.152      
                                              5e 00 52 00  5c 00 50 00              118.1.160      
                                              5d 00 50 00  5a 00 52 00              118.1.168      
                                              5c 00 51 00  5d 00 53 00              118.1.176      
                                              5b 00 51 00  5d 00 51 00              118.1.184      
                                              5f 00 51 00  5d 00 51 00              118.1.192      
  10.2                         524288  IN     56 00 5e 00  51 00 60 00   13ms       119.1.0        
                                              50 00 5f 00  51 00 5e 00              119.1.8        
                                              52 00 5f 00  53 00 5e 00              119.1.16       
                                              51 00 5c 00  53 00 5f 00              119.1.24       
                                              51 00 5d 00  52 00 5f 00              119.1.32       
                                              52 00 5e 00  53 00 5e 00              119.1.40       
                                              52 00 5f 00  50 00 60 00              119.1.48       
                                              54 00 60 00  53 00 5e 00              119.1.56       
                                              52 00 5e 00  53 00 62 00              119.1.64       
                                              53 00 5e 00  51 00 5e 00              119.1.72       
                                              52 00 5e 00  54 00 5f 00              119.1.80       
                                              50 00 60 00  50 00 60 00              119.1.88       
                                              53 00 5f 00  52 00 5c 00              119.1.96       
                                              52 00 5e 00  52 00 5e 00              119.1.104      
                                              53 00 60 00  51 00 5e 00              119.1.112      
                                              50 00 5e 00  51 00 5f 00              119.1.120      
                                              52 00 5c 00  51 00 5f 00              119.1.128      
                                              50 00 5e 00  51 00 5c 00              119.1.136      
                                              52 00 5e 00  53 00 5d 00              119.1.144      
                                              52 00 5d 00  52 00 5c 00              119.1.152      
                                              51 00 5c 00  52 00 5c 00              119.1.160      
                                              53 00 5e 00  52 00 5f 00              119.1.168      
                                              4f 00 60 00  51 00 60 00              119.1.176      
                                              51 00 5f 00  51 00 5e 00              119.1.184      
                                              53 00 5d 00  53 00 5d 00              119.1.192      
  10.2                         524288  IN     60 00 51 00  5e 00 53 00   12ms       120.1.0        
                                              5d 00 52 00  62 00 52 00              120.1.8        
                                              5d 00 52 00  5e 00 51 00              120.1.16       
                                              5c 00 53 00  5d 00 51 00              120.1.24       
                                              60 00 53 00  5f 00 53 00              120.1.32       
                                              5e 00 50 00  5c 00 51 00              120.1.40       
                                              60 00 51 00  5c 00 53 00              120.1.48       
                                              5f 00 53 00  5f 00 51 00              120.1.56       
                                              5e 00 53 00  62 00 53 00              120.1.64       
                                              5d 00 51 00  60 00 51 00              120.1.72       
                                              5e 00 51 00  5c 00 54 00              120.1.80       
                                              5d 00 51 00  5f 00 51 00              120.1.88       
                                              5f 00 53 00  60 00 52 00              120.1.96       
                                              60 00 51 00  5f 00 52 00              120.1.104      
                                              5d 00 53 00  5e 00 53 00              120.1.112      
                                              5d 00 53 00  60 00 52 00              120.1.120      
                                              5e 00 53 00  5e 00 50 00              120.1.128      
                                              61 00 53 00  5f 00 53 00              120.1.136      
                                              5b 00 52 00  60 00 51 00              120.1.144      
                                              5c 00 51 00  5e 00 51 00              120.1.152      
                                              5f 00 55 00  5d 00 50 00              120.1.160      
                                              60 00 52 00  5f 00 52 00              120.1.168      
                                              5c 00 53 00  5e 00 54 00              120.1.176      
                                              60 00 51 00  5f 00 53 00              120.1.184      
                                              60 00 51 00  5f 00 51 00              120.1.192      
  10.2                         524288  IN     54 00 5f 00  54 00 5e 00   12ms       121.1.0        
                                              50 00 60 00  50 00 60 00              121.1.8        
                                              52 00 5e 00  50 00 62 00              121.1.16       
                                              53 00 60 00  53 00 5e 00              121.1.24       
                                              53 00 5e 00  52 00 5f 00              121.1.32       
                                              52 00 5f 00  55 00 5d 00              121.1.40       
                                              52 00 5e 00  52 00 5f 00              121.1.48       
                                              52 00 5c 00  53 00 5d 00              121.1.56       
                                              51 00 5f 00  52 00 5e 00              121.1.64       
                                              51 00 5f 00  51 00 60 00              121.1.72       
                                              51 00 60 00  52 00 60 00              121.1.80       
                                              54 00 60 00  54 00 60 00              121.1.88       
                                              53 00 61 00  56 00 5f 00              121.1.96       
                                              53 00 60 00  51 00 61 00              121.1.104      
                                              52 00 60 00  52 00 5e 00              121.1.112      
                                              52 00 5e 00  51 00 60 00              121.1.120      
                                              55 00 60 00  54 00 5f 00              121.1.128      
                                              53 00 5e 00  53 00 62 00              121.1.136      
                                              53 00 62 00  52 00 5e 00              121.1.144      
                                              53 00 5f 00  52 00 5f 00              121.1.152      
                                              51 00 5d 00  51 00 60 00              121.1.160      
                                              52 00 5f 00  52 00 62 00              121.1.168      
                                              53 00 61 00  52 00 5e 00              121.1.176      
                                              51 00 60 00  51 00 60 00              121.1.184      
                                              52 00 62 00  51 00 5e 00              121.1.192      
  10.2                             31  IN     1a 00 00 00  01 00 02 00   40us       122.1.0        
                                              31 84 00 01  04 00 1a 1a              122.1.8        
                                              00 00 01 01  04 00 00 00              122.1.16       
                                              00 00 00 55  aa 55 aa                 122.1.24       
  10.0                                 CTL    40 ce 00 00  58 04 04 00  237ms       123.1.0        
  10.0                              4  OUT    f0 49 02 00               1.1ms       123.2.0        
  10.0                                 CTL    c0 b4 00 00  00 00 01 00   35us       124.1.0(2)     
  10.0                              1  IN     54                        164us       124.2.0        
  10.2                         524288  IN     62 00 54 00  5f 00 55 00   11ms       126.1.0        
                                              5f 00 55 00  63 00 56 00              126.1.8        
                                              64 00 55 00  5f 00 58 00              126.1.16       
                                              62 00 56 00  62 00 56 00              126.1.24       
                                              5f 00 54 00  63 00 57 00              126.1.32       
                                              60 00 56 00  63 00 57 00              126.1.40       
                                              65 00 59 00  62 00 57 00              126.1.48       
                                              64 00 55 00  62 00 59 00              126.1.56       
                                              64 00 57 00  64 00 56 00              126.1.64       
                                              64 00 56 00  5f 00 57 00              126.1.72       
                                              64 00 55 00  63 00 57 00              126.1.80       
                                              63 00 57 00  64 00 58 00              126.1.88       
                                              63 00 54 00  63 00 56 00              126.1.96       
                                              61 00 57 00  62 00 57 00              126.1.104      
                                              62 00 5b 00  64 00 58 00              126.1.112      
                                              64 00 57 00  63 00 58 00              126.1.120      
                                              63 00 58 00  63 00 55 00              126.1.128      
                                              62 00 55 00  62 00 58 00              126.1.136      
                                              64 00 57 00  64 00 5a 00              126.1.144      
                                              65 00 57 00  65 00 59 00              126.1.152      
                                              68 00 57 00  63 00 59 00              126.1.160      
                                              61 00 55 00  63 00 59 00              126.1.168      
                                              62 00 56 00  64 00 55 00              126.1.176      
                                              63 00 59 00  66 00 57 00              126.1.184      
                                              60 00 54 00  64 00 57 00              126.1.192      
  10.2                         524288  IN     60 00 53 00  5f 00 51 00   12ms       127.1.0        
                                              5f 00 53 00  5e 00 53 00              127.1.8        
                                              60 00 52 00  5f 00 51 00              127.1.16       
                                              5d 00 52 00  5e 00 53 00              127.1.24       
                                              5f 00 53 00  5d 00 51 00              127.1.32       
                                              5f 00 51 00  60 00 51 00              127.1.40       
                                              60 00 50 00  5f 00 53 00              127.1.48       
                                              60 00 51 00  5c 00 52 00              127.1.56       
                                              5e 00 53 00  5e 00 53 00              127.1.64       
                                              5f 00 53 00  5e 00 50 00              127.1.72       
                                              5e 00 52 00  5d 00 53 00              127.1.80       
                                              5f 00 53 00  5c 00 54 00              127.1.88       
                                              5d 00 52 00  5e 00 53 00              127.1.96       
                                              5f 00 51 00  5d 00 51 00              127.1.104      
                                              60 00 53 00  5f 00 51 00              127.1.112      
                                              5e 00 51 00  5e 00 53 00              127.1.120      
                                              60 00 52 00  5e 00 52 00              127.1.128      
                                              60 00 50 00  5e 00 51 00              127.1.136      
                                              60 00 51 00  61 00 4f 00              127.1.144      
                                              5e 00 51 00  5e 00 51 00              127.1.152      
                                              5f 00 51 00  5e 00 53 00              127.1.160      
                                              5e 00 51 00  60 00 4f 00              127.1.168      
                                              5e 00 53 00  5c 00 52 00              127.1.176      
                                              5f 00 52 00  5e 00 52 00              127.1.184      
                                              5d 00 50 00  5f 00 53 00              127.1.192      
  10.2                         524288  IN     56 00 60 00  53 00 5e 00   13ms       128.1.0        
                                              50 00 60 00  52 00 5f 00              128.1.8        
                                              51 00 5c 00  4f 00 5f 00              128.1.16       
                                              50 00 61 00  54 00 5f 00              128.1.24       
                                              52 00 60 00  50 00 5d 00              128.1.32       
                                              4f 00 60 00  53 00 60 00              128.1.40       
                                              52 00 5f 00  52 00 60 00              128.1.48       
                                              53 00 60 00  53 00 5d 00              128.1.56       
                                              52 00 5f 00  52 00 5f 00              128.1.64       
                                              53 00 5e 00  53 00 5e 00              128.1.72       
                                              51 00 5f 00  50 00 60 00              128.1.80       
                                              52 00 5f 00  53 00 60 00              128.1.88       
                                              50 00 60 00  51 00 5c 00              128.1.96       
                                              53 00 5e 00  51 00 5e 00              128.1.104      
                                              51 00 5f 00  52 00 5d 00              128.1.112      
                                              53 00 5f 00  51 00 5e 00              128.1.120      
                                              54 00 5e 00  50 00 62 00              128.1.128      
                                              51 00 60 00  53 00 5c 00              128.1.136      
                                              52 00 5f 00  51 00 5d 00              128.1.144      
                                              52 00 5f 00  52 00 5e 00              128.1.152      
                                              51 00 5d 00  51 00 5c 00              128.1.160      
                                              51 00 5d 00  52 00 5f 00              128.1.168      
                                              51 00 5f 00  52 00 5d 00              128.1.176      
                                              50 00 5e 00  53 00 60 00              128.1.184      
                                              53 00 5e 00  53 00 60 00              128.1.192      
  10.2                         524288  IN     5e 00 53 00  5e 00 50 00   12ms       129.1.0        
                                              5e 00 52 00  5f 00 51 00              129.1.8        
                                              5e 00 53 00  60 00 53 00              129.1.16       
                                              5e 00 54 00  5e 00 53 00              129.1.24       
                                              5e 00 54 00  5d 00 52 00              129.1.32       
                                              5d 00 50 00  5d 00 50 00              129.1.40       
                                              5e 00 51 00  5c 00 53 00              129.1.48       
                                              5e 00 51 00  5d 00 53 00              129.1.56       
                                              60 00 53 00  5d 00 51 00              129.1.64       
                                              5e 00 53 00  60 00 51 00              129.1.72       
                                              5f 00 53 00  5f 00 51 00              129.1.80       
                                              5e 00 50 00  5c 00 50 00              129.1.88       
                                              5b 00 53 00  60 00 51 00              129.1.96       
                                              5f 00 51 00  5e 00 4f 00              129.1.104      
                                              5e 00 52 00  5e 00 52 00              129.1.112      
                                              5c 00 50 00  5e 00 4f 00              129.1.120      
                                              5e 00 51 00  5f 00 51 00              129.1.128      
                                              5d 00 51 00  5e 00 52 00              129.1.136      
                                              5e 00 51 00  5f 00 51 00              129.1.144      
                                              5a 00 51 00  5d 00 50 00              129.1.152      
                                              5d 00 51 00  5e 00 51 00              129.1.160      
                                              61 00 55 00  5c 00 52 00              129.1.168      
                                              5f 00 53 00  5f 00 51 00              129.1.176      
                                              60 00 51 00  60 00 52 00              129.1.184      
                                              5c 00 51 00  60 00 50 00              129.1.192      
  10.2                         524288  IN     53 00 5d 00  51 00 5f 00   12ms       130.1.0        
                                              53 00 5f 00  51 00 5e 00              130.1.8        
                                              52 00 5e 00  53 00 60 00              130.1.16       
                                              51 00 60 00  52 00 5f 00              130.1.24       
                                              51 00 60 00  53 00 5e 00              130.1.32       
                                              53 00 5e 00  54 00 60 00              130.1.40       
                                              54 00 5d 00  53 00 5f 00              130.1.48       
                                              53 00 5d 00  53 00 61 00              130.1.56       
                                              51 00 5f 00  52 00 5c 00              130.1.64       
                                              53 00 5d 00  53 00 5e 00              130.1.72       
                                              53 00 60 00  55 00 5e 00              130.1.80       
                                              53 00 5e 00  55 00 60 00              130.1.88       
                                              53 00 60 00  54 00 60 00              130.1.96       
                                              50 00 5e 00  52 00 60 00              130.1.104      
                                              53 00 5e 00  51 00 5e 00              130.1.112      
                                              51 00 5e 00  4f 00 5e 00              130.1.120      
                                              53 00 60 00  53 00 60 00              130.1.128      
                                              53 00 60 00  54 00 61 00              130.1.136      
                                              53 00 5f 00  51 00 5f 00              130.1.144      
                                              53 00 60 00  53 00 5f 00              130.1.152      
                                              55 00 60 00  51 00 62 00              130.1.160      
                                              52 00 5e 00  53 00 61 00              130.1.168      
                                              53 00 5f 00  52 00 60 00              130.1.176      
                                              53 00 60 00  50 00 60 00              130.1.184      
                                              53 00 63 00  52 00 5d 00              130.1.192      
  10.2                             31  IN     1a 00 00 00  01 00 02 00   37us       131.1.0        
                                              31 84 00 01  04 00 1b 1a              131.1.8        
                                              00 00 01 01  04 00 00 00              131.1.16       
                                              00 00 00 55  aa 55 aa                 131.1.24       
  10.2                         524288  IN     63 00 55 00  61 00 53 00  249ms       132.1.0        
                                              62 00 53 00  61 00 53 00              132.1.8        
                                              62 00 56 00  62 00 57 00              132.1.16       
                                              5f 00 55 00  62 00 56 00              132.1.24       
                                              61 00 55 00  62 00 54 00              132.1.32       
                                              61 00 56 00  61 00 59 00              132.1.40       
                                              68 00 55 00  62 00 58 00              132.1.48       
                                              63 00 56 00  65 00 5a 00              132.1.56       
                                              64 00 57 00  62 00 58 00              132.1.64       
                                              64 00 56 00  60 00 55 00              132.1.72       
                                              64 00 58 00  63 00 55 00              132.1.80       
                                              63 00 59 00  65 00 59 00              132.1.88       
                                              62 00 53 00  60 00 55 00              132.1.96       
                                              61 00 57 00  64 00 55 00              132.1.104      
                                              62 00 5d 00  64 00 57 00              132.1.112      
                                              62 00 57 00  64 00 59 00              132.1.120      
                                              63 00 58 00  62 00 55 00              132.1.128      
                                              62 00 59 00  63 00 57 00              132.1.136      
                                              63 00 58 00  64 00 58 00              132.1.144      
                                              62 00 57 00  66 00 5b 00              132.1.152      
                                              64 00 58 00  64 00 57 00              132.1.160      
                                              60 00 55 00  66 00 59 00              132.1.168      
                                              62 00 56 00  64 00 56 00              132.1.176      
                                              63 00 5c 00  67 00 59 00              132.1.184      
                                              64 00 55 00  63 00 58 00              132.1.192      
  10.2                         524288  IN     5e 00 53 00  5f 00 53 00   13ms       133.1.0        
                                              5d 00 52 00  5c 00 54 00              133.1.8        
                                              5f 00 53 00  5e 00 51 00              133.1.16       
                                              5e 00 50 00  5e 00 52 00              133.1.24       
                                              5e 00 4f 00  5e 00 4f 00              133.1.32       
                                              5c 00 51 00  5c 00 4f 00              133.1.40       
                                              5e 00 51 00  61 00 4f 00              133.1.48       
                                              5f 00 52 00  5e 00 51 00              133.1.56       
                                              5e 00 53 00  5c 00 53 00              133.1.64       
                                              5e 00 51 00  5c 00 52 00              133.1.72       
                                              60 00 53 00  5d 00 51 00              133.1.80       
                                              5d 00 53 00  5d 00 51 00              133.1.88       
                                              5f 00 51 00  60 00 54 00              133.1.96       
                                              60 00 51 00  5f 00 52 00              133.1.104      
                                              5e 00 51 00  5e 00 4f 00              133.1.112      
                                              5c 00 52 00  5d 00 51 00              133.1.120      
                                              5e 00 4f 00  5e 00 50 00              133.1.128      
                                              5e 00 50 00  60 00 52 00              133.1.136      
                                              5e 00 51 00  5d 00 52 00              133.1.144      
                                              5e 00 51 00  5e 00 52 00              133.1.152      
                                              5e 00 51 00  60 00 52 00              133.1.160      
                                              5c 00 4f 00  5d 00 53 00              133.1.168      
                                              5e 00 52 00  5f 00 52 00              133.1.176      
                                              5f 00 51 00  5c 00 51 00              133.1.184      
                                              5e 00 50 00  5b 00 54 00              133.1.192      
  10.2                         524288  IN     53 00 5e 00  51 00 5e 00   12ms       134.1.0        
                                              51 00 5f 00  4e 00 5d 00              134.1.8        
                                              4f 00 5e 00  55 00 60 00              134.1.16       
                                              52 00 60 00  51 00 5f 00              134.1.24       
                                              52 00 5e 00  50 00 5e 00              134.1.32       
                                              51 00 60 00  52 00 60 00              134.1.40       
                                              52 00 5c 00  51 00 60 00              134.1.48       
                                              52 00 60 00  53 00 5e 00              134.1.56       
                                              51 00 5e 00  53 00 60 00              134.1.64       
                                              54 00 5f 00  52 00 5f 00              134.1.72       
                                              52 00 5f 00  53 00 61 00              134.1.80       
                                              52 00 5e 00  53 00 5e 00              134.1.88       
                                              52 00 5e 00  4f 00 5e 00              134.1.96       
                                              55 00 5e 00  51 00 5e 00              134.1.104      
                                              52 00 5f 00  53 00 5f 00              134.1.112      
                                              51 00 5e 00  52 00 5e 00              134.1.120      
                                              52 00 5c 00  50 00 5d 00              134.1.128      
                                              53 00 5f 00  51 00 5f 00              134.1.136      
                                              51 00 5f 00  53 00 60 00              134.1.144      
                                              54 00 60 00  52 00 5e 00              134.1.152      
                                              53 00 5e 00  51 00 5e 00              134.1.160      
                                              50 00 5e 00  51 00 5d 00              134.1.168      
                                              52 00 5f 00  4f 00 5f 00              134.1.176      
                                              51 00 5f 00  52 00 5e 00              134.1.184      
                                              51 00 5e 00  52 00 5e 00              134.1.192      
  10.2                         524288  IN     5e 00 51 00  5e 00 52 00   13ms       135.1.0        
                                              5c 00 53 00  5f 00 54 00              135.1.8        
                                              5e 00 52 00  5e 00 52 00              135.1.16       
                                              5c 00 53 00  5e 00 51 00              135.1.24       
                                              5e 00 51 00  5f 00 51 00              135.1.32       
                                              5f 00 52 00  5e 00 51 00              135.1.40       
                                              5f 00 53 00  5f 00 51 00              135.1.48       
                                              5f 00 53 00  60 00 51 00              135.1.56       
                                              60 00 53 00  5f 00 53 00              135.1.64       
                                              5f 00 53 00  60 00 52 00              135.1.72       
                                              5f 00 52 00  5f 00 52 00              135.1.80       
                                              5b 00 53 00  5f 00 51 00              135.1.88       
                                              60 00 52 00  60 00 53 00              135.1.96       
                                              5f 00 53 00  5e 00 53 00              135.1.104      
                                              5d 00 53 00  5f 00 52 00              135.1.112      
                                              5d 00 52 00  5e 00 54 00              135.1.120      
                                              5e 00 53 00  5f 00 51 00              135.1.128      
                                              5e 00 53 00  5e 00 52 00              135.1.136      
                                              5f 00 54 00  5d 00 52 00              135.1.144      
                                              5e 00 51 00  5e 00 4e 00              135.1.152      
                                              5d 00 51 00  5f 00 4f 00              135.1.160      
                                              5f 00 51 00  5e 00 53 00              135.1.168      
                                              5f 00 51 00  5d 00 53 00              135.1.176      
                                              60 00 55 00  5f 00 51 00              135.1.184      
                                              5d 00 52 00  5c 00 4f 00              135.1.192      
  10.2                         524288  IN     50 00 5f 00  53 00 5c 00   12ms       136.1.0        
                                              50 00 5d 00  51 00 5f 00              136.1.8        
                                              4f 00 5f 00  51 00 5e 00              136.1.16       
                                              50 00 60 00  52 00 5d 00              136.1.24       
                                              51 00 60 00  51 00 5f 00              136.1.32       
                                              51 00 5c 00  51 00 5c 00              136.1.40       
                                              52 00 5d 00  51 00 5d 00              136.1.48       
                                              50 00 5e 00  51 00 5e 00              136.1.56       
                                              4e 00 60 00  4f 00 60 00              136.1.64       
                                              52 00 60 00  52 00 5f 00              136.1.72       
                                              52 00 5d 00  51 00 60 00              136.1.80       
                                              53 00 5f 00  54 00 5f 00              136.1.88       
                                              54 00 60 00  51 00 5d 00              136.1.96       
                                              51 00 5e 00  52 00 5e 00              136.1.104      
                                              53 00 60 00  54 00 5e 00              136.1.112      
                                              51 00 5d 00  51 00 5e 00              136.1.120      
                                              52 00 61 00  53 00 5e 00              136.1.128      
                                              53 00 60 00  53 00 60 00              136.1.136      
                                              53 00 5f 00  51 00 60 00              136.1.144      
                                              50 00 5f 00  52 00 5c 00              136.1.152      
                                              51 00 5f 00  50 00 60 00              136.1.160      
                                              51 00 5e 00  50 00 62 00              136.1.168      
                                              53 00 5f 00  51 00 5f 00              136.1.176      
                                              51 00 60 00  51 00 5e 00              136.1.184      
                                              53 00 61 00  50 00 5d 00              136.1.192      
  10.2                             31  IN     1a 00 00 00  01 00 02 00   39us       137.1.0        
                                              31 84 00 01  04 00 1c 1a              137.1.8        
                                              00 00 01 01  04 00 00 00              137.1.16       
                                              00 00 00 55  aa 55 aa                 137.1.24       
  10.2                         524288  IN     49 00 3b 00  48 00 3b 00   98ms       138.1.0        
                                              48 00 3c 00  47 00 3c 00              138.1.8        
                                              49 00 3b 00  48 00 3d 00              138.1.16       
                                              49 00 3b 00  4c 00 3b 00              138.1.24       
                                              49 00 3c 00  49 00 3d 00              138.1.32       
                                              47 00 3c 00  49 00 3f 00              138.1.40       
                                              4b 00 3d 00  4a 00 3b 00              138.1.48       
                                              4b 00 3b 00  4b 00 3d 00              138.1.56       
                                              48 00 3c 00  48 00 3c 00              138.1.64       
                                              4b 00 3d 00  49 00 3b 00              138.1.72       
                                              48 00 3c 00  48 00 3c 00              138.1.80       
                                              47 00 3c 00  4b 00 3c 00              138.1.88       
                                              4a 00 3b 00  4c 00 3b 00              138.1.96       
                                              4a 00 3c 00  48 00 3c 00              138.1.104      
                                              4a 00 3e 00  4a 00 3b 00              138.1.112      
                                              4a 00 3c 00  4a 00 3e 00              138.1.120      
                                              4a 00 3e 00  48 00 3a 00              138.1.128      
                                              47 00 3e 00  4a 00 3c 00              138.1.136      
                                              49 00 3d 00  4a 00 3e 00              138.1.144      
                                              4a 00 3c 00  4c 00 3e 00              138.1.152      
                                              4b 00 3e 00  47 00 3b 00              138.1.160      
                                              47 00 3b 00  4a 00 3d 00              138.1.168      
                                              49 00 3b 00  49 00 3c 00              138.1.176      
                                              47 00 3e 00  4b 00 3b 00              138.1.184      
                                              48 00 3c 00  48 00 3c 00              138.1.192      
  10.2                         524288  IN     49 00 3a 00  46 00 3a 00   12ms       139.1.0        
                                              46 00 38 00  46 00 39 00              139.1.8        
                                              44 00 39 00  46 00 39 00              139.1.16       
                                              47 00 3a 00  48 00 3a 00              139.1.24       
                                              47 00 3b 00  46 00 38 00              139.1.32       
                                              46 00 39 00  46 00 39 00              139.1.40       
                                              46 00 3a 00  47 00 39 00              139.1.48       
                                              48 00 3b 00  47 00 3b 00              139.1.56       
                                              46 00 39 00  46 00 39 00              139.1.64       
                                              47 00 39 00  45 00 3b 00              139.1.72       
                                              46 00 38 00  47 00 39 00              139.1.80       
                                              46 00 3a 00  46 00 3b 00              139.1.88       
                                              47 00 39 00  45 00 39 00              139.1.96       
                                              46 00 3b 00  46 00 3a 00              139.1.104      
                                              46 00 39 00  48 00 38 00              139.1.112      
                                              46 00 38 00  46 00 39 00              139.1.120      
                                              46 00 38 00  46 00 3a 00              139.1.128      
                                              48 00 3b 00  47 00 39 00              139.1.136      
                                              47 00 39 00  47 00 39 00              139.1.144      
                                              46 00 39 00  44 00 39 00              139.1.152      
                                              46 00 37 00  46 00 3a 00              139.1.160      
                                              48 00 39 00  45 00 38 00              139.1.168      
                                              46 00 3a 00  47 00 39 00              139.1.176      
                                              47 00 39 00  46 00 39 00              139.1.184      
                                              45 00 39 00  46 00 3a 00              139.1.192      
  10.2                         524288  IN     3c 00 46 00  39 00 46 00   13ms       140.1.0        
                                              39 00 48 00  38 00 46 00              140.1.8        
                                              39 00 46 00  3a 00 46 00              140.1.16       
                                              3a 00 46 00  3a 00 46 00              140.1.24       
                                              3a 00 45 00  39 00 48 00              140.1.32       
                                              39 00 47 00  39 00 47 00              140.1.40       
                                              39 00 48 00  39 00 47 00              140.1.48       
                                              3b 00 48 00  3b 00 46 00              140.1.56       
                                              39 00 47 00  3b 00 47 00              140.1.64       
                                              3a 00 47 00  39 00 47 00              140.1.72       
                                              39 00 46 00  38 00 47 00              140.1.80       
                                              39 00 47 00  39 00 47 00              140.1.88       
                                              3b 00 47 00  37 00 47 00              140.1.96       
                                              3b 00 48 00  39 00 47 00              140.1.104      
                                              3a 00 48 00  3a 00 47 00              140.1.112      
                                              38 00 47 00  39 00 46 00              140.1.120      
                                              3b 00 45 00  39 00 47 00              140.1.128      
                                              3a 00 47 00  39 00 44 00              140.1.136      
                                              38 00 48 00  38 00 48 00              140.1.144      
                                              3c 00 45 00  3a 00 47 00              140.1.152      
                                              39 00 47 00  39 00 46 00              140.1.160      
                                              3a 00 45 00  3b 00 46 00              140.1.168      
                                              39 00 46 00  3b 00 46 00              140.1.176      
                                              39 00 46 00  39 00 47 00              140.1.184      
                                              3a 00 46 00  3b 00 48 00              140.1.192      
  10.2                         524288  IN     48 00 39 00  47 00 39 00   13ms       141.1.0        
                                              47 00 3a 00  4a 00 39 00              141.1.8        
                                              46 00 3a 00  47 00 3b 00              141.1.16       
                                              47 00 3b 00  48 00 3b 00              141.1.24       
                                              4a 00 3c 00  49 00 39 00              141.1.32       
                                              48 00 3b 00  47 00 3a 00              141.1.40       
                                              47 00 3b 00  47 00 3a 00              141.1.48       
                                              4a 00 3b 00  48 00 3c 00              141.1.56       
                                              49 00 3b 00  47 00 3b 00              141.1.64       
                                              46 00 3b 00  46 00 3b 00              141.1.72       
                                              49 00 3b 00  48 00 3b 00              141.1.80       
                                              48 00 3b 00  47 00 3a 00              141.1.88       
                                              46 00 3c 00  47 00 39 00              141.1.96       
                                              47 00 3b 00  45 00 3b 00              141.1.104      
                                              48 00 3a 00  48 00 3c 00              141.1.112      
                                              48 00 3c 00  48 00 39 00              141.1.120      
                                              48 00 39 00  47 00 3b 00              141.1.128      
                                              46 00 3a 00  47 00 3a 00              141.1.136      
                                              47 00 3b 00  47 00 3b 00              141.1.144      
                                              47 00 3b 00  47 00 3b 00              141.1.152      
                                              48 00 3b 00  4a 00 3b 00              141.1.160      
                                              48 00 39 00  47 00 3a 00              141.1.168      
                                              48 00 3b 00  48 00 3a 00              141.1.176      
                                              49 00 3b 00  47 00 3a 00              141.1.184      
                                              48 00 39 00  47 00 3b 00              141.1.192      
  10.2                         524288  IN     3b 00 47 00  39 00 47 00   12ms       142.1.0        
                                              39 00 46 00  3a 00 47 00              142.1.8        
                                              3b 00 48 00  3b 00 47 00              142.1.16       
                                              3a 00 44 00  3b 00 47 00              142.1.24       
                                              39 00 48 00  3a 00 47 00              142.1.32       
                                              3a 00 47 00  39 00 46 00              142.1.40       
                                              39 00 46 00  3b 00 46 00              142.1.48       
                                              38 00 48 00  3a 00 47 00              142.1.56       
                                              3b 00 46 00  39 00 46 00              142.1.64       
                                              3b 00 46 00  3b 00 47 00              142.1.72       
                                              3a 00 44 00  3a 00 47 00              142.1.80       
                                              3a 00 46 00  3b 00 49 00              142.1.88       
                                              3b 00 48 00  3a 00 47 00              142.1.96       
                                              3a 00 48 00  39 00 47 00              142.1.104      
                                              39 00 47 00  3a 00 47 00              142.1.112      
                                              3a 00 49 00  38 00 47 00              142.1.120      
                                              39 00 47 00  3b 00 46 00              142.1.128      
                                              3b 00 47 00  3a 00 46 00              142.1.136      
                                              39 00 47 00  39 00 47 00              142.1.144      
                                              3b 00 46 00  39 00 46 00              142.1.152      
                                              3b 00 47 00  39 00 48 00              142.1.160      
                                              3b 00 46 00  3a 00 48 00              142.1.168      
                                              39 00 48 00  39 00 48 00              142.1.176      
                                              37 00 46 00  39 00 48 00              142.1.184      
                                              3a 00 4a 00  38 00 45 00              142.1.192      
  10.2                             31  IN     1a 00 00 00  01 00 02 00   35us       143.1.0        
                                              31 84 00 01  04 00 1d 1a              143.1.8        
                                              00 00 01 01  04 00 00 00              143.1.16       
                                              00 00 00 55  aa 55 aa                 143.1.24       
  10.2                         524288  IN     47 00 3b 00  4a 00 3c 00   99ms       144.1.0        
                                              49 00 3b 00  48 00 3a 00              144.1.8        
                                              48 00 3a 00  48 00 3b 00              144.1.16       
                                              4a 00 3a 00  4b 00 3c 00              144.1.24       
                                              48 00 3d 00  4a 00 3b 00              144.1.32       
                                              49 00 3e 00  49 00 3c 00              144.1.40       
                                              4c 00 3e 00  48 00 3b 00              144.1.48       
                                              48 00 3d 00  4a 00 3f 00              144.1.56       
                                              4a 00 3b 00  4a 00 3d 00              144.1.64       
                                              4a 00 3c 00  49 00 3b 00              144.1.72       
                                              4a 00 3d 00  48 00 3d 00              144.1.80       
                                              48 00 3c 00  4a 00 3d 00              144.1.88       
                                              48 00 3b 00  49 00 3b 00              144.1.96       
                                              4a 00 3d 00  48 00 3d 00              144.1.104      
                                              4b 00 3f 00  49 00 3d 00              144.1.112      
                                              48 00 3c 00  4b 00 3e 00              144.1.120      
                                              4c 00 3c 00  49 00 3b 00              144.1.128      
                                              49 00 3b 00  47 00 3c 00              144.1.136      
                                              4a 00 3c 00  4a 00 3f 00              144.1.144      
                                              49 00 3d 00  4a 00 3f 00              144.1.152      
                                              4b 00 3e 00  4a 00 3c 00              144.1.160      
                                              49 00 3a 00  49 00 3d 00              144.1.168      
                                              49 00 3c 00  4a 00 3e 00              144.1.176      
                                              48 00 3d 00  4b 00 3c 00              144.1.184      
                                              49 00 3c 00  4a 00 3d 00              144.1.192      
  10.2                         524288  IN     46 00 3b 00  48 00 39 00   12ms       145.1.0        
                                              46 00 3b 00  49 00 39 00              145.1.8        
                                              47 00 3a 00  49 00 39 00              145.1.16       
                                              46 00 3b 00  4a 00 3b 00              145.1.24       
                                              47 00 3b 00  46 00 3a 00              145.1.32       
                                              48 00 39 00  48 00 39 00              145.1.40       
                                              47 00 3a 00  47 00 3a 00              145.1.48       
                                              49 00 3a 00  47 00 39 00              145.1.56       
                                              48 00 3b 00  46 00 3a 00              145.1.64       
                                              47 00 3b 00  46 00 3b 00              145.1.72       
                                              46 00 3a 00  47 00 3b 00              145.1.80       
                                              47 00 3b 00  47 00 39 00              145.1.88       
                                              46 00 39 00  46 00 3b 00              145.1.96       
                                              47 00 39 00  47 00 39 00              145.1.104      
                                              48 00 3b 00  47 00 3a 00              145.1.112      
                                              46 00 39 00  48 00 3a 00              145.1.120      
                                              47 00 39 00  46 00 3b 00              145.1.128      
                                              48 00 3b 00  47 00 3a 00              145.1.136      
                                              47 00 39 00  47 00 3a 00              145.1.144      
                                              47 00 39 00  47 00 3b 00              145.1.152      
                                              47 00 3b 00  48 00 3b 00              145.1.160      
                                              46 00 39 00  45 00 3b 00              145.1.168      
                                              48 00 3a 00  45 00 3a 00              145.1.176      
                                              47 00 3a 00  47 00 3b 00              145.1.184      
                                              46 00 3a 00  47 00 3a 00              145.1.192      
  10.2                         524288  IN     3c 00 47 00  39 00 46 00   17ms       146.1.0        
                                              3b 00 46 00  39 00 48 00              146.1.8        
                                              3a 00 46 00  3a 00 48 00              146.1.16       
                                              39 00 47 00  3b 00 47 00              146.1.24       
                                              3b 00 48 00  3b 00 48 00              146.1.32       
                                              39 00 47 00  3b 00 47 00              146.1.40       
                                              3a 00 47 00  3c 00 47 00              146.1.48       
                                              3d 00 48 00  39 00 48 00              146.1.56       
                                              3b 00 48 00  3b 00 47 00              146.1.64       
                                              3a 00 49 00  3c 00 48 00              146.1.72       
                                              39 00 47 00  3b 00 46 00              146.1.80       
                                              38 00 48 00  3b 00 48 00              146.1.88       
                                              3b 00 47 00  3b 00 48 00              146.1.96       
                                              3a 00 46 00  3a 00 48 00              146.1.104      
                                              39 00 47 00  3a 00 48 00              146.1.112      
                                              3b 00 47 00  3a 00 48 00              146.1.120      
                                              3a 00 47 00  3c 00 46 00              146.1.128      
                                              3b 00 48 00  3c 00 46 00              146.1.136      
                                              38 00 46 00  3a 00 46 00              146.1.144      
                                              39 00 49 00  3b 00 47 00              146.1.152      
                                              3b 00 47 00  3b 00 47 00              146.1.160      
                                              3d 00 46 00  3b 00 47 00              146.1.168      
                                              3b 00 48 00  38 00 47 00              146.1.176      
                                              3a 00 48 00  3a 00 48 00              146.1.184      
                                              39 00 48 00  3b 00 48 00              146.1.192      
  10.2                         524288  IN     45 00 38 00  47 00 39 00  9.1ms       147.1.0        
                                              45 00 39 00  46 00 39 00              147.1.8        
                                              46 00 3a 00  46 00 3b 00              147.1.16       
                                              45 00 39 00  48 00 39 00              147.1.24       
                                              46 00 3a 00  47 00 3b 00              147.1.32       
                                              45 00 39 00  47 00 39 00              147.1.40       
                                              46 00 3a 00  47 00 39 00              147.1.48       
                                              48 00 3b 00  46 00 39 00              147.1.56       
                                              47 00 3b 00  47 00 39 00              147.1.64       
                                              47 00 3a 00  48 00 39 00              147.1.72       
                                              47 00 39 00  47 00 39 00              147.1.80       
                                              47 00 3a 00  48 00 3a 00              147.1.88       
                                              46 00 39 00  47 00 39 00              147.1.96       
                                              47 00 3a 00  46 00 39 00              147.1.104      
                                              45 00 3b 00  48 00 3b 00              147.1.112      
                                              45 00 3a 00  46 00 39 00              147.1.120      
                                              47 00 3a 00  49 00 3a 00              147.1.128      
                                              47 00 3a 00  46 00 3c 00              147.1.136      
                                              46 00 3b 00  46 00 39 00              147.1.144      
                                              47 00 3a 00  48 00 38 00              147.1.152      
                                              46 00 39 00  46 00 3a 00              147.1.160      
                                              46 00 3b 00  46 00 39 00              147.1.168      
                                              46 00 39 00  44 00 39 00              147.1.176      
                                              46 00 3a 00  48 00 39 00              147.1.184      
                                              46 00 39 00  47 00 3a 00              147.1.192      
  10.2                         524288  IN     3a 00 48 00  3a 00 48 00   12ms       148.1.0        
                                              39 00 49 00  3c 00 47 00              148.1.8        
                                              3c 00 47 00  39 00 48 00              148.1.16       
                                              3a 00 48 00  3a 00 48 00              148.1.24       
                                              3b 00 48 00  3c 00 47 00              148.1.32       
                                              39 00 47 00  3c 00 48 00              148.1.40       
                                              3a 00 48 00  3a 00 48 00              148.1.48       
                                              3b 00 47 00  3b 00 48 00              148.1.56       
                                              3b 00 48 00  3b 00 48 00              148.1.64       
                                              3a 00 47 00  3c 00 47 00              148.1.72       
                                              3a 00 49 00  3a 00 47 00              148.1.80       
                                              3c 00 48 00  3a 00 46 00              148.1.88       
                                              3d 00 48 00  3b 00 47 00              148.1.96       
                                              3a 00 47 00  3d 00 48 00              148.1.104      
                                              39 00 48 00  3b 00 48 00              148.1.112      
                                              3b 00 48 00  3a 00 47 00              148.1.120      
                                              3b 00 46 00  3b 00 49 00              148.1.128      
                                              3b 00 48 00  3b 00 48 00              148.1.136      
                                              3b 00 48 00  3a 00 47 00              148.1.144      
                                              3b 00 47 00  3b 00 48 00              148.1.152      
                                              3b 00 48 00  3c 00 48 00              148.1.160      
                                              3b 00 47 00  39 00 48 00              148.1.168      
                                              3b 00 47 00  3c 00 48 00              148.1.176      
                                              3a 00 46 00  3a 00 48 00              148.1.184      
                                              3a 00 49 00  3a 00 47 00              148.1.192      
  10.2                             31  IN     1a 00 00 00  01 00 02 00   38us       149.1.0        
                                              31 84 00 01  04 00 1e 1a              149.1.8        
                                              00 00 01 01  04 00 00 00              149.1.16       
                                              00 00 00 55  aa 55 aa                 149.1.24       
  10.2                         524288  IN     47 00 3b 00  49 00 3b 00   98ms       150.1.0        
                                              47 00 3c 00  48 00 3b 00              150.1.8        
                                              4a 00 3b 00  4a 00 3b 00              150.1.16       
                                              48 00 3a 00  4a 00 3d 00              150.1.24       
                                              48 00 3b 00  48 00 3d 00              150.1.32       
                                              4a 00 3c 00  49 00 3e 00              150.1.40       
                                              4a 00 3d 00  49 00 3d 00              150.1.48       
                                              49 00 3e 00  49 00 3f 00              150.1.56       
                                              48 00 3e 00  4b 00 3d 00              150.1.64       
                                              49 00 3d 00  4a 00 3d 00              150.1.72       
                                              4a 00 3d 00  49 00 3e 00              150.1.80       
                                              49 00 3d 00  4a 00 3b 00              150.1.88       
                                              49 00 3d 00  48 00 3b 00              150.1.96       
                                              4a 00 3e 00  49 00 3c 00              150.1.104      
                                              4a 00 3d 00  4a 00 3e 00              150.1.112      
                                              4a 00 3e 00  4a 00 3e 00              150.1.120      
                                              4a 00 3b 00  49 00 3d 00              150.1.128      
                                              49 00 3d 00  4a 00 3d 00              150.1.136      
                                              4a 00 3d 00  49 00 3f 00              150.1.144      
                                              4a 00 3d 00  4a 00 3f 00              150.1.152      
                                              4a 00 3c 00  4b 00 3b 00              150.1.160      
                                              48 00 3b 00  49 00 3f 00              150.1.168      
                                              4a 00 3c 00  4b 00 3c 00              150.1.176      
                                              49 00 3e 00  4c 00 3f 00              150.1.184      
                                              49 00 3d 00  49 00 3e 00              150.1.192      
  10.2                         524288  IN     48 00 3a 00  47 00 3b 00   14ms       151.1.0        
                                              47 00 3a 00  47 00 39 00              151.1.8        
                                              47 00 3a 00  47 00 3b 00              151.1.16       
                                              48 00 39 00  47 00 3a 00              151.1.24       
                                              47 00 38 00  46 00 3a 00              151.1.32       
                                              47 00 3a 00  47 00 38 00              151.1.40       
                                              45 00 39 00  45 00 38 00              151.1.48       
                                              46 00 3a 00  46 00 39 00              151.1.56       
                                              48 00 3b 00  46 00 39 00              151.1.64       
                                              47 00 3b 00  47 00 39 00              151.1.72       
                                              44 00 39 00  46 00 39 00              151.1.80       
                                              46 00 3b 00  46 00 3a 00              151.1.88       
                                              48 00 37 00  46 00 3b 00              151.1.96       
                                              48 00 3b 00  46 00 3b 00              151.1.104      
                                              46 00 39 00  47 00 39 00              151.1.112      
                                              48 00 39 00  46 00 39 00              151.1.120      
                                              46 00 38 00  46 00 39 00              151.1.128      
                                              45 00 39 00  48 00 39 00              151.1.136      
                                              46 00 38 00  48 00 3a 00              151.1.144      
                                              47 00 38 00  47 00 38 00              151.1.152      
                                              47 00 3a 00  48 00 39 00              151.1.160      
                                              48 00 39 00  47 00 3b 00              151.1.168      
                                              44 00 3a 00  44 00 3b 00              151.1.176      
                                              47 00 3b 00  44 00 39 00              151.1.184      
                                              46 00 3a 00  44 00 3a 00              151.1.192      
  10.2                         524288  IN     3b 00 48 00  39 00 47 00   11ms       152.1.0        
                                              39 00 48 00  39 00 48 00              152.1.8        
                                              39 00 49 00  39 00 46 00              152.1.16       
                                              39 00 47 00  38 00 47 00              152.1.24       
                                              3a 00 46 00  39 00 49 00              152.1.32       
                                              39 00 46 00  39 00 48 00              152.1.40       
                                              3b 00 48 00  39 00 46 00              152.1.48       
                                              3b 00 48 00  39 00 47 00              152.1.56       
                                              39 00 47 00  39 00 48 00              152.1.64       
                                              39 00 46 00  39 00 46 00              152.1.72       
                                              39 00 46 00  39 00 48 00              152.1.80       
                                              3a 00 48 00  3a 00 46 00              152.1.88       
                                              3a 00 46 00  39 00 47 00              152.1.96       
                                              3a 00 46 00  3b 00 46 00              152.1.104      
                                              3a 00 48 00  39 00 46 00              152.1.112      
                                              3b 00 49 00  39 00 47 00              152.1.120      
                                              39 00 48 00  39 00 48 00              152.1.128      
                                              3a 00 46 00  39 00 46 00              152.1.136      
                                              3b 00 46 00  39 00 47 00              152.1.144      
                                              3a 00 48 00  3a 00 48 00              152.1.152      
                                              38 00 45 00  3b 00 46 00              152.1.160      
                                              39 00 48 00  37 00 47 00              152.1.168      
                                              3b 00 47 00  3b 00 47 00              152.1.176      
                                              39 00 46 00  39 00 46 00              152.1.184      
                                              3a 00 47 00  3a 00 47 00              152.1.192      
  10.2                         524288  IN     45 00 39 00  48 00 39 00   13ms       153.1.0        
                                              48 00 3b 00  47 00 39 00              153.1.8        
                                              47 00 39 00  47 00 3c 00              153.1.16       
                                              47 00 39 00  46 00 39 00              153.1.24       
                                              46 00 3b 00  48 00 39 00              153.1.32       
                                              48 00 3a 00  46 00 39 00              153.1.40       
                                              46 00 3b 00  47 00 3b 00              153.1.48       
                                              47 00 3a 00  47 00 3a 00              153.1.56       
                                              48 00 3b 00  48 00 3a 00              153.1.64       
                                              48 00 3a 00  4a 00 3a 00              153.1.72       
                                              46 00 3a 00  49 00 39 00              153.1.80       
                                              46 00 39 00  48 00 39 00              153.1.88       
                                              47 00 39 00  48 00 3a 00              153.1.96       
                                              47 00 3b 00  47 00 39 00              153.1.104      
                                              46 00 3b 00  47 00 39 00              153.1.112      
                                              47 00 39 00  48 00 38 00              153.1.120      
                                              48 00 3a 00  48 00 3b 00              153.1.128      
                                              47 00 3b 00  47 00 3a 00              153.1.136      
                                              47 00 3a 00  48 00 39 00              153.1.144      
                                              47 00 39 00  48 00 39 00              153.1.152      
                                              47 00 3b 00  49 00 3a 00              153.1.160      
                                              47 00 3b 00  49 00 39 00              153.1.168      
                                              46 00 39 00  46 00 39 00              153.1.176      
                                              47 00 3b 00  47 00 3c 00              153.1.184      
                                              47 00 39 00  46 00 39 00              153.1.192      
  10.2                         524288  IN     39 00 47 00  3a 00 48 00   13ms       154.1.0        
                                              3a 00 49 00  3a 00 47 00              154.1.8        
                                              39 00 46 00  39 00 48 00              154.1.16       
                                              3a 00 46 00  3b 00 48 00              154.1.24       
                                              39 00 48 00  3a 00 47 00              154.1.32       
                                              3a 00 49 00  3b 00 48 00              154.1.40       
                                              3b 00 48 00  39 00 48 00              154.1.48       
                                              3b 00 46 00  3b 00 4a 00              154.1.56       
                                              3b 00 49 00  39 00 48 00              154.1.64       
                                              3b 00 49 00  3b 00 48 00              154.1.72       
                                              3a 00 48 00  3c 00 48 00              154.1.80       
                                              3d 00 48 00  3c 00 47 00              154.1.88       
                                              3c 00 48 00  3a 00 48 00              154.1.96       
                                              3c 00 46 00  3a 00 48 00              154.1.104      
                                              3a 00 48 00  3b 00 48 00              154.1.112      
                                              3a 00 47 00  39 00 48 00              154.1.120      
                                              3b 00 47 00  3b 00 47 00              154.1.128      
                                              3c 00 47 00  3b 00 48 00              154.1.136      
                                              3b 00 47 00  3b 00 47 00              154.1.144      
                                              3b 00 46 00  3a 00 47 00              154.1.152      
                                              3b 00 46 00  3b 00 48 00              154.1.160      
                                              3a 00 48 00  3b 00 47 00              154.1.168      
                                              3c 00 47 00  39 00 46 00              154.1.176      
                                              3c 00 47 00  3a 00 49 00              154.1.184      
                                              3a 00 48 00  39 00 46 00              154.1.192      
  10.2                             31  IN     1a 00 00 00  01 00 02 00   40us       155.1.0        
                                              31 84 00 01  04 00 1f 1a              155.1.8        
                                              00 00 01 01  04 00 00 00              155.1.16       
                                              00 00 00 55  aa 55 aa                 155.1.24       
  10.2                         524288  IN     49 00 3b 00  49 00 3d 00   98ms       156.1.0        
                                              49 00 3d 00  49 00 3b 00              156.1.8        
                                              48 00 3b 00  49 00 3e 00              156.1.16       
                                              49 00 3b 00  4a 00 3e 00              156.1.24       
                                              49 00 3f 00  4a 00 3d 00              156.1.32       
                                              49 00 3d 00  4a 00 3f 00              156.1.40       
                                              4b 00 3e 00  47 00 3e 00              156.1.48       
                                              48 00 3d 00  49 00 3e 00              156.1.56       
                                              49 00 3c 00  49 00 3d 00              156.1.64       
                                              4a 00 3b 00  49 00 3c 00              156.1.72       
                                              49 00 3e 00  49 00 3c 00              156.1.80       
                                              4a 00 3c 00  4a 00 3c 00              156.1.88       
                                              4a 00 3b 00  49 00 3d 00              156.1.96       
                                              4a 00 3d 00  4a 00 3d 00              156.1.104      
                                              4b 00 3e 00  4a 00 3e 00              156.1.112      
                                              4b 00 3d 00  4a 00 3d 00              156.1.120      
                                              4a 00 3d 00  4a 00 3d 00              156.1.128      
                                              49 00 3d 00  4b 00 3d 00              156.1.136      
                                              4b 00 3e 00  4b 00 3f 00              156.1.144      
                                              4a 00 3d 00  4b 00 3f 00              156.1.152      
                                              4a 00 3e 00  49 00 3b 00              156.1.160      
                                              49 00 3b 00  4a 00 3d 00              156.1.168      
                                              49 00 3d 00  4b 00 3d 00              156.1.176      
                                              48 00 3d 00  4a 00 3d 00              156.1.184      
                                              4a 00 3e 00  4a 00 3d 00              156.1.192      
  10.2                         524288  IN     48 00 3b 00  45 00 39 00   13ms       157.1.0        
                                              47 00 3a 00  48 00 3a 00              157.1.8        
                                              48 00 39 00  48 00 39 00              157.1.16       
                                              48 00 3b 00  47 00 3a 00              157.1.24       
                                              48 00 39 00  46 00 39 00              157.1.32       
                                              48 00 3b 00  47 00 3a 00              157.1.40       
                                              46 00 39 00  48 00 3a 00              157.1.48       
                                              49 00 3a 00  47 00 39 00              157.1.56       
                                              47 00 3a 00  47 00 3b 00              157.1.64       
                                              47 00 39 00  48 00 3b 00              157.1.72       
                                              47 00 39 00  47 00 39 00              157.1.80       
                                              46 00 39 00  48 00 3a 00              157.1.88       
                                              48 00 39 00  48 00 3b 00              157.1.96       
                                              47 00 38 00  46 00 3b 00              157.1.104      
                                              48 00 3b 00  48 00 39 00              157.1.112      
                                              46 00 3a 00  48 00 3a 00              157.1.120      
                                              47 00 3a 00  47 00 3a 00              157.1.128      
                                              48 00 39 00  47 00 3a 00              157.1.136      
                                              47 00 39 00  47 00 3a 00              157.1.144      
                                              47 00 39 00  47 00 3a 00              157.1.152      
                                              47 00 39 00  47 00 39 00              157.1.160      
                                              45 00 39 00  46 00 3b 00              157.1.168      
                                              47 00 39 00  46 00 3a 00              157.1.176      
                                              46 00 3a 00  45 00 3b 00              157.1.184      
                                              46 00 39 00  47 00 3b 00              157.1.192      
  10.2                         524288  IN     3d 00 48 00  39 00 46 00   13ms       158.1.0        
                                              3a 00 48 00  39 00 47 00              158.1.8        
                                              3a 00 47 00  39 00 47 00              158.1.16       
                                              37 00 4a 00  3b 00 47 00              158.1.24       
                                              39 00 47 00  39 00 47 00              158.1.32       
                                              39 00 49 00  3b 00 48 00              158.1.40       
                                              3b 00 48 00  3a 00 49 00              158.1.48       
                                              3a 00 4a 00  3a 00 48 00              158.1.56       
                                              39 00 48 00  3c 00 48 00              158.1.64       
                                              39 00 48 00  39 00 47 00              158.1.72       
                                              3b 00 47 00  3a 00 49 00              158.1.80       
                                              3a 00 47 00  3b 00 47 00              158.1.88       
                                              39 00 47 00  3a 00 47 00              158.1.96       
                                              3a 00 48 00  3a 00 48 00              158.1.104      
                                              3a 00 4a 00  3a 00 47 00              158.1.112      
                                              3a 00 47 00  3a 00 46 00              158.1.120      
                                              3b 00 47 00  39 00 48 00              158.1.128      
                                              3b 00 48 00  39 00 47 00              158.1.136      
                                              3b 00 47 00  3c 00 48 00              158.1.144      
                                              3a 00 47 00  3a 00 48 00              158.1.152      
                                              3b 00 48 00  39 00 46 00              158.1.160      
                                              3a 00 47 00  38 00 46 00              158.1.168      
                                              3b 00 48 00  39 00 46 00              158.1.176      
                                              39 00 46 00  3a 00 47 00              158.1.184      
                                              39 00 48 00  3a 00 49 00              158.1.192      
  10.2                         524288  IN     46 00 39 00  49 00 3b 00   12ms       159.1.0        
                                              44 00 39 00  49 00 3b 00              159.1.8        
                                              46 00 3a 00  47 00 3b 00              159.1.16       
                                              45 00 3b 00  47 00 39 00              159.1.24       
                                              47 00 3a 00  48 00 3b 00              159.1.32       
                                              47 00 3a 00  46 00 39 00              159.1.40       
                                              46 00 3b 00  46 00 39 00              159.1.48       
                                              48 00 39 00  46 00 39 00              159.1.56       
                                              48 00 3d 00  47 00 3b 00              159.1.64       
                                              48 00 3d 00  47 00 3b 00              159.1.72       
                                              46 00 39 00  48 00 3b 00              159.1.80       
                                              47 00 38 00  47 00 3b 00              159.1.88       
                                              46 00 3b 00  48 00 3b 00              159.1.96       
                                              47 00 3a 00  45 00 39 00              159.1.104      
                                              46 00 3a 00  46 00 3a 00              159.1.112      
                                              48 00 3a 00  47 00 39 00              159.1.120      
                                              48 00 39 00  46 00 3b 00              159.1.128      
                                              47 00 39 00  48 00 3d 00              159.1.136      
                                              47 00 3a 00  47 00 39 00              159.1.144      
                                              47 00 3b 00  47 00 3a 00              159.1.152      
                                              46 00 3a 00  48 00 3a 00              159.1.160      
                                              48 00 39 00  48 00 3a 00              159.1.168      
                                              47 00 3a 00  47 00 3a 00              159.1.176      
                                              48 00 3b 00  47 00 39 00              159.1.184      
                                              48 00 3b 00  49 00 38 00              159.1.192      
  10.2                         524288  IN     3a 00 46 00  3c 00 46 00   12ms       160.1.0        
                                              38 00 47 00  38 00 46 00              160.1.8        
                                              39 00 48 00  3c 00 49 00              160.1.16       
                                              39 00 47 00  39 00 48 00              160.1.24       
                                              3a 00 48 00  3b 00 48 00              160.1.32       
                                              3b 00 47 00  3c 00 46 00              160.1.40       
                                              3a 00 46 00  3b 00 47 00              160.1.48       
                                              3b 00 46 00  39 00 49 00              160.1.56       
                                              3b 00 46 00  3b 00 46 00              160.1.64       
                                              39 00 48 00  3b 00 46 00              160.1.72       
                                              3c 00 47 00  3a 00 47 00              160.1.80       
                                              3b 00 48 00  3b 00 48 00              160.1.88       
                                              3a 00 46 00  3b 00 48 00              160.1.96       
                                              3b 00 47 00  3b 00 48 00              160.1.104      
                                              3a 00 47 00  3b 00 47 00              160.1.112      
                                              3d 00 49 00  3d 00 48 00              160.1.120      
                                              3b 00 48 00  3c 00 47 00              160.1.128      
                                              3b 00 48 00  3a 00 47 00              160.1.136      
                                              3a 00 48 00  3b 00 48 00              160.1.144      
                                              3a 00 46 00  3a 00 47 00              160.1.152      
                                              39 00 48 00  39 00 48 00              160.1.160      
                                              3b 00 49 00  3a 00 49 00              160.1.168      
                                              3c 00 49 00  3a 00 48 00              160.1.176      
                                              3a 00 45 00  3a 00 47 00              160.1.184      
                                              38 00 48 00  3a 00 47 00              160.1.192      
  10.2                             31  IN     1a 00 00 00  01 00 02 00   42us       161.1.0        
                                              31 84 00 01  04 00 20 1a              161.1.8        
                                              00 00 01 01  04 00 00 00              161.1.16       
                                              00 00 00 55  aa 55 aa                 161.1.24       
  10.2                         524288  IN     4a 00 3d 00  47 00 3d 00   98ms       162.1.0        
                                              4a 00 3d 00  48 00 3d 00              162.1.8        
                                              4a 00 3d 00  48 00 3c 00              162.1.16       
                                              49 00 3c 00  48 00 3b 00              162.1.24       
                                              48 00 3b 00  4a 00 3d 00              162.1.32       
                                              49 00 3d 00  49 00 3d 00              162.1.40       
                                              4d 00 3d 00  49 00 3b 00              162.1.48       
                                              49 00 3c 00  4b 00 41 00              162.1.56       
                                              4c 00 3b 00  49 00 3e 00              162.1.64       
                                              49 00 3e 00  49 00 3c 00              162.1.72       
                                              4a 00 3d 00  49 00 3d 00              162.1.80       
                                              4b 00 3d 00  4a 00 3e 00              162.1.88       
                                              46 00 3d 00  49 00 3c 00              162.1.96       
                                              49 00 3e 00  4a 00 3d 00              162.1.104      
                                              4a 00 3e 00  4a 00 3d 00              162.1.112      
                                              4a 00 3c 00  4a 00 3d 00              162.1.120      
                                              4a 00 3f 00  4c 00 3c 00              162.1.128      
                                              49 00 3c 00  4c 00 3d 00              162.1.136      
                                              49 00 3b 00  4a 00 3f 00              162.1.144      
                                              4b 00 3c 00  4b 00 3f 00              162.1.152      
                                              49 00 3d 00  4a 00 3d 00              162.1.160      
                                              47 00 3c 00  4b 00 3d 00              162.1.168      
                                              4a 00 3d 00  4a 00 3d 00              162.1.176      
                                              49 00 3d 00  4a 00 3d 00              162.1.184      
                                              4a 00 3d 00  4c 00 3d 00              162.1.192      
  10.2                         524288  IN     48 00 3a 00  49 00 3b 00   13ms       163.1.0        
                                              48 00 39 00  46 00 3b 00              163.1.8        
                                              47 00 3c 00  48 00 39 00              163.1.16       
                                              47 00 3b 00  47 00 39 00              163.1.24       
                                              48 00 3a 00  47 00 38 00              163.1.32       
                                              47 00 38 00  48 00 3b 00              163.1.40       
                                              48 00 3b 00  47 00 39 00              163.1.48       
                                              47 00 3b 00  47 00 3b 00              163.1.56       
                                              48 00 3a 00  46 00 3b 00              163.1.64       
                                              48 00 39 00  47 00 3b 00              163.1.72       
                                              47 00 39 00  45 00 3b 00              163.1.80       
                                              47 00 3a 00  47 00 39 00              163.1.88       
                                              48 00 3c 00  47 00 3d 00              163.1.96       
                                              48 00 39 00  47 00 3b 00              163.1.104      
                                              47 00 39 00  47 00 3b 00              163.1.112      
                                              45 00 38 00  47 00 3a 00              163.1.120      
                                              48 00 3b 00  46 00 3b 00              163.1.128      
                                              47 00 39 00  48 00 3b 00              163.1.136      
                                              46 00 39 00  47 00 3b 00              163.1.144      
                                              46 00 39 00  47 00 39 00              163.1.152      
                                              47 00 39 00  47 00 3a 00              163.1.160      
                                              47 00 3b 00  48 00 3b 00              163.1.168      
                                              46 00 3c 00  47 00 39 00              163.1.176      
                                              48 00 3b 00  44 00 3a 00              163.1.184      
                                              46 00 3a 00  46 00 39 00              163.1.192      
  10.2                         524288  IN     3a 00 47 00  3b 00 47 00   12ms       164.1.0        
                                              3b 00 47 00  3a 00 48 00              164.1.8        
                                              39 00 47 00  39 00 47 00              164.1.16       
                                              3b 00 48 00  39 00 47 00              164.1.24       
                                              3a 00 47 00  3b 00 47 00              164.1.32       
                                              39 00 47 00  3b 00 45 00              164.1.40       
                                              39 00 47 00  3a 00 47 00              164.1.48       
                                              3a 00 47 00  3a 00 48 00              164.1.56       
                                              3a 00 46 00  39 00 47 00              164.1.64       
                                              3a 00 48 00  39 00 47 00              164.1.72       
                                              38 00 48 00  3b 00 46 00              164.1.80       
                                              3a 00 47 00  3a 00 47 00              164.1.88       
                                              3a 00 47 00  3a 00 47 00              164.1.96       
                                              3a 00 47 00  3b 00 45 00              164.1.104      
                                              3a 00 48 00  39 00 48 00              164.1.112      
                                              3a 00 48 00  39 00 47 00              164.1.120      
                                              3a 00 47 00  38 00 48 00              164.1.128      
                                              39 00 48 00  3a 00 46 00              164.1.136      
                                              38 00 46 00  3b 00 48 00              164.1.144      
                                              3b 00 47 00  39 00 47 00              164.1.152      
                                              3a 00 47 00  3a 00 46 00              164.1.160      
                                              3a 00 46 00  3b 00 46 00              164.1.168      
                                              38 00 47 00  3b 00 47 00              164.1.176      
                                              39 00 45 00  37 00 48 00              164.1.184      
                                              39 00 45 00  3b 00 48 00              164.1.192      
  10.2                         524288  IN     47 00 39 00  48 00 39 00   13ms       165.1.0        
                                              47 00 3b 00  49 00 3a 00              165.1.8        
                                              46 00 3b 00  47 00 3a 00              165.1.16       
                                              47 00 3b 00  49 00 3b 00              165.1.24       
                                              49 00 3c 00  47 00 3a 00              165.1.32       
                                              47 00 39 00  48 00 39 00              165.1.40       
                                              46 00 39 00  46 00 3a 00              165.1.48       
                                              46 00 3a 00  48 00 3a 00              165.1.56       
                                              4a 00 3b 00  48 00 3a 00              165.1.64       
                                              48 00 3c 00  4a 00 3c 00              165.1.72       
                                              46 00 3b 00  48 00 3b 00              165.1.80       
                                              47 00 3b 00  48 00 3a 00              165.1.88       
                                              48 00 3b 00  48 00 3b 00              165.1.96       
                                              48 00 3b 00  47 00 3a 00              165.1.104      
                                              47 00 3b 00  47 00 3b 00              165.1.112      
                                              47 00 3b 00  47 00 3a 00              165.1.120      
                                              48 00 3a 00  47 00 3b 00              165.1.128      
                                              47 00 3c 00  48 00 3b 00              165.1.136      
                                              46 00 3b 00  4a 00 3a 00              165.1.144      
                                              46 00 3b 00  46 00 3b 00              165.1.152      
                                              46 00 3b 00  48 00 3b 00              165.1.160      
                                              47 00 39 00  48 00 3a 00              165.1.168      
                                              48 00 3a 00  47 00 3a 00              165.1.176      
                                              48 00 3b 00  48 00 3a 00              165.1.184      
                                              46 00 39 00  47 00 38 00              165.1.192      
  10.2                         524288  IN     39 00 47 00  39 00 47 00   13ms       166.1.0        
                                              39 00 48 00  39 00 48 00              166.1.8        
                                              39 00 48 00  39 00 49 00              166.1.16       
                                              3b 00 47 00  3a 00 47 00              166.1.24       
                                              3a 00 46 00  3b 00 48 00              166.1.32       
                                              3b 00 48 00  3b 00 48 00              166.1.40       
                                              38 00 48 00  3a 00 47 00              166.1.48       
                                              3b 00 48 00  3b 00 48 00              166.1.56       
                                              3a 00 46 00  38 00 47 00              166.1.64       
                                              39 00 47 00  3c 00 47 00              166.1.72       
                                              3a 00 47 00  3b 00 46 00              166.1.80       
                                              3b 00 48 00  3a 00 46 00              166.1.88       
                                              3c 00 47 00  3a 00 46 00              166.1.96       
                                              39 00 47 00  38 00 48 00              166.1.104      
                                              3a 00 47 00  39 00 47 00              166.1.112      
                                              3b 00 45 00  39 00 47 00              166.1.120      
                                              3b 00 47 00  3b 00 47 00              166.1.128      
                                              3b 00 46 00  39 00 46 00              166.1.136      
                                              3b 00 49 00  39 00 48 00              166.1.144      
                                              3b 00 47 00  39 00 47 00              166.1.152      
                                              39 00 48 00  39 00 47 00              166.1.160      
                                              3b 00 46 00  39 00 48 00              166.1.168      
                                              3c 00 47 00  39 00 47 00              166.1.176      
                                              3b 00 47 00  3b 00 48 00              166.1.184      
                                              3a 00 48 00  38 00 48 00              166.1.192      
  10.2                             31  IN     1a 00 00 00  01 00 02 00   40us       167.1.0        
                                              31 84 00 01  04 00 21 1a              167.1.8        
                                              00 00 01 01  04 00 00 00              167.1.16       
                                              00 00 00 55  aa 55 aa                 167.1.24       
  10.2                         524288  IN     4a 00 3b 00  48 00 3c 00   98ms       168.1.0        
                                              48 00 3d 00  48 00 3b 00              168.1.8        
                                              4a 00 3d 00  49 00 3b 00              168.1.16       
                                              49 00 3c 00  4a 00 3d 00              168.1.24       
                                              49 00 3d 00  49 00 3d 00              168.1.32       
                                              48 00 3d 00  4a 00 3e 00              168.1.40       
                                              4c 00 3d 00  48 00 3b 00              168.1.48       
                                              4a 00 3c 00  4b 00 3f 00              168.1.56       
                                              4b 00 3b 00  4a 00 3c 00              168.1.64       
                                              4b 00 3e 00  49 00 3c 00              168.1.72       
                                              4a 00 3d 00  49 00 3d 00              168.1.80       
                                              4a 00 3d 00  4b 00 3f 00              168.1.88       
                                              4a 00 3c 00  4b 00 3b 00              168.1.96       
                                              49 00 3d 00  4a 00 3c 00              168.1.104      
                                              49 00 3e 00  4b 00 3c 00              168.1.112      
                                              49 00 3c 00  4b 00 3d 00              168.1.120      
                                              48 00 3f 00  4b 00 3c 00              168.1.128      
                                              49 00 3d 00  4a 00 3d 00              168.1.136      
                                              4a 00 3c 00  4a 00 40 00              168.1.144      
                                              4a 00 3d 00  4c 00 3e 00              168.1.152      
                                              4b 00 3d 00  49 00 3e 00              168.1.160      
                                              4a 00 3c 00  4b 00 3d 00              168.1.168      
                                              4a 00 3d 00  4a 00 3d 00              168.1.176      
                                              4b 00 3f 00  4b 00 3d 00              168.1.184      
                                              4a 00 3d 00  49 00 3d 00              168.1.192      
  10.2                         524288  IN     47 00 39 00  48 00 39 00   14ms       169.1.0        
                                              46 00 3b 00  48 00 3b 00              169.1.8        
                                              46 00 3b 00  48 00 3a 00              169.1.16       
                                              46 00 3a 00  46 00 3b 00              169.1.24       
                                              48 00 3b 00  48 00 39 00              169.1.32       
                                              46 00 39 00  48 00 39 00              169.1.40       
                                              47 00 38 00  47 00 39 00              169.1.48       
                                              47 00 39 00  47 00 3b 00              169.1.56       
                                              47 00 38 00  46 00 3a 00              169.1.64       
                                              46 00 3b 00  46 00 3b 00              169.1.72       
                                              46 00 3b 00  46 00 3c 00              169.1.80       
                                              46 00 3a 00  46 00 3b 00              169.1.88       
                                              47 00 39 00  47 00 3b 00              169.1.96       
                                              48 00 37 00  47 00 39 00              169.1.104      
                                              48 00 3b 00  46 00 39 00              169.1.112      
                                              45 00 39 00  47 00 39 00              169.1.120      
                                              46 00 3a 00  47 00 3a 00              169.1.128      
                                              47 00 38 00  45 00 3c 00              169.1.136      
                                              47 00 39 00  46 00 3b 00              169.1.144      
                                              46 00 39 00  46 00 3a 00              169.1.152      
                                              48 00 3a 00  47 00 3a 00              169.1.160      
                                              47 00 3a 00  46 00 39 00              169.1.168      
                                              45 00 3c 00  47 00 39 00              169.1.176      
                                              47 00 3b 00  44 00 39 00              169.1.184      
                                              46 00 38 00  46 00 3a 00              169.1.192      
  10.2                         524288  IN     3b 00 48 00  3b 00 47 00   11ms       170.1.0        
                                              3a 00 47 00  39 00 48 00              170.1.8        
                                              3b 00 48 00  3b 00 48 00              170.1.16       
                                              3b 00 48 00  3b 00 46 00              170.1.24       
                                              3b 00 46 00  3b 00 47 00              170.1.32       
                                              3c 00 48 00  3a 00 48 00              170.1.40       
                                              39 00 48 00  3a 00 49 00              170.1.48       
                                              3a 00 49 00  3a 00 48 00              170.1.56       
                                              3c 00 48 00  39 00 49 00              170.1.64       
                                              3b 00 49 00  3b 00 49 00              170.1.72       
                                              3b 00 47 00  3a 00 48 00              170.1.80       
                                              3b 00 48 00  3a 00 48 00              170.1.88       
                                              3a 00 47 00  3a 00 47 00              170.1.96       
                                              3c 00 46 00  3b 00 48 00              170.1.104      
                                              3b 00 48 00  3b 00 47 00              170.1.112      
                                              39 00 48 00  3b 00 46 00              170.1.120      
                                              3c 00 49 00  3a 00 49 00              170.1.128      
                                              3b 00 48 00  3a 00 4a 00              170.1.136      
                                              3b 00 48 00  3a 00 46 00              170.1.144      
                                              3b 00 49 00  3b 00 47 00              170.1.152      
                                              39 00 47 00  3b 00 47 00              170.1.160      
                                              3c 00 48 00  3a 00 47 00              170.1.168      
                                              3b 00 48 00  3c 00 47 00              170.1.176      
                                              3b 00 47 00  3c 00 46 00              170.1.184      
                                              3d 00 47 00  3b 00 48 00              170.1.192      
  10.2                         524288  IN     46 00 3b 00  4a 00 3a 00   12ms       171.1.0        
                                              49 00 3b 00  48 00 3b 00              171.1.8        
                                              46 00 3a 00  47 00 3d 00              171.1.16       
                                              47 00 3a 00  45 00 3b 00              171.1.24       
                                              46 00 3b 00  48 00 3b 00              171.1.32       
                                              47 00 3a 00  47 00 39 00              171.1.40       
                                              46 00 3b 00  46 00 39 00              171.1.48       
                                              49 00 3b 00  47 00 3a 00              171.1.56       
                                              48 00 3b 00  48 00 3b 00              171.1.64       
                                              45 00 3d 00  48 00 3b 00              171.1.72       
                                              48 00 3c 00  48 00 3a 00              171.1.80       
                                              46 00 3b 00  48 00 39 00              171.1.88       
                                              48 00 3b 00  49 00 3c 00              171.1.96       
                                              46 00 3d 00  48 00 3b 00              171.1.104      
                                              47 00 3b 00  47 00 3c 00              171.1.112      
                                              48 00 3b 00  46 00 39 00              171.1.120      
                                              46 00 3b 00  48 00 3b 00              171.1.128      
                                              47 00 3d 00  46 00 3a 00              171.1.136      
                                              47 00 3b 00  49 00 3b 00              171.1.144      
                                              46 00 3b 00  47 00 39 00              171.1.152      
                                              46 00 3b 00  49 00 39 00              171.1.160      
                                              46 00 39 00  47 00 3b 00              171.1.168      
                                              47 00 39 00  46 00 3b 00              171.1.176      
                                              48 00 3b 00  46 00 3c 00              171.1.184      
                                              46 00 3c 00  47 00 39 00              171.1.192      
  10.2                         524288  IN     3b 00 46 00  3b 00 46 00   13ms       172.1.0        
                                              3b 00 48 00  3b 00 47 00              172.1.8        
                                              39 00 45 00  38 00 46 00              172.1.16       
                                              39 00 46 00  39 00 46 00              172.1.24       
                                              39 00 47 00  3d 00 46 00              172.1.32       
                                              39 00 47 00  3a 00 44 00              172.1.40       
                                              3b 00 47 00  39 00 47 00              172.1.48       
                                              39 00 46 00  39 00 46 00              172.1.56       
                                              39 00 48 00  3b 00 48 00              172.1.64       
                                              3b 00 47 00  3c 00 47 00              172.1.72       
                                              3a 00 46 00  3b 00 47 00              172.1.80       
                                              39 00 46 00  39 00 46 00              172.1.88       
                                              39 00 46 00  3b 00 46 00              172.1.96       
                                              39 00 47 00  39 00 46 00              172.1.104      
                                              3b 00 48 00  39 00 46 00              172.1.112      
                                              39 00 46 00  39 00 46 00              172.1.120      
                                              3a 00 47 00  3a 00 46 00              172.1.128      
                                              3a 00 47 00  38 00 48 00              172.1.136      
                                              39 00 48 00  3b 00 48 00              172.1.144      
                                              39 00 47 00  3a 00 49 00              172.1.152      
                                              3b 00 47 00  39 00 46 00              172.1.160      
                                              3b 00 48 00  37 00 48 00              172.1.168      
                                              3a 00 47 00  39 00 46 00              172.1.176      
                                              38 00 47 00  3a 00 46 00              172.1.184      
                                              39 00 48 00  39 00 46 00              172.1.192      
  10.2                             31  IN     1a 00 00 00  01 00 02 00   41us       173.1.0        
                                              31 84 00 01  04 00 22 1a              173.1.8        
                                              00 00 01 01  04 00 00 00              173.1.16       
                                              00 00 00 55  aa 55 aa                 173.1.24       
  10.2                         524288  IN     49 00 3b 00  49 00 3c 00   98ms       174.1.0        
                                              47 00 3d 00  49 00 3c 00              174.1.8        
                                              49 00 3b 00  49 00 3d 00              174.1.16       
                                              48 00 3d 00  4a 00 3c 00              174.1.24       
                                              48 00 3e 00  49 00 3c 00              174.1.32       
                                              47 00 3b 00  4a 00 3d 00              174.1.40       
                                              4a 00 3e 00  49 00 3c 00              174.1.48       
                                              49 00 3e 00  48 00 3f 00              174.1.56       
                                              4a 00 3d 00  49 00 3d 00              174.1.64       
                                              48 00 3d 00  49 00 3a 00              174.1.72       
                                              4c 00 3d 00  49 00 3d 00              174.1.80       
                                              4a 00 3d 00  49 00 3d 00              174.1.88       
                                              49 00 3b 00  4a 00 3e 00              174.1.96       
                                              49 00 3d 00  4a 00 3b 00              174.1.104      
                                              4a 00 3f 00  4b 00 3a 00              174.1.112      
                                              4a 00 3f 00  4c 00 3f 00              174.1.120      
                                              4b 00 3f 00  4b 00 3c 00              174.1.128      
                                              49 00 3d 00  49 00 3e 00              174.1.136      
                                              4a 00 3c 00  49 00 3f 00              174.1.144      
                                              4a 00 3d 00  4a 00 3f 00              174.1.152      
                                              4a 00 3e 00  49 00 3c 00              174.1.160      
                                              48 00 3e 00  4a 00 3d 00              174.1.168      
                                              49 00 3c 00  4a 00 3e 00              174.1.176      
                                              49 00 3f 00  4b 00 3d 00              174.1.184      
                                              4b 00 3d 00  49 00 3e 00              174.1.192      
  10.2                         524288  IN     47 00 39 00  46 00 3a 00   13ms       175.1.0        
                                              46 00 39 00  46 00 39 00              175.1.8        
                                              48 00 38 00  47 00 38 00              175.1.16       
                                              47 00 3a 00  46 00 39 00              175.1.24       
                                              48 00 3b 00  46 00 3b 00              175.1.32       
                                              46 00 39 00  46 00 39 00              175.1.40       
                                              46 00 3b 00  46 00 37 00              175.1.48       
                                              48 00 3b 00  46 00 39 00              175.1.56       
                                              47 00 3a 00  48 00 3a 00              175.1.64       
                                              47 00 3a 00  48 00 3a 00              175.1.72       
                                              46 00 39 00  46 00 38 00              175.1.80       
                                              46 00 3a 00  45 00 3a 00              175.1.88       
                                              45 00 38 00  46 00 39 00              175.1.96       
                                              46 00 39 00  46 00 39 00              175.1.104      
                                              46 00 38 00  46 00 38 00              175.1.112      
                                              47 00 3b 00  47 00 37 00              175.1.120      
                                              47 00 3b 00  46 00 3b 00              175.1.128      
                                              48 00 39 00  48 00 39 00              175.1.136      
                                              48 00 39 00  46 00 3a 00              175.1.144      
                                              46 00 3a 00  46 00 3a 00              175.1.152      
                                              46 00 39 00  47 00 39 00              175.1.160      
                                              46 00 3a 00  44 00 3b 00              175.1.168      
                                              47 00 3a 00  47 00 3a 00              175.1.176      
                                              47 00 38 00  46 00 3a 00              175.1.184      
                                              45 00 39 00  46 00 39 00              175.1.192      
  10.2                         524288  IN     3a 00 48 00  39 00 46 00   12ms       176.1.0        
                                              3b 00 47 00  39 00 46 00              176.1.8        
                                              3a 00 45 00  38 00 46 00              176.1.16       
                                              3a 00 46 00  3b 00 46 00              176.1.24       
                                              3c 00 46 00  3a 00 48 00              176.1.32       
                                              3b 00 48 00  39 00 47 00              176.1.40       
                                              3a 00 48 00  3b 00 48 00              176.1.48       
                                              3b 00 47 00  3a 00 47 00              176.1.56       
                                              39 00 46 00  39 00 47 00              176.1.64       
                                              3b 00 48 00  3a 00 48 00              176.1.72       
                                              39 00 45 00  3b 00 46 00              176.1.80       
                                              3a 00 47 00  3c 00 46 00              176.1.88       
                                              3b 00 46 00  3a 00 46 00              176.1.96       
                                              3b 00 46 00  3b 00 49 00              176.1.104      
                                              3b 00 47 00  3a 00 46 00              176.1.112      
                                              3b 00 46 00  3b 00 46 00              176.1.120      
                                              3b 00 46 00  39 00 48 00              176.1.128      
                                              3a 00 47 00  3d 00 47 00              176.1.136      
                                              3a 00 48 00  39 00 47 00              176.1.144      
                                              3b 00 48 00  3b 00 46 00              176.1.152      
                                              3a 00 48 00  39 00 48 00              176.1.160      
                                              3b 00 47 00  39 00 48 00              176.1.168      
                                              3a 00 48 00  3b 00 47 00              176.1.176      
                                              3a 00 48 00  39 00 48 00              176.1.184      
                                              3a 00 47 00  3b 00 49 00              176.1.192      
  10.2                         524288  IN     48 00 3b 00  47 00 3a 00   13ms       177.1.0        
                                              45 00 3b 00  47 00 3b 00              177.1.8        
                                              48 00 3c 00  47 00 3a 00              177.1.16       
                                              48 00 3b 00  46 00 3b 00              177.1.24       
                                              46 00 3b 00  48 00 39 00              177.1.32       
                                              47 00 3b 00  48 00 39 00              177.1.40       
                                              47 00 3b 00  47 00 39 00              177.1.48       
                                              47 00 3a 00  48 00 3b 00              177.1.56       
                                              47 00 3a 00  47 00 39 00              177.1.64       
                                              48 00 3b 00  48 00 3c 00              177.1.72       
                                              48 00 39 00  47 00 3b 00              177.1.80       
                                              45 00 39 00  46 00 3b 00              177.1.88       
                                              46 00 3a 00  48 00 39 00              177.1.96       
                                              48 00 3b 00  46 00 39 00              177.1.104      
                                              46 00 3b 00  48 00 3a 00              177.1.112      
                                              46 00 3b 00  48 00 3b 00              177.1.120      
                                              46 00 39 00  47 00 3b 00              177.1.128      
                                              48 00 3b 00  46 00 3b 00              177.1.136      
                                              47 00 39 00  48 00 39 00              177.1.144      
                                              48 00 3b 00  47 00 3b 00              177.1.152      
                                              48 00 3a 00  47 00 3a 00              177.1.160      
                                              45 00 3b 00  46 00 3d 00              177.1.168      
                                              49 00 3b 00  47 00 39 00              177.1.176      
                                              48 00 3c 00  48 00 3b 00              177.1.184      
                                              47 00 3b 00  48 00 3a 00              177.1.192      
  10.2                         524288  IN     3a 00 46 00  3a 00 46 00   13ms       178.1.0        
                                              3c 00 48 00  3b 00 48 00              178.1.8        
                                              3a 00 46 00  3b 00 48 00              178.1.16       
                                              3b 00 48 00  3a 00 4a 00              178.1.24       
                                              3a 00 48 00  39 00 48 00              178.1.32       
                                              3c 00 47 00  3b 00 48 00              178.1.40       
                                              3d 00 48 00  3c 00 48 00              178.1.48       
                                              3b 00 46 00  3a 00 47 00              178.1.56       
                                              3a 00 48 00  3b 00 48 00              178.1.64       
                                              3c 00 48 00  3a 00 4a 00              178.1.72       
                                              3b 00 48 00  3c 00 49 00              178.1.80       
                                              3b 00 48 00  3c 00 47 00              178.1.88       
                                              3b 00 46 00  3b 00 46 00              178.1.96       
                                              3b 00 48 00  3b 00 48 00              178.1.104      
                                              3b 00 48 00  3b 00 47 00              178.1.112      
                                              3a 00 48 00  3b 00 47 00              178.1.120      
                                              3b 00 48 00  3c 00 47 00              178.1.128      
                                              3b 00 46 00  3b 00 47 00              178.1.136      
                                              3a 00 48 00  3c 00 47 00              178.1.144      
                                              3a 00 47 00  39 00 47 00              178.1.152      
                                              39 00 48 00  3b 00 47 00              178.1.160      
                                              3b 00 48 00  3b 00 48 00              178.1.168      
                                              3b 00 47 00  3b 00 47 00              178.1.176      
                                              3b 00 47 00  3c 00 48 00              178.1.184      
                                              3a 00 48 00  3c 00 47 00              178.1.192      
  10.2                             31  IN     1a 00 00 00  01 00 02 00   38us       179.1.0        
                                              31 84 00 01  04 00 23 1a              179.1.8        
                                              00 00 01 01  04 00 00 00              179.1.16       
                                              00 00 00 55  aa 55 aa                 179.1.24       
  10.2                         524288  IN     48 00 3b 00  48 00 3c 00   98ms       180.1.0        
                                              48 00 3d 00  4a 00 3d 00              180.1.8        
                                              4a 00 3d 00  4a 00 3e 00              180.1.16       
                                              49 00 3c 00  4a 00 3d 00              180.1.24       
                                              49 00 3d 00  49 00 3c 00              180.1.32       
                                              49 00 3d 00  48 00 3f 00              180.1.40       
                                              4b 00 3f 00  4a 00 3c 00              180.1.48       
                                              49 00 3d 00  4b 00 3f 00              180.1.56       
                                              4b 00 3c 00  4a 00 3f 00              180.1.64       
                                              4a 00 3c 00  48 00 3d 00              180.1.72       
                                              4a 00 3d 00  48 00 3d 00              180.1.80       
                                              4a 00 41 00  4a 00 3d 00              180.1.88       
                                              48 00 3b 00  48 00 3c 00              180.1.96       
                                              4b 00 3d 00  49 00 3d 00              180.1.104      
                                              4a 00 3e 00  4b 00 3d 00              180.1.112      
                                              49 00 3c 00  4b 00 3d 00              180.1.120      
                                              49 00 40 00  4a 00 3c 00              180.1.128      
                                              48 00 3c 00  4b 00 3e 00              180.1.136      
                                              49 00 3d 00  4b 00 3f 00              180.1.144      
                                              4b 00 3d 00  4c 00 3d 00              180.1.152      
                                              4a 00 3d 00  49 00 3c 00              180.1.160      
                                              49 00 3e 00  4a 00 3e 00              180.1.168      
                                              4a 00 3e 00  4a 00 3d 00              180.1.176      
                                              4a 00 3f 00  4c 00 3f 00              180.1.184      
                                              4b 00 3a 00  4b 00 3d 00              180.1.192      
  10.2                         524288  IN     45 00 38 00  46 00 3a 00   12ms       181.1.0        
                                              46 00 3a 00  46 00 39 00              181.1.8        
                                              45 00 39 00  46 00 3c 00              181.1.16       
                                              48 00 3b 00  46 00 3b 00              181.1.24       
                                              48 00 3b 00  47 00 39 00              181.1.32       
                                              46 00 3a 00  47 00 39 00              181.1.40       
                                              47 00 3b 00  47 00 39 00              181.1.48       
                                              47 00 3a 00  46 00 39 00              181.1.56       
                                              47 00 3a 00  46 00 3b 00              181.1.64       
                                              47 00 39 00  47 00 38 00              181.1.72       
                                              47 00 3a 00  47 00 39 00              181.1.80       
                                              47 00 3a 00  48 00 39 00              181.1.88       
                                              46 00 3a 00  46 00 3a 00              181.1.96       
                                              48 00 38 00  46 00 38 00              181.1.104      
                                              47 00 39 00  47 00 39 00              181.1.112      
                                              47 00 3a 00  47 00 39 00              181.1.120      
                                              47 00 39 00  47 00 3a 00              181.1.128      
                                              48 00 39 00  47 00 39 00              181.1.136      
                                              45 00 3a 00  46 00 39 00              181.1.144      
                                              47 00 39 00  47 00 3a 00              181.1.152      
                                              47 00 39 00  47 00 39 00              181.1.160      
                                              47 00 38 00  44 00 3a 00              181.1.168      
                                              48 00 39 00  46 00 3a 00              181.1.176      
                                              48 00 38 00  45 00 39 00              181.1.184      
                                              46 00 39 00  46 00 3a 00              181.1.192      
  10.2                         524288  IN     3b 00 47 00  3a 00 47 00   13ms       182.1.0        
                                              3b 00 47 00  3b 00 48 00              182.1.8        
                                              3b 00 48 00  3b 00 48 00              182.1.16       
                                              3a 00 48 00  3a 00 48 00              182.1.24       
                                              3b 00 46 00  3c 00 48 00              182.1.32       
                                              38 00 47 00  39 00 48 00              182.1.40       
                                              39 00 47 00  3a 00 47 00              182.1.48       
                                              3a 00 47 00  39 00 47 00              182.1.56       
                                              3a 00 46 00  3a 00 48 00              182.1.64       
                                              3c 00 48 00  3b 00 46 00              182.1.72       
                                              3a 00 45 00  39 00 47 00              182.1.80       
                                              3a 00 45 00  39 00 48 00              182.1.88       
                                              3a 00 48 00  39 00 48 00              182.1.96       
                                              3c 00 47 00  3a 00 47 00              182.1.104      
                                              3b 00 47 00  3b 00 47 00              182.1.112      
                                              3b 00 48 00  39 00 47 00              182.1.120      
                                              3b 00 48 00  3a 00 46 00              182.1.128      
                                              3a 00 48 00  3a 00 45 00              182.1.136      
                                              3a 00 46 00  3a 00 48 00              182.1.144      
                                              3b 00 47 00  3a 00 48 00              182.1.152      
                                              3a 00 48 00  3a 00 47 00              182.1.160      
                                              3b 00 48 00  3a 00 47 00              182.1.168      
                                              39 00 46 00  3b 00 46 00              182.1.176      
                                              3b 00 47 00  3b 00 48 00              182.1.184      
                                              3d 00 47 00  3b 00 47 00              182.1.192      
  10.2                         524288  IN     46 00 3a 00  4a 00 3a 00   13ms       183.1.0        
                                              46 00 39 00  46 00 3c 00              183.1.8        
                                              48 00 3c 00  46 00 3c 00              183.1.16       
                                              47 00 3a 00  46 00 39 00              183.1.24       
                                              47 00 3a 00  48 00 3b 00              183.1.32       
                                              48 00 3a 00  46 00 3a 00              183.1.40       
                                              47 00 3b 00  47 00 3a 00              183.1.48       
                                              47 00 3b 00  48 00 3b 00              183.1.56       
                                              48 00 3b 00  48 00 3b 00              183.1.64       
                                              48 00 3b 00  49 00 3a 00              183.1.72       
                                              48 00 3b 00  47 00 3a 00              183.1.80       
                                              46 00 3a 00  45 00 3a 00              183.1.88       
                                              46 00 3a 00  47 00 3b 00              183.1.96       
                                              48 00 3b 00  48 00 3b 00              183.1.104      
                                              47 00 3b 00  48 00 3b 00              183.1.112      
                                              48 00 3b 00  47 00 39 00              183.1.120      
                                              48 00 3a 00  48 00 3b 00              183.1.128      
                                              48 00 3b 00  47 00 3b 00              183.1.136      
                                              46 00 39 00  47 00 3b 00              183.1.144      
                                              46 00 3a 00  46 00 39 00              183.1.152      
                                              49 00 39 00  47 00 38 00              183.1.160      
                                              47 00 3a 00  48 00 39 00              183.1.168      
                                              47 00 3b 00  48 00 39 00              183.1.176      
                                              4a 00 3b 00  48 00 3b 00              183.1.184      
                                              47 00 39 00  48 00 3b 00              183.1.192      
  10.2                         524288  IN     39 00 48 00  3b 00 46 00   13ms       184.1.0        
                                              3a 00 47 00  39 00 47 00              184.1.8        
                                              3a 00 47 00  38 00 47 00              184.1.16       
                                              3a 00 47 00  39 00 47 00              184.1.24       
                                              37 00 48 00  3b 00 48 00              184.1.32       
                                              3c 00 47 00  3c 00 46 00              184.1.40       
                                              3a 00 47 00  3a 00 47 00              184.1.48       
                                              39 00 48 00  39 00 46 00              184.1.56       
                                              39 00 46 00  3a 00 47 00              184.1.64       
                                              3a 00 46 00  3b 00 47 00              184.1.72       
                                              39 00 47 00  39 00 46 00              184.1.80       
                                              3a 00 48 00  38 00 48 00              184.1.88       
                                              39 00 46 00  39 00 46 00              184.1.96       
                                              39 00 47 00  3b 00 48 00              184.1.104      
                                              3a 00 48 00  3a 00 47 00              184.1.112      
                                              39 00 47 00  3c 00 47 00              184.1.120      
                                              3a 00 48 00  3b 00 48 00              184.1.128      
                                              3b 00 46 00  39 00 45 00              184.1.136      
                                              39 00 48 00  3c 00 48 00              184.1.144      
                                              3a 00 47 00  39 00 47 00              184.1.152      
                                              3a 00 47 00  3a 00 48 00              184.1.160      
                                              3b 00 46 00  39 00 49 00              184.1.168      
                                              3a 00 47 00  39 00 48 00              184.1.176      
                                              38 00 46 00  39 00 48 00              184.1.184      
                                              39 00 48 00  39 00 48 00              184.1.192      
  10.2                             31  IN     1a 00 00 00  01 00 02 00   45us       185.1.0        
                                              31 84 00 01  04 00 24 1a              185.1.8        
                                              00 00 01 01  04 00 00 00              185.1.16       
                                              00 00 00 55  aa 55 aa                 185.1.24       
  10.2                         524288  IN     49 00 3d 00  49 00 3b 00   99ms       186.1.0        
                                              47 00 3b 00  48 00 3c 00              186.1.8        
                                              48 00 3c 00  49 00 3d 00              186.1.16       
                                              49 00 3b 00  48 00 3c 00              186.1.24       
                                              47 00 3d 00  49 00 3b 00              186.1.32       
                                              47 00 3d 00  48 00 3c 00              186.1.40       
                                              4a 00 3e 00  48 00 3d 00              186.1.48       
                                              4b 00 3e 00  49 00 3e 00              186.1.56       
                                              49 00 3d 00  49 00 3d 00              186.1.64       
                                              49 00 3d 00  4a 00 3d 00              186.1.72       
                                              49 00 3d 00  49 00 3c 00              186.1.80       
                                              49 00 3c 00  49 00 3e 00              186.1.88       
                                              48 00 3b 00  4a 00 3c 00              186.1.96       
                                              48 00 3c 00  48 00 3b 00              186.1.104      
                                              4a 00 3f 00  4a 00 3b 00              186.1.112      
                                              4a 00 3d 00  4a 00 3d 00              186.1.120      
                                              49 00 3c 00  49 00 3b 00              186.1.128      
                                              48 00 3d 00  4b 00 3d 00              186.1.136      
                                              49 00 3d 00  4a 00 3e 00              186.1.144      
                                              4c 00 3c 00  49 00 3d 00              186.1.152      
                                              4c 00 3e 00  49 00 3d 00              186.1.160      
                                              48 00 3b 00  4b 00 3d 00              186.1.168      
                                              47 00 3c 00  48 00 3f 00              186.1.176      
                                              4a 00 3e 00  4a 00 3e 00              186.1.184      
                                              4a 00 3e 00  49 00 3c 00              186.1.192      
  10.2                         524288  IN     45 00 39 00  47 00 38 00   12ms       187.1.0        
                                              47 00 39 00  47 00 3a 00              187.1.8        
                                              47 00 38 00  46 00 39 00              187.1.16       
                                              46 00 39 00  46 00 39 00              187.1.24       
                                              48 00 39 00  47 00 3b 00              187.1.32       
                                              47 00 39 00  47 00 38 00              187.1.40       
                                              46 00 3b 00  46 00 3a 00              187.1.48       
                                              48 00 3a 00  46 00 3b 00              187.1.56       
                                              46 00 3b 00  46 00 3b 00              187.1.64       
                                              46 00 3b 00  46 00 39 00              187.1.72       
                                              48 00 39 00  47 00 3a 00              187.1.80       
                                              46 00 39 00  48 00 39 00              187.1.88       
                                              46 00 3b 00  46 00 3a 00              187.1.96       
                                              47 00 39 00  46 00 39 00              187.1.104      
                                              47 00 39 00  48 00 39 00              187.1.112      
                                              46 00 39 00  46 00 3b 00              187.1.120      
                                              46 00 3a 00  46 00 39 00              187.1.128      
                                              46 00 39 00  46 00 39 00              187.1.136      
                                              47 00 3a 00  45 00 39 00              187.1.144      
                                              46 00 39 00  46 00 39 00              187.1.152      
                                              48 00 3a 00  48 00 3b 00              187.1.160      
                                              47 00 38 00  46 00 3a 00              187.1.168      
                                              47 00 38 00  47 00 39 00              187.1.176      
                                              47 00 39 00  45 00 39 00              187.1.184      
                                              46 00 38 00  44 00 3b 00              187.1.192      
  10.2                         524288  IN     3d 00 47 00  3a 00 48 00   14ms       188.1.0        
                                              3b 00 47 00  3a 00 47 00              188.1.8        
                                              39 00 47 00  3b 00 48 00              188.1.16       
                                              3b 00 47 00  3b 00 47 00              188.1.24       
                                              3b 00 48 00  3b 00 4a 00              188.1.32       
                                              3b 00 49 00  3b 00 49 00              188.1.40       
                                              3c 00 48 00  3a 00 47 00              188.1.48       
                                              3b 00 49 00  3b 00 48 00              188.1.56       
                                              3a 00 48 00  3b 00 48 00              188.1.64       
                                              3b 00 48 00  3a 00 47 00              188.1.72       
                                              3a 00 48 00  3b 00 48 00              188.1.80       
                                              3a 00 49 00  39 00 48 00              188.1.88       
                                              39 00 48 00  3a 00 47 00              188.1.96       
                                              3a 00 47 00  3a 00 49 00              188.1.104      
                                              3a 00 48 00  39 00 47 00              188.1.112      
                                              3c 00 47 00  3b 00 48 00              188.1.120      
                                              3b 00 47 00  3b 00 47 00              188.1.128      
                                              3c 00 48 00  3b 00 48 00              188.1.136      
                                              3a 00 48 00  3b 00 48 00              188.1.144      
                                              3b 00 49 00  3b 00 48 00              188.1.152      
                                              3b 00 49 00  3d 00 47 00              188.1.160      
                                              39 00 48 00  3b 00 49 00              188.1.168      
                                              3c 00 48 00  39 00 4a 00              188.1.176      
                                              3d 00 48 00  3a 00 46 00              188.1.184      
                                              3b 00 48 00  3a 00 47 00              188.1.192      
  10.2                         524288  IN     46 00 39 00  48 00 3b 00   11ms       189.1.0        
                                              48 00 3b 00  47 00 39 00              189.1.8        
                                              46 00 3b 00  45 00 3a 00              189.1.16       
                                              45 00 3a 00  45 00 3b 00              189.1.24       
                                              46 00 3b 00  48 00 3b 00              189.1.32       
                                              47 00 39 00  46 00 3a 00              189.1.40       
                                              47 00 3b 00  46 00 39 00              189.1.48       
                                              48 00 3b 00  45 00 3b 00              189.1.56       
                                              48 00 3b 00  48 00 39 00              189.1.64       
                                              45 00 3b 00  48 00 3a 00              189.1.72       
                                              48 00 39 00  47 00 3b 00              189.1.80       
                                              47 00 3c 00  47 00 39 00              189.1.88       
                                              45 00 3b 00  49 00 39 00              189.1.96       
                                              47 00 3a 00  46 00 3a 00              189.1.104      
                                              47 00 39 00  46 00 3a 00              189.1.112      
                                              46 00 3b 00  46 00 39 00              189.1.120      
                                              48 00 39 00  48 00 38 00              189.1.128      
                                              46 00 3a 00  46 00 3a 00              189.1.136      
                                              47 00 3b 00  47 00 3a 00              189.1.144      
                                              47 00 39 00  48 00 39 00              189.1.152      
                                              46 00 39 00  46 00 3c 00              189.1.160      
                                              47 00 38 00  47 00 39 00              189.1.168      
                                              47 00 39 00  48 00 39 00              189.1.176      
                                              47 00 3b 00  46 00 3a 00              189.1.184      
                                              47 00 39 00  46 00 38 00              189.1.192      
  10.2                         524288  IN     3b 00 48 00  3b 00 48 00   13ms       190.1.0        
                                              3b 00 49 00  3b 00 48 00              190.1.8        
                                              3b 00 47 00  3a 00 47 00              190.1.16       
                                              3a 00 48 00  3c 00 4a 00              190.1.24       
                                              38 00 48 00  3d 00 47 00              190.1.32       
                                              3b 00 48 00  3c 00 48 00              190.1.40       
                                              3b 00 48 00  3d 00 47 00              190.1.48       
                                              3a 00 47 00  3b 00 48 00              190.1.56       
                                              3b 00 47 00  39 00 47 00              190.1.64       
                                              3b 00 48 00  3a 00 48 00              190.1.72       
                                              3a 00 48 00  3d 00 4a 00              190.1.80       
                                              3b 00 49 00  3d 00 45 00              190.1.88       
                                              39 00 48 00  39 00 47 00              190.1.96       
                                              3b 00 47 00  3c 00 48 00              190.1.104      
                                              3b 00 47 00  3a 00 48 00              190.1.112      
                                              3c 00 49 00  39 00 47 00              190.1.120      
                                              3b 00 47 00  3b 00 48 00              190.1.128      
                                              3c 00 46 00  3d 00 48 00              190.1.136      
                                              3e 00 4a 00  39 00 48 00              190.1.144      
                                              3b 00 48 00  3b 00 47 00              190.1.152      
                                              3b 00 48 00  3a 00 48 00              190.1.160      
                                              3a 00 48 00  3a 00 48 00              190.1.168      
                                              3c 00 47 00  3b 00 47 00              190.1.176      
                                              3b 00 47 00  3b 00 4b 00              190.1.184      
                                              3b 00 4c 00  3b 00 48 00              190.1.192      
  10.2                             31  IN     1a 00 00 00  01 00 02 00   42us       191.1.0        
                                              31 84 00 01  04 00 25 1a              191.1.8        
                                              00 00 01 01  04 00 00 00              191.1.16       
                                              00 00 00 55  aa 55 aa                 191.1.24       
  10.2                         524288  IN     46 00 3b 00  47 00 3d 00  103ms       192.1.0        
                                              49 00 3c 00  48 00 3c 00              192.1.8        
                                              48 00 3c 00  49 00 3c 00              192.1.16       
                                              49 00 3b 00  4a 00 3c 00              192.1.24       
                                              49 00 3c 00  4a 00 3b 00              192.1.32       
                                              48 00 3d 00  48 00 3c 00              192.1.40       
                                              4b 00 3b 00  4a 00 3b 00              192.1.48       
                                              4a 00 3d 00  4a 00 3d 00              192.1.56       
                                              4a 00 3b 00  49 00 3b 00              192.1.64       
                                              49 00 3b 00  48 00 3c 00              192.1.72       
                                              48 00 3d 00  48 00 3c 00              192.1.80       
                                              4b 00 3c 00  4a 00 3c 00              192.1.88       
                                              49 00 3a 00  48 00 3c 00              192.1.96       
                                              4a 00 3e 00  4a 00 3c 00              192.1.104      
                                              49 00 3d 00  4d 00 3d 00              192.1.112      
                                              4a 00 3c 00  4a 00 3d 00              192.1.120      
                                              49 00 3b 00  4a 00 3c 00              192.1.128      
                                              4a 00 3d 00  4a 00 3b 00              192.1.136      
                                              4a 00 3e 00  4a 00 3d 00              192.1.144      
                                              49 00 3c 00  4b 00 3d 00              192.1.152      
                                              4b 00 3b 00  4b 00 3c 00              192.1.160      
                                              4a 00 3b 00  4a 00 3c 00              192.1.168      
                                              4a 00 3c 00  4a 00 3e 00              192.1.176      
                                              4b 00 3d 00  4b 00 3d 00              192.1.184      
                                              4b 00 3d 00  49 00 3d 00              192.1.192      
  10.2                         524288  IN     47 00 3a 00  47 00 3a 00  8.3ms       193.1.0        
                                              46 00 3b 00  47 00 37 00              193.1.8        
                                              46 00 3b 00  48 00 3b 00              193.1.16       
                                              47 00 3c 00  44 00 3a 00              193.1.24       
                                              45 00 3b 00  46 00 39 00              193.1.32       
                                              46 00 3a 00  48 00 3a 00              193.1.40       
                                              46 00 39 00  47 00 3a 00              193.1.48       
                                              46 00 3b 00  47 00 3b 00              193.1.56       
                                              47 00 3b 00  47 00 3b 00              193.1.64       
                                              46 00 3a 00  46 00 39 00              193.1.72       
                                              46 00 3b 00  45 00 3a 00              193.1.80       
                                              49 00 3b 00  48 00 3a 00              193.1.88       
                                              48 00 39 00  47 00 39 00              193.1.96       
                                              48 00 3a 00  47 00 3b 00              193.1.104      
                                              45 00 3a 00  47 00 39 00              193.1.112      
                                              43 00 3b 00  47 00 39 00              193.1.120      
                                              46 00 39 00  46 00 39 00              193.1.128      
                                              48 00 39 00  47 00 38 00              193.1.136      
                                              45 00 3b 00  46 00 3b 00              193.1.144      
                                              48 00 39 00  46 00 39 00              193.1.152      
                                              45 00 3a 00  47 00 3a 00              193.1.160      
                                              48 00 39 00  47 00 39 00              193.1.168      
                                              46 00 3b 00  47 00 39 00              193.1.176      
                                              48 00 39 00  46 00 3a 00              193.1.184      
                                              46 00 38 00  48 00 3a 00              193.1.192      
  10.2                         524288  IN     3c 00 46 00  3a 00 46 00   14ms       194.1.0        
                                              39 00 47 00  38 00 48 00              194.1.8        
                                              3a 00 46 00  39 00 47 00              194.1.16       
                                              39 00 46 00  3b 00 46 00              194.1.24       
                                              3c 00 48 00  3b 00 47 00              194.1.32       
                                              3a 00 47 00  39 00 47 00              194.1.40       
                                              39 00 48 00  3a 00 48 00              194.1.48       
                                              39 00 48 00  3b 00 47 00              194.1.56       
                                              39 00 45 00  39 00 47 00              194.1.64       
                                              3a 00 47 00  3a 00 47 00              194.1.72       
                                              3a 00 47 00  3b 00 47 00              194.1.80       
                                              39 00 47 00  39 00 48 00              194.1.88       
                                              39 00 47 00  39 00 47 00              194.1.96       
                                              3b 00 47 00  3a 00 48 00              194.1.104      
                                              3c 00 46 00  39 00 46 00              194.1.112      
                                              3a 00 46 00  39 00 47 00              194.1.120      
                                              3a 00 47 00  39 00 48 00              194.1.128      
                                              38 00 47 00  3b 00 48 00              194.1.136      
                                              3a 00 47 00  3b 00 47 00              194.1.144      
                                              3a 00 46 00  3b 00 45 00              194.1.152      
                                              39 00 48 00  3b 00 46 00              194.1.160      
                                              3b 00 48 00  39 00 48 00              194.1.168      
                                              39 00 46 00  3b 00 46 00              194.1.176      
                                              3a 00 47 00  39 00 47 00              194.1.184      
                                              3b 00 47 00  39 00 47 00              194.1.192      
  10.2                         524288  IN     48 00 39 00  46 00 39 00   12ms       195.1.0        
                                              46 00 3a 00  48 00 3b 00              195.1.8        
                                              47 00 3a 00  47 00 3a 00              195.1.16       
                                              47 00 3b 00  47 00 3a 00              195.1.24       
                                              47 00 3b 00  46 00 39 00              195.1.32       
                                              46 00 3a 00  46 00 3b 00              195.1.40       
                                              46 00 3b 00  48 00 3a 00              195.1.48       
                                              47 00 3a 00  47 00 3a 00              195.1.56       
                                              47 00 3a 00  47 00 3a 00              195.1.64       
                                              47 00 3a 00  48 00 3a 00              195.1.72       
                                              48 00 39 00  47 00 3b 00              195.1.80       
                                              46 00 3a 00  48 00 3b 00              195.1.88       
                                              48 00 3b 00  49 00 3a 00              195.1.96       
                                              47 00 39 00  48 00 39 00              195.1.104      
                                              48 00 3b 00  47 00 39 00              195.1.112      
                                              47 00 3a 00  47 00 3b 00              195.1.120      
                                              47 00 3a 00  4a 00 39 00              195.1.128      
                                              45 00 3b 00  47 00 39 00              195.1.136      
                                              48 00 3b 00  48 00 39 00              195.1.144      
                                              48 00 3b 00  47 00 3a 00              195.1.152      
                                              46 00 39 00  46 00 39 00              195.1.160      
                                              46 00 3b 00  44 00 3a 00              195.1.168      
                                              47 00 39 00  47 00 3a 00              195.1.176      
                                              47 00 3b 00  47 00 3a 00              195.1.184      
                                              48 00 39 00  47 00 38 00              195.1.192      
  10.2                         524288  IN     3a 00 48 00  39 00 46 00   12ms       196.1.0        
                                              39 00 48 00  3b 00 46 00              196.1.8        
                                              3b 00 47 00  39 00 48 00              196.1.16       
                                              38 00 47 00  3c 00 46 00              196.1.24       
                                              3a 00 46 00  3a 00 46 00              196.1.32       
                                              39 00 47 00  3b 00 48 00              196.1.40       
                                              3b 00 46 00  3a 00 46 00              196.1.48       
                                              3a 00 47 00  3a 00 48 00              196.1.56       
                                              3b 00 47 00  39 00 48 00              196.1.64       
                                              3b 00 46 00  3b 00 46 00              196.1.72       
                                              38 00 46 00  3b 00 48 00              196.1.80       
                                              39 00 48 00  3b 00 48 00              196.1.88       
                                              3b 00 47 00  3b 00 46 00              196.1.96       
                                              3a 00 48 00  3b 00 48 00              196.1.104      
                                              3b 00 47 00  3b 00 46 00              196.1.112      
                                              3b 00 48 00  3a 00 48 00              196.1.120      
                                              3a 00 48 00  39 00 46 00              196.1.128      
                                              3b 00 48 00  3a 00 46 00              196.1.136      
                                              39 00 46 00  39 00 48 00              196.1.144      
                                              39 00 47 00  39 00 47 00              196.1.152      
                                              39 00 48 00  39 00 47 00              196.1.160      
                                              3b 00 46 00  39 00 4a 00              196.1.168      
                                              39 00 48 00  38 00 49 00              196.1.176      
                                              39 00 47 00  39 00 47 00              196.1.184      
                                              3c 00 49 00  3b 00 45 00              196.1.192      
  10.2                             31  IN     1a 00 00 00  01 00 02 00   41us       197.1.0        
                                              31 84 00 01  04 00 26 1a              197.1.8        
                                              00 00 01 01  04 00 00 00              197.1.16       
                                              00 00 00 55  aa 55 aa                 197.1.24       
  10.2                         524288  IN     46 00 3a 00  48 00 3d 00   99ms       198.1.0        
                                              49 00 3b 00  49 00 3b 00              198.1.8        
                                              4a 00 3b 00  48 00 3d 00              198.1.16       
                                              48 00 39 00  4a 00 3c 00              198.1.24       
                                              47 00 3f 00  48 00 3b 00              198.1.32       
                                              48 00 3d 00  4a 00 3d 00              198.1.40       
                                              4c 00 3d 00  4a 00 3b 00              198.1.48       
                                              49 00 3e 00  4a 00 3d 00              198.1.56       
                                              4a 00 3c 00  49 00 3d 00              198.1.64       
                                              4a 00 3d 00  49 00 3b 00              198.1.72       
                                              4a 00 3d 00  48 00 3c 00              198.1.80       
                                              4b 00 3c 00  4b 00 3d 00              198.1.88       
                                              48 00 3b 00  47 00 3c 00              198.1.96       
                                              4a 00 3b 00  4a 00 3b 00              198.1.104      
                                              4a 00 3e 00  4a 00 3c 00              198.1.112      
                                              4a 00 3c 00  4a 00 3d 00              198.1.120      
                                              49 00 3f 00  4a 00 3b 00              198.1.128      
                                              49 00 3c 00  4a 00 3c 00              198.1.136      
                                              49 00 3d 00  49 00 3d 00              198.1.144      
                                              4a 00 3c 00  4a 00 3f 00              198.1.152      
                                              4b 00 3d 00  49 00 3d 00              198.1.160      
                                              47 00 3b 00  49 00 3d 00              198.1.168      
                                              48 00 3c 00  4c 00 3c 00              198.1.176      
                                              4a 00 3c 00  4b 00 3c 00              198.1.184      
                                              4c 00 3b 00  4b 00 3b 00              198.1.192      
  10.2                         524288  IN     47 00 3b 00  46 00 3a 00   12ms       199.1.0        
                                              48 00 3a 00  46 00 3c 00              199.1.8        
                                              47 00 3a 00  47 00 39 00              199.1.16       
                                              48 00 3a 00  46 00 3b 00              199.1.24       
                                              48 00 39 00  48 00 3a 00              199.1.32       
                                              46 00 3a 00  46 00 3b 00              199.1.40       
                                              46 00 39 00  47 00 39 00              199.1.48       
                                              47 00 3a 00  46 00 3a 00              199.1.56       
                                              48 00 3b 00  48 00 3b 00              199.1.64       
                                              48 00 3a 00  48 00 3b 00              199.1.72       
                                              46 00 3b 00  46 00 39 00              199.1.80       
                                              46 00 3b 00  46 00 3b 00              199.1.88       
                                              46 00 38 00  46 00 3b 00              199.1.96       
                                              48 00 3b 00  47 00 3a 00              199.1.104      
                                              47 00 3b 00  48 00 3d 00              199.1.112      
                                              48 00 39 00  47 00 39 00              199.1.120      
                                              48 00 39 00  45 00 3b 00              199.1.128      
                                              48 00 3b 00  46 00 3b 00              199.1.136      
                                              48 00 3b 00  46 00 39 00              199.1.144      
                                              46 00 3a 00  46 00 3b 00              199.1.152      
                                              48 00 3b 00  47 00 3a 00              199.1.160      
                                              48 00 3a 00  47 00 3a 00              199.1.168      
                                              46 00 3b 00  48 00 3a 00              199.1.176      
                                              46 00 3b 00  46 00 39 00              199.1.184      
                                              48 00 39 00  45 00 3b 00              199.1.192      
  10.2                         524288  IN     3b 00 46 00  3b 00 46 00   12ms       200.1.0        
                                              3c 00 48 00  3a 00 48 00              200.1.8        
                                              3b 00 47 00  3c 00 45 00              200.1.16       
                                              3a 00 48 00  3c 00 46 00              200.1.24       
                                              3b 00 47 00  3c 00 48 00              200.1.32       
                                              3a 00 46 00  3b 00 48 00              200.1.40       
                                              3a 00 48 00  3a 00 48 00              200.1.48       
                                              3b 00 49 00  3c 00 46 00              200.1.56       
                                              3a 00 46 00  3b 00 48 00              200.1.64       
                                              3b 00 48 00  3c 00 48 00              200.1.72       
                                              3a 00 47 00  3b 00 47 00              200.1.80       
                                              3a 00 48 00  3b 00 47 00              200.1.88       
                                              39 00 48 00  39 00 48 00              200.1.96       
                                              3b 00 48 00  3c 00 48 00              200.1.104      
                                              3b 00 48 00  3a 00 47 00              200.1.112      
                                              3a 00 47 00  3b 00 47 00              200.1.120      
                                              3b 00 47 00  3b 00 48 00              200.1.128      
                                              3b 00 48 00  3b 00 48 00              200.1.136      
                                              3b 00 48 00  39 00 48 00              200.1.144      
                                              3b 00 48 00  3a 00 46 00              200.1.152      
                                              3b 00 48 00  3b 00 48 00              200.1.160      
                                              3b 00 48 00  3d 00 48 00              200.1.168      
                                              3b 00 47 00  39 00 48 00              200.1.176      
                                              3a 00 48 00  3b 00 48 00              200.1.184      
                                              39 00 47 00  3b 00 49 00              200.1.192      
  10.2                         524288  IN     46 00 38 00  47 00 3a 00   14ms       201.1.0        
                                              46 00 3b 00  48 00 3b 00              201.1.8        
                                              46 00 3a 00  46 00 3d 00              201.1.16       
                                              46 00 3a 00  46 00 3b 00              201.1.24       
                                              48 00 3c 00  46 00 3b 00              201.1.32       
                                              46 00 3b 00  49 00 3b 00              201.1.40       
                                              47 00 3b 00  47 00 3a 00              201.1.48       
                                              48 00 3b 00  48 00 3a 00              201.1.56       
                                              48 00 3b 00  46 00 39 00              201.1.64       
                                              44 00 3b 00  48 00 39 00              201.1.72       
                                              48 00 3a 00  48 00 3b 00              201.1.80       
                                              46 00 3b 00  44 00 3b 00              201.1.88       
                                              46 00 3b 00  47 00 3b 00              201.1.96       
                                              48 00 3b 00  47 00 3a 00              201.1.104      
                                              47 00 3c 00  47 00 3b 00              201.1.112      
                                              46 00 3b 00  47 00 3b 00              201.1.120      
                                              47 00 39 00  48 00 3b 00              201.1.128      
                                              48 00 3a 00  46 00 3b 00              201.1.136      
                                              47 00 3b 00  47 00 3b 00              201.1.144      
                                              46 00 3c 00  47 00 39 00              201.1.152      
                                              48 00 3b 00  46 00 3b 00              201.1.160      
                                              46 00 3b 00  47 00 39 00              201.1.168      
                                              47 00 39 00  47 00 3a 00              201.1.176      
                                              46 00 3b 00  46 00 3b 00              201.1.184      
                                              47 00 3b 00  47 00 3b 00              201.1.192      
  10.2                         524288  IN     39 00 45 00  3a 00 47 00   11ms       202.1.0        
                                              3a 00 48 00  3a 00 47 00              202.1.8        
                                              39 00 47 00  38 00 47 00              202.1.16       
                                              3a 00 48 00  3a 00 46 00              202.1.24       
                                              3a 00 46 00  3a 00 46 00              202.1.32       
                                              3b 00 45 00  38 00 48 00              202.1.40       
                                              39 00 47 00  39 00 45 00              202.1.48       
                                              3b 00 47 00  3a 00 46 00              202.1.56       
                                              3a 00 46 00  3b 00 47 00              202.1.64       
                                              37 00 48 00  3b 00 48 00              202.1.72       
                                              39 00 46 00  3a 00 46 00              202.1.80       
                                              3b 00 46 00  3b 00 48 00              202.1.88       
                                              39 00 47 00  3b 00 48 00              202.1.96       
                                              39 00 47 00  3b 00 47 00              202.1.104      
                                              3b 00 46 00  3a 00 47 00              202.1.112      
                                              3a 00 47 00  3a 00 46 00              202.1.120      
                                              3a 00 47 00  39 00 45 00              202.1.128      
                                              3c 00 48 00  3a 00 48 00              202.1.136      
                                              3a 00 48 00  3a 00 46 00              202.1.144      
                                              3b 00 46 00  3a 00 46 00              202.1.152      
                                              3a 00 46 00  3b 00 48 00              202.1.160      
                                              3b 00 46 00  39 00 48 00              202.1.168      
                                              3a 00 49 00  3b 00 45 00              202.1.176      
                                              3a 00 46 00  3a 00 47 00              202.1.184      
                                              3b 00 48 00  39 00 47 00              202.1.192      
  10.2                             31  IN     1a 00 00 00  01 00 02 00   41us       203.1.0        
                                              31 84 00 01  04 00 27 1a              203.1.8        
                                              00 00 01 01  04 00 00 00              203.1.16       
                                              00 00 00 55  aa 55 aa                 203.1.24       
  10.2                         524288  IN     49 00 3c 00  48 00 3d 00   99ms       204.1.0        
                                              48 00 3b 00  48 00 3d 00              204.1.8        
                                              48 00 3d 00  48 00 3b 00              204.1.16       
                                              48 00 3b 00  4b 00 3d 00              204.1.24       
                                              48 00 3b 00  48 00 3b 00              204.1.32       
                                              48 00 3c 00  48 00 3e 00              204.1.40       
                                              4a 00 3c 00  4a 00 3d 00              204.1.48       
                                              4a 00 3d 00  4a 00 3d 00              204.1.56       
                                              49 00 3b 00  48 00 3d 00              204.1.64       
                                              4a 00 3c 00  48 00 3b 00              204.1.72       
                                              4a 00 3c 00  48 00 3e 00              204.1.80       
                                              4a 00 3d 00  4b 00 3c 00              204.1.88       
                                              49 00 3d 00  48 00 3b 00              204.1.96       
                                              49 00 3d 00  49 00 3c 00              204.1.104      
                                              49 00 3f 00  4a 00 3c 00              204.1.112      
                                              4a 00 3b 00  4a 00 3e 00              204.1.120      
                                              4b 00 3b 00  4b 00 3b 00              204.1.128      
                                              48 00 3c 00  48 00 3c 00              204.1.136      
                                              4b 00 3d 00  49 00 3d 00              204.1.144      
                                              4b 00 3c 00  4b 00 3c 00              204.1.152      
                                              4a 00 3d 00  48 00 3c 00              204.1.160      
                                              48 00 3b 00  4b 00 3c 00              204.1.168      
                                              49 00 3d 00  4a 00 3e 00              204.1.176      
                                              49 00 3e 00  4b 00 3d 00              204.1.184      
                                              49 00 3b 00  4b 00 3c 00              204.1.192      
  10.2                         524288  IN     46 00 3a 00  46 00 39 00   12ms       205.1.0        
                                              46 00 39 00  47 00 3b 00              205.1.8        
                                              47 00 3b 00  47 00 3a 00              205.1.16       
                                              47 00 39 00  48 00 39 00              205.1.24       
                                              48 00 3a 00  46 00 3b 00              205.1.32       
                                              48 00 3b 00  48 00 3a 00              205.1.40       
                                              47 00 3a 00  47 00 39 00              205.1.48       
                                              47 00 3a 00  45 00 3a 00              205.1.56       
                                              46 00 39 00  47 00 3b 00              205.1.64       
                                              47 00 3a 00  46 00 3b 00              205.1.72       
                                              45 00 3a 00  47 00 3a 00              205.1.80       
                                              47 00 39 00  44 00 3b 00              205.1.88       
                                              47 00 39 00  47 00 37 00              205.1.96       
                                              46 00 3a 00  46 00 3a 00              205.1.104      
                                              48 00 39 00  47 00 39 00              205.1.112      
                                              46 00 3a 00  46 00 3b 00              205.1.120      
                                              45 00 3a 00  46 00 39 00              205.1.128      
                                              47 00 38 00  48 00 3b 00              205.1.136      
                                              47 00 3b 00  45 00 3a 00              205.1.144      
                                              45 00 39 00  48 00 3b 00              205.1.152      
                                              45 00 3a 00  46 00 3a 00              205.1.160      
                                              47 00 39 00  46 00 3a 00              205.1.168      
                                              46 00 3a 00  46 00 39 00              205.1.176      
                                              45 00 39 00  46 00 39 00              205.1.184      
                                              47 00 39 00  44 00 3a 00              205.1.192      
  10.2                         524288  IN     3b 00 47 00  3d 00 47 00   13ms       206.1.0        
                                              3b 00 46 00  3b 00 48 00              206.1.8        
                                              39 00 47 00  3b 00 48 00              206.1.16       
                                              3b 00 47 00  3d 00 47 00              206.1.24       
                                              3b 00 46 00  39 00 48 00              206.1.32       
                                              39 00 48 00  3a 00 48 00              206.1.40       
                                              39 00 48 00  3b 00 48 00              206.1.48       
                                              3b 00 48 00  3b 00 47 00              206.1.56       
                                              3b 00 47 00  39 00 48 00              206.1.64       
                                              3c 00 48 00  3a 00 48 00              206.1.72       
                                              3a 00 47 00  39 00 47 00              206.1.80       
                                              39 00 47 00  3c 00 48 00              206.1.88       
                                              39 00 48 00  3a 00 48 00              206.1.96       
                                              3a 00 46 00  39 00 49 00              206.1.104      
                                              3b 00 49 00  3a 00 49 00              206.1.112      
                                              3b 00 48 00  39 00 48 00              206.1.120      
                                              3b 00 48 00  3a 00 46 00              206.1.128      
                                              3b 00 47 00  3a 00 48 00              206.1.136      
                                              39 00 49 00  39 00 47 00              206.1.144      
                                              3b 00 48 00  39 00 48 00              206.1.152      
                                              39 00 47 00  3b 00 48 00              206.1.160      
                                              3c 00 46 00  3a 00 47 00              206.1.168      
                                              3b 00 48 00  3b 00 48 00              206.1.176      
                                              3b 00 48 00  39 00 48 00              206.1.184      
                                              3a 00 48 00  3a 00 48 00              206.1.192      
  10.2                         524288  IN     47 00 39 00  48 00 3a 00   13ms       207.1.0        
                                              44 00 3b 00  48 00 3b 00              207.1.8        
                                              47 00 3a 00  45 00 3a 00              207.1.16       
                                              47 00 39 00  48 00 3a 00              207.1.24       
                                              47 00 3a 00  47 00 3b 00              207.1.32       
                                              48 00 3a 00  47 00 3a 00              207.1.40       
                                              47 00 3a 00  47 00 3a 00              207.1.48       
                                              46 00 3a 00  46 00 3b 00              207.1.56       
                                              49 00 3b 00  48 00 39 00              207.1.64       
                                              47 00 39 00  46 00 39 00              207.1.72       
                                              47 00 3c 00  47 00 39 00              207.1.80       
                                              47 00 39 00  47 00 39 00              207.1.88       
                                              45 00 3b 00  47 00 3b 00              207.1.96       
                                              47 00 3b 00  47 00 3a 00              207.1.104      
                                              48 00 3a 00  44 00 3a 00              207.1.112      
                                              47 00 3a 00  47 00 3a 00              207.1.120      
                                              47 00 3a 00  48 00 3a 00              207.1.128      
                                              47 00 3b 00  48 00 3b 00              207.1.136      
                                              48 00 3b 00  48 00 3b 00              207.1.144      
                                              47 00 3b 00  47 00 39 00              207.1.152      
                                              47 00 39 00  48 00 38 00              207.1.160      
                                              47 00 3b 00  45 00 3a 00              207.1.168      
                                              46 00 3a 00  48 00 38 00              207.1.176      
                                              46 00 3b 00  47 00 39 00              207.1.184      
                                              47 00 3a 00  48 00 39 00              207.1.192      
  10.2                         524288  IN     3b 00 48 00  3b 00 47 00   12ms       208.1.0        
                                              39 00 48 00  39 00 48 00              208.1.8        
                                              3b 00 48 00  39 00 48 00              208.1.16       
                                              3b 00 48 00  3b 00 47 00              208.1.24       
                                              3b 00 47 00  39 00 46 00              208.1.32       
                                              3b 00 48 00  3b 00 48 00              208.1.40       
                                              3c 00 46 00  3a 00 48 00              208.1.48       
                                              3b 00 47 00  3b 00 48 00              208.1.56       
                                              39 00 47 00  3a 00 48 00              208.1.64       
                                              3a 00 46 00  3b 00 48 00              208.1.72       
                                              39 00 46 00  3d 00 47 00              208.1.80       
                                              3a 00 47 00  3c 00 47 00              208.1.88       
                                              3b 00 48 00  3b 00 47 00              208.1.96       
                                              3b 00 48 00  3b 00 49 00              208.1.104      
                                              3b 00 46 00  39 00 47 00              208.1.112      
                                              3b 00 47 00  3b 00 47 00              208.1.120      
                                              3a 00 48 00  3a 00 47 00              208.1.128      
                                              3c 00 48 00  3b 00 48 00              208.1.136      
                                              3a 00 48 00  3b 00 48 00              208.1.144      
                                              39 00 46 00  3b 00 44 00              208.1.152      
                                              3c 00 46 00  3b 00 47 00              208.1.160      
                                              3a 00 46 00  39 00 47 00              208.1.168      
                                              3d 00 47 00  39 00 48 00              208.1.176      
                                              3b 00 47 00  3a 00 48 00              208.1.184      
                                              39 00 4a 00  39 00 47 00              208.1.192      
  10.2                             31  IN     1a 00 00 00  01 00 02 00   38us       209.1.0        
                                              31 84 00 01  04 00 28 1a              209.1.8        
                                              00 00 01 01  04 00 00 00              209.1.16       
                                              00 00 00 55  aa 55 aa                 209.1.24       
  10.2                         524288  IN     49 00 3b 00  48 00 3d 00   98ms       210.1.0        
                                              48 00 3b 00  48 00 3b 00              210.1.8        
                                              49 00 3c 00  49 00 3b 00              210.1.16       
                                              49 00 3c 00  49 00 3b 00              210.1.24       
                                              49 00 3d 00  4a 00 3e 00              210.1.32       
                                              48 00 3b 00  48 00 3d 00              210.1.40       
                                              4b 00 3d 00  4a 00 3d 00              210.1.48       
                                              4a 00 3d 00  4c 00 3d 00              210.1.56       
                                              48 00 3c 00  49 00 3e 00              210.1.64       
                                              4a 00 3f 00  4b 00 3d 00              210.1.72       
                                              49 00 3d 00  47 00 3b 00              210.1.80       
                                              4a 00 3c 00  4a 00 3d 00              210.1.88       
                                              48 00 3b 00  48 00 3b 00              210.1.96       
                                              47 00 3b 00  49 00 3d 00              210.1.104      
                                              4b 00 3f 00  49 00 3d 00              210.1.112      
                                              49 00 3b 00  49 00 3c 00              210.1.120      
                                              4a 00 3d 00  49 00 3a 00              210.1.128      
                                              49 00 3d 00  49 00 3d 00              210.1.136      
                                              49 00 3d 00  49 00 3e 00              210.1.144      
                                              4a 00 3d 00  4a 00 3f 00              210.1.152      
                                              4b 00 3d 00  4a 00 3a 00              210.1.160      
                                              4a 00 3d 00  4a 00 3d 00              210.1.168      
                                              48 00 40 00  4a 00 3d 00              210.1.176      
                                              4b 00 3c 00  49 00 3c 00              210.1.184      
                                              49 00 3e 00  48 00 3e 00              210.1.192      
  10.2                         524288  IN     47 00 3b 00  47 00 3a 00   13ms       211.1.0        
                                              48 00 3a 00  46 00 38 00              211.1.8        
                                              47 00 3a 00  48 00 3b 00              211.1.16       
                                              48 00 3b 00  47 00 3b 00              211.1.24       
                                              47 00 39 00  45 00 39 00              211.1.32       
                                              48 00 39 00  47 00 39 00              211.1.40       
                                              46 00 39 00  47 00 39 00              211.1.48       
                                              48 00 3b 00  48 00 3a 00              211.1.56       
                                              47 00 39 00  47 00 3a 00              211.1.64       
                                              46 00 3b 00  46 00 3a 00              211.1.72       
                                              47 00 39 00  47 00 3a 00              211.1.80       
                                              46 00 39 00  46 00 3b 00              211.1.88       
                                              46 00 3a 00  46 00 39 00              211.1.96       
                                              48 00 39 00  47 00 3a 00              211.1.104      
                                              48 00 38 00  46 00 39 00              211.1.112      
                                              44 00 39 00  46 00 39 00              211.1.120      
                                              46 00 39 00  48 00 39 00              211.1.128      
                                              47 00 39 00  47 00 39 00              211.1.136      
                                              47 00 39 00  48 00 3b 00              211.1.144      
                                              46 00 3a 00  46 00 39 00              211.1.152      
                                              47 00 3b 00  45 00 3b 00              211.1.160      
                                              46 00 38 00  48 00 37 00              211.1.168      
                                              47 00 39 00  47 00 3a 00              211.1.176      
                                              46 00 3b 00  45 00 38 00              211.1.184      
                                              46 00 3a 00  47 00 3b 00              211.1.192      
  10.2                         524288  IN     3d 00 49 00  39 00 48 00   13ms       212.1.0        
                                              3b 00 48 00  39 00 48 00              212.1.8        
                                              39 00 47 00  39 00 47 00              212.1.16       
                                              3a 00 47 00  3c 00 47 00              212.1.24       
                                              37 00 47 00  3a 00 47 00              212.1.32       
                                              39 00 47 00  39 00 46 00              212.1.40       
                                              3a 00 47 00  3b 00 47 00              212.1.48       
                                              3b 00 48 00  3a 00 46 00              212.1.56       
                                              39 00 46 00  39 00 49 00              212.1.64       
                                              3a 00 49 00  3a 00 46 00              212.1.72       
                                              3b 00 48 00  39 00 47 00              212.1.80       
                                              39 00 46 00  3a 00 45 00              212.1.88       
                                              39 00 47 00  39 00 46 00              212.1.96       
                                              3a 00 48 00  3a 00 47 00              212.1.104      
                                              3b 00 48 00  3a 00 47 00              212.1.112      
                                              39 00 48 00  3a 00 48 00              212.1.120      
                                              3a 00 48 00  3a 00 48 00              212.1.128      
                                              39 00 47 00  38 00 45 00              212.1.136      
                                              3c 00 47 00  3b 00 47 00              212.1.144      
                                              3b 00 46 00  3b 00 47 00              212.1.152      
                                              39 00 48 00  3a 00 47 00              212.1.160      
                                              3b 00 46 00  39 00 47 00              212.1.168      
                                              3b 00 46 00  3b 00 48 00              212.1.176      
                                              3b 00 47 00  3a 00 47 00              212.1.184      
                                              3b 00 48 00  3b 00 48 00              212.1.192      
  10.2                         524288  IN     44 00 39 00  46 00 3b 00   13ms       213.1.0        
                                              47 00 3b 00  47 00 39 00              213.1.8        
                                              48 00 39 00  48 00 3d 00              213.1.16       
                                              48 00 3a 00  48 00 3a 00              213.1.24       
                                              48 00 3c 00  48 00 39 00              213.1.32       
                                              47 00 3b 00  47 00 3a 00              213.1.40       
                                              48 00 3a 00  48 00 3a 00              213.1.48       
                                              46 00 3a 00  47 00 3c 00              213.1.56       
                                              48 00 3b 00  48 00 39 00              213.1.64       
                                              47 00 3b 00  47 00 39 00              213.1.72       
                                              48 00 3a 00  46 00 3b 00              213.1.80       
                                              47 00 3a 00  46 00 3a 00              213.1.88       
                                              46 00 39 00  47 00 3b 00              213.1.96       
                                              46 00 3b 00  48 00 3c 00              213.1.104      
                                              46 00 3a 00  48 00 3a 00              213.1.112      
                                              48 00 3a 00  46 00 39 00              213.1.120      
                                              46 00 39 00  47 00 39 00              213.1.128      
                                              46 00 3b 00  46 00 3a 00              213.1.136      
                                              46 00 3b 00  48 00 3a 00              213.1.144      
                                              46 00 39 00  47 00 3a 00              213.1.152      
                                              45 00 3b 00  48 00 3a 00              213.1.160      
                                              47 00 39 00  49 00 3c 00              213.1.168      
                                              47 00 39 00  48 00 3a 00              213.1.176      
                                              47 00 3b 00  46 00 39 00              213.1.184      
                                              48 00 3b 00  47 00 39 00              213.1.192      
  10.2                         524288  IN     3a 00 48 00  39 00 46 00   12ms       214.1.0        
                                              3b 00 48 00  3b 00 47 00              214.1.8        
                                              3b 00 46 00  3a 00 48 00              214.1.16       
                                              3b 00 46 00  3a 00 46 00              214.1.24       
                                              38 00 46 00  3a 00 48 00              214.1.32       
                                              39 00 47 00  3b 00 46 00              214.1.40       
                                              3a 00 44 00  39 00 47 00              214.1.48       
                                              39 00 46 00  3a 00 46 00              214.1.56       
                                              39 00 47 00  3b 00 47 00              214.1.64       
                                              39 00 47 00  3b 00 47 00              214.1.72       
                                              3b 00 46 00  3b 00 48 00              214.1.80       
                                              3a 00 48 00  3b 00 48 00              214.1.88       
                                              3a 00 47 00  38 00 46 00              214.1.96       
                                              3a 00 46 00  39 00 47 00              214.1.104      
                                              3b 00 47 00  39 00 48 00              214.1.112      
                                              39 00 44 00  39 00 47 00              214.1.120      
                                              39 00 48 00  39 00 48 00              214.1.128      
                                              3b 00 46 00  3a 00 48 00              214.1.136      
                                              3a 00 49 00  3a 00 47 00              214.1.144      
                                              39 00 48 00  39 00 47 00              214.1.152      
                                              3b 00 47 00  39 00 48 00              214.1.160      
                                              39 00 46 00  3b 00 48 00              214.1.168      
                                              3b 00 48 00  39 00 47 00              214.1.176      
                                              3a 00 47 00  3a 00 47 00              214.1.184      
                                              3b 00 46 00  38 00 46 00              214.1.192      
  10.2                             31  IN     1a 00 00 00  01 00 02 00   39us       215.1.0        
                                              31 84 00 01  04 00 29 1a              215.1.8        
                                              00 00 01 01  04 00 00 00              215.1.16       
                                              00 00 00 55  aa 55 aa                 215.1.24       
  10.2                         524288  IN     49 00 3d 00  48 00 3b 00   98ms       216.1.0        
                                              48 00 3c 00  49 00 3e 00              216.1.8        
                                              49 00 3b 00  48 00 3d 00              216.1.16       
                                              48 00 3c 00  49 00 3b 00              216.1.24       
                                              46 00 3c 00  48 00 3c 00              216.1.32       
                                              48 00 3c 00  4a 00 3d 00              216.1.40       
                                              4a 00 3d 00  47 00 3b 00              216.1.48       
                                              49 00 3d 00  4b 00 3d 00              216.1.56       
                                              4a 00 3b 00  49 00 3d 00              216.1.64       
                                              49 00 3d 00  48 00 3c 00              216.1.72       
                                              48 00 3b 00  48 00 3d 00              216.1.80       
                                              4a 00 3d 00  4a 00 3d 00              216.1.88       
                                              48 00 3c 00  4a 00 3c 00              216.1.96       
                                              49 00 3c 00  4b 00 3b 00              216.1.104      
                                              4a 00 3f 00  49 00 3d 00              216.1.112      
                                              49 00 3d 00  4a 00 3d 00              216.1.120      
                                              4a 00 3f 00  4a 00 3c 00              216.1.128      
                                              48 00 3b 00  4a 00 3d 00              216.1.136      
                                              49 00 3d 00  49 00 3e 00              216.1.144      
                                              49 00 3c 00  48 00 3e 00              216.1.152      
                                              4b 00 3d 00  4a 00 3c 00              216.1.160      
                                              46 00 3b 00  49 00 3e 00              216.1.168      
                                              48 00 3d 00  49 00 3f 00              216.1.176      
                                              4a 00 3e 00  49 00 3d 00              216.1.184      
                                              49 00 3c 00  49 00 3b 00              216.1.192      
  10.2                         524288  IN     48 00 3a 00  47 00 3b 00   13ms       217.1.0        
                                              47 00 38 00  47 00 3b 00              217.1.8        
                                              48 00 3b 00  49 00 39 00              217.1.16       
                                              48 00 3b 00  48 00 3b 00              217.1.24       
                                              49 00 3b 00  47 00 3b 00              217.1.32       
                                              47 00 3b 00  47 00 3b 00              217.1.40       
                                              48 00 3b 00  48 00 3a 00              217.1.48       
                                              47 00 3a 00  47 00 3b 00              217.1.56       
                                              47 00 3b 00  47 00 3a 00              217.1.64       
                                              48 00 39 00  47 00 3a 00              217.1.72       
                                              47 00 3b 00  47 00 39 00              217.1.80       
                                              48 00 3b 00  46 00 39 00              217.1.88       
                                              45 00 39 00  47 00 3b 00              217.1.96       
                                              48 00 3a 00  47 00 3a 00              217.1.104      
                                              47 00 39 00  46 00 39 00              217.1.112      
                                              46 00 39 00  47 00 3a 00              217.1.120      
                                              47 00 3b 00  47 00 3b 00              217.1.128      
                                              48 00 39 00  47 00 3b 00              217.1.136      
                                              47 00 39 00  46 00 3a 00              217.1.144      
                                              48 00 38 00  47 00 3a 00              217.1.152      
                                              46 00 39 00  46 00 3b 00              217.1.160      
                                              47 00 39 00  47 00 39 00              217.1.168      
                                              48 00 3a 00  47 00 3b 00              217.1.176      
                                              47 00 3b 00  47 00 3a 00              217.1.184      
                                              44 00 3a 00  47 00 3a 00              217.1.192      
  10.2                         524288  IN     3b 00 45 00  3b 00 47 00   12ms       218.1.0        
                                              3a 00 47 00  39 00 47 00              218.1.8        
                                              3b 00 46 00  39 00 47 00              218.1.16       
                                              39 00 46 00  3a 00 47 00              218.1.24       
                                              3b 00 48 00  39 00 49 00              218.1.32       
                                              3b 00 48 00  3a 00 47 00              218.1.40       
                                              3b 00 48 00  39 00 47 00              218.1.48       
                                              39 00 47 00  3b 00 48 00              218.1.56       
                                              3b 00 48 00  39 00 47 00              218.1.64       
                                              3b 00 48 00  39 00 48 00              218.1.72       
                                              3b 00 4a 00  39 00 46 00              218.1.80       
                                              39 00 48 00  3b 00 4a 00              218.1.88       
                                              39 00 48 00  3a 00 47 00              218.1.96       
                                              3c 00 47 00  39 00 48 00              218.1.104      
                                              3a 00 48 00  3a 00 48 00              218.1.112      
                                              3a 00 47 00  3a 00 46 00              218.1.120      
                                              39 00 46 00  3a 00 48 00              218.1.128      
                                              39 00 47 00  39 00 47 00              218.1.136      
                                              39 00 48 00  39 00 47 00              218.1.144      
                                              3b 00 46 00  3a 00 48 00              218.1.152      
                                              3b 00 47 00  3a 00 48 00              218.1.160      
                                              3a 00 47 00  3a 00 48 00              218.1.168      
                                              3a 00 45 00  39 00 45 00              218.1.176      
                                              3b 00 45 00  39 00 45 00              218.1.184      
                                              3a 00 47 00  3a 00 47 00              218.1.192      
  10.2                         524288  IN     44 00 3b 00  46 00 39 00   13ms       219.1.0        
                                              46 00 3b 00  48 00 3a 00              219.1.8        
                                              47 00 3b 00  48 00 3a 00              219.1.16       
                                              47 00 3d 00  48 00 3b 00              219.1.24       
                                              47 00 3a 00  48 00 3b 00              219.1.32       
                                              48 00 39 00  46 00 3b 00              219.1.40       
                                              48 00 3a 00  47 00 3b 00              219.1.48       
                                              46 00 39 00  46 00 3b 00              219.1.56       
                                              48 00 3b 00  47 00 3b 00              219.1.64       
                                              47 00 3a 00  48 00 3a 00              219.1.72       
                                              47 00 3a 00  47 00 39 00              219.1.80       
                                              47 00 39 00  48 00 39 00              219.1.88       
                                              48 00 3a 00  48 00 3a 00              219.1.96       
                                              47 00 3b 00  47 00 39 00              219.1.104      
                                              46 00 3b 00  44 00 3c 00              219.1.112      
                                              47 00 3a 00  47 00 39 00              219.1.120      
                                              46 00 39 00  48 00 3d 00              219.1.128      
                                              46 00 39 00  47 00 3b 00              219.1.136      
                                              46 00 38 00  49 00 3a 00              219.1.144      
                                              47 00 3b 00  46 00 3b 00              219.1.152      
                                              46 00 39 00  48 00 3b 00              219.1.160      
                                              46 00 39 00  46 00 3b 00              219.1.168      
                                              46 00 3b 00  48 00 3a 00              219.1.176      
                                              49 00 3a 00  46 00 3a 00              219.1.184      
                                              46 00 3a 00  46 00 3b 00              219.1.192      
  10.2                         524288  IN     39 00 47 00  3b 00 46 00   13ms       220.1.0        
                                              39 00 46 00  39 00 46 00              220.1.8        
                                              3b 00 46 00  39 00 48 00              220.1.16       
                                              3a 00 48 00  3b 00 48 00              220.1.24       
                                              3b 00 48 00  38 00 47 00              220.1.32       
                                              3a 00 47 00  3a 00 48 00              220.1.40       
                                              3a 00 48 00  3a 00 47 00              220.1.48       
                                              3a 00 47 00  39 00 46 00              220.1.56       
                                              3b 00 47 00  3a 00 47 00              220.1.64       
                                              3b 00 48 00  3b 00 48 00              220.1.72       
                                              39 00 46 00  3b 00 46 00              220.1.80       
                                              3a 00 48 00  3a 00 47 00              220.1.88       
                                              3b 00 47 00  3a 00 45 00              220.1.96       
                                              39 00 47 00  3b 00 47 00              220.1.104      
                                              3b 00 47 00  3b 00 48 00              220.1.112      
                                              3b 00 46 00  39 00 48 00              220.1.120      
                                              39 00 48 00  3b 00 46 00              220.1.128      
                                              3b 00 47 00  3b 00 48 00              220.1.136      
                                              3b 00 46 00  3b 00 48 00              220.1.144      
                                              3b 00 46 00  39 00 46 00              220.1.152      
                                              3b 00 48 00  39 00 49 00              220.1.160      
                                              39 00 46 00  3b 00 48 00              220.1.168      
                                              3c 00 47 00  3a 00 47 00              220.1.176      
                                              3a 00 45 00  3b 00 48 00              220.1.184      
                                              39 00 48 00  3a 00 48 00              220.1.192      
  10.2                             31  IN     1a 00 00 00  01 00 02 00   37us       221.1.0        
                                              31 84 00 01  04 00 2a 1a              221.1.8        
                                              00 00 01 01  04 00 00 00              221.1.16       
                                              00 00 00 55  aa 55 aa                 221.1.24       
  10.2                         524288  IN     49 00 3b 00  49 00 3e 00   98ms       222.1.0        
                                              49 00 3b 00  49 00 3c 00              222.1.8        
                                              48 00 3c 00  4a 00 3d 00              222.1.16       
                                              4a 00 39 00  49 00 3c 00              222.1.24       
                                              49 00 3d 00  49 00 3b 00              222.1.32       
                                              4a 00 3d 00  49 00 3d 00              222.1.40       
                                              4b 00 3d 00  49 00 3e 00              222.1.48       
                                              4b 00 3c 00  4b 00 3d 00              222.1.56       
                                              49 00 3b 00  4a 00 3d 00              222.1.64       
                                              49 00 3d 00  4a 00 3c 00              222.1.72       
                                              4b 00 3d 00  49 00 3c 00              222.1.80       
                                              48 00 3b 00  4a 00 3f 00              222.1.88       
                                              49 00 3d 00  4a 00 3e 00              222.1.96       
                                              4a 00 3d 00  49 00 3c 00              222.1.104      
                                              4a 00 3e 00  49 00 3d 00              222.1.112      
                                              4a 00 3e 00  4a 00 3c 00              222.1.120      
                                              48 00 3c 00  4a 00 3d 00              222.1.128      
                                              48 00 3d 00  48 00 3d 00              222.1.136      
                                              4a 00 3c 00  4a 00 3e 00              222.1.144      
                                              4a 00 3d 00  4a 00 3e 00              222.1.152      
                                              49 00 3d 00  49 00 3d 00              222.1.160      
                                              48 00 3c 00  4c 00 3d 00              222.1.168      
                                              4a 00 3d 00  4a 00 3b 00              222.1.176      
                                              49 00 3d 00  4a 00 3c 00              222.1.184      
                                              4a 00 3c 00  48 00 3c 00              222.1.192      
  10.2                         524288  IN     48 00 3b 00  48 00 39 00   13ms       223.1.0        
                                              46 00 3a 00  47 00 3b 00              223.1.8        
                                              47 00 3c 00  48 00 3a 00              223.1.16       
                                              48 00 3a 00  47 00 3a 00              223.1.24       
                                              48 00 3b 00  47 00 3c 00              223.1.32       
                                              47 00 3c 00  48 00 3a 00              223.1.40       
                                              47 00 3b 00  47 00 3b 00              223.1.48       
                                              4a 00 3a 00  46 00 3a 00              223.1.56       
                                              48 00 3b 00  48 00 3b 00              223.1.64       
                                              47 00 3b 00  48 00 3b 00              223.1.72       
                                              45 00 3b 00  46 00 3c 00              223.1.80       
                                              46 00 3b 00  47 00 3b 00              223.1.88       
                                              47 00 3b 00  48 00 3b 00              223.1.96       
                                              48 00 3a 00  47 00 3a 00              223.1.104      
                                              47 00 3a 00  49 00 3c 00              223.1.112      
                                              48 00 3a 00  47 00 3b 00              223.1.120      
                                              47 00 39 00  47 00 3b 00              223.1.128      
                                              46 00 39 00  48 00 3a 00              223.1.136      
                                              47 00 39 00  46 00 3b 00              223.1.144      
                                              46 00 39 00  48 00 38 00              223.1.152      
                                              47 00 3a 00  48 00 3b 00              223.1.160      
                                              47 00 3a 00  46 00 3b 00              223.1.168      
                                              46 00 3b 00  47 00 39 00              223.1.176      
                                              48 00 3b 00  46 00 3a 00              223.1.184      
                                              47 00 3b 00  47 00 3b 00              223.1.192      
  10.2                         524288  IN     3b 00 47 00  3a 00 47 00   13ms       224.1.0        
                                              3c 00 48 00  3a 00 48 00              224.1.8        
                                              3a 00 47 00  38 00 47 00              224.1.16       
                                              3a 00 46 00  3b 00 46 00              224.1.24       
                                              3b 00 48 00  3b 00 47 00              224.1.32       
                                              39 00 46 00  3b 00 48 00              224.1.40       
                                              3a 00 48 00  3b 00 48 00              224.1.48       
                                              3c 00 48 00  3c 00 47 00              224.1.56       
                                              3b 00 47 00  39 00 48 00              224.1.64       
                                              3a 00 48 00  3a 00 47 00              224.1.72       
                                              3b 00 46 00  3c 00 46 00              224.1.80       
                                              39 00 47 00  3b 00 48 00              224.1.88       
                                              3b 00 47 00  3a 00 45 00              224.1.96       
                                              3c 00 46 00  3a 00 47 00              224.1.104      
                                              3c 00 48 00  3b 00 47 00              224.1.112      
                                              3d 00 47 00  3b 00 47 00              224.1.120      
                                              3a 00 48 00  3b 00 48 00              224.1.128      
                                              3c 00 47 00  3a 00 47 00              224.1.136      
                                              3b 00 46 00  3a 00 45 00              224.1.144      
                                              39 00 47 00  3b 00 4a 00              224.1.152      
                                              3a 00 48 00  3d 00 46 00              224.1.160      
                                              3a 00 48 00  3c 00 46 00              224.1.168      
                                              39 00 45 00  3b 00 46 00              224.1.176      
                                              3b 00 46 00  3b 00 45 00              224.1.184      
                                              3b 00 45 00  3c 00 47 00              224.1.192      
  10.0                                 CTL    80 06 00 01  00 00 12 00  6.0ms       225.1.0        
  10.0                             18  IN     12 01 00 02  00 00 00 40  180us       225.2.0        
                                              48 44 70 56  40 1b 01 02              225.2.8        
                                              00 01                                 225.2.16       
  10.0                                 CTL    80 06 00 03  00 00 02 00   26us       226.1.0        
  10.0                              2  IN     04 03                     139us       226.2.0        
  10.0                                 CTL    80 06 00 03  00 00 04 00   12us       227.1.0        
  10.0                              4  IN     04 03 09 04               155us       227.2.0        
  10.0                                 CTL    80 06 01 03  09 04 02 00    9us       228.1.0        
  10.0                              2  IN     06 03                     116us       228.2.0        
  10.0                                 CTL    80 06 01 03  09 04 06 00    9us       229.1.0        
  10.0                              6  IN     06 03 54 00  33 00        168us       229.2.0        
  10.0                                 CTL    80 06 02 03  09 04 02 00   10us       230.1.0        
  10.0                              2  IN     1a 03                     172us       230.2.0        
  10.0                                 CTL    80 06 02 03  09 04 1a 00    9us       231.1.0        
  10.0                             26  IN     1a 03 52 00  48 00 31 00  125us       231.2.0        
                                              30 00 31 00  35 00 30 00              231.2.8        
                                              30 00 35 00  30 00 32 00              231.2.16       
                                              31 00                                 231.2.24       
  10.0                                 CTL    80 06 00 03  09 04 02 00   12us       232.1.0        
  10.0                              2  IN     04 03                     173us       232.2.0        
  10.0                                 CTL    80 06 00 03  09 04 04 00   21us       233.1.0        
  10.0                              4  IN     04 03 09 04               123us       233.2.0        
  10.0                                 CTL    80 06 02 03  09 04 02 00  560us       234.1.0        
  10.0                              2  IN     1a 03                     150us       234.2.0        
  10.0                                 CTL    80 06 02 03  09 04 1a 00    9us       235.1.0        
  10.0                             26  IN     1a 03 52 00  48 00 31 00  137us       235.2.0        
                                              30 00 31 00  35 00 30 00              235.2.8        
                                              30 00 35 00  30 00 32 00              235.2.16       
                                              31 00                                 235.2.24       
  10.0                                 CTL    80 06 01 03  00 00 20 00  140us       236.1.0        
  10.0                              6  IN     06 03 54 00  33 00        174us       236.2.0        
  10.0                                 CTL    c0 e1 00 00  00 00 04 00   20us       237.1.0        
  10.0                              4  IN     03 0b 00 00               1.6ms       237.2.0        
  10.0                                 CTL    c0 b4 00 00  00 00 01 00   72us       238.1.0(2)     
  10.0                              1  IN     54                        188us       238.2.0        
  10.0                                 CTL    c0 e1 00 00  04 00 40 00  234us       240.1.0        
  10.2                         524288  IN     47 00 3b 00  46 00 3b 00  2.0ms       241.1.0        
                                              46 00 3b 00  46 00 3a 00              241.1.8        
                                              46 00 3b 00  46 00 3b 00              241.1.16       
                                              48 00 3a 00  47 00 3c 00              241.1.24       
                                              48 00 3c 00  47 00 3b 00              241.1.32       
                                              47 00 39 00  47 00 3a 00              241.1.40       
                                              48 00 3c 00  47 00 39 00              241.1.48       
                                              47 00 3b 00  47 00 3c 00              241.1.56       
                                              46 00 3b 00  46 00 3c 00              241.1.64       
                                              48 00 3a 00  48 00 39 00              241.1.72       
                                              47 00 39 00  47 00 3b 00              241.1.80       
                                              47 00 39 00  47 00 39 00              241.1.88       
                                              46 00 3b 00  46 00 3d 00              241.1.96       
                                              49 00 3b 00  46 00 3a 00              241.1.104      
                                              46 00 3b 00  48 00 3b 00              241.1.112      
                                              47 00 39 00  47 00 38 00              241.1.120      
                                              46 00 3b 00  48 00 3a 00              241.1.128      
                                              48 00 3c 00  46 00 3a 00              241.1.136      
                                              47 00 3b 00  47 00 3a 00              241.1.144      
                                              46 00 38 00  46 00 3b 00              241.1.152      
                                              46 00 3a 00  48 00 3b 00              241.1.160      
                                              48 00 3a 00  45 00 38 00              241.1.168      
                                              48 00 3b 00  47 00 3b 00              241.1.176      
                                              47 00 3b 00  45 00 3b 00              241.1.184      
                                              47 00 3a 00  47 00 38 00              241.1.192      
  10.0                             64  IN     00 00 00 00  01 01 00 00  2.0ms       240.2.0        
                                              0f 44 61 68  65 6e 67 20              240.2.8        
                                              49 6d 61 67  69 6e 67 00              240.2.16       
                                              20 00 00 00  01 01 00 00              240.2.24       
                                              0f 4d 45 52  2d 31 33 30              240.2.32       
                                              2d 33 30 55  4d 2d 4c 00              240.2.40       
                                              80 00 00 00  01 01 00 00              240.2.48       
                                              0d 52 48 31  30 31 35 30              240.2.56       
  10.0                                 CTL    c0 b4 00 00  00 00 01 00   65us       242.1.0(2)     
  10.0                              1  IN     54                        168us       242.2.0        
  10.0                                 CTL    c0 e1 00 00  44 00 40 00  183us       244.1.0        
  10.0                             64  IN     30 35 30 32  31 00 90 00  4.1ms       244.2.0        
                                              00 00 01 01  00 00 03 36              244.2.8        
                                              37 00 04 01  00 00 01 01              244.2.16       
                                              00 00 0a 31  32 33 34 56              244.2.24       
                                              33 32 30 33  00 14 01 00              244.2.32       
                                              00 01 01 00  00 0e 31 2e              244.2.40       
                                              31 2e 31 33  30 35 2e 39              244.2.48       
                                              33 30 31 00  00 02 00 00              244.2.56       
  10.0                                 CTL    c0 b4 00 00  00 00 01 00   21us       245.1.0(2)     
  10.0                              1  IN     54                        257us       245.2.0        
  10.0                                 CTL    80 06 02 03  00 00 20 00  270us       247.1.0        
  10.0                             26  IN     1a 03 52 00  48 00 31 00  130us       247.2.0        
                                              30 00 31 00  35 00 30 00              247.2.8        
                                              30 00 35 00  30 00 32 00              247.2.16       
                                              31 00                                 247.2.24       
  10.0                                 CTL    80 06 00 01  00 00 12 00  550us       248.1.0        
  10.0                             18  IN     12 01 00 02  00 00 00 40  148us       248.2.0        
                                              48 44 70 56  40 1b 01 02              248.2.8        
                                              00 01                                 248.2.16       
  10.0                                 CTL    80 06 00 03  00 00 02 00   10us       249.1.0        
  10.0                              2  IN     04 03                     161us       249.2.0        
  10.0                                 CTL    80 06 00 03  00 00 04 00    9us       250.1.0        
  10.0                              4  IN     04 03 09 04               152us       250.2.0        
  10.0                                 CTL    80 06 01 03  09 04 02 00   11us       251.1.0        
  10.0                              2  IN     06 03                     159us       251.2.0        
  10.0                                 CTL    80 06 01 03  09 04 06 00    8us       252.1.0        
  10.0                              6  IN     06 03 54 00  33 00        147us       252.2.0        
  10.0                                 CTL    80 06 02 03  09 04 02 00   11us       253.1.0        
  10.0                              2  IN     1a 03                     154us       253.2.0        
  10.0                                 CTL    80 06 02 03  09 04 1a 00    9us       254.1.0        
  10.0                             26  IN     1a 03 52 00  48 00 31 00  188us       254.2.0        
                                              30 00 31 00  35 00 30 00              254.2.8        
                                              30 00 35 00  30 00 32 00              254.2.16       
                                              31 00                                 254.2.24       
  10.0                                 CTL    80 06 00 03  09 04 02 00   10us       255.1.0        
  10.0                              2  IN     04 03                     156us       255.2.0        
  10.0                                 CTL    80 06 00 03  09 04 04 00    9us       256.1.0        
  10.0                              4  IN     04 03 09 04               159us       256.2.0        
  10.0                                 CTL    80 06 02 03  09 04 02 00  512us       257.1.0        
  10.0                              2  IN     1a 03                     140us       257.2.0        
  10.0                                 CTL    80 06 02 03  09 04 1a 00   10us       258.1.0        
  10.0                             26  IN     1a 03 52 00  48 00 31 00  129us       258.2.0        
                                              30 00 31 00  35 00 30 00              258.2.8        
                                              30 00 35 00  30 00 32 00              258.2.16       
                                              31 00                                 258.2.24       
  10.0                                 CTL    80 06 01 03  00 00 20 00  123us       259.1.0        
  10.0                              6  IN     06 03 54 00  33 00        165us       259.2.0        
  10.0                                 CTL    c0 e1 00 00  00 00 04 00   19us       260.1.0        
  10.0                              4  IN     03 0b 00 00               1.6ms       260.2.0        
  10.0                                 CTL    c0 b4 00 00  00 00 01 00   19us       261.1.0(2)     
  10.0                              1  IN     54                        164us       261.2.0        
  10.0                                 CTL    c0 e1 00 00  04 00 40 00  227us       263.1.0        
  10.2                         524288  IN     39 00 47 00  3c 00 47 00  512us       264.1.0        
                                              39 00 47 00  39 00 46 00              264.1.8        
                                              3a 00 47 00  3a 00 48 00              264.1.16       
                                              3b 00 46 00  3b 00 47 00              264.1.24       
                                              37 00 46 00  3b 00 46 00              264.1.32       
                                              3a 00 46 00  39 00 46 00              264.1.40       
                                              3b 00 44 00  39 00 43 00              264.1.48       
                                              3a 00 46 00  3a 00 46 00              264.1.56       
                                              3a 00 46 00  3a 00 46 00              264.1.64       
                                              3a 00 46 00  3b 00 46 00              264.1.72       
                                              3a 00 48 00  3b 00 47 00              264.1.80       
                                              3a 00 47 00  3b 00 45 00              264.1.88       
                                              3a 00 47 00  3b 00 46 00              264.1.96       
                                              3b 00 47 00  39 00 46 00              264.1.104      
                                              3a 00 45 00  3a 00 46 00              264.1.112      
                                              39 00 48 00  39 00 47 00              264.1.120      
                                              3a 00 47 00  3b 00 48 00              264.1.128      
                                              3b 00 48 00  3b 00 48 00              264.1.136      
                                              3a 00 48 00  3b 00 44 00              264.1.144      
                                              3a 00 46 00  3b 00 44 00              264.1.152      
                                              3c 00 47 00  39 00 48 00              264.1.160      
                                              39 00 49 00  39 00 46 00              264.1.168      
                                              3d 00 46 00  3b 00 46 00              264.1.176      
                                              39 00 46 00  38 00 45 00              264.1.184      
                                              3a 00 49 00  3a 00 48 00              264.1.192      
  10.2                             31  IN     1a 00 00 00  01 00 02 00   37us       265.1.0        
                                              31 84 00 01  04 00 2b 1a              265.1.8        
                                              00 00 01 01  04 00 00 00              265.1.16       
                                              00 00 00 55  aa 55 aa                 265.1.24       
  10.0                             64  IN     00 00 00 00  01 01 00 00  3.5ms       263.2.0        
                                              0f 44 61 68  65 6e 67 20              263.2.8        
                                              49 6d 61 67  69 6e 67 00              263.2.16       
                                              20 00 00 00  01 01 00 00              263.2.24       
                                              0f 4d 45 52  2d 31 33 30              263.2.32       
                                              2d 33 30 55  4d 2d 4c 00              263.2.40       
                                              80 00 00 00  01 01 00 00              263.2.48       
                                              0d 52 48 31  30 31 35 30              263.2.56       
  10.0                                 CTL    c0 b4 00 00  00 00 01 00   23us       266.1.0(2)     
  10.0                              1  IN     54                         80us       266.2.0        
  10.0                                 CTL    c0 e1 00 00  44 00 40 00  145us       268.1.0        
  10.0                             64  IN     30 35 30 32  31 00 90 00  4.0ms       268.2.0        
                                              00 00 01 01  00 00 03 36              268.2.8        
                                              37 00 04 01  00 00 01 01              268.2.16       
                                              00 00 0a 31  32 33 34 56              268.2.24       
                                              33 32 30 33  00 14 01 00              268.2.32       
                                              00 01 01 00  00 0e 31 2e              268.2.40       
                                              31 2e 31 33  30 35 2e 39              268.2.48       
                                              33 30 31 00  00 02 00 00              268.2.56       
  10.0                                 CTL    c0 b4 00 00  00 00 01 00   55us       269.1.0(2)     
  10.0                              1  IN     54                        111us       269.2.0        
  10.0                                 CTL    80 06 02 03  00 00 20 00  107us       271.1.0        
  10.0                             26  IN     1a 03 52 00  48 00 31 00   80us       271.2.0        
                                              30 00 31 00  35 00 30 00              271.2.8        
                                              30 00 35 00  30 00 32 00              271.2.16       
                                              31 00                                 271.2.24       
  10.2                         524288  IN     46 00 3d 00  4a 00 3b 00   90ms       272.1.0        
                                              4a 00 3c 00  4a 00 3d 00              272.1.8        
                                              4a 00 3d 00  4a 00 3e 00              272.1.16       
                                              49 00 3b 00  4b 00 3e 00              272.1.24       
                                              47 00 3f 00  49 00 3b 00              272.1.32       
                                              48 00 3b 00  48 00 3d 00              272.1.40       
                                              49 00 3c 00  48 00 3b 00              272.1.48       
                                              49 00 3d 00  48 00 3e 00              272.1.56       
                                              4a 00 3b 00  49 00 3b 00              272.1.64       
                                              4a 00 3b 00  49 00 3b 00              272.1.72       
                                              49 00 3c 00  49 00 3b 00              272.1.80       
                                              49 00 3f 00  4a 00 3d 00              272.1.88       
                                              4b 00 3c 00  49 00 3b 00              272.1.96       
                                              4a 00 3b 00  4a 00 3b 00              272.1.104      
                                              4a 00 3d 00  49 00 3d 00              272.1.112      
                                              49 00 3d 00  4b 00 3d 00              272.1.120      
                                              4a 00 3e 00  48 00 3c 00              272.1.128      
                                              49 00 3d 00  4a 00 3e 00              272.1.136      
                                              4a 00 3d 00  49 00 3e 00              272.1.144      
                                              4c 00 3e 00  4a 00 3e 00              272.1.152      
                                              4a 00 3e 00  4a 00 3d 00              272.1.160      
                                              48 00 3b 00  4b 00 3b 00              272.1.168      
                                              4a 00 3b 00  4a 00 3d 00              272.1.176      
                                              48 00 3e 00  4a 00 3d 00              272.1.184      
                                              4b 00 3d 00  48 00 3d 00              272.1.192      
  10.2                         524288  IN     47 00 3a 00  46 00 3a 00   12ms       273.1.0        
                                              48 00 38 00  48 00 3a 00              273.1.8        
                                              46 00 3a 00  48 00 3b 00              273.1.16       
                                              47 00 3b 00  46 00 39 00              273.1.24       
                                              46 00 3b 00  4a 00 3b 00              273.1.32       
                                              46 00 3b 00  45 00 39 00              273.1.40       
                                              48 00 3b 00  48 00 3a 00              273.1.48       
                                              48 00 3b 00  47 00 3a 00              273.1.56       
                                              48 00 39 00  46 00 3b 00              273.1.64       
                                              46 00 3a 00  46 00 3a 00              273.1.72       
                                              48 00 39 00  48 00 3b 00              273.1.80       
                                              47 00 3b 00  46 00 3b 00              273.1.88       
                                              47 00 3b 00  4a 00 3b 00              273.1.96       
                                              48 00 3b 00  47 00 3b 00              273.1.104      
                                              48 00 3b 00  48 00 3a 00              273.1.112      
                                              47 00 3a 00  48 00 3b 00              273.1.120      
                                              48 00 3a 00  45 00 3a 00              273.1.128      
                                              47 00 3b 00  48 00 39 00              273.1.136      
                                              48 00 3c 00  46 00 3b 00              273.1.144      
                                              46 00 3b 00  47 00 3b 00              273.1.152      
                                              47 00 39 00  46 00 3a 00              273.1.160      
                                              47 00 39 00  48 00 3b 00              273.1.168      
                                              47 00 3b 00  46 00 3b 00              273.1.176      
                                              47 00 3b 00  47 00 39 00              273.1.184      
                                              47 00 39 00  47 00 3c 00              273.1.192      
  10.2                         524288  IN     3b 00 48 00  39 00 46 00   13ms       274.1.0        
                                              3a 00 46 00  39 00 46 00              274.1.8        
                                              39 00 48 00  3a 00 47 00              274.1.16       
                                              39 00 48 00  39 00 47 00              274.1.24       
                                              3a 00 48 00  39 00 48 00              274.1.32       
                                              39 00 46 00  3b 00 47 00              274.1.40       
                                              3b 00 47 00  3a 00 46 00              274.1.48       
                                              3b 00 47 00  3b 00 46 00              274.1.56       
                                              39 00 48 00  3a 00 48 00              274.1.64       
                                              39 00 4a 00  38 00 46 00              274.1.72       
                                              3b 00 47 00  39 00 48 00              274.1.80       
                                              3b 00 47 00  3b 00 45 00              274.1.88       
                                              39 00 49 00  3b 00 48 00              274.1.96       
                                              3a 00 45 00  3a 00 46 00              274.1.104      
                                              3a 00 48 00  39 00 46 00              274.1.112      
                                              39 00 47 00  38 00 46 00              274.1.120      
                                              39 00 46 00  3b 00 49 00              274.1.128      
                                              39 00 47 00  3b 00 47 00              274.1.136      
                                              3b 00 47 00  39 00 48 00              274.1.144      
                                              3b 00 47 00  39 00 48 00              274.1.152      
                                              3a 00 47 00  3a 00 46 00              274.1.160      
                                              3a 00 48 00  3b 00 46 00              274.1.168      
                                              3b 00 48 00  3a 00 47 00              274.1.176      
                                              3a 00 49 00  3b 00 47 00              274.1.184      
                                              39 00 47 00  3a 00 46 00              274.1.192      
  10.2                         524288  IN     46 00 39 00  46 00 3a 00   13ms       275.1.0        
                                              46 00 3a 00  47 00 39 00              275.1.8        
                                              48 00 39 00  46 00 38 00              275.1.16       
                                              46 00 39 00  46 00 39 00              275.1.24       
                                              45 00 3b 00  47 00 3a 00              275.1.32       
                                              48 00 3a 00  48 00 3a 00              275.1.40       
                                              46 00 39 00  46 00 3b 00              275.1.48       
                                              48 00 39 00  47 00 3a 00              275.1.56       
                                              48 00 3a 00  48 00 3b 00              275.1.64       
                                              47 00 3a 00  47 00 3b 00              275.1.72       
                                              46 00 3a 00  46 00 3a 00              275.1.80       
                                              46 00 3a 00  48 00 3b 00              275.1.88       
                                              45 00 3a 00  47 00 3b 00              275.1.96       
                                              48 00 3b 00  47 00 3b 00              275.1.104      
                                              46 00 3a 00  48 00 39 00              275.1.112      
                                              46 00 3b 00  46 00 39 00              275.1.120      
                                              46 00 39 00  47 00 3b 00              275.1.128      
                                              46 00 3b 00  46 00 3b 00              275.1.136      
                                              44 00 3b 00  47 00 3a 00              275.1.144      
                                              46 00 39 00  46 00 39 00              275.1.152      
                                              45 00 39 00  47 00 39 00              275.1.160      
                                              47 00 3a 00  46 00 3b 00              275.1.168      
                                              46 00 3a 00  48 00 39 00              275.1.176      
                                              46 00 3a 00  46 00 3b 00              275.1.184      
                                              46 00 39 00  46 00 39 00              275.1.192      
  10.2                         524288  IN     3b 00 48 00  3b 00 48 00   13ms       276.1.0        
                                              39 00 47 00  3b 00 47 00              276.1.8        
                                              3a 00 47 00  38 00 47 00              276.1.16       
                                              3a 00 48 00  3b 00 47 00              276.1.24       
                                              39 00 47 00  3b 00 47 00              276.1.32       
                                              3a 00 46 00  3a 00 48 00              276.1.40       
                                              3a 00 46 00  3a 00 48 00              276.1.48       
                                              3b 00 48 00  3b 00 48 00              276.1.56       
                                              3b 00 45 00  3b 00 46 00              276.1.64       
                                              38 00 47 00  3a 00 46 00              276.1.72       
                                              3a 00 48 00  3c 00 47 00              276.1.80       
                                              3b 00 48 00  3b 00 46 00              276.1.88       
                                              3b 00 48 00  3b 00 47 00              276.1.96       
                                              3b 00 45 00  3b 00 48 00              276.1.104      
                                              3b 00 46 00  3a 00 47 00              276.1.112      
                                              39 00 47 00  3b 00 47 00              276.1.120      
                                              3b 00 47 00  3b 00 48 00              276.1.128      
                                              3b 00 47 00  3b 00 48 00              276.1.136      
                                              39 00 48 00  39 00 48 00              276.1.144      
                                              3b 00 45 00  39 00 48 00              276.1.152      
                                              3b 00 45 00  39 00 48 00              276.1.160      
                                              3b 00 47 00  3a 00 49 00              276.1.168      
                                              3b 00 48 00  39 00 48 00              276.1.176      
                                              3a 00 47 00  3b 00 46 00              276.1.184      
                                              3b 00 48 00  3b 00 46 00              276.1.192      
  10.2                             31  IN     1a 00 00 00  01 00 02 00   33us       277.1.0        
                                              31 84 00 01  04 00 2c 1a              277.1.8        
                                              00 00 01 01  04 00 00 00              277.1.16       
                                              00 00 00 55  aa 55 aa                 277.1.24       
  10.2                         524288  IN     48 00 3c 00  48 00 3d 00   98ms       278.1.0        
                                              49 00 3b 00  49 00 3c 00              278.1.8        
                                              48 00 3b 00  48 00 3c 00              278.1.16       
                                              48 00 3d 00  4b 00 3d 00              278.1.24       
                                              47 00 3d 00  4a 00 3b 00              278.1.32       
                                              49 00 3d 00  49 00 3e 00              278.1.40       
                                              4a 00 3d 00  49 00 3b 00              278.1.48       
                                              4a 00 3b 00  4b 00 3d 00              278.1.56       
                                              48 00 3b 00  4b 00 3d 00              278.1.64       
                                              49 00 3d 00  48 00 3d 00              278.1.72       
                                              49 00 3d 00  49 00 3d 00              278.1.80       
                                              4a 00 3d 00  4b 00 3e 00              278.1.88       
                                              48 00 3b 00  4c 00 3d 00              278.1.96       
                                              48 00 3d 00  4b 00 3e 00              278.1.104      
                                              4d 00 40 00  49 00 3e 00              278.1.112      
                                              49 00 3f 00  4c 00 3d 00              278.1.120      
                                              4a 00 3d 00  4a 00 3d 00              278.1.128      
                                              49 00 3d 00  4b 00 3e 00              278.1.136      
                                              49 00 3e 00  4a 00 3f 00              278.1.144      
                                              4c 00 3d 00  4b 00 3f 00              278.1.152      
                                              4b 00 3d 00  4a 00 3d 00              278.1.160      
                                              47 00 3c 00  4c 00 3d 00              278.1.168      
                                              4a 00 3e 00  4c 00 3d 00              278.1.176      
                                              49 00 3f 00  49 00 3f 00              278.1.184      
                                              4a 00 3b 00  4b 00 3f 00              278.1.192      
  10.2                         524288  IN     47 00 39 00  46 00 3b 00   12ms       279.1.0        
                                              47 00 3a 00  45 00 39 00              279.1.8        
                                              46 00 3d 00  48 00 3b 00              279.1.16       
                                              47 00 3b 00  48 00 3a 00              279.1.24       
                                              47 00 3a 00  48 00 38 00              279.1.32       
                                              46 00 3a 00  47 00 3b 00              279.1.40       
                                              47 00 3b 00  48 00 38 00              279.1.48       
                                              48 00 3b 00  47 00 39 00              279.1.56       
                                              47 00 3b 00  47 00 3a 00              279.1.64       
                                              46 00 3a 00  48 00 3b 00              279.1.72       
                                              48 00 38 00  48 00 39 00              279.1.80       
                                              47 00 3b 00  47 00 3c 00              279.1.88       
                                              48 00 3a 00  47 00 39 00              279.1.96       
                                              48 00 39 00  46 00 3a 00              279.1.104      
                                              48 00 39 00  47 00 3b 00              279.1.112      
                                              46 00 3b 00  46 00 3a 00              279.1.120      
                                              48 00 3a 00  46 00 39 00              279.1.128      
                                              47 00 39 00  47 00 39 00              279.1.136      
                                              46 00 39 00  47 00 3b 00              279.1.144      
                                              47 00 3b 00  47 00 39 00              279.1.152      
                                              44 00 3a 00  48 00 3b 00              279.1.160      
                                              45 00 39 00  47 00 39 00              279.1.168      
                                              44 00 3b 00  46 00 38 00              279.1.176      
                                              47 00 3b 00  46 00 3a 00              279.1.184      
                                              46 00 39 00  45 00 3b 00              279.1.192      
  10.2                         524288  IN     3c 00 47 00  3b 00 48 00   13ms       280.1.0        
                                              3b 00 47 00  3a 00 47 00              280.1.8        
                                              39 00 46 00  39 00 47 00              280.1.16       
                                              3a 00 48 00  3b 00 47 00              280.1.24       
                                              3a 00 47 00  39 00 46 00              280.1.32       
                                              39 00 46 00  3b 00 46 00              280.1.40       
                                              39 00 48 00  38 00 47 00              280.1.48       
                                              3a 00 4a 00  3a 00 49 00              280.1.56       
                                              3a 00 44 00  39 00 48 00              280.1.64       
                                              3b 00 48 00  3b 00 46 00              280.1.72       
                                              39 00 46 00  3a 00 46 00              280.1.80       
                                              3b 00 49 00  39 00 46 00              280.1.88       
                                              3a 00 47 00  3b 00 48 00              280.1.96       
                                              3c 00 47 00  3b 00 47 00              280.1.104      
                                              3b 00 47 00  3a 00 46 00              280.1.112      
                                              3d 00 48 00  3a 00 48 00              280.1.120      
                                              3b 00 46 00  3b 00 47 00              280.1.128      
                                              39 00 46 00  3a 00 46 00              280.1.136      
                                              3a 00 48 00  3a 00 47 00              280.1.144      
                                              3c 00 48 00  3a 00 47 00              280.1.152      
                                              39 00 48 00  3a 00 47 00              280.1.160      
                                              3b 00 47 00  39 00 47 00              280.1.168      
                                              39 00 47 00  3a 00 47 00              280.1.176      
                                              3a 00 47 00  3b 00 48 00              280.1.184      
                                              3b 00 45 00  39 00 47 00              280.1.192      
  10.2                         524288  IN     47 00 3a 00  47 00 38 00   12ms       281.1.0        
                                              47 00 3b 00  48 00 3b 00              281.1.8        
                                              46 00 3a 00  47 00 3b 00              281.1.16       
                                              45 00 3c 00  47 00 3a 00              281.1.24       
                                              46 00 3b 00  46 00 39 00              281.1.32       
                                              47 00 39 00  46 00 3b 00              281.1.40       
                                              48 00 3b 00  47 00 3b 00              281.1.48       
                                              47 00 3b 00  46 00 3b 00              281.1.56       
                                              47 00 39 00  45 00 3a 00              281.1.64       
                                              46 00 39 00  48 00 39 00              281.1.72       
                                              48 00 39 00  48 00 39 00              281.1.80       
                                              44 00 3b 00  47 00 3a 00              281.1.88       
                                              47 00 3b 00  47 00 39 00              281.1.96       
                                              48 00 3b 00  48 00 3a 00              281.1.104      
                                              46 00 3a 00  47 00 3b 00              281.1.112      
                                              47 00 39 00  46 00 3a 00              281.1.120      
                                              46 00 39 00  47 00 39 00              281.1.128      
                                              46 00 3b 00  47 00 3c 00              281.1.136      
                                              47 00 39 00  47 00 3a 00              281.1.144      
                                              47 00 3b 00  48 00 3a 00              281.1.152      
                                              47 00 3b 00  47 00 39 00              281.1.160      
                                              46 00 39 00  46 00 39 00              281.1.168      
                                              46 00 3a 00  48 00 3b 00              281.1.176      
                                              48 00 3a 00  48 00 39 00              281.1.184      
                                              45 00 3b 00  47 00 39 00              281.1.192      
  10.2                         524288  IN     3a 00 46 00  39 00 47 00   12ms       282.1.0        
                                              3b 00 48 00  39 00 48 00              282.1.8        
                                              3a 00 46 00  39 00 48 00              282.1.16       
                                              39 00 47 00  3b 00 48 00              282.1.24       
                                              39 00 48 00  3b 00 46 00              282.1.32       
                                              39 00 47 00  3b 00 48 00              282.1.40       
                                              3b 00 47 00  39 00 46 00              282.1.48       
                                              39 00 46 00  3a 00 47 00              282.1.56       
                                              3b 00 46 00  38 00 46 00              282.1.64       
                                              3a 00 46 00  3a 00 47 00              282.1.72       
                                              3b 00 47 00  3b 00 48 00              282.1.80       
                                              3a 00 49 00  39 00 45 00              282.1.88       
                                              3d 00 48 00  39 00 47 00              282.1.96       
                                              3a 00 48 00  3b 00 47 00              282.1.104      
                                              39 00 48 00  3b 00 47 00              282.1.112      
                                              3a 00 48 00  39 00 48 00              282.1.120      
                                              3b 00 47 00  39 00 46 00              282.1.128      
                                              3b 00 47 00  39 00 47 00              282.1.136      
                                              39 00 48 00  3a 00 48 00              282.1.144      
                                              38 00 47 00  3a 00 46 00              282.1.152      
                                              39 00 48 00  39 00 47 00              282.1.160      
                                              3a 00 47 00  3a 00 48 00              282.1.168      
                                              3b 00 48 00  3a 00 47 00              282.1.176      
                                              3a 00 48 00  3a 00 49 00              282.1.184      
                                              3b 00 49 00  3a 00 4a 00              282.1.192      
  10.2                             31  IN     1a 00 00 00  01 00 02 00   33us       283.1.0        
                                              31 84 00 01  04 00 2d 1a              283.1.8        
                                              00 00 01 01  04 00 00 00              283.1.16       
                                              00 00 00 55  aa 55 aa                 283.1.24       
  10.2                         524288  IN     49 00 3b 00  48 00 3b 00   98ms       284.1.0        
                                              4a 00 3b 00  48 00 3b 00              284.1.8        
                                              4a 00 3b 00  4a 00 3d 00              284.1.16       
                                              49 00 3d 00  4a 00 3b 00              284.1.24       
                                              48 00 3b 00  4b 00 3b 00              284.1.32       
                                              49 00 3d 00  4b 00 3f 00              284.1.40       
                                              4a 00 3c 00  4a 00 3d 00              284.1.48       
                                              4a 00 3d 00  4a 00 3d 00              284.1.56       
                                              4a 00 3c 00  4a 00 3e 00              284.1.64       
                                              49 00 3c 00  49 00 3b 00              284.1.72       
                                              48 00 3d 00  46 00 3d 00              284.1.80       
                                              48 00 3b 00  4a 00 3d 00              284.1.88       
                                              48 00 3c 00  49 00 3b 00              284.1.96       
                                              49 00 3d 00  49 00 3b 00              284.1.104      
                                              49 00 3d 00  4c 00 3b 00              284.1.112      
                                              4a 00 3c 00  4a 00 3e 00              284.1.120      
                                              4a 00 3e 00  48 00 3b 00              284.1.128      
                                              48 00 3d 00  4a 00 3c 00              284.1.136      
                                              4a 00 3b 00  4a 00 3e 00              284.1.144      
                                              4b 00 3a 00  4b 00 3e 00              284.1.152      
                                              4a 00 3d 00  4b 00 3b 00              284.1.160      
                                              49 00 3b 00  4a 00 3d 00              284.1.168      
                                              48 00 3c 00  48 00 3c 00              284.1.176      
                                              49 00 3d 00  4b 00 3d 00              284.1.184      
                                              4a 00 3b 00  49 00 3e 00              284.1.192      
  10.2                         524288  IN     47 00 3a 00  47 00 3a 00   13ms       285.1.0        
                                              45 00 3c 00  47 00 3b 00              285.1.8        
                                              46 00 3b 00  48 00 3c 00              285.1.16       
                                              47 00 3b 00  47 00 3c 00              285.1.24       
                                              48 00 3a 00  47 00 39 00              285.1.32       
                                              48 00 39 00  47 00 3b 00              285.1.40       
                                              48 00 3a 00  47 00 39 00              285.1.48       
                                              47 00 3b 00  47 00 3b 00              285.1.56       
                                              47 00 3b 00  47 00 3b 00              285.1.64       
                                              47 00 3c 00  48 00 3a 00              285.1.72       
                                              48 00 3a 00  48 00 39 00              285.1.80       
                                              46 00 39 00  46 00 3b 00              285.1.88       
                                              48 00 3b 00  45 00 3c 00              285.1.96       
                                              48 00 39 00  47 00 3b 00              285.1.104      
                                              46 00 39 00  48 00 39 00              285.1.112      
                                              46 00 3a 00  48 00 3b 00              285.1.120      
                                              46 00 3a 00  48 00 39 00              285.1.128      
                                              48 00 39 00  46 00 3a 00              285.1.136      
                                              46 00 39 00  46 00 3a 00              285.1.144      
                                              45 00 39 00  46 00 39 00              285.1.152      
                                              46 00 3b 00  46 00 3b 00              285.1.160      
                                              4a 00 3b 00  46 00 39 00              285.1.168      
                                              46 00 3a 00  47 00 3b 00              285.1.176      
                                              46 00 39 00  48 00 39 00              285.1.184      
                                              48 00 39 00  47 00 3b 00              285.1.192      
  10.2                         524288  IN     3c 00 47 00  39 00 47 00   12ms       286.1.0        
                                              3b 00 46 00  3a 00 46 00              286.1.8        
                                              38 00 46 00  39 00 48 00              286.1.16       
                                              3a 00 46 00  3a 00 48 00              286.1.24       
                                              3a 00 46 00  3b 00 45 00              286.1.32       
                                              3a 00 45 00  3a 00 44 00              286.1.40       
                                              38 00 47 00  3a 00 48 00              286.1.48       
                                              3b 00 47 00  39 00 46 00              286.1.56       
                                              3a 00 46 00  3a 00 47 00              286.1.64       
                                              3a 00 47 00  3c 00 45 00              286.1.72       
                                              39 00 47 00  39 00 46 00              286.1.80       
                                              3b 00 45 00  39 00 46 00              286.1.88       
                                              3a 00 47 00  37 00 46 00              286.1.96       
                                              3b 00 47 00  3b 00 44 00              286.1.104      
                                              39 00 48 00  39 00 47 00              286.1.112      
                                              3a 00 47 00  3b 00 48 00              286.1.120      
                                              3b 00 48 00  39 00 47 00              286.1.128      
                                              39 00 48 00  3b 00 46 00              286.1.136      
                                              39 00 46 00  39 00 47 00              286.1.144      
                                              3a 00 47 00  3b 00 47 00              286.1.152      
                                              39 00 46 00  3b 00 47 00              286.1.160      
                                              3a 00 47 00  3a 00 46 00              286.1.168      
                                              3b 00 46 00  3a 00 46 00              286.1.176      
                                              3b 00 47 00  38 00 48 00              286.1.184      
                                              39 00 47 00  3b 00 47 00              286.1.192      
  10.2                         524288  IN     48 00 39 00  48 00 3a 00   12ms       287.1.0        
                                              46 00 3c 00  46 00 39 00              287.1.8        
                                              46 00 3b 00  47 00 38 00              287.1.16       
                                              47 00 3a 00  47 00 39 00              287.1.24       
                                              46 00 3a 00  47 00 3a 00              287.1.32       
                                              46 00 39 00  46 00 38 00              287.1.40       
                                              46 00 3b 00  47 00 3a 00              287.1.48       
                                              47 00 39 00  47 00 3a 00              287.1.56       
                                              49 00 3b 00  46 00 39 00              287.1.64       
                                              46 00 3a 00  48 00 39 00              287.1.72       
                                              45 00 39 00  47 00 3c 00              287.1.80       
                                              46 00 39 00  46 00 3a 00              287.1.88       
                                              46 00 39 00  45 00 3a 00              287.1.96       
                                              46 00 3a 00  47 00 3a 00              287.1.104      
                                              46 00 3b 00  47 00 39 00              287.1.112      
                                              46 00 3a 00  47 00 3a 00              287.1.120      
                                              46 00 3a 00  48 00 39 00              287.1.128      
                                              48 00 3b 00  47 00 3a 00              287.1.136      
                                              47 00 39 00  47 00 3b 00              287.1.144      
                                              47 00 3b 00  47 00 39 00              287.1.152      
                                              46 00 3a 00  47 00 3a 00              287.1.160      
                                              47 00 39 00  47 00 3a 00              287.1.168      
                                              47 00 3a 00  45 00 3b 00              287.1.176      
                                              48 00 3a 00  47 00 3b 00              287.1.184      
                                              46 00 3a 00  47 00 38 00              287.1.192      
  10.2                         524288  IN     3c 00 48 00  3b 00 46 00   12ms       288.1.0        
                                              3b 00 47 00  3b 00 47 00              288.1.8        
                                              39 00 49 00  3b 00 47 00              288.1.16       
                                              3b 00 46 00  39 00 46 00              288.1.24       
                                              39 00 47 00  3b 00 48 00              288.1.32       
                                              39 00 46 00  3a 00 47 00              288.1.40       
                                              39 00 47 00  3b 00 47 00              288.1.48       
                                              3a 00 47 00  3b 00 47 00              288.1.56       
                                              3a 00 48 00  39 00 47 00              288.1.64       
                                              3b 00 47 00  3c 00 47 00              288.1.72       
                                              3a 00 47 00  3b 00 46 00              288.1.80       
                                              3b 00 47 00  3b 00 47 00              288.1.88       
                                              3b 00 48 00  3a 00 46 00              288.1.96       
                                              3a 00 48 00  3a 00 48 00              288.1.104      
                                              3b 00 47 00  3b 00 46 00              288.1.112      
                                              3a 00 48 00  3a 00 46 00              288.1.120      
                                              3b 00 48 00  3a 00 47 00              288.1.128      
                                              3c 00 47 00  3a 00 47 00              288.1.136      
                                              38 00 48 00  3a 00 48 00              288.1.144      
                                              3a 00 47 00  39 00 48 00              288.1.152      
                                              3b 00 46 00  39 00 47 00              288.1.160      
                                              39 00 47 00  39 00 49 00              288.1.168      
                                              3b 00 47 00  3b 00 47 00              288.1.176      
                                              39 00 47 00  39 00 47 00              288.1.184      
                                              39 00 49 00  3b 00 47 00              288.1.192      
  10.2                             31  IN     1a 00 00 00  01 00 02 00   37us       289.1.0        
                                              31 84 00 01  04 00 2e 1a              289.1.8        
                                              00 00 01 01  04 00 00 00              289.1.16       
                                              00 00 00 55  aa 55 aa                 289.1.24       
