Bus Hound 6.00 capture on Windows Vista (x64). Complements of www.perisoft.net

  Device - Device ID (followed by the endpoint for USB devices)
            (6) USB Root Hub (USB 3.0)
            (8) USB Mass Storage Device
            (10) USB2.0 Digital Camera
            (11) USB Composite Device
            (15) Generic Flash Disk [ROM=8.07]
            (20) EarPods
            (21) USB Input Device
            (22) USB Input Device
            (28) HID-compliant consumer control device
            (29) HID-compliant vendor-defined device
            (31) HID Keyboard Device
            (32) HID-compliant consumer control device
            (33) HID-compliant system controller
            (34) HID-compliant vendor-defined device
            (35) HID-compliant vendor-defined device
            (37) HID Keyboard Device
            (38) HID-compliant mouse
            (39) HID-compliant mouse
  Address - FireWire async address or channel number
  Length - Total transfer length
  Phase  - Phase Type
            ASTS  ATA task file status       NTSTS NTSTATUS value
            ATA   ATA task file command      OUT   Data out transfer
            BRB   Bluetooth request block    RESET bus reset
            CMD   SCSI/ATAPI command         SENSE SCSI sense data
            CTL   USB control transfer       SSTS  SCSI request block status
            IN    Data in transfer           USTS  USB status
            ISOC  Isochronous transfer       ok    command complete
            LOCK  FireWire lock transaction
  Data   - Hex dump of the data transferred
  Delta  - Elapsed time from the previous phase to the current phase
  Cmd... - Position in the captured data


Device  Address              Length    Phase  Data                      Delta  Cmd.Phase.Ofs(rep)
------  -------------------  --------  -----  ------------------------  -----  ------------------
  10.2                         524288  IN     51 00 5e 00  52 00 5e 00   10ms         1.1.0        
                                              52 00 5e 00  50 00 5e 00                1.1.8        
                                              52 00 5e 00  51 00 5f 00                1.1.16       
                                              51 00 5f 00  51 00 5d 00                1.1.24       
                                              51 00 5e 00  55 00 5f 00                1.1.32       
                                              53 00 5d 00  51 00 5f 00                1.1.40       
                                              51 00 5f 00  52 00 5d 00                1.1.48       
                                              51 00 5e 00  50 00 5d 00                1.1.56       
                                              51 00 5e 00  52 00 5c 00                1.1.64       
                                              51 00 5c 00  51 00 5e 00                1.1.72       
                                              51 00 5c 00  54 00 5d 00                1.1.80       
                                              52 00 5e 00  54 00 5c 00                1.1.88       
                                              53 00 5f 00  53 00 5c 00                1.1.96       
                                              51 00 5e 00  50 00 60 00                1.1.104      
                                              52 00 5e 00  52 00 5b 00                1.1.112      
                                              52 00 5f 00  51 00 5f 00                1.1.120      
                                              51 00 5f 00  52 00 5f 00                1.1.128      
                                              53 00 60 00  50 00 60 00                1.1.136      
                                              52 00 61 00  51 00 5e 00                1.1.144      
                                              55 00 5e 00  51 00 5d 00                1.1.152      
                                              51 00 5d 00  50 00 5d 00                1.1.160      
                                              52 00 5d 00  50 00 5f 00                1.1.168      
                                              52 00 5e 00  53 00 60 00                1.1.176      
                                              50 00 5e 00  52 00 5e 00                1.1.184      
                                              51 00 61 00  4f 00 5e 00                1.1.192      
  10.2                             31  IN     1a 00 00 00  01 00 02 00   30us         2.1.0        
                                              31 84 00 01  04 00 5e 0f                2.1.8        
                                              00 00 01 01  04 00 00 00                2.1.16       
                                              00 00 00 55  aa 55 aa                   2.1.24       
  10.2                         524288  IN     5f 00 54 00  5f 00 57 00  251ms         3.1.0        
                                              61 00 55 00  63 00 56 00                3.1.8        
                                              62 00 56 00  61 00 56 00                3.1.16       
                                              62 00 54 00  66 00 53 00                3.1.24       
                                              60 00 57 00  62 00 55 00                3.1.32       
                                              62 00 59 00  62 00 59 00                3.1.40       
                                              64 00 57 00  5f 00 57 00                3.1.48       
                                              63 00 57 00  65 00 57 00                3.1.56       
                                              64 00 55 00  64 00 57 00                3.1.64       
                                              66 00 59 00  63 00 56 00                3.1.72       
                                              64 00 59 00  61 00 57 00                3.1.80       
                                              65 00 58 00  65 00 56 00                3.1.88       
                                              60 00 55 00  62 00 57 00                3.1.96       
                                              62 00 57 00  64 00 55 00                3.1.104      
                                              64 00 5b 00  66 00 53 00                3.1.112      
                                              63 00 56 00  65 00 55 00                3.1.120      
                                              65 00 59 00  64 00 55 00                3.1.128      
                                              62 00 57 00  62 00 57 00                3.1.136      
                                              61 00 59 00  61 00 5c 00                3.1.144      
                                              63 00 57 00  65 00 58 00                3.1.152      
                                              64 00 57 00  61 00 55 00                3.1.160      
                                              5f 00 55 00  66 00 58 00                3.1.168      
                                              62 00 56 00  64 00 57 00                3.1.176      
                                              63 00 57 00  67 00 59 00                3.1.184      
                                              64 00 57 00  61 00 57 00                3.1.192      
  10.2                         524288  IN     5e 00 51 00  60 00 53 00   12ms         4.1.0        
                                              5c 00 52 00  5e 00 52 00                4.1.8        
                                              5d 00 52 00  5f 00 51 00                4.1.16       
                                              5f 00 51 00  60 00 52 00                4.1.24       
                                              60 00 51 00  5f 00 51 00                4.1.32       
                                              5f 00 51 00  5d 00 51 00                4.1.40       
                                              5f 00 53 00  5e 00 53 00                4.1.48       
                                              5f 00 50 00  5d 00 51 00                4.1.56       
                                              5d 00 53 00  5f 00 54 00                4.1.64       
                                              5c 00 53 00  5d 00 51 00                4.1.72       
                                              5e 00 51 00  5e 00 53 00                4.1.80       
                                              5d 00 52 00  5f 00 50 00                4.1.88       
                                              5c 00 51 00  5c 00 51 00                4.1.96       
                                              5f 00 4f 00  5e 00 4d 00                4.1.104      
                                              5e 00 4f 00  60 00 4e 00                4.1.112      
                                              5e 00 52 00  5e 00 53 00                4.1.120      
                                              5f 00 50 00  5c 00 50 00                4.1.128      
                                              5d 00 51 00  5e 00 50 00                4.1.136      
                                              5d 00 51 00  5f 00 52 00                4.1.144      
                                              5e 00 50 00  5f 00 51 00                4.1.152      
                                              5f 00 4f 00  5f 00 51 00                4.1.160      
                                              5e 00 4f 00  5c 00 53 00                4.1.168      
                                              5f 00 52 00  5c 00 53 00                4.1.176      
                                              5e 00 50 00  5e 00 50 00                4.1.184      
                                              5e 00 51 00  5e 00 53 00                4.1.192      
  10.2                         524288  IN     55 00 5e 00  51 00 5e 00   12ms         5.1.0        
                                              52 00 5f 00  52 00 5f 00                5.1.8        
                                              52 00 61 00  54 00 5e 00                5.1.16       
                                              50 00 5e 00  51 00 5e 00                5.1.24       
                                              50 00 62 00  51 00 60 00                5.1.32       
                                              52 00 60 00  53 00 60 00                5.1.40       
                                              51 00 60 00  52 00 60 00                5.1.48       
                                              53 00 5f 00  52 00 5c 00                5.1.56       
                                              53 00 5e 00  53 00 5f 00                5.1.64       
                                              54 00 5e 00  51 00 5c 00                5.1.72       
                                              50 00 5d 00  51 00 5e 00                5.1.80       
                                              52 00 5e 00  51 00 60 00                5.1.88       
                                              52 00 5d 00  52 00 5f 00                5.1.96       
                                              51 00 5c 00  51 00 5f 00                5.1.104      
                                              51 00 5e 00  51 00 60 00                5.1.112      
                                              52 00 5e 00  53 00 5f 00                5.1.120      
                                              53 00 5f 00  52 00 5f 00                5.1.128      
                                              51 00 5e 00  50 00 5f 00                5.1.136      
                                              52 00 5e 00  51 00 5d 00                5.1.144      
                                              51 00 5e 00  53 00 5d 00                5.1.152      
                                              52 00 5d 00  51 00 5f 00                5.1.160      
                                              51 00 5d 00  4f 00 5e 00                5.1.168      
                                              53 00 5b 00  52 00 60 00                5.1.176      
                                              53 00 5d 00  53 00 5f 00                5.1.184      
                                              51 00 5e 00  53 00 5f 00                5.1.192      
  10.2                         524288  IN     5d 00 53 00  60 00 52 00   13ms         6.1.0        
                                              60 00 50 00  60 00 51 00                6.1.8        
                                              5f 00 50 00  5d 00 52 00                6.1.16       
                                              5d 00 55 00  5d 00 51 00                6.1.24       
                                              61 00 51 00  61 00 52 00                6.1.32       
                                              5f 00 50 00  5f 00 52 00                6.1.40       
                                              5f 00 51 00  5e 00 52 00                6.1.48       
                                              5f 00 53 00  5e 00 53 00                6.1.56       
                                              60 00 53 00  5f 00 51 00                6.1.64       
                                              5c 00 54 00  61 00 51 00                6.1.72       
                                              60 00 54 00  5d 00 50 00                6.1.80       
                                              5e 00 50 00  5e 00 51 00                6.1.88       
                                              5c 00 54 00  5e 00 51 00                6.1.96       
                                              61 00 55 00  60 00 51 00                6.1.104      
                                              5e 00 53 00  5e 00 52 00                6.1.112      
                                              5f 00 51 00  5e 00 50 00                6.1.120      
                                              60 00 51 00  60 00 52 00                6.1.128      
                                              5f 00 4f 00  5e 00 54 00                6.1.136      
                                              60 00 51 00  5f 00 51 00                6.1.144      
                                              5f 00 51 00  5d 00 52 00                6.1.152      
                                              5e 00 53 00  60 00 52 00                6.1.160      
                                              5f 00 4f 00  5e 00 53 00                6.1.168      
                                              5e 00 53 00  5e 00 52 00                6.1.176      
                                              60 00 54 00  5f 00 51 00                6.1.184      
                                              60 00 52 00  5f 00 51 00                6.1.192      
  10.2                         524288  IN     51 00 60 00  53 00 5f 00   12ms         7.1.0        
                                              53 00 60 00  52 00 5e 00                7.1.8        
                                              52 00 60 00  4f 00 5e 00                7.1.16       
                                              54 00 60 00  54 00 60 00                7.1.24       
                                              53 00 5d 00  53 00 60 00                7.1.32       
                                              52 00 5e 00  53 00 5e 00                7.1.40       
                                              53 00 5e 00  52 00 60 00                7.1.48       
                                              52 00 5c 00  52 00 5f 00                7.1.56       
                                              52 00 5f 00  51 00 5b 00                7.1.64       
                                              51 00 60 00  53 00 5e 00                7.1.72       
                                              52 00 5f 00  54 00 5f 00                7.1.80       
                                              52 00 5f 00  53 00 5f 00                7.1.88       
                                              53 00 5e 00  53 00 60 00                7.1.96       
                                              53 00 60 00  52 00 5e 00                7.1.104      
                                              52 00 5d 00  53 00 61 00                7.1.112      
                                              53 00 5f 00  51 00 5e 00                7.1.120      
                                              53 00 5e 00  53 00 60 00                7.1.128      
                                              53 00 60 00  54 00 60 00                7.1.136      
                                              52 00 61 00  51 00 5e 00                7.1.144      
                                              51 00 60 00  52 00 5c 00                7.1.152      
                                              53 00 60 00  50 00 5e 00                7.1.160      
                                              51 00 5e 00  51 00 62 00                7.1.168      
                                              53 00 62 00  50 00 5e 00                7.1.176      
                                              51 00 5d 00  52 00 62 00                7.1.184      
                                              51 00 61 00  52 00 61 00                7.1.192      
  10.2                             31  IN     1a 00 00 00  01 00 02 00   31us         8.1.0        
                                              31 84 00 01  04 00 5f 0f                8.1.8        
                                              00 00 01 01  04 00 00 00                8.1.16       
                                              00 00 00 55  aa 55 aa                   8.1.24       
  10.2                         524288  IN     60 00 57 00  5f 00 53 00  249ms         9.1.0        
                                              63 00 55 00  61 00 55 00                9.1.8        
                                              61 00 53 00  60 00 57 00                9.1.16       
                                              61 00 53 00  62 00 56 00                9.1.24       
                                              60 00 55 00  61 00 55 00                9.1.32       
                                              61 00 56 00  61 00 5b 00                9.1.40       
                                              64 00 57 00  61 00 55 00                9.1.48       
                                              64 00 57 00  61 00 59 00                9.1.56       
                                              62 00 54 00  64 00 59 00                9.1.64       
                                              63 00 55 00  5f 00 56 00                9.1.72       
                                              65 00 57 00  63 00 58 00                9.1.80       
                                              63 00 56 00  63 00 56 00                9.1.88       
                                              60 00 56 00  64 00 57 00                9.1.96       
                                              63 00 56 00  65 00 56 00                9.1.104      
                                              63 00 5b 00  63 00 57 00                9.1.112      
                                              63 00 58 00  66 00 59 00                9.1.120      
                                              64 00 57 00  62 00 55 00                9.1.128      
                                              60 00 57 00  66 00 55 00                9.1.136      
                                              62 00 59 00  64 00 5c 00                9.1.144      
                                              64 00 56 00  66 00 5a 00                9.1.152      
                                              64 00 58 00  64 00 58 00                9.1.160      
                                              63 00 57 00  67 00 57 00                9.1.168      
                                              61 00 58 00  62 00 5b 00                9.1.176      
                                              64 00 5b 00  66 00 57 00                9.1.184      
                                              61 00 56 00  64 00 55 00                9.1.192      
  10.2                         524288  IN     5d 00 51 00  5c 00 4f 00   13ms        10.1.0        
                                              5e 00 51 00  5c 00 52 00               10.1.8        
                                              5c 00 50 00  5e 00 51 00               10.1.16       
                                              5f 00 51 00  5c 00 51 00               10.1.24       
                                              5e 00 51 00  5f 00 51 00               10.1.32       
                                              5d 00 51 00  5e 00 51 00               10.1.40       
                                              5d 00 53 00  5c 00 51 00               10.1.48       
                                              5f 00 51 00  5d 00 4f 00               10.1.56       
                                              5e 00 4f 00  5d 00 51 00               10.1.64       
                                              5c 00 53 00  5e 00 52 00               10.1.72       
                                              5d 00 51 00  5b 00 4f 00               10.1.80       
                                              5e 00 51 00  5b 00 51 00               10.1.88       
                                              5c 00 51 00  5e 00 52 00               10.1.96       
                                              60 00 4f 00  5d 00 50 00               10.1.104      
                                              5b 00 50 00  5c 00 4f 00               10.1.112      
                                              5c 00 50 00  5e 00 50 00               10.1.120      
                                              5f 00 50 00  5c 00 51 00               10.1.128      
                                              5f 00 51 00  5d 00 50 00               10.1.136      
                                              5e 00 4e 00  5d 00 51 00               10.1.144      
                                              5e 00 50 00  5d 00 53 00               10.1.152      
                                              5c 00 51 00  5e 00 51 00               10.1.160      
                                              5d 00 51 00  5b 00 50 00               10.1.168      
                                              5e 00 50 00  5d 00 53 00               10.1.176      
                                              5c 00 51 00  5b 00 50 00               10.1.184      
                                              5c 00 4f 00  5e 00 54 00               10.1.192      
  10.2                         524288  IN     54 00 5e 00  52 00 5e 00   14ms        11.1.0        
                                              50 00 5f 00  50 00 5d 00               11.1.8        
                                              51 00 5e 00  52 00 5f 00               11.1.16       
                                              51 00 61 00  52 00 5f 00               11.1.24       
                                              51 00 5e 00  50 00 60 00               11.1.32       
                                              52 00 5f 00  50 00 60 00               11.1.40       
                                              51 00 5f 00  53 00 5f 00               11.1.48       
                                              53 00 5e 00  53 00 5d 00               11.1.56       
                                              51 00 5f 00  52 00 60 00               11.1.64       
                                              51 00 5f 00  53 00 5b 00               11.1.72       
                                              53 00 5e 00  54 00 5c 00               11.1.80       
                                              53 00 60 00  53 00 5e 00               11.1.88       
                                              53 00 5e 00  53 00 60 00               11.1.96       
                                              53 00 5e 00  52 00 5c 00               11.1.104      
                                              53 00 5f 00  53 00 5e 00               11.1.112      
                                              52 00 5f 00  51 00 5d 00               11.1.120      
                                              52 00 5d 00  53 00 5f 00               11.1.128      
                                              51 00 5e 00  52 00 5e 00               11.1.136      
                                              4f 00 60 00  52 00 5f 00               11.1.144      
                                              53 00 5c 00  52 00 5c 00               11.1.152      
                                              50 00 5e 00  51 00 5e 00               11.1.160      
                                              55 00 5f 00  50 00 5e 00               11.1.168      
                                              4e 00 5e 00  53 00 5d 00               11.1.176      
                                              53 00 5f 00  52 00 60 00               11.1.184      
                                              50 00 5f 00  52 00 5c 00               11.1.192      
  10.2                         524288  IN     5e 00 52 00  5e 00 53 00   16ms        12.1.0        
                                              5d 00 51 00  5e 00 53 00               12.1.8        
                                              5f 00 51 00  5f 00 52 00               12.1.16       
                                              5d 00 51 00  5e 00 52 00               12.1.24       
                                              5d 00 53 00  5c 00 53 00               12.1.32       
                                              5c 00 53 00  5e 00 51 00               12.1.40       
                                              5f 00 52 00  5d 00 52 00               12.1.48       
                                              60 00 52 00  5e 00 50 00               12.1.56       
                                              5d 00 52 00  5e 00 53 00               12.1.64       
                                              5d 00 52 00  5f 00 52 00               12.1.72       
                                              5f 00 52 00  60 00 53 00               12.1.80       
                                              5c 00 51 00  5c 00 52 00               12.1.88       
                                              5d 00 54 00  5e 00 53 00               12.1.96       
                                              60 00 53 00  5e 00 52 00               12.1.104      
                                              5e 00 53 00  5d 00 50 00               12.1.112      
                                              5d 00 53 00  5f 00 52 00               12.1.120      
                                              5d 00 53 00  60 00 50 00               12.1.128      
                                              5e 00 54 00  5e 00 55 00               12.1.136      
                                              5e 00 51 00  5e 00 51 00               12.1.144      
                                              5e 00 52 00  5d 00 52 00               12.1.152      
                                              5f 00 52 00  5e 00 51 00               12.1.160      
                                              5e 00 51 00  5d 00 53 00               12.1.168      
                                              5e 00 52 00  5f 00 52 00               12.1.176      
                                              5f 00 4f 00  5d 00 51 00               12.1.184      
                                              5e 00 53 00  5c 00 50 00               12.1.192      
  10.2                         524288  IN     51 00 5e 00  50 00 5d 00  9.5ms        13.1.0        
                                              52 00 5e 00  51 00 60 00               13.1.8        
                                              52 00 5f 00  53 00 5f 00               13.1.16       
                                              53 00 5c 00  51 00 5f 00               13.1.24       
                                              51 00 5c 00  53 00 5e 00               13.1.32       
                                              53 00 5d 00  50 00 5f 00               13.1.40       
                                              53 00 5f 00  52 00 60 00               13.1.48       
                                              50 00 5e 00  54 00 5c 00               13.1.56       
                                              50 00 5e 00  51 00 5c 00               13.1.64       
                                              51 00 5f 00  54 00 5e 00               13.1.72       
                                              53 00 5c 00  51 00 60 00               13.1.80       
                                              51 00 62 00  50 00 5e 00               13.1.88       
                                              51 00 60 00  53 00 5f 00               13.1.96       
                                              52 00 60 00  52 00 5f 00               13.1.104      
                                              50 00 5f 00  54 00 5e 00               13.1.112      
                                              52 00 60 00  51 00 5e 00               13.1.120      
                                              55 00 5c 00  53 00 5f 00               13.1.128      
                                              53 00 60 00  50 00 5f 00               13.1.136      
                                              54 00 60 00  52 00 60 00               13.1.144      
                                              51 00 5e 00  50 00 5e 00               13.1.152      
                                              54 00 60 00  53 00 60 00               13.1.160      
                                              4f 00 5d 00  53 00 60 00               13.1.168      
                                              55 00 60 00  52 00 5e 00               13.1.176      
                                              4f 00 5d 00  52 00 60 00               13.1.184      
                                              54 00 60 00  50 00 5e 00               13.1.192      
  10.2                             31  IN     1a 00 00 00  01 00 02 00   37us        14.1.0        
                                              31 84 00 01  04 00 60 0f               14.1.8        
                                              00 00 01 01  04 00 00 00               14.1.16       
                                              00 00 00 55  aa 55 aa                  14.1.24       
  10.2                         524288  IN     61 00 55 00  5e 00 55 00  248ms        15.1.0        
                                              61 00 56 00  61 00 56 00               15.1.8        
                                              62 00 56 00  5e 00 55 00               15.1.16       
                                              62 00 53 00  62 00 57 00               15.1.24       
                                              5e 00 55 00  66 00 54 00               15.1.32       
                                              60 00 54 00  62 00 57 00               15.1.40       
                                              65 00 58 00  61 00 53 00               15.1.48       
                                              61 00 58 00  63 00 59 00               15.1.56       
                                              64 00 57 00  62 00 57 00               15.1.64       
                                              63 00 56 00  60 00 55 00               15.1.72       
                                              64 00 58 00  60 00 56 00               15.1.80       
                                              63 00 58 00  64 00 5a 00               15.1.88       
                                              60 00 55 00  60 00 54 00               15.1.96       
                                              62 00 55 00  64 00 57 00               15.1.104      
                                              66 00 59 00  62 00 57 00               15.1.112      
                                              61 00 55 00  64 00 59 00               15.1.120      
                                              64 00 56 00  61 00 54 00               15.1.128      
                                              5f 00 55 00  63 00 55 00               15.1.136      
                                              60 00 59 00  63 00 59 00               15.1.144      
                                              65 00 55 00  66 00 59 00               15.1.152      
                                              64 00 55 00  63 00 56 00               15.1.160      
                                              60 00 55 00  62 00 57 00               15.1.168      
                                              60 00 57 00  64 00 56 00               15.1.176      
                                              62 00 57 00  64 00 57 00               15.1.184      
                                              63 00 57 00  64 00 55 00               15.1.192      
  10.2                         524288  IN     5e 00 50 00  5e 00 50 00   14ms        16.1.0        
                                              5c 00 52 00  5e 00 52 00               16.1.8        
                                              5e 00 53 00  5e 00 51 00               16.1.16       
                                              5e 00 51 00  5c 00 52 00               16.1.24       
                                              5e 00 50 00  5e 00 53 00               16.1.32       
                                              60 00 53 00  5e 00 50 00               16.1.40       
                                              5e 00 51 00  5e 00 50 00               16.1.48       
                                              60 00 4f 00  60 00 50 00               16.1.56       
                                              5e 00 4e 00  5e 00 4f 00               16.1.64       
                                              60 00 51 00  5e 00 51 00               16.1.72       
                                              5f 00 51 00  5c 00 53 00               16.1.80       
                                              5d 00 51 00  60 00 52 00               16.1.88       
                                              5c 00 51 00  5c 00 51 00               16.1.96       
                                              5f 00 4f 00  5c 00 50 00               16.1.104      
                                              5f 00 50 00  5d 00 50 00               16.1.112      
                                              5e 00 50 00  5f 00 4f 00               16.1.120      
                                              5f 00 51 00  5c 00 50 00               16.1.128      
                                              5e 00 50 00  60 00 50 00               16.1.136      
                                              5c 00 51 00  5e 00 53 00               16.1.144      
                                              5d 00 51 00  5f 00 51 00               16.1.152      
                                              5e 00 51 00  5c 00 50 00               16.1.160      
                                              5e 00 50 00  5a 00 51 00               16.1.168      
                                              5d 00 53 00  5b 00 4f 00               16.1.176      
                                              5d 00 51 00  5e 00 52 00               16.1.184      
                                              5b 00 50 00  5f 00 52 00               16.1.192      
  10.2                         524288  IN     54 00 5e 00  4f 00 5e 00   11ms        17.1.0        
                                              52 00 5e 00  51 00 5e 00               17.1.8        
                                              51 00 5e 00  52 00 5e 00               17.1.16       
                                              50 00 5f 00  54 00 5f 00               17.1.24       
                                              51 00 5e 00  51 00 60 00               17.1.32       
                                              51 00 5f 00  53 00 5f 00               17.1.40       
                                              53 00 60 00  51 00 5f 00               17.1.48       
                                              53 00 5e 00  53 00 5e 00               17.1.56       
                                              53 00 5f 00  53 00 60 00               17.1.64       
                                              53 00 60 00  53 00 60 00               17.1.72       
                                              52 00 5f 00  52 00 5f 00               17.1.80       
                                              54 00 5f 00  52 00 5e 00               17.1.88       
                                              52 00 60 00  52 00 5d 00               17.1.96       
                                              53 00 5e 00  52 00 5e 00               17.1.104      
                                              54 00 5f 00  54 00 5e 00               17.1.112      
                                              53 00 5d 00  52 00 5e 00               17.1.120      
                                              51 00 5e 00  51 00 5c 00               17.1.128      
                                              51 00 5d 00  51 00 5e 00               17.1.136      
                                              50 00 60 00  53 00 5e 00               17.1.144      
                                              53 00 5c 00  53 00 5e 00               17.1.152      
                                              51 00 60 00  51 00 5f 00               17.1.160      
                                              55 00 5f 00  52 00 5e 00               17.1.168      
                                              53 00 60 00  51 00 5e 00               17.1.176      
                                              4f 00 5c 00  4f 00 5c 00               17.1.184      
                                              51 00 5f 00  53 00 60 00               17.1.192      
  10.2                         524288  IN     5d 00 52 00  5e 00 51 00   12ms        18.1.0        
                                              5c 00 51 00  60 00 52 00               18.1.8        
                                              5f 00 52 00  5f 00 53 00               18.1.16       
                                              5e 00 53 00  5e 00 52 00               18.1.24       
                                              5e 00 51 00  5e 00 51 00               18.1.32       
                                              5f 00 53 00  5d 00 53 00               18.1.40       
                                              60 00 50 00  5e 00 51 00               18.1.48       
                                              5e 00 53 00  5e 00 53 00               18.1.56       
                                              60 00 51 00  5f 00 52 00               18.1.64       
                                              5e 00 53 00  61 00 53 00               18.1.72       
                                              5d 00 53 00  5c 00 53 00               18.1.80       
                                              5e 00 53 00  5d 00 51 00               18.1.88       
                                              5e 00 54 00  62 00 52 00               18.1.96       
                                              5e 00 51 00  5c 00 50 00               18.1.104      
                                              5e 00 53 00  5d 00 53 00               18.1.112      
                                              5f 00 50 00  5f 00 51 00               18.1.120      
                                              60 00 53 00  5f 00 52 00               18.1.128      
                                              5e 00 53 00  60 00 54 00               18.1.136      
                                              5e 00 52 00  5e 00 51 00               18.1.144      
                                              5d 00 51 00  5e 00 50 00               18.1.152      
                                              5e 00 51 00  5d 00 51 00               18.1.160      
                                              5c 00 52 00  5e 00 51 00               18.1.168      
                                              5d 00 51 00  5b 00 52 00               18.1.176      
                                              60 00 53 00  5d 00 53 00               18.1.184      
                                              5f 00 51 00  5d 00 51 00               18.1.192      
  10.2                         524288  IN     53 00 5e 00  53 00 5d 00   13ms        19.1.0        
                                              53 00 5e 00  51 00 5d 00               19.1.8        
                                              53 00 5e 00  52 00 61 00               19.1.16       
                                              52 00 5e 00  52 00 5f 00               19.1.24       
                                              52 00 5f 00  52 00 5f 00               19.1.32       
                                              53 00 5b 00  54 00 5f 00               19.1.40       
                                              53 00 5e 00  52 00 5e 00               19.1.48       
                                              53 00 5e 00  52 00 5d 00               19.1.56       
                                              51 00 5e 00  53 00 5d 00               19.1.64       
                                              53 00 5e 00  53 00 5e 00               19.1.72       
                                              53 00 5e 00  55 00 5d 00               19.1.80       
                                              51 00 5f 00  54 00 60 00               19.1.88       
                                              54 00 5e 00  54 00 5f 00               19.1.96       
                                              53 00 5e 00  51 00 5f 00               19.1.104      
                                              52 00 5d 00  54 00 5f 00               19.1.112      
                                              52 00 5f 00  51 00 5c 00               19.1.120      
                                              55 00 5f 00  54 00 60 00               19.1.128      
                                              52 00 5e 00  50 00 64 00               19.1.136      
                                              52 00 62 00  53 00 5e 00               19.1.144      
                                              53 00 5f 00  53 00 5e 00               19.1.152      
                                              53 00 60 00  52 00 5e 00               19.1.160      
                                              53 00 60 00  52 00 60 00               19.1.168      
                                              55 00 62 00  53 00 5f 00               19.1.176      
                                              51 00 5e 00  51 00 5e 00               19.1.184      
                                              51 00 62 00  53 00 5f 00               19.1.192      
  10.2                             31  IN     1a 00 00 00  01 00 02 00   34us        20.1.0        
                                              31 84 00 01  04 00 61 0f               20.1.8        
                                              00 00 01 01  04 00 00 00               20.1.16       
                                              00 00 00 55  aa 55 aa                  20.1.24       
  10.2                         524288  IN     60 00 54 00  60 00 54 00  250ms        21.1.0        
                                              60 00 56 00  60 00 56 00               21.1.8        
                                              60 00 56 00  61 00 57 00               21.1.16       
                                              63 00 54 00  62 00 54 00               21.1.24       
                                              60 00 59 00  60 00 57 00               21.1.32       
                                              61 00 57 00  63 00 59 00               21.1.40       
                                              66 00 57 00  61 00 57 00               21.1.48       
                                              64 00 58 00  66 00 58 00               21.1.56       
                                              61 00 56 00  63 00 57 00               21.1.64       
                                              64 00 57 00  61 00 53 00               21.1.72       
                                              64 00 59 00  62 00 57 00               21.1.80       
                                              62 00 58 00  64 00 58 00               21.1.88       
                                              60 00 53 00  62 00 56 00               21.1.96       
                                              61 00 57 00  63 00 57 00               21.1.104      
                                              63 00 5b 00  64 00 58 00               21.1.112      
                                              65 00 57 00  65 00 56 00               21.1.120      
                                              65 00 57 00  64 00 56 00               21.1.128      
                                              60 00 57 00  62 00 57 00               21.1.136      
                                              62 00 55 00  61 00 58 00               21.1.144      
                                              62 00 57 00  63 00 59 00               21.1.152      
                                              64 00 58 00  62 00 55 00               21.1.160      
                                              60 00 55 00  64 00 57 00               21.1.168      
                                              61 00 57 00  63 00 55 00               21.1.176      
                                              64 00 5b 00  65 00 5a 00               21.1.184      
                                              62 00 57 00  64 00 56 00               21.1.192      
  10.2                         524288  IN     5e 00 51 00  5e 00 4f 00   14ms        22.1.0        
                                              5c 00 52 00  5e 00 52 00               22.1.8        
                                              5f 00 53 00  5d 00 50 00               22.1.16       
                                              5d 00 53 00  5e 00 53 00               22.1.24       
                                              5d 00 51 00  5b 00 51 00               22.1.32       
                                              5b 00 51 00  5c 00 50 00               22.1.40       
                                              5e 00 52 00  5f 00 4f 00               22.1.48       
                                              60 00 50 00  5d 00 51 00               22.1.56       
                                              5d 00 53 00  5c 00 4f 00               22.1.64       
                                              5c 00 51 00  5e 00 4f 00               22.1.72       
                                              5f 00 53 00  5c 00 52 00               22.1.80       
                                              5e 00 53 00  60 00 53 00               22.1.88       
                                              5f 00 51 00  5c 00 52 00               22.1.96       
                                              5f 00 4f 00  5c 00 51 00               22.1.104      
                                              5d 00 50 00  5d 00 4f 00               22.1.112      
                                              5d 00 52 00  5d 00 50 00               22.1.120      
                                              5e 00 51 00  5d 00 51 00               22.1.128      
                                              60 00 4f 00  5d 00 4f 00               22.1.136      
                                              5f 00 51 00  5e 00 54 00               22.1.144      
                                              5f 00 4f 00  5c 00 51 00               22.1.152      
                                              5e 00 51 00  5c 00 52 00               22.1.160      
                                              5d 00 51 00  5c 00 53 00               22.1.168      
                                              5c 00 51 00  5e 00 50 00               22.1.176      
                                              5c 00 50 00  5f 00 50 00               22.1.184      
                                              5d 00 51 00  5d 00 51 00               22.1.192      
  10.2                         524288  IN     55 00 5f 00  51 00 60 00   16ms        23.1.0        
                                              4f 00 60 00  51 00 5f 00               23.1.8        
                                              52 00 60 00  53 00 5f 00               23.1.16       
                                              52 00 5f 00  52 00 5f 00               23.1.24       
                                              52 00 5c 00  50 00 5f 00               23.1.32       
                                              52 00 5e 00  51 00 5f 00               23.1.40       
                                              51 00 60 00  51 00 5e 00               23.1.48       
                                              53 00 5f 00  53 00 5c 00               23.1.56       
                                              51 00 5f 00  53 00 62 00               23.1.64       
                                              53 00 5e 00  52 00 60 00               23.1.72       
                                              51 00 60 00  53 00 5e 00               23.1.80       
                                              52 00 5c 00  54 00 5f 00               23.1.88       
                                              52 00 5f 00  51 00 5f 00               23.1.96       
                                              52 00 5d 00  50 00 5d 00               23.1.104      
                                              51 00 5f 00  51 00 5c 00               23.1.112      
                                              51 00 5d 00  4f 00 5d 00               23.1.120      
                                              55 00 5d 00  52 00 5e 00               23.1.128      
                                              53 00 5d 00  52 00 60 00               23.1.136      
                                              51 00 60 00  51 00 5c 00               23.1.144      
                                              53 00 5f 00  51 00 5d 00               23.1.152      
                                              51 00 5e 00  52 00 5b 00               23.1.160      
                                              55 00 60 00  53 00 5f 00               23.1.168      
                                              52 00 5f 00  50 00 5f 00               23.1.176      
                                              52 00 5c 00  50 00 5d 00               23.1.184      
                                              50 00 5d 00  53 00 5e 00               23.1.192      
  10.2                         524288  IN     5f 00 51 00  5f 00 52 00  8.8ms        24.1.0        
                                              5c 00 51 00  5f 00 53 00               24.1.8        
                                              5f 00 52 00  5f 00 52 00               24.1.16       
                                              5d 00 50 00  5d 00 51 00               24.1.24       
                                              60 00 54 00  5f 00 53 00               24.1.32       
                                              5f 00 52 00  5e 00 52 00               24.1.40       
                                              5e 00 53 00  5c 00 51 00               24.1.48       
                                              5f 00 53 00  5c 00 51 00               24.1.56       
                                              60 00 53 00  5f 00 50 00               24.1.64       
                                              5f 00 56 00  61 00 52 00               24.1.72       
                                              5d 00 51 00  5e 00 53 00               24.1.80       
                                              5c 00 53 00  5c 00 53 00               24.1.88       
                                              5e 00 53 00  5e 00 51 00               24.1.96       
                                              5e 00 54 00  5d 00 51 00               24.1.104      
                                              5d 00 53 00  5c 00 51 00               24.1.112      
                                              5c 00 50 00  5e 00 52 00               24.1.120      
                                              5e 00 53 00  5e 00 53 00               24.1.128      
                                              5e 00 53 00  5f 00 54 00               24.1.136      
                                              5c 00 50 00  5e 00 51 00               24.1.144      
                                              5e 00 52 00  5c 00 53 00               24.1.152      
                                              5c 00 52 00  60 00 52 00               24.1.160      
                                              5c 00 54 00  5e 00 54 00               24.1.168      
                                              5e 00 52 00  5c 00 53 00               24.1.176      
                                              61 00 52 00  5f 00 53 00               24.1.184      
                                              60 00 51 00  5c 00 51 00               24.1.192      
  10.2                         524288  IN     52 00 5f 00  52 00 5f 00   17ms        25.1.0        
                                              51 00 5f 00  51 00 5c 00               25.1.8        
                                              51 00 5c 00  52 00 60 00               25.1.16       
                                              51 00 5f 00  52 00 5f 00               25.1.24       
                                              51 00 5c 00  55 00 5e 00               25.1.32       
                                              53 00 5c 00  52 00 5d 00               25.1.40       
                                              53 00 60 00  52 00 60 00               25.1.48       
                                              51 00 5e 00  53 00 5f 00               25.1.56       
                                              51 00 5e 00  50 00 5d 00               25.1.64       
                                              53 00 60 00  56 00 5f 00               25.1.72       
                                              52 00 5e 00  53 00 5f 00               25.1.80       
                                              54 00 5c 00  52 00 5f 00               25.1.88       
                                              53 00 5e 00  52 00 5e 00               25.1.96       
                                              51 00 5e 00  53 00 60 00               25.1.104      
                                              51 00 5e 00  53 00 5e 00               25.1.112      
                                              51 00 5e 00  52 00 5e 00               25.1.120      
                                              53 00 5e 00  53 00 60 00               25.1.128      
                                              51 00 5c 00  54 00 5d 00               25.1.136      
                                              53 00 61 00  50 00 5f 00               25.1.144      
                                              52 00 60 00  50 00 5f 00               25.1.152      
                                              52 00 60 00  51 00 61 00               25.1.160      
                                              52 00 60 00  52 00 61 00               25.1.168      
                                              54 00 5f 00  52 00 5c 00               25.1.176      
                                              53 00 5f 00  50 00 5f 00               25.1.184      
                                              50 00 60 00  4f 00 60 00               25.1.192      
  10.2                             31  IN     1a 00 00 00  01 00 02 00  3.8ms        26.1.0        
                                              31 84 00 01  04 00 62 0f               26.1.8        
                                              00 00 01 01  04 00 00 00               26.1.16       
                                              00 00 00 55  aa 55 aa                  26.1.24       
  10.2                         524288  IN     60 00 55 00  63 00 53 00  241ms        27.1.0        
                                              5f 00 54 00  62 00 55 00               27.1.8        
                                              60 00 55 00  60 00 56 00               27.1.16       
                                              60 00 55 00  64 00 53 00               27.1.24       
                                              5f 00 58 00  62 00 57 00               27.1.32       
                                              61 00 57 00  61 00 57 00               27.1.40       
                                              66 00 56 00  62 00 54 00               27.1.48       
                                              62 00 58 00  64 00 58 00               27.1.56       
                                              63 00 52 00  62 00 57 00               27.1.64       
                                              64 00 57 00  60 00 57 00               27.1.72       
                                              63 00 57 00  61 00 57 00               27.1.80       
                                              61 00 55 00  64 00 57 00               27.1.88       
                                              60 00 55 00  60 00 57 00               27.1.96       
                                              63 00 57 00  64 00 55 00               27.1.104      
                                              62 00 5a 00  66 00 56 00               27.1.112      
                                              63 00 57 00  62 00 55 00               27.1.120      
                                              61 00 57 00  63 00 55 00               27.1.128      
                                              63 00 57 00  63 00 58 00               27.1.136      
                                              64 00 57 00  63 00 5a 00               27.1.144      
                                              64 00 58 00  65 00 5a 00               27.1.152      
                                              65 00 57 00  63 00 57 00               27.1.160      
                                              60 00 53 00  64 00 57 00               27.1.168      
                                              60 00 56 00  64 00 56 00               27.1.176      
                                              63 00 5a 00  65 00 56 00               27.1.184      
                                              62 00 56 00  62 00 57 00               27.1.192      
  10.2                         524288  IN     5e 00 52 00  60 00 51 00   20ms        28.1.0        
                                              5d 00 50 00  5c 00 52 00               28.1.8        
                                              5f 00 52 00  60 00 51 00               28.1.16       
                                              5c 00 53 00  5e 00 55 00               28.1.24       
                                              5c 00 52 00  5f 00 51 00               28.1.32       
                                              5f 00 4f 00  5d 00 51 00               28.1.40       
                                              5f 00 53 00  5f 00 53 00               28.1.48       
                                              5f 00 51 00  5c 00 51 00               28.1.56       
                                              5c 00 51 00  5e 00 51 00               28.1.64       
                                              5c 00 51 00  5f 00 52 00               28.1.72       
                                              5b 00 51 00  5b 00 51 00               28.1.80       
                                              5c 00 51 00  5f 00 52 00               28.1.88       
                                              5f 00 4f 00  5b 00 52 00               28.1.96       
                                              60 00 51 00  5e 00 52 00               28.1.104      
                                              5e 00 51 00  5e 00 51 00               28.1.112      
                                              5c 00 51 00  5e 00 4f 00               28.1.120      
                                              5c 00 52 00  5c 00 53 00               28.1.128      
                                              5e 00 52 00  5e 00 51 00               28.1.136      
                                              5e 00 51 00  5f 00 52 00               28.1.144      
                                              5b 00 51 00  5d 00 51 00               28.1.152      
                                              5e 00 51 00  5e 00 51 00               28.1.160      
                                              5e 00 4f 00  5e 00 51 00               28.1.168      
                                              5c 00 51 00  5c 00 50 00               28.1.176      
                                              5e 00 51 00  5e 00 53 00               28.1.184      
                                              5e 00 50 00  5c 00 51 00               28.1.192      
  10.2                         524288  IN     53 00 5e 00  53 00 5e 00   15ms        29.1.0        
                                              52 00 5e 00  4f 00 62 00               29.1.8        
                                              51 00 5e 00  52 00 5e 00               29.1.16       
                                              50 00 60 00  51 00 5e 00               29.1.24       
                                              50 00 5e 00  4f 00 5e 00               29.1.32       
                                              50 00 5e 00  52 00 5e 00               29.1.40       
                                              51 00 5f 00  53 00 60 00               29.1.48       
                                              51 00 5e 00  52 00 5e 00               29.1.56       
                                              52 00 5e 00  52 00 61 00               29.1.64       
                                              51 00 5e 00  53 00 5d 00               29.1.72       
                                              51 00 5e 00  53 00 5c 00               29.1.80       
                                              51 00 5f 00  4f 00 5e 00               29.1.88       
                                              51 00 5e 00  50 00 5e 00               29.1.96       
                                              52 00 5c 00  52 00 5f 00               29.1.104      
                                              53 00 5f 00  52 00 5c 00               29.1.112      
                                              53 00 5e 00  52 00 5c 00               29.1.120      
                                              52 00 5e 00  51 00 5e 00               29.1.128      
                                              55 00 5e 00  53 00 5e 00               29.1.136      
                                              53 00 5d 00  50 00 5c 00               29.1.144      
                                              53 00 60 00  53 00 5e 00               29.1.152      
                                              54 00 5d 00  51 00 5e 00               29.1.160      
                                              54 00 5e 00  52 00 5e 00               29.1.168      
                                              52 00 60 00  50 00 5e 00               29.1.176      
                                              52 00 5d 00  52 00 5c 00               29.1.184      
                                              4f 00 5e 00  4f 00 5e 00               29.1.192      
  10.2                         524288  IN     5c 00 53 00  60 00 52 00  5.6ms        30.1.0        
                                              5d 00 53 00  5f 00 51 00               30.1.8        
                                              5e 00 52 00  5c 00 53 00               30.1.16       
                                              5e 00 51 00  5e 00 51 00               30.1.24       
                                              60 00 53 00  5f 00 52 00               30.1.32       
                                              5d 00 54 00  5f 00 52 00               30.1.40       
                                              5d 00 51 00  60 00 4f 00               30.1.48       
                                              61 00 52 00  5f 00 53 00               30.1.56       
                                              60 00 54 00  5e 00 53 00               30.1.64       
                                              61 00 55 00  61 00 52 00               30.1.72       
                                              5f 00 54 00  5f 00 53 00               30.1.80       
                                              5e 00 50 00  5e 00 53 00               30.1.88       
                                              5e 00 53 00  60 00 53 00               30.1.96       
                                              5f 00 54 00  5e 00 51 00               30.1.104      
                                              5e 00 54 00  5d 00 51 00               30.1.112      
                                              5e 00 51 00  60 00 52 00               30.1.120      
                                              60 00 51 00  5f 00 52 00               30.1.128      
                                              5e 00 51 00  60 00 54 00               30.1.136      
                                              5e 00 4f 00  5f 00 53 00               30.1.144      
                                              60 00 52 00  5f 00 51 00               30.1.152      
                                              5f 00 51 00  5f 00 51 00               30.1.160      
                                              60 00 52 00  5f 00 52 00               30.1.168      
                                              5f 00 51 00  5c 00 51 00               30.1.176      
                                              5d 00 53 00  5d 00 51 00               30.1.184      
                                              5f 00 51 00  5e 00 50 00               30.1.192      
  10.2                         524288  IN     52 00 5e 00  53 00 5e 00   13ms        31.1.0        
                                              51 00 60 00  54 00 5f 00               31.1.8        
                                              52 00 5e 00  50 00 5f 00               31.1.16       
                                              51 00 5e 00  53 00 60 00               31.1.24       
                                              52 00 5f 00  54 00 5e 00               31.1.32       
                                              53 00 5e 00  55 00 5e 00               31.1.40       
                                              52 00 5e 00  53 00 60 00               31.1.48       
                                              52 00 60 00  53 00 60 00               31.1.56       
                                              53 00 5d 00  52 00 5e 00               31.1.64       
                                              52 00 60 00  53 00 5f 00               31.1.72       
                                              55 00 5d 00  53 00 5e 00               31.1.80       
                                              53 00 61 00  54 00 5c 00               31.1.88       
                                              53 00 5f 00  52 00 5f 00               31.1.96       
                                              51 00 60 00  51 00 62 00               31.1.104      
                                              53 00 60 00  53 00 60 00               31.1.112      
                                              53 00 5d 00  52 00 5e 00               31.1.120      
                                              54 00 5f 00  54 00 5f 00               31.1.128      
                                              54 00 5f 00  55 00 60 00               31.1.136      
                                              53 00 62 00  54 00 60 00               31.1.144      
                                              52 00 60 00  52 00 61 00               31.1.152      
                                              54 00 5e 00  51 00 5e 00               31.1.160      
                                              53 00 60 00  51 00 62 00               31.1.168      
                                              55 00 60 00  52 00 5f 00               31.1.176      
                                              52 00 5d 00  52 00 5e 00               31.1.184      
                                              54 00 62 00  53 00 5e 00               31.1.192      
  10.2                             31  IN     1a 00 00 00  01 00 02 00  5.5ms        32.1.0        
                                              31 84 00 01  04 00 63 0f               32.1.8        
                                              00 00 01 01  04 00 00 00               32.1.16       
                                              00 00 00 55  aa 55 aa                  32.1.24       
  10.0                                 CTL    80 06 00 01  00 00 12 00  219ms        33.1.0        
  10.0                             18  IN     12 01 00 02  00 00 00 40  3.7ms        33.2.0        
                                              48 44 70 56  40 1b 01 02               33.2.8        
                                              00 01                                  33.2.16       
  10.0                                 CTL    80 06 00 03  00 00 02 00   28us        34.1.0        
  10.0                              2  IN     04 03                     352us        34.2.0        
  10.0                                 CTL    80 06 00 03  00 00 04 00   20us        35.1.0        
  10.0                              4  IN     04 03 09 04                61us        35.2.0        
  10.0                                 CTL    80 06 01 03  09 04 02 00   21us        36.1.0        
  10.0                              2  IN     06 03                      81us        36.2.0        
  10.0                                 CTL    80 06 01 03  09 04 06 00   13us        37.1.0        
  10.0                              6  IN     06 03 54 00  33 00         67us        37.2.0        
  10.0                                 CTL    80 06 02 03  09 04 02 00    9us        38.1.0        
  10.0                              2  IN     1a 03                      65us        38.2.0        
  10.0                                 CTL    80 06 02 03  09 04 1a 00   12us        39.1.0        
  10.0                             26  IN     1a 03 52 00  48 00 31 00   64us        39.2.0        
                                              30 00 31 00  35 00 30 00               39.2.8        
                                              30 00 35 00  30 00 32 00               39.2.16       
                                              31 00                                  39.2.24       
  10.0                                 CTL    80 06 00 03  09 04 02 00   10us        40.1.0        
  10.0                              2  IN     04 03                      43us        40.2.0        
  10.0                                 CTL    80 06 00 03  09 04 04 00    9us        41.1.0        
  10.0                              4  IN     04 03 09 04                66us        41.2.0        
  10.0                                 CTL    80 06 02 03  09 04 02 00  593us        42.1.0        
  10.0                              2  IN     1a 03                      74us        42.2.0        
  10.0                                 CTL    80 06 02 03  09 04 1a 00   11us        43.1.0        
  10.0                             26  IN     1a 03 52 00  48 00 31 00   65us        43.2.0        
                                              30 00 31 00  35 00 30 00               43.2.8        
                                              30 00 35 00  30 00 32 00               43.2.16       
                                              31 00                                  43.2.24       
  10.0                                 CTL    80 06 01 03  00 00 20 00  195us        44.1.0        
  10.0                              6  IN     06 03 54 00  33 00         83us        44.2.0        
  10.0                                 CTL    c0 e1 00 00  00 00 04 00   45us        45.1.0        
  10.0                              4  IN     03 0b 00 00               1.5ms        45.2.0        
  10.0                                 CTL    c0 b4 00 00  00 00 01 00   59us        46.1.0(2)     
  10.0                              1  IN     54                         78us        46.2.0        
  10.0                                 CTL    c0 e1 00 00  04 00 40 00  145us        48.1.0        
  10.0                             64  IN     00 00 00 00  01 01 00 00  4.1ms        48.2.0        
                                              0f 44 61 68  65 6e 67 20               48.2.8        
                                              49 6d 61 67  69 6e 67 00               48.2.16       
                                              20 00 00 00  01 01 00 00               48.2.24       
                                              0f 4d 45 52  2d 31 33 30               48.2.32       
                                              2d 33 30 55  4d 2d 4c 00               48.2.40       
                                              80 00 00 00  01 01 00 00               48.2.48       
                                              0d 52 48 31  30 31 35 30               48.2.56       
  10.0                                 CTL    c0 b4 00 00  00 00 01 00   64us        49.1.0(2)     
  10.0                              1  IN     54                        174us        49.2.0        
  10.0                                 CTL    c0 e1 00 00  44 00 40 00  290us        51.1.0        
  10.0                             64  IN     30 35 30 32  31 00 90 00  7.8ms        51.2.0        
                                              00 00 01 01  00 00 03 36               51.2.8        
                                              37 00 04 01  00 00 01 01               51.2.16       
                                              00 00 0a 31  32 33 34 56               51.2.24       
                                              33 32 30 33  00 14 01 00               51.2.32       
                                              00 01 01 00  00 0e 31 2e               51.2.40       
                                              31 2e 31 33  30 35 2e 39               51.2.48       
                                              33 30 31 00  00 02 00 00               51.2.56       
  10.0                                 CTL    c0 b4 00 00  00 00 01 00   72us        52.1.0(2)     
  10.0                              1  IN     54                        368us        52.2.0        
  10.0                                 CTL    80 06 02 03  00 00 20 00  232us        54.1.0        
  10.0                             26  IN     1a 03 52 00  48 00 31 00  176us        54.2.0        
                                              30 00 31 00  35 00 30 00               54.2.8        
                                              30 00 35 00  30 00 32 00               54.2.16       
                                              31 00                                  54.2.24       
  10.0                                 CTL    80 06 00 01  00 00 12 00  2.4ms        55.1.0        
  10.2                         524288  IN     5d 00 54 00  5e 00 57 00  1.9ms        56.1.0        
                                              60 00 55 00  62 00 53 00               56.1.8        
                                              61 00 54 00  61 00 57 00               56.1.16       
                                              60 00 53 00  64 00 57 00               56.1.24       
                                              62 00 57 00  64 00 55 00               56.1.32       
                                              61 00 56 00  64 00 5a 00               56.1.40       
                                              67 00 5b 00  61 00 55 00               56.1.48       
                                              62 00 58 00  65 00 58 00               56.1.56       
                                              62 00 54 00  62 00 58 00               56.1.64       
                                              64 00 57 00  62 00 57 00               56.1.72       
                                              65 00 57 00  62 00 56 00               56.1.80       
                                              66 00 57 00  63 00 57 00               56.1.88       
                                              60 00 56 00  60 00 54 00               56.1.96       
                                              64 00 5a 00  61 00 55 00               56.1.104      
                                              62 00 5b 00  61 00 58 00               56.1.112      
                                              63 00 59 00  68 00 57 00               56.1.120      
                                              64 00 58 00  64 00 56 00               56.1.128      
                                              5f 00 54 00  63 00 57 00               56.1.136      
                                              64 00 58 00  62 00 5b 00               56.1.144      
                                              64 00 57 00  65 00 59 00               56.1.152      
                                              64 00 59 00  64 00 55 00               56.1.160      
                                              60 00 54 00  65 00 58 00               56.1.168      
                                              62 00 57 00  64 00 58 00               56.1.176      
                                              62 00 58 00  65 00 58 00               56.1.184      
                                              64 00 55 00  61 00 58 00               56.1.192      
  10.0                             18  IN     12 01 00 02  00 00 00 40  153us        55.2.0        
                                              48 44 70 56  40 1b 01 02               55.2.8        
                                              00 01                                  55.2.16       
  10.0                                 CTL    80 06 00 03  00 00 02 00   22us        57.1.0        
  10.0                              2  IN     04 03                     2.0ms        57.2.0        
  10.0                                 CTL    80 06 00 03  00 00 04 00   21us        58.1.0        
  10.0                              4  IN     04 03 09 04                94us        58.2.0        
  10.0                                 CTL    80 06 01 03  09 04 02 00   14us        59.1.0        
  10.0                              2  IN     06 03                     125us        59.2.0        
  10.0                                 CTL    80 06 01 03  09 04 06 00   12us        60.1.0        
  10.0                              6  IN     06 03 54 00  33 00        165us        60.2.0        
  10.0                                 CTL    80 06 02 03  09 04 02 00   12us        61.1.0        
  10.0                              2  IN     1a 03                     154us        61.2.0        
  10.0                                 CTL    80 06 02 03  09 04 1a 00   11us        62.1.0        
  10.0                             26  IN     1a 03 52 00  48 00 31 00  131us        62.2.0        
                                              30 00 31 00  35 00 30 00               62.2.8        
                                              30 00 35 00  30 00 32 00               62.2.16       
                                              31 00                                  62.2.24       
  10.0                                 CTL    80 06 00 03  09 04 02 00   10us        63.1.0        
  10.0                              2  IN     04 03                     152us        63.2.0        
  10.0                                 CTL    80 06 00 03  09 04 04 00   14us        64.1.0        
  10.0                              4  IN     04 03 09 04               162us        64.2.0        
  10.0                                 CTL    80 06 02 03  09 04 02 00  653us        65.1.0        
  10.0                              2  IN     1a 03                     102us        65.2.0        
  10.0                                 CTL    80 06 02 03  09 04 1a 00   10us        66.1.0        
  10.0                             26  IN     1a 03 52 00  48 00 31 00  130us        66.2.0        
                                              30 00 31 00  35 00 30 00               66.2.8        
                                              30 00 35 00  30 00 32 00               66.2.16       
                                              31 00                                  66.2.24       
  10.0                                 CTL    80 06 01 03  00 00 20 00  195us        67.1.0        
  10.0                              6  IN     06 03 54 00  33 00        176us        67.2.0        
  10.0                                 CTL    c0 e1 00 00  00 00 04 00   24us        68.1.0        
  10.0                              4  IN     03 0b 00 00               2.5ms        68.2.0        
  10.0                                 CTL    c0 b4 00 00  00 00 01 00   42us        69.1.0(2)     
  10.0                              1  IN     54                        1.9ms        69.2.0        
  10.0                                 CTL    c0 e1 00 00  04 00 40 00  270us        71.1.0        
  10.2                         524288  IN     5d 00 51 00  5f 00 51 00  460us        72.1.0        
                                              5d 00 52 00  5c 00 52 00               72.1.8        
                                              5e 00 51 00  5d 00 52 00               72.1.16       
                                              5f 00 53 00  5f 00 50 00               72.1.24       
                                              5d 00 51 00  5c 00 53 00               72.1.32       
                                              5c 00 52 00  5d 00 51 00               72.1.40       
                                              5e 00 51 00  5f 00 4f 00               72.1.48       
                                              62 00 52 00  5e 00 51 00               72.1.56       
                                              60 00 51 00  5e 00 53 00               72.1.64       
                                              5c 00 53 00  5c 00 51 00               72.1.72       
                                              5e 00 53 00  5c 00 4f 00               72.1.80       
                                              5f 00 53 00  5f 00 51 00               72.1.88       
                                              5d 00 51 00  5d 00 52 00               72.1.96       
                                              5f 00 50 00  5d 00 51 00               72.1.104      
                                              5e 00 4f 00  5d 00 51 00               72.1.112      
                                              5a 00 52 00  5b 00 53 00               72.1.120      
                                              5e 00 51 00  5e 00 51 00               72.1.128      
                                              5e 00 51 00  60 00 51 00               72.1.136      
                                              5e 00 52 00  5c 00 50 00               72.1.144      
                                              5f 00 51 00  60 00 51 00               72.1.152      
                                              5e 00 51 00  5e 00 52 00               72.1.160      
                                              60 00 51 00  5c 00 52 00               72.1.168      
                                              5c 00 53 00  5c 00 51 00               72.1.176      
                                              5f 00 54 00  59 00 52 00               72.1.184      
                                              5d 00 50 00  5c 00 53 00               72.1.192      
  10.0                             64  IN     00 00 00 00  01 01 00 00  4.5ms        71.2.0        
                                              0f 44 61 68  65 6e 67 20               71.2.8        
                                              49 6d 61 67  69 6e 67 00               71.2.16       
                                              20 00 00 00  01 01 00 00               71.2.24       
                                              0f 4d 45 52  2d 31 33 30               71.2.32       
                                              2d 33 30 55  4d 2d 4c 00               71.2.40       
                                              80 00 00 00  01 01 00 00               71.2.48       
                                              0d 52 48 31  30 31 35 30               71.2.56       
  10.0                                 CTL    c0 b4 00 00  00 00 01 00  1.8ms        73.1.0(2)     
  10.0                              1  IN     54                        1.8ms        73.2.0        
  10.0                                 CTL    c0 e1 00 00  44 00 40 00  2.1ms        75.1.0        
  10.2                         524288  IN     55 00 5c 00  51 00 5e 00  5.8ms        76.1.0        
                                              52 00 60 00  52 00 60 00               76.1.8        
                                              51 00 60 00  53 00 5e 00               76.1.16       
                                              4f 00 60 00  52 00 61 00               76.1.24       
                                              51 00 5e 00  53 00 5c 00               76.1.32       
                                              53 00 5f 00  53 00 5e 00               76.1.40       
                                              53 00 5e 00  51 00 5f 00               76.1.48       
                                              53 00 5f 00  51 00 5e 00               76.1.56       
                                              51 00 60 00  53 00 60 00               76.1.64       
                                              53 00 63 00  51 00 5c 00               76.1.72       
                                              52 00 5d 00  53 00 5f 00               76.1.80       
                                              53 00 60 00  52 00 60 00               76.1.88       
                                              51 00 5e 00  51 00 5d 00               76.1.96       
                                              54 00 5e 00  53 00 5f 00               76.1.104      
                                              51 00 5f 00  51 00 5c 00               76.1.112      
                                              52 00 5f 00  51 00 5e 00               76.1.120      
                                              53 00 5e 00  53 00 5d 00               76.1.128      
                                              53 00 5e 00  51 00 5e 00               76.1.136      
                                              52 00 60 00  52 00 5e 00               76.1.144      
                                              52 00 5f 00  52 00 60 00               76.1.152      
                                              52 00 5f 00  51 00 5f 00               76.1.160      
                                              53 00 60 00  53 00 5f 00               76.1.168      
                                              51 00 5e 00  53 00 60 00               76.1.176      
                                              53 00 60 00  52 00 5e 00               76.1.184      
                                              51 00 5f 00  53 00 60 00               76.1.192      
  10.0                             64  IN     30 35 30 32  31 00 90 00   42us        75.2.0        
                                              00 00 01 01  00 00 03 36               75.2.8        
                                              37 00 04 01  00 00 01 01               75.2.16       
                                              00 00 0a 31  32 33 34 56               75.2.24       
                                              33 32 30 33  00 14 01 00               75.2.32       
                                              00 01 01 00  00 0e 31 2e               75.2.40       
                                              31 2e 31 33  30 35 2e 39               75.2.48       
                                              33 30 31 00  00 02 00 00               75.2.56       
  10.0                                 CTL    c0 b4 00 00  00 00 01 00   48us        77.1.0(2)     
  10.0                              1  IN     54                        2.0ms        77.2.0        
  10.0                                 CTL    80 06 02 03  00 00 20 00  4.0ms        79.1.0        
  10.0                             26  IN     1a 03 52 00  48 00 31 00  1.8ms        79.2.0        
                                              30 00 31 00  35 00 30 00               79.2.8        
                                              30 00 35 00  30 00 32 00               79.2.16       
                                              31 00                                  79.2.24       
  10.2                         524288  IN     5d 00 54 00  5d 00 53 00  3.6ms        80.1.0        
                                              5f 00 53 00  60 00 53 00               80.1.8        
                                              5d 00 51 00  5e 00 51 00               80.1.16       
                                              5e 00 51 00  5d 00 53 00               80.1.24       
                                              5d 00 54 00  5e 00 54 00               80.1.32       
                                              60 00 52 00  5e 00 51 00               80.1.40       
                                              5e 00 52 00  5e 00 54 00               80.1.48       
                                              5e 00 55 00  5d 00 53 00               80.1.56       
                                              5e 00 54 00  5e 00 53 00               80.1.64       
                                              60 00 52 00  5f 00 50 00               80.1.72       
                                              5e 00 53 00  5f 00 52 00               80.1.80       
                                              5d 00 52 00  5e 00 51 00               80.1.88       
                                              5e 00 51 00  62 00 53 00               80.1.96       
                                              60 00 53 00  5f 00 50 00               80.1.104      
                                              5c 00 54 00  5c 00 52 00               80.1.112      
                                              5f 00 52 00  5f 00 51 00               80.1.120      
                                              5c 00 53 00  5f 00 53 00               80.1.128      
                                              5d 00 53 00  5e 00 53 00               80.1.136      
                                              5e 00 53 00  60 00 53 00               80.1.144      
                                              5e 00 51 00  5e 00 4f 00               80.1.152      
                                              5e 00 4f 00  5e 00 51 00               80.1.160      
                                              5e 00 52 00  5e 00 51 00               80.1.168      
                                              5e 00 53 00  5d 00 53 00               80.1.176      
                                              5f 00 51 00  5d 00 53 00               80.1.184      
                                              5e 00 53 00  5c 00 53 00               80.1.192      
  10.2                         524288  IN     51 00 5f 00  51 00 60 00   15ms        81.1.0        
                                              53 00 5e 00  53 00 5e 00               81.1.8        
                                              52 00 5f 00  51 00 61 00               81.1.16       
                                              53 00 5e 00  50 00 5d 00               81.1.24       
                                              53 00 5e 00  55 00 5e 00               81.1.32       
                                              55 00 5e 00  53 00 5c 00               81.1.40       
                                              53 00 60 00  53 00 5d 00               81.1.48       
                                              51 00 5f 00  54 00 5f 00               81.1.56       
                                              52 00 5f 00  51 00 5c 00               81.1.64       
                                              53 00 5d 00  53 00 5f 00               81.1.72       
                                              51 00 5e 00  55 00 60 00               81.1.80       
                                              53 00 5e 00  54 00 5c 00               81.1.88       
                                              53 00 60 00  53 00 5f 00               81.1.96       
                                              53 00 62 00  51 00 5e 00               81.1.104      
                                              54 00 61 00  54 00 5f 00               81.1.112      
                                              55 00 5f 00  51 00 5e 00               81.1.120      
                                              53 00 60 00  54 00 60 00               81.1.128      
                                              57 00 60 00  51 00 62 00               81.1.136      
                                              53 00 61 00  52 00 5e 00               81.1.144      
                                              51 00 5e 00  51 00 60 00               81.1.152      
                                              53 00 5f 00  53 00 5e 00               81.1.160      
                                              51 00 5e 00  54 00 64 00               81.1.168      
                                              54 00 60 00  51 00 5f 00               81.1.176      
                                              51 00 5f 00  51 00 60 00               81.1.184      
                                              53 00 63 00  52 00 60 00               81.1.192      
  10.2                             31  IN     1a 00 00 00  01 00 02 00   60us        82.1.0        
                                              31 84 00 01  04 00 64 0f               82.1.8        
                                              00 00 01 01  04 00 00 00               82.1.16       
                                              00 00 00 55  aa 55 aa                  82.1.24       
  10.2                         524288  IN     60 00 55 00  60 00 53 00  246ms        83.1.0        
                                              63 00 56 00  62 00 55 00               83.1.8        
                                              63 00 55 00  64 00 57 00               83.1.16       
                                              62 00 53 00  64 00 55 00               83.1.24       
                                              5e 00 58 00  62 00 57 00               83.1.32       
                                              63 00 58 00  63 00 57 00               83.1.40       
                                              66 00 59 00  63 00 57 00               83.1.48       
                                              63 00 57 00  64 00 5a 00               83.1.56       
                                              63 00 56 00  62 00 59 00               83.1.64       
                                              63 00 57 00  60 00 55 00               83.1.72       
                                              63 00 58 00  5e 00 59 00               83.1.80       
                                              62 00 55 00  64 00 59 00               83.1.88       
                                              63 00 54 00  64 00 55 00               83.1.96       
                                              61 00 57 00  64 00 56 00               83.1.104      
                                              62 00 5a 00  64 00 58 00               83.1.112      
                                              65 00 59 00  64 00 58 00               83.1.120      
                                              65 00 57 00  65 00 55 00               83.1.128      
                                              61 00 59 00  62 00 59 00               83.1.136      
                                              62 00 56 00  64 00 5a 00               83.1.144      
                                              65 00 57 00  64 00 58 00               83.1.152      
                                              63 00 57 00  63 00 58 00               83.1.160      
                                              62 00 56 00  66 00 58 00               83.1.168      
                                              61 00 57 00  65 00 57 00               83.1.176      
                                              61 00 59 00  65 00 59 00               83.1.184      
                                              63 00 58 00  62 00 58 00               83.1.192      
  10.2                         524288  IN     5c 00 51 00  5c 00 51 00   11ms        84.1.0        
                                              5e 00 51 00  5d 00 52 00               84.1.8        
                                              5c 00 53 00  60 00 51 00               84.1.16       
                                              5c 00 51 00  5d 00 51 00               84.1.24       
                                              5f 00 50 00  5e 00 51 00               84.1.32       
                                              5e 00 51 00  5e 00 4f 00               84.1.40       
                                              5d 00 51 00  5e 00 50 00               84.1.48       
                                              5f 00 51 00  5c 00 53 00               84.1.56       
                                              5f 00 53 00  5e 00 51 00               84.1.64       
                                              5c 00 51 00  5e 00 51 00               84.1.72       
                                              5e 00 52 00  5e 00 51 00               84.1.80       
                                              5e 00 51 00  5c 00 50 00               84.1.88       
                                              5c 00 52 00  5c 00 51 00               84.1.96       
                                              5d 00 50 00  5f 00 4e 00               84.1.104      
                                              5d 00 51 00  5c 00 51 00               84.1.112      
                                              5c 00 51 00  5c 00 4f 00               84.1.120      
                                              5e 00 50 00  5c 00 52 00               84.1.128      
                                              5d 00 51 00  5e 00 52 00               84.1.136      
                                              5c 00 51 00  5e 00 52 00               84.1.144      
                                              5c 00 4f 00  5c 00 51 00               84.1.152      
                                              5f 00 4f 00  5c 00 4e 00               84.1.160      
                                              5f 00 4d 00  5d 00 4f 00               84.1.168      
                                              5c 00 51 00  5b 00 4f 00               84.1.176      
                                              5c 00 51 00  5c 00 52 00               84.1.184      
                                              5c 00 50 00  5f 00 50 00               84.1.192      
  10.2                         524288  IN     59 00 5d 00  51 00 5e 00   13ms        85.1.0        
                                              51 00 5f 00  51 00 60 00               85.1.8        
                                              54 00 5f 00  53 00 5e 00               85.1.16       
                                              51 00 5e 00  53 00 5d 00               85.1.24       
                                              50 00 5f 00  51 00 60 00               85.1.32       
                                              53 00 5d 00  51 00 5e 00               85.1.40       
                                              51 00 60 00  51 00 5f 00               85.1.48       
                                              53 00 5f 00  52 00 5e 00               85.1.56       
                                              52 00 5c 00  51 00 63 00               85.1.64       
                                              4f 00 5d 00  51 00 60 00               85.1.72       
                                              52 00 5d 00  53 00 5e 00               85.1.80       
                                              51 00 60 00  51 00 5e 00               85.1.88       
                                              52 00 5e 00  54 00 5f 00               85.1.96       
                                              53 00 5e 00  53 00 5d 00               85.1.104      
                                              52 00 5d 00  51 00 5d 00               85.1.112      
                                              51 00 5c 00  51 00 5e 00               85.1.120      
                                              52 00 5e 00  51 00 60 00               85.1.128      
                                              51 00 5e 00  52 00 5c 00               85.1.136      
                                              51 00 60 00  51 00 5e 00               85.1.144      
                                              51 00 5e 00  53 00 60 00               85.1.152      
                                              51 00 5f 00  53 00 5f 00               85.1.160      
                                              55 00 5c 00  53 00 5f 00               85.1.168      
                                              52 00 5f 00  53 00 5e 00               85.1.176      
                                              53 00 5e 00  51 00 5e 00               85.1.184      
                                              52 00 5e 00  51 00 5e 00               85.1.192      
  10.2                         524288  IN     5e 00 53 00  5e 00 52 00   12ms        86.1.0        
                                              5f 00 53 00  60 00 55 00               86.1.8        
                                              5d 00 52 00  5f 00 54 00               86.1.16       
                                              5d 00 53 00  5f 00 51 00               86.1.24       
                                              61 00 54 00  5f 00 51 00               86.1.32       
                                              5f 00 53 00  5d 00 51 00               86.1.40       
                                              5c 00 53 00  5e 00 52 00               86.1.48       
                                              5e 00 4f 00  5e 00 4f 00               86.1.56       
                                              62 00 54 00  5f 00 51 00               86.1.64       
                                              60 00 53 00  61 00 51 00               86.1.72       
                                              5d 00 54 00  60 00 50 00               86.1.80       
                                              5e 00 54 00  60 00 52 00               86.1.88       
                                              5e 00 53 00  60 00 51 00               86.1.96       
                                              60 00 55 00  60 00 51 00               86.1.104      
                                              5e 00 54 00  5e 00 54 00               86.1.112      
                                              60 00 51 00  5e 00 53 00               86.1.120      
                                              5e 00 54 00  5e 00 51 00               86.1.128      
                                              5e 00 53 00  5d 00 55 00               86.1.136      
                                              5e 00 52 00  5f 00 51 00               86.1.144      
                                              5d 00 51 00  5e 00 50 00               86.1.152      
                                              5e 00 52 00  5e 00 52 00               86.1.160      
                                              60 00 51 00  5e 00 53 00               86.1.168      
                                              5e 00 51 00  60 00 54 00               86.1.176      
                                              5f 00 54 00  5d 00 55 00               86.1.184      
                                              5c 00 53 00  5d 00 55 00               86.1.192      
  10.2                         524288  IN     52 00 5f 00  51 00 5e 00   13ms        87.1.0        
                                              52 00 62 00  52 00 5e 00               87.1.8        
                                              53 00 5e 00  51 00 60 00               87.1.16       
                                              52 00 5e 00  53 00 60 00               87.1.24       
                                              51 00 60 00  54 00 5f 00               87.1.32       
                                              52 00 5f 00  54 00 5e 00               87.1.40       
                                              52 00 5e 00  54 00 5f 00               87.1.48       
                                              53 00 5e 00  51 00 60 00               87.1.56       
                                              50 00 5b 00  54 00 5c 00               87.1.64       
                                              53 00 5e 00  53 00 5e 00               87.1.72       
                                              53 00 5d 00  53 00 5f 00               87.1.80       
                                              53 00 5f 00  52 00 60 00               87.1.88       
                                              53 00 62 00  53 00 5d 00               87.1.96       
                                              51 00 60 00  52 00 5f 00               87.1.104      
                                              53 00 5f 00  53 00 5f 00               87.1.112      
                                              53 00 5f 00  53 00 60 00               87.1.120      
                                              54 00 60 00  54 00 5f 00               87.1.128      
                                              52 00 5c 00  53 00 60 00               87.1.136      
                                              51 00 61 00  53 00 62 00               87.1.144      
                                              51 00 5d 00  51 00 5e 00               87.1.152      
                                              52 00 5e 00  51 00 5e 00               87.1.160      
                                              52 00 5e 00  53 00 60 00               87.1.168      
                                              56 00 5f 00  51 00 5f 00               87.1.176      
                                              52 00 5f 00  51 00 5d 00               87.1.184      
                                              51 00 64 00  51 00 5f 00               87.1.192      
  10.2                             31  IN     1a 00 00 00  01 00 02 00   36us        88.1.0        
                                              31 84 00 01  04 00 65 0f               88.1.8        
                                              00 00 01 01  04 00 00 00               88.1.16       
                                              00 00 00 55  aa 55 aa                  88.1.24       
  10.2                         524288  IN     60 00 56 00  61 00 54 00  249ms        89.1.0        
                                              60 00 55 00  61 00 55 00               89.1.8        
                                              60 00 55 00  63 00 57 00               89.1.16       
                                              65 00 51 00  65 00 53 00               89.1.24       
                                              60 00 57 00  62 00 57 00               89.1.32       
                                              61 00 58 00  63 00 59 00               89.1.40       
                                              64 00 59 00  62 00 54 00               89.1.48       
                                              61 00 59 00  64 00 5b 00               89.1.56       
                                              63 00 56 00  64 00 57 00               89.1.64       
                                              63 00 58 00  61 00 56 00               89.1.72       
                                              62 00 59 00  62 00 59 00               89.1.80       
                                              62 00 58 00  66 00 57 00               89.1.88       
                                              63 00 54 00  5f 00 57 00               89.1.96       
                                              62 00 55 00  63 00 55 00               89.1.104      
                                              62 00 5a 00  64 00 57 00               89.1.112      
                                              64 00 58 00  64 00 58 00               89.1.120      
                                              63 00 57 00  62 00 53 00               89.1.128      
                                              61 00 57 00  64 00 57 00               89.1.136      
                                              64 00 57 00  62 00 5b 00               89.1.144      
                                              64 00 56 00  67 00 5b 00               89.1.152      
                                              63 00 5a 00  64 00 58 00               89.1.160      
                                              60 00 57 00  65 00 57 00               89.1.168      
                                              62 00 56 00  68 00 57 00               89.1.176      
                                              62 00 59 00  66 00 58 00               89.1.184      
                                              62 00 57 00  64 00 59 00               89.1.192      
  10.2                         524288  IN     5c 00 53 00  5e 00 50 00   13ms        90.1.0        
                                              5d 00 51 00  5c 00 51 00               90.1.8        
                                              60 00 52 00  5c 00 52 00               90.1.16       
                                              5d 00 53 00  5c 00 51 00               90.1.24       
                                              60 00 50 00  5c 00 51 00               90.1.32       
                                              5c 00 52 00  5e 00 51 00               90.1.40       
                                              5e 00 52 00  5f 00 50 00               90.1.48       
                                              60 00 51 00  5e 00 50 00               90.1.56       
                                              60 00 51 00  5e 00 52 00               90.1.64       
                                              5d 00 54 00  60 00 53 00               90.1.72       
                                              5b 00 53 00  5d 00 50 00               90.1.80       
                                              5d 00 53 00  5e 00 51 00               90.1.88       
                                              5e 00 54 00  5e 00 52 00               90.1.96       
                                              5e 00 51 00  5c 00 51 00               90.1.104      
                                              5c 00 51 00  5f 00 51 00               90.1.112      
                                              5c 00 52 00  5c 00 51 00               90.1.120      
                                              5d 00 50 00  5d 00 53 00               90.1.128      
                                              5d 00 51 00  5e 00 51 00               90.1.136      
                                              60 00 52 00  5f 00 51 00               90.1.144      
                                              5c 00 52 00  5b 00 4e 00               90.1.152      
                                              5c 00 51 00  5c 00 52 00               90.1.160      
                                              60 00 50 00  5a 00 52 00               90.1.168      
                                              5e 00 50 00  5c 00 53 00               90.1.176      
                                              5c 00 51 00  5c 00 50 00               90.1.184      
                                              5d 00 50 00  5c 00 53 00               90.1.192      
  10.2                         524288  IN     57 00 5e 00  51 00 5f 00   12ms        91.1.0        
                                              53 00 5f 00  4f 00 60 00               91.1.8        
                                              51 00 60 00  52 00 60 00               91.1.16       
                                              51 00 5f 00  52 00 5e 00               91.1.24       
                                              52 00 5d 00  52 00 5f 00               91.1.32       
                                              51 00 5e 00  50 00 61 00               91.1.40       
                                              53 00 5f 00  54 00 5f 00               91.1.48       
                                              53 00 5f 00  52 00 5d 00               91.1.56       
                                              52 00 5e 00  56 00 5f 00               91.1.64       
                                              51 00 5e 00  51 00 5e 00               91.1.72       
                                              52 00 60 00  52 00 5c 00               91.1.80       
                                              52 00 62 00  51 00 5c 00               91.1.88       
                                              51 00 5f 00  53 00 5e 00               91.1.96       
                                              52 00 5e 00  53 00 5d 00               91.1.104      
                                              53 00 60 00  52 00 5f 00               91.1.112      
                                              52 00 5e 00  50 00 5e 00               91.1.120      
                                              52 00 5e 00  52 00 5f 00               91.1.128      
                                              53 00 60 00  52 00 5d 00               91.1.136      
                                              53 00 5d 00  51 00 5e 00               91.1.144      
                                              51 00 5e 00  51 00 5e 00               91.1.152      
                                              50 00 5d 00  52 00 5e 00               91.1.160      
                                              54 00 5d 00  52 00 60 00               91.1.168      
                                              53 00 5f 00  53 00 5f 00               91.1.176      
                                              51 00 5e 00  51 00 5f 00               91.1.184      
                                              52 00 5c 00  53 00 61 00               91.1.192      
  10.2                         524288  IN     5e 00 51 00  62 00 54 00   13ms        92.1.0        
                                              5e 00 53 00  62 00 51 00               92.1.8        
                                              5e 00 50 00  5f 00 51 00               92.1.16       
                                              5d 00 54 00  5d 00 51 00               92.1.24       
                                              5e 00 54 00  60 00 52 00               92.1.32       
                                              5c 00 50 00  5e 00 50 00               92.1.40       
                                              5e 00 54 00  5d 00 53 00               92.1.48       
                                              5e 00 53 00  60 00 51 00               92.1.56       
                                              5f 00 55 00  5f 00 51 00               92.1.64       
                                              5e 00 55 00  5e 00 53 00               92.1.72       
                                              5e 00 51 00  5f 00 51 00               92.1.80       
                                              5d 00 53 00  5e 00 50 00               92.1.88       
                                              5d 00 53 00  5e 00 52 00               92.1.96       
                                              5e 00 52 00  5e 00 53 00               92.1.104      
                                              5f 00 51 00  5c 00 52 00               92.1.112      
                                              5c 00 53 00  5e 00 53 00               92.1.120      
                                              5f 00 53 00  5e 00 51 00               92.1.128      
                                              5f 00 55 00  5e 00 55 00               92.1.136      
                                              5e 00 51 00  5f 00 52 00               92.1.144      
                                              5f 00 51 00  5f 00 52 00               92.1.152      
                                              5d 00 52 00  60 00 52 00               92.1.160      
                                              5e 00 53 00  5e 00 55 00               92.1.168      
                                              5e 00 53 00  5f 00 51 00               92.1.176      
                                              61 00 52 00  5e 00 53 00               92.1.184      
                                              5f 00 53 00  60 00 51 00               92.1.192      
  10.2                         524288  IN     50 00 5e 00  51 00 60 00   12ms        93.1.0        
                                              51 00 5e 00  50 00 5c 00               93.1.8        
                                              54 00 5e 00  52 00 5f 00               93.1.16       
                                              50 00 5e 00  52 00 5e 00               93.1.24       
                                              52 00 5e 00  53 00 5c 00               93.1.32       
                                              53 00 5c 00  54 00 5c 00               93.1.40       
                                              52 00 5e 00  51 00 5e 00               93.1.48       
                                              52 00 5e 00  50 00 5d 00               93.1.56       
                                              51 00 5e 00  53 00 5e 00               93.1.64       
                                              51 00 5e 00  53 00 5f 00               93.1.72       
                                              53 00 5f 00  52 00 5f 00               93.1.80       
                                              53 00 5f 00  54 00 5f 00               93.1.88       
                                              53 00 5e 00  52 00 60 00               93.1.96       
                                              51 00 5f 00  4f 00 5d 00               93.1.104      
                                              52 00 5d 00  54 00 5d 00               93.1.112      
                                              55 00 5e 00  52 00 5c 00               93.1.120      
                                              53 00 5f 00  53 00 60 00               93.1.128      
                                              53 00 5d 00  52 00 5d 00               93.1.136      
                                              50 00 60 00  51 00 60 00               93.1.144      
                                              51 00 5c 00  53 00 5d 00               93.1.152      
                                              54 00 5e 00  4e 00 5f 00               93.1.160      
                                              50 00 5c 00  53 00 60 00               93.1.168      
                                              54 00 60 00  50 00 5c 00               93.1.176      
                                              4f 00 62 00  50 00 60 00               93.1.184      
                                              51 00 62 00  51 00 5e 00               93.1.192      
  10.2                             31  IN     1a 00 00 00  01 00 02 00   31us        94.1.0        
                                              31 84 00 01  04 00 66 0f               94.1.8        
                                              00 00 01 01  04 00 00 00               94.1.16       
                                              00 00 00 55  aa 55 aa                  94.1.24       
  10.2                         524288  IN     61 00 54 00  5f 00 55 00  249ms        95.1.0        
                                              5f 00 55 00  62 00 55 00               95.1.8        
                                              61 00 53 00  61 00 55 00               95.1.16       
                                              62 00 53 00  64 00 54 00               95.1.24       
                                              5d 00 55 00  5f 00 55 00               95.1.32       
                                              60 00 57 00  60 00 57 00               95.1.40       
                                              66 00 57 00  61 00 56 00               95.1.48       
                                              63 00 57 00  64 00 58 00               95.1.56       
                                              64 00 53 00  63 00 57 00               95.1.64       
                                              63 00 55 00  61 00 55 00               95.1.72       
                                              63 00 57 00  63 00 55 00               95.1.80       
                                              62 00 57 00  64 00 57 00               95.1.88       
                                              61 00 56 00  62 00 56 00               95.1.96       
                                              62 00 56 00  63 00 55 00               95.1.104      
                                              64 00 5a 00  64 00 56 00               95.1.112      
                                              62 00 56 00  62 00 56 00               95.1.120      
                                              62 00 57 00  63 00 53 00               95.1.128      
                                              60 00 55 00  65 00 57 00               95.1.136      
                                              62 00 56 00  62 00 59 00               95.1.144      
                                              65 00 57 00  66 00 5b 00               95.1.152      
                                              62 00 57 00  65 00 56 00               95.1.160      
                                              60 00 55 00  64 00 59 00               95.1.168      
                                              60 00 54 00  64 00 58 00               95.1.176      
                                              61 00 5d 00  66 00 57 00               95.1.184      
                                              62 00 56 00  62 00 57 00               95.1.192      
  10.2                         524288  IN     5c 00 52 00  60 00 4f 00   13ms        96.1.0        
                                              5d 00 52 00  5e 00 51 00               96.1.8        
                                              5d 00 55 00  5b 00 51 00               96.1.16       
                                              5c 00 50 00  5f 00 50 00               96.1.24       
                                              5c 00 51 00  5e 00 51 00               96.1.32       
                                              5d 00 51 00  5d 00 52 00               96.1.40       
                                              5d 00 53 00  5c 00 51 00               96.1.48       
                                              60 00 51 00  5c 00 53 00               96.1.56       
                                              5d 00 51 00  60 00 53 00               96.1.64       
                                              5d 00 50 00  5e 00 52 00               96.1.72       
                                              5c 00 50 00  5c 00 52 00               96.1.80       
                                              5c 00 50 00  5d 00 51 00               96.1.88       
                                              5f 00 51 00  5d 00 51 00               96.1.96       
                                              60 00 51 00  5c 00 51 00               96.1.104      
                                              5d 00 50 00  5c 00 51 00               96.1.112      
                                              5c 00 51 00  5d 00 50 00               96.1.120      
                                              5f 00 50 00  5e 00 4f 00               96.1.128      
                                              5e 00 4f 00  5e 00 51 00               96.1.136      
                                              5c 00 51 00  5d 00 53 00               96.1.144      
                                              5c 00 51 00  5c 00 4f 00               96.1.152      
                                              5c 00 53 00  5b 00 50 00               96.1.160      
                                              5d 00 4f 00  5e 00 52 00               96.1.168      
                                              5c 00 51 00  5c 00 51 00               96.1.176      
                                              5f 00 53 00  5d 00 4f 00               96.1.184      
                                              5c 00 4d 00  5e 00 52 00               96.1.192      
  10.2                         524288  IN     55 00 5e 00  52 00 60 00   13ms        97.1.0        
                                              53 00 5d 00  50 00 5e 00               97.1.8        
                                              53 00 5e 00  53 00 5b 00               97.1.16       
                                              53 00 5e 00  53 00 5e 00               97.1.24       
                                              52 00 5f 00  50 00 5d 00               97.1.32       
                                              51 00 5d 00  53 00 5c 00               97.1.40       
                                              50 00 5d 00  51 00 61 00               97.1.48       
                                              51 00 5d 00  55 00 5e 00               97.1.56       
                                              52 00 5f 00  53 00 5f 00               97.1.64       
                                              52 00 5f 00  50 00 60 00               97.1.72       
                                              4f 00 60 00  52 00 5e 00               97.1.80       
                                              51 00 60 00  51 00 5d 00               97.1.88       
                                              51 00 60 00  51 00 5d 00               97.1.96       
                                              53 00 5b 00  51 00 60 00               97.1.104      
                                              55 00 5e 00  51 00 5e 00               97.1.112      
                                              50 00 5d 00  52 00 5e 00               97.1.120      
                                              54 00 5c 00  52 00 5f 00               97.1.128      
                                              53 00 5f 00  52 00 5f 00               97.1.136      
                                              52 00 60 00  50 00 61 00               97.1.144      
                                              52 00 5f 00  53 00 5f 00               97.1.152      
                                              51 00 5f 00  51 00 5d 00               97.1.160      
                                              55 00 5c 00  55 00 5f 00               97.1.168      
                                              50 00 5f 00  51 00 5e 00               97.1.176      
                                              51 00 5c 00  53 00 5f 00               97.1.184      
                                              53 00 5e 00  53 00 5c 00               97.1.192      
  10.2                         524288  IN     5d 00 53 00  5e 00 53 00   12ms        98.1.0        
                                              5f 00 53 00  62 00 52 00               98.1.8        
                                              61 00 56 00  5e 00 55 00               98.1.16       
                                              5f 00 51 00  5c 00 53 00               98.1.24       
                                              60 00 53 00  60 00 55 00               98.1.32       
                                              5e 00 53 00  5f 00 51 00               98.1.40       
                                              5e 00 55 00  5e 00 50 00               98.1.48       
                                              5e 00 51 00  5e 00 51 00               98.1.56       
                                              61 00 54 00  5c 00 53 00               98.1.64       
                                              5e 00 55 00  60 00 53 00               98.1.72       
                                              60 00 53 00  5e 00 53 00               98.1.80       
                                              5e 00 51 00  5c 00 54 00               98.1.88       
                                              5c 00 53 00  5e 00 52 00               98.1.96       
                                              5f 00 53 00  5e 00 52 00               98.1.104      
                                              5f 00 53 00  5e 00 52 00               98.1.112      
                                              5d 00 52 00  60 00 53 00               98.1.120      
                                              5c 00 53 00  5f 00 51 00               98.1.128      
                                              60 00 54 00  5f 00 55 00               98.1.136      
                                              5e 00 53 00  60 00 54 00               98.1.144      
                                              5f 00 51 00  5e 00 4e 00               98.1.152      
                                              5e 00 53 00  5e 00 52 00               98.1.160      
                                              5e 00 52 00  5d 00 55 00               98.1.168      
                                              60 00 52 00  5e 00 52 00               98.1.176      
                                              5e 00 53 00  60 00 51 00               98.1.184      
                                              5c 00 52 00  5e 00 51 00               98.1.192      
  10.2                         524288  IN     52 00 5e 00  51 00 5e 00   13ms        99.1.0        
                                              53 00 61 00  53 00 5c 00               99.1.8        
                                              52 00 5f 00  54 00 5e 00               99.1.16       
                                              52 00 5e 00  50 00 5f 00               99.1.24       
                                              52 00 5e 00  51 00 5c 00               99.1.32       
                                              51 00 5e 00  53 00 61 00               99.1.40       
                                              53 00 5d 00  53 00 5e 00               99.1.48       
                                              50 00 5f 00  55 00 5d 00               99.1.56       
                                              52 00 5e 00  51 00 5e 00               99.1.64       
                                              55 00 5e 00  53 00 5e 00               99.1.72       
                                              52 00 5f 00  53 00 60 00               99.1.80       
                                              53 00 5e 00  53 00 60 00               99.1.88       
                                              52 00 5d 00  54 00 5e 00               99.1.96       
                                              51 00 5f 00  51 00 5f 00               99.1.104      
                                              52 00 5f 00  51 00 5d 00               99.1.112      
                                              50 00 5f 00  53 00 5c 00               99.1.120      
                                              54 00 5c 00  54 00 5e 00               99.1.128      
                                              54 00 5c 00  53 00 5e 00               99.1.136      
                                              52 00 60 00  53 00 5f 00               99.1.144      
                                              52 00 5e 00  54 00 5e 00               99.1.152      
                                              53 00 5f 00  51 00 5d 00               99.1.160      
                                              51 00 5e 00  54 00 60 00               99.1.168      
                                              53 00 5f 00  52 00 5f 00               99.1.176      
                                              51 00 60 00  51 00 61 00               99.1.184      
                                              51 00 63 00  51 00 5c 00               99.1.192      
  10.2                             31  IN     1a 00 00 00  01 00 02 00   44us       100.1.0        
                                              31 84 00 01  04 00 67 0f              100.1.8        
                                              00 00 01 01  04 00 00 00              100.1.16       
                                              00 00 00 55  aa 55 aa                 100.1.24       
  10.2                         524288  IN     61 00 53 00  61 00 57 00  249ms       101.1.0        
                                              5e 00 55 00  60 00 53 00              101.1.8        
                                              61 00 53 00  62 00 55 00              101.1.16       
                                              60 00 53 00  62 00 55 00              101.1.24       
                                              5f 00 56 00  63 00 55 00              101.1.32       
                                              61 00 56 00  62 00 58 00              101.1.40       
                                              63 00 57 00  61 00 58 00              101.1.48       
                                              62 00 59 00  64 00 58 00              101.1.56       
                                              63 00 54 00  62 00 57 00              101.1.64       
                                              63 00 58 00  62 00 55 00              101.1.72       
                                              62 00 59 00  62 00 57 00              101.1.80       
                                              62 00 58 00  62 00 57 00              101.1.88       
                                              60 00 55 00  60 00 55 00              101.1.96       
                                              60 00 55 00  61 00 54 00              101.1.104      
                                              61 00 5a 00  66 00 56 00              101.1.112      
                                              60 00 59 00  64 00 57 00              101.1.120      
                                              64 00 5a 00  62 00 54 00              101.1.128      
                                              60 00 56 00  64 00 56 00              101.1.136      
                                              64 00 59 00  62 00 5a 00              101.1.144      
                                              64 00 56 00  64 00 5b 00              101.1.152      
                                              64 00 59 00  63 00 57 00              101.1.160      
                                              60 00 53 00  65 00 59 00              101.1.168      
                                              62 00 55 00  63 00 56 00              101.1.176      
                                              62 00 5d 00  64 00 56 00              101.1.184      
                                              63 00 57 00  62 00 56 00              101.1.192      
  10.2                         524288  IN     5c 00 51 00  5f 00 52 00   13ms       102.1.0        
                                              5e 00 53 00  5c 00 50 00              102.1.8        
                                              5f 00 53 00  5f 00 50 00              102.1.16       
                                              5d 00 51 00  5c 00 53 00              102.1.24       
                                              5f 00 52 00  5d 00 53 00              102.1.32       
                                              61 00 50 00  5e 00 52 00              102.1.40       
                                              5d 00 51 00  5d 00 52 00              102.1.48       
                                              62 00 52 00  5c 00 53 00              102.1.56       
                                              5e 00 52 00  5c 00 54 00              102.1.64       
                                              5d 00 53 00  5e 00 52 00              102.1.72       
                                              5d 00 51 00  5d 00 52 00              102.1.80       
                                              5e 00 51 00  5c 00 52 00              102.1.88       
                                              5e 00 50 00  5c 00 51 00              102.1.96       
                                              5f 00 50 00  5e 00 52 00              102.1.104      
                                              5e 00 50 00  5d 00 52 00              102.1.112      
                                              60 00 51 00  5e 00 52 00              102.1.120      
                                              5e 00 52 00  5f 00 54 00              102.1.128      
                                              5e 00 50 00  5f 00 54 00              102.1.136      
                                              5e 00 52 00  5f 00 52 00              102.1.144      
                                              5c 00 50 00  5e 00 52 00              102.1.152      
                                              5f 00 53 00  5d 00 51 00              102.1.160      
                                              5e 00 51 00  5c 00 51 00              102.1.168      
                                              5d 00 50 00  5f 00 52 00              102.1.176      
                                              5c 00 51 00  5c 00 51 00              102.1.184      
                                              5d 00 4f 00  5e 00 53 00              102.1.192      
  10.2                         524288  IN     54 00 5d 00  52 00 5d 00   12ms       103.1.0        
                                              55 00 60 00  4f 00 5f 00              103.1.8        
                                              53 00 5f 00  52 00 5e 00              103.1.16       
                                              4f 00 5c 00  53 00 5e 00              103.1.24       
                                              51 00 5e 00  51 00 5e 00              103.1.32       
                                              51 00 5f 00  53 00 5d 00              103.1.40       
                                              4f 00 60 00  52 00 5e 00              103.1.48       
                                              54 00 5f 00  53 00 5f 00              103.1.56       
                                              53 00 5e 00  52 00 60 00              103.1.64       
                                              52 00 60 00  52 00 5e 00              103.1.72       
                                              52 00 5e 00  53 00 5e 00              103.1.80       
                                              51 00 5c 00  51 00 5e 00              103.1.88       
                                              52 00 5f 00  4f 00 60 00              103.1.96       
                                              53 00 5e 00  51 00 5c 00              103.1.104      
                                              54 00 5e 00  53 00 5e 00              103.1.112      
                                              52 00 5e 00  52 00 5d 00              103.1.120      
                                              51 00 5d 00  51 00 5f 00              103.1.128      
                                              53 00 60 00  52 00 5e 00              103.1.136      
                                              51 00 5f 00  52 00 5d 00              103.1.144      
                                              50 00 60 00  51 00 5e 00              103.1.152      
                                              51 00 5c 00  54 00 5c 00              103.1.160      
                                              51 00 5d 00  51 00 5d 00              103.1.168      
                                              51 00 5f 00  52 00 60 00              103.1.176      
                                              53 00 5c 00  53 00 5e 00              103.1.184      
                                              53 00 5d 00  51 00 5f 00              103.1.192      
  10.2                         524288  IN     5e 00 53 00  5f 00 52 00   13ms       104.1.0        
                                              5e 00 54 00  5f 00 53 00              104.1.8        
                                              5f 00 51 00  60 00 52 00              104.1.16       
                                              5e 00 53 00  5e 00 53 00              104.1.24       
                                              5d 00 54 00  5d 00 55 00              104.1.32       
                                              5e 00 50 00  5e 00 51 00              104.1.40       
                                              5e 00 51 00  5e 00 53 00              104.1.48       
                                              5d 00 53 00  61 00 52 00              104.1.56       
                                              5f 00 52 00  5e 00 53 00              104.1.64       
                                              5f 00 55 00  60 00 53 00              104.1.72       
                                              5c 00 55 00  5e 00 52 00              104.1.80       
                                              5d 00 52 00  5e 00 52 00              104.1.88       
                                              5c 00 53 00  60 00 53 00              104.1.96       
                                              5f 00 53 00  5f 00 51 00              104.1.104      
                                              5e 00 54 00  5e 00 52 00              104.1.112      
                                              5e 00 53 00  5e 00 53 00              104.1.120      
                                              60 00 53 00  5e 00 52 00              104.1.128      
                                              5c 00 54 00  60 00 54 00              104.1.136      
                                              5e 00 53 00  5f 00 52 00              104.1.144      
                                              5d 00 53 00  5e 00 51 00              104.1.152      
                                              60 00 53 00  60 00 53 00              104.1.160      
                                              5e 00 54 00  60 00 54 00              104.1.168      
                                              5e 00 52 00  5e 00 51 00              104.1.176      
                                              5e 00 53 00  5e 00 52 00              104.1.184      
                                              60 00 53 00  5e 00 50 00              104.1.192      
  10.2                         524288  IN     52 00 60 00  4f 00 60 00   13ms       105.1.0        
                                              53 00 5e 00  50 00 60 00              105.1.8        
                                              54 00 5d 00  52 00 62 00              105.1.16       
                                              53 00 5c 00  53 00 5b 00              105.1.24       
                                              52 00 5e 00  53 00 5e 00              105.1.32       
                                              51 00 60 00  53 00 60 00              105.1.40       
                                              52 00 5f 00  52 00 60 00              105.1.48       
                                              51 00 60 00  52 00 5f 00              105.1.56       
                                              51 00 5f 00  53 00 5d 00              105.1.64       
                                              51 00 5e 00  52 00 5d 00              105.1.72       
                                              53 00 5d 00  51 00 5f 00              105.1.80       
                                              53 00 5f 00  53 00 5f 00              105.1.88       
                                              54 00 61 00  53 00 5d 00              105.1.96       
                                              53 00 60 00  54 00 62 00              105.1.104      
                                              53 00 5f 00  53 00 60 00              105.1.112      
                                              51 00 5e 00  53 00 60 00              105.1.120      
                                              51 00 5d 00  55 00 62 00              105.1.128      
                                              53 00 5e 00  52 00 60 00              105.1.136      
                                              54 00 60 00  52 00 60 00              105.1.144      
                                              52 00 5f 00  51 00 5d 00              105.1.152      
                                              53 00 60 00  53 00 5e 00              105.1.160      
                                              52 00 5d 00  52 00 62 00              105.1.168      
                                              52 00 60 00  51 00 5c 00              105.1.176      
                                              50 00 60 00  53 00 5e 00              105.1.184      
                                              53 00 62 00  51 00 60 00              105.1.192      
  10.2                             31  IN     1a 00 00 00  01 00 02 00   67us       106.1.0        
                                              31 84 00 01  04 00 68 0f              106.1.8        
                                              00 00 01 01  04 00 00 00              106.1.16       
                                              00 00 00 55  aa 55 aa                 106.1.24       
  10.2                         524288  IN     5e 00 54 00  5f 00 54 00  249ms       107.1.0        
                                              60 00 54 00  61 00 54 00              107.1.8        
                                              61 00 54 00  60 00 57 00              107.1.16       
                                              60 00 55 00  62 00 55 00              107.1.24       
                                              5e 00 57 00  60 00 55 00              107.1.32       
                                              63 00 56 00  61 00 58 00              107.1.40       
                                              63 00 57 00  62 00 57 00              107.1.48       
                                              61 00 57 00  64 00 58 00              107.1.56       
                                              63 00 55 00  64 00 59 00              107.1.64       
                                              64 00 57 00  60 00 55 00              107.1.72       
                                              63 00 59 00  60 00 55 00              107.1.80       
                                              64 00 56 00  64 00 57 00              107.1.88       
                                              60 00 55 00  63 00 58 00              107.1.96       
                                              62 00 56 00  63 00 55 00              107.1.104      
                                              63 00 5b 00  63 00 58 00              107.1.112      
                                              61 00 58 00  63 00 56 00              107.1.120      
                                              67 00 56 00  62 00 52 00              107.1.128      
                                              60 00 55 00  64 00 58 00              107.1.136      
                                              63 00 58 00  63 00 5a 00              107.1.144      
                                              63 00 57 00  65 00 59 00              107.1.152      
                                              65 00 59 00  61 00 55 00              107.1.160      
                                              62 00 55 00  65 00 58 00              107.1.168      
                                              61 00 57 00  63 00 57 00              107.1.176      
                                              61 00 59 00  66 00 56 00              107.1.184      
                                              61 00 53 00  61 00 58 00              107.1.192      
  10.2                         524288  IN     5c 00 50 00  60 00 54 00   12ms       108.1.0        
                                              5b 00 52 00  5c 00 51 00              108.1.8        
                                              5c 00 53 00  61 00 55 00              108.1.16       
                                              5d 00 51 00  5d 00 51 00              108.1.24       
                                              5c 00 53 00  5f 00 50 00              108.1.32       
                                              5d 00 50 00  5e 00 50 00              108.1.40       
                                              5f 00 51 00  5e 00 4f 00              108.1.48       
                                              5f 00 53 00  5c 00 52 00              108.1.56       
                                              5e 00 50 00  5f 00 52 00              108.1.64       
                                              5d 00 54 00  5d 00 52 00              108.1.72       
                                              5e 00 50 00  5c 00 52 00              108.1.80       
                                              5e 00 53 00  5c 00 52 00              108.1.88       
                                              5c 00 51 00  5d 00 54 00              108.1.96       
                                              5f 00 50 00  5c 00 51 00              108.1.104      
                                              5c 00 51 00  5d 00 4f 00              108.1.112      
                                              5e 00 4e 00  5e 00 50 00              108.1.120      
                                              5e 00 51 00  5d 00 51 00              108.1.128      
                                              5f 00 51 00  5c 00 51 00              108.1.136      
                                              5e 00 51 00  5c 00 52 00              108.1.144      
                                              5f 00 4f 00  5e 00 51 00              108.1.152      
                                              5e 00 51 00  5e 00 52 00              108.1.160      
                                              5d 00 54 00  5b 00 51 00              108.1.168      
                                              5d 00 51 00  5c 00 51 00              108.1.176      
                                              5d 00 4f 00  5c 00 51 00              108.1.184      
                                              5c 00 51 00  5c 00 54 00              108.1.192      
  10.2                         524288  IN     52 00 5e 00  51 00 5d 00   14ms       109.1.0        
                                              53 00 5e 00  51 00 60 00              109.1.8        
                                              53 00 5f 00  53 00 5d 00              109.1.16       
                                              50 00 5f 00  53 00 60 00              109.1.24       
                                              53 00 5e 00  52 00 5e 00              109.1.32       
                                              51 00 60 00  52 00 5f 00              109.1.40       
                                              53 00 5d 00  53 00 60 00              109.1.48       
                                              53 00 60 00  55 00 5e 00              109.1.56       
                                              50 00 62 00  53 00 62 00              109.1.64       
                                              51 00 5e 00  4f 00 60 00              109.1.72       
                                              51 00 5e 00  54 00 5d 00              109.1.80       
                                              52 00 5f 00  52 00 60 00              109.1.88       
                                              50 00 5e 00  51 00 60 00              109.1.96       
                                              53 00 60 00  53 00 5f 00              109.1.104      
                                              51 00 61 00  53 00 5f 00              109.1.112      
                                              51 00 5f 00  50 00 5e 00              109.1.120      
                                              54 00 5e 00  51 00 5f 00              109.1.128      
                                              53 00 5f 00  53 00 5c 00              109.1.136      
                                              53 00 60 00  52 00 5e 00              109.1.144      
                                              52 00 5e 00  53 00 5d 00              109.1.152      
                                              51 00 5d 00  50 00 5b 00              109.1.160      
                                              54 00 5d 00  52 00 5f 00              109.1.168      
                                              53 00 5f 00  53 00 5e 00              109.1.176      
                                              51 00 5d 00  52 00 5d 00              109.1.184      
                                              50 00 5e 00  54 00 60 00              109.1.192      
  10.2                         524288  IN     5c 00 51 00  5e 00 52 00   11ms       110.1.0        
                                              5e 00 53 00  5e 00 51 00              110.1.8        
                                              5d 00 53 00  5d 00 53 00              110.1.16       
                                              5e 00 53 00  5c 00 53 00              110.1.24       
                                              5b 00 53 00  5d 00 53 00              110.1.32       
                                              5e 00 50 00  60 00 55 00              110.1.40       
                                              60 00 51 00  5e 00 51 00              110.1.48       
                                              60 00 54 00  5c 00 54 00              110.1.56       
                                              5f 00 53 00  5f 00 53 00              110.1.64       
                                              5e 00 52 00  60 00 53 00              110.1.72       
                                              5f 00 53 00  5c 00 52 00              110.1.80       
                                              5e 00 52 00  5c 00 51 00              110.1.88       
                                              5e 00 53 00  60 00 53 00              110.1.96       
                                              5f 00 55 00  5f 00 51 00              110.1.104      
                                              5c 00 51 00  5e 00 50 00              110.1.112      
                                              5b 00 50 00  5e 00 51 00              110.1.120      
                                              5d 00 51 00  62 00 51 00              110.1.128      
                                              60 00 53 00  5c 00 55 00              110.1.136      
                                              5f 00 51 00  5f 00 51 00              110.1.144      
                                              5d 00 53 00  5e 00 51 00              110.1.152      
                                              5e 00 52 00  5f 00 50 00              110.1.160      
                                              5d 00 4f 00  5f 00 52 00              110.1.168      
                                              5d 00 51 00  5e 00 4f 00              110.1.176      
                                              60 00 53 00  5d 00 53 00              110.1.184      
                                              5b 00 51 00  5c 00 4f 00              110.1.192      
  10.2                         524288  IN     53 00 5e 00  53 00 5d 00   13ms       111.1.0        
                                              53 00 5f 00  50 00 60 00              111.1.8        
                                              52 00 5e 00  52 00 5e 00              111.1.16       
                                              53 00 5f 00  51 00 5f 00              111.1.24       
                                              50 00 60 00  52 00 5e 00              111.1.32       
                                              52 00 60 00  53 00 5c 00              111.1.40       
                                              52 00 5f 00  53 00 5f 00              111.1.48       
                                              50 00 60 00  52 00 60 00              111.1.56       
                                              51 00 61 00  53 00 5e 00              111.1.64       
                                              53 00 60 00  53 00 5f 00              111.1.72       
                                              52 00 5c 00  53 00 5e 00              111.1.80       
                                              51 00 60 00  53 00 5f 00              111.1.88       
                                              53 00 5f 00  52 00 60 00              111.1.96       
                                              53 00 60 00  52 00 60 00              111.1.104      
                                              54 00 5f 00  53 00 61 00              111.1.112      
                                              52 00 61 00  50 00 5d 00              111.1.120      
                                              51 00 5f 00  52 00 5e 00              111.1.128      
                                              55 00 5e 00  53 00 60 00              111.1.136      
                                              54 00 60 00  52 00 5e 00              111.1.144      
                                              53 00 5f 00  51 00 5d 00              111.1.152      
                                              55 00 5d 00  51 00 5f 00              111.1.160      
                                              54 00 5e 00  52 00 64 00              111.1.168      
                                              54 00 60 00  50 00 5f 00              111.1.176      
                                              53 00 5e 00  53 00 60 00              111.1.184      
                                              51 00 60 00  51 00 5e 00              111.1.192      
  10.2                             31  IN     1a 00 00 00  01 00 02 00   43us       112.1.0        
                                              31 84 00 01  04 00 69 0f              112.1.8        
                                              00 00 01 01  04 00 00 00              112.1.16       
                                              00 00 00 55  aa 55 aa                 112.1.24       
  10.2                         524288  IN     60 00 54 00  5f 00 54 00  249ms       113.1.0        
                                              61 00 55 00  60 00 55 00              113.1.8        
                                              63 00 53 00  61 00 56 00              113.1.16       
                                              61 00 53 00  60 00 55 00              113.1.24       
                                              5e 00 55 00  60 00 54 00              113.1.32       
                                              60 00 58 00  63 00 57 00              113.1.40       
                                              65 00 56 00  62 00 56 00              113.1.48       
                                              64 00 57 00  64 00 59 00              113.1.56       
                                              62 00 55 00  62 00 59 00              113.1.64       
                                              65 00 55 00  61 00 56 00              113.1.72       
                                              63 00 58 00  63 00 59 00              113.1.80       
                                              63 00 57 00  65 00 58 00              113.1.88       
                                              64 00 53 00  62 00 54 00              113.1.96       
                                              61 00 56 00  62 00 55 00              113.1.104      
                                              65 00 59 00  65 00 56 00              113.1.112      
                                              63 00 58 00  64 00 58 00              113.1.120      
                                              63 00 57 00  64 00 55 00              113.1.128      
                                              61 00 55 00  64 00 56 00              113.1.136      
                                              61 00 56 00  61 00 5a 00              113.1.144      
                                              63 00 55 00  62 00 58 00              113.1.152      
                                              65 00 57 00  65 00 55 00              113.1.160      
                                              60 00 53 00  65 00 5a 00              113.1.168      
                                              62 00 55 00  66 00 56 00              113.1.176      
                                              62 00 59 00  65 00 56 00              113.1.184      
                                              61 00 55 00  63 00 56 00              113.1.192      
  10.2                         524288  IN     60 00 50 00  5e 00 52 00   12ms       114.1.0        
                                              5c 00 53 00  5e 00 53 00              114.1.8        
                                              5f 00 53 00  5d 00 50 00              114.1.16       
                                              5c 00 53 00  5e 00 53 00              114.1.24       
                                              5d 00 51 00  5f 00 53 00              114.1.32       
                                              5e 00 51 00  60 00 50 00              114.1.40       
                                              5f 00 52 00  5d 00 53 00              114.1.48       
                                              60 00 51 00  5f 00 52 00              114.1.56       
                                              5f 00 52 00  5f 00 4f 00              114.1.64       
                                              5c 00 51 00  5e 00 53 00              114.1.72       
                                              60 00 52 00  5c 00 51 00              114.1.80       
                                              5f 00 52 00  5e 00 52 00              114.1.88       
                                              5f 00 51 00  5c 00 52 00              114.1.96       
                                              60 00 51 00  5b 00 50 00              114.1.104      
                                              5e 00 51 00  60 00 51 00              114.1.112      
                                              5d 00 53 00  5e 00 52 00              114.1.120      
                                              5c 00 51 00  5f 00 53 00              114.1.128      
                                              5e 00 52 00  60 00 51 00              114.1.136      
                                              5e 00 52 00  5d 00 53 00              114.1.144      
                                              5e 00 51 00  5e 00 50 00              114.1.152      
                                              5d 00 52 00  60 00 50 00              114.1.160      
                                              5e 00 51 00  5e 00 52 00              114.1.168      
                                              61 00 52 00  5f 00 52 00              114.1.176      
                                              5c 00 50 00  5c 00 53 00              114.1.184      
                                              60 00 51 00  5d 00 54 00              114.1.192      
  10.2                         524288  IN     52 00 60 00  51 00 5c 00   13ms       115.1.0        
                                              51 00 60 00  51 00 60 00              115.1.8        
                                              53 00 5f 00  53 00 5e 00              115.1.16       
                                              52 00 5d 00  52 00 5f 00              115.1.24       
                                              51 00 5e 00  52 00 60 00              115.1.32       
                                              52 00 5e 00  52 00 5d 00              115.1.40       
                                              54 00 60 00  53 00 5e 00              115.1.48       
                                              53 00 60 00  54 00 61 00              115.1.56       
                                              52 00 5f 00  52 00 5f 00              115.1.64       
                                              51 00 5e 00  52 00 5f 00              115.1.72       
                                              50 00 5e 00  51 00 5e 00              115.1.80       
                                              52 00 5e 00  52 00 5e 00              115.1.88       
                                              53 00 5e 00  53 00 5e 00              115.1.96       
                                              54 00 5f 00  53 00 60 00              115.1.104      
                                              55 00 5f 00  52 00 5e 00              115.1.112      
                                              53 00 5e 00  52 00 5e 00              115.1.120      
                                              53 00 5e 00  51 00 5e 00              115.1.128      
                                              51 00 5e 00  51 00 5e 00              115.1.136      
                                              53 00 60 00  53 00 60 00              115.1.144      
                                              55 00 5e 00  51 00 5e 00              115.1.152      
                                              53 00 5c 00  51 00 5e 00              115.1.160      
                                              53 00 5d 00  50 00 60 00              115.1.168      
                                              53 00 60 00  51 00 5c 00              115.1.176      
                                              53 00 5c 00  51 00 5e 00              115.1.184      
                                              51 00 5f 00  53 00 5f 00              115.1.192      
  10.2                         524288  IN     5c 00 50 00  5e 00 54 00   12ms       116.1.0        
                                              5e 00 53 00  5e 00 51 00              116.1.8        
                                              5e 00 54 00  5c 00 51 00              116.1.16       
                                              5f 00 50 00  5e 00 51 00              116.1.24       
                                              5f 00 54 00  5e 00 53 00              116.1.32       
                                              5d 00 51 00  5d 00 53 00              116.1.40       
                                              5e 00 51 00  5e 00 51 00              116.1.48       
                                              5e 00 53 00  5e 00 4f 00              116.1.56       
                                              5f 00 53 00  5e 00 52 00              116.1.64       
                                              60 00 52 00  5f 00 52 00              116.1.72       
                                              60 00 53 00  5f 00 52 00              116.1.80       
                                              5d 00 50 00  5c 00 51 00              116.1.88       
                                              5e 00 51 00  60 00 53 00              116.1.96       
                                              60 00 53 00  5e 00 51 00              116.1.104      
                                              5c 00 51 00  60 00 55 00              116.1.112      
                                              5e 00 51 00  5f 00 4f 00              116.1.120      
                                              5d 00 53 00  61 00 52 00              116.1.128      
                                              5d 00 51 00  5e 00 57 00              116.1.136      
                                              5e 00 51 00  60 00 54 00              116.1.144      
                                              5f 00 51 00  5e 00 51 00              116.1.152      
                                              5e 00 52 00  5f 00 50 00              116.1.160      
                                              5f 00 53 00  60 00 51 00              116.1.168      
                                              60 00 51 00  5e 00 52 00              116.1.176      
                                              5f 00 53 00  5d 00 52 00              116.1.184      
                                              5e 00 52 00  5e 00 53 00              116.1.192      
  10.2                         524288  IN     51 00 5c 00  52 00 5f 00   12ms       117.1.0        
                                              52 00 5e 00  53 00 5e 00              117.1.8        
                                              53 00 60 00  51 00 5d 00              117.1.16       
                                              53 00 5e 00  52 00 5f 00              117.1.24       
                                              52 00 5e 00  53 00 5e 00              117.1.32       
                                              4f 00 60 00  53 00 62 00              117.1.40       
                                              52 00 5e 00  53 00 5f 00              117.1.48       
                                              52 00 5d 00  51 00 60 00              117.1.56       
                                              51 00 5e 00  54 00 5c 00              117.1.64       
                                              52 00 60 00  52 00 60 00              117.1.72       
                                              52 00 5c 00  52 00 5f 00              117.1.80       
                                              53 00 5e 00  55 00 5f 00              117.1.88       
                                              53 00 61 00  53 00 5f 00              117.1.96       
                                              53 00 5f 00  54 00 5f 00              117.1.104      
                                              53 00 62 00  54 00 5e 00              117.1.112      
                                              51 00 5e 00  53 00 5e 00              117.1.120      
                                              53 00 60 00  53 00 60 00              117.1.128      
                                              51 00 5e 00  53 00 5d 00              117.1.136      
                                              54 00 62 00  52 00 5f 00              117.1.144      
                                              51 00 5c 00  51 00 5f 00              117.1.152      
                                              53 00 5d 00  51 00 5c 00              117.1.160      
                                              54 00 5f 00  51 00 62 00              117.1.168      
                                              57 00 5e 00  51 00 61 00              117.1.176      
                                              52 00 5f 00  51 00 5f 00              117.1.184      
                                              53 00 62 00  53 00 61 00              117.1.192      
  10.2                             31  IN     1a 00 00 00  01 00 02 00   51us       118.1.0        
                                              31 84 00 01  04 00 6a 0f              118.1.8        
                                              00 00 01 01  04 00 00 00              118.1.16       
                                              00 00 00 55  aa 55 aa                 118.1.24       
  10.2                         524288  IN     60 00 53 00  5f 00 53 00  249ms       119.1.0        
                                              60 00 57 00  61 00 55 00              119.1.8        
                                              63 00 53 00  61 00 54 00              119.1.16       
                                              64 00 54 00  64 00 57 00              119.1.24       
                                              61 00 56 00  60 00 56 00              119.1.32       
                                              60 00 55 00  64 00 57 00              119.1.40       
                                              64 00 57 00  61 00 56 00              119.1.48       
                                              60 00 57 00  64 00 58 00              119.1.56       
                                              62 00 54 00  64 00 58 00              119.1.64       
                                              64 00 57 00  60 00 55 00              119.1.72       
                                              62 00 59 00  5e 00 57 00              119.1.80       
                                              62 00 56 00  64 00 57 00              119.1.88       
                                              63 00 53 00  62 00 55 00              119.1.96       
                                              61 00 55 00  61 00 55 00              119.1.104      
                                              64 00 59 00  64 00 59 00              119.1.112      
                                              62 00 57 00  65 00 58 00              119.1.120      
                                              64 00 57 00  64 00 54 00              119.1.128      
                                              61 00 57 00  65 00 57 00              119.1.136      
                                              64 00 56 00  63 00 5a 00              119.1.144      
                                              65 00 54 00  67 00 5c 00              119.1.152      
                                              67 00 58 00  65 00 55 00              119.1.160      
                                              5e 00 55 00  66 00 59 00              119.1.168      
                                              61 00 57 00  64 00 57 00              119.1.176      
                                              63 00 58 00  64 00 58 00              119.1.184      
                                              63 00 56 00  62 00 57 00              119.1.192      
  10.2                         524288  IN     5e 00 52 00  5c 00 52 00   12ms       120.1.0        
                                              5e 00 53 00  5c 00 53 00              120.1.8        
                                              60 00 51 00  5d 00 53 00              120.1.16       
                                              5f 00 53 00  60 00 53 00              120.1.24       
                                              5d 00 51 00  5e 00 53 00              120.1.32       
                                              5c 00 51 00  5c 00 52 00              120.1.40       
                                              5f 00 51 00  60 00 51 00              120.1.48       
                                              60 00 50 00  60 00 51 00              120.1.56       
                                              60 00 53 00  5b 00 50 00              120.1.64       
                                              5f 00 52 00  5d 00 50 00              120.1.72       
                                              5d 00 52 00  5d 00 52 00              120.1.80       
                                              5d 00 4f 00  5e 00 54 00              120.1.88       
                                              5d 00 51 00  5d 00 51 00              120.1.96       
                                              5d 00 51 00  5d 00 51 00              120.1.104      
                                              5d 00 51 00  5d 00 51 00              120.1.112      
                                              5d 00 51 00  5d 00 50 00              120.1.120      
                                              5e 00 51 00  5f 00 51 00              120.1.128      
                                              5c 00 51 00  5e 00 50 00              120.1.136      
                                              5e 00 50 00  5e 00 52 00              120.1.144      
                                              5d 00 51 00  5e 00 52 00              120.1.152      
                                              5f 00 54 00  5d 00 52 00              120.1.160      
                                              5c 00 51 00  5c 00 51 00              120.1.168      
                                              5c 00 52 00  5c 00 50 00              120.1.176      
                                              5c 00 51 00  5b 00 51 00              120.1.184      
                                              5c 00 4d 00  5c 00 54 00              120.1.192      
  10.2                         524288  IN     56 00 5d 00  53 00 5d 00   13ms       121.1.0        
                                              51 00 5d 00  51 00 60 00              121.1.8        
                                              51 00 5d 00  52 00 5c 00              121.1.16       
                                              52 00 5f 00  50 00 60 00              121.1.24       
                                              50 00 5e 00  51 00 5e 00              121.1.32       
                                              53 00 5e 00  51 00 60 00              121.1.40       
                                              52 00 5e 00  52 00 5f 00              121.1.48       
                                              54 00 5e 00  53 00 5e 00              121.1.56       
                                              51 00 5e 00  54 00 5f 00              121.1.64       
                                              55 00 5f 00  51 00 5f 00              121.1.72       
                                              51 00 5d 00  53 00 5e 00              121.1.80       
                                              53 00 5e 00  51 00 5c 00              121.1.88       
                                              52 00 5e 00  52 00 5d 00              121.1.96       
                                              53 00 5e 00  51 00 5c 00              121.1.104      
                                              52 00 60 00  52 00 5e 00              121.1.112      
                                              52 00 5f 00  52 00 5c 00              121.1.120      
                                              51 00 5b 00  52 00 60 00              121.1.128      
                                              53 00 5c 00  54 00 5f 00              121.1.136      
                                              52 00 61 00  52 00 5d 00              121.1.144      
                                              51 00 5f 00  53 00 5e 00              121.1.152      
                                              55 00 5e 00  53 00 5e 00              121.1.160      
                                              53 00 5c 00  51 00 5f 00              121.1.168      
                                              51 00 5c 00  51 00 5d 00              121.1.176      
                                              51 00 5c 00  4f 00 5c 00              121.1.184      
                                              51 00 60 00  51 00 5f 00              121.1.192      
  10.2                         524288  IN     5e 00 51 00  62 00 50 00   12ms       122.1.0        
                                              5b 00 53 00  60 00 55 00              122.1.8        
                                              5e 00 52 00  5c 00 51 00              122.1.16       
                                              5c 00 51 00  5f 00 53 00              122.1.24       
                                              5e 00 52 00  5e 00 52 00              122.1.32       
                                              5e 00 53 00  5e 00 53 00              122.1.40       
                                              5c 00 51 00  5e 00 52 00              122.1.48       
                                              5c 00 52 00  5e 00 51 00              122.1.56       
                                              5f 00 53 00  5c 00 53 00              122.1.64       
                                              5d 00 52 00  61 00 50 00              122.1.72       
                                              5c 00 53 00  5d 00 51 00              122.1.80       
                                              5c 00 51 00  5f 00 53 00              122.1.88       
                                              5e 00 51 00  5d 00 51 00              122.1.96       
                                              5e 00 53 00  5e 00 52 00              122.1.104      
                                              60 00 52 00  5c 00 52 00              122.1.112      
                                              61 00 50 00  60 00 4f 00              122.1.120      
                                              5f 00 53 00  5e 00 54 00              122.1.128      
                                              5f 00 53 00  5f 00 53 00              122.1.136      
                                              5b 00 52 00  60 00 51 00              122.1.144      
                                              60 00 53 00  5c 00 51 00              122.1.152      
                                              5d 00 50 00  5d 00 52 00              122.1.160      
                                              5d 00 51 00  5f 00 51 00              122.1.168      
                                              5f 00 52 00  5d 00 53 00              122.1.176      
                                              60 00 53 00  5d 00 51 00              122.1.184      
                                              5e 00 50 00  5d 00 51 00              122.1.192      
  10.2                         524288  IN     55 00 5f 00  53 00 5f 00   13ms       123.1.0        
                                              53 00 5f 00  51 00 5e 00              123.1.8        
                                              52 00 5e 00  52 00 5e 00              123.1.16       
                                              53 00 5e 00  51 00 5d 00              123.1.24       
                                              51 00 60 00  53 00 5d 00              123.1.32       
                                              50 00 5b 00  53 00 5e 00              123.1.40       
                                              53 00 5e 00  53 00 5e 00              123.1.48       
                                              51 00 5e 00  53 00 5d 00              123.1.56       
                                              50 00 5c 00  52 00 5c 00              123.1.64       
                                              51 00 5d 00  52 00 60 00              123.1.72       
                                              54 00 5c 00  53 00 5d 00              123.1.80       
                                              51 00 5f 00  51 00 60 00              123.1.88       
                                              54 00 60 00  54 00 5e 00              123.1.96       
                                              50 00 5d 00  53 00 5c 00              123.1.104      
                                              53 00 5e 00  51 00 5d 00              123.1.112      
                                              54 00 5f 00  51 00 5e 00              123.1.120      
                                              52 00 5d 00  51 00 60 00              123.1.128      
                                              54 00 5d 00  52 00 5f 00              123.1.136      
                                              53 00 5f 00  52 00 60 00              123.1.144      
                                              52 00 60 00  51 00 5e 00              123.1.152      
                                              53 00 5e 00  50 00 60 00              123.1.160      
                                              51 00 60 00  51 00 60 00              123.1.168      
                                              53 00 5e 00  53 00 5e 00              123.1.176      
                                              51 00 5e 00  53 00 60 00              123.1.184      
                                              52 00 62 00  52 00 5f 00              123.1.192      
  10.2                             31  IN     1a 00 00 00  01 00 02 00   35us       124.1.0        
                                              31 84 00 01  04 00 6b 0f              124.1.8        
                                              00 00 01 01  04 00 00 00              124.1.16       
                                              00 00 00 55  aa 55 aa                 124.1.24       
  10.2                         524288  IN     61 00 53 00  5f 00 54 00  249ms       125.1.0        
                                              61 00 56 00  5f 00 56 00              125.1.8        
                                              62 00 57 00  62 00 57 00              125.1.16       
                                              61 00 53 00  63 00 57 00              125.1.24       
                                              60 00 55 00  64 00 55 00              125.1.32       
                                              61 00 59 00  61 00 5b 00              125.1.40       
                                              66 00 58 00  63 00 55 00              125.1.48       
                                              62 00 58 00  66 00 59 00              125.1.56       
                                              62 00 56 00  62 00 58 00              125.1.64       
                                              62 00 57 00  60 00 54 00              125.1.72       
                                              64 00 58 00  61 00 57 00              125.1.80       
                                              63 00 57 00  65 00 56 00              125.1.88       
                                              62 00 56 00  62 00 56 00              125.1.96       
                                              64 00 56 00  63 00 57 00              125.1.104      
                                              65 00 5a 00  63 00 56 00              125.1.112      
                                              63 00 57 00  65 00 58 00              125.1.120      
                                              64 00 59 00  63 00 57 00              125.1.128      
                                              62 00 55 00  64 00 58 00              125.1.136      
                                              63 00 58 00  62 00 5d 00              125.1.144      
                                              63 00 57 00  65 00 5a 00              125.1.152      
                                              63 00 59 00  62 00 57 00              125.1.160      
                                              60 00 55 00  64 00 55 00              125.1.168      
                                              61 00 55 00  65 00 58 00              125.1.176      
                                              62 00 5a 00  66 00 59 00              125.1.184      
                                              62 00 58 00  62 00 58 00              125.1.192      
  10.2                         524288  IN     5e 00 52 00  5d 00 50 00   12ms       126.1.0        
                                              5c 00 52 00  5e 00 51 00              126.1.8        
                                              5e 00 53 00  5e 00 51 00              126.1.16       
                                              5c 00 53 00  60 00 54 00              126.1.24       
                                              60 00 52 00  5e 00 55 00              126.1.32       
                                              5e 00 52 00  5e 00 52 00              126.1.40       
                                              61 00 54 00  5c 00 51 00              126.1.48       
                                              5c 00 53 00  5e 00 53 00              126.1.56       
                                              5e 00 53 00  5f 00 53 00              126.1.64       
                                              5d 00 53 00  5d 00 51 00              126.1.72       
                                              5d 00 53 00  5d 00 51 00              126.1.80       
                                              5e 00 53 00  5e 00 53 00              126.1.88       
                                              5c 00 51 00  5b 00 52 00              126.1.96       
                                              5e 00 51 00  5e 00 51 00              126.1.104      
                                              5e 00 51 00  60 00 52 00              126.1.112      
                                              5d 00 4f 00  60 00 52 00              126.1.120      
                                              5d 00 51 00  5e 00 52 00              126.1.128      
                                              5e 00 52 00  5f 00 50 00              126.1.136      
                                              5f 00 51 00  5d 00 51 00              126.1.144      
                                              5e 00 52 00  5d 00 51 00              126.1.152      
                                              5d 00 4f 00  5c 00 4f 00              126.1.160      
                                              5e 00 53 00  5f 00 50 00              126.1.168      
                                              5e 00 52 00  5c 00 53 00              126.1.176      
                                              5e 00 51 00  5c 00 52 00              126.1.184      
                                              5d 00 53 00  5e 00 52 00              126.1.192      
  10.2                         524288  IN     57 00 5d 00  51 00 5f 00   13ms       127.1.0        
                                              53 00 5d 00  4d 00 5e 00              127.1.8        
                                              51 00 60 00  52 00 5c 00              127.1.16       
                                              51 00 5e 00  54 00 5c 00              127.1.24       
                                              51 00 60 00  51 00 60 00              127.1.32       
                                              52 00 5b 00  53 00 5f 00              127.1.40       
                                              52 00 60 00  51 00 5c 00              127.1.48       
                                              54 00 60 00  55 00 5f 00              127.1.56       
                                              51 00 5c 00  52 00 60 00              127.1.64       
                                              52 00 5e 00  51 00 5e 00              127.1.72       
                                              4f 00 5c 00  50 00 5d 00              127.1.80       
                                              51 00 5e 00  51 00 5e 00              127.1.88       
                                              52 00 60 00  50 00 5e 00              127.1.96       
                                              53 00 61 00  51 00 5d 00              127.1.104      
                                              53 00 5f 00  51 00 5e 00              127.1.112      
                                              52 00 5e 00  51 00 5e 00              127.1.120      
                                              50 00 5c 00  52 00 5c 00              127.1.128      
                                              53 00 60 00  4f 00 5e 00              127.1.136      
                                              4f 00 60 00  51 00 5f 00              127.1.144      
                                              53 00 5e 00  52 00 5f 00              127.1.152      
                                              51 00 5d 00  52 00 5e 00              127.1.160      
                                              53 00 5e 00  53 00 5e 00              127.1.168      
                                              50 00 5e 00  50 00 5e 00              127.1.176      
                                              51 00 5e 00  52 00 5d 00              127.1.184      
                                              51 00 60 00  51 00 5d 00              127.1.192      
  10.2                         524288  IN     60 00 53 00  5f 00 51 00   12ms       128.1.0        
                                              5d 00 53 00  60 00 51 00              128.1.8        
                                              5f 00 51 00  5e 00 53 00              128.1.16       
                                              5d 00 51 00  5f 00 53 00              128.1.24       
                                              5f 00 53 00  5f 00 51 00              128.1.32       
                                              5f 00 52 00  5f 00 51 00              128.1.40       
                                              5c 00 53 00  5f 00 50 00              128.1.48       
                                              5f 00 52 00  5e 00 51 00              128.1.56       
                                              60 00 52 00  5d 00 54 00              128.1.64       
                                              5e 00 53 00  60 00 52 00              128.1.72       
                                              60 00 52 00  60 00 53 00              128.1.80       
                                              5d 00 51 00  5e 00 51 00              128.1.88       
                                              5e 00 53 00  5e 00 51 00              128.1.96       
                                              5e 00 53 00  5d 00 52 00              128.1.104      
                                              5c 00 52 00  5e 00 52 00              128.1.112      
                                              5d 00 53 00  5f 00 52 00              128.1.120      
                                              5d 00 51 00  60 00 53 00              128.1.128      
                                              5c 00 53 00  5e 00 53 00              128.1.136      
                                              60 00 52 00  5c 00 55 00              128.1.144      
                                              5c 00 51 00  5c 00 51 00              128.1.152      
                                              5e 00 52 00  60 00 52 00              128.1.160      
                                              5e 00 53 00  5f 00 53 00              128.1.168      
                                              5b 00 53 00  5f 00 50 00              128.1.176      
                                              61 00 53 00  5e 00 51 00              128.1.184      
                                              5e 00 51 00  5c 00 53 00              128.1.192      
  10.2                         524288  IN     52 00 60 00  54 00 5f 00   13ms       129.1.0        
                                              51 00 5e 00  53 00 60 00              129.1.8        
                                              54 00 5f 00  53 00 5d 00              129.1.16       
                                              51 00 5f 00  51 00 5f 00              129.1.24       
                                              52 00 5e 00  53 00 60 00              129.1.32       
                                              57 00 5e 00  55 00 5e 00              129.1.40       
                                              53 00 60 00  51 00 5f 00              129.1.48       
                                              53 00 60 00  52 00 5e 00              129.1.56       
                                              53 00 5e 00  53 00 5e 00              129.1.64       
                                              52 00 5e 00  52 00 5e 00              129.1.72       
                                              52 00 5e 00  54 00 62 00              129.1.80       
                                              53 00 60 00  53 00 5f 00              129.1.88       
                                              54 00 5e 00  54 00 60 00              129.1.96       
                                              51 00 5e 00  55 00 60 00              129.1.104      
                                              53 00 60 00  52 00 60 00              129.1.112      
                                              53 00 5e 00  51 00 5d 00              129.1.120      
                                              53 00 60 00  56 00 60 00              129.1.128      
                                              55 00 5f 00  53 00 5f 00              129.1.136      
                                              53 00 60 00  51 00 62 00              129.1.144      
                                              51 00 5f 00  51 00 5c 00              129.1.152      
                                              54 00 60 00  51 00 60 00              129.1.160      
                                              51 00 5e 00  53 00 60 00              129.1.168      
                                              55 00 60 00  52 00 60 00              129.1.176      
                                              51 00 5f 00  52 00 5f 00              129.1.184      
                                              54 00 62 00  53 00 5e 00              129.1.192      
  10.2                             31  IN     1a 00 00 00  01 00 02 00   46us       130.1.0        
                                              31 84 00 01  04 00 6c 0f              130.1.8        
                                              00 00 01 01  04 00 00 00              130.1.16       
                                              00 00 00 55  aa 55 aa                 130.1.24       
  10.2                         524288  IN     60 00 53 00  5e 00 54 00  251ms       131.1.0        
                                              5f 00 57 00  61 00 53 00              131.1.8        
                                              61 00 53 00  60 00 55 00              131.1.16       
                                              60 00 53 00  64 00 57 00              131.1.24       
                                              5e 00 56 00  63 00 57 00              131.1.32       
                                              5f 00 55 00  63 00 58 00              131.1.40       
                                              63 00 59 00  63 00 57 00              131.1.48       
                                              65 00 57 00  65 00 59 00              131.1.56       
                                              64 00 54 00  64 00 58 00              131.1.64       
                                              65 00 55 00  60 00 54 00              131.1.72       
                                              64 00 58 00  61 00 56 00              131.1.80       
                                              63 00 56 00  65 00 58 00              131.1.88       
                                              62 00 55 00  61 00 55 00              131.1.96       
                                              63 00 54 00  61 00 55 00              131.1.104      
                                              62 00 59 00  62 00 57 00              131.1.112      
                                              62 00 57 00  64 00 55 00              131.1.120      
                                              63 00 55 00  62 00 57 00              131.1.128      
                                              63 00 55 00  64 00 57 00              131.1.136      
                                              64 00 5a 00  64 00 5a 00              131.1.144      
                                              62 00 55 00  68 00 5a 00              131.1.152      
                                              66 00 55 00  64 00 55 00              131.1.160      
                                              62 00 53 00  66 00 58 00              131.1.168      
                                              62 00 58 00  64 00 58 00              131.1.176      
                                              63 00 56 00  64 00 58 00              131.1.184      
                                              60 00 57 00  60 00 55 00              131.1.192      
  10.2                         524288  IN     5e 00 51 00  5d 00 4f 00   12ms       132.1.0        
                                              5c 00 51 00  5e 00 52 00              132.1.8        
                                              5d 00 53 00  5f 00 52 00              132.1.16       
                                              5d 00 51 00  5d 00 52 00              132.1.24       
                                              61 00 4f 00  5d 00 51 00              132.1.32       
                                              5d 00 51 00  5c 00 54 00              132.1.40       
                                              5e 00 52 00  5d 00 51 00              132.1.48       
                                              5e 00 51 00  5d 00 51 00              132.1.56       
                                              5d 00 51 00  5e 00 51 00              132.1.64       
                                              5e 00 50 00  5e 00 51 00              132.1.72       
                                              5e 00 53 00  5c 00 4e 00              132.1.80       
                                              5c 00 51 00  5f 00 52 00              132.1.88       
                                              5f 00 4f 00  5e 00 51 00              132.1.96       
                                              5e 00 50 00  5e 00 4f 00              132.1.104      
                                              5d 00 51 00  5d 00 50 00              132.1.112      
                                              5e 00 51 00  5d 00 51 00              132.1.120      
                                              5d 00 50 00  5b 00 54 00              132.1.128      
                                              5f 00 50 00  5e 00 51 00              132.1.136      
                                              5e 00 50 00  5b 00 50 00              132.1.144      
                                              5d 00 4f 00  5c 00 51 00              132.1.152      
                                              60 00 52 00  5e 00 4f 00              132.1.160      
                                              5c 00 53 00  5d 00 53 00              132.1.168      
                                              5e 00 52 00  5d 00 51 00              132.1.176      
                                              5e 00 52 00  5f 00 53 00              132.1.184      
                                              5b 00 4e 00  5e 00 53 00              132.1.192      
  10.2                         524288  IN     54 00 5e 00  52 00 5f 00   12ms       133.1.0        
                                              50 00 5e 00  50 00 5d 00              133.1.8        
                                              51 00 5e 00  51 00 5e 00              133.1.16       
                                              4f 00 60 00  52 00 5e 00              133.1.24       
                                              50 00 5e 00  52 00 5e 00              133.1.32       
                                              51 00 5f 00  52 00 5f 00              133.1.40       
                                              52 00 60 00  53 00 60 00              133.1.48       
                                              55 00 5f 00  51 00 5f 00              133.1.56       
                                              51 00 5e 00  51 00 61 00              133.1.64       
                                              51 00 60 00  53 00 5e 00              133.1.72       
                                              50 00 5e 00  52 00 5e 00              133.1.80       
                                              50 00 5c 00  50 00 60 00              133.1.88       
                                              4f 00 5f 00  52 00 5e 00              133.1.96       
                                              50 00 5e 00  52 00 5d 00              133.1.104      
                                              51 00 5e 00  51 00 60 00              133.1.112      
                                              51 00 5d 00  51 00 5f 00              133.1.120      
                                              53 00 5c 00  51 00 5c 00              133.1.128      
                                              55 00 5e 00  4f 00 5d 00              133.1.136      
                                              50 00 5f 00  51 00 5c 00              133.1.144      
                                              53 00 5c 00  53 00 61 00              133.1.152      
                                              52 00 5d 00  51 00 5f 00              133.1.160      
                                              52 00 5e 00  4f 00 5d 00              133.1.168      
                                              51 00 5d 00  52 00 5d 00              133.1.176      
                                              51 00 5e 00  51 00 5e 00              133.1.184      
                                              51 00 5e 00  51 00 5e 00              133.1.192      
  10.2                         524288  IN     5f 00 53 00  5f 00 50 00   13ms       134.1.0        
                                              5c 00 51 00  60 00 52 00              134.1.8        
                                              60 00 54 00  60 00 50 00              134.1.16       
                                              5f 00 54 00  5f 00 51 00              134.1.24       
                                              5e 00 54 00  61 00 53 00              134.1.32       
                                              5f 00 51 00  60 00 51 00              134.1.40       
                                              5e 00 53 00  60 00 51 00              134.1.48       
                                              5f 00 55 00  5c 00 52 00              134.1.56       
                                              5f 00 52 00  5f 00 54 00              134.1.64       
                                              60 00 54 00  60 00 52 00              134.1.72       
                                              5f 00 54 00  5f 00 50 00              134.1.80       
                                              5c 00 52 00  60 00 51 00              134.1.88       
                                              5e 00 51 00  5f 00 51 00              134.1.96       
                                              5f 00 54 00  5b 00 55 00              134.1.104      
                                              5f 00 52 00  5c 00 55 00              134.1.112      
                                              5f 00 52 00  60 00 50 00              134.1.120      
                                              60 00 52 00  5e 00 54 00              134.1.128      
                                              5e 00 53 00  5b 00 53 00              134.1.136      
                                              60 00 51 00  5f 00 53 00              134.1.144      
                                              5c 00 51 00  5e 00 51 00              134.1.152      
                                              5f 00 53 00  60 00 51 00              134.1.160      
                                              5f 00 51 00  5c 00 51 00              134.1.168      
                                              5e 00 51 00  5d 00 52 00              134.1.176      
                                              5f 00 54 00  5c 00 51 00              134.1.184      
                                              5c 00 53 00  5e 00 51 00              134.1.192      
  10.2                         524288  IN     51 00 5e 00  53 00 5c 00   13ms       135.1.0        
                                              51 00 5e 00  52 00 60 00              135.1.8        
                                              53 00 5d 00  54 00 5e 00              135.1.16       
                                              52 00 5c 00  51 00 5e 00              135.1.24       
                                              51 00 5d 00  53 00 5d 00              135.1.32       
                                              53 00 5d 00  55 00 5f 00              135.1.40       
                                              51 00 5c 00  53 00 5d 00              135.1.48       
                                              51 00 5d 00  53 00 60 00              135.1.56       
                                              51 00 61 00  51 00 5d 00              135.1.64       
                                              53 00 5f 00  53 00 5f 00              135.1.72       
                                              52 00 61 00  53 00 5d 00              135.1.80       
                                              4f 00 60 00  53 00 5e 00              135.1.88       
                                              51 00 5e 00  51 00 5f 00              135.1.96       
                                              53 00 5e 00  51 00 60 00              135.1.104      
                                              53 00 5f 00  53 00 60 00              135.1.112      
                                              51 00 5e 00  53 00 5e 00              135.1.120      
                                              50 00 60 00  51 00 5f 00              135.1.128      
                                              52 00 5f 00  52 00 60 00              135.1.136      
                                              54 00 60 00  52 00 5f 00              135.1.144      
                                              51 00 5e 00  52 00 5e 00              135.1.152      
                                              51 00 5e 00  51 00 5c 00              135.1.160      
                                              51 00 60 00  52 00 62 00              135.1.168      
                                              54 00 5e 00  51 00 5e 00              135.1.176      
                                              53 00 60 00  51 00 5f 00              135.1.184      
                                              53 00 62 00  53 00 5e 00              135.1.192      
  10.2                             31  IN     1a 00 00 00  01 00 02 00   37us       136.1.0        
                                              31 84 00 01  04 00 6d 0f              136.1.8        
                                              00 00 01 01  04 00 00 00              136.1.16       
                                              00 00 00 55  aa 55 aa                 136.1.24       
  10.2                         524288  IN     5e 00 54 00  5e 00 56 00  249ms       137.1.0        
                                              60 00 53 00  63 00 55 00              137.1.8        
                                              60 00 55 00  61 00 55 00              137.1.16       
                                              60 00 53 00  64 00 56 00              137.1.24       
                                              60 00 56 00  60 00 56 00              137.1.32       
                                              60 00 58 00  61 00 59 00              137.1.40       
                                              64 00 59 00  61 00 56 00              137.1.48       
                                              63 00 57 00  66 00 5a 00              137.1.56       
                                              62 00 55 00  64 00 57 00              137.1.64       
                                              64 00 58 00  60 00 56 00              137.1.72       
                                              63 00 59 00  60 00 56 00              137.1.80       
                                              63 00 55 00  64 00 57 00              137.1.88       
                                              60 00 55 00  60 00 57 00              137.1.96       
                                              60 00 56 00  63 00 56 00              137.1.104      
                                              63 00 5a 00  63 00 56 00              137.1.112      
                                              63 00 57 00  64 00 56 00              137.1.120      
                                              63 00 59 00  62 00 52 00              137.1.128      
                                              62 00 56 00  64 00 55 00              137.1.136      
                                              62 00 55 00  64 00 5d 00              137.1.144      
                                              65 00 58 00  64 00 58 00              137.1.152      
                                              63 00 55 00  62 00 58 00              137.1.160      
                                              61 00 54 00  64 00 56 00              137.1.168      
                                              61 00 58 00  62 00 55 00              137.1.176      
                                              63 00 57 00  67 00 57 00              137.1.184      
                                              63 00 56 00  64 00 57 00              137.1.192      
  10.2                         524288  IN     5d 00 53 00  5e 00 51 00   12ms       138.1.0        
                                              5e 00 51 00  5d 00 51 00              138.1.8        
                                              5b 00 52 00  5e 00 50 00              138.1.16       
                                              5c 00 52 00  5f 00 51 00              138.1.24       
                                              60 00 50 00  60 00 51 00              138.1.32       
                                              5e 00 53 00  5e 00 52 00              138.1.40       
                                              5d 00 52 00  5f 00 50 00              138.1.48       
                                              5d 00 50 00  5c 00 52 00              138.1.56       
                                              5d 00 51 00  5c 00 51 00              138.1.64       
                                              5e 00 52 00  5e 00 53 00              138.1.72       
                                              5c 00 52 00  5c 00 4e 00              138.1.80       
                                              5e 00 51 00  5b 00 53 00              138.1.88       
                                              5c 00 51 00  5c 00 53 00              138.1.96       
                                              5f 00 50 00  5c 00 51 00              138.1.104      
                                              5d 00 50 00  5f 00 50 00              138.1.112      
                                              5e 00 51 00  5e 00 52 00              138.1.120      
                                              5c 00 4f 00  5c 00 52 00              138.1.128      
                                              5d 00 50 00  5c 00 51 00              138.1.136      
                                              5e 00 52 00  5d 00 55 00              138.1.144      
                                              5f 00 50 00  5e 00 50 00              138.1.152      
                                              5d 00 4f 00  5b 00 51 00              138.1.160      
                                              5b 00 50 00  5c 00 51 00              138.1.168      
                                              5e 00 4f 00  5e 00 50 00              138.1.176      
                                              5e 00 51 00  5c 00 52 00              138.1.184      
                                              5c 00 52 00  5f 00 53 00              138.1.192      
  10.2                         524288  IN     54 00 5e 00  52 00 5e 00   13ms       139.1.0        
                                              52 00 5d 00  51 00 5f 00              139.1.8        
                                              52 00 5e 00  55 00 5f 00              139.1.16       
                                              4e 00 5f 00  52 00 5f 00              139.1.24       
                                              52 00 5f 00  55 00 5e 00              139.1.32       
                                              51 00 5f 00  53 00 5d 00              139.1.40       
                                              50 00 5d 00  51 00 5f 00              139.1.48       
                                              54 00 5e 00  55 00 5e 00              139.1.56       
                                              53 00 5e 00  52 00 60 00              139.1.64       
                                              52 00 5f 00  51 00 5e 00              139.1.72       
                                              50 00 60 00  53 00 5e 00              139.1.80       
                                              51 00 5c 00  51 00 62 00              139.1.88       
                                              51 00 60 00  51 00 5c 00              139.1.96       
                                              54 00 5e 00  53 00 5e 00              139.1.104      
                                              53 00 5e 00  50 00 5e 00              139.1.112      
                                              53 00 5e 00  52 00 5e 00              139.1.120      
                                              51 00 5d 00  51 00 5f 00              139.1.128      
                                              51 00 5f 00  51 00 5d 00              139.1.136      
                                              53 00 5f 00  50 00 5e 00              139.1.144      
                                              51 00 5c 00  51 00 5c 00              139.1.152      
                                              53 00 5e 00  51 00 5e 00              139.1.160      
                                              53 00 5f 00  53 00 5e 00              139.1.168      
                                              53 00 5d 00  51 00 5e 00              139.1.176      
                                              53 00 5c 00  52 00 60 00              139.1.184      
                                              53 00 5e 00  53 00 60 00              139.1.192      
  10.2                         524288  IN     5e 00 51 00  60 00 53 00   12ms       140.1.0        
                                              5f 00 51 00  5f 00 52 00              140.1.8        
                                              5d 00 52 00  5f 00 52 00              140.1.16       
                                              5d 00 53 00  60 00 52 00              140.1.24       
                                              61 00 54 00  5d 00 53 00              140.1.32       
                                              60 00 52 00  5d 00 54 00              140.1.40       
                                              5e 00 55 00  5d 00 51 00              140.1.48       
                                              5f 00 50 00  5e 00 52 00              140.1.56       
                                              60 00 53 00  60 00 52 00              140.1.64       
                                              5d 00 54 00  60 00 52 00              140.1.72       
                                              61 00 51 00  61 00 52 00              140.1.80       
                                              5d 00 52 00  5e 00 52 00              140.1.88       
                                              5c 00 52 00  5f 00 52 00              140.1.96       
                                              5f 00 52 00  5f 00 52 00              140.1.104      
                                              5e 00 54 00  5f 00 51 00              140.1.112      
                                              5f 00 53 00  5f 00 53 00              140.1.120      
                                              60 00 53 00  5c 00 51 00              140.1.128      
                                              5f 00 52 00  60 00 53 00              140.1.136      
                                              5d 00 52 00  5f 00 52 00              140.1.144      
                                              5d 00 53 00  5e 00 51 00              140.1.152      
                                              5c 00 52 00  60 00 52 00              140.1.160      
                                              5f 00 53 00  5e 00 54 00              140.1.168      
                                              60 00 53 00  5e 00 4f 00              140.1.176      
                                              60 00 53 00  5e 00 55 00              140.1.184      
                                              5e 00 54 00  5e 00 51 00              140.1.192      
  10.2                         524288  IN     51 00 5e 00  52 00 5a 00   12ms       141.1.0        
                                              56 00 5e 00  53 00 5e 00              141.1.8        
                                              52 00 5e 00  51 00 5f 00              141.1.16       
                                              50 00 5e 00  51 00 5c 00              141.1.24       
                                              51 00 5e 00  53 00 5d 00              141.1.32       
                                              54 00 5c 00  55 00 5e 00              141.1.40       
                                              4f 00 5f 00  51 00 5e 00              141.1.48       
                                              50 00 5e 00  51 00 60 00              141.1.56       
                                              51 00 5f 00  53 00 5e 00              141.1.64       
                                              52 00 5e 00  54 00 5e 00              141.1.72       
                                              51 00 5c 00  51 00 5e 00              141.1.80       
                                              54 00 61 00  52 00 5b 00              141.1.88       
                                              51 00 5e 00  52 00 5b 00              141.1.96       
                                              51 00 5e 00  51 00 60 00              141.1.104      
                                              51 00 5f 00  53 00 5d 00              141.1.112      
                                              53 00 5e 00  50 00 5d 00              141.1.120      
                                              52 00 5d 00  51 00 60 00              141.1.128      
                                              53 00 5e 00  51 00 60 00              141.1.136      
                                              51 00 62 00  53 00 5d 00              141.1.144      
                                              51 00 5d 00  50 00 5d 00              141.1.152      
                                              51 00 5e 00  51 00 60 00              141.1.160      
                                              51 00 5e 00  51 00 61 00              141.1.168      
                                              54 00 5e 00  52 00 5b 00              141.1.176      
                                              52 00 5c 00  51 00 5e 00              141.1.184      
                                              51 00 5e 00  52 00 5e 00              141.1.192      
  10.2                             31  IN     1a 00 00 00  01 00 02 00   38us       142.1.0        
                                              31 84 00 01  04 00 6e 0f              142.1.8        
                                              00 00 01 01  04 00 00 00              142.1.16       
                                              00 00 00 55  aa 55 aa                 142.1.24       
  10.2                         524288  IN     62 00 53 00  5e 00 55 00  249ms       143.1.0        
                                              60 00 54 00  62 00 54 00              143.1.8        
                                              62 00 57 00  62 00 57 00              143.1.16       
                                              61 00 53 00  61 00 58 00              143.1.24       
                                              62 00 58 00  61 00 5a 00              143.1.32       
                                              61 00 57 00  62 00 5b 00              143.1.40       
                                              65 00 56 00  5f 00 56 00              143.1.48       
                                              63 00 58 00  65 00 5a 00              143.1.56       
                                              65 00 57 00  66 00 59 00              143.1.64       
                                              65 00 58 00  61 00 55 00              143.1.72       
                                              65 00 57 00  61 00 54 00              143.1.80       
                                              62 00 57 00  65 00 57 00              143.1.88       
                                              64 00 57 00  62 00 56 00              143.1.96       
                                              62 00 56 00  64 00 57 00              143.1.104      
                                              64 00 5a 00  64 00 57 00              143.1.112      
                                              64 00 58 00  64 00 59 00              143.1.120      
                                              62 00 56 00  62 00 56 00              143.1.128      
                                              62 00 57 00  63 00 56 00              143.1.136      
                                              63 00 57 00  60 00 59 00              143.1.144      
                                              64 00 58 00  65 00 5b 00              143.1.152      
                                              65 00 58 00  61 00 56 00              143.1.160      
                                              61 00 54 00  64 00 58 00              143.1.168      
                                              61 00 59 00  62 00 57 00              143.1.176      
                                              62 00 59 00  64 00 5b 00              143.1.184      
                                              61 00 55 00  63 00 57 00              143.1.192      
  10.2                         524288  IN     5e 00 52 00  5c 00 4f 00   12ms       144.1.0        
                                              5b 00 52 00  5c 00 51 00              144.1.8        
                                              5c 00 51 00  5e 00 51 00              144.1.16       
                                              5e 00 50 00  5e 00 52 00              144.1.24       
                                              60 00 53 00  5e 00 51 00              144.1.32       
                                              5e 00 53 00  60 00 51 00              144.1.40       
                                              5e 00 51 00  5e 00 53 00              144.1.48       
                                              5f 00 50 00  5e 00 51 00              144.1.56       
                                              5f 00 51 00  5e 00 51 00              144.1.64       
                                              5c 00 51 00  5e 00 51 00              144.1.72       
                                              5e 00 51 00  5e 00 51 00              144.1.80       
                                              5c 00 52 00  5e 00 52 00              144.1.88       
                                              5e 00 52 00  5b 00 51 00              144.1.96       
                                              5d 00 51 00  5e 00 4f 00              144.1.104      
                                              5d 00 4f 00  5d 00 4f 00              144.1.112      
                                              5f 00 51 00  5e 00 4f 00              144.1.120      
                                              5c 00 51 00  5e 00 51 00              144.1.128      
                                              5e 00 53 00  5f 00 51 00              144.1.136      
                                              5e 00 51 00  5c 00 52 00              144.1.144      
                                              5e 00 50 00  5e 00 4f 00              144.1.152      
                                              5e 00 4f 00  5d 00 51 00              144.1.160      
                                              5c 00 51 00  5f 00 51 00              144.1.168      
                                              5d 00 53 00  5d 00 51 00              144.1.176      
                                              5c 00 50 00  5c 00 53 00              144.1.184      
                                              5c 00 4e 00  60 00 53 00              144.1.192      
  10.2                         524288  IN     54 00 5d 00  52 00 5c 00   12ms       145.1.0        
                                              51 00 60 00  53 00 5f 00              145.1.8        
                                              53 00 5d 00  53 00 5f 00              145.1.16       
                                              53 00 5d 00  51 00 5e 00              145.1.24       
                                              53 00 5f 00  53 00 5f 00              145.1.32       
                                              51 00 5e 00  51 00 5e 00              145.1.40       
                                              53 00 60 00  51 00 5f 00              145.1.48       
                                              52 00 60 00  52 00 5f 00              145.1.56       
                                              52 00 5f 00  50 00 5f 00              145.1.64       
                                              51 00 5f 00  51 00 5e 00              145.1.72       
                                              52 00 5e 00  53 00 5f 00              145.1.80       
                                              51 00 5f 00  53 00 5d 00              145.1.88       
                                              54 00 5e 00  4e 00 5e 00              145.1.96       
                                              51 00 5e 00  50 00 61 00              145.1.104      
                                              52 00 5e 00  50 00 5d 00              145.1.112      
                                              51 00 5e 00  52 00 5e 00              145.1.120      
                                              52 00 5c 00  50 00 60 00              145.1.128      
                                              51 00 60 00  53 00 5b 00              145.1.136      
                                              51 00 60 00  51 00 5f 00              145.1.144      
                                              55 00 5d 00  53 00 5d 00              145.1.152      
                                              53 00 5c 00  52 00 5d 00              145.1.160      
                                              52 00 5e 00  52 00 5d 00              145.1.168      
                                              51 00 5e 00  50 00 5e 00              145.1.176      
                                              51 00 5d 00  51 00 5c 00              145.1.184      
                                              51 00 5f 00  51 00 60 00              145.1.192      
  10.0                                 CTL    80 06 00 01  00 00 12 00  3.5ms       146.1.0        
  10.0                             18  IN     12 01 00 02  00 00 00 40  133us       146.2.0        
                                              48 44 70 56  40 1b 01 02              146.2.8        
                                              00 01                                 146.2.16       
  10.0                                 CTL    80 06 00 03  00 00 02 00   13us       147.1.0        
  10.0                              2  IN     04 03                     152us       147.2.0        
  10.0                                 CTL    80 06 00 03  00 00 04 00   10us       148.1.0        
  10.0                              4  IN     04 03 09 04               161us       148.2.0        
  10.0                                 CTL    80 06 01 03  09 04 02 00   15us       149.1.0        
  10.0                              2  IN     06 03                     169us       149.2.0        
  10.0                                 CTL    80 06 01 03  09 04 06 00   10us       150.1.0        
  10.0                              6  IN     06 03 54 00  33 00        156us       150.2.0        
  10.0                                 CTL    80 06 02 03  09 04 02 00   12us       151.1.0        
  10.0                              2  IN     1a 03                     176us       151.2.0        
  10.0                                 CTL    80 06 02 03  09 04 1a 00    9us       152.1.0        
  10.0                             26  IN     1a 03 52 00  48 00 31 00  180us       152.2.0        
                                              30 00 31 00  35 00 30 00              152.2.8        
                                              30 00 35 00  30 00 32 00              152.2.16       
                                              31 00                                 152.2.24       
  10.0                                 CTL    80 06 00 03  09 04 02 00   11us       153.1.0        
  10.0                              2  IN     04 03                     148us       153.2.0        
  10.0                                 CTL    80 06 00 03  09 04 04 00   22us       154.1.0        
  10.0                              4  IN     04 03 09 04               149us       154.2.0        
  10.0                                 CTL    80 06 02 03  09 04 02 00  563us       155.1.0        
  10.0                              2  IN     1a 03                     189us       155.2.0        
  10.0                                 CTL    80 06 02 03  09 04 1a 00   11us       156.1.0        
  10.0                             26  IN     1a 03 52 00  48 00 31 00  127us       156.2.0        
                                              30 00 31 00  35 00 30 00              156.2.8        
                                              30 00 35 00  30 00 32 00              156.2.16       
                                              31 00                                 156.2.24       
  10.0                                 CTL    80 06 01 03  00 00 20 00  150us       157.1.0        
  10.0                              6  IN     06 03 54 00  33 00        170us       157.2.0        
  10.0                                 CTL    c0 e1 00 00  00 00 04 00   21us       158.1.0        
  10.0                              4  IN     03 0b 00 00               1.6ms       158.2.0        
  10.0                                 CTL    c0 b4 00 00  00 00 01 00   52us       159.1.0(2)     
  10.0                              1  IN     54                        171us       159.2.0        
  10.0                                 CTL    c0 e1 00 00  04 00 40 00  284us       161.1.0        
  10.0                             64  IN     00 00 00 00  01 01 00 00  4.1ms       161.2.0        
                                              0f 44 61 68  65 6e 67 20              161.2.8        
                                              49 6d 61 67  69 6e 67 00              161.2.16       
                                              20 00 00 00  01 01 00 00              161.2.24       
                                              0f 4d 45 52  2d 31 33 30              161.2.32       
                                              2d 33 30 55  4d 2d 4c 00              161.2.40       
                                              80 00 00 00  01 01 00 00              161.2.48       
                                              0d 52 48 31  30 31 35 30              161.2.56       
  10.0                                 CTL    c0 b4 00 00  00 00 01 00   40us       162.1.0        
  10.0                              1  IN     54                        154us       162.2.0        
  10.0                                 CTL    c0 b4 00 00  00 00 01 00   18us       163.1.0        
  10.2                         524288  IN     5f 00 53 00  5d 00 53 00  208us       164.1.0        
                                              5d 00 53 00  5f 00 53 00              164.1.8        
                                              5f 00 54 00  5c 00 53 00              164.1.16       
                                              5d 00 55 00  5e 00 52 00              164.1.24       
                                              60 00 52 00  5e 00 54 00              164.1.32       
                                              5e 00 50 00  5f 00 50 00              164.1.40       
                                              60 00 53 00  5e 00 50 00              164.1.48       
                                              5e 00 54 00  60 00 52 00              164.1.56       
                                              5e 00 52 00  5e 00 53 00              164.1.64       
                                              5e 00 55 00  5f 00 51 00              164.1.72       
                                              60 00 55 00  60 00 52 00              164.1.80       
                                              5e 00 52 00  5f 00 52 00              164.1.88       
                                              5f 00 51 00  5f 00 52 00              164.1.96       
                                              62 00 55 00  5f 00 51 00              164.1.104      
                                              5f 00 54 00  5e 00 53 00              164.1.112      
                                              5d 00 51 00  5e 00 52 00              164.1.120      
                                              5e 00 55 00  62 00 56 00              164.1.128      
                                              5e 00 55 00  5c 00 55 00              164.1.136      
                                              5d 00 52 00  5e 00 52 00              164.1.144      
                                              5d 00 54 00  5e 00 52 00              164.1.152      
                                              5c 00 51 00  5f 00 52 00              164.1.160      
                                              5f 00 53 00  5d 00 53 00              164.1.168      
                                              5f 00 51 00  5e 00 52 00              164.1.176      
                                              60 00 55 00  61 00 54 00              164.1.184      
                                              5e 00 53 00  5e 00 51 00              164.1.192      
  10.0                              1  IN     54                         33us       163.2.0        
  10.0                                 CTL    c0 e1 00 00  44 00 40 00   18us       165.1.0        
  10.0                             64  IN     30 35 30 32  31 00 90 00  4.1ms       165.2.0        
                                              00 00 01 01  00 00 03 36              165.2.8        
                                              37 00 04 01  00 00 01 01              165.2.16       
                                              00 00 0a 31  32 33 34 56              165.2.24       
                                              33 32 30 33  00 14 01 00              165.2.32       
                                              00 01 01 00  00 0e 31 2e              165.2.40       
                                              31 2e 31 33  30 35 2e 39              165.2.48       
                                              33 30 31 00  00 02 00 00              165.2.56       
  10.0                                 CTL    c0 b4 00 00  00 00 01 00   24us       166.1.0(2)     
  10.0                              1  IN     54                        165us       166.2.0        
  10.0                                 CTL    80 06 02 03  00 00 20 00  241us       168.1.0        
  10.0                             26  IN     1a 03 52 00  48 00 31 00  154us       168.2.0        
                                              30 00 31 00  35 00 30 00              168.2.8        
                                              30 00 35 00  30 00 32 00              168.2.16       
                                              31 00                                 168.2.24       
  10.0                                 CTL    80 06 00 01  00 00 12 00  607us       169.1.0        
  10.0                             18  IN     12 01 00 02  00 00 00 40  169us       169.2.0        
                                              48 44 70 56  40 1b 01 02              169.2.8        
                                              00 01                                 169.2.16       
  10.0                                 CTL    80 06 00 03  00 00 02 00   13us       170.1.0        
  10.0                              2  IN     04 03                     153us       170.2.0        
  10.0                                 CTL    80 06 00 03  00 00 04 00    9us       171.1.0        
  10.0                              4  IN     04 03 09 04               144us       171.2.0        
  10.0                                 CTL    80 06 01 03  09 04 02 00    9us       172.1.0        
  10.0                              2  IN     06 03                     168us       172.2.0        
  10.0                                 CTL    80 06 01 03  09 04 06 00   11us       173.1.0        
  10.0                              6  IN     06 03 54 00  33 00        107us       173.2.0        
  10.0                                 CTL    80 06 02 03  09 04 02 00   11us       174.1.0        
  10.0                              2  IN     1a 03                     162us       174.2.0        
  10.0                                 CTL    80 06 02 03  09 04 1a 00   11us       175.1.0        
  10.0                             26  IN     1a 03 52 00  48 00 31 00  124us       175.2.0        
                                              30 00 31 00  35 00 30 00              175.2.8        
                                              30 00 35 00  30 00 32 00              175.2.16       
                                              31 00                                 175.2.24       
  10.0                                 CTL    80 06 00 03  09 04 02 00   10us       176.1.0        
  10.0                              2  IN     04 03                     156us       176.2.0        
  10.0                                 CTL    80 06 00 03  09 04 04 00   11us       177.1.0        
  10.0                              4  IN     04 03 09 04               147us       177.2.0        
  10.0                                 CTL    80 06 02 03  09 04 02 00  628us       178.1.0        
  10.0                              2  IN     1a 03                     130us       178.2.0        
  10.0                                 CTL    80 06 02 03  09 04 1a 00    9us       179.1.0        
  10.0                             26  IN     1a 03 52 00  48 00 31 00  170us       179.2.0        
                                              30 00 31 00  35 00 30 00              179.2.8        
                                              30 00 35 00  30 00 32 00              179.2.16       
                                              31 00                                 179.2.24       
  10.0                                 CTL    80 06 01 03  00 00 20 00  133us       180.1.0        
  10.0                              6  IN     06 03 54 00  33 00        146us       180.2.0        
  10.0                                 CTL    c0 e1 00 00  00 00 04 00   22us       181.1.0        
  10.0                              4  IN     03 0b 00 00               1.6ms       181.2.0        
  10.0                                 CTL    c0 b4 00 00  00 00 01 00   20us       182.1.0(2)     
  10.0                              1  IN     54                        146us       182.2.0        
  10.0                                 CTL    c0 e1 00 00  04 00 40 00  242us       184.1.0        
  10.2                         524288  IN     53 00 5c 00  51 00 5c 00  2.8ms       185.1.0        
                                              51 00 5e 00  53 00 5c 00              185.1.8        
                                              51 00 5f 00  55 00 5f 00              185.1.16       
                                              52 00 5f 00  53 00 60 00              185.1.24       
                                              55 00 60 00  51 00 5e 00              185.1.32       
                                              51 00 5e 00  53 00 5e 00              185.1.40       
                                              51 00 5e 00  52 00 5e 00              185.1.48       
                                              53 00 5f 00  53 00 60 00              185.1.56       
                                              53 00 62 00  53 00 5e 00              185.1.64       
                                              53 00 5e 00  54 00 61 00              185.1.72       
                                              52 00 5d 00  52 00 5f 00              185.1.80       
                                              52 00 60 00  54 00 5e 00              185.1.88       
                                              54 00 60 00  52 00 5f 00              185.1.96       
                                              55 00 5e 00  51 00 5e 00              185.1.104      
                                              53 00 60 00  51 00 5f 00              185.1.112      
                                              53 00 5f 00  52 00 5e 00              185.1.120      
                                              53 00 5e 00  51 00 5e 00              185.1.128      
                                              55 00 5e 00  51 00 5e 00              185.1.136      
                                              53 00 62 00  53 00 5e 00              185.1.144      
                                              54 00 5e 00  51 00 5e 00              185.1.152      
                                              52 00 5e 00  4f 00 5e 00              185.1.160      
                                              4f 00 60 00  4e 00 61 00              185.1.168      
                                              54 00 61 00  51 00 5d 00              185.1.176      
                                              51 00 60 00  51 00 60 00              185.1.184      
                                              54 00 60 00  52 00 60 00              185.1.192      
  10.2                             31  IN     1a 00 00 00  01 00 02 00   33us       186.1.0        
                                              31 84 00 01  04 00 6f 0f              186.1.8        
                                              00 00 01 01  04 00 00 00              186.1.16       
                                              00 00 00 55  aa 55 aa                 186.1.24       
  10.0                             64  IN     00 00 00 00  01 01 00 00  1.1ms       184.2.0        
                                              0f 44 61 68  65 6e 67 20              184.2.8        
                                              49 6d 61 67  69 6e 67 00              184.2.16       
                                              20 00 00 00  01 01 00 00              184.2.24       
                                              0f 4d 45 52  2d 31 33 30              184.2.32       
                                              2d 33 30 55  4d 2d 4c 00              184.2.40       
                                              80 00 00 00  01 01 00 00              184.2.48       
                                              0d 52 48 31  30 31 35 30              184.2.56       
  10.0                                 CTL    c0 b4 00 00  00 00 01 00   37us       187.1.0(2)     
  10.0                              1  IN     54                         81us       187.2.0        
  10.0                                 CTL    c0 e1 00 00  44 00 40 00  102us       189.1.0        
  10.0                             64  IN     30 35 30 32  31 00 90 00  4.0ms       189.2.0        
                                              00 00 01 01  00 00 03 36              189.2.8        
                                              37 00 04 01  00 00 01 01              189.2.16       
                                              00 00 0a 31  32 33 34 56              189.2.24       
                                              33 32 30 33  00 14 01 00              189.2.32       
                                              00 01 01 00  00 0e 31 2e              189.2.40       
                                              31 2e 31 33  30 35 2e 39              189.2.48       
                                              33 30 31 00  00 02 00 00              189.2.56       
  10.0                                 CTL    c0 b4 00 00  00 00 01 00   33us       190.1.0(2)     
  10.0                              1  IN     54                         74us       190.2.0        
  10.0                                 CTL    80 06 02 03  00 00 20 00  107us       192.1.0        
  10.0                             26  IN     1a 03 52 00  48 00 31 00   75us       192.2.0        
                                              30 00 31 00  35 00 30 00              192.2.8        
                                              30 00 35 00  30 00 32 00              192.2.16       
                                              31 00                                 192.2.24       
  10.2                         524288  IN     5e 00 55 00  60 00 56 00  244ms       193.1.0        
                                              60 00 53 00  62 00 55 00              193.1.8        
                                              61 00 54 00  61 00 56 00              193.1.16       
                                              62 00 53 00  62 00 55 00              193.1.24       
                                              60 00 56 00  64 00 54 00              193.1.32       
                                              61 00 57 00  63 00 57 00              193.1.40       
                                              66 00 58 00  62 00 57 00              193.1.48       
                                              62 00 57 00  64 00 58 00              193.1.56       
                                              62 00 56 00  64 00 56 00              193.1.64       
                                              63 00 57 00  60 00 55 00              193.1.72       
                                              62 00 57 00  60 00 57 00              193.1.80       
                                              62 00 55 00  63 00 57 00              193.1.88       
                                              62 00 54 00  63 00 57 00              193.1.96       
                                              62 00 58 00  63 00 57 00              193.1.104      
                                              62 00 59 00  63 00 56 00              193.1.112      
                                              63 00 56 00  66 00 57 00              193.1.120      
                                              64 00 58 00  63 00 55 00              193.1.128      
                                              63 00 56 00  65 00 55 00              193.1.136      
                                              62 00 57 00  65 00 59 00              193.1.144      
                                              63 00 59 00  63 00 57 00              193.1.152      
                                              64 00 58 00  63 00 56 00              193.1.160      
                                              60 00 57 00  65 00 59 00              193.1.168      
                                              61 00 56 00  64 00 55 00              193.1.176      
                                              64 00 59 00  68 00 57 00              193.1.184      
                                              63 00 56 00  62 00 57 00              193.1.192      
  10.2                         524288  IN     5f 00 51 00  5d 00 52 00   13ms       194.1.0        
                                              59 00 51 00  5c 00 51 00              194.1.8        
                                              5d 00 53 00  5f 00 53 00              194.1.16       
                                              5e 00 50 00  5e 00 52 00              194.1.24       
                                              5c 00 51 00  5f 00 51 00              194.1.32       
                                              5b 00 51 00  5c 00 53 00              194.1.40       
                                              5f 00 52 00  5c 00 51 00              194.1.48       
                                              60 00 53 00  5c 00 52 00              194.1.56       
                                              5c 00 53 00  5e 00 51 00              194.1.64       
                                              5f 00 55 00  5e 00 52 00              194.1.72       
                                              5d 00 4f 00  5c 00 53 00              194.1.80       
                                              5c 00 51 00  5d 00 50 00              194.1.88       
                                              5e 00 52 00  5f 00 51 00              194.1.96       
                                              5f 00 54 00  5f 00 4f 00              194.1.104      
                                              60 00 4f 00  5f 00 53 00              194.1.112      
                                              5d 00 51 00  5e 00 51 00              194.1.120      
                                              5c 00 4f 00  5c 00 51 00              194.1.128      
                                              5e 00 53 00  5d 00 52 00              194.1.136      
                                              5e 00 52 00  5b 00 52 00              194.1.144      
                                              5c 00 4f 00  5c 00 51 00              194.1.152      
                                              5b 00 51 00  5d 00 51 00              194.1.160      
                                              5c 00 51 00  5c 00 51 00              194.1.168      
                                              5c 00 51 00  5d 00 51 00              194.1.176      
                                              5e 00 4f 00  5b 00 4f 00              194.1.184      
                                              5b 00 4f 00  5c 00 53 00              194.1.192      
  10.2                         524288  IN     57 00 5e 00  52 00 5d 00   13ms       195.1.0        
                                              50 00 5f 00  52 00 5f 00              195.1.8        
                                              52 00 5c 00  53 00 5f 00              195.1.16       
                                              51 00 5f 00  50 00 5d 00              195.1.24       
                                              51 00 5d 00  52 00 5d 00              195.1.32       
                                              52 00 5f 00  53 00 5d 00              195.1.40       
                                              52 00 5f 00  53 00 5f 00              195.1.48       
                                              53 00 5e 00  53 00 5f 00              195.1.56       
                                              52 00 5f 00  53 00 5e 00              195.1.64       
                                              51 00 60 00  51 00 5e 00              195.1.72       
                                              52 00 5e 00  51 00 5e 00              195.1.80       
                                              52 00 5e 00  53 00 5f 00              195.1.88       
                                              51 00 5f 00  50 00 5f 00              195.1.96       
                                              54 00 5d 00  51 00 60 00              195.1.104      
                                              53 00 5c 00  52 00 60 00              195.1.112      
                                              51 00 5e 00  51 00 5e 00              195.1.120      
                                              54 00 5e 00  52 00 5e 00              195.1.128      
                                              51 00 5c 00  53 00 5d 00              195.1.136      
                                              53 00 5d 00  51 00 5f 00              195.1.144      
                                              52 00 60 00  51 00 5d 00              195.1.152      
                                              51 00 5c 00  51 00 5d 00              195.1.160      
                                              54 00 5e 00  52 00 5f 00              195.1.168      
                                              4f 00 5e 00  51 00 5c 00              195.1.176      
                                              53 00 5d 00  51 00 5d 00              195.1.184      
                                              53 00 5f 00  51 00 5f 00              195.1.192      
  10.2                         524288  IN     60 00 51 00  60 00 54 00   13ms       196.1.0        
                                              5d 00 53 00  5f 00 53 00              196.1.8        
                                              5d 00 51 00  5c 00 53 00              196.1.16       
                                              5c 00 56 00  5f 00 53 00              196.1.24       
                                              60 00 54 00  5f 00 54 00              196.1.32       
                                              5d 00 53 00  60 00 55 00              196.1.40       
                                              5f 00 53 00  5f 00 52 00              196.1.48       
                                              61 00 53 00  5d 00 51 00              196.1.56       
                                              60 00 53 00  5f 00 52 00              196.1.64       
                                              60 00 53 00  5f 00 54 00              196.1.72       
                                              5f 00 54 00  5f 00 53 00              196.1.80       
                                              5f 00 53 00  60 00 53 00              196.1.88       
                                              5d 00 55 00  60 00 53 00              196.1.96       
                                              60 00 53 00  5e 00 51 00              196.1.104      
                                              60 00 51 00  5e 00 55 00              196.1.112      
                                              60 00 51 00  60 00 53 00              196.1.120      
                                              5e 00 55 00  61 00 51 00              196.1.128      
                                              5e 00 53 00  60 00 51 00              196.1.136      
                                              60 00 53 00  60 00 53 00              196.1.144      
                                              5d 00 53 00  5f 00 50 00              196.1.152      
                                              5d 00 52 00  61 00 50 00              196.1.160      
                                              5f 00 51 00  5f 00 52 00              196.1.168      
                                              5b 00 51 00  5c 00 52 00              196.1.176      
                                              5f 00 54 00  5f 00 52 00              196.1.184      
                                              60 00 55 00  5f 00 55 00              196.1.192      
  10.2                         524288  IN     50 00 5c 00  53 00 5d 00   12ms       197.1.0        
                                              52 00 5d 00  52 00 60 00              197.1.8        
                                              51 00 5d 00  51 00 60 00              197.1.16       
                                              52 00 5e 00  52 00 60 00              197.1.24       
                                              51 00 5d 00  52 00 5e 00              197.1.32       
                                              52 00 5e 00  55 00 60 00              197.1.40       
                                              52 00 5b 00  51 00 5f 00              197.1.48       
                                              51 00 5b 00  50 00 5c 00              197.1.56       
                                              51 00 5f 00  53 00 5e 00              197.1.64       
                                              51 00 5e 00  56 00 5d 00              197.1.72       
                                              53 00 5e 00  53 00 5e 00              197.1.80       
                                              54 00 5f 00  52 00 5d 00              197.1.88       
                                              53 00 5e 00  51 00 5d 00              197.1.96       
                                              52 00 5e 00  50 00 61 00              197.1.104      
                                              53 00 5f 00  53 00 5e 00              197.1.112      
                                              53 00 60 00  50 00 5f 00              197.1.120      
                                              52 00 5c 00  53 00 60 00              197.1.128      
                                              55 00 5e 00  51 00 5e 00              197.1.136      
                                              52 00 60 00  52 00 5c 00              197.1.144      
                                              51 00 5f 00  52 00 5c 00              197.1.152      
                                              52 00 5f 00  51 00 5e 00              197.1.160      
                                              52 00 5f 00  51 00 63 00              197.1.168      
                                              53 00 5f 00  52 00 5d 00              197.1.176      
                                              51 00 60 00  51 00 5e 00              197.1.184      
                                              51 00 63 00  51 00 5d 00              197.1.192      
  10.2                             31  IN     1a 00 00 00  01 00 02 00   34us       198.1.0        
                                              31 84 00 01  04 00 70 0f              198.1.8        
                                              00 00 01 01  04 00 00 00              198.1.16       
                                              00 00 00 55  aa 55 aa                 198.1.24       
  10.2                         524288  IN     60 00 55 00  5d 00 55 00  250ms       199.1.0        
                                              61 00 55 00  61 00 55 00              199.1.8        
                                              61 00 55 00  61 00 54 00              199.1.16       
                                              60 00 55 00  63 00 57 00              199.1.24       
                                              62 00 59 00  62 00 54 00              199.1.32       
                                              61 00 57 00  62 00 5a 00              199.1.40       
                                              64 00 57 00  5f 00 55 00              199.1.48       
                                              64 00 57 00  61 00 59 00              199.1.56       
                                              64 00 56 00  64 00 56 00              199.1.64       
                                              64 00 58 00  60 00 55 00              199.1.72       
                                              64 00 57 00  61 00 57 00              199.1.80       
                                              64 00 59 00  64 00 57 00              199.1.88       
                                              61 00 55 00  61 00 55 00              199.1.96       
                                              64 00 57 00  63 00 55 00              199.1.104      
                                              62 00 57 00  63 00 59 00              199.1.112      
                                              61 00 55 00  62 00 57 00              199.1.120      
                                              64 00 59 00  62 00 55 00              199.1.128      
                                              62 00 57 00  62 00 58 00              199.1.136      
                                              63 00 57 00  63 00 5b 00              199.1.144      
                                              64 00 56 00  65 00 57 00              199.1.152      
                                              65 00 58 00  60 00 55 00              199.1.160      
                                              60 00 55 00  65 00 57 00              199.1.168      
                                              62 00 55 00  62 00 56 00              199.1.176      
                                              64 00 57 00  64 00 59 00              199.1.184      
                                              63 00 56 00  63 00 57 00              199.1.192      
  10.2                         524288  IN     5e 00 52 00  5f 00 51 00   12ms       200.1.0        
                                              5d 00 51 00  5d 00 51 00              200.1.8        
                                              5e 00 53 00  5e 00 51 00              200.1.16       
                                              5d 00 51 00  5e 00 53 00              200.1.24       
                                              5e 00 52 00  5c 00 53 00              200.1.32       
                                              5f 00 53 00  5e 00 51 00              200.1.40       
                                              5e 00 53 00  5e 00 53 00              200.1.48       
                                              5f 00 50 00  5d 00 51 00              200.1.56       
                                              5e 00 53 00  5c 00 51 00              200.1.64       
                                              5f 00 52 00  5c 00 51 00              200.1.72       
                                              5d 00 52 00  5e 00 53 00              200.1.80       
                                              5d 00 50 00  5c 00 53 00              200.1.88       
                                              5f 00 53 00  5f 00 53 00              200.1.96       
                                              5e 00 51 00  5f 00 52 00              200.1.104      
                                              5e 00 4f 00  5e 00 51 00              200.1.112      
                                              5e 00 50 00  5e 00 51 00              200.1.120      
                                              5e 00 51 00  60 00 51 00              200.1.128      
                                              5c 00 51 00  5c 00 4f 00              200.1.136      
                                              5e 00 4f 00  5d 00 52 00              200.1.144      
                                              5d 00 51 00  5e 00 51 00              200.1.152      
                                              5d 00 51 00  5f 00 51 00              200.1.160      
                                              5c 00 4f 00  5c 00 51 00              200.1.168      
                                              5c 00 52 00  5b 00 50 00              200.1.176      
                                              5d 00 52 00  5b 00 50 00              200.1.184      
                                              5c 00 4e 00  5c 00 53 00              200.1.192      
  10.2                         524288  IN     56 00 5e 00  50 00 5e 00   13ms       201.1.0        
                                              55 00 5c 00  51 00 5d 00              201.1.8        
                                              51 00 60 00  52 00 5e 00              201.1.16       
                                              4f 00 5d 00  52 00 5e 00              201.1.24       
                                              52 00 5c 00  53 00 5f 00              201.1.32       
                                              50 00 5e 00  51 00 5e 00              201.1.40       
                                              4f 00 5e 00  51 00 5e 00              201.1.48       
                                              53 00 60 00  52 00 5e 00              201.1.56       
                                              51 00 5e 00  50 00 5f 00              201.1.64       
                                              51 00 5f 00  52 00 5f 00              201.1.72       
                                              52 00 5f 00  52 00 5e 00              201.1.80       
                                              51 00 5e 00  51 00 5e 00              201.1.88       
                                              4f 00 60 00  51 00 5e 00              201.1.96       
                                              55 00 5f 00  52 00 5f 00              201.1.104      
                                              53 00 5e 00  53 00 5e 00              201.1.112      
                                              53 00 5e 00  53 00 5e 00              201.1.120      
                                              53 00 5f 00  52 00 60 00              201.1.128      
                                              51 00 5e 00  53 00 5c 00              201.1.136      
                                              51 00 60 00  51 00 5f 00              201.1.144      
                                              51 00 5d 00  52 00 5f 00              201.1.152      
                                              52 00 5d 00  4f 00 5b 00              201.1.160      
                                              54 00 5e 00  52 00 5e 00              201.1.168      
                                              53 00 5e 00  51 00 5f 00              201.1.176      
                                              51 00 5f 00  51 00 5e 00              201.1.184      
                                              53 00 5d 00  54 00 5f 00              201.1.192      
  10.2                         524288  IN     5c 00 52 00  5e 00 50 00   12ms       202.1.0        
                                              60 00 53 00  60 00 53 00              202.1.8        
                                              5f 00 53 00  5e 00 51 00              202.1.16       
                                              5c 00 53 00  5f 00 52 00              202.1.24       
                                              5c 00 54 00  5d 00 52 00              202.1.32       
                                              60 00 51 00  5e 00 51 00              202.1.40       
                                              5f 00 53 00  5c 00 51 00              202.1.48       
                                              5f 00 52 00  5d 00 51 00              202.1.56       
                                              5e 00 53 00  5c 00 51 00              202.1.64       
                                              5e 00 55 00  5e 00 53 00              202.1.72       
                                              60 00 55 00  60 00 51 00              202.1.80       
                                              5e 00 52 00  5e 00 53 00              202.1.88       
                                              5c 00 52 00  5e 00 4f 00              202.1.96       
                                              5e 00 56 00  5d 00 53 00              202.1.104      
                                              5e 00 53 00  5e 00 50 00              202.1.112      
                                              5c 00 52 00  5f 00 52 00              202.1.120      
                                              5d 00 53 00  5e 00 52 00              202.1.128      
                                              60 00 53 00  5d 00 53 00              202.1.136      
                                              5b 00 4f 00  5d 00 53 00              202.1.144      
                                              5d 00 51 00  60 00 53 00              202.1.152      
                                              5e 00 56 00  5e 00 4f 00              202.1.160      
                                              5f 00 51 00  5d 00 53 00              202.1.168      
                                              5e 00 50 00  5f 00 52 00              202.1.176      
                                              5f 00 53 00  5e 00 52 00              202.1.184      
                                              5e 00 52 00  5c 00 50 00              202.1.192      
  10.2                         524288  IN     50 00 5f 00  51 00 5e 00   13ms       203.1.0        
                                              51 00 5f 00  53 00 60 00              203.1.8        
                                              53 00 5d 00  50 00 5f 00              203.1.16       
                                              53 00 61 00  52 00 5e 00              203.1.24       
                                              53 00 5e 00  54 00 5e 00              203.1.32       
                                              51 00 5b 00  51 00 5f 00              203.1.40       
                                              52 00 60 00  4e 00 60 00              203.1.48       
                                              51 00 5e 00  52 00 5d 00              203.1.56       
                                              52 00 5e 00  53 00 5c 00              203.1.64       
                                              54 00 5e 00  53 00 60 00              203.1.72       
                                              51 00 5c 00  52 00 5f 00              203.1.80       
                                              53 00 5d 00  53 00 60 00              203.1.88       
                                              53 00 5e 00  53 00 5e 00              203.1.96       
                                              52 00 60 00  51 00 5f 00              203.1.104      
                                              55 00 5f 00  53 00 5d 00              203.1.112      
                                              51 00 60 00  53 00 61 00              203.1.120      
                                              54 00 5f 00  53 00 5f 00              203.1.128      
                                              53 00 5e 00  53 00 5f 00              203.1.136      
                                              54 00 61 00  51 00 60 00              203.1.144      
                                              53 00 5f 00  51 00 5d 00              203.1.152      
                                              52 00 5e 00  52 00 60 00              203.1.160      
                                              53 00 60 00  53 00 60 00              203.1.168      
                                              55 00 5c 00  52 00 5c 00              203.1.176      
                                              52 00 5c 00  53 00 60 00              203.1.184      
                                              52 00 60 00  51 00 5f 00              203.1.192      
  10.2                             31  IN     1a 00 00 00  01 00 02 00   39us       204.1.0        
                                              31 84 00 01  04 00 71 0f              204.1.8        
                                              00 00 01 01  04 00 00 00              204.1.16       
                                              00 00 00 55  aa 55 aa                 204.1.24       
  10.2                         524288  IN     61 00 53 00  5f 00 55 00  249ms       205.1.0        
                                              61 00 55 00  60 00 56 00              205.1.8        
                                              66 00 56 00  60 00 55 00              205.1.16       
                                              61 00 53 00  62 00 56 00              205.1.24       
                                              60 00 56 00  60 00 56 00              205.1.32       
                                              60 00 57 00  62 00 57 00              205.1.40       
                                              66 00 58 00  62 00 54 00              205.1.48       
                                              62 00 56 00  62 00 59 00              205.1.56       
                                              66 00 56 00  62 00 59 00              205.1.64       
                                              66 00 55 00  60 00 57 00              205.1.72       
                                              64 00 58 00  5d 00 57 00              205.1.80       
                                              63 00 57 00  64 00 57 00              205.1.88       
                                              60 00 53 00  62 00 55 00              205.1.96       
                                              61 00 57 00  62 00 54 00              205.1.104      
                                              62 00 58 00  64 00 58 00              205.1.112      
                                              60 00 57 00  64 00 57 00              205.1.120      
                                              64 00 57 00  61 00 52 00              205.1.128      
                                              60 00 58 00  63 00 59 00              205.1.136      
                                              62 00 57 00  63 00 5b 00              205.1.144      
                                              63 00 57 00  65 00 59 00              205.1.152      
                                              62 00 57 00  63 00 56 00              205.1.160      
                                              61 00 54 00  63 00 57 00              205.1.168      
                                              61 00 56 00  65 00 57 00              205.1.176      
                                              60 00 58 00  64 00 57 00              205.1.184      
                                              63 00 56 00  61 00 58 00              205.1.192      
  10.2                         524288  IN     5f 00 51 00  5d 00 52 00   13ms       206.1.0        
                                              5b 00 51 00  5d 00 4f 00              206.1.8        
                                              5d 00 53 00  5f 00 52 00              206.1.16       
                                              5c 00 53 00  5c 00 50 00              206.1.24       
                                              5e 00 51 00  5d 00 53 00              206.1.32       
                                              5f 00 50 00  5f 00 51 00              206.1.40       
                                              5e 00 53 00  5c 00 51 00              206.1.48       
                                              5e 00 52 00  5d 00 51 00              206.1.56       
                                              5d 00 51 00  5d 00 51 00              206.1.64       
                                              5e 00 53 00  5c 00 51 00              206.1.72       
                                              5c 00 51 00  5f 00 53 00              206.1.80       
                                              5c 00 53 00  5c 00 52 00              206.1.88       
                                              5d 00 52 00  5e 00 53 00              206.1.96       
                                              5b 00 51 00  5d 00 4f 00              206.1.104      
                                              5d 00 50 00  5e 00 51 00              206.1.112      
                                              5c 00 51 00  5d 00 52 00              206.1.120      
                                              5f 00 50 00  5c 00 51 00              206.1.128      
                                              5f 00 53 00  5e 00 51 00              206.1.136      
                                              5c 00 4f 00  5c 00 53 00              206.1.144      
                                              5d 00 51 00  5d 00 52 00              206.1.152      
                                              5e 00 52 00  5e 00 50 00              206.1.160      
                                              5d 00 51 00  5c 00 53 00              206.1.168      
                                              5a 00 52 00  5d 00 51 00              206.1.176      
                                              5c 00 51 00  5c 00 51 00              206.1.184      
                                              5c 00 51 00  5e 00 52 00              206.1.192      
  10.2                         524288  IN     57 00 5c 00  53 00 5e 00   12ms       207.1.0        
                                              51 00 60 00  51 00 60 00              207.1.8        
                                              53 00 60 00  50 00 5c 00              207.1.16       
                                              53 00 5f 00  53 00 5d 00              207.1.24       
                                              52 00 5d 00  53 00 61 00              207.1.32       
                                              52 00 5e 00  52 00 5e 00              207.1.40       
                                              53 00 5f 00  53 00 62 00              207.1.48       
                                              55 00 5d 00  53 00 5d 00              207.1.56       
                                              53 00 5e 00  51 00 5e 00              207.1.64       
                                              53 00 60 00  51 00 5e 00              207.1.72       
                                              53 00 60 00  53 00 5e 00              207.1.80       
                                              50 00 5e 00  51 00 61 00              207.1.88       
                                              52 00 5f 00  50 00 5e 00              207.1.96       
                                              55 00 5f 00  50 00 5b 00              207.1.104      
                                              53 00 60 00  52 00 5c 00              207.1.112      
                                              53 00 5f 00  52 00 5e 00              207.1.120      
                                              52 00 5d 00  52 00 61 00              207.1.128      
                                              53 00 60 00  52 00 60 00              207.1.136      
                                              52 00 5e 00  53 00 5e 00              207.1.144      
                                              53 00 5f 00  55 00 5f 00              207.1.152      
                                              53 00 5e 00  51 00 5e 00              207.1.160      
                                              51 00 60 00  51 00 60 00              207.1.168      
                                              53 00 5e 00  52 00 5f 00              207.1.176      
                                              51 00 5f 00  52 00 5d 00              207.1.184      
                                              51 00 5e 00  53 00 5e 00              207.1.192      
  10.2                         524288  IN     5e 00 54 00  60 00 53 00   13ms       208.1.0        
                                              5d 00 53 00  61 00 53 00              208.1.8        
                                              5d 00 53 00  62 00 55 00              208.1.16       
                                              5e 00 55 00  60 00 52 00              208.1.24       
                                              5e 00 51 00  5e 00 53 00              208.1.32       
                                              60 00 51 00  5f 00 51 00              208.1.40       
                                              5c 00 53 00  5f 00 52 00              208.1.48       
                                              5f 00 53 00  5e 00 52 00              208.1.56       
                                              60 00 55 00  60 00 51 00              208.1.64       
                                              60 00 54 00  60 00 51 00              208.1.72       
                                              5c 00 55 00  5f 00 53 00              208.1.80       
                                              5e 00 53 00  60 00 54 00              208.1.88       
                                              5e 00 54 00  60 00 51 00              208.1.96       
                                              60 00 53 00  5f 00 52 00              208.1.104      
                                              5e 00 54 00  5c 00 52 00              208.1.112      
                                              5f 00 55 00  5f 00 52 00              208.1.120      
                                              5e 00 51 00  62 00 52 00              208.1.128      
                                              5d 00 54 00  5e 00 53 00              208.1.136      
                                              5e 00 53 00  5e 00 54 00              208.1.144      
                                              5c 00 52 00  5e 00 53 00              208.1.152      
                                              5f 00 52 00  5c 00 52 00              208.1.160      
                                              60 00 53 00  5d 00 52 00              208.1.168      
                                              5f 00 51 00  5f 00 50 00              208.1.176      
                                              60 00 54 00  5e 00 52 00              208.1.184      
                                              5f 00 52 00  5e 00 51 00              208.1.192      
  10.2                         524288  IN     51 00 5d 00  53 00 5d 00   13ms       209.1.0        
                                              51 00 5e 00  51 00 5d 00              209.1.8        
                                              52 00 5e 00  52 00 5e 00              209.1.16       
                                              53 00 5d 00  51 00 5d 00              209.1.24       
                                              53 00 5e 00  52 00 5c 00              209.1.32       
                                              53 00 5d 00  51 00 5f 00              209.1.40       
                                              50 00 5e 00  52 00 5e 00              209.1.48       
                                              53 00 5e 00  52 00 60 00              209.1.56       
                                              50 00 5c 00  51 00 5e 00              209.1.64       
                                              4f 00 5e 00  51 00 5f 00              209.1.72       
                                              51 00 5d 00  53 00 5e 00              209.1.80       
                                              53 00 5d 00  51 00 5c 00              209.1.88       
                                              54 00 5f 00  51 00 5c 00              209.1.96       
                                              51 00 5e 00  51 00 5f 00              209.1.104      
                                              53 00 5e 00  53 00 5c 00              209.1.112      
                                              51 00 5d 00  51 00 5e 00              209.1.120      
                                              51 00 5e 00  53 00 5e 00              209.1.128      
                                              54 00 5c 00  51 00 5f 00              209.1.136      
                                              52 00 60 00  51 00 60 00              209.1.144      
                                              52 00 61 00  53 00 5e 00              209.1.152      
                                              4f 00 5f 00  4f 00 5e 00              209.1.160      
                                              50 00 60 00  53 00 60 00              209.1.168      
                                              53 00 5e 00  4f 00 5d 00              209.1.176      
                                              51 00 5d 00  50 00 5e 00              209.1.184      
                                              52 00 60 00  4f 00 5d 00              209.1.192      
  10.2                             31  IN     1a 00 00 00  01 00 02 00   40us       210.1.0        
                                              31 84 00 01  04 00 72 0f              210.1.8        
                                              00 00 01 01  04 00 00 00              210.1.16       
                                              00 00 00 55  aa 55 aa                 210.1.24       
