Bus Hound 6.00 capture on Windows Vista (x64). Complements of www.perisoft.net

  Device - Device ID (followed by the endpoint for USB devices)
            (6) USB Root Hub (USB 3.0)
            (8) USB Mass Storage Device
            (10) USB2.0 Digital Camera
            (11) USB Composite Device
            (15) Generic Flash Disk [ROM=8.07]
            (20) EarPods
            (21) USB Input Device
            (22) USB Input Device
            (28) HID-compliant consumer control device
            (29) HID-compliant vendor-defined device
            (31) HID Keyboard Device
            (32) HID-compliant consumer control device
            (33) HID-compliant system controller
            (34) HID-compliant vendor-defined device
            (35) HID-compliant vendor-defined device
            (37) HID Keyboard Device
            (38) HID-compliant mouse
            (39) HID-compliant mouse
  Address - FireWire async address or channel number
  Length - Total transfer length
  Phase  - Phase Type
            ASTS  ATA task file status       NTSTS NTSTATUS value
            ATA   ATA task file command      OUT   Data out transfer
            BRB   Bluetooth request block    RESET bus reset
            CMD   SCSI/ATAPI command         SENSE SCSI sense data
            CTL   USB control transfer       SSTS  SCSI request block status
            IN    Data in transfer           USTS  USB status
            ISOC  Isochronous transfer       ok    command complete
            LOCK  FireWire lock transaction
  Data   - Hex dump of the data transferred
  Delta  - Elapsed time from the previous phase to the current phase
  Cmd... - Position in the captured data


Device  Address              Length    Phase  Data                      Delta  Cmd.Phase.Ofs(rep)
------  -------------------  --------  -----  ------------------------  -----  ------------------
  10.2                         524288  IN     61 00 54 00  61 00 56 00   58ms         1.1.0        
                                              60 00 53 00  63 00 55 00                1.1.8        
                                              64 00 54 00  64 00 56 00                1.1.16       
                                              62 00 53 00  64 00 58 00                1.1.24       
                                              5e 00 54 00  60 00 56 00                1.1.32       
                                              60 00 55 00  60 00 59 00                1.1.40       
                                              66 00 56 00  61 00 55 00                1.1.48       
                                              62 00 56 00  64 00 59 00                1.1.56       
                                              63 00 54 00  62 00 57 00                1.1.64       
                                              66 00 56 00  63 00 56 00                1.1.72       
                                              63 00 57 00  60 00 56 00                1.1.80       
                                              64 00 56 00  64 00 58 00                1.1.88       
                                              62 00 55 00  60 00 57 00                1.1.96       
                                              60 00 58 00  63 00 57 00                1.1.104      
                                              63 00 5a 00  63 00 57 00                1.1.112      
                                              64 00 57 00  62 00 58 00                1.1.120      
                                              64 00 57 00  63 00 56 00                1.1.128      
                                              61 00 57 00  64 00 56 00                1.1.136      
                                              62 00 57 00  64 00 58 00                1.1.144      
                                              66 00 57 00  65 00 5a 00                1.1.152      
                                              64 00 57 00  64 00 55 00                1.1.160      
                                              62 00 54 00  64 00 59 00                1.1.168      
                                              62 00 56 00  65 00 57 00                1.1.176      
                                              61 00 57 00  64 00 58 00                1.1.184      
                                              63 00 54 00  66 00 57 00                1.1.192      
  10.2                         524288  IN     60 00 51 00  60 00 51 00   12ms         2.1.0        
                                              5c 00 53 00  5f 00 51 00                2.1.8        
                                              60 00 52 00  60 00 51 00                2.1.16       
                                              5e 00 52 00  5e 00 54 00                2.1.24       
                                              5d 00 52 00  5f 00 51 00                2.1.32       
                                              5f 00 51 00  5c 00 53 00                2.1.40       
                                              5e 00 51 00  5d 00 51 00                2.1.48       
                                              5e 00 53 00  5c 00 51 00                2.1.56       
                                              5a 00 51 00  60 00 51 00                2.1.64       
                                              5c 00 51 00  5e 00 52 00                2.1.72       
                                              5e 00 53 00  5e 00 50 00                2.1.80       
                                              5d 00 51 00  5f 00 52 00                2.1.88       
                                              5b 00 51 00  5d 00 52 00                2.1.96       
                                              5e 00 51 00  5c 00 50 00                2.1.104      
                                              5b 00 50 00  5e 00 52 00                2.1.112      
                                              5c 00 51 00  5f 00 51 00                2.1.120      
                                              5e 00 50 00  5d 00 51 00                2.1.128      
                                              5d 00 51 00  5e 00 51 00                2.1.136      
                                              5e 00 50 00  5e 00 52 00                2.1.144      
                                              5d 00 51 00  5e 00 51 00                2.1.152      
                                              5e 00 51 00  5e 00 51 00                2.1.160      
                                              5c 00 54 00  5c 00 52 00                2.1.168      
                                              5c 00 51 00  5d 00 51 00                2.1.176      
                                              5d 00 53 00  5c 00 52 00                2.1.184      
                                              5b 00 4f 00  5d 00 51 00                2.1.192      
  10.2                         524288  IN     55 00 5e 00  54 00 5d 00   13ms         3.1.0        
                                              53 00 5e 00  50 00 60 00                3.1.8        
                                              50 00 5c 00  53 00 62 00                3.1.16       
                                              52 00 5f 00  54 00 5c 00                3.1.24       
                                              4f 00 5e 00  4f 00 5d 00                3.1.32       
                                              51 00 5e 00  53 00 5e 00                3.1.40       
                                              4f 00 5e 00  4f 00 60 00                3.1.48       
                                              52 00 62 00  52 00 60 00                3.1.56       
                                              51 00 5f 00  52 00 60 00                3.1.64       
                                              52 00 5f 00  52 00 5e 00                3.1.72       
                                              53 00 5d 00  53 00 5d 00                3.1.80       
                                              52 00 5d 00  53 00 5e 00                3.1.88       
                                              51 00 5e 00  51 00 5e 00                3.1.96       
                                              53 00 5e 00  51 00 5f 00                3.1.104      
                                              53 00 60 00  51 00 5e 00                3.1.112      
                                              51 00 5d 00  51 00 5d 00                3.1.120      
                                              55 00 5e 00  52 00 5d 00                3.1.128      
                                              51 00 5f 00  50 00 5e 00                3.1.136      
                                              51 00 5e 00  51 00 5e 00                3.1.144      
                                              53 00 5f 00  53 00 5d 00                3.1.152      
                                              51 00 5e 00  51 00 5c 00                3.1.160      
                                              53 00 5b 00  52 00 60 00                3.1.168      
                                              51 00 5e 00  53 00 5f 00                3.1.176      
                                              53 00 5c 00  50 00 5d 00                3.1.184      
                                              51 00 5e 00  54 00 5c 00                3.1.192      
  10.2                         524288  IN     5d 00 52 00  5f 00 51 00   13ms         4.1.0        
                                              5f 00 52 00  5f 00 53 00                4.1.8        
                                              60 00 51 00  5d 00 53 00                4.1.16       
                                              5d 00 53 00  5d 00 51 00                4.1.24       
                                              5e 00 53 00  5f 00 4f 00                4.1.32       
                                              5e 00 52 00  5e 00 51 00                4.1.40       
                                              5e 00 53 00  5d 00 51 00                4.1.48       
                                              5e 00 53 00  5f 00 4f 00                4.1.56       
                                              60 00 52 00  5f 00 51 00                4.1.64       
                                              60 00 55 00  5f 00 52 00                4.1.72       
                                              5b 00 4f 00  5f 00 52 00                4.1.80       
                                              5c 00 53 00  5c 00 53 00                4.1.88       
                                              5d 00 53 00  5f 00 53 00                4.1.96       
                                              60 00 55 00  5e 00 50 00                4.1.104      
                                              5f 00 52 00  5d 00 52 00                4.1.112      
                                              5f 00 51 00  5d 00 52 00                4.1.120      
                                              5d 00 52 00  61 00 52 00                4.1.128      
                                              5c 00 54 00  60 00 53 00                4.1.136      
                                              5e 00 51 00  5e 00 50 00                4.1.144      
                                              5e 00 51 00  5c 00 53 00                4.1.152      
                                              5f 00 52 00  5f 00 51 00                4.1.160      
                                              5e 00 51 00  5f 00 53 00                4.1.168      
                                              5e 00 51 00  5e 00 53 00                4.1.176      
                                              5e 00 54 00  5e 00 53 00                4.1.184      
                                              5e 00 53 00  5e 00 52 00                4.1.192      
  10.2                         524288  IN     51 00 5e 00  51 00 60 00   13ms         5.1.0        
                                              53 00 5f 00  51 00 5e 00                5.1.8        
                                              53 00 5e 00  51 00 5f 00                5.1.16       
                                              51 00 5e 00  51 00 5d 00                5.1.24       
                                              51 00 5e 00  53 00 5f 00                5.1.32       
                                              53 00 5f 00  54 00 5f 00                5.1.40       
                                              51 00 5d 00  51 00 62 00                5.1.48       
                                              52 00 5e 00  52 00 5f 00                5.1.56       
                                              52 00 60 00  54 00 5f 00                5.1.64       
                                              53 00 5e 00  53 00 5e 00                5.1.72       
                                              52 00 5e 00  51 00 60 00                5.1.80       
                                              51 00 5e 00  52 00 5f 00                5.1.88       
                                              53 00 5f 00  53 00 5f 00                5.1.96       
                                              52 00 5f 00  53 00 60 00                5.1.104      
                                              52 00 5e 00  51 00 5e 00                5.1.112      
                                              54 00 60 00  54 00 60 00                5.1.120      
                                              52 00 60 00  52 00 5e 00                5.1.128      
                                              53 00 5e 00  51 00 5e 00                5.1.136      
                                              55 00 60 00  52 00 60 00                5.1.144      
                                              51 00 5e 00  52 00 5f 00                5.1.152      
                                              52 00 5d 00  50 00 5f 00                5.1.160      
                                              53 00 5e 00  52 00 62 00                5.1.168      
                                              53 00 60 00  53 00 60 00                5.1.176      
                                              51 00 60 00  53 00 60 00                5.1.184      
                                              51 00 63 00  53 00 61 00                5.1.192      
  10.2                             31  IN     1a 00 00 00  01 00 02 00   34us         6.1.0        
                                              31 84 00 01  04 00 88 1e                6.1.8        
                                              00 00 01 01  04 00 00 00                6.1.16       
                                              00 00 00 55  aa 55 aa                   6.1.24       
  10.2                         524288  IN     60 00 54 00  60 00 54 00  249ms         7.1.0        
                                              62 00 55 00  62 00 55 00                7.1.8        
                                              63 00 56 00  61 00 57 00                7.1.16       
                                              61 00 55 00  62 00 55 00                7.1.24       
                                              60 00 56 00  62 00 55 00                7.1.32       
                                              60 00 55 00  64 00 58 00                7.1.40       
                                              65 00 58 00  62 00 55 00                7.1.48       
                                              62 00 59 00  64 00 59 00                7.1.56       
                                              62 00 53 00  62 00 56 00                7.1.64       
                                              64 00 55 00  61 00 56 00                7.1.72       
                                              64 00 57 00  63 00 55 00                7.1.80       
                                              63 00 59 00  62 00 59 00                7.1.88       
                                              61 00 55 00  63 00 55 00                7.1.96       
                                              62 00 57 00  62 00 55 00                7.1.104      
                                              64 00 59 00  62 00 55 00                7.1.112      
                                              64 00 56 00  65 00 57 00                7.1.120      
                                              64 00 57 00  64 00 56 00                7.1.128      
                                              60 00 57 00  62 00 57 00                7.1.136      
                                              62 00 57 00  62 00 5b 00                7.1.144      
                                              65 00 57 00  64 00 59 00                7.1.152      
                                              64 00 55 00  63 00 55 00                7.1.160      
                                              61 00 54 00  66 00 57 00                7.1.168      
                                              63 00 57 00  66 00 57 00                7.1.176      
                                              63 00 59 00  67 00 58 00                7.1.184      
                                              63 00 57 00  64 00 59 00                7.1.192      
  10.2                         524288  IN     5e 00 51 00  5e 00 52 00   12ms         8.1.0        
                                              5e 00 52 00  60 00 52 00                8.1.8        
                                              5f 00 55 00  5f 00 52 00                8.1.16       
                                              60 00 53 00  61 00 53 00                8.1.24       
                                              60 00 51 00  5f 00 50 00                8.1.32       
                                              60 00 53 00  5e 00 51 00                8.1.40       
                                              5e 00 51 00  5f 00 52 00                8.1.48       
                                              61 00 52 00  5e 00 51 00                8.1.56       
                                              60 00 54 00  5e 00 53 00                8.1.64       
                                              5f 00 54 00  5d 00 51 00                8.1.72       
                                              5e 00 52 00  5e 00 53 00                8.1.80       
                                              5f 00 51 00  60 00 52 00                8.1.88       
                                              5f 00 51 00  5c 00 53 00                8.1.96       
                                              60 00 54 00  5f 00 54 00                8.1.104      
                                              5f 00 51 00  5f 00 54 00                8.1.112      
                                              5e 00 51 00  5e 00 51 00                8.1.120      
                                              5e 00 53 00  5e 00 53 00                8.1.128      
                                              60 00 51 00  5f 00 51 00                8.1.136      
                                              5c 00 4f 00  5f 00 53 00                8.1.144      
                                              5f 00 50 00  5d 00 51 00                8.1.152      
                                              5d 00 50 00  61 00 53 00                8.1.160      
                                              5f 00 51 00  5f 00 53 00                8.1.168      
                                              5e 00 52 00  5d 00 55 00                8.1.176      
                                              5e 00 53 00  5e 00 53 00                8.1.184      
                                              5c 00 4f 00  5c 00 51 00                8.1.192      
  10.2                         524288  IN     55 00 60 00  52 00 5f 00   13ms         9.1.0        
                                              51 00 5d 00  51 00 5f 00                9.1.8        
                                              51 00 60 00  52 00 5e 00                9.1.16       
                                              51 00 5f 00  50 00 5d 00                9.1.24       
                                              51 00 5e 00  52 00 60 00                9.1.32       
                                              4f 00 5e 00  51 00 60 00                9.1.40       
                                              53 00 60 00  52 00 5e 00                9.1.48       
                                              50 00 60 00  50 00 5e 00                9.1.56       
                                              51 00 5c 00  51 00 62 00                9.1.64       
                                              51 00 5f 00  51 00 5c 00                9.1.72       
                                              51 00 5f 00  51 00 5f 00                9.1.80       
                                              50 00 5f 00  4f 00 60 00                9.1.88       
                                              4f 00 5f 00  4e 00 5c 00                9.1.96       
                                              51 00 5f 00  51 00 5e 00                9.1.104      
                                              52 00 5f 00  52 00 5f 00                9.1.112      
                                              4f 00 5d 00  51 00 5e 00                9.1.120      
                                              4f 00 5f 00  51 00 5c 00                9.1.128      
                                              51 00 60 00  51 00 5f 00                9.1.136      
                                              50 00 5e 00  50 00 5e 00                9.1.144      
                                              53 00 5e 00  54 00 5d 00                9.1.152      
                                              53 00 5e 00  51 00 5f 00                9.1.160      
                                              51 00 5b 00  52 00 5f 00                9.1.168      
                                              52 00 5e 00  51 00 5f 00                9.1.176      
                                              51 00 5c 00  51 00 5e 00                9.1.184      
                                              51 00 5f 00  52 00 5e 00                9.1.192      
  10.2                         524288  IN     5c 00 52 00  5e 00 50 00   13ms        10.1.0        
                                              5e 00 51 00  5e 00 54 00               10.1.8        
                                              5d 00 53 00  5d 00 51 00               10.1.16       
                                              5e 00 51 00  5f 00 52 00               10.1.24       
                                              60 00 54 00  5f 00 51 00               10.1.32       
                                              5e 00 53 00  5f 00 4f 00               10.1.40       
                                              5d 00 53 00  5e 00 50 00               10.1.48       
                                              5c 00 51 00  5c 00 51 00               10.1.56       
                                              5f 00 51 00  5e 00 55 00               10.1.64       
                                              5f 00 53 00  5f 00 53 00               10.1.72       
                                              5f 00 53 00  60 00 51 00               10.1.80       
                                              5e 00 53 00  5c 00 51 00               10.1.88       
                                              5c 00 52 00  5f 00 50 00               10.1.96       
                                              5e 00 53 00  60 00 51 00               10.1.104      
                                              5e 00 51 00  5f 00 51 00               10.1.112      
                                              5f 00 53 00  5f 00 51 00               10.1.120      
                                              5e 00 54 00  5f 00 52 00               10.1.128      
                                              5c 00 52 00  5d 00 52 00               10.1.136      
                                              5b 00 52 00  60 00 51 00               10.1.144      
                                              5c 00 51 00  5c 00 53 00               10.1.152      
                                              5e 00 51 00  5f 00 51 00               10.1.160      
                                              5e 00 51 00  5e 00 53 00               10.1.168      
                                              5d 00 51 00  5f 00 52 00               10.1.176      
                                              60 00 51 00  5e 00 55 00               10.1.184      
                                              5c 00 51 00  5d 00 51 00               10.1.192      
  10.2                         524288  IN     53 00 5e 00  52 00 5d 00   13ms        11.1.0        
                                              51 00 5f 00  54 00 5d 00               11.1.8        
                                              52 00 5e 00  50 00 60 00               11.1.16       
                                              51 00 5f 00  53 00 5d 00               11.1.24       
                                              52 00 60 00  53 00 5f 00               11.1.32       
                                              52 00 5f 00  53 00 5f 00               11.1.40       
                                              52 00 5e 00  52 00 5f 00               11.1.48       
                                              51 00 5c 00  51 00 5f 00               11.1.56       
                                              51 00 5d 00  54 00 5c 00               11.1.64       
                                              53 00 5d 00  53 00 5f 00               11.1.72       
                                              53 00 5e 00  53 00 5e 00               11.1.80       
                                              53 00 60 00  53 00 5f 00               11.1.88       
                                              53 00 5d 00  53 00 5e 00               11.1.96       
                                              52 00 5e 00  4f 00 61 00               11.1.104      
                                              52 00 5d 00  53 00 5c 00               11.1.112      
                                              54 00 60 00  4f 00 5f 00               11.1.120      
                                              54 00 5e 00  52 00 5e 00               11.1.128      
                                              55 00 5e 00  51 00 5f 00               11.1.136      
                                              55 00 60 00  51 00 5e 00               11.1.144      
                                              53 00 5d 00  53 00 5d 00               11.1.152      
                                              52 00 5d 00  51 00 60 00               11.1.160      
                                              50 00 60 00  52 00 61 00               11.1.168      
                                              55 00 60 00  52 00 60 00               11.1.176      
                                              51 00 5e 00  53 00 5d 00               11.1.184      
                                              53 00 62 00  53 00 60 00               11.1.192      
  10.2                             31  IN     1a 00 00 00  01 00 02 00   34us        12.1.0        
                                              31 84 00 01  04 00 89 1e               12.1.8        
                                              00 00 01 01  04 00 00 00               12.1.16       
                                              00 00 00 55  aa 55 aa                  12.1.24       
  10.2                         524288  IN     5f 00 54 00  5f 00 55 00  250ms        13.1.0        
                                              62 00 58 00  60 00 56 00               13.1.8        
                                              62 00 56 00  60 00 58 00               13.1.16       
                                              60 00 54 00  66 00 55 00               13.1.24       
                                              61 00 59 00  62 00 55 00               13.1.32       
                                              63 00 57 00  62 00 59 00               13.1.40       
                                              68 00 5c 00  62 00 57 00               13.1.48       
                                              64 00 57 00  66 00 5a 00               13.1.56       
                                              63 00 54 00  63 00 57 00               13.1.64       
                                              64 00 59 00  62 00 58 00               13.1.72       
                                              64 00 5a 00  60 00 58 00               13.1.80       
                                              64 00 55 00  65 00 58 00               13.1.88       
                                              62 00 55 00  62 00 55 00               13.1.96       
                                              64 00 58 00  62 00 53 00               13.1.104      
                                              64 00 5c 00  64 00 54 00               13.1.112      
                                              61 00 56 00  64 00 57 00               13.1.120      
                                              63 00 58 00  63 00 55 00               13.1.128      
                                              63 00 54 00  62 00 59 00               13.1.136      
                                              64 00 58 00  64 00 59 00               13.1.144      
                                              64 00 59 00  65 00 59 00               13.1.152      
                                              63 00 57 00  63 00 55 00               13.1.160      
                                              62 00 53 00  64 00 59 00               13.1.168      
                                              64 00 57 00  67 00 56 00               13.1.176      
                                              63 00 58 00  68 00 59 00               13.1.184      
                                              63 00 57 00  62 00 58 00               13.1.192      
  10.2                         524288  IN     5e 00 51 00  5f 00 51 00   14ms        14.1.0        
                                              5e 00 53 00  5f 00 53 00               14.1.8        
                                              5c 00 53 00  60 00 51 00               14.1.16       
                                              5d 00 51 00  5e 00 50 00               14.1.24       
                                              5e 00 51 00  5e 00 52 00               14.1.32       
                                              5d 00 51 00  5f 00 51 00               14.1.40       
                                              5d 00 53 00  5d 00 50 00               14.1.48       
                                              60 00 51 00  60 00 52 00               14.1.56       
                                              5f 00 52 00  5e 00 51 00               14.1.64       
                                              5d 00 53 00  5f 00 51 00               14.1.72       
                                              5d 00 53 00  5d 00 54 00               14.1.80       
                                              5e 00 53 00  5c 00 4f 00               14.1.88       
                                              5c 00 51 00  5c 00 52 00               14.1.96       
                                              5e 00 51 00  5e 00 4f 00               14.1.104      
                                              5d 00 51 00  5f 00 51 00               14.1.112      
                                              5d 00 53 00  5d 00 51 00               14.1.120      
                                              5e 00 50 00  5e 00 4f 00               14.1.128      
                                              5c 00 51 00  5c 00 4f 00               14.1.136      
                                              5f 00 4e 00  5e 00 52 00               14.1.144      
                                              5d 00 4f 00  5f 00 51 00               14.1.152      
                                              5e 00 50 00  5c 00 51 00               14.1.160      
                                              5f 00 51 00  5c 00 53 00               14.1.168      
                                              5c 00 52 00  5e 00 51 00               14.1.176      
                                              5e 00 53 00  5b 00 50 00               14.1.184      
                                              5c 00 50 00  5e 00 52 00               14.1.192      
  10.2                         524288  IN     51 00 5e 00  53 00 60 00   11ms        15.1.0        
                                              51 00 5c 00  51 00 5f 00               15.1.8        
                                              4f 00 5f 00  53 00 5f 00               15.1.16       
                                              51 00 5d 00  51 00 5e 00               15.1.24       
                                              4f 00 5e 00  52 00 62 00               15.1.32       
                                              50 00 5e 00  52 00 5f 00               15.1.40       
                                              52 00 61 00  53 00 60 00               15.1.48       
                                              53 00 5d 00  53 00 5c 00               15.1.56       
                                              51 00 5e 00  54 00 5f 00               15.1.64       
                                              51 00 5f 00  50 00 5d 00               15.1.72       
                                              51 00 60 00  51 00 5b 00               15.1.80       
                                              52 00 5e 00  50 00 61 00               15.1.88       
                                              53 00 5f 00  51 00 60 00               15.1.96       
                                              52 00 60 00  52 00 5e 00               15.1.104      
                                              52 00 5c 00  53 00 5d 00               15.1.112      
                                              53 00 5e 00  52 00 5e 00               15.1.120      
                                              50 00 5c 00  53 00 5f 00               15.1.128      
                                              52 00 5e 00  52 00 5d 00               15.1.136      
                                              50 00 5f 00  51 00 5d 00               15.1.144      
                                              51 00 60 00  52 00 60 00               15.1.152      
                                              51 00 5f 00  50 00 5e 00               15.1.160      
                                              53 00 5c 00  4f 00 5f 00               15.1.168      
                                              51 00 5f 00  50 00 5f 00               15.1.176      
                                              52 00 5f 00  51 00 5e 00               15.1.184      
                                              52 00 5e 00  51 00 5f 00               15.1.192      
  10.2                         524288  IN     5c 00 52 00  5f 00 53 00   14ms        16.1.0        
                                              5e 00 51 00  60 00 52 00               16.1.8        
                                              5e 00 53 00  5e 00 52 00               16.1.16       
                                              5e 00 53 00  5e 00 54 00               16.1.24       
                                              5f 00 54 00  60 00 53 00               16.1.32       
                                              60 00 50 00  5e 00 51 00               16.1.40       
                                              5f 00 51 00  5c 00 51 00               16.1.48       
                                              5f 00 53 00  5e 00 51 00               16.1.56       
                                              5b 00 53 00  5e 00 52 00               16.1.64       
                                              60 00 52 00  5f 00 53 00               16.1.72       
                                              5d 00 51 00  60 00 51 00               16.1.80       
                                              5e 00 51 00  5c 00 52 00               16.1.88       
                                              5e 00 52 00  5e 00 51 00               16.1.96       
                                              62 00 53 00  5e 00 52 00               16.1.104      
                                              5f 00 54 00  60 00 53 00               16.1.112      
                                              5e 00 52 00  5e 00 53 00               16.1.120      
                                              5e 00 53 00  61 00 53 00               16.1.128      
                                              5d 00 55 00  5f 00 53 00               16.1.136      
                                              5e 00 51 00  5e 00 53 00               16.1.144      
                                              5e 00 53 00  5c 00 52 00               16.1.152      
                                              5f 00 52 00  5f 00 52 00               16.1.160      
                                              5e 00 52 00  60 00 52 00               16.1.168      
                                              5e 00 51 00  5d 00 52 00               16.1.176      
                                              5f 00 54 00  5e 00 51 00               16.1.184      
                                              5e 00 51 00  5c 00 51 00               16.1.192      
  10.2                         524288  IN     52 00 5e 00  52 00 5f 00   11ms        17.1.0        
                                              52 00 60 00  51 00 5c 00               17.1.8        
                                              54 00 60 00  55 00 60 00               17.1.16       
                                              52 00 5e 00  53 00 60 00               17.1.24       
                                              52 00 5d 00  53 00 5f 00               17.1.32       
                                              56 00 5e 00  52 00 60 00               17.1.40       
                                              52 00 5d 00  51 00 60 00               17.1.48       
                                              51 00 5e 00  52 00 5e 00               17.1.56       
                                              51 00 5c 00  55 00 5e 00               17.1.64       
                                              51 00 5d 00  52 00 5e 00               17.1.72       
                                              52 00 5e 00  52 00 5e 00               17.1.80       
                                              53 00 61 00  53 00 5f 00               17.1.88       
                                              51 00 60 00  52 00 60 00               17.1.96       
                                              52 00 5f 00  52 00 60 00               17.1.104      
                                              53 00 5e 00  51 00 5e 00               17.1.112      
                                              53 00 5d 00  52 00 5c 00               17.1.120      
                                              53 00 5f 00  52 00 5f 00               17.1.128      
                                              53 00 5e 00  51 00 5e 00               17.1.136      
                                              54 00 60 00  53 00 5f 00               17.1.144      
                                              53 00 5e 00  52 00 5c 00               17.1.152      
                                              52 00 5e 00  50 00 5e 00               17.1.160      
                                              53 00 5e 00  51 00 60 00               17.1.168      
                                              55 00 5f 00  53 00 5e 00               17.1.176      
                                              51 00 60 00  51 00 5e 00               17.1.184      
                                              54 00 64 00  51 00 5f 00               17.1.192      
  10.2                             31  IN     1a 00 00 00  01 00 02 00   37us        18.1.0        
                                              31 84 00 01  04 00 8a 1e               18.1.8        
                                              00 00 01 01  04 00 00 00               18.1.16       
                                              00 00 00 55  aa 55 aa                  18.1.24       
  10.0                                 CTL    80 06 00 01  00 00 12 00   65ms        19.1.0        
  10.0                             18  IN     12 01 00 02  00 00 00 40   79us        19.2.0        
                                              48 44 70 56  40 1b 01 02               19.2.8        
                                              00 01                                  19.2.16       
  10.0                                 CTL    80 06 00 03  00 00 02 00   14us        20.1.0        
  10.0                              2  IN     04 03                      44us        20.2.0        
  10.0                                 CTL    80 06 00 03  00 00 04 00    9us        21.1.0        
  10.0                              4  IN     04 03 09 04                43us        21.2.0        
  10.0                                 CTL    80 06 01 03  09 04 02 00    9us        22.1.0        
  10.0                              2  IN     06 03                      65us        22.2.0        
  10.0                                 CTL    80 06 01 03  09 04 06 00   12us        23.1.0        
  10.0                              6  IN     06 03 54 00  33 00         65us        23.2.0        
  10.0                                 CTL    80 06 02 03  09 04 02 00    9us        24.1.0        
  10.0                              2  IN     1a 03                      65us        24.2.0        
  10.0                                 CTL    80 06 02 03  09 04 1a 00    9us        25.1.0        
  10.0                             26  IN     1a 03 52 00  48 00 31 00   65us        25.2.0        
                                              30 00 31 00  35 00 30 00               25.2.8        
                                              30 00 35 00  30 00 32 00               25.2.16       
                                              31 00                                  25.2.24       
  10.0                                 CTL    80 06 00 03  09 04 02 00   23us        26.1.0        
  10.0                              2  IN     04 03                      61us        26.2.0        
  10.0                                 CTL    80 06 00 03  09 04 04 00   21us        27.1.0        
  10.0                              4  IN     04 03 09 04                64us        27.2.0        
  10.0                                 CTL    80 06 02 03  09 04 02 00  2.3ms        28.1.0        
  10.0                              2  IN     1a 03                      73us        28.2.0        
  10.0                                 CTL    80 06 02 03  09 04 1a 00   16us        29.1.0        
  10.0                             26  IN     1a 03 52 00  48 00 31 00   85us        29.2.0        
                                              30 00 31 00  35 00 30 00               29.2.8        
                                              30 00 35 00  30 00 32 00               29.2.16       
                                              31 00                                  29.2.24       
  10.0                                 CTL    80 06 01 03  00 00 20 00  211us        30.1.0        
  10.0                              6  IN     06 03 54 00  33 00         83us        30.2.0        
  10.0                                 CTL    c0 e1 00 00  00 00 04 00   24us        31.1.0        
  10.0                              4  IN     03 0b 00 00               6.2ms        31.2.0        
  10.0                                 CTL    c0 b4 00 00  00 00 01 00  1.6ms        32.1.0(2)     
  10.0                              1  IN     54                         81us        32.2.0        
  10.0                                 CTL    c0 e1 00 00  04 00 40 00  161us        34.1.0        
  10.0                             64  IN     00 00 00 00  01 01 00 00  5.4ms        34.2.0        
                                              0f 44 61 68  65 6e 67 20               34.2.8        
                                              49 6d 61 67  69 6e 67 00               34.2.16       
                                              20 00 00 00  01 01 00 00               34.2.24       
                                              0f 4d 45 52  2d 31 33 30               34.2.32       
                                              2d 33 30 55  4d 2d 4c 00               34.2.40       
                                              80 00 00 00  01 01 00 00               34.2.48       
                                              0d 52 48 31  30 31 35 30               34.2.56       
  10.0                                 CTL    c0 b4 00 00  00 00 01 00   40us        35.1.0(2)     
  10.0                              1  IN     54                         78us        35.2.0        
  10.0                                 CTL    c0 e1 00 00  44 00 40 00  103us        37.1.0        
  10.0                             64  IN     30 35 30 32  31 00 90 00  5.5ms        37.2.0        
                                              00 00 01 01  00 00 03 36               37.2.8        
                                              37 00 04 01  00 00 01 01               37.2.16       
                                              00 00 0a 31  32 33 34 56               37.2.24       
                                              33 32 30 33  00 14 01 00               37.2.32       
                                              00 01 01 00  00 0e 31 2e               37.2.40       
                                              31 2e 31 33  30 35 2e 39               37.2.48       
                                              33 30 31 00  00 02 00 00               37.2.56       
  10.0                                 CTL    c0 b4 00 00  00 00 01 00   62us        38.1.0(2)     
  10.0                              1  IN     54                         85us        38.2.0        
  10.0                                 CTL    80 06 02 03  00 00 20 00  159us        40.1.0        
  10.0                             26  IN     1a 03 52 00  48 00 31 00   77us        40.2.0        
                                              30 00 31 00  35 00 30 00               40.2.8        
                                              30 00 35 00  30 00 32 00               40.2.16       
                                              31 00                                  40.2.24       
  10.0                                 CTL    80 06 00 01  00 00 12 00  933us        41.1.0        
  10.0                             18  IN     12 01 00 02  00 00 00 40   59us        41.2.0        
                                              48 44 70 56  40 1b 01 02               41.2.8        
                                              00 01                                  41.2.16       
  10.0                                 CTL    80 06 00 03  00 00 02 00   19us        42.1.0        
  10.0                              2  IN     04 03                      88us        42.2.0        
  10.0                                 CTL    80 06 00 03  00 00 04 00   10us        43.1.0        
  10.0                              4  IN     04 03 09 04                53us        43.2.0        
  10.0                                 CTL    80 06 01 03  09 04 02 00    9us        44.1.0        
  10.0                              2  IN     06 03                      78us        44.2.0        
  10.0                                 CTL    80 06 01 03  09 04 06 00   19us        45.1.0        
  10.0                              6  IN     06 03 54 00  33 00         85us        45.2.0        
  10.0                                 CTL    80 06 02 03  09 04 02 00   11us        46.1.0        
  10.0                              2  IN     1a 03                      66us        46.2.0        
  10.0                                 CTL    80 06 02 03  09 04 1a 00   12us        47.1.0        
  10.0                             26  IN     1a 03 52 00  48 00 31 00   65us        47.2.0        
                                              30 00 31 00  35 00 30 00               47.2.8        
                                              30 00 35 00  30 00 32 00               47.2.16       
                                              31 00                                  47.2.24       
  10.0                                 CTL    80 06 00 03  09 04 02 00   10us        48.1.0        
  10.0                              2  IN     04 03                      43us        48.2.0        
  10.0                                 CTL    80 06 00 03  09 04 04 00    9us        49.1.0        
  10.0                              4  IN     04 03 09 04                66us        49.2.0        
  10.0                                 CTL    80 06 02 03  09 04 02 00  607us        50.1.0        
  10.0                              2  IN     1a 03                      71us        50.2.0        
  10.0                                 CTL    80 06 02 03  09 04 1a 00   13us        51.1.0        
  10.0                             26  IN     1a 03 52 00  48 00 31 00  1.9ms        51.2.0        
                                              30 00 31 00  35 00 30 00               51.2.8        
                                              30 00 35 00  30 00 32 00               51.2.16       
                                              31 00                                  51.2.24       
  10.0                                 CTL    80 06 01 03  00 00 20 00  171us        52.1.0        
  10.0                              6  IN     06 03 54 00  33 00         57us        52.2.0        
  10.0                                 CTL    c0 e1 00 00  00 00 04 00   42us        53.1.0        
  10.0                              4  IN     03 0b 00 00               1.6ms        53.2.0        
  10.0                                 CTL    c0 b4 00 00  00 00 01 00   29us        54.1.0(2)     
  10.0                              1  IN     54                         77us        54.2.0        
  10.0                                 CTL    c0 e1 00 00  04 00 40 00  106us        56.1.0        
  10.0                             64  IN     00 00 00 00  01 01 00 00  4.0ms        56.2.0        
                                              0f 44 61 68  65 6e 67 20               56.2.8        
                                              49 6d 61 67  69 6e 67 00               56.2.16       
                                              20 00 00 00  01 01 00 00               56.2.24       
                                              0f 4d 45 52  2d 31 33 30               56.2.32       
                                              2d 33 30 55  4d 2d 4c 00               56.2.40       
                                              80 00 00 00  01 01 00 00               56.2.48       
                                              0d 52 48 31  30 31 35 30               56.2.56       
  10.0                                 CTL    c0 b4 00 00  00 00 01 00   39us        57.1.0(2)     
  10.0                              1  IN     54                         85us        57.2.0        
  10.0                                 CTL    c0 e1 00 00  44 00 40 00  123us        59.1.0        
  10.0                             64  IN     30 35 30 32  31 00 90 00  4.0ms        59.2.0        
                                              00 00 01 01  00 00 03 36               59.2.8        
                                              37 00 04 01  00 00 01 01               59.2.16       
                                              00 00 0a 31  32 33 34 56               59.2.24       
                                              33 32 30 33  00 14 01 00               59.2.32       
                                              00 01 01 00  00 0e 31 2e               59.2.40       
                                              31 2e 31 33  30 35 2e 39               59.2.48       
                                              33 30 31 00  00 02 00 00               59.2.56       
  10.0                                 CTL    c0 b4 00 00  00 00 01 00   25us        60.1.0(2)     
  10.0                              1  IN     54                         73us        60.2.0        
  10.0                                 CTL    80 06 02 03  00 00 20 00  147us        62.1.0        
  10.0                             26  IN     1a 03 52 00  48 00 31 00   72us        62.2.0        
                                              30 00 31 00  35 00 30 00               62.2.8        
                                              30 00 35 00  30 00 32 00               62.2.16       
                                              31 00                                  62.2.24       
  10.2                         524288  IN     60 00 57 00  60 00 54 00  146ms        63.1.0        
                                              63 00 56 00  62 00 53 00               63.1.8        
                                              63 00 57 00  63 00 57 00               63.1.16       
                                              62 00 55 00  64 00 54 00               63.1.24       
                                              60 00 57 00  62 00 56 00               63.1.32       
                                              62 00 58 00  63 00 59 00               63.1.40       
                                              64 00 56 00  63 00 58 00               63.1.48       
                                              61 00 57 00  66 00 59 00               63.1.56       
                                              63 00 55 00  63 00 57 00               63.1.64       
                                              65 00 59 00  60 00 57 00               63.1.72       
                                              63 00 55 00  62 00 58 00               63.1.80       
                                              62 00 57 00  64 00 59 00               63.1.88       
                                              61 00 53 00  62 00 59 00               63.1.96       
                                              64 00 58 00  66 00 57 00               63.1.104      
                                              64 00 5a 00  64 00 58 00               63.1.112      
                                              62 00 58 00  64 00 59 00               63.1.120      
                                              63 00 59 00  64 00 55 00               63.1.128      
                                              63 00 57 00  63 00 57 00               63.1.136      
                                              64 00 57 00  63 00 58 00               63.1.144      
                                              66 00 58 00  64 00 5b 00               63.1.152      
                                              67 00 58 00  62 00 56 00               63.1.160      
                                              60 00 55 00  66 00 57 00               63.1.168      
                                              60 00 58 00  66 00 58 00               63.1.176      
                                              63 00 5a 00  66 00 58 00               63.1.184      
                                              61 00 56 00  62 00 56 00               63.1.192      
  10.2                         524288  IN     5d 00 52 00  5d 00 51 00   12ms        64.1.0        
                                              5a 00 52 00  5e 00 50 00               64.1.8        
                                              5e 00 51 00  5d 00 4f 00               64.1.16       
                                              5e 00 51 00  5e 00 53 00               64.1.24       
                                              60 00 51 00  5c 00 52 00               64.1.32       
                                              5d 00 50 00  5f 00 51 00               64.1.40       
                                              5f 00 53 00  5e 00 51 00               64.1.48       
                                              60 00 51 00  5c 00 51 00               64.1.56       
                                              60 00 54 00  5f 00 51 00               64.1.64       
                                              5f 00 51 00  5d 00 51 00               64.1.72       
                                              5f 00 51 00  5d 00 52 00               64.1.80       
                                              5d 00 51 00  5e 00 50 00               64.1.88       
                                              5e 00 51 00  5e 00 51 00               64.1.96       
                                              5d 00 52 00  5c 00 50 00               64.1.104      
                                              5e 00 4f 00  5e 00 51 00               64.1.112      
                                              5e 00 52 00  5d 00 53 00               64.1.120      
                                              5c 00 50 00  5c 00 50 00               64.1.128      
                                              5f 00 51 00  60 00 54 00               64.1.136      
                                              60 00 4f 00  5f 00 54 00               64.1.144      
                                              5c 00 4f 00  5f 00 51 00               64.1.152      
                                              5e 00 4f 00  5d 00 4f 00               64.1.160      
                                              5c 00 51 00  5c 00 51 00               64.1.168      
                                              5e 00 52 00  5c 00 50 00               64.1.176      
                                              5c 00 50 00  5b 00 51 00               64.1.184      
                                              5d 00 50 00  5d 00 53 00               64.1.192      
  10.2                         524288  IN     55 00 5d 00  53 00 5d 00   13ms        65.1.0        
                                              51 00 5e 00  50 00 60 00               65.1.8        
                                              51 00 5f 00  51 00 5e 00               65.1.16       
                                              4e 00 5e 00  53 00 5e 00               65.1.24       
                                              50 00 5f 00  52 00 5f 00               65.1.32       
                                              50 00 5f 00  51 00 5f 00               65.1.40       
                                              52 00 5e 00  53 00 5e 00               65.1.48       
                                              53 00 62 00  52 00 5a 00               65.1.56       
                                              53 00 5e 00  53 00 60 00               65.1.64       
                                              51 00 60 00  52 00 5f 00               65.1.72       
                                              51 00 5d 00  53 00 5c 00               65.1.80       
                                              51 00 5e 00  51 00 5f 00               65.1.88       
                                              51 00 5f 00  53 00 5d 00               65.1.96       
                                              50 00 5f 00  53 00 5c 00               65.1.104      
                                              53 00 5f 00  50 00 5c 00               65.1.112      
                                              51 00 60 00  4f 00 5e 00               65.1.120      
                                              52 00 5e 00  51 00 5f 00               65.1.128      
                                              51 00 61 00  53 00 5c 00               65.1.136      
                                              51 00 5f 00  51 00 5c 00               65.1.144      
                                              51 00 5e 00  51 00 5e 00               65.1.152      
                                              52 00 5e 00  4f 00 5c 00               65.1.160      
                                              52 00 5c 00  51 00 5e 00               65.1.168      
                                              51 00 5d 00  4f 00 5d 00               65.1.176      
                                              51 00 5d 00  50 00 5e 00               65.1.184      
                                              54 00 60 00  52 00 5d 00               65.1.192      
  10.2                         524288  IN     5e 00 53 00  5e 00 53 00   13ms        66.1.0        
                                              5f 00 53 00  5e 00 52 00               66.1.8        
                                              60 00 53 00  5f 00 51 00               66.1.16       
                                              5c 00 52 00  5d 00 54 00               66.1.24       
                                              5d 00 55 00  61 00 53 00               66.1.32       
                                              5f 00 51 00  5b 00 52 00               66.1.40       
                                              5f 00 52 00  5c 00 52 00               66.1.48       
                                              5c 00 52 00  62 00 53 00               66.1.56       
                                              60 00 54 00  61 00 53 00               66.1.64       
                                              5e 00 54 00  61 00 53 00               66.1.72       
                                              5d 00 53 00  5c 00 53 00               66.1.80       
                                              5c 00 53 00  5d 00 52 00               66.1.88       
                                              5d 00 53 00  5d 00 53 00               66.1.96       
                                              5d 00 51 00  5f 00 53 00               66.1.104      
                                              5e 00 53 00  5e 00 52 00               66.1.112      
                                              60 00 52 00  5e 00 51 00               66.1.120      
                                              5e 00 53 00  61 00 55 00               66.1.128      
                                              60 00 52 00  5d 00 54 00               66.1.136      
                                              5e 00 51 00  60 00 51 00               66.1.144      
                                              5e 00 52 00  5e 00 53 00               66.1.152      
                                              5e 00 52 00  5c 00 51 00               66.1.160      
                                              5e 00 4f 00  60 00 53 00               66.1.168      
                                              60 00 52 00  5f 00 52 00               66.1.176      
                                              61 00 50 00  5e 00 52 00               66.1.184      
                                              5e 00 53 00  62 00 52 00               66.1.192      
  10.2                         524288  IN     52 00 5e 00  51 00 5e 00   14ms        67.1.0        
                                              53 00 5f 00  51 00 5d 00               67.1.8        
                                              55 00 5e 00  4f 00 5f 00               67.1.16       
                                              54 00 5e 00  53 00 5e 00               67.1.24       
                                              55 00 5e 00  53 00 5e 00               67.1.32       
                                              52 00 5e 00  54 00 5d 00               67.1.40       
                                              52 00 5c 00  52 00 5f 00               67.1.48       
                                              50 00 5e 00  52 00 5e 00               67.1.56       
                                              51 00 5c 00  52 00 5f 00               67.1.64       
                                              52 00 5e 00  51 00 60 00               67.1.72       
                                              55 00 5d 00  52 00 5c 00               67.1.80       
                                              51 00 60 00  53 00 5f 00               67.1.88       
                                              53 00 60 00  53 00 5f 00               67.1.96       
                                              51 00 5f 00  53 00 63 00               67.1.104      
                                              51 00 5d 00  51 00 5f 00               67.1.112      
                                              51 00 5c 00  52 00 5d 00               67.1.120      
                                              52 00 5f 00  54 00 5e 00               67.1.128      
                                              55 00 60 00  53 00 60 00               67.1.136      
                                              53 00 62 00  53 00 5f 00               67.1.144      
                                              51 00 5f 00  51 00 5d 00               67.1.152      
                                              53 00 5e 00  51 00 5f 00               67.1.160      
                                              54 00 5e 00  4f 00 63 00               67.1.168      
                                              50 00 5f 00  50 00 5e 00               67.1.176      
                                              52 00 5f 00  51 00 60 00               67.1.184      
                                              53 00 62 00  52 00 60 00               67.1.192      
  10.2                             31  IN     1a 00 00 00  01 00 02 00   44us        68.1.0        
                                              31 84 00 01  04 00 8b 1e               68.1.8        
                                              00 00 01 01  04 00 00 00               68.1.16       
                                              00 00 00 55  aa 55 aa                  68.1.24       
  10.2                         524288  IN     61 00 54 00  60 00 53 00  248ms        69.1.0        
                                              60 00 56 00  62 00 56 00               69.1.8        
                                              62 00 54 00  62 00 57 00               69.1.16       
                                              62 00 51 00  64 00 57 00               69.1.24       
                                              60 00 55 00  64 00 56 00               69.1.32       
                                              62 00 59 00  62 00 59 00               69.1.40       
                                              66 00 59 00  61 00 57 00               69.1.48       
                                              63 00 56 00  65 00 58 00               69.1.56       
                                              60 00 55 00  63 00 57 00               69.1.64       
                                              63 00 57 00  62 00 57 00               69.1.72       
                                              65 00 57 00  61 00 58 00               69.1.80       
                                              63 00 58 00  66 00 5a 00               69.1.88       
                                              5e 00 56 00  62 00 57 00               69.1.96       
                                              63 00 58 00  63 00 56 00               69.1.104      
                                              63 00 5a 00  63 00 56 00               69.1.112      
                                              64 00 58 00  64 00 58 00               69.1.120      
                                              64 00 58 00  62 00 55 00               69.1.128      
                                              60 00 56 00  64 00 57 00               69.1.136      
                                              64 00 56 00  63 00 59 00               69.1.144      
                                              64 00 57 00  63 00 57 00               69.1.152      
                                              65 00 53 00  64 00 55 00               69.1.160      
                                              61 00 55 00  65 00 57 00               69.1.168      
                                              62 00 57 00  66 00 58 00               69.1.176      
                                              63 00 57 00  66 00 56 00               69.1.184      
                                              61 00 55 00  61 00 57 00               69.1.192      
  10.2                         524288  IN     5f 00 53 00  60 00 52 00   12ms        70.1.0        
                                              5f 00 52 00  5f 00 52 00               70.1.8        
                                              61 00 53 00  61 00 51 00               70.1.16       
                                              5d 00 53 00  5e 00 51 00               70.1.24       
                                              5f 00 52 00  5d 00 52 00               70.1.32       
                                              5f 00 53 00  5e 00 54 00               70.1.40       
                                              5f 00 53 00  60 00 52 00               70.1.48       
                                              5f 00 52 00  5e 00 54 00               70.1.56       
                                              5d 00 54 00  5d 00 55 00               70.1.64       
                                              5f 00 53 00  5e 00 51 00               70.1.72       
                                              5e 00 54 00  5c 00 52 00               70.1.80       
                                              5e 00 54 00  5e 00 54 00               70.1.88       
                                              5e 00 52 00  5d 00 50 00               70.1.96       
                                              5f 00 51 00  60 00 51 00               70.1.104      
                                              5f 00 52 00  5d 00 53 00               70.1.112      
                                              60 00 52 00  5e 00 53 00               70.1.120      
                                              5e 00 52 00  5c 00 53 00               70.1.128      
                                              5f 00 52 00  61 00 52 00               70.1.136      
                                              60 00 51 00  5e 00 53 00               70.1.144      
                                              5c 00 53 00  5e 00 51 00               70.1.152      
                                              5e 00 51 00  60 00 50 00               70.1.160      
                                              60 00 51 00  5c 00 52 00               70.1.168      
                                              5d 00 55 00  5d 00 51 00               70.1.176      
                                              5f 00 52 00  5e 00 51 00               70.1.184      
                                              5e 00 4f 00  5e 00 52 00               70.1.192      
  10.2                         524288  IN     55 00 5e 00  52 00 5e 00   14ms        71.1.0        
                                              52 00 5e 00  50 00 5f 00               71.1.8        
                                              52 00 5e 00  50 00 5f 00               71.1.16       
                                              51 00 5f 00  51 00 5e 00               71.1.24       
                                              50 00 5f 00  51 00 5f 00               71.1.32       
                                              51 00 5e 00  51 00 5e 00               71.1.40       
                                              4f 00 5d 00  52 00 5e 00               71.1.48       
                                              52 00 5e 00  52 00 5e 00               71.1.56       
                                              50 00 5e 00  51 00 60 00               71.1.64       
                                              51 00 5f 00  53 00 5f 00               71.1.72       
                                              51 00 5e 00  54 00 5e 00               71.1.80       
                                              51 00 5f 00  4f 00 60 00               71.1.88       
                                              4f 00 5e 00  53 00 5f 00               71.1.96       
                                              54 00 5c 00  51 00 5d 00               71.1.104      
                                              53 00 5f 00  52 00 5c 00               71.1.112      
                                              52 00 5e 00  55 00 60 00               71.1.120      
                                              53 00 5e 00  53 00 5f 00               71.1.128      
                                              51 00 5c 00  51 00 5e 00               71.1.136      
                                              51 00 5e 00  53 00 60 00               71.1.144      
                                              51 00 5e 00  4f 00 5f 00               71.1.152      
                                              54 00 5f 00  53 00 5c 00               71.1.160      
                                              51 00 5e 00  52 00 5e 00               71.1.168      
                                              53 00 5c 00  50 00 5f 00               71.1.176      
                                              53 00 5d 00  51 00 5d 00               71.1.184      
                                              53 00 5e 00  52 00 5f 00               71.1.192      
  10.2                         524288  IN     5f 00 54 00  5e 00 53 00   11ms        72.1.0        
                                              5d 00 53 00  5f 00 51 00               72.1.8        
                                              5d 00 54 00  5d 00 52 00               72.1.16       
                                              5e 00 52 00  5e 00 52 00               72.1.24       
                                              5e 00 55 00  5e 00 52 00               72.1.32       
                                              5d 00 51 00  5d 00 51 00               72.1.40       
                                              5f 00 52 00  5f 00 52 00               72.1.48       
                                              5d 00 51 00  5f 00 52 00               72.1.56       
                                              5f 00 53 00  5e 00 52 00               72.1.64       
                                              60 00 55 00  60 00 51 00               72.1.72       
                                              60 00 53 00  5d 00 50 00               72.1.80       
                                              5e 00 53 00  5c 00 54 00               72.1.88       
                                              5e 00 53 00  5f 00 53 00               72.1.96       
                                              5e 00 52 00  5e 00 51 00               72.1.104      
                                              5e 00 51 00  62 00 53 00               72.1.112      
                                              5d 00 53 00  60 00 51 00               72.1.120      
                                              5d 00 53 00  60 00 51 00               72.1.128      
                                              5e 00 53 00  5c 00 50 00               72.1.136      
                                              5d 00 53 00  5e 00 53 00               72.1.144      
                                              5c 00 51 00  5d 00 52 00               72.1.152      
                                              5d 00 50 00  5f 00 51 00               72.1.160      
                                              5f 00 53 00  5c 00 52 00               72.1.168      
                                              60 00 51 00  5d 00 51 00               72.1.176      
                                              61 00 52 00  5d 00 52 00               72.1.184      
                                              60 00 53 00  60 00 4f 00               72.1.192      
  10.2                         524288  IN     53 00 5d 00  51 00 5e 00   13ms        73.1.0        
                                              52 00 60 00  51 00 5e 00               73.1.8        
                                              53 00 5e 00  53 00 60 00               73.1.16       
                                              53 00 5c 00  53 00 5f 00               73.1.24       
                                              52 00 5e 00  54 00 60 00               73.1.32       
                                              52 00 5d 00  52 00 5e 00               73.1.40       
                                              53 00 60 00  51 00 5f 00               73.1.48       
                                              51 00 5f 00  4f 00 5e 00               73.1.56       
                                              52 00 5e 00  53 00 5d 00               73.1.64       
                                              55 00 5d 00  51 00 5e 00               73.1.72       
                                              51 00 5f 00  53 00 5d 00               73.1.80       
                                              52 00 5f 00  52 00 5f 00               73.1.88       
                                              54 00 5f 00  53 00 60 00               73.1.96       
                                              55 00 5e 00  53 00 60 00               73.1.104      
                                              51 00 5e 00  51 00 5f 00               73.1.112      
                                              50 00 5f 00  53 00 5b 00               73.1.120      
                                              52 00 5f 00  53 00 60 00               73.1.128      
                                              54 00 60 00  55 00 60 00               73.1.136      
                                              54 00 61 00  51 00 5e 00               73.1.144      
                                              51 00 5d 00  53 00 5f 00               73.1.152      
                                              53 00 61 00  53 00 5e 00               73.1.160      
                                              53 00 60 00  51 00 61 00               73.1.168      
                                              53 00 5e 00  4f 00 5d 00               73.1.176      
                                              50 00 5e 00  51 00 5e 00               73.1.184      
                                              51 00 61 00  52 00 60 00               73.1.192      
  10.2                             31  IN     1a 00 00 00  01 00 02 00   40us        74.1.0        
                                              31 84 00 01  04 00 8c 1e               74.1.8        
                                              00 00 01 01  04 00 00 00               74.1.16       
                                              00 00 00 55  aa 55 aa                  74.1.24       
  10.2                         524288  IN     61 00 55 00  5f 00 57 00  249ms        75.1.0        
                                              60 00 55 00  63 00 57 00               75.1.8        
                                              64 00 54 00  62 00 55 00               75.1.16       
                                              61 00 55 00  61 00 55 00               75.1.24       
                                              60 00 57 00  64 00 56 00               75.1.32       
                                              5f 00 58 00  62 00 59 00               75.1.40       
                                              64 00 59 00  62 00 55 00               75.1.48       
                                              63 00 57 00  65 00 59 00               75.1.56       
                                              62 00 54 00  64 00 58 00               75.1.64       
                                              65 00 58 00  64 00 56 00               75.1.72       
                                              63 00 58 00  60 00 56 00               75.1.80       
                                              64 00 57 00  66 00 58 00               75.1.88       
                                              62 00 55 00  61 00 57 00               75.1.96       
                                              62 00 56 00  64 00 55 00               75.1.104      
                                              66 00 5b 00  63 00 57 00               75.1.112      
                                              64 00 57 00  66 00 5b 00               75.1.120      
                                              64 00 58 00  63 00 55 00               75.1.128      
                                              65 00 57 00  67 00 58 00               75.1.136      
                                              64 00 57 00  64 00 59 00               75.1.144      
                                              66 00 58 00  65 00 59 00               75.1.152      
                                              64 00 5a 00  64 00 58 00               75.1.160      
                                              62 00 55 00  64 00 5a 00               75.1.168      
                                              62 00 57 00  66 00 59 00               75.1.176      
                                              62 00 59 00  67 00 59 00               75.1.184      
                                              64 00 57 00  62 00 56 00               75.1.192      
  10.2                         524288  IN     5e 00 52 00  5f 00 51 00   12ms        76.1.0        
                                              5b 00 52 00  60 00 51 00               76.1.8        
                                              5f 00 51 00  5f 00 52 00               76.1.16       
                                              5c 00 50 00  5e 00 50 00               76.1.24       
                                              5d 00 52 00  5f 00 51 00               76.1.32       
                                              5e 00 4f 00  5e 00 50 00               76.1.40       
                                              5e 00 50 00  5c 00 51 00               76.1.48       
                                              5f 00 53 00  5f 00 53 00               76.1.56       
                                              5e 00 50 00  5e 00 53 00               76.1.64       
                                              60 00 53 00  5c 00 52 00               76.1.72       
                                              5f 00 50 00  5d 00 4f 00               76.1.80       
                                              5c 00 53 00  5d 00 53 00               76.1.88       
                                              5d 00 51 00  5f 00 53 00               76.1.96       
                                              5b 00 51 00  5f 00 4f 00               76.1.104      
                                              5e 00 4e 00  60 00 53 00               76.1.112      
                                              5d 00 50 00  5f 00 52 00               76.1.120      
                                              5e 00 50 00  5e 00 50 00               76.1.128      
                                              5f 00 50 00  5f 00 4f 00               76.1.136      
                                              5c 00 52 00  5d 00 53 00               76.1.144      
                                              5c 00 51 00  5c 00 52 00               76.1.152      
                                              60 00 50 00  5e 00 4f 00               76.1.160      
                                              5c 00 50 00  5c 00 51 00               76.1.168      
                                              5c 00 51 00  5c 00 4f 00               76.1.176      
                                              5e 00 51 00  5e 00 4e 00               76.1.184      
                                              5c 00 50 00  5e 00 51 00               76.1.192      
  10.2                         524288  IN     55 00 60 00  51 00 60 00   13ms        77.1.0        
                                              52 00 5f 00  52 00 60 00               77.1.8        
                                              52 00 5e 00  52 00 60 00               77.1.16       
                                              51 00 5f 00  53 00 60 00               77.1.24       
                                              52 00 60 00  51 00 60 00               77.1.32       
                                              51 00 60 00  53 00 60 00               77.1.40       
                                              51 00 5f 00  53 00 62 00               77.1.48       
                                              51 00 60 00  53 00 5f 00               77.1.56       
                                              52 00 5d 00  52 00 63 00               77.1.64       
                                              52 00 61 00  53 00 5e 00               77.1.72       
                                              52 00 62 00  53 00 60 00               77.1.80       
                                              52 00 60 00  51 00 60 00               77.1.88       
                                              51 00 5d 00  53 00 5f 00               77.1.96       
                                              53 00 5c 00  52 00 60 00               77.1.104      
                                              53 00 5f 00  55 00 5f 00               77.1.112      
                                              53 00 5d 00  53 00 60 00               77.1.120      
                                              53 00 5e 00  51 00 60 00               77.1.128      
                                              53 00 60 00  52 00 5f 00               77.1.136      
                                              51 00 61 00  51 00 5e 00               77.1.144      
                                              53 00 5f 00  53 00 5c 00               77.1.152      
                                              51 00 5e 00  51 00 61 00               77.1.160      
                                              56 00 5e 00  52 00 5f 00               77.1.168      
                                              52 00 5f 00  50 00 5c 00               77.1.176      
                                              53 00 5e 00  53 00 60 00               77.1.184      
                                              53 00 60 00  53 00 5f 00               77.1.192      
  10.2                         524288  IN     5c 00 52 00  5e 00 53 00   14ms        78.1.0        
                                              60 00 53 00  5f 00 54 00               78.1.8        
                                              5d 00 52 00  60 00 53 00               78.1.16       
                                              5e 00 51 00  5e 00 52 00               78.1.24       
                                              60 00 52 00  5f 00 53 00               78.1.32       
                                              5f 00 53 00  5f 00 53 00               78.1.40       
                                              5d 00 52 00  5e 00 53 00               78.1.48       
                                              5f 00 53 00  5d 00 51 00               78.1.56       
                                              60 00 51 00  5f 00 54 00               78.1.64       
                                              5e 00 53 00  60 00 53 00               78.1.72       
                                              60 00 53 00  5f 00 51 00               78.1.80       
                                              5c 00 53 00  60 00 4f 00               78.1.88       
                                              5f 00 51 00  61 00 53 00               78.1.96       
                                              5f 00 55 00  5f 00 52 00               78.1.104      
                                              5f 00 53 00  60 00 53 00               78.1.112      
                                              5e 00 51 00  5e 00 53 00               78.1.120      
                                              5e 00 55 00  5f 00 53 00               78.1.128      
                                              5c 00 52 00  60 00 51 00               78.1.136      
                                              5c 00 51 00  60 00 53 00               78.1.144      
                                              60 00 53 00  60 00 51 00               78.1.152      
                                              5e 00 51 00  60 00 52 00               78.1.160      
                                              5d 00 52 00  5c 00 53 00               78.1.168      
                                              60 00 52 00  5f 00 51 00               78.1.176      
                                              62 00 52 00  60 00 51 00               78.1.184      
                                              5d 00 51 00  5f 00 52 00               78.1.192      
  10.2                         524288  IN     55 00 5c 00  51 00 5f 00   13ms        79.1.0        
                                              53 00 60 00  52 00 5f 00               79.1.8        
                                              51 00 60 00  52 00 60 00               79.1.16       
                                              53 00 5e 00  52 00 61 00               79.1.24       
                                              51 00 60 00  53 00 60 00               79.1.32       
                                              54 00 5e 00  55 00 5f 00               79.1.40       
                                              50 00 5f 00  54 00 5e 00               79.1.48       
                                              52 00 5c 00  51 00 60 00               79.1.56       
                                              4f 00 5f 00  53 00 5f 00               79.1.64       
                                              52 00 5f 00  55 00 5f 00               79.1.72       
                                              53 00 60 00  55 00 5f 00               79.1.80       
                                              52 00 5e 00  54 00 5e 00               79.1.88       
                                              55 00 5f 00  55 00 5e 00               79.1.96       
                                              52 00 60 00  4f 00 60 00               79.1.104      
                                              54 00 60 00  53 00 5f 00               79.1.112      
                                              53 00 5f 00  51 00 5d 00               79.1.120      
                                              53 00 5e 00  53 00 60 00               79.1.128      
                                              52 00 5e 00  52 00 60 00               79.1.136      
                                              52 00 5f 00  54 00 60 00               79.1.144      
                                              53 00 5f 00  51 00 5f 00               79.1.152      
                                              54 00 5f 00  52 00 60 00               79.1.160      
                                              55 00 5f 00  52 00 62 00               79.1.168      
                                              53 00 61 00  53 00 61 00               79.1.176      
                                              50 00 5e 00  53 00 60 00               79.1.184      
                                              53 00 62 00  53 00 60 00               79.1.192      
  10.2                             31  IN     1a 00 00 00  01 00 02 00   40us        80.1.0        
                                              31 84 00 01  04 00 8d 1e               80.1.8        
                                              00 00 01 01  04 00 00 00               80.1.16       
                                              00 00 00 55  aa 55 aa                  80.1.24       
  10.2                         524288  IN     60 00 56 00  5f 00 55 00  248ms        81.1.0        
                                              60 00 56 00  64 00 56 00               81.1.8        
                                              63 00 55 00  62 00 54 00               81.1.16       
                                              63 00 52 00  64 00 54 00               81.1.24       
                                              60 00 56 00  63 00 54 00               81.1.32       
                                              63 00 57 00  63 00 57 00               81.1.40       
                                              64 00 58 00  62 00 56 00               81.1.48       
                                              64 00 57 00  64 00 57 00               81.1.56       
                                              64 00 53 00  62 00 58 00               81.1.64       
                                              64 00 56 00  61 00 53 00               81.1.72       
                                              63 00 57 00  60 00 56 00               81.1.80       
                                              63 00 57 00  64 00 56 00               81.1.88       
                                              60 00 55 00  62 00 57 00               81.1.96       
                                              64 00 55 00  63 00 55 00               81.1.104      
                                              64 00 59 00  62 00 55 00               81.1.112      
                                              63 00 56 00  64 00 5b 00               81.1.120      
                                              62 00 59 00  64 00 57 00               81.1.128      
                                              60 00 54 00  65 00 57 00               81.1.136      
                                              64 00 56 00  64 00 58 00               81.1.144      
                                              64 00 57 00  64 00 58 00               81.1.152      
                                              63 00 56 00  61 00 54 00               81.1.160      
                                              61 00 55 00  64 00 57 00               81.1.168      
                                              66 00 56 00  66 00 56 00               81.1.176      
                                              63 00 57 00  64 00 57 00               81.1.184      
                                              64 00 57 00  64 00 58 00               81.1.192      
  10.2                         524288  IN     5e 00 51 00  5c 00 4f 00   13ms        82.1.0        
                                              5d 00 53 00  5d 00 53 00               82.1.8        
                                              5d 00 50 00  5f 00 51 00               82.1.16       
                                              5f 00 51 00  5f 00 51 00               82.1.24       
                                              5d 00 52 00  5d 00 51 00               82.1.32       
                                              5c 00 51 00  5b 00 51 00               82.1.40       
                                              60 00 52 00  60 00 51 00               82.1.48       
                                              60 00 51 00  5e 00 52 00               82.1.56       
                                              5d 00 53 00  5e 00 51 00               82.1.64       
                                              5e 00 53 00  5f 00 51 00               82.1.72       
                                              5d 00 52 00  5d 00 53 00               82.1.80       
                                              5d 00 53 00  5d 00 51 00               82.1.88       
                                              5f 00 51 00  5f 00 51 00               82.1.96       
                                              5d 00 50 00  5e 00 51 00               82.1.104      
                                              60 00 4f 00  5f 00 4f 00               82.1.112      
                                              5c 00 51 00  5e 00 53 00               82.1.120      
                                              5c 00 50 00  5c 00 53 00               82.1.128      
                                              5e 00 50 00  5c 00 51 00               82.1.136      
                                              5f 00 4f 00  5c 00 51 00               82.1.144      
                                              5c 00 51 00  5d 00 53 00               82.1.152      
                                              5e 00 52 00  5e 00 51 00               82.1.160      
                                              5e 00 53 00  5c 00 53 00               82.1.168      
                                              5f 00 53 00  5e 00 4d 00               82.1.176      
                                              5c 00 53 00  5d 00 51 00               82.1.184      
                                              5b 00 51 00  5e 00 53 00               82.1.192      
  10.2                         524288  IN     55 00 5e 00  51 00 5f 00   12ms        83.1.0        
                                              53 00 5e 00  51 00 5e 00               83.1.8        
                                              50 00 5e 00  53 00 5e 00               83.1.16       
                                              4f 00 5d 00  52 00 5d 00               83.1.24       
                                              53 00 5c 00  4f 00 5f 00               83.1.32       
                                              51 00 5d 00  51 00 5a 00               83.1.40       
                                              50 00 60 00  52 00 5e 00               83.1.48       
                                              51 00 5d 00  53 00 5e 00               83.1.56       
                                              53 00 5e 00  4f 00 5d 00               83.1.64       
                                              51 00 60 00  51 00 5c 00               83.1.72       
                                              50 00 5e 00  52 00 5f 00               83.1.80       
                                              50 00 5d 00  51 00 61 00               83.1.88       
                                              51 00 60 00  51 00 5d 00               83.1.96       
                                              53 00 5d 00  51 00 5d 00               83.1.104      
                                              52 00 5f 00  51 00 5e 00               83.1.112      
                                              4f 00 5f 00  51 00 5e 00               83.1.120      
                                              53 00 5e 00  51 00 5e 00               83.1.128      
                                              52 00 5e 00  50 00 5c 00               83.1.136      
                                              51 00 5d 00  51 00 5e 00               83.1.144      
                                              53 00 5e 00  51 00 5e 00               83.1.152      
                                              50 00 5e 00  50 00 5e 00               83.1.160      
                                              51 00 5e 00  50 00 5e 00               83.1.168      
                                              51 00 5f 00  4f 00 5c 00               83.1.176      
                                              51 00 5e 00  50 00 5c 00               83.1.184      
                                              50 00 5e 00  55 00 5e 00               83.1.192      
  10.2                         524288  IN     5d 00 53 00  5d 00 52 00   13ms        84.1.0        
                                              5d 00 52 00  61 00 54 00               84.1.8        
                                              5c 00 55 00  5c 00 55 00               84.1.16       
                                              5f 00 52 00  5f 00 52 00               84.1.24       
                                              5f 00 53 00  5f 00 53 00               84.1.32       
                                              5e 00 53 00  60 00 51 00               84.1.40       
                                              5c 00 53 00  5e 00 51 00               84.1.48       
                                              5e 00 52 00  60 00 51 00               84.1.56       
                                              60 00 54 00  60 00 52 00               84.1.64       
                                              5e 00 54 00  5e 00 51 00               84.1.72       
                                              60 00 53 00  60 00 52 00               84.1.80       
                                              5e 00 53 00  60 00 52 00               84.1.88       
                                              5f 00 53 00  5f 00 56 00               84.1.96       
                                              60 00 51 00  61 00 51 00               84.1.104      
                                              5d 00 53 00  60 00 52 00               84.1.112      
                                              5e 00 53 00  60 00 51 00               84.1.120      
                                              5f 00 53 00  61 00 53 00               84.1.128      
                                              5d 00 54 00  5d 00 53 00               84.1.136      
                                              60 00 51 00  61 00 54 00               84.1.144      
                                              5e 00 51 00  5e 00 51 00               84.1.152      
                                              61 00 53 00  60 00 52 00               84.1.160      
                                              5e 00 54 00  5e 00 51 00               84.1.168      
                                              60 00 53 00  5e 00 53 00               84.1.176      
                                              5e 00 54 00  5e 00 54 00               84.1.184      
                                              5f 00 52 00  5c 00 51 00               84.1.192      
  10.2                         524288  IN     55 00 5f 00  53 00 5d 00   12ms        85.1.0        
                                              52 00 5c 00  51 00 60 00               85.1.8        
                                              53 00 5c 00  52 00 5e 00               85.1.16       
                                              51 00 5e 00  51 00 5d 00               85.1.24       
                                              52 00 5e 00  53 00 5f 00               85.1.32       
                                              53 00 5e 00  53 00 5e 00               85.1.40       
                                              51 00 5e 00  51 00 5e 00               85.1.48       
                                              51 00 5f 00  51 00 5b 00               85.1.56       
                                              51 00 5e 00  51 00 5c 00               85.1.64       
                                              4f 00 5f 00  53 00 5d 00               85.1.72       
                                              53 00 5d 00  52 00 5c 00               85.1.80       
                                              51 00 5f 00  54 00 5c 00               85.1.88       
                                              51 00 60 00  53 00 5c 00               85.1.96       
                                              53 00 5c 00  51 00 60 00               85.1.104      
                                              52 00 5f 00  50 00 5e 00               85.1.112      
                                              55 00 5e 00  51 00 60 00               85.1.120      
                                              54 00 5e 00  53 00 5f 00               85.1.128      
                                              53 00 5f 00  52 00 60 00               85.1.136      
                                              52 00 61 00  52 00 5f 00               85.1.144      
                                              52 00 5d 00  50 00 5e 00               85.1.152      
                                              55 00 5d 00  51 00 60 00               85.1.160      
                                              51 00 60 00  4e 00 60 00               85.1.168      
                                              53 00 60 00  52 00 5c 00               85.1.176      
                                              4f 00 5e 00  52 00 5e 00               85.1.184      
                                              51 00 61 00  50 00 5f 00               85.1.192      
  10.2                             31  IN     1a 00 00 00  01 00 02 00   29us        86.1.0        
                                              31 84 00 01  04 00 8e 1e               86.1.8        
                                              00 00 01 01  04 00 00 00               86.1.16       
                                              00 00 00 55  aa 55 aa                  86.1.24       
  10.2                         524288  IN     60 00 55 00  60 00 53 00  249ms        87.1.0        
                                              61 00 57 00  65 00 55 00               87.1.8        
                                              61 00 55 00  62 00 55 00               87.1.16       
                                              61 00 54 00  64 00 57 00               87.1.24       
                                              5e 00 55 00  61 00 54 00               87.1.32       
                                              60 00 57 00  61 00 58 00               87.1.40       
                                              64 00 58 00  64 00 55 00               87.1.48       
                                              62 00 57 00  64 00 5b 00               87.1.56       
                                              63 00 55 00  61 00 57 00               87.1.64       
                                              62 00 57 00  60 00 55 00               87.1.72       
                                              63 00 57 00  63 00 57 00               87.1.80       
                                              62 00 5a 00  66 00 59 00               87.1.88       
                                              60 00 57 00  62 00 55 00               87.1.96       
                                              61 00 57 00  64 00 57 00               87.1.104      
                                              63 00 5a 00  62 00 58 00               87.1.112      
                                              63 00 57 00  64 00 57 00               87.1.120      
                                              63 00 57 00  63 00 53 00               87.1.128      
                                              64 00 56 00  64 00 58 00               87.1.136      
                                              64 00 56 00  64 00 5a 00               87.1.144      
                                              62 00 58 00  68 00 59 00               87.1.152      
                                              64 00 56 00  63 00 55 00               87.1.160      
                                              60 00 53 00  64 00 59 00               87.1.168      
                                              62 00 57 00  63 00 57 00               87.1.176      
                                              64 00 57 00  64 00 59 00               87.1.184      
                                              65 00 57 00  62 00 57 00               87.1.192      
  10.2                         524288  IN     5d 00 53 00  5d 00 53 00   12ms        88.1.0        
                                              5e 00 54 00  5f 00 51 00               88.1.8        
                                              5f 00 52 00  5d 00 52 00               88.1.16       
                                              5c 00 51 00  5d 00 53 00               88.1.24       
                                              5d 00 53 00  5e 00 53 00               88.1.32       
                                              5c 00 53 00  5d 00 50 00               88.1.40       
                                              5e 00 52 00  5f 00 4f 00               88.1.48       
                                              60 00 53 00  5e 00 53 00               88.1.56       
                                              5c 00 51 00  5c 00 52 00               88.1.64       
                                              5e 00 53 00  5d 00 52 00               88.1.72       
                                              5e 00 51 00  5e 00 51 00               88.1.80       
                                              5e 00 53 00  5f 00 52 00               88.1.88       
                                              5d 00 54 00  5d 00 52 00               88.1.96       
                                              5d 00 50 00  5e 00 50 00               88.1.104      
                                              5f 00 51 00  60 00 4f 00               88.1.112      
                                              5c 00 51 00  5d 00 52 00               88.1.120      
                                              5e 00 51 00  5e 00 51 00               88.1.128      
                                              5f 00 50 00  60 00 53 00               88.1.136      
                                              5f 00 51 00  5e 00 50 00               88.1.144      
                                              5d 00 53 00  5e 00 51 00               88.1.152      
                                              5f 00 52 00  5f 00 4f 00               88.1.160      
                                              5e 00 50 00  5c 00 53 00               88.1.168      
                                              5c 00 53 00  5d 00 51 00               88.1.176      
                                              5c 00 51 00  5c 00 51 00               88.1.184      
                                              5d 00 51 00  5e 00 51 00               88.1.192      
  10.2                         524288  IN     55 00 5e 00  52 00 5f 00   13ms        89.1.0        
                                              52 00 60 00  51 00 5e 00               89.1.8        
                                              51 00 5c 00  55 00 5e 00               89.1.16       
                                              53 00 60 00  52 00 5e 00               89.1.24       
                                              51 00 5e 00  51 00 60 00               89.1.32       
                                              52 00 60 00  52 00 5c 00               89.1.40       
                                              53 00 5f 00  51 00 5f 00               89.1.48       
                                              53 00 5e 00  53 00 5f 00               89.1.56       
                                              51 00 5e 00  53 00 62 00               89.1.64       
                                              52 00 5e 00  52 00 5d 00               89.1.72       
                                              53 00 5e 00  51 00 5f 00               89.1.80       
                                              53 00 5f 00  53 00 60 00               89.1.88       
                                              51 00 5e 00  51 00 60 00               89.1.96       
                                              53 00 5e 00  51 00 5f 00               89.1.104      
                                              55 00 5f 00  53 00 5f 00               89.1.112      
                                              51 00 5d 00  52 00 61 00               89.1.120      
                                              51 00 5c 00  52 00 5f 00               89.1.128      
                                              52 00 60 00  53 00 5d 00               89.1.136      
                                              4f 00 60 00  51 00 5f 00               89.1.144      
                                              53 00 5e 00  52 00 5e 00               89.1.152      
                                              53 00 60 00  53 00 5d 00               89.1.160      
                                              53 00 5c 00  52 00 60 00               89.1.168      
                                              50 00 5d 00  51 00 5e 00               89.1.176      
                                              53 00 5e 00  50 00 5e 00               89.1.184      
                                              51 00 5e 00  53 00 60 00               89.1.192      
  10.2                         524288  IN     5e 00 51 00  60 00 50 00   13ms        90.1.0        
                                              5f 00 52 00  5f 00 53 00               90.1.8        
                                              60 00 53 00  61 00 51 00               90.1.16       
                                              5d 00 54 00  60 00 52 00               90.1.24       
                                              5f 00 52 00  5f 00 53 00               90.1.32       
                                              5f 00 51 00  5f 00 51 00               90.1.40       
                                              5f 00 53 00  5d 00 53 00               90.1.48       
                                              62 00 53 00  5f 00 52 00               90.1.56       
                                              61 00 55 00  60 00 51 00               90.1.64       
                                              61 00 55 00  61 00 53 00               90.1.72       
                                              60 00 53 00  60 00 51 00               90.1.80       
                                              5e 00 52 00  5d 00 53 00               90.1.88       
                                              5f 00 54 00  60 00 54 00               90.1.96       
                                              60 00 54 00  60 00 54 00               90.1.104      
                                              5f 00 53 00  5f 00 54 00               90.1.112      
                                              5d 00 51 00  5f 00 52 00               90.1.120      
                                              5e 00 52 00  60 00 52 00               90.1.128      
                                              5f 00 51 00  5d 00 52 00               90.1.136      
                                              5f 00 52 00  5f 00 53 00               90.1.144      
                                              5d 00 55 00  5f 00 53 00               90.1.152      
                                              60 00 52 00  5f 00 51 00               90.1.160      
                                              60 00 53 00  5e 00 53 00               90.1.168      
                                              5d 00 52 00  60 00 52 00               90.1.176      
                                              60 00 55 00  5e 00 54 00               90.1.184      
                                              5e 00 53 00  5f 00 51 00               90.1.192      
  10.2                         524288  IN     50 00 5f 00  50 00 5c 00   12ms        91.1.0        
                                              51 00 5f 00  52 00 5f 00               91.1.8        
                                              54 00 5c 00  51 00 5f 00               91.1.16       
                                              51 00 5f 00  51 00 5e 00               91.1.24       
                                              51 00 5f 00  53 00 5e 00               91.1.32       
                                              53 00 5e 00  52 00 60 00               91.1.40       
                                              51 00 5e 00  53 00 60 00               91.1.48       
                                              50 00 5e 00  53 00 60 00               91.1.56       
                                              51 00 5d 00  53 00 5f 00               91.1.64       
                                              4f 00 5d 00  53 00 5f 00               91.1.72       
                                              50 00 60 00  51 00 5d 00               91.1.80       
                                              54 00 5f 00  51 00 5f 00               91.1.88       
                                              54 00 5f 00  51 00 5f 00               91.1.96       
                                              50 00 5e 00  51 00 5d 00               91.1.104      
                                              4f 00 5e 00  51 00 60 00               91.1.112      
                                              53 00 5c 00  51 00 5e 00               91.1.120      
                                              51 00 5f 00  53 00 5f 00               91.1.128      
                                              53 00 5f 00  51 00 5e 00               91.1.136      
                                              51 00 60 00  51 00 60 00               91.1.144      
                                              52 00 60 00  52 00 5e 00               91.1.152      
                                              52 00 60 00  50 00 60 00               91.1.160      
                                              52 00 5e 00  53 00 64 00               91.1.168      
                                              54 00 5f 00  50 00 5e 00               91.1.176      
                                              53 00 60 00  51 00 60 00               91.1.184      
                                              51 00 61 00  51 00 5f 00               91.1.192      
  10.2                             31  IN     1a 00 00 00  01 00 02 00   34us        92.1.0        
                                              31 84 00 01  04 00 8f 1e               92.1.8        
                                              00 00 01 01  04 00 00 00               92.1.16       
                                              00 00 00 55  aa 55 aa                  92.1.24       
  10.2                         524288  IN     5f 00 56 00  5f 00 56 00  249ms        93.1.0        
                                              60 00 54 00  62 00 57 00               93.1.8        
                                              62 00 55 00  61 00 57 00               93.1.16       
                                              61 00 55 00  64 00 56 00               93.1.24       
                                              60 00 59 00  62 00 57 00               93.1.32       
                                              60 00 58 00  62 00 57 00               93.1.40       
                                              64 00 58 00  61 00 55 00               93.1.48       
                                              62 00 56 00  65 00 57 00               93.1.56       
                                              62 00 54 00  62 00 59 00               93.1.64       
                                              62 00 56 00  61 00 55 00               93.1.72       
                                              62 00 58 00  62 00 55 00               93.1.80       
                                              62 00 57 00  64 00 55 00               93.1.88       
                                              60 00 54 00  62 00 55 00               93.1.96       
                                              64 00 57 00  64 00 59 00               93.1.104      
                                              63 00 5b 00  65 00 57 00               93.1.112      
                                              61 00 58 00  65 00 55 00               93.1.120      
                                              64 00 57 00  61 00 54 00               93.1.128      
                                              61 00 55 00  65 00 57 00               93.1.136      
                                              63 00 59 00  62 00 5a 00               93.1.144      
                                              64 00 55 00  64 00 59 00               93.1.152      
                                              64 00 57 00  63 00 57 00               93.1.160      
                                              62 00 56 00  65 00 59 00               93.1.168      
                                              61 00 54 00  64 00 58 00               93.1.176      
                                              64 00 59 00  67 00 57 00               93.1.184      
                                              63 00 56 00  60 00 58 00               93.1.192      
  10.2                         524288  IN     5d 00 51 00  60 00 53 00   12ms        94.1.0        
                                              5e 00 52 00  5b 00 51 00               94.1.8        
                                              5d 00 51 00  5d 00 52 00               94.1.16       
                                              5d 00 50 00  5d 00 51 00               94.1.24       
                                              5d 00 51 00  5e 00 52 00               94.1.32       
                                              5c 00 52 00  5c 00 52 00               94.1.40       
                                              5d 00 50 00  5d 00 51 00               94.1.48       
                                              60 00 50 00  5e 00 54 00               94.1.56       
                                              5c 00 51 00  5d 00 4f 00               94.1.64       
                                              5d 00 51 00  5e 00 51 00               94.1.72       
                                              5b 00 52 00  5c 00 51 00               94.1.80       
                                              5d 00 51 00  5f 00 53 00               94.1.88       
                                              5f 00 50 00  5d 00 51 00               94.1.96       
                                              5e 00 4f 00  5c 00 4f 00               94.1.104      
                                              5f 00 51 00  5f 00 4f 00               94.1.112      
                                              5c 00 51 00  5f 00 52 00               94.1.120      
                                              5f 00 52 00  5c 00 53 00               94.1.128      
                                              5d 00 50 00  5f 00 50 00               94.1.136      
                                              5e 00 50 00  5d 00 51 00               94.1.144      
                                              5e 00 4d 00  5d 00 50 00               94.1.152      
                                              5c 00 4f 00  5f 00 50 00               94.1.160      
                                              5d 00 51 00  5c 00 51 00               94.1.168      
                                              5e 00 51 00  5e 00 50 00               94.1.176      
                                              60 00 4f 00  5e 00 52 00               94.1.184      
                                              5d 00 51 00  5d 00 53 00               94.1.192      
  10.2                         524288  IN     55 00 5c 00  53 00 61 00   13ms        95.1.0        
                                              51 00 5e 00  52 00 5e 00               95.1.8        
                                              53 00 5e 00  52 00 61 00               95.1.16       
                                              4f 00 60 00  51 00 5e 00               95.1.24       
                                              51 00 60 00  51 00 5d 00               95.1.32       
                                              51 00 60 00  51 00 60 00               95.1.40       
                                              4f 00 5c 00  52 00 60 00               95.1.48       
                                              52 00 60 00  54 00 5f 00               95.1.56       
                                              51 00 5e 00  53 00 61 00               95.1.64       
                                              53 00 5e 00  51 00 5e 00               95.1.72       
                                              51 00 60 00  53 00 60 00               95.1.80       
                                              4f 00 5e 00  52 00 5e 00               95.1.88       
                                              50 00 5e 00  53 00 5e 00               95.1.96       
                                              56 00 5e 00  52 00 60 00               95.1.104      
                                              51 00 60 00  52 00 5f 00               95.1.112      
                                              50 00 5f 00  53 00 5e 00               95.1.120      
                                              51 00 5e 00  52 00 5e 00               95.1.128      
                                              51 00 5e 00  53 00 5f 00               95.1.136      
                                              4e 00 5f 00  54 00 5f 00               95.1.144      
                                              53 00 60 00  51 00 5c 00               95.1.152      
                                              53 00 5c 00  51 00 5e 00               95.1.160      
                                              51 00 5e 00  52 00 5e 00               95.1.168      
                                              51 00 5d 00  53 00 5e 00               95.1.176      
                                              53 00 5f 00  51 00 5f 00               95.1.184      
                                              51 00 5d 00  51 00 5e 00               95.1.192      
  10.2                         524288  IN     5e 00 53 00  5e 00 51 00   13ms        96.1.0        
                                              60 00 52 00  5f 00 55 00               96.1.8        
                                              5f 00 52 00  5e 00 52 00               96.1.16       
                                              5f 00 51 00  5c 00 50 00               96.1.24       
                                              5f 00 53 00  5f 00 51 00               96.1.32       
                                              60 00 51 00  5e 00 52 00               96.1.40       
                                              5f 00 54 00  5f 00 52 00               96.1.48       
                                              5c 00 51 00  5c 00 50 00               96.1.56       
                                              60 00 53 00  60 00 52 00               96.1.64       
                                              5e 00 52 00  5e 00 51 00               96.1.72       
                                              5d 00 52 00  5e 00 51 00               96.1.80       
                                              5e 00 52 00  5e 00 4f 00               96.1.88       
                                              60 00 52 00  60 00 50 00               96.1.96       
                                              5e 00 54 00  5f 00 53 00               96.1.104      
                                              5e 00 55 00  5e 00 53 00               96.1.112      
                                              5f 00 53 00  5f 00 52 00               96.1.120      
                                              5d 00 52 00  60 00 53 00               96.1.128      
                                              60 00 53 00  60 00 52 00               96.1.136      
                                              60 00 52 00  5e 00 51 00               96.1.144      
                                              5e 00 51 00  5e 00 52 00               96.1.152      
                                              60 00 52 00  5f 00 53 00               96.1.160      
                                              5d 00 4f 00  5f 00 51 00               96.1.168      
                                              5f 00 50 00  5e 00 50 00               96.1.176      
                                              5e 00 55 00  5f 00 51 00               96.1.184      
                                              60 00 52 00  5d 00 52 00               96.1.192      
  10.2                         524288  IN     51 00 5f 00  52 00 60 00   13ms        97.1.0        
                                              4f 00 5f 00  4f 00 5e 00               97.1.8        
                                              54 00 5e 00  50 00 5c 00               97.1.16       
                                              52 00 5b 00  51 00 5c 00               97.1.24       
                                              52 00 5e 00  52 00 5c 00               97.1.32       
                                              53 00 5e 00  51 00 5e 00               97.1.40       
                                              52 00 5c 00  50 00 5f 00               97.1.48       
                                              51 00 5f 00  54 00 5d 00               97.1.56       
                                              4e 00 5f 00  52 00 5c 00               97.1.64       
                                              4e 00 5f 00  52 00 5e 00               97.1.72       
                                              51 00 60 00  51 00 5f 00               97.1.80       
                                              53 00 5f 00  52 00 5e 00               97.1.88       
                                              54 00 5f 00  51 00 5e 00               97.1.96       
                                              52 00 60 00  51 00 60 00               97.1.104      
                                              53 00 60 00  53 00 61 00               97.1.112      
                                              54 00 5d 00  4f 00 5d 00               97.1.120      
                                              52 00 5e 00  52 00 5e 00               97.1.128      
                                              52 00 5d 00  51 00 5f 00               97.1.136      
                                              50 00 62 00  52 00 5e 00               97.1.144      
                                              52 00 5e 00  51 00 5d 00               97.1.152      
                                              52 00 5e 00  51 00 5e 00               97.1.160      
                                              53 00 5c 00  51 00 60 00               97.1.168      
                                              53 00 61 00  4f 00 5d 00               97.1.176      
                                              51 00 5f 00  52 00 5e 00               97.1.184      
                                              51 00 62 00  50 00 5e 00               97.1.192      
  10.2                             31  IN     1a 00 00 00  01 00 02 00   47us        98.1.0        
                                              31 84 00 01  04 00 90 1e               98.1.8        
                                              00 00 01 01  04 00 00 00               98.1.16       
                                              00 00 00 55  aa 55 aa                  98.1.24       
  10.2                         524288  IN     60 00 57 00  5e 00 55 00  250ms        99.1.0        
                                              63 00 56 00  62 00 55 00               99.1.8        
                                              62 00 57 00  61 00 57 00               99.1.16       
                                              62 00 55 00  64 00 54 00               99.1.24       
                                              60 00 56 00  60 00 55 00               99.1.32       
                                              60 00 57 00  64 00 59 00               99.1.40       
                                              64 00 56 00  63 00 56 00               99.1.48       
                                              64 00 58 00  63 00 57 00               99.1.56       
                                              61 00 54 00  64 00 59 00               99.1.64       
                                              64 00 57 00  60 00 55 00               99.1.72       
                                              62 00 56 00  62 00 57 00               99.1.80       
                                              65 00 59 00  64 00 58 00               99.1.88       
                                              62 00 56 00  63 00 58 00               99.1.96       
                                              62 00 59 00  63 00 58 00               99.1.104      
                                              62 00 57 00  63 00 58 00               99.1.112      
                                              61 00 59 00  64 00 59 00               99.1.120      
                                              64 00 57 00  66 00 54 00               99.1.128      
                                              60 00 56 00  65 00 59 00               99.1.136      
                                              62 00 57 00  66 00 58 00               99.1.144      
                                              64 00 57 00  65 00 5a 00               99.1.152      
                                              63 00 59 00  64 00 59 00               99.1.160      
                                              60 00 53 00  64 00 59 00               99.1.168      
                                              64 00 57 00  65 00 5a 00               99.1.176      
                                              63 00 5b 00  65 00 56 00               99.1.184      
                                              64 00 57 00  62 00 58 00               99.1.192      
  10.2                         524288  IN     5e 00 50 00  5e 00 51 00   12ms       100.1.0        
                                              5c 00 53 00  60 00 55 00              100.1.8        
                                              5d 00 53 00  5f 00 51 00              100.1.16       
                                              5f 00 52 00  5e 00 52 00              100.1.24       
                                              5e 00 51 00  5e 00 52 00              100.1.32       
                                              60 00 53 00  5e 00 51 00              100.1.40       
                                              5e 00 53 00  5f 00 53 00              100.1.48       
                                              5f 00 52 00  5e 00 54 00              100.1.56       
                                              5c 00 52 00  60 00 51 00              100.1.64       
                                              5e 00 51 00  5c 00 51 00              100.1.72       
                                              5d 00 51 00  5d 00 52 00              100.1.80       
                                              5e 00 52 00  5e 00 50 00              100.1.88       
                                              5f 00 51 00  5c 00 53 00              100.1.96       
                                              60 00 4f 00  5c 00 51 00              100.1.104      
                                              5c 00 4f 00  5f 00 50 00              100.1.112      
                                              5b 00 4f 00  5e 00 51 00              100.1.120      
                                              5e 00 51 00  5e 00 52 00              100.1.128      
                                              5c 00 51 00  5e 00 50 00              100.1.136      
                                              5e 00 50 00  5f 00 54 00              100.1.144      
                                              5e 00 50 00  5c 00 4f 00              100.1.152      
                                              5f 00 51 00  60 00 51 00              100.1.160      
                                              5e 00 50 00  5e 00 52 00              100.1.168      
                                              60 00 52 00  5e 00 52 00              100.1.176      
                                              5c 00 54 00  5c 00 52 00              100.1.184      
                                              5e 00 52 00  60 00 51 00              100.1.192      
  10.2                         524288  IN     53 00 5e 00  4e 00 5e 00   13ms       101.1.0        
                                              51 00 5e 00  50 00 5f 00              101.1.8        
                                              54 00 5f 00  51 00 5d 00              101.1.16       
                                              4f 00 5d 00  52 00 60 00              101.1.24       
                                              53 00 5f 00  51 00 60 00              101.1.32       
                                              51 00 5f 00  53 00 60 00              101.1.40       
                                              53 00 60 00  54 00 60 00              101.1.48       
                                              52 00 5f 00  51 00 5c 00              101.1.56       
                                              51 00 5f 00  52 00 60 00              101.1.64       
                                              52 00 60 00  51 00 5f 00              101.1.72       
                                              4f 00 5f 00  53 00 5e 00              101.1.80       
                                              53 00 5e 00  51 00 60 00              101.1.88       
                                              52 00 5e 00  54 00 5f 00              101.1.96       
                                              55 00 5c 00  52 00 5f 00              101.1.104      
                                              51 00 5f 00  51 00 5f 00              101.1.112      
                                              52 00 5e 00  53 00 60 00              101.1.120      
                                              54 00 5f 00  51 00 5e 00              101.1.128      
                                              51 00 5e 00  53 00 5f 00              101.1.136      
                                              53 00 61 00  4f 00 5e 00              101.1.144      
                                              53 00 5f 00  53 00 5e 00              101.1.152      
                                              51 00 60 00  54 00 60 00              101.1.160      
                                              51 00 5f 00  53 00 5f 00              101.1.168      
                                              52 00 5f 00  53 00 5f 00              101.1.176      
                                              53 00 61 00  54 00 5e 00              101.1.184      
                                              4f 00 5f 00  51 00 5f 00              101.1.192      
  10.2                         524288  IN     5e 00 53 00  5c 00 53 00   13ms       102.1.0        
                                              5e 00 53 00  60 00 52 00              102.1.8        
                                              60 00 54 00  5e 00 54 00              102.1.16       
                                              5e 00 51 00  60 00 53 00              102.1.24       
                                              5f 00 51 00  60 00 52 00              102.1.32       
                                              5e 00 50 00  60 00 53 00              102.1.40       
                                              60 00 53 00  5e 00 53 00              102.1.48       
                                              5f 00 51 00  5e 00 51 00              102.1.56       
                                              5f 00 55 00  5d 00 53 00              102.1.64       
                                              5e 00 53 00  60 00 51 00              102.1.72       
                                              61 00 52 00  61 00 54 00              102.1.80       
                                              5d 00 53 00  60 00 55 00              102.1.88       
                                              5d 00 55 00  62 00 51 00              102.1.96       
                                              5f 00 53 00  60 00 51 00              102.1.104      
                                              5f 00 55 00  5e 00 51 00              102.1.112      
                                              5e 00 51 00  5f 00 52 00              102.1.120      
                                              5f 00 53 00  60 00 50 00              102.1.128      
                                              5e 00 52 00  5d 00 54 00              102.1.136      
                                              5d 00 51 00  5d 00 53 00              102.1.144      
                                              5d 00 51 00  5e 00 53 00              102.1.152      
                                              5c 00 55 00  5e 00 51 00              102.1.160      
                                              5e 00 52 00  5e 00 51 00              102.1.168      
                                              5e 00 51 00  60 00 51 00              102.1.176      
                                              60 00 52 00  60 00 54 00              102.1.184      
                                              5e 00 51 00  5b 00 51 00              102.1.192      
  10.2                         524288  IN     52 00 5d 00  52 00 5d 00   12ms       103.1.0        
                                              51 00 5d 00  53 00 5d 00              103.1.8        
                                              53 00 5c 00  50 00 60 00              103.1.16       
                                              52 00 60 00  54 00 5f 00              103.1.24       
                                              51 00 5f 00  52 00 5c 00              103.1.32       
                                              53 00 5f 00  53 00 5f 00              103.1.40       
                                              51 00 5b 00  52 00 5f 00              103.1.48       
                                              51 00 5f 00  51 00 5f 00              103.1.56       
                                              4f 00 60 00  51 00 5e 00              103.1.64       
                                              52 00 5e 00  53 00 5f 00              103.1.72       
                                              53 00 5e 00  52 00 5e 00              103.1.80       
                                              52 00 61 00  52 00 5c 00              103.1.88       
                                              51 00 60 00  53 00 5f 00              103.1.96       
                                              54 00 5f 00  53 00 5d 00              103.1.104      
                                              51 00 5d 00  53 00 5f 00              103.1.112      
                                              51 00 60 00  53 00 5e 00              103.1.120      
                                              51 00 5e 00  51 00 60 00              103.1.128      
                                              53 00 5f 00  53 00 60 00              103.1.136      
                                              52 00 60 00  50 00 60 00              103.1.144      
                                              52 00 5e 00  51 00 5d 00              103.1.152      
                                              52 00 5e 00  51 00 5e 00              103.1.160      
                                              52 00 5f 00  51 00 60 00              103.1.168      
                                              51 00 5f 00  52 00 5c 00              103.1.176      
                                              52 00 5c 00  51 00 60 00              103.1.184      
                                              51 00 60 00  52 00 60 00              103.1.192      
  10.2                             31  IN     1a 00 00 00  01 00 02 00   40us       104.1.0        
                                              31 84 00 01  04 00 91 1e              104.1.8        
                                              00 00 01 01  04 00 00 00              104.1.16       
                                              00 00 00 55  aa 55 aa                 104.1.24       
  10.2                         524288  IN     60 00 55 00  60 00 54 00  249ms       105.1.0        
                                              5f 00 56 00  62 00 53 00              105.1.8        
                                              64 00 54 00  63 00 56 00              105.1.16       
                                              62 00 54 00  65 00 55 00              105.1.24       
                                              62 00 56 00  64 00 55 00              105.1.32       
                                              60 00 59 00  61 00 59 00              105.1.40       
                                              65 00 57 00  63 00 55 00              105.1.48       
                                              61 00 57 00  65 00 5b 00              105.1.56       
                                              65 00 56 00  62 00 56 00              105.1.64       
                                              65 00 5a 00  62 00 55 00              105.1.72       
                                              64 00 57 00  64 00 58 00              105.1.80       
                                              62 00 58 00  68 00 59 00              105.1.88       
                                              62 00 55 00  62 00 57 00              105.1.96       
                                              63 00 56 00  63 00 56 00              105.1.104      
                                              64 00 59 00  65 00 58 00              105.1.112      
                                              62 00 58 00  64 00 5a 00              105.1.120      
                                              64 00 58 00  63 00 55 00              105.1.128      
                                              64 00 57 00  63 00 57 00              105.1.136      
                                              62 00 57 00  64 00 5b 00              105.1.144      
                                              65 00 57 00  64 00 5b 00              105.1.152      
                                              64 00 59 00  64 00 57 00              105.1.160      
                                              5c 00 54 00  66 00 57 00              105.1.168      
                                              61 00 58 00  64 00 58 00              105.1.176      
                                              63 00 5a 00  66 00 57 00              105.1.184      
                                              64 00 56 00  64 00 55 00              105.1.192      
  10.2                         524288  IN     5e 00 54 00  5e 00 53 00   12ms       106.1.0        
                                              5f 00 54 00  5e 00 52 00              106.1.8        
                                              5f 00 52 00  60 00 51 00              106.1.16       
                                              5f 00 51 00  5f 00 54 00              106.1.24       
                                              60 00 51 00  5d 00 51 00              106.1.32       
                                              5f 00 51 00  60 00 51 00              106.1.40       
                                              61 00 53 00  5f 00 53 00              106.1.48       
                                              5e 00 4f 00  5c 00 55 00              106.1.56       
                                              5f 00 53 00  5d 00 52 00              106.1.64       
                                              5e 00 52 00  62 00 53 00              106.1.72       
                                              5e 00 52 00  5f 00 52 00              106.1.80       
                                              60 00 52 00  5c 00 53 00              106.1.88       
                                              5e 00 51 00  5e 00 53 00              106.1.96       
                                              60 00 52 00  5e 00 52 00              106.1.104      
                                              5d 00 51 00  5d 00 53 00              106.1.112      
                                              5f 00 51 00  5e 00 50 00              106.1.120      
                                              5e 00 52 00  5d 00 52 00              106.1.128      
                                              5e 00 51 00  60 00 51 00              106.1.136      
                                              5f 00 51 00  5d 00 53 00              106.1.144      
                                              5d 00 54 00  5e 00 50 00              106.1.152      
                                              5e 00 52 00  5f 00 52 00              106.1.160      
                                              61 00 51 00  5d 00 52 00              106.1.168      
                                              5f 00 54 00  5e 00 52 00              106.1.176      
                                              5e 00 52 00  5c 00 52 00              106.1.184      
                                              5e 00 4e 00  5e 00 55 00              106.1.192      
  10.2                         524288  IN     55 00 5c 00  53 00 5e 00   13ms       107.1.0        
                                              53 00 60 00  52 00 5f 00              107.1.8        
                                              51 00 5f 00  51 00 60 00              107.1.16       
                                              52 00 60 00  55 00 5e 00              107.1.24       
                                              51 00 5e 00  53 00 60 00              107.1.32       
                                              51 00 60 00  51 00 62 00              107.1.40       
                                              51 00 5e 00  53 00 5e 00              107.1.48       
                                              51 00 61 00  51 00 60 00              107.1.56       
                                              52 00 5e 00  51 00 60 00              107.1.64       
                                              51 00 5e 00  51 00 5d 00              107.1.72       
                                              51 00 60 00  53 00 5e 00              107.1.80       
                                              54 00 60 00  52 00 5f 00              107.1.88       
                                              53 00 5f 00  50 00 5e 00              107.1.96       
                                              53 00 5c 00  51 00 60 00              107.1.104      
                                              55 00 62 00  52 00 5e 00              107.1.112      
                                              53 00 60 00  52 00 62 00              107.1.120      
                                              51 00 5f 00  52 00 5e 00              107.1.128      
                                              53 00 60 00  50 00 60 00              107.1.136      
                                              52 00 5f 00  51 00 5f 00              107.1.144      
                                              54 00 5c 00  52 00 5c 00              107.1.152      
                                              52 00 5e 00  4f 00 5e 00              107.1.160      
                                              55 00 5c 00  51 00 5e 00              107.1.168      
                                              52 00 60 00  4f 00 5f 00              107.1.176      
                                              53 00 5d 00  52 00 5f 00              107.1.184      
                                              51 00 5e 00  51 00 60 00              107.1.192      
  10.2                         524288  IN     5f 00 53 00  5d 00 51 00   12ms       108.1.0        
                                              5f 00 53 00  60 00 52 00              108.1.8        
                                              5e 00 52 00  5e 00 51 00              108.1.16       
                                              5e 00 51 00  5c 00 52 00              108.1.24       
                                              5e 00 52 00  5d 00 53 00              108.1.32       
                                              5e 00 52 00  5e 00 4f 00              108.1.40       
                                              5c 00 53 00  5f 00 50 00              108.1.48       
                                              60 00 52 00  5c 00 51 00              108.1.56       
                                              5f 00 51 00  5d 00 52 00              108.1.64       
                                              5f 00 53 00  60 00 52 00              108.1.72       
                                              5e 00 53 00  5c 00 52 00              108.1.80       
                                              5e 00 52 00  5e 00 54 00              108.1.88       
                                              5e 00 54 00  5e 00 51 00              108.1.96       
                                              5e 00 53 00  61 00 4f 00              108.1.104      
                                              5d 00 53 00  5e 00 51 00              108.1.112      
                                              5d 00 54 00  5d 00 50 00              108.1.120      
                                              5f 00 53 00  60 00 50 00              108.1.128      
                                              5b 00 53 00  5f 00 54 00              108.1.136      
                                              60 00 52 00  5f 00 51 00              108.1.144      
                                              5c 00 51 00  5c 00 51 00              108.1.152      
                                              5d 00 51 00  5c 00 54 00              108.1.160      
                                              5e 00 50 00  5e 00 51 00              108.1.168      
                                              5e 00 52 00  5e 00 51 00              108.1.176      
                                              60 00 51 00  5c 00 53 00              108.1.184      
                                              5f 00 51 00  5e 00 51 00              108.1.192      
  10.2                         524288  IN     51 00 5e 00  52 00 5f 00   12ms       109.1.0        
                                              52 00 5f 00  4f 00 5c 00              109.1.8        
                                              52 00 5e 00  51 00 5f 00              109.1.16       
                                              50 00 5f 00  51 00 5e 00              109.1.24       
                                              51 00 5e 00  54 00 5e 00              109.1.32       
                                              52 00 5e 00  52 00 60 00              109.1.40       
                                              53 00 5e 00  50 00 60 00              109.1.48       
                                              52 00 5d 00  50 00 5e 00              109.1.56       
                                              52 00 5b 00  51 00 5d 00              109.1.64       
                                              51 00 60 00  51 00 5c 00              109.1.72       
                                              52 00 5d 00  53 00 5e 00              109.1.80       
                                              54 00 62 00  51 00 5c 00              109.1.88       
                                              53 00 5f 00  51 00 5f 00              109.1.96       
                                              52 00 5f 00  52 00 5e 00              109.1.104      
                                              51 00 5e 00  53 00 60 00              109.1.112      
                                              52 00 5f 00  51 00 5c 00              109.1.120      
                                              52 00 5e 00  51 00 5f 00              109.1.128      
                                              51 00 60 00  54 00 5f 00              109.1.136      
                                              54 00 5f 00  51 00 60 00              109.1.144      
                                              51 00 5c 00  50 00 5c 00              109.1.152      
                                              51 00 5d 00  53 00 5f 00              109.1.160      
                                              53 00 5f 00  54 00 61 00              109.1.168      
                                              51 00 5f 00  4f 00 60 00              109.1.176      
                                              4f 00 5d 00  51 00 5f 00              109.1.184      
                                              55 00 60 00  51 00 5f 00              109.1.192      
  10.2                             31  IN     1a 00 00 00  01 00 02 00   34us       110.1.0        
                                              31 84 00 01  04 00 92 1e              110.1.8        
                                              00 00 01 01  04 00 00 00              110.1.16       
                                              00 00 00 55  aa 55 aa                 110.1.24       
  10.2                         524288  IN     61 00 55 00  63 00 51 00  249ms       111.1.0        
                                              60 00 56 00  60 00 56 00              111.1.8        
                                              60 00 57 00  62 00 55 00              111.1.16       
                                              62 00 53 00  64 00 56 00              111.1.24       
                                              61 00 57 00  63 00 57 00              111.1.32       
                                              62 00 57 00  62 00 57 00              111.1.40       
                                              66 00 59 00  62 00 57 00              111.1.48       
                                              64 00 59 00  64 00 59 00              111.1.56       
                                              62 00 55 00  63 00 57 00              111.1.64       
                                              63 00 57 00  61 00 55 00              111.1.72       
                                              63 00 57 00  61 00 56 00              111.1.80       
                                              64 00 59 00  64 00 58 00              111.1.88       
                                              62 00 55 00  65 00 54 00              111.1.96       
                                              61 00 55 00  63 00 55 00              111.1.104      
                                              64 00 5a 00  65 00 55 00              111.1.112      
                                              63 00 56 00  64 00 58 00              111.1.120      
                                              63 00 59 00  63 00 56 00              111.1.128      
                                              5f 00 55 00  63 00 55 00              111.1.136      
                                              64 00 57 00  64 00 57 00              111.1.144      
                                              64 00 56 00  65 00 59 00              111.1.152      
                                              64 00 57 00  64 00 56 00              111.1.160      
                                              60 00 53 00  64 00 59 00              111.1.168      
                                              61 00 57 00  64 00 57 00              111.1.176      
                                              61 00 59 00  65 00 57 00              111.1.184      
                                              62 00 55 00  62 00 59 00              111.1.192      
  10.2                         524288  IN     60 00 52 00  5f 00 52 00   12ms       112.1.0        
                                              5c 00 52 00  5f 00 53 00              112.1.8        
                                              5f 00 55 00  5f 00 51 00              112.1.16       
                                              5e 00 53 00  60 00 53 00              112.1.24       
                                              5e 00 51 00  60 00 51 00              112.1.32       
                                              60 00 51 00  5f 00 51 00              112.1.40       
                                              5e 00 53 00  5c 00 53 00              112.1.48       
                                              5e 00 52 00  5e 00 50 00              112.1.56       
                                              5e 00 53 00  5e 00 52 00              112.1.64       
                                              5e 00 53 00  5d 00 53 00              112.1.72       
                                              60 00 52 00  5e 00 53 00              112.1.80       
                                              5d 00 53 00  5e 00 53 00              112.1.88       
                                              5d 00 53 00  5f 00 54 00              112.1.96       
                                              60 00 52 00  60 00 51 00              112.1.104      
                                              60 00 51 00  5f 00 51 00              112.1.112      
                                              5e 00 51 00  60 00 51 00              112.1.120      
                                              5f 00 51 00  5c 00 4f 00              112.1.128      
                                              60 00 51 00  60 00 53 00              112.1.136      
                                              5e 00 52 00  5e 00 52 00              112.1.144      
                                              5e 00 51 00  5e 00 51 00              112.1.152      
                                              60 00 53 00  5e 00 53 00              112.1.160      
                                              5f 00 51 00  5c 00 51 00              112.1.168      
                                              5f 00 53 00  5c 00 52 00              112.1.176      
                                              5e 00 53 00  5d 00 53 00              112.1.184      
                                              5c 00 50 00  60 00 54 00              112.1.192      
  10.2                         524288  IN     55 00 5c 00  51 00 60 00   13ms       113.1.0        
                                              53 00 5e 00  52 00 5f 00              113.1.8        
                                              54 00 5f 00  53 00 5d 00              113.1.16       
                                              4f 00 60 00  53 00 60 00              113.1.24       
                                              52 00 5f 00  53 00 60 00              113.1.32       
                                              53 00 60 00  55 00 60 00              113.1.40       
                                              51 00 60 00  51 00 61 00              113.1.48       
                                              54 00 60 00  55 00 5e 00              113.1.56       
                                              52 00 5c 00  52 00 63 00              113.1.64       
                                              51 00 5e 00  53 00 5e 00              113.1.72       
                                              51 00 5e 00  53 00 5d 00              113.1.80       
                                              52 00 61 00  52 00 5f 00              113.1.88       
                                              52 00 5e 00  54 00 5f 00              113.1.96       
                                              53 00 5e 00  55 00 60 00              113.1.104      
                                              53 00 5e 00  52 00 5c 00              113.1.112      
                                              51 00 5f 00  53 00 5f 00              113.1.120      
                                              55 00 5f 00  51 00 60 00              113.1.128      
                                              53 00 5f 00  53 00 5d 00              113.1.136      
                                              4f 00 5f 00  52 00 5e 00              113.1.144      
                                              53 00 62 00  54 00 5e 00              113.1.152      
                                              52 00 5d 00  53 00 5f 00              113.1.160      
                                              55 00 5d 00  50 00 5e 00              113.1.168      
                                              52 00 5e 00  50 00 5c 00              113.1.176      
                                              53 00 5e 00  51 00 5f 00              113.1.184      
                                              52 00 5e 00  51 00 5f 00              113.1.192      
  10.2                         524288  IN     5d 00 4f 00  5e 00 51 00   13ms       114.1.0        
                                              5c 00 55 00  60 00 51 00              114.1.8        
                                              5d 00 51 00  5d 00 52 00              114.1.16       
                                              5e 00 52 00  5d 00 51 00              114.1.24       
                                              5e 00 53 00  5c 00 51 00              114.1.32       
                                              5e 00 51 00  5e 00 53 00              114.1.40       
                                              5c 00 51 00  5d 00 52 00              114.1.48       
                                              5d 00 4f 00  5d 00 52 00              114.1.56       
                                              5e 00 51 00  5e 00 53 00              114.1.64       
                                              5c 00 53 00  5c 00 51 00              114.1.72       
                                              60 00 51 00  5f 00 51 00              114.1.80       
                                              5e 00 51 00  5d 00 51 00              114.1.88       
                                              5f 00 53 00  5e 00 51 00              114.1.96       
                                              5c 00 53 00  5f 00 50 00              114.1.104      
                                              5b 00 52 00  5d 00 52 00              114.1.112      
                                              5e 00 50 00  5e 00 51 00              114.1.120      
                                              5e 00 53 00  60 00 53 00              114.1.128      
                                              5d 00 52 00  5e 00 51 00              114.1.136      
                                              5e 00 51 00  5d 00 51 00              114.1.144      
                                              5e 00 51 00  5c 00 50 00              114.1.152      
                                              5e 00 51 00  5f 00 51 00              114.1.160      
                                              5f 00 4f 00  5e 00 51 00              114.1.168      
                                              5c 00 52 00  5c 00 4f 00              114.1.176      
                                              5f 00 53 00  5f 00 52 00              114.1.184      
                                              5d 00 52 00  5c 00 50 00              114.1.192      
  10.2                         524288  IN     54 00 60 00  53 00 5f 00   12ms       115.1.0        
                                              52 00 61 00  51 00 5d 00              115.1.8        
                                              53 00 5f 00  51 00 60 00              115.1.16       
                                              51 00 5e 00  53 00 5f 00              115.1.24       
                                              52 00 60 00  53 00 5e 00              115.1.32       
                                              53 00 5e 00  53 00 5f 00              115.1.40       
                                              51 00 5e 00  53 00 61 00              115.1.48       
                                              51 00 60 00  55 00 5e 00              115.1.56       
                                              51 00 5e 00  51 00 5e 00              115.1.64       
                                              51 00 60 00  51 00 5f 00              115.1.72       
                                              52 00 5e 00  51 00 5f 00              115.1.80       
                                              51 00 60 00  53 00 5f 00              115.1.88       
                                              53 00 5f 00  51 00 5c 00              115.1.96       
                                              52 00 5f 00  52 00 60 00              115.1.104      
                                              53 00 5f 00  51 00 5f 00              115.1.112      
                                              53 00 5e 00  51 00 5c 00              115.1.120      
                                              53 00 5f 00  53 00 61 00              115.1.128      
                                              54 00 61 00  55 00 5f 00              115.1.136      
                                              52 00 5f 00  51 00 5f 00              115.1.144      
                                              53 00 5d 00  55 00 5e 00              115.1.152      
                                              53 00 5e 00  52 00 5d 00              115.1.160      
                                              51 00 5f 00  50 00 60 00              115.1.168      
                                              54 00 5e 00  51 00 5e 00              115.1.176      
                                              52 00 5e 00  51 00 5e 00              115.1.184      
                                              52 00 62 00  52 00 5e 00              115.1.192      
  10.2                             31  IN     1a 00 00 00  01 00 02 00   40us       116.1.0        
                                              31 84 00 01  04 00 93 1e              116.1.8        
                                              00 00 01 01  04 00 00 00              116.1.16       
                                              00 00 00 55  aa 55 aa                 116.1.24       
  10.2                         524288  IN     5f 00 53 00  61 00 55 00  249ms       117.1.0        
                                              5f 00 55 00  63 00 54 00              117.1.8        
                                              63 00 54 00  61 00 56 00              117.1.16       
                                              61 00 53 00  64 00 54 00              117.1.24       
                                              61 00 56 00  65 00 56 00              117.1.32       
                                              61 00 55 00  63 00 58 00              117.1.40       
                                              66 00 58 00  61 00 55 00              117.1.48       
                                              62 00 57 00  64 00 5b 00              117.1.56       
                                              63 00 55 00  62 00 57 00              117.1.64       
                                              66 00 59 00  62 00 57 00              117.1.72       
                                              61 00 57 00  60 00 57 00              117.1.80       
                                              63 00 56 00  64 00 58 00              117.1.88       
                                              61 00 55 00  62 00 55 00              117.1.96       
                                              62 00 57 00  63 00 55 00              117.1.104      
                                              63 00 5a 00  64 00 58 00              117.1.112      
                                              61 00 57 00  64 00 55 00              117.1.120      
                                              63 00 57 00  66 00 56 00              117.1.128      
                                              62 00 58 00  60 00 57 00              117.1.136      
                                              63 00 56 00  62 00 5b 00              117.1.144      
                                              63 00 55 00  64 00 59 00              117.1.152      
                                              63 00 59 00  63 00 55 00              117.1.160      
                                              60 00 54 00  63 00 56 00              117.1.168      
                                              62 00 56 00  62 00 59 00              117.1.176      
                                              63 00 57 00  65 00 57 00              117.1.184      
                                              62 00 54 00  63 00 59 00              117.1.192      
  10.2                         524288  IN     5f 00 55 00  5e 00 51 00   13ms       118.1.0        
                                              5e 00 54 00  5d 00 53 00              118.1.8        
                                              60 00 55 00  60 00 53 00              118.1.16       
                                              5f 00 53 00  5e 00 53 00              118.1.24       
                                              5e 00 53 00  5e 00 53 00              118.1.32       
                                              5e 00 53 00  5f 00 51 00              118.1.40       
                                              5e 00 53 00  60 00 52 00              118.1.48       
                                              5f 00 53 00  5d 00 53 00              118.1.56       
                                              60 00 55 00  5f 00 53 00              118.1.64       
                                              5e 00 52 00  5f 00 51 00              118.1.72       
                                              60 00 52 00  5f 00 52 00              118.1.80       
                                              62 00 56 00  5e 00 53 00              118.1.88       
                                              60 00 52 00  5f 00 53 00              118.1.96       
                                              61 00 52 00  5c 00 50 00              118.1.104      
                                              5f 00 52 00  60 00 54 00              118.1.112      
                                              60 00 52 00  5c 00 50 00              118.1.120      
                                              5f 00 52 00  5f 00 53 00              118.1.128      
                                              5f 00 50 00  5f 00 51 00              118.1.136      
                                              5d 00 51 00  5e 00 54 00              118.1.144      
                                              5e 00 53 00  5c 00 51 00              118.1.152      
                                              60 00 53 00  5e 00 55 00              118.1.160      
                                              5e 00 50 00  5f 00 51 00              118.1.168      
                                              5f 00 53 00  5e 00 51 00              118.1.176      
                                              5b 00 52 00  5e 00 51 00              118.1.184      
                                              5e 00 52 00  5e 00 51 00              118.1.192      
  10.2                         524288  IN     55 00 5e 00  51 00 5e 00   13ms       119.1.0        
                                              52 00 5f 00  53 00 5e 00              119.1.8        
                                              50 00 5c 00  52 00 5e 00              119.1.16       
                                              50 00 5e 00  4f 00 5d 00              119.1.24       
                                              53 00 5e 00  51 00 61 00              119.1.32       
                                              50 00 5f 00  50 00 5f 00              119.1.40       
                                              50 00 5e 00  53 00 5e 00              119.1.48       
                                              55 00 60 00  53 00 5d 00              119.1.56       
                                              51 00 5c 00  54 00 5e 00              119.1.64       
                                              54 00 5e 00  50 00 5d 00              119.1.72       
                                              51 00 5e 00  52 00 5c 00              119.1.80       
                                              51 00 5e 00  51 00 5f 00              119.1.88       
                                              52 00 5d 00  50 00 5f 00              119.1.96       
                                              52 00 5f 00  50 00 5f 00              119.1.104      
                                              51 00 60 00  52 00 5f 00              119.1.112      
                                              51 00 5d 00  53 00 5d 00              119.1.120      
                                              52 00 5e 00  4f 00 60 00              119.1.128      
                                              51 00 5d 00  50 00 5d 00              119.1.136      
                                              51 00 60 00  53 00 5d 00              119.1.144      
                                              52 00 5e 00  53 00 5e 00              119.1.152      
                                              51 00 5c 00  50 00 5f 00              119.1.160      
                                              54 00 5d 00  53 00 5d 00              119.1.168      
                                              50 00 5f 00  51 00 5f 00              119.1.176      
                                              51 00 5e 00  52 00 5f 00              119.1.184      
                                              53 00 5e 00  53 00 5e 00              119.1.192      
  10.2                         524288  IN     5d 00 53 00  5f 00 53 00   13ms       120.1.0        
                                              5c 00 55 00  61 00 53 00              120.1.8        
                                              5d 00 53 00  5e 00 53 00              120.1.16       
                                              5c 00 53 00  5e 00 52 00              120.1.24       
                                              60 00 52 00  5f 00 55 00              120.1.32       
                                              5d 00 53 00  5c 00 50 00              120.1.40       
                                              60 00 53 00  5d 00 50 00              120.1.48       
                                              5e 00 55 00  5e 00 53 00              120.1.56       
                                              60 00 54 00  5d 00 52 00              120.1.64       
                                              60 00 53 00  5c 00 53 00              120.1.72       
                                              5c 00 52 00  5e 00 51 00              120.1.80       
                                              5c 00 52 00  5f 00 54 00              120.1.88       
                                              60 00 53 00  5f 00 51 00              120.1.96       
                                              61 00 53 00  5e 00 53 00              120.1.104      
                                              60 00 53 00  5e 00 52 00              120.1.112      
                                              5f 00 53 00  5f 00 51 00              120.1.120      
                                              5d 00 52 00  60 00 51 00              120.1.128      
                                              5e 00 51 00  5e 00 51 00              120.1.136      
                                              5e 00 52 00  5f 00 51 00              120.1.144      
                                              5c 00 4f 00  5e 00 54 00              120.1.152      
                                              5e 00 51 00  5f 00 51 00              120.1.160      
                                              5e 00 52 00  5e 00 52 00              120.1.168      
                                              5f 00 51 00  5f 00 52 00              120.1.176      
                                              60 00 52 00  5c 00 53 00              120.1.184      
                                              5e 00 50 00  5e 00 53 00              120.1.192      
  10.2                         524288  IN     54 00 5e 00  51 00 5e 00   12ms       121.1.0        
                                              54 00 60 00  53 00 5e 00              121.1.8        
                                              54 00 5d 00  53 00 5f 00              121.1.16       
                                              51 00 5c 00  52 00 60 00              121.1.24       
                                              53 00 60 00  52 00 5c 00              121.1.32       
                                              52 00 5e 00  54 00 60 00              121.1.40       
                                              53 00 5e 00  51 00 5d 00              121.1.48       
                                              52 00 5e 00  53 00 5e 00              121.1.56       
                                              50 00 5e 00  53 00 5f 00              121.1.64       
                                              52 00 60 00  54 00 5f 00              121.1.72       
                                              53 00 5e 00  55 00 5c 00              121.1.80       
                                              51 00 5d 00  53 00 5f 00              121.1.88       
                                              55 00 5d 00  54 00 5e 00              121.1.96       
                                              53 00 5e 00  53 00 5e 00              121.1.104      
                                              55 00 60 00  51 00 60 00              121.1.112      
                                              54 00 5e 00  52 00 5f 00              121.1.120      
                                              53 00 5f 00  53 00 60 00              121.1.128      
                                              54 00 5f 00  53 00 5c 00              121.1.136      
                                              52 00 64 00  52 00 60 00              121.1.144      
                                              53 00 5f 00  51 00 5f 00              121.1.152      
                                              53 00 5e 00  53 00 5d 00              121.1.160      
                                              51 00 5e 00  52 00 62 00              121.1.168      
                                              56 00 61 00  53 00 5f 00              121.1.176      
                                              51 00 5f 00  51 00 60 00              121.1.184      
                                              53 00 62 00  53 00 61 00              121.1.192      
  10.2                             31  IN     1a 00 00 00  01 00 02 00   40us       122.1.0        
                                              31 84 00 01  04 00 94 1e              122.1.8        
                                              00 00 01 01  04 00 00 00              122.1.16       
                                              00 00 00 55  aa 55 aa                 122.1.24       
  10.0                                 CTL    40 ce 00 00  04 07 04 00  159ms       123.1.0        
  10.0                              4  OUT    0d 00 00 00               2.0ms       123.2.0        
  10.0                                 CTL    c0 b4 00 00  00 00 01 00   66us       124.1.0(2)     
  10.0                              1  IN     54                         75us       124.2.0        
  10.2                         524288  IN     7c 00 6d 00  80 00 70 00   87ms       126.1.0        
                                              82 00 72 00  7e 00 70 00              126.1.8        
                                              82 00 71 00  82 00 73 00              126.1.16       
                                              84 00 6f 00  85 00 72 00              126.1.24       
                                              80 00 75 00  83 00 76 00              126.1.32       
                                              7e 00 74 00  84 00 76 00              126.1.40       
                                              87 00 73 00  81 00 71 00              126.1.48       
                                              86 00 75 00  84 00 7b 00              126.1.56       
                                              84 00 71 00  83 00 73 00              126.1.64       
                                              87 00 74 00  82 00 73 00              126.1.72       
                                              84 00 77 00  84 00 71 00              126.1.80       
                                              81 00 73 00  87 00 78 00              126.1.88       
                                              7f 00 71 00  84 00 71 00              126.1.96       
                                              83 00 73 00  83 00 72 00              126.1.104      
                                              85 00 78 00  85 00 71 00              126.1.112      
                                              86 00 73 00  86 00 77 00              126.1.120      
                                              84 00 76 00  84 00 71 00              126.1.128      
                                              80 00 71 00  84 00 72 00              126.1.136      
                                              84 00 75 00  84 00 7d 00              126.1.144      
                                              86 00 75 00  88 00 78 00              126.1.152      
                                              86 00 73 00  84 00 71 00              126.1.160      
                                              7e 00 6f 00  88 00 77 00              126.1.168      
                                              80 00 73 00  86 00 74 00              126.1.176      
                                              84 00 75 00  87 00 77 00              126.1.184      
                                              83 00 71 00  84 00 73 00              126.1.192      
  10.2                         524288  IN     7d 00 6c 00  7b 00 70 00   12ms       127.1.0        
                                              7c 00 6d 00  7e 00 6b 00              127.1.8        
                                              7c 00 6d 00  7f 00 6b 00              127.1.16       
                                              7a 00 6d 00  7b 00 6c 00              127.1.24       
                                              7d 00 6d 00  7d 00 6a 00              127.1.32       
                                              7d 00 6d 00  7d 00 67 00              127.1.40       
                                              7d 00 6d 00  7b 00 6d 00              127.1.48       
                                              7d 00 6b 00  7b 00 6c 00              127.1.56       
                                              7b 00 6a 00  7c 00 6d 00              127.1.64       
                                              7a 00 6b 00  7a 00 6a 00              127.1.72       
                                              7e 00 6c 00  78 00 6b 00              127.1.80       
                                              78 00 6f 00  7a 00 6f 00              127.1.88       
                                              7c 00 6b 00  7a 00 6b 00              127.1.96       
                                              7b 00 6c 00  7b 00 6d 00              127.1.104      
                                              7f 00 67 00  7d 00 6c 00              127.1.112      
                                              7a 00 6b 00  7b 00 6c 00              127.1.120      
                                              7c 00 6c 00  7e 00 6e 00              127.1.128      
                                              7b 00 6d 00  7e 00 6b 00              127.1.136      
                                              7d 00 6a 00  7d 00 70 00              127.1.144      
                                              7b 00 6a 00  7b 00 6b 00              127.1.152      
                                              7b 00 6a 00  7b 00 6c 00              127.1.160      
                                              7b 00 6b 00  78 00 69 00              127.1.168      
                                              7c 00 6b 00  7c 00 6a 00              127.1.176      
                                              79 00 69 00  7a 00 6b 00              127.1.184      
                                              7c 00 6a 00  7c 00 6c 00              127.1.192      
  10.2                         524288  IN     75 00 7a 00  6b 00 7d 00   13ms       128.1.0        
                                              6a 00 7d 00  66 00 7b 00              128.1.8        
                                              68 00 7e 00  6a 00 7a 00              128.1.16       
                                              67 00 7c 00  6f 00 7d 00              128.1.24       
                                              6a 00 7e 00  70 00 7b 00              128.1.32       
                                              6b 00 7a 00  6b 00 7e 00              128.1.40       
                                              6d 00 7d 00  6d 00 81 00              128.1.48       
                                              6c 00 7f 00  6c 00 7c 00              128.1.56       
                                              6b 00 7c 00  6d 00 7d 00              128.1.64       
                                              6d 00 7c 00  6b 00 80 00              128.1.72       
                                              69 00 7a 00  6c 00 7a 00              128.1.80       
                                              6d 00 7c 00  6b 00 7f 00              128.1.88       
                                              6a 00 7a 00  6f 00 7a 00              128.1.96       
                                              6f 00 7d 00  6b 00 7b 00              128.1.104      
                                              6d 00 7e 00  6c 00 7b 00              128.1.112      
                                              6b 00 7b 00  6d 00 7a 00              128.1.120      
                                              6a 00 7a 00  6e 00 7f 00              128.1.128      
                                              6a 00 78 00  6d 00 7d 00              128.1.136      
                                              69 00 7b 00  6b 00 7e 00              128.1.144      
                                              69 00 7c 00  6c 00 7b 00              128.1.152      
                                              67 00 79 00  69 00 79 00              128.1.160      
                                              6b 00 7c 00  6a 00 78 00              128.1.168      
                                              6b 00 7c 00  6b 00 7a 00              128.1.176      
                                              6b 00 80 00  6d 00 7c 00              128.1.184      
                                              70 00 7a 00  6c 00 7e 00              128.1.192      
  10.2                         524288  IN     78 00 6b 00  7c 00 6a 00   13ms       129.1.0        
                                              7c 00 6e 00  7f 00 6e 00              129.1.8        
                                              7c 00 6e 00  7d 00 69 00              129.1.16       
                                              7b 00 6c 00  7a 00 69 00              129.1.24       
                                              7c 00 6e 00  7f 00 6c 00              129.1.32       
                                              7c 00 6d 00  7e 00 6b 00              129.1.40       
                                              82 00 6d 00  7c 00 6a 00              129.1.48       
                                              7f 00 6c 00  79 00 6a 00              129.1.56       
                                              7c 00 6f 00  7c 00 6a 00              129.1.64       
                                              7c 00 6c 00  7e 00 69 00              129.1.72       
                                              7b 00 6e 00  78 00 6b 00              129.1.80       
                                              7a 00 6b 00  7e 00 6c 00              129.1.88       
                                              7b 00 6c 00  7b 00 6f 00              129.1.96       
                                              7c 00 6d 00  7e 00 6c 00              129.1.104      
                                              7f 00 70 00  7b 00 6b 00              129.1.112      
                                              7a 00 6b 00  7e 00 6d 00              129.1.120      
                                              7e 00 6c 00  7c 00 6a 00              129.1.128      
                                              7a 00 6b 00  7c 00 6c 00              129.1.136      
                                              7d 00 69 00  7f 00 6c 00              129.1.144      
                                              7b 00 6e 00  7c 00 6a 00              129.1.152      
                                              7b 00 6c 00  7a 00 6a 00              129.1.160      
                                              7c 00 6b 00  7a 00 6f 00              129.1.168      
                                              7c 00 6d 00  7d 00 6d 00              129.1.176      
                                              7f 00 6b 00  7b 00 6b 00              129.1.184      
                                              7c 00 6c 00  7c 00 6c 00              129.1.192      
  10.2                         524288  IN     67 00 7f 00  6a 00 7d 00   14ms       130.1.0        
                                              6a 00 7e 00  67 00 7c 00              130.1.8        
                                              6f 00 79 00  6f 00 7a 00              130.1.16       
                                              6a 00 7b 00  6d 00 7c 00              130.1.24       
                                              6c 00 7c 00  6d 00 7b 00              130.1.32       
                                              6d 00 7b 00  6e 00 7c 00              130.1.40       
                                              69 00 7d 00  6a 00 7a 00              130.1.48       
                                              69 00 7e 00  6c 00 7a 00              130.1.56       
                                              67 00 7a 00  6d 00 7a 00              130.1.64       
                                              6d 00 7a 00  6c 00 7e 00              130.1.72       
                                              6c 00 7a 00  70 00 7a 00              130.1.80       
                                              6f 00 7e 00  6d 00 7c 00              130.1.88       
                                              6b 00 7e 00  6e 00 79 00              130.1.96       
                                              6e 00 7e 00  69 00 7e 00              130.1.104      
                                              6d 00 7f 00  6e 00 7e 00              130.1.112      
                                              70 00 7e 00  6b 00 7c 00              130.1.120      
                                              6b 00 7e 00  6c 00 7e 00              130.1.128      
                                              6f 00 7c 00  6c 00 7f 00              130.1.136      
                                              6c 00 7f 00  6b 00 7d 00              130.1.144      
                                              6a 00 7e 00  6e 00 7d 00              130.1.152      
                                              6f 00 7f 00  6c 00 7e 00              130.1.160      
                                              6d 00 80 00  6d 00 80 00              130.1.168      
                                              6f 00 7f 00  67 00 7e 00              130.1.176      
                                              69 00 80 00  6d 00 7f 00              130.1.184      
                                              6c 00 7e 00  6d 00 7e 00              130.1.192      
  10.2                             31  IN     1a 00 00 00  01 00 02 00   52us       131.1.0        
                                              31 84 00 01  04 00 95 1e              131.1.8        
                                              00 00 01 01  04 00 00 00              131.1.16       
                                              00 00 00 55  aa 55 aa                 131.1.24       
  10.0                                 CTL    80 06 00 01  00 00 12 00   91ms       132.1.0        
  10.0                             18  IN     12 01 00 02  00 00 00 40   79us       132.2.0        
                                              48 44 70 56  40 1b 01 02              132.2.8        
                                              00 01                                 132.2.16       
  10.0                                 CTL    80 06 00 03  00 00 02 00   27us       133.1.0        
  10.0                              2  IN     04 03                      61us       133.2.0        
  10.0                                 CTL    80 06 00 03  00 00 04 00   13us       134.1.0        
  10.0                              4  IN     04 03 09 04                65us       134.2.0        
  10.0                                 CTL    80 06 01 03  09 04 02 00   20us       135.1.0        
  10.0                              2  IN     06 03                      97us       135.2.0        
  10.0                                 CTL    80 06 01 03  09 04 06 00   12us       136.1.0        
  10.0                              6  IN     06 03 54 00  33 00        105us       136.2.0        
  10.0                                 CTL    80 06 02 03  09 04 02 00    9us       137.1.0        
  10.0                              2  IN     1a 03                      69us       137.2.0        
  10.0                                 CTL    80 06 02 03  09 04 1a 00   10us       138.1.0        
  10.0                             26  IN     1a 03 52 00  48 00 31 00   73us       138.2.0        
                                              30 00 31 00  35 00 30 00              138.2.8        
                                              30 00 35 00  30 00 32 00              138.2.16       
                                              31 00                                 138.2.24       
  10.0                                 CTL    80 06 00 03  09 04 02 00   11us       139.1.0        
  10.0                              2  IN     04 03                      43us       139.2.0        
  10.0                                 CTL    80 06 00 03  09 04 04 00    9us       140.1.0        
  10.0                              4  IN     04 03 09 04                44us       140.2.0        
  10.0                                 CTL    80 06 02 03  09 04 02 00  571us       141.1.0        
  10.0                              2  IN     1a 03                      70us       141.2.0        
  10.0                                 CTL    80 06 02 03  09 04 1a 00   10us       142.1.0        
  10.0                             26  IN     1a 03 52 00  48 00 31 00   70us       142.2.0        
                                              30 00 31 00  35 00 30 00              142.2.8        
                                              30 00 35 00  30 00 32 00              142.2.16       
                                              31 00                                 142.2.24       
  10.0                                 CTL    80 06 01 03  00 00 20 00  142us       143.1.0        
  10.0                              6  IN     06 03 54 00  33 00        115us       143.2.0        
  10.0                                 CTL    c0 e1 00 00  00 00 04 00   54us       144.1.0        
  10.0                              4  IN     03 0b 00 00               1.5ms       144.2.0        
  10.0                                 CTL    c0 b4 00 00  00 00 01 00   44us       145.1.0(2)     
  10.0                              1  IN     54                         81us       145.2.0        
  10.0                                 CTL    c0 e1 00 00  04 00 40 00  147us       147.1.0        
  10.0                             64  IN     00 00 00 00  01 01 00 00  5.5ms       147.2.0        
                                              0f 44 61 68  65 6e 67 20              147.2.8        
                                              49 6d 61 67  69 6e 67 00              147.2.16       
                                              20 00 00 00  01 01 00 00              147.2.24       
                                              0f 4d 45 52  2d 31 33 30              147.2.32       
                                              2d 33 30 55  4d 2d 4c 00              147.2.40       
                                              80 00 00 00  01 01 00 00              147.2.48       
                                              0d 52 48 31  30 31 35 30              147.2.56       
  10.0                                 CTL    c0 b4 00 00  00 00 01 00   50us       148.1.0(2)     
  10.0                              1  IN     54                         86us       148.2.0        
  10.0                                 CTL    c0 e1 00 00  44 00 40 00  119us       150.1.0        
  10.0                             64  IN     30 35 30 32  31 00 90 00  4.0ms       150.2.0        
                                              00 00 01 01  00 00 03 36              150.2.8        
                                              37 00 04 01  00 00 01 01              150.2.16       
                                              00 00 0a 31  32 33 34 56              150.2.24       
                                              33 32 30 33  00 14 01 00              150.2.32       
                                              00 01 01 00  00 0e 31 2e              150.2.40       
                                              31 2e 31 33  30 35 2e 39              150.2.48       
                                              33 30 31 00  00 02 00 00              150.2.56       
  10.0                                 CTL    c0 b4 00 00  00 00 01 00   48us       151.1.0(2)     
  10.0                              1  IN     54                         77us       151.2.0        
  10.0                                 CTL    80 06 02 03  00 00 20 00  243us       153.1.0        
  10.0                             26  IN     1a 03 52 00  48 00 31 00   62us       153.2.0        
                                              30 00 31 00  35 00 30 00              153.2.8        
                                              30 00 35 00  30 00 32 00              153.2.16       
                                              31 00                                 153.2.24       
  10.0                                 CTL    80 06 00 01  00 00 12 00  716us       154.1.0        
  10.0                             18  IN     12 01 00 02  00 00 00 40   51us       154.2.0        
                                              48 44 70 56  40 1b 01 02              154.2.8        
                                              00 01                                 154.2.16       
  10.0                                 CTL    80 06 00 03  00 00 02 00   18us       155.1.0        
  10.0                              2  IN     04 03                      80us       155.2.0        
  10.0                                 CTL    80 06 00 03  00 00 04 00   11us       156.1.0        
  10.0                              4  IN     04 03 09 04                42us       156.2.0        
  10.0                                 CTL    80 06 01 03  09 04 02 00   35us       157.1.0        
  10.0                              2  IN     06 03                      71us       157.2.0        
  10.0                                 CTL    80 06 01 03  09 04 06 00   10us       158.1.0        
  10.0                              6  IN     06 03 54 00  33 00         65us       158.2.0        
  10.0                                 CTL    80 06 02 03  09 04 02 00   12us       159.1.0        
  10.0                              2  IN     1a 03                      79us       159.2.0        
  10.0                                 CTL    80 06 02 03  09 04 1a 00   16us       160.1.0        
  10.0                             26  IN     1a 03 52 00  48 00 31 00   83us       160.2.0        
                                              30 00 31 00  35 00 30 00              160.2.8        
                                              30 00 35 00  30 00 32 00              160.2.16       
                                              31 00                                 160.2.24       
  10.0                                 CTL    80 06 00 03  09 04 02 00   12us       161.1.0        
  10.0                              2  IN     04 03                      73us       161.2.0        
  10.0                                 CTL    80 06 00 03  09 04 04 00   11us       162.1.0        
  10.0                              4  IN     04 03 09 04                64us       162.2.0        
  10.0                                 CTL    80 06 02 03  09 04 02 00  550us       163.1.0        
  10.0                              2  IN     1a 03                      77us       163.2.0        
  10.0                                 CTL    80 06 02 03  09 04 1a 00   12us       164.1.0        
  10.0                             26  IN     1a 03 52 00  48 00 31 00   76us       164.2.0        
                                              30 00 31 00  35 00 30 00              164.2.8        
                                              30 00 35 00  30 00 32 00              164.2.16       
                                              31 00                                 164.2.24       
  10.0                                 CTL    80 06 01 03  00 00 20 00  167us       165.1.0        
  10.0                              6  IN     06 03 54 00  33 00         82us       165.2.0        
  10.0                                 CTL    c0 e1 00 00  00 00 04 00   21us       166.1.0        
  10.0                              4  IN     03 0b 00 00               1.5ms       166.2.0        
  10.0                                 CTL    c0 b4 00 00  00 00 01 00   23us       167.1.0(2)     
  10.0                              1  IN     54                         79us       167.2.0        
  10.0                                 CTL    c0 e1 00 00  04 00 40 00  128us       169.1.0        
  10.0                             64  IN     00 00 00 00  01 01 00 00  4.0ms       169.2.0        
                                              0f 44 61 68  65 6e 67 20              169.2.8        
                                              49 6d 61 67  69 6e 67 00              169.2.16       
                                              20 00 00 00  01 01 00 00              169.2.24       
                                              0f 4d 45 52  2d 31 33 30              169.2.32       
                                              2d 33 30 55  4d 2d 4c 00              169.2.40       
                                              80 00 00 00  01 01 00 00              169.2.48       
                                              0d 52 48 31  30 31 35 30              169.2.56       
  10.0                                 CTL    c0 b4 00 00  00 00 01 00   34us       170.1.0(2)     
  10.0                              1  IN     54                         76us       170.2.0        
  10.0                                 CTL    c0 e1 00 00  44 00 40 00  151us       172.1.0        
  10.0                             64  IN     30 35 30 32  31 00 90 00  4.0ms       172.2.0        
                                              00 00 01 01  00 00 03 36              172.2.8        
                                              37 00 04 01  00 00 01 01              172.2.16       
                                              00 00 0a 31  32 33 34 56              172.2.24       
                                              33 32 30 33  00 14 01 00              172.2.32       
                                              00 01 01 00  00 0e 31 2e              172.2.40       
                                              31 2e 31 33  30 35 2e 39              172.2.48       
                                              33 30 31 00  00 02 00 00              172.2.56       
  10.0                                 CTL    c0 b4 00 00  00 00 01 00   36us       173.1.0(2)     
  10.0                              1  IN     54                         82us       173.2.0        
  10.0                                 CTL    80 06 02 03  00 00 20 00  160us       175.1.0        
  10.0                             26  IN     1a 03 52 00  48 00 31 00  1.8ms       175.2.0        
                                              30 00 31 00  35 00 30 00              175.2.8        
                                              30 00 35 00  30 00 32 00              175.2.16       
                                              31 00                                 175.2.24       
  10.2                         524288  IN     7f 00 6d 00  80 00 6e 00  128ms       176.1.0        
                                              7e 00 73 00  82 00 6f 00              176.1.8        
                                              84 00 6f 00  81 00 73 00              176.1.16       
                                              82 00 70 00  85 00 6f 00              176.1.24       
                                              7e 00 75 00  82 00 72 00              176.1.32       
                                              81 00 73 00  82 00 74 00              176.1.40       
                                              88 00 70 00  81 00 73 00              176.1.48       
                                              82 00 73 00  84 00 79 00              176.1.56       
                                              84 00 71 00  83 00 71 00              176.1.64       
                                              86 00 75 00  82 00 74 00              176.1.72       
                                              84 00 72 00  7f 00 73 00              176.1.80       
                                              81 00 72 00  84 00 73 00              176.1.88       
                                              7d 00 6f 00  83 00 6f 00              176.1.96       
                                              84 00 73 00  84 00 70 00              176.1.104      
                                              84 00 78 00  86 00 6f 00              176.1.112      
                                              81 00 73 00  85 00 72 00              176.1.120      
                                              84 00 76 00  85 00 6c 00              176.1.128      
                                              81 00 71 00  85 00 72 00              176.1.136      
                                              82 00 77 00  84 00 7a 00              176.1.144      
                                              84 00 76 00  88 00 74 00              176.1.152      
                                              84 00 73 00  83 00 70 00              176.1.160      
                                              7c 00 70 00  85 00 78 00              176.1.168      
                                              83 00 72 00  87 00 75 00              176.1.176      
                                              86 00 75 00  88 00 74 00              176.1.184      
                                              83 00 73 00  83 00 76 00              176.1.192      
  10.2                         524288  IN     78 00 6b 00  7f 00 6b 00   12ms       177.1.0        
                                              78 00 6e 00  7c 00 69 00              177.1.8        
                                              7d 00 70 00  7c 00 6a 00              177.1.16       
                                              7c 00 6b 00  7c 00 6b 00              177.1.24       
                                              7f 00 6b 00  7a 00 6a 00              177.1.32       
                                              79 00 6d 00  7d 00 6c 00              177.1.40       
                                              79 00 6a 00  7b 00 6c 00              177.1.48       
                                              7d 00 6c 00  7a 00 6d 00              177.1.56       
                                              7c 00 6d 00  78 00 69 00              177.1.64       
                                              78 00 69 00  78 00 6d 00              177.1.72       
                                              7b 00 6a 00  79 00 6b 00              177.1.80       
                                              79 00 6c 00  7d 00 6b 00              177.1.88       
                                              78 00 6b 00  78 00 6d 00              177.1.96       
                                              7f 00 69 00  79 00 69 00              177.1.104      
                                              7b 00 65 00  7f 00 69 00              177.1.112      
                                              7c 00 67 00  78 00 6a 00              177.1.120      
                                              7c 00 6a 00  7b 00 6a 00              177.1.128      
                                              7a 00 6a 00  7c 00 68 00              177.1.136      
                                              7e 00 66 00  79 00 6a 00              177.1.144      
                                              7c 00 68 00  79 00 6b 00              177.1.152      
                                              7b 00 6b 00  7a 00 6a 00              177.1.160      
                                              7d 00 68 00  78 00 6b 00              177.1.168      
                                              7b 00 6a 00  7a 00 6c 00              177.1.176      
                                              7a 00 6b 00  77 00 69 00              177.1.184      
                                              79 00 67 00  77 00 6d 00              177.1.192      
  10.2                         524288  IN     71 00 79 00  6c 00 7a 00   12ms       178.1.0        
                                              6d 00 7c 00  69 00 82 00              178.1.8        
                                              6a 00 7e 00  6f 00 7e 00              178.1.16       
                                              69 00 7c 00  6c 00 7b 00              178.1.24       
                                              6a 00 7e 00  6c 00 7c 00              178.1.32       
                                              67 00 7c 00  6a 00 7c 00              178.1.40       
                                              6f 00 7b 00  67 00 7e 00              178.1.48       
                                              6f 00 7f 00  6f 00 7c 00              178.1.56       
                                              6b 00 7a 00  6a 00 7e 00              178.1.64       
                                              6c 00 7d 00  6c 00 7c 00              178.1.72       
                                              67 00 7b 00  6b 00 7c 00              178.1.80       
                                              6c 00 7e 00  6f 00 7f 00              178.1.88       
                                              69 00 7d 00  6b 00 7a 00              178.1.96       
                                              6f 00 7c 00  6b 00 7a 00              178.1.104      
                                              70 00 7c 00  6e 00 7a 00              178.1.112      
                                              6a 00 7b 00  6c 00 7c 00              178.1.120      
                                              6b 00 7c 00  69 00 7c 00              178.1.128      
                                              6b 00 7f 00  6d 00 7c 00              178.1.136      
                                              69 00 7e 00  6b 00 7b 00              178.1.144      
                                              6c 00 7b 00  6b 00 7a 00              178.1.152      
                                              6d 00 7b 00  6b 00 7c 00              178.1.160      
                                              6b 00 7c 00  6b 00 7d 00              178.1.168      
                                              67 00 7b 00  6d 00 7c 00              178.1.176      
                                              6d 00 7a 00  6d 00 7c 00              178.1.184      
                                              6d 00 7f 00  6b 00 7a 00              178.1.192      
  10.2                         524288  IN     7a 00 6d 00  7b 00 6b 00   13ms       179.1.0        
                                              7e 00 6f 00  7c 00 6f 00              179.1.8        
                                              80 00 6f 00  7b 00 71 00              179.1.16       
                                              7b 00 6e 00  7b 00 6d 00              179.1.24       
                                              7c 00 6f 00  7c 00 6d 00              179.1.32       
                                              7f 00 6f 00  7b 00 6d 00              179.1.40       
                                              7a 00 6f 00  7e 00 6d 00              179.1.48       
                                              7c 00 6d 00  7b 00 6d 00              179.1.56       
                                              80 00 6d 00  7c 00 6b 00              179.1.64       
                                              7b 00 6f 00  7c 00 6d 00              179.1.72       
                                              7f 00 6e 00  7c 00 6a 00              179.1.80       
                                              7b 00 6f 00  7a 00 6b 00              179.1.88       
                                              7c 00 6f 00  7f 00 6c 00              179.1.96       
                                              7f 00 6f 00  7c 00 6f 00              179.1.104      
                                              7b 00 6b 00  7d 00 6d 00              179.1.112      
                                              7e 00 6c 00  7e 00 6d 00              179.1.120      
                                              7c 00 6f 00  7f 00 69 00              179.1.128      
                                              7c 00 6e 00  7c 00 70 00              179.1.136      
                                              7b 00 6d 00  81 00 6d 00              179.1.144      
                                              7d 00 6b 00  7a 00 6c 00              179.1.152      
                                              7c 00 6d 00  7d 00 6d 00              179.1.160      
                                              80 00 6d 00  7c 00 6e 00              179.1.168      
                                              7e 00 6e 00  7c 00 6e 00              179.1.176      
                                              7f 00 6d 00  7e 00 6f 00              179.1.184      
                                              7e 00 6b 00  7c 00 70 00              179.1.192      
  10.2                         524288  IN     6c 00 7c 00  69 00 7c 00   12ms       180.1.0        
                                              6b 00 7e 00  67 00 7c 00              180.1.8        
                                              6d 00 7c 00  6d 00 78 00              180.1.16       
                                              6d 00 7c 00  6e 00 7a 00              180.1.24       
                                              6b 00 7c 00  6a 00 7b 00              180.1.32       
                                              6d 00 7c 00  6d 00 7a 00              180.1.40       
                                              6b 00 7c 00  6d 00 7c 00              180.1.48       
                                              6e 00 7a 00  6a 00 7c 00              180.1.56       
                                              6b 00 7b 00  6c 00 7b 00              180.1.64       
                                              6a 00 7a 00  6d 00 79 00              180.1.72       
                                              6f 00 7a 00  6d 00 7a 00              180.1.80       
                                              6d 00 7c 00  6f 00 7e 00              180.1.88       
                                              6f 00 80 00  6d 00 7d 00              180.1.96       
                                              6b 00 7f 00  6a 00 80 00              180.1.104      
                                              6f 00 7c 00  6e 00 7b 00              180.1.112      
                                              6b 00 7c 00  6d 00 7d 00              180.1.120      
                                              6d 00 7a 00  6d 00 7f 00              180.1.128      
                                              70 00 7c 00  69 00 7c 00              180.1.136      
                                              6a 00 80 00  6d 00 82 00              180.1.144      
                                              6a 00 7b 00  6b 00 7a 00              180.1.152      
                                              69 00 7c 00  6b 00 7e 00              180.1.160      
                                              6c 00 7e 00  6d 00 84 00              180.1.168      
                                              6e 00 7c 00  69 00 7c 00              180.1.176      
                                              6e 00 7c 00  6c 00 7e 00              180.1.184      
                                              6b 00 80 00  6b 00 7d 00              180.1.192      
  10.2                             31  IN     1a 00 00 00  01 00 02 00   44us       181.1.0        
                                              31 84 00 01  04 00 96 1e              181.1.8        
                                              00 00 01 01  04 00 00 00              181.1.16       
                                              00 00 00 55  aa 55 aa                 181.1.24       
  10.2                         524288  IN     7e 00 72 00  84 00 6f 00  249ms       182.1.0        
                                              7e 00 74 00  80 00 70 00              182.1.8        
                                              83 00 6f 00  7f 00 77 00              182.1.16       
                                              83 00 6f 00  84 00 72 00              182.1.24       
                                              7c 00 75 00  81 00 72 00              182.1.32       
                                              83 00 71 00  83 00 76 00              182.1.40       
                                              87 00 77 00  83 00 71 00              182.1.48       
                                              83 00 73 00  83 00 79 00              182.1.56       
                                              80 00 71 00  84 00 77 00              182.1.64       
                                              83 00 75 00  7e 00 72 00              182.1.72       
                                              88 00 75 00  82 00 73 00              182.1.80       
                                              84 00 73 00  84 00 76 00              182.1.88       
                                              81 00 74 00  86 00 71 00              182.1.96       
                                              83 00 74 00  84 00 73 00              182.1.104      
                                              86 00 79 00  86 00 75 00              182.1.112      
                                              87 00 75 00  86 00 72 00              182.1.120      
                                              88 00 78 00  85 00 6f 00              182.1.128      
                                              82 00 72 00  82 00 77 00              182.1.136      
                                              83 00 75 00  81 00 77 00              182.1.144      
                                              85 00 75 00  83 00 78 00              182.1.152      
                                              87 00 72 00  88 00 70 00              182.1.160      
                                              82 00 74 00  88 00 76 00              182.1.168      
                                              83 00 75 00  88 00 71 00              182.1.176      
                                              84 00 78 00  8a 00 75 00              182.1.184      
                                              85 00 75 00  88 00 72 00              182.1.192      
  10.2                         524288  IN     7b 00 6c 00  7a 00 69 00   13ms       183.1.0        
                                              7a 00 69 00  7c 00 6c 00              183.1.8        
                                              7b 00 6e 00  7b 00 69 00              183.1.16       
                                              7b 00 69 00  7a 00 6d 00              183.1.24       
                                              7c 00 67 00  7a 00 6b 00              183.1.32       
                                              7d 00 6b 00  7a 00 69 00              183.1.40       
                                              78 00 6b 00  78 00 69 00              183.1.48       
                                              7d 00 6b 00  78 00 6b 00              183.1.56       
                                              7a 00 6d 00  7b 00 6d 00              183.1.64       
                                              7c 00 69 00  79 00 6d 00              183.1.72       
                                              7a 00 6b 00  7c 00 6c 00              183.1.80       
                                              7a 00 6c 00  7b 00 6d 00              183.1.88       
                                              7b 00 6b 00  78 00 6b 00              183.1.96       
                                              7a 00 6c 00  7c 00 6b 00              183.1.104      
                                              7a 00 68 00  7c 00 67 00              183.1.112      
                                              7b 00 68 00  7c 00 6d 00              183.1.120      
                                              7a 00 6c 00  7c 00 6a 00              183.1.128      
                                              7d 00 6c 00  79 00 68 00              183.1.136      
                                              79 00 69 00  78 00 6c 00              183.1.144      
                                              78 00 6e 00  78 00 69 00              183.1.152      
                                              7b 00 69 00  7b 00 6c 00              183.1.160      
                                              7b 00 6c 00  76 00 69 00              183.1.168      
                                              79 00 6b 00  79 00 6b 00              183.1.176      
                                              77 00 67 00  7a 00 67 00              183.1.184      
                                              7b 00 67 00  7c 00 6e 00              183.1.192      
  10.2                         524288  IN     71 00 7c 00  6a 00 7c 00   12ms       184.1.0        
                                              6d 00 7e 00  68 00 7c 00              184.1.8        
                                              6e 00 82 00  6e 00 7f 00              184.1.16       
                                              6a 00 7d 00  6b 00 7e 00              184.1.24       
                                              69 00 7e 00  6c 00 7b 00              184.1.32       
                                              6e 00 7f 00  6e 00 7e 00              184.1.40       
                                              6d 00 7f 00  6d 00 7e 00              184.1.48       
                                              6d 00 80 00  72 00 7e 00              184.1.56       
                                              6f 00 7c 00  6d 00 80 00              184.1.64       
                                              6e 00 7f 00  69 00 7c 00              184.1.72       
                                              6b 00 78 00  6c 00 7c 00              184.1.80       
                                              6c 00 7d 00  6b 00 7f 00              184.1.88       
                                              6f 00 7f 00  6b 00 7f 00              184.1.96       
                                              6f 00 79 00  6c 00 7a 00              184.1.104      
                                              6d 00 7c 00  6e 00 7c 00              184.1.112      
                                              6c 00 7b 00  6c 00 7b 00              184.1.120      
                                              6b 00 7b 00  6d 00 7f 00              184.1.128      
                                              6c 00 7e 00  6b 00 7a 00              184.1.136      
                                              6c 00 7c 00  6d 00 7d 00              184.1.144      
                                              70 00 7c 00  6b 00 7a 00              184.1.152      
                                              69 00 78 00  6c 00 7f 00              184.1.160      
                                              70 00 7b 00  6b 00 7f 00              184.1.168      
                                              6b 00 7d 00  6b 00 79 00              184.1.176      
                                              6d 00 7d 00  69 00 80 00              184.1.184      
                                              6a 00 7c 00  6a 00 7c 00              184.1.192      
  10.2                         524288  IN     7c 00 6b 00  7e 00 6d 00   13ms       185.1.0        
                                              7e 00 6c 00  7c 00 6c 00              185.1.8        
                                              7a 00 6d 00  7c 00 6d 00              185.1.16       
                                              7a 00 6c 00  7a 00 6d 00              185.1.24       
                                              7c 00 6f 00  7d 00 6c 00              185.1.32       
                                              7b 00 6c 00  7c 00 6b 00              185.1.40       
                                              7b 00 6b 00  7c 00 6a 00              185.1.48       
                                              7c 00 6d 00  7d 00 6d 00              185.1.56       
                                              7d 00 6d 00  7e 00 6c 00              185.1.64       
                                              7c 00 6d 00  7e 00 6a 00              185.1.72       
                                              7b 00 6e 00  7b 00 6b 00              185.1.80       
                                              7a 00 6f 00  7c 00 6e 00              185.1.88       
                                              7c 00 6e 00  7d 00 6c 00              185.1.96       
                                              7e 00 6d 00  7c 00 69 00              185.1.104      
                                              7c 00 6d 00  7b 00 6d 00              185.1.112      
                                              7f 00 6d 00  7c 00 6d 00              185.1.120      
                                              7c 00 6f 00  7e 00 68 00              185.1.128      
                                              7c 00 6b 00  7c 00 6a 00              185.1.136      
                                              7c 00 6d 00  80 00 6b 00              185.1.144      
                                              78 00 6c 00  78 00 6d 00              185.1.152      
                                              7a 00 6b 00  7e 00 69 00              185.1.160      
                                              7c 00 6b 00  7c 00 6e 00              185.1.168      
                                              7e 00 6b 00  7a 00 6b 00              185.1.176      
                                              7e 00 6f 00  7a 00 6a 00              185.1.184      
                                              7d 00 6e 00  79 00 6b 00              185.1.192      
  10.2                         524288  IN     6a 00 7c 00  6d 00 7b 00   12ms       186.1.0        
                                              6c 00 80 00  6d 00 7a 00              186.1.8        
                                              6d 00 7b 00  6b 00 7c 00              186.1.16       
                                              6b 00 7c 00  6d 00 7b 00              186.1.24       
                                              69 00 7b 00  6e 00 80 00              186.1.32       
                                              6e 00 79 00  6e 00 7c 00              186.1.40       
                                              6c 00 7c 00  69 00 7d 00              186.1.48       
                                              6b 00 7d 00  70 00 7c 00              186.1.56       
                                              6c 00 7b 00  6d 00 7d 00              186.1.64       
                                              6b 00 7c 00  6a 00 7f 00              186.1.72       
                                              6d 00 7c 00  6d 00 7c 00              186.1.80       
                                              6b 00 7b 00  6d 00 7b 00              186.1.88       
                                              6d 00 7c 00  6c 00 7a 00              186.1.96       
                                              6c 00 7e 00  6b 00 7d 00              186.1.104      
                                              6d 00 7c 00  69 00 7d 00              186.1.112      
                                              6b 00 7b 00  69 00 7a 00              186.1.120      
                                              6f 00 80 00  6b 00 7d 00              186.1.128      
                                              71 00 7d 00  6b 00 7d 00              186.1.136      
                                              6d 00 81 00  69 00 7e 00              186.1.144      
                                              6b 00 7c 00  6c 00 7a 00              186.1.152      
                                              6e 00 7b 00  69 00 7b 00              186.1.160      
                                              6c 00 7d 00  6c 00 7e 00              186.1.168      
                                              6d 00 7c 00  6b 00 7b 00              186.1.176      
                                              6c 00 7b 00  6d 00 7c 00              186.1.184      
                                              6d 00 80 00  6c 00 7f 00              186.1.192      
  10.2                             31  IN     1a 00 00 00  01 00 02 00   36us       187.1.0        
                                              31 84 00 01  04 00 97 1e              187.1.8        
                                              00 00 01 01  04 00 00 00              187.1.16       
                                              00 00 00 55  aa 55 aa                 187.1.24       
  10.2                         524288  IN     80 00 70 00  7d 00 6e 00  249ms       188.1.0        
                                              80 00 71 00  81 00 6f 00              188.1.8        
                                              82 00 6d 00  82 00 73 00              188.1.16       
                                              7e 00 6b 00  86 00 73 00              188.1.24       
                                              7e 00 73 00  84 00 71 00              188.1.32       
                                              7e 00 75 00  82 00 73 00              188.1.40       
                                              87 00 75 00  83 00 6d 00              188.1.48       
                                              84 00 76 00  83 00 78 00              188.1.56       
                                              84 00 73 00  82 00 74 00              188.1.64       
                                              85 00 75 00  84 00 72 00              188.1.72       
                                              85 00 77 00  85 00 72 00              188.1.80       
                                              87 00 77 00  83 00 73 00              188.1.88       
                                              84 00 70 00  80 00 6f 00              188.1.96       
                                              84 00 73 00  83 00 72 00              188.1.104      
                                              84 00 79 00  86 00 71 00              188.1.112      
                                              81 00 75 00  87 00 71 00              188.1.120      
                                              85 00 73 00  83 00 70 00              188.1.128      
                                              81 00 72 00  86 00 76 00              188.1.136      
                                              80 00 75 00  81 00 75 00              188.1.144      
                                              89 00 72 00  87 00 77 00              188.1.152      
                                              84 00 75 00  86 00 70 00              188.1.160      
                                              7e 00 71 00  85 00 75 00              188.1.168      
                                              83 00 72 00  86 00 72 00              188.1.176      
                                              83 00 75 00  89 00 77 00              188.1.184      
                                              86 00 71 00  84 00 70 00              188.1.192      
  10.2                         524288  IN     79 00 6d 00  7c 00 69 00   12ms       189.1.0        
                                              7b 00 6d 00  79 00 6b 00              189.1.8        
                                              7c 00 6c 00  7c 00 6b 00              189.1.16       
                                              79 00 6c 00  7c 00 6f 00              189.1.24       
                                              78 00 6b 00  7c 00 6b 00              189.1.32       
                                              7c 00 69 00  7b 00 6b 00              189.1.40       
                                              7b 00 6a 00  7c 00 6b 00              189.1.48       
                                              81 00 69 00  7a 00 69 00              189.1.56       
                                              7a 00 6a 00  7e 00 67 00              189.1.64       
                                              7e 00 6e 00  7b 00 6e 00              189.1.72       
                                              7a 00 69 00  7d 00 6a 00              189.1.80       
                                              7d 00 6e 00  7c 00 6b 00              189.1.88       
                                              79 00 67 00  7a 00 6a 00              189.1.96       
                                              7b 00 6a 00  79 00 68 00              189.1.104      
                                              79 00 6a 00  7c 00 6a 00              189.1.112      
                                              7c 00 6a 00  7b 00 67 00              189.1.120      
                                              7c 00 6b 00  78 00 6b 00              189.1.128      
                                              7d 00 68 00  79 00 6d 00              189.1.136      
                                              77 00 69 00  7b 00 6d 00              189.1.144      
                                              79 00 6c 00  7a 00 6c 00              189.1.152      
                                              7a 00 68 00  7c 00 69 00              189.1.160      
                                              7c 00 6b 00  7a 00 6b 00              189.1.168      
                                              78 00 6b 00  78 00 6c 00              189.1.176      
                                              7c 00 69 00  78 00 69 00              189.1.184      
                                              79 00 66 00  7c 00 6f 00              189.1.192      
  10.2                         524288  IN     6f 00 7a 00  6d 00 7a 00   13ms       190.1.0        
                                              6b 00 7a 00  69 00 7c 00              190.1.8        
                                              6b 00 7c 00  69 00 7c 00              190.1.16       
                                              6d 00 7e 00  6b 00 7c 00              190.1.24       
                                              6e 00 7a 00  6c 00 7a 00              190.1.32       
                                              68 00 7a 00  6c 00 7f 00              190.1.40       
                                              6e 00 7b 00  6d 00 7d 00              190.1.48       
                                              6c 00 7d 00  6c 00 7b 00              190.1.56       
                                              6b 00 7b 00  6b 00 7e 00              190.1.64       
                                              69 00 7c 00  6b 00 7e 00              190.1.72       
                                              6b 00 7d 00  6b 00 7e 00              190.1.80       
                                              6c 00 80 00  6b 00 7c 00              190.1.88       
                                              6a 00 7b 00  6a 00 7d 00              190.1.96       
                                              6c 00 7c 00  68 00 7f 00              190.1.104      
                                              6d 00 7e 00  6d 00 7e 00              190.1.112      
                                              6a 00 7e 00  6d 00 7c 00              190.1.120      
                                              6e 00 7e 00  6c 00 7d 00              190.1.128      
                                              6c 00 7a 00  6e 00 7c 00              190.1.136      
                                              6c 00 80 00  6c 00 78 00              190.1.144      
                                              6c 00 7c 00  6d 00 7a 00              190.1.152      
                                              6f 00 7c 00  6a 00 7c 00              190.1.160      
                                              6f 00 7b 00  6b 00 7d 00              190.1.168      
                                              68 00 7c 00  6f 00 78 00              190.1.176      
                                              69 00 7c 00  6b 00 7b 00              190.1.184      
                                              6d 00 7d 00  70 00 7b 00              190.1.192      
  10.2                         524288  IN     78 00 6c 00  7c 00 6b 00   13ms       191.1.0        
                                              7e 00 6f 00  7e 00 6f 00              191.1.8        
                                              7b 00 6d 00  7b 00 70 00              191.1.16       
                                              7c 00 70 00  7f 00 6f 00              191.1.24       
                                              7c 00 70 00  7f 00 6a 00              191.1.32       
                                              7c 00 6b 00  7f 00 6d 00              191.1.40       
                                              7e 00 6a 00  7e 00 6b 00              191.1.48       
                                              7a 00 6d 00  7b 00 69 00              191.1.56       
                                              7c 00 70 00  7d 00 6c 00              191.1.64       
                                              7c 00 6a 00  7f 00 6a 00              191.1.72       
                                              7d 00 6d 00  79 00 70 00              191.1.80       
                                              7d 00 70 00  7c 00 69 00              191.1.88       
                                              7f 00 6b 00  7c 00 6b 00              191.1.96       
                                              80 00 6e 00  7f 00 6f 00              191.1.104      
                                              7d 00 6e 00  7b 00 6d 00              191.1.112      
                                              7d 00 6c 00  7f 00 6b 00              191.1.120      
                                              7b 00 6d 00  7c 00 6b 00              191.1.128      
                                              7a 00 6e 00  7a 00 6e 00              191.1.136      
                                              7c 00 6c 00  7c 00 6d 00              191.1.144      
                                              79 00 6d 00  7e 00 6c 00              191.1.152      
                                              7a 00 6b 00  7d 00 6d 00              191.1.160      
                                              7c 00 6b 00  7c 00 6d 00              191.1.168      
                                              7f 00 69 00  7d 00 6b 00              191.1.176      
                                              80 00 6d 00  7c 00 6f 00              191.1.184      
                                              7b 00 6d 00  7e 00 69 00              191.1.192      
  10.2                         524288  IN     6c 00 7c 00  6e 00 7b 00   12ms       192.1.0        
                                              6c 00 7e 00  6a 00 7c 00              192.1.8        
                                              6c 00 7e 00  6b 00 7e 00              192.1.16       
                                              69 00 7c 00  69 00 7c 00              192.1.24       
                                              6d 00 7c 00  6d 00 7b 00              192.1.32       
                                              6b 00 7d 00  70 00 7c 00              192.1.40       
                                              6f 00 7c 00  6c 00 7b 00              192.1.48       
                                              6c 00 7c 00  6f 00 78 00              192.1.56       
                                              6b 00 7c 00  6c 00 7a 00              192.1.64       
                                              6c 00 7c 00  68 00 7e 00              192.1.72       
                                              6c 00 7c 00  6c 00 7b 00              192.1.80       
                                              6f 00 7d 00  6a 00 7e 00              192.1.88       
                                              6b 00 7c 00  6f 00 7b 00              192.1.96       
                                              6c 00 7e 00  6b 00 7d 00              192.1.104      
                                              6b 00 7f 00  6b 00 7f 00              192.1.112      
                                              6d 00 7c 00  6e 00 7a 00              192.1.120      
                                              6d 00 7e 00  6d 00 81 00              192.1.128      
                                              6c 00 80 00  6b 00 7d 00              192.1.136      
                                              6d 00 81 00  6b 00 7d 00              192.1.144      
                                              6b 00 7d 00  6d 00 78 00              192.1.152      
                                              6a 00 7c 00  69 00 7e 00              192.1.160      
                                              6b 00 7a 00  6e 00 82 00              192.1.168      
                                              70 00 7c 00  6b 00 7a 00              192.1.176      
                                              6c 00 7c 00  6e 00 7b 00              192.1.184      
                                              6d 00 81 00  6b 00 7e 00              192.1.192      
  10.2                             31  IN     1a 00 00 00  01 00 02 00   44us       193.1.0        
                                              31 84 00 01  04 00 98 1e              193.1.8        
                                              00 00 01 01  04 00 00 00              193.1.16       
                                              00 00 00 55  aa 55 aa                 193.1.24       
  10.2                         524288  IN     80 00 70 00  7e 00 71 00  249ms       194.1.0        
                                              80 00 73 00  84 00 73 00              194.1.8        
                                              80 00 6f 00  84 00 73 00              194.1.16       
                                              80 00 6f 00  86 00 71 00              194.1.24       
                                              80 00 71 00  80 00 71 00              194.1.32       
                                              83 00 73 00  82 00 76 00              194.1.40       
                                              88 00 75 00  81 00 72 00              194.1.48       
                                              83 00 72 00  84 00 77 00              194.1.56       
                                              85 00 71 00  84 00 74 00              194.1.64       
                                              85 00 74 00  7f 00 73 00              194.1.72       
                                              84 00 75 00  7e 00 75 00              194.1.80       
                                              84 00 75 00  84 00 74 00              194.1.88       
                                              81 00 70 00  81 00 72 00              194.1.96       
                                              81 00 70 00  84 00 72 00              194.1.104      
                                              83 00 76 00  86 00 73 00              194.1.112      
                                              83 00 73 00  83 00 75 00              194.1.120      
                                              83 00 75 00  85 00 72 00              194.1.128      
                                              80 00 76 00  85 00 74 00              194.1.136      
                                              81 00 73 00  83 00 75 00              194.1.144      
                                              87 00 73 00  87 00 7b 00              194.1.152      
                                              89 00 73 00  84 00 73 00              194.1.160      
                                              80 00 6f 00  86 00 77 00              194.1.168      
                                              81 00 71 00  85 00 73 00              194.1.176      
                                              85 00 78 00  85 00 72 00              194.1.184      
                                              82 00 73 00  82 00 75 00              194.1.192      
  10.2                         524288  IN     7a 00 6b 00  78 00 67 00   12ms       195.1.0        
                                              7a 00 6c 00  7a 00 6b 00              195.1.8        
                                              7a 00 6c 00  80 00 6b 00              195.1.16       
                                              78 00 6a 00  78 00 69 00              195.1.24       
                                              7a 00 6d 00  7a 00 69 00              195.1.32       
                                              7a 00 69 00  7b 00 6d 00              195.1.40       
                                              79 00 6d 00  7a 00 6c 00              195.1.48       
                                              7a 00 66 00  7a 00 6b 00              195.1.56       
                                              76 00 6f 00  7c 00 6a 00              195.1.64       
                                              7a 00 6a 00  7a 00 69 00              195.1.72       
                                              7a 00 6f 00  7c 00 6b 00              195.1.80       
                                              79 00 68 00  76 00 6a 00              195.1.88       
                                              78 00 6b 00  7d 00 6b 00              195.1.96       
                                              7b 00 69 00  7a 00 6a 00              195.1.104      
                                              7b 00 6c 00  7d 00 6c 00              195.1.112      
                                              7a 00 6a 00  7e 00 6d 00              195.1.120      
                                              78 00 6a 00  7a 00 65 00              195.1.128      
                                              7a 00 6a 00  7c 00 68 00              195.1.136      
                                              7c 00 67 00  7c 00 6b 00              195.1.144      
                                              78 00 6a 00  78 00 6b 00              195.1.152      
                                              7b 00 68 00  7e 00 68 00              195.1.160      
                                              79 00 67 00  76 00 67 00              195.1.168      
                                              79 00 70 00  78 00 6a 00              195.1.176      
                                              7a 00 6a 00  79 00 6d 00              195.1.184      
                                              7c 00 66 00  7b 00 6b 00              195.1.192      
  10.2                         524288  IN     6d 00 7e 00  6c 00 7c 00   12ms       196.1.0        
                                              6f 00 7e 00  6a 00 79 00              196.1.8        
                                              6d 00 7c 00  6f 00 80 00              196.1.16       
                                              6b 00 81 00  6c 00 7f 00              196.1.24       
                                              6e 00 7b 00  6c 00 7f 00              196.1.32       
                                              6d 00 7e 00  6e 00 7f 00              196.1.40       
                                              6b 00 7f 00  69 00 7b 00              196.1.48       
                                              6d 00 7f 00  6e 00 7b 00              196.1.56       
                                              6d 00 7c 00  6b 00 80 00              196.1.64       
                                              6e 00 7e 00  6b 00 7e 00              196.1.72       
                                              6d 00 7e 00  6e 00 7d 00              196.1.80       
                                              6c 00 7a 00  6b 00 7d 00              196.1.88       
                                              6b 00 7c 00  6f 00 7b 00              196.1.96       
                                              6e 00 7b 00  6b 00 7d 00              196.1.104      
                                              6d 00 81 00  6c 00 7d 00              196.1.112      
                                              70 00 7c 00  6d 00 7e 00              196.1.120      
                                              6e 00 7c 00  6b 00 7e 00              196.1.128      
                                              6d 00 7e 00  6f 00 7c 00              196.1.136      
                                              6a 00 80 00  6c 00 7f 00              196.1.144      
                                              6e 00 7d 00  6d 00 7d 00              196.1.152      
                                              6d 00 7e 00  6c 00 7c 00              196.1.160      
                                              6e 00 7e 00  6a 00 7a 00              196.1.168      
                                              6d 00 7e 00  6f 00 7d 00              196.1.176      
                                              6c 00 81 00  6d 00 7f 00              196.1.184      
                                              6e 00 80 00  6f 00 7b 00              196.1.192      
  10.2                         524288  IN     7c 00 6b 00  7b 00 6d 00   13ms       197.1.0        
                                              78 00 6e 00  7e 00 70 00              197.1.8        
                                              7a 00 6d 00  7d 00 6d 00              197.1.16       
                                              7e 00 6b 00  7c 00 6d 00              197.1.24       
                                              7e 00 6d 00  7c 00 6b 00              197.1.32       
                                              7b 00 6c 00  7a 00 6d 00              197.1.40       
                                              7a 00 6b 00  7c 00 6b 00              197.1.48       
                                              7b 00 6a 00  7b 00 6d 00              197.1.56       
                                              7d 00 6b 00  7c 00 6e 00              197.1.64       
                                              7c 00 6f 00  7e 00 69 00              197.1.72       
                                              81 00 6b 00  7c 00 6d 00              197.1.80       
                                              79 00 6d 00  7b 00 6b 00              197.1.88       
                                              79 00 6d 00  7e 00 6d 00              197.1.96       
                                              7d 00 6f 00  7d 00 6b 00              197.1.104      
                                              7c 00 6b 00  7c 00 69 00              197.1.112      
                                              7d 00 6b 00  7e 00 6a 00              197.1.120      
                                              7c 00 6e 00  7d 00 6b 00              197.1.128      
                                              7a 00 6b 00  7b 00 6f 00              197.1.136      
                                              7f 00 6a 00  7d 00 6b 00              197.1.144      
                                              7a 00 6d 00  7d 00 6a 00              197.1.152      
                                              7a 00 6c 00  7c 00 6a 00              197.1.160      
                                              7b 00 6b 00  7c 00 6f 00              197.1.168      
                                              7b 00 6f 00  7d 00 6d 00              197.1.176      
                                              80 00 70 00  7b 00 6b 00              197.1.184      
                                              7b 00 6b 00  7c 00 6d 00              197.1.192      
  10.2                         524288  IN     6a 00 79 00  6f 00 7e 00   13ms       198.1.0        
                                              6b 00 7f 00  6b 00 7b 00              198.1.8        
                                              69 00 7c 00  6b 00 79 00              198.1.16       
                                              6b 00 7d 00  6a 00 7d 00              198.1.24       
                                              6b 00 7d 00  6f 00 79 00              198.1.32       
                                              6c 00 76 00  6f 00 7e 00              198.1.40       
                                              6d 00 7b 00  6b 00 7d 00              198.1.48       
                                              6b 00 7c 00  6d 00 7c 00              198.1.56       
                                              69 00 7c 00  69 00 7b 00              198.1.64       
                                              6d 00 7e 00  6a 00 7e 00              198.1.72       
                                              6b 00 7b 00  6d 00 7c 00              198.1.80       
                                              69 00 7b 00  69 00 7b 00              198.1.88       
                                              6a 00 7d 00  6d 00 7e 00              198.1.96       
                                              6d 00 7b 00  6b 00 7e 00              198.1.104      
                                              6d 00 7e 00  6f 00 7e 00              198.1.112      
                                              6d 00 7a 00  6c 00 7c 00              198.1.120      
                                              6d 00 7c 00  6a 00 7d 00              198.1.128      
                                              6c 00 7e 00  6e 00 7d 00              198.1.136      
                                              6b 00 7e 00  6e 00 7d 00              198.1.144      
                                              6d 00 7a 00  6b 00 7e 00              198.1.152      
                                              6d 00 7c 00  6c 00 7c 00              198.1.160      
                                              69 00 7a 00  6e 00 83 00              198.1.168      
                                              72 00 7f 00  69 00 7a 00              198.1.176      
                                              68 00 7d 00  6b 00 7e 00              198.1.184      
                                              68 00 80 00  6d 00 7a 00              198.1.192      
  10.2                             31  IN     1a 00 00 00  01 00 02 00   34us       199.1.0        
                                              31 84 00 01  04 00 99 1e              199.1.8        
                                              00 00 01 01  04 00 00 00              199.1.16       
                                              00 00 00 55  aa 55 aa                 199.1.24       
  10.2                         524288  IN     80 00 70 00  7f 00 6e 00  249ms       200.1.0        
                                              80 00 71 00  80 00 6f 00              200.1.8        
                                              80 00 6f 00  80 00 6f 00              200.1.16       
                                              80 00 6d 00  84 00 71 00              200.1.24       
                                              7e 00 71 00  82 00 72 00              200.1.32       
                                              7e 00 73 00  84 00 74 00              200.1.40       
                                              87 00 75 00  7f 00 74 00              200.1.48       
                                              84 00 72 00  86 00 76 00              200.1.56       
                                              89 00 74 00  80 00 76 00              200.1.64       
                                              84 00 73 00  82 00 70 00              200.1.72       
                                              86 00 73 00  83 00 75 00              200.1.80       
                                              82 00 73 00  86 00 75 00              200.1.88       
                                              81 00 71 00  81 00 71 00              200.1.96       
                                              86 00 72 00  84 00 71 00              200.1.104      
                                              82 00 77 00  87 00 71 00              200.1.112      
                                              81 00 72 00  84 00 73 00              200.1.120      
                                              84 00 73 00  83 00 6f 00              200.1.128      
                                              84 00 73 00  84 00 73 00              200.1.136      
                                              87 00 72 00  81 00 77 00              200.1.144      
                                              83 00 6f 00  86 00 77 00              200.1.152      
                                              88 00 75 00  83 00 71 00              200.1.160      
                                              7e 00 70 00  88 00 74 00              200.1.168      
                                              82 00 73 00  86 00 78 00              200.1.176      
                                              80 00 76 00  88 00 74 00              200.1.184      
                                              81 00 75 00  83 00 75 00              200.1.192      
  10.2                         524288  IN     7b 00 6c 00  7b 00 6b 00   13ms       201.1.0        
                                              7b 00 69 00  78 00 6b 00              201.1.8        
                                              7e 00 6d 00  7a 00 6a 00              201.1.16       
                                              7b 00 6c 00  7c 00 6c 00              201.1.24       
                                              7a 00 6b 00  7c 00 6b 00              201.1.32       
                                              7d 00 6b 00  79 00 69 00              201.1.40       
                                              79 00 6d 00  7a 00 69 00              201.1.48       
                                              7c 00 6b 00  7c 00 6c 00              201.1.56       
                                              7c 00 6c 00  7a 00 6a 00              201.1.64       
                                              7a 00 6a 00  7a 00 6c 00              201.1.72       
                                              7a 00 6b 00  7b 00 6b 00              201.1.80       
                                              78 00 69 00  7c 00 6a 00              201.1.88       
                                              79 00 6d 00  79 00 69 00              201.1.96       
                                              7c 00 6a 00  7b 00 69 00              201.1.104      
                                              7d 00 68 00  7d 00 6a 00              201.1.112      
                                              7c 00 69 00  79 00 6b 00              201.1.120      
                                              7b 00 69 00  7b 00 6c 00              201.1.128      
                                              79 00 6b 00  7c 00 6d 00              201.1.136      
                                              7b 00 69 00  7b 00 6c 00              201.1.144      
                                              78 00 6b 00  7b 00 6b 00              201.1.152      
                                              7d 00 6f 00  7e 00 6a 00              201.1.160      
                                              7a 00 68 00  7c 00 6b 00              201.1.168      
                                              77 00 6c 00  7c 00 6a 00              201.1.176      
                                              7c 00 6d 00  79 00 6b 00              201.1.184      
                                              7a 00 67 00  7e 00 71 00              201.1.192      
  10.2                         524288  IN     72 00 7a 00  6b 00 7f 00   12ms       202.1.0        
                                              6d 00 7d 00  69 00 7d 00              202.1.8        
                                              6d 00 7d 00  6d 00 7b 00              202.1.16       
                                              69 00 80 00  69 00 7c 00              202.1.24       
                                              69 00 7c 00  6b 00 7c 00              202.1.32       
                                              6a 00 7c 00  6c 00 7c 00              202.1.40       
                                              6b 00 7e 00  6e 00 7c 00              202.1.48       
                                              6e 00 7d 00  6e 00 7b 00              202.1.56       
                                              6b 00 7c 00  6b 00 7f 00              202.1.64       
                                              6a 00 7c 00  68 00 7d 00              202.1.72       
                                              6c 00 7e 00  6b 00 7b 00              202.1.80       
                                              69 00 7f 00  6b 00 7b 00              202.1.88       
                                              69 00 7b 00  6b 00 7a 00              202.1.96       
                                              6d 00 7d 00  6c 00 7a 00              202.1.104      
                                              6c 00 7b 00  6a 00 7b 00              202.1.112      
                                              6e 00 7e 00  6c 00 7f 00              202.1.120      
                                              6b 00 7f 00  6b 00 7c 00              202.1.128      
                                              6b 00 7a 00  6d 00 7a 00              202.1.136      
                                              6c 00 7e 00  6c 00 7c 00              202.1.144      
                                              6b 00 7b 00  6b 00 7a 00              202.1.152      
                                              6c 00 7d 00  6c 00 79 00              202.1.160      
                                              6e 00 7c 00  6c 00 7e 00              202.1.168      
                                              6a 00 7c 00  6b 00 7a 00              202.1.176      
                                              6b 00 80 00  69 00 7e 00              202.1.184      
                                              6b 00 7c 00  6f 00 7b 00              202.1.192      
  10.2                         524288  IN     7c 00 6e 00  7b 00 6a 00   13ms       203.1.0        
                                              79 00 6d 00  7c 00 6b 00              203.1.8        
                                              7a 00 69 00  7c 00 6d 00              203.1.16       
                                              7b 00 6d 00  7c 00 6b 00              203.1.24       
                                              7e 00 6b 00  7e 00 69 00              203.1.32       
                                              7b 00 6a 00  7e 00 6b 00              203.1.40       
                                              7f 00 6b 00  7d 00 6a 00              203.1.48       
                                              7b 00 6b 00  78 00 6c 00              203.1.56       
                                              7a 00 6e 00  7c 00 70 00              203.1.64       
                                              7d 00 6a 00  7f 00 6a 00              203.1.72       
                                              80 00 6c 00  7b 00 69 00              203.1.80       
                                              7b 00 69 00  7e 00 6d 00              203.1.88       
                                              7c 00 6d 00  7b 00 6d 00              203.1.96       
                                              7e 00 6c 00  7e 00 6c 00              203.1.104      
                                              7a 00 6c 00  7d 00 6b 00              203.1.112      
                                              7a 00 6b 00  7e 00 6b 00              203.1.120      
                                              7c 00 6d 00  79 00 6b 00              203.1.128      
                                              7b 00 6e 00  7c 00 6e 00              203.1.136      
                                              7a 00 6b 00  7c 00 6b 00              203.1.144      
                                              78 00 69 00  78 00 69 00              203.1.152      
                                              7b 00 6b 00  79 00 69 00              203.1.160      
                                              7e 00 69 00  7c 00 6b 00              203.1.168      
                                              7c 00 6d 00  7d 00 6a 00              203.1.176      
                                              7d 00 6e 00  81 00 6a 00              203.1.184      
                                              7b 00 6a 00  7a 00 68 00              203.1.192      
  10.2                         524288  IN     6b 00 7c 00  6a 00 7a 00   14ms       204.1.0        
                                              6a 00 7f 00  6a 00 7a 00              204.1.8        
                                              6d 00 7b 00  6c 00 7c 00              204.1.16       
                                              6f 00 7c 00  6c 00 7e 00              204.1.24       
                                              6d 00 7f 00  6d 00 7e 00              204.1.32       
                                              6d 00 79 00  6d 00 7e 00              204.1.40       
                                              69 00 7d 00  6d 00 7e 00              204.1.48       
                                              6a 00 7e 00  69 00 7c 00              204.1.56       
                                              6b 00 80 00  6b 00 7c 00              204.1.64       
                                              6d 00 80 00  6a 00 7e 00              204.1.72       
                                              6d 00 7c 00  6c 00 7c 00              204.1.80       
                                              6f 00 7c 00  6b 00 7e 00              204.1.88       
                                              6c 00 7e 00  6d 00 7e 00              204.1.96       
                                              70 00 7e 00  6d 00 7c 00              204.1.104      
                                              6c 00 7c 00  6b 00 7e 00              204.1.112      
                                              6b 00 7d 00  69 00 7e 00              204.1.120      
                                              6d 00 7d 00  6f 00 7c 00              204.1.128      
                                              69 00 7d 00  6a 00 7e 00              204.1.136      
                                              6f 00 7e 00  6e 00 7e 00              204.1.144      
                                              6d 00 7b 00  6b 00 78 00              204.1.152      
                                              6c 00 7c 00  6b 00 7c 00              204.1.160      
                                              70 00 7b 00  6b 00 7d 00              204.1.168      
                                              6f 00 7f 00  6b 00 7c 00              204.1.176      
                                              6b 00 7c 00  6a 00 7b 00              204.1.184      
                                              6e 00 81 00  6a 00 7a 00              204.1.192      
  10.2                             31  IN     1a 00 00 00  01 00 02 00   53us       205.1.0        
                                              31 84 00 01  04 00 9a 1e              205.1.8        
                                              00 00 01 01  04 00 00 00              205.1.16       
                                              00 00 00 55  aa 55 aa                 205.1.24       
  10.2                         524288  IN     81 00 72 00  7e 00 6e 00  249ms       206.1.0        
                                              80 00 73 00  82 00 71 00              206.1.8        
                                              82 00 6f 00  81 00 71 00              206.1.16       
                                              7f 00 70 00  80 00 70 00              206.1.24       
                                              7d 00 77 00  80 00 71 00              206.1.32       
                                              81 00 75 00  84 00 76 00              206.1.40       
                                              88 00 74 00  84 00 72 00              206.1.48       
                                              81 00 78 00  83 00 74 00              206.1.56       
                                              84 00 74 00  84 00 77 00              206.1.64       
                                              85 00 74 00  82 00 71 00              206.1.72       
                                              84 00 77 00  7f 00 74 00              206.1.80       
                                              80 00 73 00  84 00 74 00              206.1.88       
                                              81 00 72 00  81 00 73 00              206.1.96       
                                              83 00 74 00  82 00 73 00              206.1.104      
                                              86 00 79 00  87 00 71 00              206.1.112      
                                              83 00 71 00  87 00 72 00              206.1.120      
                                              84 00 74 00  80 00 71 00              206.1.128      
                                              83 00 72 00  83 00 73 00              206.1.136      
                                              81 00 73 00  82 00 78 00              206.1.144      
                                              88 00 76 00  87 00 78 00              206.1.152      
                                              86 00 73 00  84 00 71 00              206.1.160      
                                              7c 00 6e 00  86 00 77 00              206.1.168      
                                              80 00 71 00  86 00 73 00              206.1.176      
                                              84 00 77 00  85 00 71 00              206.1.184      
                                              83 00 71 00  83 00 71 00              206.1.192      
  10.2                         524288  IN     7c 00 6d 00  7c 00 6e 00   14ms       207.1.0        
                                              7a 00 6b 00  7b 00 6b 00              207.1.8        
                                              7d 00 6d 00  7b 00 6b 00              207.1.16       
                                              7a 00 6d 00  7e 00 6a 00              207.1.24       
                                              7c 00 6b 00  7a 00 6b 00              207.1.32       
                                              7a 00 6a 00  7c 00 6d 00              207.1.40       
                                              7c 00 6d 00  7e 00 69 00              207.1.48       
                                              82 00 6b 00  7c 00 6a 00              207.1.56       
                                              7c 00 70 00  7b 00 6b 00              207.1.64       
                                              7d 00 6d 00  79 00 6c 00              207.1.72       
                                              7a 00 6a 00  7a 00 6d 00              207.1.80       
                                              7c 00 6a 00  7d 00 6f 00              207.1.88       
                                              7b 00 6b 00  7c 00 6c 00              207.1.96       
                                              7f 00 6b 00  7b 00 67 00              207.1.104      
                                              79 00 6b 00  7e 00 6d 00              207.1.112      
                                              7a 00 69 00  7c 00 68 00              207.1.120      
                                              7e 00 6b 00  78 00 6b 00              207.1.128      
                                              7d 00 6b 00  7c 00 69 00              207.1.136      
                                              7b 00 68 00  7c 00 6b 00              207.1.144      
                                              7c 00 6b 00  77 00 6b 00              207.1.152      
                                              7b 00 6b 00  7d 00 6d 00              207.1.160      
                                              7d 00 69 00  7c 00 6f 00              207.1.168      
                                              78 00 6f 00  78 00 6e 00              207.1.176      
                                              78 00 6b 00  7a 00 68 00              207.1.184      
                                              7e 00 6b 00  78 00 69 00              207.1.192      
  10.2                         524288  IN     6e 00 7c 00  6c 00 7a 00   12ms       208.1.0        
                                              6e 00 7d 00  6b 00 7c 00              208.1.8        
                                              6c 00 7b 00  6a 00 81 00              208.1.16       
                                              69 00 7c 00  6b 00 7c 00              208.1.24       
                                              6a 00 7d 00  6c 00 7f 00              208.1.32       
                                              6a 00 7b 00  69 00 7d 00              208.1.40       
                                              6c 00 7d 00  6a 00 7c 00              208.1.48       
                                              6d 00 7a 00  6b 00 7e 00              208.1.56       
                                              6c 00 7c 00  6b 00 7f 00              208.1.64       
                                              6a 00 79 00  6c 00 7c 00              208.1.72       
                                              6c 00 7f 00  69 00 7d 00              208.1.80       
                                              6b 00 7c 00  6c 00 7d 00              208.1.88       
                                              6a 00 7d 00  6a 00 7a 00              208.1.96       
                                              6f 00 7a 00  6c 00 7a 00              208.1.104      
                                              6c 00 7c 00  6c 00 7a 00              208.1.112      
                                              6d 00 7a 00  6b 00 7b 00              208.1.120      
                                              6b 00 7b 00  6b 00 7f 00              208.1.128      
                                              6c 00 7f 00  69 00 7b 00              208.1.136      
                                              6a 00 79 00  6d 00 80 00              208.1.144      
                                              6b 00 7c 00  6e 00 78 00              208.1.152      
                                              69 00 7a 00  6b 00 7c 00              208.1.160      
                                              6e 00 7e 00  69 00 7b 00              208.1.168      
                                              6d 00 7d 00  6c 00 7b 00              208.1.176      
                                              6c 00 7b 00  6b 00 7d 00              208.1.184      
                                              6b 00 7e 00  6d 00 7a 00              208.1.192      
  10.2                         524288  IN     7b 00 6b 00  81 00 6d 00   13ms       209.1.0        
                                              7d 00 6b 00  7f 00 6b 00              209.1.8        
                                              7a 00 6c 00  7b 00 6f 00              209.1.16       
                                              7c 00 6d 00  7d 00 6c 00              209.1.24       
                                              7a 00 6e 00  7a 00 6d 00              209.1.32       
                                              7c 00 6d 00  7c 00 6d 00              209.1.40       
                                              7a 00 6b 00  7b 00 6b 00              209.1.48       
                                              7a 00 69 00  7d 00 6b 00              209.1.56       
                                              7c 00 6c 00  7c 00 6c 00              209.1.64       
                                              7a 00 6b 00  81 00 6b 00              209.1.72       
                                              7c 00 6b 00  7a 00 69 00              209.1.80       
                                              7c 00 69 00  7c 00 6b 00              209.1.88       
                                              7a 00 6c 00  7d 00 6d 00              209.1.96       
                                              7d 00 69 00  7b 00 6b 00              209.1.104      
                                              7c 00 69 00  7e 00 6a 00              209.1.112      
                                              7d 00 6b 00  7e 00 6a 00              209.1.120      
                                              7e 00 6d 00  7e 00 6b 00              209.1.128      
                                              7e 00 6d 00  7c 00 6c 00              209.1.136      
                                              7c 00 6d 00  7e 00 71 00              209.1.144      
                                              79 00 6e 00  7b 00 69 00              209.1.152      
                                              7d 00 6d 00  80 00 6d 00              209.1.160      
                                              7b 00 6c 00  7c 00 6b 00              209.1.168      
                                              7f 00 69 00  7c 00 6b 00              209.1.176      
                                              7d 00 6b 00  7d 00 69 00              209.1.184      
                                              79 00 6e 00  78 00 6e 00              209.1.192      
  10.2                         524288  IN     6b 00 7e 00  6a 00 7c 00   14ms       210.1.0        
                                              6d 00 7e 00  6a 00 7c 00              210.1.8        
                                              6d 00 7c 00  6f 00 7c 00              210.1.16       
                                              6a 00 77 00  69 00 7c 00              210.1.24       
                                              6a 00 7c 00  6d 00 7b 00              210.1.32       
                                              6e 00 7b 00  6d 00 7f 00              210.1.40       
                                              6e 00 7c 00  6d 00 7a 00              210.1.48       
                                              6b 00 7e 00  6b 00 7c 00              210.1.56       
                                              6d 00 7b 00  6b 00 79 00              210.1.64       
                                              6d 00 7f 00  6d 00 7d 00              210.1.72       
                                              6c 00 7d 00  6c 00 7f 00              210.1.80       
                                              6a 00 7b 00  6f 00 7b 00              210.1.88       
                                              71 00 7e 00  6c 00 7a 00              210.1.96       
                                              6b 00 7e 00  6c 00 7e 00              210.1.104      
                                              6b 00 7c 00  71 00 7b 00              210.1.112      
                                              6c 00 80 00  6c 00 7e 00              210.1.120      
                                              6e 00 7e 00  6d 00 7d 00              210.1.128      
                                              6d 00 7c 00  6c 00 7c 00              210.1.136      
                                              6e 00 7f 00  6d 00 7a 00              210.1.144      
                                              69 00 7e 00  6d 00 7b 00              210.1.152      
                                              6d 00 7c 00  69 00 7c 00              210.1.160      
                                              69 00 7c 00  6b 00 83 00              210.1.168      
                                              6c 00 7f 00  6d 00 7a 00              210.1.176      
                                              6b 00 7a 00  6d 00 7c 00              210.1.184      
                                              6c 00 80 00  69 00 7c 00              210.1.192      
  10.2                             31  IN     1a 00 00 00  01 00 02 00  1.8ms       211.1.0        
                                              31 84 00 01  04 00 9b 1e              211.1.8        
                                              00 00 01 01  04 00 00 00              211.1.16       
                                              00 00 00 55  aa 55 aa                 211.1.24       
  10.2                         524288  IN     7e 00 6f 00  7f 00 71 00  244ms       212.1.0        
                                              7e 00 6f 00  80 00 70 00              212.1.8        
                                              82 00 72 00  7f 00 6f 00              212.1.16       
                                              80 00 71 00  87 00 6e 00              212.1.24       
                                              7c 00 73 00  82 00 6d 00              212.1.32       
                                              7e 00 6f 00  80 00 72 00              212.1.40       
                                              84 00 75 00  81 00 70 00              212.1.48       
                                              82 00 72 00  84 00 78 00              212.1.56       
                                              85 00 72 00  82 00 75 00              212.1.64       
                                              84 00 72 00  80 00 6f 00              212.1.72       
                                              84 00 73 00  81 00 73 00              212.1.80       
                                              82 00 71 00  85 00 75 00              212.1.88       
                                              84 00 71 00  84 00 73 00              212.1.96       
                                              81 00 75 00  83 00 72 00              212.1.104      
                                              84 00 77 00  84 00 71 00              212.1.112      
                                              82 00 78 00  83 00 73 00              212.1.120      
                                              85 00 75 00  83 00 6d 00              212.1.128      
                                              82 00 74 00  82 00 73 00              212.1.136      
                                              7e 00 73 00  84 00 78 00              212.1.144      
                                              84 00 73 00  86 00 76 00              212.1.152      
                                              86 00 74 00  81 00 71 00              212.1.160      
                                              7f 00 6c 00  86 00 75 00              212.1.168      
                                              80 00 73 00  84 00 77 00              212.1.176      
                                              83 00 78 00  87 00 73 00              212.1.184      
                                              86 00 74 00  80 00 79 00              212.1.192      
  10.2                         524288  IN     79 00 6b 00  7b 00 6c 00   12ms       213.1.0        
                                              7b 00 6c 00  78 00 6b 00              213.1.8        
                                              7b 00 6b 00  7c 00 6b 00              213.1.16       
                                              79 00 6d 00  7a 00 69 00              213.1.24       
                                              7c 00 66 00  79 00 6a 00              213.1.32       
                                              7a 00 6e 00  79 00 6b 00              213.1.40       
                                              7c 00 6a 00  7c 00 69 00              213.1.48       
                                              7d 00 69 00  78 00 6d 00              213.1.56       
                                              78 00 67 00  7c 00 67 00              213.1.64       
                                              78 00 67 00  7b 00 69 00              213.1.72       
                                              7b 00 6b 00  79 00 69 00              213.1.80       
                                              79 00 6c 00  7b 00 69 00              213.1.88       
                                              7c 00 6b 00  7a 00 6d 00              213.1.96       
                                              7c 00 6a 00  7b 00 67 00              213.1.104      
                                              7a 00 6d 00  7c 00 68 00              213.1.112      
                                              7a 00 68 00  77 00 6b 00              213.1.120      
                                              7a 00 66 00  79 00 6a 00              213.1.128      
                                              7a 00 6b 00  79 00 6a 00              213.1.136      
                                              7b 00 69 00  7b 00 6f 00              213.1.144      
                                              7b 00 6a 00  79 00 67 00              213.1.152      
                                              7a 00 66 00  79 00 69 00              213.1.160      
                                              7a 00 67 00  76 00 69 00              213.1.168      
                                              78 00 6d 00  78 00 6a 00              213.1.176      
                                              79 00 6a 00  74 00 6b 00              213.1.184      
                                              78 00 66 00  79 00 6c 00              213.1.192      
  10.2                         524288  IN     6f 00 7e 00  69 00 7a 00   12ms       214.1.0        
                                              69 00 7a 00  68 00 7e 00              214.1.8        
                                              6a 00 7d 00  6d 00 7d 00              214.1.16       
                                              69 00 7d 00  6a 00 7c 00              214.1.24       
                                              6c 00 7c 00  69 00 7c 00              214.1.32       
                                              6a 00 7e 00  6a 00 7c 00              214.1.40       
                                              6b 00 7c 00  6c 00 7c 00              214.1.48       
                                              6b 00 7e 00  6f 00 7e 00              214.1.56       
                                              6a 00 7d 00  6c 00 80 00              214.1.64       
                                              69 00 7d 00  68 00 7c 00              214.1.72       
                                              6c 00 79 00  6b 00 7c 00              214.1.80       
                                              69 00 7d 00  6b 00 7a 00              214.1.88       
                                              69 00 7e 00  69 00 7c 00              214.1.96       
                                              6b 00 78 00  6d 00 7c 00              214.1.104      
                                              6c 00 7b 00  69 00 79 00              214.1.112      
                                              6b 00 7b 00  6b 00 7b 00              214.1.120      
                                              6b 00 7b 00  6b 00 79 00              214.1.128      
                                              6a 00 7c 00  6d 00 7b 00              214.1.136      
                                              69 00 7c 00  6b 00 7b 00              214.1.144      
                                              6b 00 7c 00  6b 00 7d 00              214.1.152      
                                              6e 00 7b 00  69 00 7b 00              214.1.160      
                                              6d 00 7b 00  6c 00 7a 00              214.1.168      
                                              6b 00 7a 00  69 00 7a 00              214.1.176      
                                              6c 00 7b 00  67 00 7e 00              214.1.184      
                                              6a 00 7b 00  69 00 7d 00              214.1.192      
  10.2                         524288  IN     7c 00 6c 00  7e 00 6e 00   13ms       215.1.0        
                                              7c 00 6a 00  7e 00 6b 00              215.1.8        
                                              7d 00 6d 00  7b 00 68 00              215.1.16       
                                              79 00 6f 00  7a 00 6d 00              215.1.24       
                                              7c 00 6d 00  7c 00 6b 00              215.1.32       
                                              7f 00 6d 00  7c 00 6d 00              215.1.40       
                                              80 00 6d 00  7c 00 6b 00              215.1.48       
                                              7d 00 6e 00  7d 00 6b 00              215.1.56       
                                              7f 00 6f 00  7d 00 6b 00              215.1.64       
                                              7c 00 6b 00  7c 00 6c 00              215.1.72       
                                              7b 00 6e 00  7b 00 6d 00              215.1.80       
                                              7c 00 6b 00  7e 00 6c 00              215.1.88       
                                              7a 00 6a 00  7e 00 6d 00              215.1.96       
                                              7d 00 6b 00  7c 00 6b 00              215.1.104      
                                              7e 00 6c 00  7c 00 6c 00              215.1.112      
                                              7e 00 6f 00  7e 00 6d 00              215.1.120      
                                              7c 00 6a 00  7d 00 6f 00              215.1.128      
                                              7b 00 6e 00  7e 00 6e 00              215.1.136      
                                              7a 00 6d 00  7c 00 6d 00              215.1.144      
                                              7e 00 6d 00  7c 00 6c 00              215.1.152      
                                              7c 00 6b 00  7f 00 6b 00              215.1.160      
                                              7e 00 6c 00  7c 00 6e 00              215.1.168      
                                              78 00 69 00  7c 00 6d 00              215.1.176      
                                              7c 00 6c 00  7e 00 6b 00              215.1.184      
                                              7c 00 6f 00  7c 00 6b 00              215.1.192      
  10.2                         524288  IN     6d 00 7c 00  6e 00 7c 00   12ms       216.1.0        
                                              6b 00 7c 00  69 00 7d 00              216.1.8        
                                              6f 00 7f 00  69 00 7c 00              216.1.16       
                                              6b 00 7d 00  6b 00 7c 00              216.1.24       
                                              6d 00 7e 00  6e 00 7c 00              216.1.32       
                                              6e 00 80 00  70 00 7d 00              216.1.40       
                                              6c 00 7c 00  6a 00 7f 00              216.1.48       
                                              6e 00 7d 00  6a 00 79 00              216.1.56       
                                              6a 00 7b 00  6c 00 7b 00              216.1.64       
                                              6b 00 7d 00  6d 00 7e 00              216.1.72       
                                              6f 00 7b 00  6c 00 7b 00              216.1.80       
                                              6e 00 7e 00  6d 00 7d 00              216.1.88       
                                              6c 00 7b 00  6d 00 7c 00              216.1.96       
                                              6d 00 7b 00  6e 00 7e 00              216.1.104      
                                              6d 00 80 00  6c 00 81 00              216.1.112      
                                              6c 00 7c 00  6d 00 7c 00              216.1.120      
                                              6d 00 7d 00  6f 00 7f 00              216.1.128      
                                              71 00 7c 00  6d 00 80 00              216.1.136      
                                              69 00 81 00  69 00 7a 00              216.1.144      
                                              6b 00 7c 00  6c 00 7c 00              216.1.152      
                                              6c 00 7f 00  6b 00 7e 00              216.1.160      
                                              6c 00 7b 00  6c 00 81 00              216.1.168      
                                              6f 00 81 00  6b 00 7f 00              216.1.176      
                                              6d 00 7f 00  6d 00 7d 00              216.1.184      
                                              6b 00 7f 00  6a 00 7f 00              216.1.192      
  10.2                             31  IN     1a 00 00 00  01 00 02 00   41us       217.1.0        
                                              31 84 00 01  04 00 9c 1e              217.1.8        
                                              00 00 01 01  04 00 00 00              217.1.16       
                                              00 00 00 55  aa 55 aa                 217.1.24       
  10.2                         524288  IN     80 00 6d 00  7e 00 71 00  251ms       218.1.0        
                                              7c 00 71 00  7f 00 71 00              218.1.8        
                                              81 00 73 00  81 00 75 00              218.1.16       
                                              7f 00 6e 00  83 00 70 00              218.1.24       
                                              7e 00 73 00  82 00 75 00              218.1.32       
                                              7f 00 77 00  87 00 77 00              218.1.40       
                                              88 00 77 00  82 00 75 00              218.1.48       
                                              85 00 71 00  85 00 77 00              218.1.56       
                                              82 00 6f 00  7e 00 74 00              218.1.64       
                                              84 00 72 00  82 00 72 00              218.1.72       
                                              86 00 76 00  7c 00 75 00              218.1.80       
                                              81 00 73 00  85 00 77 00              218.1.88       
                                              7f 00 71 00  82 00 75 00              218.1.96       
                                              83 00 71 00  84 00 71 00              218.1.104      
                                              84 00 77 00  81 00 77 00              218.1.112      
                                              86 00 73 00  86 00 74 00              218.1.120      
                                              84 00 72 00  82 00 6f 00              218.1.128      
                                              82 00 72 00  81 00 77 00              218.1.136      
                                              84 00 74 00  80 00 75 00              218.1.144      
                                              88 00 71 00  88 00 77 00              218.1.152      
                                              85 00 75 00  80 00 73 00              218.1.160      
                                              7c 00 72 00  86 00 79 00              218.1.168      
                                              83 00 72 00  86 00 75 00              218.1.176      
                                              80 00 79 00  87 00 74 00              218.1.184      
                                              82 00 73 00  86 00 73 00              218.1.192      
  10.2                         524288  IN     7a 00 67 00  7a 00 69 00   11ms       219.1.0        
                                              78 00 6b 00  7b 00 69 00              219.1.8        
                                              79 00 68 00  7a 00 68 00              219.1.16       
                                              7a 00 69 00  7a 00 6b 00              219.1.24       
                                              7c 00 6b 00  7a 00 67 00              219.1.32       
                                              7a 00 69 00  78 00 69 00              219.1.40       
                                              7f 00 6b 00  7c 00 69 00              219.1.48       
                                              7c 00 6c 00  7b 00 69 00              219.1.56       
                                              79 00 6d 00  79 00 6d 00              219.1.64       
                                              78 00 6b 00  7b 00 69 00              219.1.72       
                                              7b 00 6b 00  78 00 69 00              219.1.80       
                                              7b 00 6c 00  79 00 6b 00              219.1.88       
                                              78 00 68 00  7a 00 6b 00              219.1.96       
                                              79 00 6a 00  77 00 67 00              219.1.104      
                                              7c 00 69 00  7c 00 68 00              219.1.112      
                                              7a 00 6a 00  78 00 6c 00              219.1.120      
                                              79 00 6a 00  79 00 6b 00              219.1.128      
                                              7e 00 69 00  79 00 6a 00              219.1.136      
                                              7a 00 68 00  79 00 67 00              219.1.144      
                                              78 00 69 00  78 00 6b 00              219.1.152      
                                              7b 00 68 00  79 00 68 00              219.1.160      
                                              7a 00 6a 00  76 00 69 00              219.1.168      
                                              79 00 6b 00  77 00 69 00              219.1.176      
                                              79 00 6c 00  77 00 69 00              219.1.184      
                                              76 00 65 00  7a 00 69 00              219.1.192      
  10.2                         524288  IN     70 00 7a 00  6b 00 79 00   12ms       220.1.0        
                                              6a 00 79 00  68 00 7a 00              220.1.8        
                                              6a 00 7d 00  6a 00 80 00              220.1.16       
                                              67 00 7f 00  6c 00 7c 00              220.1.24       
                                              6a 00 79 00  68 00 7c 00              220.1.32       
                                              68 00 79 00  6a 00 7e 00              220.1.40       
                                              6b 00 7e 00  6f 00 80 00              220.1.48       
                                              6d 00 78 00  6d 00 7b 00              220.1.56       
                                              6b 00 7b 00  69 00 7e 00              220.1.64       
                                              6d 00 7d 00  6b 00 7c 00              220.1.72       
                                              69 00 7a 00  6c 00 79 00              220.1.80       
                                              6a 00 7e 00  67 00 80 00              220.1.88       
                                              6b 00 79 00  6c 00 7d 00              220.1.96       
                                              6f 00 7c 00  68 00 78 00              220.1.104      
                                              6b 00 7b 00  6d 00 7b 00              220.1.112      
                                              6a 00 7c 00  6c 00 7c 00              220.1.120      
                                              6c 00 7c 00  6b 00 7e 00              220.1.128      
                                              69 00 7a 00  69 00 7c 00              220.1.136      
                                              69 00 7e 00  69 00 7c 00              220.1.144      
                                              6c 00 7c 00  6d 00 7c 00              220.1.152      
                                              6b 00 76 00  6b 00 7c 00              220.1.160      
                                              6f 00 78 00  6c 00 7d 00              220.1.168      
                                              6c 00 7b 00  6d 00 7c 00              220.1.176      
                                              6b 00 7a 00  6a 00 7c 00              220.1.184      
                                              6a 00 7c 00  6b 00 7d 00              220.1.192      
  10.2                         524288  IN     7d 00 6e 00  7d 00 6b 00   13ms       221.1.0        
                                              7b 00 6b 00  81 00 6f 00              221.1.8        
                                              7a 00 6c 00  7c 00 6d 00              221.1.16       
                                              7c 00 6d 00  7b 00 6b 00              221.1.24       
                                              7c 00 6d 00  7d 00 6d 00              221.1.32       
                                              7d 00 6d 00  7b 00 6c 00              221.1.40       
                                              7c 00 6d 00  7f 00 6b 00              221.1.48       
                                              7e 00 6d 00  7d 00 6d 00              221.1.56       
                                              7f 00 6d 00  7e 00 6f 00              221.1.64       
                                              7b 00 6d 00  80 00 6d 00              221.1.72       
                                              7f 00 6b 00  7d 00 6e 00              221.1.80       
                                              7b 00 6b 00  7a 00 6d 00              221.1.88       
                                              7c 00 6a 00  7d 00 6d 00              221.1.96       
                                              7f 00 6b 00  7a 00 6a 00              221.1.104      
                                              7b 00 6a 00  7c 00 6c 00              221.1.112      
                                              7d 00 6d 00  7b 00 6b 00              221.1.120      
                                              7c 00 6f 00  81 00 6b 00              221.1.128      
                                              7a 00 69 00  7c 00 6f 00              221.1.136      
                                              7c 00 6c 00  80 00 6c 00              221.1.144      
                                              7c 00 6d 00  7a 00 6c 00              221.1.152      
                                              7a 00 6b 00  7f 00 6b 00              221.1.160      
                                              7f 00 6d 00  7c 00 6d 00              221.1.168      
                                              7e 00 6f 00  7f 00 6e 00              221.1.176      
                                              7f 00 70 00  7d 00 69 00              221.1.184      
                                              7b 00 6d 00  7c 00 6b 00              221.1.192      
  10.2                         524288  IN     6d 00 7e 00  6e 00 7b 00   12ms       222.1.0        
                                              6e 00 7d 00  6f 00 7c 00              222.1.8        
                                              6c 00 7c 00  6b 00 7b 00              222.1.16       
                                              71 00 7f 00  6e 00 7b 00              222.1.24       
                                              6d 00 7d 00  6f 00 7c 00              222.1.32       
                                              6d 00 7c 00  6f 00 7d 00              222.1.40       
                                              6e 00 7e 00  6f 00 7e 00              222.1.48       
                                              6d 00 7e 00  6c 00 7d 00              222.1.56       
                                              6e 00 7e 00  6f 00 7b 00              222.1.64       
                                              6d 00 7d 00  6f 00 7c 00              222.1.72       
                                              6b 00 7b 00  6f 00 7c 00              222.1.80       
                                              6e 00 7c 00  6d 00 7e 00              222.1.88       
                                              6e 00 7c 00  70 00 7d 00              222.1.96       
                                              6e 00 7e 00  6e 00 7f 00              222.1.104      
                                              6e 00 7e 00  6f 00 7e 00              222.1.112      
                                              6e 00 7e 00  6c 00 7e 00              222.1.120      
                                              70 00 7a 00  6d 00 7c 00              222.1.128      
                                              6d 00 7d 00  6d 00 7e 00              222.1.136      
                                              6d 00 7e 00  6d 00 82 00              222.1.144      
                                              6d 00 80 00  6d 00 7f 00              222.1.152      
                                              6d 00 7b 00  6d 00 7c 00              222.1.160      
                                              6d 00 7e 00  69 00 81 00              222.1.168      
                                              6f 00 7e 00  6c 00 7c 00              222.1.176      
                                              6b 00 7f 00  6b 00 7c 00              222.1.184      
                                              6c 00 84 00  6c 00 7c 00              222.1.192      
  10.2                             31  IN     1a 00 00 00  01 00 02 00   38us       223.1.0        
                                              31 84 00 01  04 00 9d 1e              223.1.8        
                                              00 00 01 01  04 00 00 00              223.1.16       
                                              00 00 00 55  aa 55 aa                 223.1.24       
  10.2                         524288  IN     7e 00 6f 00  81 00 6d 00  249ms       224.1.0        
                                              7e 00 71 00  80 00 71 00              224.1.8        
                                              83 00 6e 00  80 00 70 00              224.1.16       
                                              83 00 6e 00  84 00 70 00              224.1.24       
                                              7f 00 73 00  83 00 72 00              224.1.32       
                                              81 00 75 00  84 00 77 00              224.1.40       
                                              88 00 77 00  80 00 70 00              224.1.48       
                                              84 00 74 00  84 00 75 00              224.1.56       
                                              84 00 71 00  7e 00 75 00              224.1.64       
                                              84 00 73 00  7f 00 70 00              224.1.72       
                                              85 00 77 00  7e 00 6f 00              224.1.80       
                                              86 00 73 00  85 00 75 00              224.1.88       
                                              80 00 6f 00  81 00 71 00              224.1.96       
                                              81 00 75 00  82 00 71 00              224.1.104      
                                              83 00 77 00  83 00 73 00              224.1.112      
                                              86 00 73 00  82 00 75 00              224.1.120      
                                              84 00 75 00  80 00 6f 00              224.1.128      
                                              82 00 72 00  81 00 75 00              224.1.136      
                                              82 00 75 00  84 00 78 00              224.1.144      
                                              84 00 71 00  86 00 77 00              224.1.152      
                                              86 00 74 00  84 00 72 00              224.1.160      
                                              80 00 70 00  84 00 75 00              224.1.168      
                                              80 00 74 00  87 00 75 00              224.1.176      
                                              83 00 75 00  87 00 72 00              224.1.184      
                                              81 00 72 00  84 00 75 00              224.1.192      
  10.2                         524288  IN     7a 00 6d 00  7b 00 6d 00   12ms       225.1.0        
                                              7a 00 6b 00  7c 00 68 00              225.1.8        
                                              7e 00 6c 00  7a 00 6a 00              225.1.16       
                                              7c 00 6b 00  78 00 6b 00              225.1.24       
                                              7c 00 6a 00  7c 00 66 00              225.1.32       
                                              7c 00 6a 00  7a 00 6b 00              225.1.40       
                                              7a 00 6d 00  7a 00 68 00              225.1.48       
                                              7f 00 68 00  7c 00 6b 00              225.1.56       
                                              7c 00 6b 00  7a 00 6b 00              225.1.64       
                                              7d 00 6f 00  79 00 6b 00              225.1.72       
                                              79 00 6c 00  7a 00 69 00              225.1.80       
                                              7c 00 6f 00  7b 00 69 00              225.1.88       
                                              7d 00 6d 00  7a 00 6b 00              225.1.96       
                                              7d 00 6b 00  7d 00 6b 00              225.1.104      
                                              7c 00 69 00  7e 00 6c 00              225.1.112      
                                              79 00 68 00  7b 00 6c 00              225.1.120      
                                              7b 00 6c 00  78 00 6b 00              225.1.128      
                                              7b 00 6c 00  80 00 6a 00              225.1.136      
                                              7b 00 6a 00  7a 00 6b 00              225.1.144      
                                              79 00 6a 00  7a 00 67 00              225.1.152      
                                              79 00 69 00  7a 00 67 00              225.1.160      
                                              7a 00 6b 00  79 00 6d 00              225.1.168      
                                              79 00 6d 00  7c 00 6b 00              225.1.176      
                                              78 00 66 00  7c 00 69 00              225.1.184      
                                              79 00 67 00  7f 00 6d 00              225.1.192      
  10.2                         524288  IN     6d 00 7c 00  6a 00 7c 00   13ms       226.1.0        
                                              68 00 7b 00  6b 00 7a 00              226.1.8        
                                              6b 00 7b 00  67 00 7c 00              226.1.16       
                                              6a 00 7e 00  6e 00 7e 00              226.1.24       
                                              6b 00 79 00  69 00 7e 00              226.1.32       
                                              6b 00 79 00  6d 00 7e 00              226.1.40       
                                              6c 00 80 00  6a 00 7f 00              226.1.48       
                                              6e 00 79 00  6b 00 7b 00              226.1.56       
                                              6c 00 7b 00  6b 00 7d 00              226.1.64       
                                              6b 00 7c 00  6e 00 7d 00              226.1.72       
                                              68 00 7e 00  6c 00 78 00              226.1.80       
                                              6c 00 80 00  6c 00 79 00              226.1.88       
                                              69 00 79 00  6a 00 7c 00              226.1.96       
                                              6c 00 7b 00  69 00 7a 00              226.1.104      
                                              6a 00 7d 00  6e 00 7a 00              226.1.112      
                                              6d 00 7a 00  6c 00 7a 00              226.1.120      
                                              67 00 7f 00  6d 00 7b 00              226.1.128      
                                              6b 00 7b 00  6b 00 7b 00              226.1.136      
                                              6b 00 7e 00  6b 00 7a 00              226.1.144      
                                              6e 00 7d 00  6b 00 7c 00              226.1.152      
                                              6d 00 7e 00  6b 00 7c 00              226.1.160      
                                              6b 00 78 00  6e 00 7c 00              226.1.168      
                                              6a 00 7c 00  69 00 7e 00              226.1.176      
                                              6d 00 7d 00  6b 00 78 00              226.1.184      
                                              69 00 7c 00  6d 00 7c 00              226.1.192      
  10.2                         524288  IN     7b 00 6f 00  7d 00 6b 00   13ms       227.1.0        
                                              7b 00 6e 00  7d 00 71 00              227.1.8        
                                              7d 00 6d 00  79 00 6d 00              227.1.16       
                                              7f 00 6c 00  7f 00 6d 00              227.1.24       
                                              80 00 6e 00  7c 00 6d 00              227.1.32       
                                              7e 00 6b 00  7d 00 6a 00              227.1.40       
                                              7c 00 6c 00  7c 00 6a 00              227.1.48       
                                              7f 00 6d 00  7c 00 69 00              227.1.56       
                                              80 00 6c 00  7e 00 6c 00              227.1.64       
                                              7c 00 6e 00  7c 00 6d 00              227.1.72       
                                              7e 00 6b 00  7d 00 6d 00              227.1.80       
                                              7d 00 6d 00  7e 00 6b 00              227.1.88       
                                              7e 00 6e 00  7e 00 6b 00              227.1.96       
                                              7c 00 6f 00  7d 00 6d 00              227.1.104      
                                              7e 00 6f 00  7c 00 6b 00              227.1.112      
                                              7a 00 6d 00  7f 00 6f 00              227.1.120      
                                              78 00 6e 00  7e 00 6b 00              227.1.128      
                                              7a 00 6d 00  7e 00 6d 00              227.1.136      
                                              7a 00 67 00  7b 00 6d 00              227.1.144      
                                              7e 00 6e 00  7c 00 6f 00              227.1.152      
                                              7d 00 69 00  7c 00 6b 00              227.1.160      
                                              7e 00 6e 00  7c 00 6b 00              227.1.168      
                                              80 00 6c 00  7e 00 6d 00              227.1.176      
                                              7e 00 6b 00  7b 00 6d 00              227.1.184      
                                              7a 00 6b 00  7b 00 6d 00              227.1.192      
  10.2                         524288  IN     6c 00 7b 00  6e 00 7a 00   12ms       228.1.0        
                                              6e 00 7e 00  6d 00 7c 00              228.1.8        
                                              6f 00 7c 00  69 00 7e 00              228.1.16       
                                              6b 00 7b 00  6d 00 7c 00              228.1.24       
                                              6b 00 80 00  6d 00 7b 00              228.1.32       
                                              6d 00 7a 00  6f 00 7f 00              228.1.40       
                                              6d 00 7c 00  69 00 7c 00              228.1.48       
                                              67 00 7c 00  6d 00 7c 00              228.1.56       
                                              6a 00 7a 00  6a 00 7a 00              228.1.64       
                                              6e 00 7a 00  6f 00 7c 00              228.1.72       
                                              6e 00 7a 00  6f 00 7f 00              228.1.80       
                                              6f 00 80 00  6d 00 7e 00              228.1.88       
                                              6e 00 7d 00  70 00 7c 00              228.1.96       
                                              69 00 7e 00  6b 00 7e 00              228.1.104      
                                              6d 00 7f 00  6c 00 7d 00              228.1.112      
                                              6f 00 7f 00  6e 00 7d 00              228.1.120      
                                              71 00 82 00  6d 00 7c 00              228.1.128      
                                              6c 00 80 00  69 00 7e 00              228.1.136      
                                              6f 00 82 00  6d 00 7e 00              228.1.144      
                                              6b 00 7e 00  6b 00 7c 00              228.1.152      
                                              6e 00 7b 00  6b 00 7e 00              228.1.160      
                                              6a 00 7e 00  6a 00 80 00              228.1.168      
                                              70 00 7c 00  68 00 7d 00              228.1.176      
                                              68 00 7b 00  69 00 7e 00              228.1.184      
                                              69 00 82 00  6b 00 7a 00              228.1.192      
  10.2                             31  IN     1a 00 00 00  01 00 02 00   40us       229.1.0        
                                              31 84 00 01  04 00 9e 1e              229.1.8        
                                              00 00 01 01  04 00 00 00              229.1.16       
                                              00 00 00 55  aa 55 aa                 229.1.24       
  10.2                         524288  IN     7d 00 71 00  80 00 71 00  251ms       230.1.0        
                                              7f 00 71 00  7f 00 71 00              230.1.8        
                                              81 00 71 00  82 00 71 00              230.1.16       
                                              80 00 6f 00  84 00 70 00              230.1.24       
                                              7b 00 73 00  84 00 71 00              230.1.32       
                                              82 00 75 00  83 00 77 00              230.1.40       
                                              8b 00 78 00  83 00 72 00              230.1.48       
                                              86 00 76 00  88 00 78 00              230.1.56       
                                              82 00 75 00  83 00 71 00              230.1.64       
                                              85 00 70 00  84 00 6f 00              230.1.72       
                                              84 00 72 00  80 00 71 00              230.1.80       
                                              81 00 77 00  87 00 77 00              230.1.88       
                                              80 00 6f 00  84 00 6f 00              230.1.96       
                                              7d 00 73 00  85 00 6f 00              230.1.104      
                                              84 00 76 00  84 00 74 00              230.1.112      
                                              84 00 73 00  84 00 77 00              230.1.120      
                                              84 00 75 00  83 00 71 00              230.1.128      
                                              82 00 75 00  83 00 72 00              230.1.136      
                                              82 00 75 00  80 00 74 00              230.1.144      
                                              84 00 77 00  88 00 77 00              230.1.152      
                                              87 00 77 00  83 00 73 00              230.1.160      
                                              7e 00 70 00  87 00 75 00              230.1.168      
                                              84 00 75 00  83 00 73 00              230.1.176      
                                              83 00 79 00  87 00 77 00              230.1.184      
                                              85 00 75 00  85 00 75 00              230.1.192      
  10.2                         524288  IN     79 00 6b 00  7c 00 6d 00   11ms       231.1.0        
                                              7a 00 6e 00  7d 00 6b 00              231.1.8        
                                              7d 00 6b 00  7a 00 68 00              231.1.16       
                                              78 00 69 00  7c 00 6b 00              231.1.24       
                                              7e 00 68 00  77 00 68 00              231.1.32       
                                              7b 00 69 00  78 00 6d 00              231.1.40       
                                              7a 00 69 00  7c 00 6c 00              231.1.48       
                                              7c 00 6a 00  7a 00 6c 00              231.1.56       
                                              7c 00 6d 00  78 00 6b 00              231.1.64       
                                              7b 00 6b 00  7c 00 6b 00              231.1.72       
                                              7c 00 69 00  7d 00 6b 00              231.1.80       
                                              7b 00 6b 00  78 00 6c 00              231.1.88       
                                              7c 00 6b 00  78 00 6e 00              231.1.96       
                                              7f 00 68 00  7b 00 6d 00              231.1.104      
                                              7c 00 6b 00  79 00 69 00              231.1.112      
                                              7c 00 6b 00  7b 00 6a 00              231.1.120      
                                              7c 00 6c 00  7a 00 6d 00              231.1.128      
                                              7d 00 67 00  7b 00 6c 00              231.1.136      
                                              7b 00 68 00  7d 00 6b 00              231.1.144      
                                              7c 00 6a 00  76 00 6a 00              231.1.152      
                                              7a 00 69 00  7a 00 69 00              231.1.160      
                                              7a 00 68 00  7b 00 69 00              231.1.168      
                                              7c 00 6c 00  78 00 6a 00              231.1.176      
                                              7c 00 6b 00  7b 00 6d 00              231.1.184      
                                              79 00 68 00  75 00 6b 00              231.1.192      
