Bus Hound 6.00 capture on Windows Vista (x64). Complements of www.perisoft.net

  Device - Device ID (followed by the endpoint for USB devices)
            (6) USB Root Hub (USB 3.0)
            (8) USB Mass Storage Device
            (10) USB2.0 Digital Camera
            (11) USB Composite Device
            (15) Generic Flash Disk [ROM=8.07]
            (20) EarPods
            (21) USB Input Device
            (22) USB Input Device
            (28) HID-compliant consumer control device
            (29) HID-compliant vendor-defined device
            (31) HID Keyboard Device
            (32) HID-compliant consumer control device
            (33) HID-compliant system controller
            (34) HID-compliant vendor-defined device
            (35) HID-compliant vendor-defined device
            (37) HID Keyboard Device
            (38) HID-compliant mouse
            (39) HID-compliant mouse
  Address - FireWire async address or channel number
  Length - Total transfer length
  Phase  - Phase Type
            ASTS  ATA task file status       NTSTS NTSTATUS value
            ATA   ATA task file command      OUT   Data out transfer
            BRB   Bluetooth request block    RESET bus reset
            CMD   SCSI/ATAPI command         SENSE SCSI sense data
            CTL   USB control transfer       SSTS  SCSI request block status
            IN    Data in transfer           USTS  USB status
            ISOC  Isochronous transfer       ok    command complete
            LOCK  FireWire lock transaction
  Data   - Hex dump of the data transferred
  Delta  - Elapsed time from the previous phase to the current phase
  Cmd... - Position in the captured data


Device  Address              Length    Phase  Data                      Delta  Cmd.Phase.Ofs(rep)
------  -------------------  --------  -----  ------------------------  -----  ------------------
  10.2                         524288  IN     60 00 56 00  5e 00 53 00   85ms         1.1.0        
                                              60 00 57 00  62 00 53 00                1.1.8        
                                              62 00 56 00  61 00 55 00                1.1.16       
                                              61 00 55 00  62 00 54 00                1.1.24       
                                              5e 00 55 00  61 00 55 00                1.1.32       
                                              61 00 57 00  64 00 57 00                1.1.40       
                                              68 00 59 00  60 00 55 00                1.1.48       
                                              63 00 57 00  65 00 5a 00                1.1.56       
                                              61 00 55 00  61 00 57 00                1.1.64       
                                              63 00 57 00  60 00 56 00                1.1.72       
                                              64 00 59 00  63 00 53 00                1.1.80       
                                              63 00 56 00  65 00 55 00                1.1.88       
                                              62 00 55 00  62 00 55 00                1.1.96       
                                              62 00 56 00  64 00 57 00                1.1.104      
                                              62 00 5a 00  63 00 56 00                1.1.112      
                                              63 00 58 00  64 00 57 00                1.1.120      
                                              63 00 59 00  61 00 56 00                1.1.128      
                                              5f 00 57 00  61 00 55 00                1.1.136      
                                              62 00 58 00  63 00 59 00                1.1.144      
                                              64 00 57 00  65 00 59 00                1.1.152      
                                              64 00 57 00  63 00 55 00                1.1.160      
                                              5f 00 53 00  64 00 57 00                1.1.168      
                                              61 00 55 00  65 00 56 00                1.1.176      
                                              62 00 58 00  67 00 59 00                1.1.184      
                                              62 00 55 00  64 00 55 00                1.1.192      
  10.2                         524288  IN     5e 00 54 00  5f 00 51 00   12ms         2.1.0        
                                              5c 00 51 00  5f 00 51 00                2.1.8        
                                              5f 00 53 00  5e 00 52 00                2.1.16       
                                              5c 00 51 00  5f 00 52 00                2.1.24       
                                              5e 00 53 00  5e 00 4f 00                2.1.32       
                                              5e 00 50 00  5e 00 52 00                2.1.40       
                                              5e 00 52 00  5f 00 4f 00                2.1.48       
                                              5e 00 52 00  5c 00 52 00                2.1.56       
                                              5e 00 53 00  5c 00 53 00                2.1.64       
                                              5d 00 51 00  5c 00 50 00                2.1.72       
                                              5f 00 51 00  5d 00 52 00                2.1.80       
                                              5e 00 52 00  5d 00 50 00                2.1.88       
                                              5e 00 51 00  5c 00 52 00                2.1.96       
                                              5e 00 51 00  5d 00 50 00                2.1.104      
                                              5e 00 51 00  60 00 50 00                2.1.112      
                                              5c 00 50 00  5d 00 52 00                2.1.120      
                                              5e 00 51 00  5c 00 53 00                2.1.128      
                                              60 00 52 00  5d 00 53 00                2.1.136      
                                              5e 00 50 00  5c 00 53 00                2.1.144      
                                              5c 00 50 00  5d 00 53 00                2.1.152      
                                              5e 00 51 00  5d 00 4f 00                2.1.160      
                                              5c 00 50 00  5c 00 51 00                2.1.168      
                                              5e 00 52 00  5e 00 53 00                2.1.176      
                                              5e 00 51 00  5c 00 52 00                2.1.184      
                                              5b 00 51 00  5c 00 50 00                2.1.192      
  10.2                         524288  IN     56 00 5b 00  4e 00 5d 00   13ms         3.1.0        
                                              53 00 5f 00  51 00 5c 00                3.1.8        
                                              4f 00 5e 00  51 00 5e 00                3.1.16       
                                              53 00 5c 00  51 00 5d 00                3.1.24       
                                              51 00 5d 00  52 00 60 00                3.1.32       
                                              51 00 5c 00  55 00 5f 00                3.1.40       
                                              51 00 5f 00  52 00 5f 00                3.1.48       
                                              53 00 60 00  52 00 5e 00                3.1.56       
                                              52 00 5c 00  54 00 60 00                3.1.64       
                                              53 00 5f 00  51 00 5e 00                3.1.72       
                                              4f 00 5f 00  52 00 5e 00                3.1.80       
                                              51 00 60 00  51 00 5e 00                3.1.88       
                                              51 00 5f 00  51 00 5d 00                3.1.96       
                                              52 00 5e 00  4f 00 5e 00                3.1.104      
                                              53 00 5f 00  51 00 5f 00                3.1.112      
                                              52 00 5c 00  51 00 5c 00                3.1.120      
                                              54 00 5c 00  4f 00 5e 00                3.1.128      
                                              51 00 5f 00  50 00 5e 00                3.1.136      
                                              54 00 5f 00  50 00 5d 00                3.1.144      
                                              52 00 5e 00  53 00 5c 00                3.1.152      
                                              51 00 5d 00  52 00 5e 00                3.1.160      
                                              52 00 5e 00  53 00 5d 00                3.1.168      
                                              51 00 5e 00  52 00 5e 00                3.1.176      
                                              51 00 5e 00  50 00 5e 00                3.1.184      
                                              53 00 5d 00  53 00 5e 00                3.1.192      
  10.2                         524288  IN     5d 00 51 00  5f 00 52 00   13ms         4.1.0        
                                              5e 00 53 00  60 00 53 00                4.1.8        
                                              5d 00 53 00  5f 00 52 00                4.1.16       
                                              5d 00 53 00  5e 00 53 00                4.1.24       
                                              60 00 54 00  61 00 50 00                4.1.32       
                                              5e 00 51 00  5e 00 51 00                4.1.40       
                                              5f 00 51 00  5f 00 53 00                4.1.48       
                                              5d 00 52 00  5f 00 51 00                4.1.56       
                                              5e 00 53 00  5e 00 53 00                4.1.64       
                                              60 00 53 00  5e 00 51 00                4.1.72       
                                              5e 00 55 00  5d 00 53 00                4.1.80       
                                              5c 00 53 00  5d 00 4f 00                4.1.88       
                                              5d 00 52 00  5f 00 53 00                4.1.96       
                                              5f 00 53 00  5d 00 52 00                4.1.104      
                                              5e 00 53 00  5c 00 54 00                4.1.112      
                                              60 00 53 00  5f 00 52 00                4.1.120      
                                              5d 00 55 00  60 00 52 00                4.1.128      
                                              5e 00 52 00  5e 00 52 00                4.1.136      
                                              5b 00 53 00  5f 00 51 00                4.1.144      
                                              5f 00 52 00  5e 00 52 00                4.1.152      
                                              5c 00 51 00  5e 00 52 00                4.1.160      
                                              5e 00 51 00  5c 00 51 00                4.1.168      
                                              5c 00 4f 00  5e 00 51 00                4.1.176      
                                              5f 00 53 00  5d 00 51 00                4.1.184      
                                              5f 00 51 00  5e 00 52 00                4.1.192      
  10.2                         524288  IN     51 00 5e 00  50 00 5e 00   13ms         5.1.0        
                                              52 00 5e 00  51 00 5c 00                5.1.8        
                                              4f 00 5e 00  50 00 5f 00                5.1.16       
                                              54 00 5d 00  51 00 5d 00                5.1.24       
                                              52 00 5e 00  53 00 5f 00                5.1.32       
                                              53 00 5c 00  54 00 60 00                5.1.40       
                                              51 00 5d 00  51 00 5c 00                5.1.48       
                                              51 00 5f 00  52 00 5d 00                5.1.56       
                                              50 00 5d 00  52 00 5d 00                5.1.64       
                                              51 00 5f 00  51 00 5c 00                5.1.72       
                                              53 00 5f 00  53 00 5c 00                5.1.80       
                                              51 00 5f 00  52 00 5e 00                5.1.88       
                                              53 00 60 00  55 00 5f 00                5.1.96       
                                              51 00 5c 00  51 00 60 00                5.1.104      
                                              53 00 60 00  52 00 5e 00                5.1.112      
                                              53 00 5d 00  52 00 5d 00                5.1.120      
                                              53 00 5e 00  52 00 5d 00                5.1.128      
                                              50 00 5e 00  51 00 5e 00                5.1.136      
                                              53 00 60 00  53 00 5c 00                5.1.144      
                                              51 00 5f 00  50 00 5f 00                5.1.152      
                                              53 00 5f 00  51 00 5f 00                5.1.160      
                                              51 00 5e 00  4f 00 61 00                5.1.168      
                                              54 00 5b 00  53 00 5d 00                5.1.176      
                                              51 00 5e 00  4f 00 5d 00                5.1.184      
                                              51 00 5f 00  52 00 5e 00                5.1.192      
  10.2                             31  IN     1a 00 00 00  01 00 02 00   44us         6.1.0        
                                              31 84 00 01  04 00 33 22                6.1.8        
                                              00 00 01 01  04 00 00 00                6.1.16       
                                              00 00 00 55  aa 55 aa                   6.1.24       
  10.2                         524288  IN     60 00 54 00  60 00 57 00  249ms         7.1.0        
                                              61 00 56 00  61 00 55 00                7.1.8        
                                              61 00 54 00  63 00 56 00                7.1.16       
                                              61 00 53 00  64 00 57 00                7.1.24       
                                              60 00 57 00  64 00 55 00                7.1.32       
                                              60 00 59 00  62 00 58 00                7.1.40       
                                              64 00 58 00  62 00 55 00                7.1.48       
                                              64 00 58 00  66 00 5b 00                7.1.56       
                                              63 00 55 00  66 00 55 00                7.1.64       
                                              64 00 56 00  61 00 54 00                7.1.72       
                                              63 00 56 00  61 00 57 00                7.1.80       
                                              65 00 56 00  66 00 57 00                7.1.88       
                                              61 00 56 00  61 00 56 00                7.1.96       
                                              62 00 57 00  62 00 54 00                7.1.104      
                                              62 00 5b 00  64 00 56 00                7.1.112      
                                              64 00 56 00  63 00 57 00                7.1.120      
                                              64 00 59 00  64 00 56 00                7.1.128      
                                              61 00 57 00  62 00 59 00                7.1.136      
                                              64 00 58 00  63 00 59 00                7.1.144      
                                              64 00 57 00  65 00 5a 00                7.1.152      
                                              65 00 55 00  60 00 56 00                7.1.160      
                                              5e 00 55 00  63 00 5a 00                7.1.168      
                                              61 00 59 00  64 00 57 00                7.1.176      
                                              64 00 59 00  64 00 57 00                7.1.184      
                                              63 00 55 00  64 00 56 00                7.1.192      
  10.2                         524288  IN     5e 00 52 00  5e 00 51 00   12ms         8.1.0        
                                              5c 00 52 00  5e 00 53 00                8.1.8        
                                              5e 00 51 00  5e 00 53 00                8.1.16       
                                              5f 00 51 00  5b 00 51 00                8.1.24       
                                              5f 00 51 00  5c 00 51 00                8.1.32       
                                              5e 00 51 00  5e 00 51 00                8.1.40       
                                              5c 00 51 00  5e 00 51 00                8.1.48       
                                              5f 00 50 00  5e 00 50 00                8.1.56       
                                              5e 00 52 00  5e 00 54 00                8.1.64       
                                              5e 00 53 00  5d 00 52 00                8.1.72       
                                              5e 00 51 00  5c 00 4f 00                8.1.80       
                                              5c 00 52 00  5e 00 51 00                8.1.88       
                                              5c 00 52 00  5e 00 52 00                8.1.96       
                                              5e 00 4f 00  5c 00 52 00                8.1.104      
                                              5c 00 50 00  5c 00 51 00                8.1.112      
                                              5e 00 52 00  5e 00 52 00                8.1.120      
                                              5b 00 52 00  5c 00 52 00                8.1.128      
                                              5e 00 51 00  5e 00 51 00                8.1.136      
                                              5c 00 4f 00  5f 00 53 00                8.1.144      
                                              5b 00 51 00  5e 00 51 00                8.1.152      
                                              5b 00 50 00  5d 00 50 00                8.1.160      
                                              5d 00 50 00  5d 00 51 00                8.1.168      
                                              5d 00 51 00  5c 00 51 00                8.1.176      
                                              5e 00 51 00  5c 00 51 00                8.1.184      
                                              5c 00 4d 00  5e 00 53 00                8.1.192      
  10.2                         524288  IN     55 00 5d 00  50 00 5f 00   12ms         9.1.0        
                                              51 00 5d 00  51 00 5f 00                9.1.8        
                                              52 00 5d 00  4f 00 60 00                9.1.16       
                                              51 00 60 00  52 00 5e 00                9.1.24       
                                              51 00 5e 00  52 00 60 00                9.1.32       
                                              4f 00 5e 00  51 00 5d 00                9.1.40       
                                              51 00 5f 00  51 00 5f 00                9.1.48       
                                              52 00 5f 00  53 00 5f 00                9.1.56       
                                              51 00 5c 00  51 00 63 00                9.1.64       
                                              53 00 5e 00  51 00 60 00                9.1.72       
                                              53 00 5e 00  53 00 5d 00                9.1.80       
                                              51 00 5e 00  51 00 60 00                9.1.88       
                                              51 00 5e 00  53 00 5d 00                9.1.96       
                                              54 00 60 00  53 00 60 00                9.1.104      
                                              53 00 5f 00  50 00 5f 00                9.1.112      
                                              52 00 5c 00  51 00 5e 00                9.1.120      
                                              51 00 5c 00  52 00 5c 00                9.1.128      
                                              50 00 5e 00  51 00 5c 00                9.1.136      
                                              51 00 5f 00  51 00 5d 00                9.1.144      
                                              54 00 5d 00  54 00 5e 00                9.1.152      
                                              53 00 5d 00  54 00 5e 00                9.1.160      
                                              52 00 5f 00  53 00 61 00                9.1.168      
                                              50 00 5c 00  52 00 5e 00                9.1.176      
                                              53 00 5f 00  51 00 5e 00                9.1.184      
                                              51 00 5c 00  51 00 5c 00                9.1.192      
  10.2                         524288  IN     5e 00 52 00  5e 00 55 00   13ms        10.1.0        
                                              5c 00 54 00  5d 00 52 00               10.1.8        
                                              5d 00 52 00  5c 00 53 00               10.1.16       
                                              5f 00 52 00  5f 00 53 00               10.1.24       
                                              60 00 55 00  60 00 52 00               10.1.32       
                                              5f 00 50 00  5f 00 52 00               10.1.40       
                                              5c 00 53 00  60 00 51 00               10.1.48       
                                              5d 00 51 00  5f 00 51 00               10.1.56       
                                              5f 00 52 00  5f 00 52 00               10.1.64       
                                              5d 00 55 00  62 00 52 00               10.1.72       
                                              60 00 4f 00  5e 00 4f 00               10.1.80       
                                              5c 00 54 00  5f 00 50 00               10.1.88       
                                              5d 00 54 00  60 00 53 00               10.1.96       
                                              60 00 55 00  5c 00 53 00               10.1.104      
                                              5c 00 51 00  5e 00 53 00               10.1.112      
                                              5e 00 53 00  5e 00 53 00               10.1.120      
                                              5e 00 52 00  5f 00 51 00               10.1.128      
                                              5f 00 51 00  5c 00 52 00               10.1.136      
                                              5b 00 52 00  5f 00 53 00               10.1.144      
                                              5e 00 52 00  5c 00 51 00               10.1.152      
                                              5c 00 52 00  60 00 55 00               10.1.160      
                                              60 00 51 00  5f 00 53 00               10.1.168      
                                              5c 00 51 00  5f 00 54 00               10.1.176      
                                              60 00 52 00  5b 00 51 00               10.1.184      
                                              5d 00 51 00  5e 00 52 00               10.1.192      
  10.2                         524288  IN     4f 00 5f 00  54 00 5e 00   13ms        11.1.0        
                                              53 00 60 00  51 00 5d 00               11.1.8        
                                              53 00 5e 00  51 00 5e 00               11.1.16       
                                              53 00 5d 00  53 00 5e 00               11.1.24       
                                              51 00 5f 00  53 00 60 00               11.1.32       
                                              54 00 5e 00  53 00 5e 00               11.1.40       
                                              53 00 5d 00  51 00 5f 00               11.1.48       
                                              51 00 5e 00  51 00 62 00               11.1.56       
                                              53 00 5d 00  53 00 5d 00               11.1.64       
                                              51 00 60 00  52 00 60 00               11.1.72       
                                              50 00 60 00  50 00 60 00               11.1.80       
                                              53 00 60 00  54 00 5e 00               11.1.88       
                                              53 00 60 00  53 00 5c 00               11.1.96       
                                              54 00 5e 00  52 00 5f 00               11.1.104      
                                              53 00 5e 00  52 00 5e 00               11.1.112      
                                              54 00 5f 00  52 00 5d 00               11.1.120      
                                              54 00 60 00  51 00 5e 00               11.1.128      
                                              52 00 61 00  53 00 60 00               11.1.136      
                                              55 00 60 00  53 00 60 00               11.1.144      
                                              50 00 60 00  51 00 5c 00               11.1.152      
                                              50 00 5e 00  53 00 5c 00               11.1.160      
                                              54 00 5f 00  51 00 61 00               11.1.168      
                                              53 00 60 00  51 00 5f 00               11.1.176      
                                              53 00 60 00  51 00 5e 00               11.1.184      
                                              51 00 62 00  52 00 60 00               11.1.192      
  10.2                             31  IN     1a 00 00 00  01 00 02 00   34us        12.1.0        
                                              31 84 00 01  04 00 34 22               12.1.8        
                                              00 00 01 01  04 00 00 00               12.1.16       
                                              00 00 00 55  aa 55 aa                  12.1.24       
  10.2                         524288  IN     60 00 54 00  60 00 56 00  249ms        13.1.0        
                                              61 00 56 00  62 00 57 00               13.1.8        
                                              64 00 55 00  5e 00 53 00               13.1.16       
                                              60 00 54 00  63 00 55 00               13.1.24       
                                              60 00 57 00  62 00 55 00               13.1.32       
                                              60 00 56 00  61 00 56 00               13.1.40       
                                              65 00 59 00  60 00 57 00               13.1.48       
                                              63 00 59 00  63 00 58 00               13.1.56       
                                              61 00 58 00  62 00 58 00               13.1.64       
                                              65 00 54 00  5f 00 56 00               13.1.72       
                                              64 00 56 00  61 00 57 00               13.1.80       
                                              62 00 57 00  64 00 58 00               13.1.88       
                                              61 00 56 00  63 00 55 00               13.1.96       
                                              61 00 56 00  64 00 56 00               13.1.104      
                                              64 00 58 00  64 00 57 00               13.1.112      
                                              64 00 57 00  64 00 57 00               13.1.120      
                                              65 00 58 00  63 00 53 00               13.1.128      
                                              61 00 57 00  61 00 58 00               13.1.136      
                                              63 00 57 00  62 00 57 00               13.1.144      
                                              64 00 58 00  64 00 59 00               13.1.152      
                                              64 00 56 00  63 00 55 00               13.1.160      
                                              61 00 53 00  66 00 59 00               13.1.168      
                                              60 00 55 00  62 00 58 00               13.1.176      
                                              62 00 5b 00  66 00 56 00               13.1.184      
                                              60 00 57 00  63 00 56 00               13.1.192      
  10.2                         524288  IN     5e 00 53 00  5d 00 51 00   12ms        14.1.0        
                                              5d 00 51 00  5c 00 50 00               14.1.8        
                                              5e 00 51 00  5e 00 52 00               14.1.16       
                                              5a 00 51 00  5e 00 51 00               14.1.24       
                                              5c 00 4f 00  5c 00 53 00               14.1.32       
                                              5e 00 51 00  5e 00 51 00               14.1.40       
                                              5c 00 4f 00  5c 00 51 00               14.1.48       
                                              5e 00 4f 00  5c 00 50 00               14.1.56       
                                              5f 00 53 00  5c 00 52 00               14.1.64       
                                              5e 00 52 00  5d 00 4f 00               14.1.72       
                                              5b 00 51 00  5c 00 52 00               14.1.80       
                                              5d 00 51 00  5d 00 54 00               14.1.88       
                                              5d 00 51 00  5c 00 4f 00               14.1.96       
                                              5c 00 51 00  5e 00 4f 00               14.1.104      
                                              5d 00 51 00  60 00 52 00               14.1.112      
                                              5b 00 4f 00  5e 00 51 00               14.1.120      
                                              5e 00 50 00  5a 00 51 00               14.1.128      
                                              5e 00 52 00  5c 00 53 00               14.1.136      
                                              5d 00 50 00  5d 00 52 00               14.1.144      
                                              5c 00 51 00  5d 00 4f 00               14.1.152      
                                              5c 00 52 00  5c 00 50 00               14.1.160      
                                              5c 00 4f 00  5e 00 52 00               14.1.168      
                                              5d 00 51 00  59 00 51 00               14.1.176      
                                              5c 00 51 00  5d 00 4f 00               14.1.184      
                                              5c 00 51 00  5e 00 53 00               14.1.192      
  10.2                         524288  IN     53 00 5d 00  4f 00 5d 00   14ms        15.1.0        
                                              50 00 5e 00  52 00 5d 00               15.1.8        
                                              52 00 5d 00  51 00 5e 00               15.1.16       
                                              51 00 5e 00  53 00 5d 00               15.1.24       
                                              51 00 5f 00  54 00 5f 00               15.1.32       
                                              51 00 5e 00  51 00 60 00               15.1.40       
                                              51 00 60 00  51 00 5e 00               15.1.48       
                                              53 00 5f 00  51 00 5d 00               15.1.56       
                                              52 00 5c 00  52 00 5f 00               15.1.64       
                                              51 00 5f 00  52 00 5d 00               15.1.72       
                                              51 00 5f 00  53 00 5c 00               15.1.80       
                                              50 00 60 00  53 00 60 00               15.1.88       
                                              52 00 5b 00  52 00 5e 00               15.1.96       
                                              53 00 5f 00  51 00 5e 00               15.1.104      
                                              52 00 5d 00  51 00 5f 00               15.1.112      
                                              51 00 5e 00  51 00 5e 00               15.1.120      
                                              51 00 5e 00  51 00 5e 00               15.1.128      
                                              53 00 5f 00  53 00 5e 00               15.1.136      
                                              50 00 5e 00  51 00 60 00               15.1.144      
                                              51 00 5e 00  52 00 5e 00               15.1.152      
                                              50 00 5e 00  50 00 5c 00               15.1.160      
                                              52 00 5f 00  51 00 5d 00               15.1.168      
                                              4f 00 5d 00  51 00 60 00               15.1.176      
                                              53 00 5c 00  51 00 5d 00               15.1.184      
                                              51 00 5f 00  52 00 5e 00               15.1.192      
  10.2                         524288  IN     5d 00 52 00  61 00 50 00   11ms        16.1.0        
                                              5d 00 53 00  5f 00 53 00               16.1.8        
                                              5f 00 52 00  5c 00 52 00               16.1.16       
                                              5c 00 52 00  5f 00 51 00               16.1.24       
                                              5c 00 53 00  5d 00 4f 00               16.1.32       
                                              5e 00 51 00  5e 00 51 00               16.1.40       
                                              5e 00 51 00  5e 00 52 00               16.1.48       
                                              5e 00 52 00  5c 00 51 00               16.1.56       
                                              5f 00 51 00  5e 00 51 00               16.1.64       
                                              5c 00 51 00  60 00 52 00               16.1.72       
                                              5e 00 52 00  5e 00 51 00               16.1.80       
                                              5c 00 51 00  5e 00 51 00               16.1.88       
                                              5e 00 53 00  5e 00 52 00               16.1.96       
                                              5e 00 53 00  5c 00 4f 00               16.1.104      
                                              5e 00 51 00  5e 00 53 00               16.1.112      
                                              5d 00 53 00  5d 00 4f 00               16.1.120      
                                              5a 00 51 00  5e 00 53 00               16.1.128      
                                              5c 00 55 00  5f 00 54 00               16.1.136      
                                              60 00 51 00  5d 00 51 00               16.1.144      
                                              5f 00 51 00  5c 00 54 00               16.1.152      
                                              5f 00 51 00  60 00 51 00               16.1.160      
                                              5c 00 52 00  5e 00 50 00               16.1.168      
                                              5c 00 52 00  5d 00 53 00               16.1.176      
                                              60 00 51 00  5d 00 53 00               16.1.184      
                                              5e 00 50 00  5b 00 50 00               16.1.192      
  10.2                         524288  IN     51 00 5c 00  53 00 5e 00   13ms        17.1.0        
                                              51 00 5e 00  4f 00 5e 00               17.1.8        
                                              53 00 5e 00  51 00 5e 00               17.1.16       
                                              51 00 60 00  52 00 5e 00               17.1.24       
                                              51 00 5e 00  52 00 5e 00               17.1.32       
                                              53 00 5d 00  52 00 5f 00               17.1.40       
                                              52 00 5c 00  50 00 5e 00               17.1.48       
                                              4f 00 5f 00  52 00 5f 00               17.1.56       
                                              52 00 5f 00  52 00 5d 00               17.1.64       
                                              51 00 5e 00  51 00 5d 00               17.1.72       
                                              53 00 5d 00  51 00 5d 00               17.1.80       
                                              50 00 5f 00  55 00 5e 00               17.1.88       
                                              51 00 5e 00  52 00 5e 00               17.1.96       
                                              52 00 5d 00  50 00 61 00               17.1.104      
                                              51 00 5e 00  52 00 5e 00               17.1.112      
                                              52 00 5c 00  4f 00 5c 00               17.1.120      
                                              55 00 5e 00  51 00 5e 00               17.1.128      
                                              55 00 5d 00  50 00 62 00               17.1.136      
                                              51 00 60 00  53 00 5e 00               17.1.144      
                                              51 00 5c 00  52 00 60 00               17.1.152      
                                              53 00 5e 00  4e 00 5e 00               17.1.160      
                                              52 00 5c 00  52 00 63 00               17.1.168      
                                              54 00 5c 00  50 00 5c 00               17.1.176      
                                              50 00 60 00  50 00 5c 00               17.1.184      
                                              54 00 63 00  51 00 5f 00               17.1.192      
  10.2                             31  IN     1a 00 00 00  01 00 02 00   39us        18.1.0        
                                              31 84 00 01  04 00 35 22               18.1.8        
                                              00 00 01 01  04 00 00 00               18.1.16       
                                              00 00 00 55  aa 55 aa                  18.1.24       
  10.2                         524288  IN     60 00 54 00  60 00 55 00  250ms        19.1.0        
                                              60 00 56 00  62 00 54 00               19.1.8        
                                              62 00 56 00  61 00 54 00               19.1.16       
                                              61 00 54 00  65 00 57 00               19.1.24       
                                              60 00 55 00  60 00 55 00               19.1.32       
                                              62 00 57 00  62 00 5b 00               19.1.40       
                                              64 00 56 00  62 00 57 00               19.1.48       
                                              62 00 57 00  62 00 56 00               19.1.56       
                                              64 00 53 00  5f 00 57 00               19.1.64       
                                              64 00 57 00  62 00 55 00               19.1.72       
                                              63 00 56 00  60 00 55 00               19.1.80       
                                              63 00 57 00  63 00 56 00               19.1.88       
                                              62 00 55 00  61 00 57 00               19.1.96       
                                              5f 00 55 00  64 00 55 00               19.1.104      
                                              63 00 5a 00  64 00 54 00               19.1.112      
                                              61 00 54 00  64 00 56 00               19.1.120      
                                              63 00 58 00  65 00 56 00               19.1.128      
                                              61 00 54 00  62 00 56 00               19.1.136      
                                              62 00 55 00  64 00 59 00               19.1.144      
                                              64 00 57 00  64 00 59 00               19.1.152      
                                              66 00 59 00  62 00 57 00               19.1.160      
                                              5f 00 57 00  64 00 58 00               19.1.168      
                                              61 00 55 00  64 00 56 00               19.1.176      
                                              61 00 59 00  62 00 54 00               19.1.184      
                                              61 00 54 00  61 00 57 00               19.1.192      
  10.2                         524288  IN     5c 00 52 00  5d 00 50 00   19ms        20.1.0        
                                              5d 00 52 00  5d 00 53 00               20.1.8        
                                              5d 00 50 00  5f 00 52 00               20.1.16       
                                              5d 00 52 00  5d 00 52 00               20.1.24       
                                              5d 00 50 00  5e 00 51 00               20.1.32       
                                              5e 00 51 00  5e 00 51 00               20.1.40       
                                              5e 00 52 00  5d 00 52 00               20.1.48       
                                              60 00 50 00  5e 00 52 00               20.1.56       
                                              5d 00 50 00  5f 00 50 00               20.1.64       
                                              5d 00 53 00  5d 00 4f 00               20.1.72       
                                              5c 00 51 00  5c 00 51 00               20.1.80       
                                              5c 00 55 00  5d 00 52 00               20.1.88       
                                              5d 00 52 00  5e 00 54 00               20.1.96       
                                              5d 00 4f 00  5d 00 50 00               20.1.104      
                                              5d 00 51 00  5e 00 50 00               20.1.112      
                                              5d 00 51 00  5d 00 51 00               20.1.120      
                                              5c 00 4f 00  5c 00 51 00               20.1.128      
                                              5e 00 51 00  5e 00 53 00               20.1.136      
                                              5a 00 51 00  5c 00 51 00               20.1.144      
                                              5f 00 51 00  5b 00 4f 00               20.1.152      
                                              5e 00 4f 00  5c 00 50 00               20.1.160      
                                              5c 00 4f 00  5c 00 4f 00               20.1.168      
                                              5d 00 51 00  5e 00 54 00               20.1.176      
                                              5b 00 51 00  5c 00 51 00               20.1.184      
                                              5d 00 51 00  5d 00 51 00               20.1.192      
  10.2                         524288  IN     55 00 5d 00  52 00 5b 00  6.8ms        21.1.0        
                                              54 00 5f 00  4f 00 5c 00               21.1.8        
                                              51 00 5e 00  51 00 5f 00               21.1.16       
                                              50 00 60 00  53 00 5e 00               21.1.24       
                                              50 00 5d 00  53 00 5f 00               21.1.32       
                                              51 00 60 00  52 00 60 00               21.1.40       
                                              53 00 60 00  50 00 5f 00               21.1.48       
                                              52 00 60 00  51 00 5c 00               21.1.56       
                                              51 00 5f 00  51 00 60 00               21.1.64       
                                              52 00 5e 00  4f 00 5e 00               21.1.72       
                                              51 00 5f 00  53 00 5c 00               21.1.80       
                                              52 00 60 00  52 00 60 00               21.1.88       
                                              51 00 5e 00  53 00 5c 00               21.1.96       
                                              50 00 5e 00  52 00 5c 00               21.1.104      
                                              53 00 5e 00  53 00 5e 00               21.1.112      
                                              51 00 5d 00  52 00 60 00               21.1.120      
                                              52 00 5c 00  50 00 5e 00               21.1.128      
                                              53 00 5f 00  51 00 5f 00               21.1.136      
                                              51 00 5f 00  51 00 5f 00               21.1.144      
                                              50 00 5e 00  54 00 5c 00               21.1.152      
                                              53 00 5c 00  53 00 60 00               21.1.160      
                                              53 00 5e 00  52 00 5d 00               21.1.168      
                                              51 00 5e 00  51 00 5d 00               21.1.176      
                                              51 00 5c 00  53 00 5f 00               21.1.184      
                                              51 00 5e 00  51 00 5e 00               21.1.192      
  10.2                         524288  IN     5a 00 55 00  5f 00 51 00   13ms        22.1.0        
                                              5b 00 51 00  5e 00 50 00               22.1.8        
                                              5e 00 53 00  5c 00 51 00               22.1.16       
                                              5c 00 52 00  5f 00 53 00               22.1.24       
                                              5f 00 51 00  5d 00 55 00               22.1.32       
                                              5c 00 53 00  5f 00 51 00               22.1.40       
                                              5d 00 55 00  5e 00 51 00               22.1.48       
                                              5c 00 51 00  61 00 51 00               22.1.56       
                                              5f 00 53 00  5e 00 53 00               22.1.64       
                                              5d 00 53 00  5f 00 53 00               22.1.72       
                                              5d 00 50 00  5e 00 52 00               22.1.80       
                                              5e 00 53 00  5c 00 53 00               22.1.88       
                                              5f 00 53 00  60 00 51 00               22.1.96       
                                              5e 00 53 00  5e 00 51 00               22.1.104      
                                              5f 00 55 00  5c 00 53 00               22.1.112      
                                              5f 00 52 00  5e 00 51 00               22.1.120      
                                              5d 00 52 00  61 00 54 00               22.1.128      
                                              5f 00 53 00  60 00 56 00               22.1.136      
                                              5e 00 52 00  5d 00 53 00               22.1.144      
                                              5d 00 53 00  5b 00 51 00               22.1.152      
                                              5e 00 51 00  5d 00 51 00               22.1.160      
                                              5d 00 52 00  5e 00 52 00               22.1.168      
                                              60 00 51 00  5d 00 53 00               22.1.176      
                                              5f 00 53 00  5f 00 53 00               22.1.184      
                                              5e 00 53 00  5e 00 51 00               22.1.192      
  10.2                         524288  IN     51 00 5d 00  52 00 5e 00   12ms        23.1.0        
                                              51 00 5d 00  50 00 5d 00               23.1.8        
                                              52 00 61 00  51 00 5d 00               23.1.16       
                                              53 00 5e 00  51 00 5e 00               23.1.24       
                                              51 00 5d 00  53 00 5d 00               23.1.32       
                                              53 00 5f 00  54 00 5f 00               23.1.40       
                                              52 00 5e 00  52 00 5e 00               23.1.48       
                                              51 00 5c 00  4f 00 5c 00               23.1.56       
                                              51 00 5e 00  51 00 5b 00               23.1.64       
                                              52 00 60 00  51 00 5c 00               23.1.72       
                                              51 00 5e 00  53 00 5c 00               23.1.80       
                                              51 00 5f 00  51 00 5e 00               23.1.88       
                                              53 00 5e 00  51 00 5c 00               23.1.96       
                                              55 00 60 00  51 00 5f 00               23.1.104      
                                              4f 00 5e 00  52 00 5e 00               23.1.112      
                                              51 00 5e 00  51 00 60 00               23.1.120      
                                              53 00 5f 00  52 00 5e 00               23.1.128      
                                              53 00 5e 00  53 00 5f 00               23.1.136      
                                              53 00 60 00  52 00 5c 00               23.1.144      
                                              52 00 5d 00  51 00 5d 00               23.1.152      
                                              51 00 5d 00  51 00 5d 00               23.1.160      
                                              52 00 5e 00  51 00 62 00               23.1.168      
                                              52 00 5f 00  4f 00 5c 00               23.1.176      
                                              4f 00 5f 00  53 00 5e 00               23.1.184      
                                              51 00 61 00  51 00 5c 00               23.1.192      
  10.2                             31  IN     1a 00 00 00  01 00 02 00  1.8ms        24.1.0        
                                              31 84 00 01  04 00 36 22               24.1.8        
                                              00 00 01 01  04 00 00 00               24.1.16       
                                              00 00 00 55  aa 55 aa                  24.1.24       
  10.0                                 CTL    80 06 00 01  00 00 12 00  141ms        25.1.0        
  10.0                             18  IN     12 01 00 02  00 00 00 40   84us        25.2.0        
                                              48 44 70 56  40 1b 01 02               25.2.8        
                                              00 01                                  25.2.16       
  10.0                                 CTL    80 06 00 03  00 00 02 00   15us        26.1.0        
  10.0                              2  IN     04 03                      48us        26.2.0        
  10.0                                 CTL    80 06 00 03  00 00 04 00    9us        27.1.0        
  10.0                              4  IN     04 03 09 04                43us        27.2.0        
  10.0                                 CTL    80 06 01 03  09 04 02 00   30us        28.1.0        
  10.0                              2  IN     06 03                      89us        28.2.0        
  10.0                                 CTL    80 06 01 03  09 04 06 00   10us        29.1.0        
  10.0                              6  IN     06 03 54 00  33 00         68us        29.2.0        
  10.0                                 CTL    80 06 02 03  09 04 02 00   10us        30.1.0        
  10.0                              2  IN     1a 03                      66us        30.2.0        
  10.0                                 CTL    80 06 02 03  09 04 1a 00   10us        31.1.0        
  10.0                             26  IN     1a 03 52 00  48 00 31 00   65us        31.2.0        
                                              30 00 31 00  35 00 30 00               31.2.8        
                                              30 00 35 00  30 00 32 00               31.2.16       
                                              31 00                                  31.2.24       
  10.0                                 CTL    80 06 00 03  09 04 02 00   12us        32.1.0        
  10.0                              2  IN     04 03                      43us        32.2.0        
  10.0                                 CTL    80 06 00 03  09 04 04 00    9us        33.1.0        
  10.0                              4  IN     04 03 09 04                65us        33.2.0        
  10.0                                 CTL    80 06 02 03  09 04 02 00  2.0ms        34.1.0        
  10.0                              2  IN     1a 03                      67us        34.2.0        
  10.0                                 CTL    80 06 02 03  09 04 1a 00   11us        35.1.0        
  10.0                             26  IN     1a 03 52 00  48 00 31 00   64us        35.2.0        
                                              30 00 31 00  35 00 30 00               35.2.8        
                                              30 00 35 00  30 00 32 00               35.2.16       
                                              31 00                                  35.2.24       
  10.0                                 CTL    80 06 01 03  00 00 20 00  171us        36.1.0        
  10.0                              6  IN     06 03 54 00  33 00         81us        36.2.0        
  10.0                                 CTL    c0 e1 00 00  00 00 04 00   39us        37.1.0        
  10.0                              4  IN     03 0b 00 00               2.2ms        37.2.0        
  10.0                                 CTL    c0 b4 00 00  00 00 01 00   43us        38.1.0(2)     
  10.0                              1  IN     54                         80us        38.2.0        
  10.0                                 CTL    c0 e1 00 00  04 00 40 00  119us        40.1.0        
  10.0                             64  IN     00 00 00 00  01 01 00 00  4.0ms        40.2.0        
                                              0f 44 61 68  65 6e 67 20               40.2.8        
                                              49 6d 61 67  69 6e 67 00               40.2.16       
                                              20 00 00 00  01 01 00 00               40.2.24       
                                              0f 4d 45 52  2d 31 33 30               40.2.32       
                                              2d 33 30 55  4d 2d 4c 00               40.2.40       
                                              80 00 00 00  01 01 00 00               40.2.48       
                                              0d 52 48 31  30 31 35 30               40.2.56       
  10.0                                 CTL    c0 b4 00 00  00 00 01 00   42us        41.1.0(2)     
  10.0                              1  IN     54                         77us        41.2.0        
  10.0                                 CTL    c0 e1 00 00  44 00 40 00  105us        43.1.0        
  10.0                             64  IN     30 35 30 32  31 00 90 00  5.2ms        43.2.0        
                                              00 00 01 01  00 00 03 36               43.2.8        
                                              37 00 04 01  00 00 01 01               43.2.16       
                                              00 00 0a 31  32 33 34 56               43.2.24       
                                              33 32 30 33  00 14 01 00               43.2.32       
                                              00 01 01 00  00 0e 31 2e               43.2.40       
                                              31 2e 31 33  30 35 2e 39               43.2.48       
                                              33 30 31 00  00 02 00 00               43.2.56       
  10.0                                 CTL    c0 b4 00 00  00 00 01 00   31us        44.1.0(2)     
  10.0                              1  IN     54                         74us        44.2.0        
  10.0                                 CTL    80 06 02 03  00 00 20 00  106us        46.1.0        
  10.0                             26  IN     1a 03 52 00  48 00 31 00   77us        46.2.0        
                                              30 00 31 00  35 00 30 00               46.2.8        
                                              30 00 35 00  30 00 32 00               46.2.16       
                                              31 00                                  46.2.24       
  10.0                                 CTL    80 06 00 01  00 00 12 00  694us        47.1.0        
  10.0                             18  IN     12 01 00 02  00 00 00 40   55us        47.2.0        
                                              48 44 70 56  40 1b 01 02               47.2.8        
                                              00 01                                  47.2.16       
  10.0                                 CTL    80 06 00 03  00 00 02 00   26us        48.1.0        
  10.0                              2  IN     04 03                      86us        48.2.0        
  10.0                                 CTL    80 06 00 03  00 00 04 00   11us        49.1.0        
  10.0                              4  IN     04 03 09 04                44us        49.2.0        
  10.0                                 CTL    80 06 01 03  09 04 02 00    9us        50.1.0        
  10.0                              2  IN     06 03                      65us        50.2.0        
  10.0                                 CTL    80 06 01 03  09 04 06 00   10us        51.1.0        
  10.0                              6  IN     06 03 54 00  33 00         65us        51.2.0        
  10.0                                 CTL    80 06 02 03  09 04 02 00    9us        52.1.0        
  10.0                              2  IN     1a 03                      65us        52.2.0        
  10.0                                 CTL    80 06 02 03  09 04 1a 00   10us        53.1.0        
  10.0                             26  IN     1a 03 52 00  48 00 31 00   65us        53.2.0        
                                              30 00 31 00  35 00 30 00               53.2.8        
                                              30 00 35 00  30 00 32 00               53.2.16       
                                              31 00                                  53.2.24       
  10.0                                 CTL    80 06 00 03  09 04 02 00   10us        54.1.0        
  10.0                              2  IN     04 03                      43us        54.2.0        
  10.0                                 CTL    80 06 00 03  09 04 04 00    9us        55.1.0        
  10.0                              4  IN     04 03 09 04                64us        55.2.0        
  10.0                                 CTL    80 06 02 03  09 04 02 00  603us        56.1.0        
  10.0                              2  IN     1a 03                      71us        56.2.0        
  10.0                                 CTL    80 06 02 03  09 04 1a 00    9us        57.1.0        
  10.0                             26  IN     1a 03 52 00  48 00 31 00   64us        57.2.0        
                                              30 00 31 00  35 00 30 00               57.2.8        
                                              30 00 35 00  30 00 32 00               57.2.16       
                                              31 00                                  57.2.24       
  10.0                                 CTL    80 06 01 03  00 00 20 00  175us        58.1.0        
  10.0                              6  IN     06 03 54 00  33 00         53us        58.2.0        
  10.0                                 CTL    c0 e1 00 00  00 00 04 00   21us        59.1.0        
  10.0                              4  IN     03 0b 00 00               1.5ms        59.2.0        
  10.0                                 CTL    c0 b4 00 00  00 00 01 00   28us        60.1.0(2)     
  10.0                              1  IN     54                         74us        60.2.0        
  10.0                                 CTL    c0 e1 00 00  04 00 40 00  101us        62.1.0        
  10.0                             64  IN     00 00 00 00  01 01 00 00  4.2ms        62.2.0        
                                              0f 44 61 68  65 6e 67 20               62.2.8        
                                              49 6d 61 67  69 6e 67 00               62.2.16       
                                              20 00 00 00  01 01 00 00               62.2.24       
                                              0f 4d 45 52  2d 31 33 30               62.2.32       
                                              2d 33 30 55  4d 2d 4c 00               62.2.40       
                                              80 00 00 00  01 01 00 00               62.2.48       
                                              0d 52 48 31  30 31 35 30               62.2.56       
  10.0                                 CTL    c0 b4 00 00  00 00 01 00   58us        63.1.0(2)     
  10.0                              1  IN     54                        155us        63.2.0        
  10.0                                 CTL    c0 e1 00 00  44 00 40 00  118us        65.1.0        
  10.0                             64  IN     30 35 30 32  31 00 90 00  4.0ms        65.2.0        
                                              00 00 01 01  00 00 03 36               65.2.8        
                                              37 00 04 01  00 00 01 01               65.2.16       
                                              00 00 0a 31  32 33 34 56               65.2.24       
                                              33 32 30 33  00 14 01 00               65.2.32       
                                              00 01 01 00  00 0e 31 2e               65.2.40       
                                              31 2e 31 33  30 35 2e 39               65.2.48       
                                              33 30 31 00  00 02 00 00               65.2.56       
  10.0                                 CTL    c0 b4 00 00  00 00 01 00   32us        66.1.0(2)     
  10.0                              1  IN     54                         90us        66.2.0        
  10.0                                 CTL    80 06 02 03  00 00 20 00  111us        68.1.0        
  10.0                             26  IN     1a 03 52 00  48 00 31 00   70us        68.2.0        
                                              30 00 31 00  35 00 30 00               68.2.8        
                                              30 00 35 00  30 00 32 00               68.2.16       
                                              31 00                                  68.2.24       
  10.2                         524288  IN     62 00 53 00  60 00 55 00   78ms        69.1.0        
                                              60 00 56 00  62 00 54 00               69.1.8        
                                              62 00 53 00  62 00 57 00               69.1.16       
                                              61 00 53 00  64 00 56 00               69.1.24       
                                              60 00 56 00  61 00 54 00               69.1.32       
                                              61 00 56 00  61 00 58 00               69.1.40       
                                              64 00 57 00  60 00 55 00               69.1.48       
                                              63 00 58 00  65 00 5b 00               69.1.56       
                                              63 00 57 00  62 00 57 00               69.1.64       
                                              62 00 56 00  61 00 56 00               69.1.72       
                                              64 00 58 00  62 00 56 00               69.1.80       
                                              64 00 57 00  64 00 58 00               69.1.88       
                                              60 00 56 00  62 00 57 00               69.1.96       
                                              62 00 57 00  64 00 58 00               69.1.104      
                                              62 00 5b 00  63 00 57 00               69.1.112      
                                              65 00 57 00  64 00 58 00               69.1.120      
                                              66 00 56 00  65 00 55 00               69.1.128      
                                              62 00 57 00  64 00 55 00               69.1.136      
                                              61 00 56 00  62 00 5b 00               69.1.144      
                                              64 00 57 00  61 00 59 00               69.1.152      
                                              62 00 56 00  61 00 57 00               69.1.160      
                                              62 00 55 00  64 00 58 00               69.1.168      
                                              63 00 57 00  63 00 57 00               69.1.176      
                                              63 00 59 00  64 00 58 00               69.1.184      
                                              63 00 56 00  61 00 59 00               69.1.192      
  10.2                         524288  IN     5f 00 53 00  5c 00 50 00   12ms        70.1.0        
                                              5c 00 53 00  5c 00 50 00               70.1.8        
                                              5e 00 51 00  5c 00 50 00               70.1.16       
                                              5c 00 50 00  5c 00 53 00               70.1.24       
                                              5e 00 51 00  5e 00 4d 00               70.1.32       
                                              5f 00 53 00  5e 00 51 00               70.1.40       
                                              5e 00 53 00  5e 00 52 00               70.1.48       
                                              5e 00 50 00  5e 00 51 00               70.1.56       
                                              5d 00 51 00  5f 00 51 00               70.1.64       
                                              5e 00 51 00  5f 00 53 00               70.1.72       
                                              5d 00 4e 00  5e 00 51 00               70.1.80       
                                              5f 00 50 00  5d 00 51 00               70.1.88       
                                              5e 00 51 00  5c 00 50 00               70.1.96       
                                              5f 00 4f 00  60 00 4f 00               70.1.104      
                                              5d 00 51 00  5e 00 4f 00               70.1.112      
                                              5d 00 51 00  5f 00 53 00               70.1.120      
                                              5d 00 51 00  5e 00 53 00               70.1.128      
                                              5c 00 52 00  5c 00 53 00               70.1.136      
                                              5d 00 51 00  5e 00 50 00               70.1.144      
                                              5d 00 4e 00  5b 00 51 00               70.1.152      
                                              5e 00 4f 00  5e 00 50 00               70.1.160      
                                              5d 00 52 00  5d 00 4f 00               70.1.168      
                                              5d 00 53 00  5e 00 50 00               70.1.176      
                                              5e 00 50 00  5b 00 50 00               70.1.184      
                                              5d 00 50 00  5b 00 51 00               70.1.192      
  10.2                         524288  IN     55 00 60 00  50 00 60 00   14ms        71.1.0        
                                              51 00 5d 00  50 00 5e 00               71.1.8        
                                              51 00 5f 00  53 00 5d 00               71.1.16       
                                              51 00 5f 00  53 00 5d 00               71.1.24       
                                              51 00 5c 00  51 00 5f 00               71.1.32       
                                              50 00 5e 00  52 00 60 00               71.1.40       
                                              51 00 5c 00  51 00 60 00               71.1.48       
                                              53 00 60 00  51 00 5f 00               71.1.56       
                                              55 00 5f 00  51 00 61 00               71.1.64       
                                              52 00 5e 00  51 00 5e 00               71.1.72       
                                              4f 00 5c 00  51 00 5e 00               71.1.80       
                                              53 00 5e 00  51 00 60 00               71.1.88       
                                              51 00 5e 00  53 00 5e 00               71.1.96       
                                              55 00 5f 00  53 00 5e 00               71.1.104      
                                              51 00 5f 00  51 00 5f 00               71.1.112      
                                              51 00 5d 00  52 00 5f 00               71.1.120      
                                              53 00 5d 00  50 00 5e 00               71.1.128      
                                              53 00 5e 00  52 00 5c 00               71.1.136      
                                              4f 00 5d 00  51 00 5c 00               71.1.144      
                                              53 00 5d 00  51 00 5c 00               71.1.152      
                                              53 00 5c 00  51 00 5c 00               71.1.160      
                                              55 00 5e 00  52 00 5e 00               71.1.168      
                                              51 00 5e 00  51 00 5e 00               71.1.176      
                                              4f 00 5c 00  53 00 5c 00               71.1.184      
                                              50 00 5c 00  51 00 5d 00               71.1.192      
  10.2                         524288  IN     5c 00 53 00  60 00 52 00   11ms        72.1.0        
                                              5f 00 53 00  60 00 52 00               72.1.8        
                                              5e 00 4f 00  5f 00 51 00               72.1.16       
                                              5b 00 53 00  60 00 51 00               72.1.24       
                                              5e 00 51 00  60 00 52 00               72.1.32       
                                              5e 00 51 00  5e 00 51 00               72.1.40       
                                              5e 00 54 00  5e 00 51 00               72.1.48       
                                              5c 00 52 00  5e 00 50 00               72.1.56       
                                              5f 00 50 00  5e 00 51 00               72.1.64       
                                              5e 00 54 00  60 00 53 00               72.1.72       
                                              60 00 53 00  5d 00 53 00               72.1.80       
                                              5e 00 54 00  5e 00 52 00               72.1.88       
                                              5d 00 53 00  5e 00 52 00               72.1.96       
                                              5f 00 53 00  5f 00 51 00               72.1.104      
                                              5d 00 51 00  5e 00 52 00               72.1.112      
                                              60 00 51 00  5e 00 53 00               72.1.120      
                                              5e 00 53 00  60 00 51 00               72.1.128      
                                              60 00 50 00  5e 00 53 00               72.1.136      
                                              5c 00 51 00  5e 00 51 00               72.1.144      
                                              5f 00 52 00  5e 00 52 00               72.1.152      
                                              5f 00 52 00  60 00 52 00               72.1.160      
                                              5e 00 50 00  5e 00 50 00               72.1.168      
                                              5c 00 50 00  5f 00 52 00               72.1.176      
                                              60 00 53 00  5f 00 52 00               72.1.184      
                                              5c 00 53 00  5e 00 51 00               72.1.192      
  10.2                         524288  IN     52 00 5f 00  51 00 60 00   12ms        73.1.0        
                                              51 00 5f 00  4f 00 5f 00               73.1.8        
                                              53 00 5f 00  52 00 5f 00               73.1.16       
                                              53 00 5d 00  50 00 5d 00               73.1.24       
                                              53 00 5c 00  54 00 5c 00               73.1.32       
                                              51 00 5e 00  57 00 5e 00               73.1.40       
                                              52 00 5e 00  50 00 5e 00               73.1.48       
                                              53 00 5e 00  51 00 60 00               73.1.56       
                                              51 00 5e 00  51 00 5c 00               73.1.64       
                                              54 00 60 00  54 00 5f 00               73.1.72       
                                              54 00 5e 00  54 00 5d 00               73.1.80       
                                              54 00 5e 00  53 00 5e 00               73.1.88       
                                              52 00 5e 00  51 00 5f 00               73.1.96       
                                              51 00 5d 00  50 00 5f 00               73.1.104      
                                              55 00 5f 00  53 00 5d 00               73.1.112      
                                              53 00 5f 00  51 00 5e 00               73.1.120      
                                              54 00 5c 00  53 00 61 00               73.1.128      
                                              55 00 60 00  51 00 5e 00               73.1.136      
                                              53 00 60 00  51 00 5d 00               73.1.144      
                                              51 00 5d 00  51 00 5c 00               73.1.152      
                                              52 00 5d 00  51 00 5f 00               73.1.160      
                                              53 00 5d 00  53 00 61 00               73.1.168      
                                              54 00 5f 00  4f 00 5e 00               73.1.176      
                                              53 00 5e 00  4f 00 5e 00               73.1.184      
                                              53 00 60 00  52 00 5f 00               73.1.192      
  10.2                             31  IN     1a 00 00 00  01 00 02 00   30us        74.1.0        
                                              31 84 00 01  04 00 37 22               74.1.8        
                                              00 00 01 01  04 00 00 00               74.1.16       
                                              00 00 00 55  aa 55 aa                  74.1.24       
  10.2                         524288  IN     5f 00 55 00  5f 00 53 00  250ms        75.1.0        
                                              60 00 55 00  61 00 57 00               75.1.8        
                                              62 00 55 00  60 00 54 00               75.1.16       
                                              61 00 53 00  65 00 53 00               75.1.24       
                                              61 00 56 00  62 00 55 00               75.1.32       
                                              60 00 56 00  62 00 59 00               75.1.40       
                                              65 00 57 00  63 00 56 00               75.1.48       
                                              63 00 59 00  65 00 59 00               75.1.56       
                                              64 00 55 00  64 00 57 00               75.1.64       
                                              66 00 57 00  62 00 55 00               75.1.72       
                                              61 00 55 00  60 00 57 00               75.1.80       
                                              62 00 58 00  65 00 5a 00               75.1.88       
                                              62 00 58 00  63 00 58 00               75.1.96       
                                              63 00 57 00  65 00 55 00               75.1.104      
                                              63 00 5a 00  63 00 56 00               75.1.112      
                                              63 00 54 00  63 00 58 00               75.1.120      
                                              60 00 56 00  64 00 57 00               75.1.128      
                                              60 00 57 00  64 00 57 00               75.1.136      
                                              62 00 55 00  61 00 58 00               75.1.144      
                                              64 00 57 00  64 00 59 00               75.1.152      
                                              64 00 56 00  62 00 57 00               75.1.160      
                                              60 00 56 00  64 00 57 00               75.1.168      
                                              63 00 55 00  63 00 58 00               75.1.176      
                                              63 00 58 00  64 00 57 00               75.1.184      
                                              62 00 55 00  63 00 56 00               75.1.192      
  10.2                         524288  IN     5d 00 51 00  5e 00 50 00   13ms        76.1.0        
                                              5c 00 51 00  5c 00 51 00               76.1.8        
                                              60 00 52 00  5f 00 50 00               76.1.16       
                                              5d 00 52 00  5e 00 52 00               76.1.24       
                                              5e 00 4f 00  5d 00 51 00               76.1.32       
                                              5e 00 50 00  5c 00 51 00               76.1.40       
                                              5e 00 53 00  5e 00 51 00               76.1.48       
                                              60 00 51 00  5c 00 53 00               76.1.56       
                                              5c 00 52 00  5f 00 52 00               76.1.64       
                                              5c 00 51 00  60 00 53 00               76.1.72       
                                              5d 00 51 00  5e 00 53 00               76.1.80       
                                              5e 00 53 00  5e 00 52 00               76.1.88       
                                              5e 00 53 00  5e 00 52 00               76.1.96       
                                              5e 00 51 00  5f 00 4f 00               76.1.104      
                                              5d 00 4f 00  5f 00 50 00               76.1.112      
                                              5b 00 51 00  5d 00 53 00               76.1.120      
                                              5f 00 51 00  5c 00 4f 00               76.1.128      
                                              5e 00 4f 00  5e 00 50 00               76.1.136      
                                              5d 00 51 00  5d 00 50 00               76.1.144      
                                              5f 00 4f 00  5c 00 54 00               76.1.152      
                                              5c 00 50 00  5e 00 50 00               76.1.160      
                                              5d 00 4f 00  5c 00 51 00               76.1.168      
                                              5c 00 51 00  5c 00 4f 00               76.1.176      
                                              5f 00 52 00  5c 00 50 00               76.1.184      
                                              5e 00 50 00  5b 00 53 00               76.1.192      
  10.2                         524288  IN     54 00 5c 00  4f 00 5d 00   12ms        77.1.0        
                                              52 00 61 00  50 00 5f 00               77.1.8        
                                              52 00 5e 00  52 00 5e 00               77.1.16       
                                              4f 00 5f 00  51 00 60 00               77.1.24       
                                              51 00 60 00  50 00 5c 00               77.1.32       
                                              4f 00 5f 00  54 00 5c 00               77.1.40       
                                              52 00 5e 00  51 00 5d 00               77.1.48       
                                              55 00 5e 00  53 00 5c 00               77.1.56       
                                              53 00 60 00  53 00 60 00               77.1.64       
                                              51 00 5f 00  53 00 5f 00               77.1.72       
                                              52 00 60 00  51 00 5e 00               77.1.80       
                                              51 00 5f 00  53 00 60 00               77.1.88       
                                              51 00 5e 00  51 00 5e 00               77.1.96       
                                              52 00 5f 00  51 00 5f 00               77.1.104      
                                              53 00 5e 00  52 00 5e 00               77.1.112      
                                              54 00 5e 00  50 00 5e 00               77.1.120      
                                              51 00 60 00  53 00 5f 00               77.1.128      
                                              53 00 5f 00  52 00 5d 00               77.1.136      
                                              51 00 5e 00  52 00 60 00               77.1.144      
                                              52 00 5f 00  52 00 5f 00               77.1.152      
                                              52 00 60 00  51 00 5c 00               77.1.160      
                                              53 00 5e 00  53 00 5e 00               77.1.168      
                                              51 00 5f 00  52 00 5b 00               77.1.176      
                                              52 00 5c 00  53 00 5c 00               77.1.184      
                                              53 00 5d 00  51 00 5e 00               77.1.192      
  10.2                         524288  IN     5e 00 53 00  60 00 52 00   15ms        78.1.0        
                                              5e 00 54 00  62 00 53 00               78.1.8        
                                              5e 00 51 00  5f 00 52 00               78.1.16       
                                              60 00 55 00  61 00 53 00               78.1.24       
                                              61 00 53 00  5f 00 51 00               78.1.32       
                                              5d 00 53 00  5f 00 54 00               78.1.40       
                                              5d 00 51 00  5c 00 52 00               78.1.48       
                                              5f 00 53 00  5f 00 51 00               78.1.56       
                                              62 00 54 00  5f 00 53 00               78.1.64       
                                              60 00 53 00  61 00 51 00               78.1.72       
                                              60 00 51 00  61 00 52 00               78.1.80       
                                              5f 00 53 00  5c 00 51 00               78.1.88       
                                              60 00 54 00  60 00 52 00               78.1.96       
                                              62 00 55 00  5f 00 53 00               78.1.104      
                                              5d 00 53 00  61 00 52 00               78.1.112      
                                              5d 00 53 00  60 00 53 00               78.1.120      
                                              60 00 53 00  60 00 51 00               78.1.128      
                                              5f 00 55 00  5f 00 53 00               78.1.136      
                                              5c 00 53 00  5f 00 52 00               78.1.144      
                                              5d 00 53 00  5e 00 52 00               78.1.152      
                                              5e 00 51 00  60 00 51 00               78.1.160      
                                              60 00 51 00  5e 00 51 00               78.1.168      
                                              60 00 51 00  5c 00 52 00               78.1.176      
                                              60 00 52 00  5c 00 54 00               78.1.184      
                                              5f 00 53 00  5e 00 53 00               78.1.192      
  10.2                         524288  IN     51 00 5e 00  53 00 5e 00   16ms        79.1.0        
                                              53 00 5e 00  50 00 5e 00               79.1.8        
                                              53 00 5e 00  53 00 60 00               79.1.16       
                                              52 00 5e 00  50 00 60 00               79.1.24       
                                              52 00 5f 00  55 00 5e 00               79.1.32       
                                              52 00 5e 00  54 00 5e 00               79.1.40       
                                              53 00 5e 00  52 00 5f 00               79.1.48       
                                              52 00 5f 00  53 00 5e 00               79.1.56       
                                              53 00 5e 00  51 00 5e 00               79.1.64       
                                              4f 00 5f 00  53 00 60 00               79.1.72       
                                              53 00 5e 00  52 00 5e 00               79.1.80       
                                              53 00 5f 00  52 00 5f 00               79.1.88       
                                              53 00 5f 00  53 00 5e 00               79.1.96       
                                              54 00 60 00  51 00 62 00               79.1.104      
                                              53 00 5d 00  53 00 60 00               79.1.112      
                                              54 00 5e 00  52 00 60 00               79.1.120      
                                              52 00 60 00  54 00 5f 00               79.1.128      
                                              53 00 5d 00  51 00 60 00               79.1.136      
                                              54 00 61 00  53 00 61 00               79.1.144      
                                              51 00 5e 00  53 00 5e 00               79.1.152      
                                              53 00 60 00  51 00 60 00               79.1.160      
                                              50 00 5e 00  51 00 63 00               79.1.168      
                                              55 00 5f 00  52 00 5d 00               79.1.176      
                                              53 00 5e 00  53 00 5e 00               79.1.184      
                                              51 00 63 00  51 00 60 00               79.1.192      
  10.2                             31  IN     1a 00 00 00  01 00 02 00  9.5ms        80.1.0        
                                              31 84 00 01  04 00 38 22               80.1.8        
                                              00 00 01 01  04 00 00 00               80.1.16       
                                              00 00 00 55  aa 55 aa                  80.1.24       
  10.2                         524288  IN     5f 00 54 00  5f 00 55 00  234ms        81.1.0        
                                              62 00 56 00  63 00 53 00               81.1.8        
                                              62 00 55 00  61 00 57 00               81.1.16       
                                              64 00 54 00  64 00 57 00               81.1.24       
                                              60 00 57 00  60 00 55 00               81.1.32       
                                              5f 00 55 00  62 00 57 00               81.1.40       
                                              63 00 57 00  63 00 53 00               81.1.48       
                                              63 00 57 00  61 00 59 00               81.1.56       
                                              64 00 57 00  61 00 58 00               81.1.64       
                                              62 00 5a 00  60 00 58 00               81.1.72       
                                              62 00 57 00  63 00 56 00               81.1.80       
                                              63 00 57 00  64 00 59 00               81.1.88       
                                              64 00 55 00  62 00 57 00               81.1.96       
                                              62 00 56 00  65 00 57 00               81.1.104      
                                              62 00 5b 00  66 00 56 00               81.1.112      
                                              62 00 57 00  62 00 59 00               81.1.120      
                                              64 00 59 00  63 00 57 00               81.1.128      
                                              62 00 58 00  63 00 57 00               81.1.136      
                                              61 00 57 00  63 00 5a 00               81.1.144      
                                              64 00 59 00  64 00 59 00               81.1.152      
                                              64 00 56 00  61 00 58 00               81.1.160      
                                              62 00 55 00  64 00 56 00               81.1.168      
                                              62 00 57 00  62 00 58 00               81.1.176      
                                              64 00 5a 00  65 00 59 00               81.1.184      
                                              63 00 56 00  65 00 57 00               81.1.192      
  10.2                         524288  IN     5d 00 51 00  5e 00 53 00   12ms        82.1.0        
                                              5c 00 51 00  5f 00 51 00               82.1.8        
                                              5f 00 52 00  5f 00 51 00               82.1.16       
                                              5c 00 53 00  5e 00 52 00               82.1.24       
                                              5e 00 50 00  60 00 52 00               82.1.32       
                                              5d 00 53 00  5c 00 4e 00               82.1.40       
                                              5d 00 51 00  5d 00 4f 00               82.1.48       
                                              5e 00 53 00  5e 00 51 00               82.1.56       
                                              5e 00 52 00  5d 00 52 00               82.1.64       
                                              5c 00 51 00  5d 00 51 00               82.1.72       
                                              5c 00 51 00  5c 00 51 00               82.1.80       
                                              5d 00 50 00  5c 00 51 00               82.1.88       
                                              5e 00 50 00  5b 00 52 00               82.1.96       
                                              5f 00 4e 00  5c 00 4f 00               82.1.104      
                                              5c 00 51 00  5f 00 50 00               82.1.112      
                                              5d 00 4e 00  5e 00 51 00               82.1.120      
                                              5e 00 4f 00  5c 00 53 00               82.1.128      
                                              5c 00 4e 00  5e 00 51 00               82.1.136      
                                              5d 00 4f 00  5d 00 51 00               82.1.144      
                                              5f 00 4f 00  5d 00 4f 00               82.1.152      
                                              5c 00 51 00  5b 00 51 00               82.1.160      
                                              5f 00 4f 00  5c 00 51 00               82.1.168      
                                              5e 00 51 00  5c 00 51 00               82.1.176      
                                              5c 00 4f 00  5c 00 50 00               82.1.184      
                                              5d 00 50 00  5e 00 54 00               82.1.192      
  10.2                         524288  IN     55 00 5c 00  50 00 5e 00   12ms        83.1.0        
                                              50 00 60 00  51 00 5f 00               83.1.8        
                                              53 00 5d 00  52 00 5e 00               83.1.16       
                                              4f 00 5f 00  52 00 5f 00               83.1.24       
                                              53 00 5d 00  51 00 5e 00               83.1.32       
                                              50 00 5e 00  51 00 5d 00               83.1.40       
                                              50 00 60 00  52 00 5e 00               83.1.48       
                                              54 00 60 00  53 00 5e 00               83.1.56       
                                              52 00 5b 00  53 00 60 00               83.1.64       
                                              53 00 5d 00  4f 00 60 00               83.1.72       
                                              51 00 60 00  51 00 5f 00               83.1.80       
                                              51 00 5e 00  52 00 5d 00               83.1.88       
                                              53 00 5f 00  51 00 5a 00               83.1.96       
                                              54 00 5e 00  51 00 5c 00               83.1.104      
                                              53 00 5f 00  52 00 5f 00               83.1.112      
                                              50 00 5c 00  51 00 5e 00               83.1.120      
                                              53 00 5c 00  51 00 5d 00               83.1.128      
                                              54 00 5f 00  51 00 5e 00               83.1.136      
                                              51 00 60 00  51 00 5f 00               83.1.144      
                                              54 00 5c 00  53 00 5e 00               83.1.152      
                                              53 00 60 00  4f 00 5c 00               83.1.160      
                                              56 00 5c 00  52 00 5e 00               83.1.168      
                                              51 00 5e 00  51 00 60 00               83.1.176      
                                              50 00 5e 00  52 00 5b 00               83.1.184      
                                              52 00 60 00  52 00 5f 00               83.1.192      
  10.2                         524288  IN     5c 00 51 00  5e 00 51 00   13ms        84.1.0        
                                              5c 00 53 00  60 00 52 00               84.1.8        
                                              5d 00 51 00  5e 00 55 00               84.1.16       
                                              5c 00 51 00  5e 00 52 00               84.1.24       
                                              60 00 53 00  5f 00 53 00               84.1.32       
                                              5d 00 53 00  5f 00 52 00               84.1.40       
                                              5c 00 51 00  5c 00 52 00               84.1.48       
                                              5c 00 52 00  5f 00 51 00               84.1.56       
                                              5e 00 53 00  5d 00 51 00               84.1.64       
                                              5e 00 53 00  5e 00 51 00               84.1.72       
                                              5e 00 52 00  5c 00 53 00               84.1.80       
                                              5d 00 52 00  5d 00 51 00               84.1.88       
                                              5d 00 51 00  5f 00 54 00               84.1.96       
                                              5e 00 52 00  5e 00 51 00               84.1.104      
                                              5e 00 51 00  60 00 53 00               84.1.112      
                                              5e 00 53 00  5e 00 52 00               84.1.120      
                                              61 00 52 00  5f 00 52 00               84.1.128      
                                              5e 00 53 00  60 00 53 00               84.1.136      
                                              5e 00 53 00  60 00 4f 00               84.1.144      
                                              5e 00 52 00  5d 00 51 00               84.1.152      
                                              5e 00 51 00  5e 00 51 00               84.1.160      
                                              5e 00 51 00  5e 00 4f 00               84.1.168      
                                              60 00 51 00  60 00 51 00               84.1.176      
                                              60 00 53 00  5f 00 53 00               84.1.184      
                                              5c 00 52 00  5f 00 53 00               84.1.192      
  10.2                         524288  IN     53 00 5e 00  51 00 5e 00   13ms        85.1.0        
                                              53 00 5f 00  55 00 5f 00               85.1.8        
                                              54 00 5c 00  52 00 60 00               85.1.16       
                                              50 00 5d 00  52 00 5e 00               85.1.24       
                                              51 00 5e 00  53 00 60 00               85.1.32       
                                              53 00 5f 00  55 00 5e 00               85.1.40       
                                              53 00 5f 00  51 00 60 00               85.1.48       
                                              53 00 5e 00  51 00 5e 00               85.1.56       
                                              53 00 5e 00  53 00 5c 00               85.1.64       
                                              52 00 5f 00  55 00 5e 00               85.1.72       
                                              52 00 5e 00  55 00 61 00               85.1.80       
                                              53 00 60 00  52 00 5f 00               85.1.88       
                                              53 00 5e 00  53 00 5e 00               85.1.96       
                                              52 00 5d 00  53 00 5f 00               85.1.104      
                                              54 00 5f 00  54 00 5e 00               85.1.112      
                                              53 00 5f 00  51 00 60 00               85.1.120      
                                              53 00 5f 00  55 00 5e 00               85.1.128      
                                              53 00 5f 00  54 00 5c 00               85.1.136      
                                              51 00 60 00  53 00 5f 00               85.1.144      
                                              51 00 5e 00  53 00 5f 00               85.1.152      
                                              52 00 5c 00  51 00 5f 00               85.1.160      
                                              52 00 5f 00  52 00 62 00               85.1.168      
                                              53 00 60 00  52 00 5c 00               85.1.176      
                                              52 00 60 00  53 00 60 00               85.1.184      
                                              53 00 62 00  53 00 5c 00               85.1.192      
  10.2                             31  IN     1a 00 00 00  01 00 02 00   38us        86.1.0        
                                              31 84 00 01  04 00 39 22               86.1.8        
                                              00 00 01 01  04 00 00 00               86.1.16       
                                              00 00 00 55  aa 55 aa                  86.1.24       
  10.2                         524288  IN     62 00 54 00  62 00 56 00  249ms        87.1.0        
                                              60 00 56 00  62 00 54 00               87.1.8        
                                              61 00 55 00  62 00 55 00               87.1.16       
                                              62 00 53 00  64 00 53 00               87.1.24       
                                              61 00 59 00  62 00 56 00               87.1.32       
                                              61 00 58 00  63 00 58 00               87.1.40       
                                              67 00 59 00  61 00 56 00               87.1.48       
                                              64 00 58 00  64 00 59 00               87.1.56       
                                              64 00 58 00  64 00 56 00               87.1.64       
                                              64 00 57 00  61 00 56 00               87.1.72       
                                              64 00 56 00  64 00 56 00               87.1.80       
                                              62 00 57 00  62 00 58 00               87.1.88       
                                              62 00 53 00  61 00 59 00               87.1.96       
                                              63 00 59 00  63 00 57 00               87.1.104      
                                              63 00 5a 00  63 00 57 00               87.1.112      
                                              63 00 55 00  63 00 58 00               87.1.120      
                                              63 00 56 00  63 00 55 00               87.1.128      
                                              61 00 55 00  65 00 59 00               87.1.136      
                                              64 00 55 00  61 00 57 00               87.1.144      
                                              65 00 57 00  65 00 59 00               87.1.152      
                                              65 00 54 00  63 00 55 00               87.1.160      
                                              61 00 57 00  65 00 59 00               87.1.168      
                                              61 00 57 00  64 00 57 00               87.1.176      
                                              62 00 5a 00  65 00 57 00               87.1.184      
                                              62 00 57 00  62 00 59 00               87.1.192      
  10.2                         524288  IN     5c 00 51 00  5f 00 51 00   13ms        88.1.0        
                                              5c 00 51 00  5d 00 54 00               88.1.8        
                                              5d 00 51 00  5e 00 50 00               88.1.16       
                                              5c 00 4f 00  5e 00 51 00               88.1.24       
                                              5e 00 51 00  5e 00 50 00               88.1.32       
                                              5d 00 4f 00  5d 00 52 00               88.1.40       
                                              5e 00 50 00  5d 00 51 00               88.1.48       
                                              5f 00 50 00  5b 00 50 00               88.1.56       
                                              5f 00 50 00  5e 00 4f 00               88.1.64       
                                              5e 00 51 00  5c 00 4f 00               88.1.72       
                                              5f 00 4f 00  5e 00 51 00               88.1.80       
                                              5e 00 4f 00  5e 00 51 00               88.1.88       
                                              5c 00 51 00  5c 00 51 00               88.1.96       
                                              62 00 50 00  60 00 53 00               88.1.104      
                                              5e 00 4f 00  5d 00 51 00               88.1.112      
                                              5c 00 4f 00  5c 00 4f 00               88.1.120      
                                              5b 00 52 00  5d 00 52 00               88.1.128      
                                              5f 00 4f 00  5d 00 51 00               88.1.136      
                                              5e 00 51 00  5d 00 51 00               88.1.144      
                                              5c 00 4e 00  5d 00 52 00               88.1.152      
                                              5e 00 51 00  60 00 50 00               88.1.160      
                                              5e 00 50 00  5b 00 51 00               88.1.168      
                                              5c 00 53 00  5d 00 51 00               88.1.176      
                                              5d 00 51 00  5c 00 4f 00               88.1.184      
                                              5e 00 4f 00  5c 00 52 00               88.1.192      
  10.2                         524288  IN     56 00 5c 00  50 00 60 00   14ms        89.1.0        
                                              50 00 5e 00  51 00 5e 00               89.1.8        
                                              52 00 62 00  54 00 5f 00               89.1.16       
                                              50 00 5f 00  52 00 60 00               89.1.24       
                                              52 00 5e 00  52 00 61 00               89.1.32       
                                              53 00 5d 00  51 00 5f 00               89.1.40       
                                              54 00 5f 00  52 00 5e 00               89.1.48       
                                              55 00 60 00  54 00 5d 00               89.1.56       
                                              53 00 5c 00  51 00 62 00               89.1.64       
                                              53 00 5f 00  51 00 5e 00               89.1.72       
                                              50 00 60 00  54 00 60 00               89.1.80       
                                              51 00 5e 00  50 00 5f 00               89.1.88       
                                              4f 00 5d 00  50 00 5f 00               89.1.96       
                                              53 00 5f 00  51 00 5c 00               89.1.104      
                                              50 00 5f 00  51 00 5e 00               89.1.112      
                                              51 00 5e 00  53 00 5f 00               89.1.120      
                                              51 00 5e 00  53 00 5e 00               89.1.128      
                                              51 00 5f 00  53 00 5c 00               89.1.136      
                                              52 00 5e 00  52 00 5f 00               89.1.144      
                                              52 00 60 00  50 00 5e 00               89.1.152      
                                              55 00 5e 00  52 00 5e 00               89.1.160      
                                              54 00 5d 00  52 00 5d 00               89.1.168      
                                              51 00 5e 00  51 00 5e 00               89.1.176      
                                              52 00 5f 00  52 00 5f 00               89.1.184      
                                              52 00 5c 00  53 00 5f 00               89.1.192      
  10.2                         524288  IN     5e 00 53 00  5e 00 51 00   11ms        90.1.0        
                                              5e 00 53 00  5e 00 55 00               90.1.8        
                                              5e 00 54 00  5e 00 53 00               90.1.16       
                                              5f 00 52 00  5f 00 52 00               90.1.24       
                                              5e 00 53 00  60 00 53 00               90.1.32       
                                              5f 00 51 00  5e 00 53 00               90.1.40       
                                              5e 00 52 00  5f 00 53 00               90.1.48       
                                              5f 00 52 00  5e 00 53 00               90.1.56       
                                              60 00 53 00  60 00 52 00               90.1.64       
                                              5e 00 53 00  60 00 51 00               90.1.72       
                                              5c 00 52 00  5e 00 51 00               90.1.80       
                                              5e 00 51 00  5d 00 51 00               90.1.88       
                                              5d 00 52 00  61 00 53 00               90.1.96       
                                              60 00 51 00  61 00 52 00               90.1.104      
                                              5e 00 51 00  5e 00 55 00               90.1.112      
                                              5f 00 51 00  5f 00 51 00               90.1.120      
                                              5e 00 52 00  60 00 53 00               90.1.128      
                                              5c 00 52 00  60 00 54 00               90.1.136      
                                              5e 00 54 00  60 00 54 00               90.1.144      
                                              5c 00 51 00  5e 00 53 00               90.1.152      
                                              5e 00 52 00  5e 00 52 00               90.1.160      
                                              5e 00 52 00  5f 00 54 00               90.1.168      
                                              5e 00 52 00  5e 00 51 00               90.1.176      
                                              62 00 53 00  5e 00 51 00               90.1.184      
                                              5f 00 53 00  5f 00 53 00               90.1.192      
  10.2                         524288  IN     51 00 5d 00  53 00 5e 00   12ms        91.1.0        
                                              51 00 5d 00  51 00 5d 00               91.1.8        
                                              53 00 5f 00  53 00 5e 00               91.1.16       
                                              51 00 5e 00  4f 00 5e 00               91.1.24       
                                              51 00 5e 00  53 00 5e 00               91.1.32       
                                              55 00 60 00  51 00 60 00               91.1.40       
                                              53 00 5e 00  52 00 5e 00               91.1.48       
                                              52 00 5e 00  53 00 5c 00               91.1.56       
                                              52 00 5f 00  52 00 5f 00               91.1.64       
                                              51 00 5e 00  53 00 60 00               91.1.72       
                                              50 00 5e 00  52 00 5e 00               91.1.80       
                                              51 00 5e 00  51 00 5e 00               91.1.88       
                                              52 00 60 00  53 00 5f 00               91.1.96       
                                              51 00 5e 00  52 00 5f 00               91.1.104      
                                              53 00 5f 00  53 00 5d 00               91.1.112      
                                              4f 00 61 00  52 00 5a 00               91.1.120      
                                              53 00 5f 00  52 00 5f 00               91.1.128      
                                              53 00 60 00  54 00 60 00               91.1.136      
                                              53 00 60 00  52 00 5f 00               91.1.144      
                                              52 00 5f 00  52 00 5d 00               91.1.152      
                                              54 00 5f 00  52 00 5f 00               91.1.160      
                                              54 00 60 00  52 00 61 00               91.1.168      
                                              53 00 5f 00  52 00 5e 00               91.1.176      
                                              51 00 5e 00  50 00 5e 00               91.1.184      
                                              52 00 62 00  51 00 5e 00               91.1.192      
  10.2                             31  IN     1a 00 00 00  01 00 02 00  1.9ms        92.1.0        
                                              31 84 00 01  04 00 3a 22               92.1.8        
                                              00 00 01 01  04 00 00 00               92.1.16       
                                              00 00 00 55  aa 55 aa                  92.1.24       
  10.2                         524288  IN     62 00 55 00  60 00 56 00  248ms        93.1.0        
                                              62 00 56 00  60 00 56 00               93.1.8        
                                              60 00 54 00  62 00 56 00               93.1.16       
                                              64 00 54 00  65 00 53 00               93.1.24       
                                              61 00 56 00  61 00 56 00               93.1.32       
                                              61 00 56 00  61 00 58 00               93.1.40       
                                              64 00 5b 00  63 00 56 00               93.1.48       
                                              60 00 59 00  65 00 57 00               93.1.56       
                                              63 00 54 00  63 00 59 00               93.1.64       
                                              64 00 58 00  60 00 56 00               93.1.72       
                                              63 00 55 00  63 00 57 00               93.1.80       
                                              61 00 57 00  63 00 57 00               93.1.88       
                                              61 00 57 00  62 00 54 00               93.1.96       
                                              62 00 57 00  63 00 55 00               93.1.104      
                                              65 00 5b 00  64 00 55 00               93.1.112      
                                              63 00 56 00  64 00 59 00               93.1.120      
                                              64 00 56 00  63 00 55 00               93.1.128      
                                              62 00 56 00  66 00 56 00               93.1.136      
                                              65 00 59 00  61 00 59 00               93.1.144      
                                              62 00 55 00  64 00 5b 00               93.1.152      
                                              66 00 57 00  63 00 54 00               93.1.160      
                                              61 00 55 00  64 00 58 00               93.1.168      
                                              61 00 58 00  63 00 57 00               93.1.176      
                                              62 00 58 00  66 00 59 00               93.1.184      
                                              61 00 57 00  65 00 56 00               93.1.192      
  10.2                         524288  IN     59 00 52 00  5d 00 52 00   12ms        94.1.0        
                                              5f 00 52 00  5c 00 51 00               94.1.8        
                                              5b 00 51 00  5d 00 51 00               94.1.16       
                                              5e 00 51 00  5d 00 52 00               94.1.24       
                                              5d 00 51 00  5c 00 51 00               94.1.32       
                                              5e 00 4f 00  5c 00 51 00               94.1.40       
                                              5c 00 52 00  5e 00 51 00               94.1.48       
                                              5f 00 52 00  5d 00 52 00               94.1.56       
                                              5f 00 51 00  5b 00 52 00               94.1.64       
                                              5d 00 53 00  5d 00 51 00               94.1.72       
                                              5c 00 55 00  5e 00 50 00               94.1.80       
                                              5d 00 51 00  5e 00 52 00               94.1.88       
                                              5c 00 51 00  5f 00 50 00               94.1.96       
                                              5d 00 50 00  5d 00 4f 00               94.1.104      
                                              5d 00 50 00  5e 00 50 00               94.1.112      
                                              5a 00 51 00  5e 00 4f 00               94.1.120      
                                              5e 00 51 00  5d 00 51 00               94.1.128      
                                              5e 00 51 00  5e 00 50 00               94.1.136      
                                              5d 00 4f 00  5b 00 51 00               94.1.144      
                                              5c 00 51 00  5e 00 51 00               94.1.152      
                                              5c 00 4f 00  5c 00 53 00               94.1.160      
                                              5e 00 51 00  5c 00 4f 00               94.1.168      
                                              5e 00 51 00  5c 00 51 00               94.1.176      
                                              5b 00 51 00  5b 00 51 00               94.1.184      
                                              5c 00 51 00  5c 00 50 00               94.1.192      
  10.2                         524288  IN     53 00 5d 00  4f 00 60 00   13ms        95.1.0        
                                              4f 00 5d 00  51 00 5e 00               95.1.8        
                                              52 00 5f 00  51 00 5e 00               95.1.16       
                                              51 00 5c 00  50 00 5e 00               95.1.24       
                                              52 00 60 00  51 00 5e 00               95.1.32       
                                              51 00 5e 00  53 00 5f 00               95.1.40       
                                              51 00 60 00  54 00 5f 00               95.1.48       
                                              53 00 5d 00  52 00 60 00               95.1.56       
                                              53 00 5e 00  50 00 61 00               95.1.64       
                                              51 00 5d 00  51 00 5e 00               95.1.72       
                                              52 00 60 00  52 00 5e 00               95.1.80       
                                              52 00 5e 00  52 00 5e 00               95.1.88       
                                              4f 00 5f 00  53 00 5c 00               95.1.96       
                                              53 00 5e 00  52 00 5f 00               95.1.104      
                                              51 00 5d 00  51 00 5e 00               95.1.112      
                                              51 00 5f 00  54 00 5e 00               95.1.120      
                                              52 00 5e 00  52 00 5c 00               95.1.128      
                                              50 00 5b 00  53 00 60 00               95.1.136      
                                              52 00 60 00  52 00 5f 00               95.1.144      
                                              51 00 5f 00  53 00 5c 00               95.1.152      
                                              53 00 5e 00  51 00 5d 00               95.1.160      
                                              52 00 5d 00  52 00 5f 00               95.1.168      
                                              54 00 60 00  52 00 5d 00               95.1.176      
                                              52 00 5f 00  51 00 5d 00               95.1.184      
                                              51 00 5e 00  53 00 5f 00               95.1.192      
  10.2                         524288  IN     60 00 51 00  5e 00 52 00   12ms        96.1.0        
                                              5e 00 53 00  5f 00 52 00               96.1.8        
                                              5d 00 51 00  5e 00 53 00               96.1.16       
                                              5e 00 53 00  5e 00 51 00               96.1.24       
                                              5c 00 53 00  5e 00 53 00               96.1.32       
                                              60 00 51 00  5e 00 51 00               96.1.40       
                                              5e 00 53 00  5e 00 53 00               96.1.48       
                                              5e 00 53 00  5e 00 53 00               96.1.56       
                                              5e 00 52 00  5e 00 53 00               96.1.64       
                                              5d 00 51 00  5e 00 52 00               96.1.72       
                                              5f 00 52 00  5f 00 52 00               96.1.80       
                                              5f 00 52 00  5e 00 51 00               96.1.88       
                                              5e 00 50 00  60 00 53 00               96.1.96       
                                              5e 00 51 00  5e 00 4f 00               96.1.104      
                                              5e 00 53 00  5f 00 54 00               96.1.112      
                                              5f 00 53 00  5e 00 51 00               96.1.120      
                                              5d 00 51 00  61 00 53 00               96.1.128      
                                              5e 00 53 00  5d 00 53 00               96.1.136      
                                              5e 00 55 00  5f 00 53 00               96.1.144      
                                              5d 00 53 00  5e 00 53 00               96.1.152      
                                              5e 00 52 00  60 00 53 00               96.1.160      
                                              5e 00 53 00  5e 00 50 00               96.1.168      
                                              5c 00 50 00  5f 00 51 00               96.1.176      
                                              60 00 51 00  60 00 51 00               96.1.184      
                                              60 00 51 00  5e 00 53 00               96.1.192      
  10.2                         524288  IN     50 00 5e 00  52 00 5f 00   12ms        97.1.0        
                                              52 00 5e 00  54 00 5e 00               97.1.8        
                                              54 00 5d 00  51 00 5e 00               97.1.16       
                                              53 00 5c 00  53 00 5e 00               97.1.24       
                                              51 00 5e 00  52 00 5d 00               97.1.32       
                                              54 00 5c 00  52 00 5e 00               97.1.40       
                                              55 00 5d 00  51 00 60 00               97.1.48       
                                              51 00 5f 00  53 00 61 00               97.1.56       
                                              50 00 5e 00  52 00 5e 00               97.1.64       
                                              52 00 5f 00  52 00 5d 00               97.1.72       
                                              52 00 5f 00  55 00 5d 00               97.1.80       
                                              54 00 5c 00  55 00 5e 00               97.1.88       
                                              51 00 5e 00  53 00 60 00               97.1.96       
                                              50 00 60 00  53 00 5e 00               97.1.104      
                                              50 00 60 00  53 00 5d 00               97.1.112      
                                              55 00 5f 00  52 00 5e 00               97.1.120      
                                              52 00 5e 00  53 00 5f 00               97.1.128      
                                              53 00 5d 00  51 00 5d 00               97.1.136      
                                              53 00 60 00  53 00 5e 00               97.1.144      
                                              51 00 5d 00  51 00 5e 00               97.1.152      
                                              51 00 60 00  51 00 60 00               97.1.160      
                                              51 00 5f 00  52 00 60 00               97.1.168      
                                              53 00 61 00  51 00 5f 00               97.1.176      
                                              52 00 5f 00  50 00 5f 00               97.1.184      
                                              53 00 62 00  51 00 5f 00               97.1.192      
  10.2                             31  IN     1a 00 00 00  01 00 02 00   38us        98.1.0        
                                              31 84 00 01  04 00 3b 22               98.1.8        
                                              00 00 01 01  04 00 00 00               98.1.16       
                                              00 00 00 55  aa 55 aa                  98.1.24       
  10.2                         524288  IN     5f 00 54 00  5e 00 55 00  249ms        99.1.0        
                                              60 00 55 00  60 00 57 00               99.1.8        
                                              61 00 55 00  61 00 57 00               99.1.16       
                                              62 00 53 00  63 00 56 00               99.1.24       
                                              60 00 56 00  62 00 58 00               99.1.32       
                                              61 00 57 00  64 00 58 00               99.1.40       
                                              65 00 56 00  61 00 57 00               99.1.48       
                                              64 00 57 00  63 00 59 00               99.1.56       
                                              61 00 56 00  62 00 58 00               99.1.64       
                                              66 00 58 00  62 00 55 00               99.1.72       
                                              62 00 57 00  62 00 56 00               99.1.80       
                                              63 00 57 00  64 00 57 00               99.1.88       
                                              60 00 55 00  62 00 58 00               99.1.96       
                                              62 00 55 00  62 00 55 00               99.1.104      
                                              64 00 5b 00  65 00 55 00               99.1.112      
                                              62 00 57 00  64 00 56 00               99.1.120      
                                              63 00 59 00  64 00 55 00               99.1.128      
                                              61 00 57 00  61 00 54 00               99.1.136      
                                              62 00 55 00  64 00 5a 00               99.1.144      
                                              64 00 56 00  66 00 5a 00               99.1.152      
                                              64 00 55 00  63 00 56 00               99.1.160      
                                              61 00 53 00  65 00 57 00               99.1.168      
                                              62 00 59 00  63 00 59 00               99.1.176      
                                              64 00 59 00  67 00 57 00               99.1.184      
                                              63 00 58 00  65 00 59 00               99.1.192      
  10.2                         524288  IN     5d 00 51 00  5c 00 51 00   13ms       100.1.0        
                                              5c 00 51 00  5d 00 50 00              100.1.8        
                                              5c 00 52 00  5d 00 51 00              100.1.16       
                                              5d 00 51 00  5e 00 51 00              100.1.24       
                                              5e 00 4f 00  5e 00 4e 00              100.1.32       
                                              5e 00 51 00  5c 00 4f 00              100.1.40       
                                              5c 00 52 00  5d 00 53 00              100.1.48       
                                              5f 00 51 00  5c 00 53 00              100.1.56       
                                              5e 00 51 00  5b 00 53 00              100.1.64       
                                              5c 00 52 00  5d 00 4f 00              100.1.72       
                                              5a 00 50 00  5d 00 4f 00              100.1.80       
                                              5c 00 4f 00  5c 00 51 00              100.1.88       
                                              5e 00 52 00  5e 00 52 00              100.1.96       
                                              5e 00 51 00  5c 00 4e 00              100.1.104      
                                              5d 00 50 00  5d 00 4f 00              100.1.112      
                                              5c 00 50 00  5d 00 51 00              100.1.120      
                                              5c 00 4f 00  5e 00 51 00              100.1.128      
                                              5c 00 51 00  5e 00 52 00              100.1.136      
                                              5e 00 51 00  5d 00 51 00              100.1.144      
                                              5c 00 51 00  5c 00 4f 00              100.1.152      
                                              5f 00 52 00  5d 00 51 00              100.1.160      
                                              5d 00 51 00  5b 00 50 00              100.1.168      
                                              5e 00 51 00  5d 00 51 00              100.1.176      
                                              5e 00 51 00  5d 00 50 00              100.1.184      
                                              5c 00 4f 00  5d 00 52 00              100.1.192      
  10.2                         524288  IN     54 00 5d 00  51 00 5d 00   12ms       101.1.0        
                                              51 00 5f 00  53 00 60 00              101.1.8        
                                              50 00 5c 00  4f 00 60 00              101.1.16       
                                              50 00 60 00  53 00 5e 00              101.1.24       
                                              50 00 5e 00  4f 00 5e 00              101.1.32       
                                              51 00 60 00  51 00 5b 00              101.1.40       
                                              53 00 60 00  50 00 61 00              101.1.48       
                                              52 00 60 00  53 00 5f 00              101.1.56       
                                              50 00 5f 00  52 00 60 00              101.1.64       
                                              51 00 60 00  51 00 5f 00              101.1.72       
                                              4f 00 5e 00  53 00 5f 00              101.1.80       
                                              50 00 5f 00  52 00 5c 00              101.1.88       
                                              51 00 5d 00  51 00 5e 00              101.1.96       
                                              51 00 5e 00  4f 00 5e 00              101.1.104      
                                              54 00 60 00  52 00 60 00              101.1.112      
                                              50 00 5c 00  51 00 5e 00              101.1.120      
                                              51 00 60 00  51 00 60 00              101.1.128      
                                              53 00 5c 00  51 00 5c 00              101.1.136      
                                              51 00 5e 00  53 00 5e 00              101.1.144      
                                              52 00 5f 00  53 00 5f 00              101.1.152      
                                              53 00 60 00  53 00 5f 00              101.1.160      
                                              52 00 5d 00  52 00 5f 00              101.1.168      
                                              52 00 5e 00  51 00 5d 00              101.1.176      
                                              52 00 5f 00  50 00 5e 00              101.1.184      
                                              51 00 5e 00  53 00 5e 00              101.1.192      
  10.2                         524288  IN     5f 00 51 00  5e 00 52 00   13ms       102.1.0        
                                              5d 00 53 00  5e 00 52 00              102.1.8        
                                              60 00 53 00  5f 00 54 00              102.1.16       
                                              5b 00 51 00  5d 00 52 00              102.1.24       
                                              5d 00 53 00  61 00 53 00              102.1.32       
                                              5c 00 51 00  60 00 51 00              102.1.40       
                                              5e 00 52 00  5d 00 53 00              102.1.48       
                                              5d 00 53 00  5f 00 53 00              102.1.56       
                                              5f 00 53 00  5f 00 52 00              102.1.64       
                                              5d 00 52 00  61 00 51 00              102.1.72       
                                              60 00 52 00  5f 00 52 00              102.1.80       
                                              5d 00 51 00  5e 00 52 00              102.1.88       
                                              5d 00 53 00  60 00 51 00              102.1.96       
                                              5f 00 53 00  5f 00 53 00              102.1.104      
                                              5e 00 51 00  60 00 53 00              102.1.112      
                                              5f 00 51 00  5e 00 51 00              102.1.120      
                                              60 00 51 00  62 00 53 00              102.1.128      
                                              5e 00 53 00  5d 00 53 00              102.1.136      
                                              5d 00 51 00  5f 00 53 00              102.1.144      
                                              60 00 53 00  5e 00 52 00              102.1.152      
                                              5e 00 51 00  5f 00 52 00              102.1.160      
                                              5f 00 53 00  5f 00 53 00              102.1.168      
                                              5e 00 50 00  5d 00 52 00              102.1.176      
                                              61 00 52 00  5e 00 52 00              102.1.184      
                                              5e 00 53 00  5e 00 53 00              102.1.192      
  10.2                         524288  IN     53 00 5e 00  52 00 60 00   12ms       103.1.0        
                                              56 00 60 00  51 00 5d 00              103.1.8        
                                              52 00 5f 00  51 00 5e 00              103.1.16       
                                              52 00 5e 00  51 00 5e 00              103.1.24       
                                              51 00 60 00  53 00 60 00              103.1.32       
                                              55 00 5c 00  53 00 5e 00              103.1.40       
                                              53 00 5e 00  53 00 5e 00              103.1.48       
                                              4f 00 5f 00  53 00 60 00              103.1.56       
                                              4f 00 5e 00  51 00 5e 00              103.1.64       
                                              53 00 5e 00  53 00 5c 00              103.1.72       
                                              52 00 5c 00  51 00 61 00              103.1.80       
                                              51 00 5f 00  53 00 60 00              103.1.88       
                                              55 00 5c 00  53 00 60 00              103.1.96       
                                              52 00 60 00  54 00 61 00              103.1.104      
                                              52 00 60 00  53 00 61 00              103.1.112      
                                              53 00 5d 00  53 00 5f 00              103.1.120      
                                              51 00 60 00  53 00 5c 00              103.1.128      
                                              52 00 5f 00  53 00 61 00              103.1.136      
                                              53 00 60 00  53 00 5e 00              103.1.144      
                                              51 00 5d 00  51 00 5f 00              103.1.152      
                                              51 00 5f 00  51 00 5f 00              103.1.160      
                                              51 00 5d 00  51 00 61 00              103.1.168      
                                              53 00 5d 00  53 00 5d 00              103.1.176      
                                              51 00 5f 00  53 00 5f 00              103.1.184      
                                              52 00 60 00  53 00 60 00              103.1.192      
  10.2                             31  IN     1a 00 00 00  01 00 02 00   35us       104.1.0        
                                              31 84 00 01  04 00 3c 22              104.1.8        
                                              00 00 01 01  04 00 00 00              104.1.16       
                                              00 00 00 55  aa 55 aa                 104.1.24       
  10.2                         524288  IN     5f 00 56 00  60 00 55 00  249ms       105.1.0        
                                              62 00 57 00  62 00 55 00              105.1.8        
                                              61 00 56 00  62 00 54 00              105.1.16       
                                              62 00 55 00  64 00 56 00              105.1.24       
                                              5f 00 58 00  61 00 54 00              105.1.32       
                                              64 00 55 00  61 00 59 00              105.1.40       
                                              66 00 5a 00  62 00 55 00              105.1.48       
                                              62 00 57 00  64 00 5b 00              105.1.56       
                                              63 00 53 00  63 00 5a 00              105.1.64       
                                              63 00 56 00  61 00 54 00              105.1.72       
                                              64 00 56 00  61 00 59 00              105.1.80       
                                              62 00 56 00  64 00 56 00              105.1.88       
                                              62 00 56 00  64 00 56 00              105.1.96       
                                              61 00 54 00  64 00 56 00              105.1.104      
                                              62 00 59 00  64 00 57 00              105.1.112      
                                              62 00 57 00  63 00 59 00              105.1.120      
                                              64 00 58 00  62 00 55 00              105.1.128      
                                              63 00 58 00  63 00 57 00              105.1.136      
                                              64 00 57 00  65 00 5b 00              105.1.144      
                                              66 00 57 00  64 00 5a 00              105.1.152      
                                              64 00 57 00  63 00 55 00              105.1.160      
                                              5f 00 53 00  63 00 57 00              105.1.168      
                                              62 00 56 00  64 00 55 00              105.1.176      
                                              62 00 59 00  66 00 56 00              105.1.184      
                                              66 00 56 00  62 00 56 00              105.1.192      
  10.2                         524288  IN     5c 00 51 00  5e 00 51 00   13ms       106.1.0        
                                              5e 00 53 00  5c 00 51 00              106.1.8        
                                              5c 00 51 00  5f 00 53 00              106.1.16       
                                              5e 00 51 00  5f 00 51 00              106.1.24       
                                              5d 00 53 00  60 00 51 00              106.1.32       
                                              5c 00 53 00  5e 00 53 00              106.1.40       
                                              5e 00 53 00  5f 00 51 00              106.1.48       
                                              5e 00 51 00  5e 00 51 00              106.1.56       
                                              5c 00 53 00  60 00 53 00              106.1.64       
                                              5d 00 51 00  5e 00 53 00              106.1.72       
                                              5e 00 53 00  5c 00 51 00              106.1.80       
                                              58 00 52 00  5f 00 51 00              106.1.88       
                                              5f 00 53 00  5f 00 53 00              106.1.96       
                                              5f 00 51 00  5b 00 51 00              106.1.104      
                                              5e 00 51 00  5e 00 53 00              106.1.112      
                                              5c 00 51 00  5e 00 51 00              106.1.120      
                                              5e 00 52 00  5f 00 51 00              106.1.128      
                                              5e 00 4f 00  60 00 4f 00              106.1.136      
                                              5a 00 51 00  5d 00 50 00              106.1.144      
                                              5f 00 50 00  5d 00 50 00              106.1.152      
                                              5c 00 50 00  5d 00 51 00              106.1.160      
                                              5e 00 52 00  5e 00 51 00              106.1.168      
                                              5d 00 51 00  5c 00 50 00              106.1.176      
                                              5c 00 52 00  5c 00 50 00              106.1.184      
                                              5e 00 4f 00  5c 00 55 00              106.1.192      
  10.2                         524288  IN     53 00 5f 00  52 00 5f 00   13ms       107.1.0        
                                              53 00 5f 00  53 00 60 00              107.1.8        
                                              51 00 5f 00  53 00 5f 00              107.1.16       
                                              53 00 5f 00  52 00 5e 00              107.1.24       
                                              52 00 61 00  51 00 60 00              107.1.32       
                                              51 00 60 00  51 00 60 00              107.1.40       
                                              51 00 5c 00  51 00 60 00              107.1.48       
                                              53 00 5e 00  52 00 61 00              107.1.56       
                                              53 00 5e 00  53 00 61 00              107.1.64       
                                              53 00 5f 00  51 00 5d 00              107.1.72       
                                              53 00 5f 00  53 00 60 00              107.1.80       
                                              52 00 60 00  52 00 5f 00              107.1.88       
                                              53 00 60 00  51 00 5f 00              107.1.96       
                                              53 00 5e 00  52 00 5e 00              107.1.104      
                                              54 00 60 00  51 00 5f 00              107.1.112      
                                              53 00 5e 00  52 00 5e 00              107.1.120      
                                              50 00 5d 00  52 00 60 00              107.1.128      
                                              54 00 5f 00  53 00 60 00              107.1.136      
                                              53 00 60 00  52 00 5f 00              107.1.144      
                                              53 00 5e 00  53 00 5e 00              107.1.152      
                                              52 00 5f 00  53 00 5f 00              107.1.160      
                                              53 00 5f 00  53 00 60 00              107.1.168      
                                              53 00 5f 00  4f 00 61 00              107.1.176      
                                              53 00 5e 00  54 00 5e 00              107.1.184      
                                              53 00 5e 00  54 00 5f 00              107.1.192      
  10.2                         524288  IN     5d 00 51 00  60 00 52 00   13ms       108.1.0        
                                              5e 00 55 00  60 00 55 00              108.1.8        
                                              5e 00 51 00  5d 00 52 00              108.1.16       
                                              5d 00 53 00  5f 00 53 00              108.1.24       
                                              5f 00 53 00  5f 00 51 00              108.1.32       
                                              5d 00 51 00  5f 00 51 00              108.1.40       
                                              5f 00 53 00  5e 00 53 00              108.1.48       
                                              5e 00 51 00  5e 00 53 00              108.1.56       
                                              5f 00 53 00  5f 00 54 00              108.1.64       
                                              5e 00 54 00  5d 00 53 00              108.1.72       
                                              60 00 52 00  5e 00 54 00              108.1.80       
                                              5c 00 53 00  5c 00 53 00              108.1.88       
                                              60 00 53 00  5f 00 53 00              108.1.96       
                                              60 00 54 00  5f 00 4f 00              108.1.104      
                                              5f 00 53 00  5e 00 54 00              108.1.112      
                                              60 00 50 00  5e 00 52 00              108.1.120      
                                              5e 00 55 00  5f 00 51 00              108.1.128      
                                              60 00 51 00  5e 00 54 00              108.1.136      
                                              5d 00 52 00  60 00 52 00              108.1.144      
                                              5f 00 53 00  5d 00 51 00              108.1.152      
                                              5d 00 52 00  5f 00 52 00              108.1.160      
                                              5e 00 51 00  5c 00 50 00              108.1.168      
                                              5c 00 50 00  5f 00 52 00              108.1.176      
                                              5f 00 54 00  5d 00 52 00              108.1.184      
                                              5e 00 53 00  5e 00 51 00              108.1.192      
  10.2                         524288  IN     52 00 5e 00  52 00 5e 00   13ms       109.1.0        
                                              52 00 5c 00  50 00 5f 00              109.1.8        
                                              53 00 60 00  52 00 5f 00              109.1.16       
                                              55 00 5c 00  50 00 5e 00              109.1.24       
                                              53 00 5e 00  52 00 5e 00              109.1.32       
                                              54 00 5c 00  51 00 60 00              109.1.40       
                                              51 00 5f 00  50 00 5e 00              109.1.48       
                                              52 00 5f 00  52 00 5c 00              109.1.56       
                                              51 00 5c 00  51 00 5b 00              109.1.64       
                                              52 00 5f 00  51 00 5c 00              109.1.72       
                                              51 00 5c 00  53 00 5c 00              109.1.80       
                                              51 00 60 00  53 00 5f 00              109.1.88       
                                              53 00 60 00  52 00 5e 00              109.1.96       
                                              51 00 5d 00  52 00 5e 00              109.1.104      
                                              52 00 5e 00  53 00 5e 00              109.1.112      
                                              52 00 60 00  50 00 5e 00              109.1.120      
                                              53 00 60 00  51 00 5e 00              109.1.128      
                                              51 00 5e 00  52 00 5f 00              109.1.136      
                                              53 00 61 00  53 00 5d 00              109.1.144      
                                              51 00 5d 00  51 00 60 00              109.1.152      
                                              55 00 5c 00  53 00 5d 00              109.1.160      
                                              52 00 5f 00  50 00 60 00              109.1.168      
                                              52 00 5f 00  4f 00 5d 00              109.1.176      
                                              51 00 5f 00  53 00 60 00              109.1.184      
                                              53 00 60 00  53 00 5e 00              109.1.192      
  10.2                             31  IN     1a 00 00 00  01 00 02 00   40us       110.1.0        
                                              31 84 00 01  04 00 3d 22              110.1.8        
                                              00 00 01 01  04 00 00 00              110.1.16       
                                              00 00 00 55  aa 55 aa                 110.1.24       
  10.2                         524288  IN     5e 00 53 00  60 00 54 00  249ms       111.1.0        
                                              64 00 57 00  62 00 57 00              111.1.8        
                                              61 00 56 00  61 00 55 00              111.1.16       
                                              63 00 53 00  64 00 55 00              111.1.24       
                                              5e 00 57 00  62 00 55 00              111.1.32       
                                              62 00 57 00  64 00 58 00              111.1.40       
                                              64 00 57 00  62 00 54 00              111.1.48       
                                              61 00 56 00  66 00 5c 00              111.1.56       
                                              62 00 54 00  60 00 56 00              111.1.64       
                                              64 00 57 00  61 00 57 00              111.1.72       
                                              62 00 55 00  62 00 57 00              111.1.80       
                                              61 00 55 00  67 00 59 00              111.1.88       
                                              62 00 55 00  62 00 54 00              111.1.96       
                                              62 00 56 00  64 00 56 00              111.1.104      
                                              61 00 5b 00  65 00 55 00              111.1.112      
                                              62 00 57 00  63 00 57 00              111.1.120      
                                              62 00 59 00  63 00 56 00              111.1.128      
                                              63 00 57 00  63 00 56 00              111.1.136      
                                              64 00 55 00  64 00 57 00              111.1.144      
                                              64 00 58 00  64 00 59 00              111.1.152      
                                              64 00 59 00  63 00 56 00              111.1.160      
                                              61 00 57 00  63 00 58 00              111.1.168      
                                              62 00 54 00  66 00 56 00              111.1.176      
                                              64 00 59 00  66 00 59 00              111.1.184      
                                              62 00 59 00  65 00 57 00              111.1.192      
  10.2                         524288  IN     5e 00 51 00  5d 00 52 00   13ms       112.1.0        
                                              5e 00 51 00  5e 00 51 00              112.1.8        
                                              5e 00 50 00  5c 00 51 00              112.1.16       
                                              5b 00 53 00  5e 00 53 00              112.1.24       
                                              5e 00 50 00  60 00 51 00              112.1.32       
                                              5f 00 50 00  5b 00 50 00              112.1.40       
                                              5d 00 51 00  5e 00 51 00              112.1.48       
                                              5e 00 51 00  5e 00 51 00              112.1.56       
                                              5d 00 50 00  5b 00 51 00              112.1.64       
                                              5c 00 50 00  5e 00 51 00              112.1.72       
                                              5e 00 52 00  5b 00 52 00              112.1.80       
                                              5d 00 53 00  5d 00 52 00              112.1.88       
                                              5d 00 52 00  5c 00 51 00              112.1.96       
                                              5d 00 4e 00  5d 00 51 00              112.1.104      
                                              5f 00 4f 00  5d 00 4f 00              112.1.112      
                                              5d 00 51 00  5b 00 4f 00              112.1.120      
                                              5e 00 4f 00  5f 00 53 00              112.1.128      
                                              5d 00 50 00  5c 00 4f 00              112.1.136      
                                              5f 00 51 00  5e 00 53 00              112.1.144      
                                              5c 00 50 00  5e 00 50 00              112.1.152      
                                              5c 00 50 00  5c 00 4f 00              112.1.160      
                                              5e 00 50 00  5d 00 4f 00              112.1.168      
                                              5c 00 51 00  5c 00 51 00              112.1.176      
                                              5d 00 4e 00  5e 00 51 00              112.1.184      
                                              5e 00 4f 00  5d 00 50 00              112.1.192      
  10.2                         524288  IN     54 00 5e 00  52 00 5d 00   12ms       113.1.0        
                                              51 00 5e 00  53 00 5e 00              113.1.8        
                                              52 00 5e 00  53 00 5d 00              113.1.16       
                                              51 00 61 00  51 00 5e 00              113.1.24       
                                              51 00 5f 00  54 00 5f 00              113.1.32       
                                              52 00 5e 00  51 00 5e 00              113.1.40       
                                              53 00 5e 00  53 00 60 00              113.1.48       
                                              53 00 60 00  53 00 5f 00              113.1.56       
                                              51 00 5f 00  51 00 61 00              113.1.64       
                                              53 00 60 00  53 00 5e 00              113.1.72       
                                              50 00 60 00  50 00 5c 00              113.1.80       
                                              50 00 60 00  51 00 5e 00              113.1.88       
                                              52 00 5e 00  52 00 5c 00              113.1.96       
                                              54 00 5e 00  53 00 5f 00              113.1.104      
                                              51 00 5e 00  52 00 5d 00              113.1.112      
                                              52 00 5c 00  51 00 5e 00              113.1.120      
                                              51 00 5d 00  53 00 5e 00              113.1.128      
                                              50 00 5b 00  52 00 5a 00              113.1.136      
                                              51 00 61 00  53 00 5d 00              113.1.144      
                                              55 00 5e 00  52 00 5e 00              113.1.152      
                                              51 00 5c 00  50 00 5e 00              113.1.160      
                                              52 00 5a 00  52 00 5d 00              113.1.168      
                                              52 00 5e 00  50 00 5c 00              113.1.176      
                                              54 00 5e 00  52 00 60 00              113.1.184      
                                              53 00 60 00  52 00 5c 00              113.1.192      
  10.2                         524288  IN     5e 00 51 00  61 00 52 00   13ms       114.1.0        
                                              5d 00 52 00  5e 00 51 00              114.1.8        
                                              5e 00 52 00  5d 00 53 00              114.1.16       
                                              5e 00 52 00  5e 00 52 00              114.1.24       
                                              60 00 54 00  5d 00 53 00              114.1.32       
                                              5f 00 51 00  5e 00 53 00              114.1.40       
                                              5c 00 54 00  60 00 52 00              114.1.48       
                                              5e 00 51 00  5f 00 54 00              114.1.56       
                                              60 00 53 00  5f 00 53 00              114.1.64       
                                              5b 00 54 00  60 00 51 00              114.1.72       
                                              61 00 50 00  5d 00 52 00              114.1.80       
                                              5e 00 51 00  5e 00 51 00              114.1.88       
                                              5e 00 51 00  5e 00 53 00              114.1.96       
                                              5d 00 53 00  5e 00 51 00              114.1.104      
                                              60 00 53 00  5e 00 51 00              114.1.112      
                                              5c 00 53 00  5e 00 51 00              114.1.120      
                                              60 00 53 00  5e 00 54 00              114.1.128      
                                              5c 00 53 00  5c 00 52 00              114.1.136      
                                              5f 00 53 00  5e 00 53 00              114.1.144      
                                              60 00 51 00  5e 00 51 00              114.1.152      
                                              5d 00 52 00  5e 00 51 00              114.1.160      
                                              5e 00 52 00  5d 00 50 00              114.1.168      
                                              5c 00 51 00  5d 00 55 00              114.1.176      
                                              5e 00 53 00  5d 00 51 00              114.1.184      
                                              5c 00 50 00  5c 00 51 00              114.1.192      
  10.2                         524288  IN     50 00 5e 00  52 00 60 00   13ms       115.1.0        
                                              51 00 5f 00  53 00 5e 00              115.1.8        
                                              53 00 5e 00  53 00 60 00              115.1.16       
                                              50 00 5e 00  51 00 60 00              115.1.24       
                                              52 00 60 00  54 00 5d 00              115.1.32       
                                              53 00 5c 00  53 00 60 00              115.1.40       
                                              53 00 5e 00  52 00 61 00              115.1.48       
                                              53 00 5f 00  53 00 5f 00              115.1.56       
                                              50 00 5e 00  52 00 5d 00              115.1.64       
                                              50 00 5e 00  52 00 61 00              115.1.72       
                                              52 00 5d 00  52 00 60 00              115.1.80       
                                              51 00 5f 00  53 00 5f 00              115.1.88       
                                              52 00 5f 00  51 00 5d 00              115.1.96       
                                              51 00 5e 00  53 00 60 00              115.1.104      
                                              52 00 5f 00  50 00 5e 00              115.1.112      
                                              53 00 5e 00  53 00 5e 00              115.1.120      
                                              51 00 5e 00  54 00 5e 00              115.1.128      
                                              53 00 60 00  53 00 5f 00              115.1.136      
                                              55 00 62 00  53 00 5e 00              115.1.144      
                                              52 00 61 00  50 00 5e 00              115.1.152      
                                              51 00 5e 00  52 00 5e 00              115.1.160      
                                              51 00 5e 00  51 00 5e 00              115.1.168      
                                              54 00 5f 00  52 00 5e 00              115.1.176      
                                              51 00 5e 00  50 00 5e 00              115.1.184      
                                              53 00 62 00  52 00 5e 00              115.1.192      
  10.2                             31  IN     1a 00 00 00  01 00 02 00   35us       116.1.0        
                                              31 84 00 01  04 00 3e 22              116.1.8        
                                              00 00 01 01  04 00 00 00              116.1.16       
                                              00 00 00 55  aa 55 aa                 116.1.24       
  10.2                         524288  IN     5f 00 54 00  5f 00 55 00  250ms       117.1.0        
                                              60 00 56 00  60 00 55 00              117.1.8        
                                              63 00 55 00  60 00 57 00              117.1.16       
                                              62 00 54 00  62 00 55 00              117.1.24       
                                              5f 00 53 00  61 00 56 00              117.1.32       
                                              60 00 54 00  62 00 57 00              117.1.40       
                                              67 00 57 00  61 00 55 00              117.1.48       
                                              63 00 59 00  62 00 56 00              117.1.56       
                                              61 00 53 00  62 00 57 00              117.1.64       
                                              62 00 57 00  61 00 55 00              117.1.72       
                                              62 00 55 00  60 00 59 00              117.1.80       
                                              61 00 57 00  63 00 58 00              117.1.88       
                                              62 00 55 00  63 00 55 00              117.1.96       
                                              64 00 55 00  61 00 55 00              117.1.104      
                                              64 00 58 00  63 00 56 00              117.1.112      
                                              61 00 54 00  64 00 55 00              117.1.120      
                                              64 00 56 00  62 00 54 00              117.1.128      
                                              60 00 57 00  62 00 55 00              117.1.136      
                                              61 00 59 00  63 00 58 00              117.1.144      
                                              62 00 57 00  66 00 57 00              117.1.152      
                                              61 00 56 00  62 00 53 00              117.1.160      
                                              5e 00 54 00  66 00 58 00              117.1.168      
                                              60 00 57 00  62 00 55 00              117.1.176      
                                              60 00 57 00  63 00 59 00              117.1.184      
                                              62 00 56 00  62 00 54 00              117.1.192      
  10.2                         524288  IN     5d 00 53 00  5e 00 4f 00   12ms       118.1.0        
                                              5e 00 4f 00  5c 00 51 00              118.1.8        
                                              5f 00 52 00  60 00 50 00              118.1.16       
                                              5e 00 51 00  5d 00 55 00              118.1.24       
                                              5c 00 51 00  5f 00 51 00              118.1.32       
                                              5d 00 51 00  5c 00 53 00              118.1.40       
                                              5d 00 51 00  5f 00 52 00              118.1.48       
                                              60 00 53 00  5d 00 52 00              118.1.56       
                                              5b 00 52 00  5f 00 51 00              118.1.64       
                                              5f 00 53 00  5c 00 53 00              118.1.72       
                                              5f 00 53 00  5b 00 52 00              118.1.80       
                                              5e 00 50 00  60 00 51 00              118.1.88       
                                              5e 00 53 00  5e 00 50 00              118.1.96       
                                              5e 00 51 00  5d 00 50 00              118.1.104      
                                              5e 00 4f 00  5e 00 50 00              118.1.112      
                                              5c 00 51 00  5e 00 51 00              118.1.120      
                                              5e 00 51 00  5c 00 50 00              118.1.128      
                                              5c 00 50 00  5e 00 50 00              118.1.136      
                                              5f 00 50 00  5e 00 51 00              118.1.144      
                                              5e 00 51 00  5c 00 4e 00              118.1.152      
                                              60 00 4f 00  5c 00 50 00              118.1.160      
                                              5d 00 50 00  5d 00 50 00              118.1.168      
                                              5f 00 53 00  5c 00 52 00              118.1.176      
                                              5e 00 50 00  5c 00 50 00              118.1.184      
                                              5c 00 4f 00  5c 00 53 00              118.1.192      
  10.2                         524288  IN     56 00 5d 00  51 00 5e 00   13ms       119.1.0        
                                              50 00 5e 00  52 00 60 00              119.1.8        
                                              51 00 5e 00  51 00 60 00              119.1.16       
                                              51 00 5f 00  51 00 5e 00              119.1.24       
                                              52 00 5e 00  53 00 62 00              119.1.32       
                                              52 00 5f 00  51 00 5d 00              119.1.40       
                                              51 00 5e 00  51 00 60 00              119.1.48       
                                              51 00 60 00  51 00 5e 00              119.1.56       
                                              51 00 5e 00  53 00 5e 00              119.1.64       
                                              53 00 5f 00  52 00 60 00              119.1.72       
                                              51 00 5d 00  51 00 5e 00              119.1.80       
                                              51 00 5e 00  53 00 5f 00              119.1.88       
                                              52 00 5e 00  52 00 5e 00              119.1.96       
                                              52 00 5c 00  54 00 60 00              119.1.104      
                                              54 00 5e 00  4f 00 5e 00              119.1.112      
                                              51 00 5c 00  50 00 5e 00              119.1.120      
                                              50 00 5e 00  51 00 5f 00              119.1.128      
                                              53 00 5e 00  53 00 5e 00              119.1.136      
                                              51 00 5f 00  4f 00 5c 00              119.1.144      
                                              51 00 5f 00  53 00 60 00              119.1.152      
                                              51 00 5f 00  52 00 5e 00              119.1.160      
                                              50 00 5f 00  52 00 5d 00              119.1.168      
                                              4f 00 61 00  4f 00 5d 00              119.1.176      
                                              52 00 5e 00  52 00 5c 00              119.1.184      
                                              51 00 5f 00  53 00 5d 00              119.1.192      
  10.2                         524288  IN     5f 00 51 00  5c 00 51 00   12ms       120.1.0        
                                              5d 00 53 00  61 00 52 00              120.1.8        
                                              5b 00 51 00  5d 00 52 00              120.1.16       
                                              5c 00 51 00  5e 00 52 00              120.1.24       
                                              5e 00 52 00  5e 00 53 00              120.1.32       
                                              5e 00 50 00  5a 00 4f 00              120.1.40       
                                              60 00 53 00  5e 00 51 00              120.1.48       
                                              60 00 52 00  5f 00 50 00              120.1.56       
                                              5f 00 53 00  5c 00 53 00              120.1.64       
                                              5f 00 51 00  5f 00 53 00              120.1.72       
                                              5d 00 53 00  60 00 51 00              120.1.80       
                                              5e 00 51 00  5c 00 52 00              120.1.88       
                                              5e 00 55 00  60 00 54 00              120.1.96       
                                              5f 00 53 00  5e 00 52 00              120.1.104      
                                              5e 00 53 00  5e 00 52 00              120.1.112      
                                              5e 00 4f 00  5e 00 51 00              120.1.120      
                                              5e 00 53 00  60 00 53 00              120.1.128      
                                              5e 00 51 00  5e 00 55 00              120.1.136      
                                              5e 00 51 00  60 00 51 00              120.1.144      
                                              5c 00 51 00  5e 00 4f 00              120.1.152      
                                              5e 00 53 00  5e 00 52 00              120.1.160      
                                              60 00 52 00  5e 00 53 00              120.1.168      
                                              5e 00 51 00  5e 00 53 00              120.1.176      
                                              60 00 53 00  5e 00 55 00              120.1.184      
                                              5c 00 53 00  60 00 51 00              120.1.192      
  10.2                         524288  IN     52 00 5f 00  52 00 5e 00   13ms       121.1.0        
                                              53 00 5e 00  52 00 5e 00              121.1.8        
                                              53 00 5f 00  52 00 5e 00              121.1.16       
                                              53 00 5c 00  51 00 5f 00              121.1.24       
                                              52 00 5c 00  51 00 5e 00              121.1.32       
                                              54 00 5e 00  52 00 5f 00              121.1.40       
                                              53 00 5d 00  51 00 5e 00              121.1.48       
                                              52 00 5b 00  51 00 60 00              121.1.56       
                                              50 00 5d 00  51 00 5e 00              121.1.64       
                                              53 00 5f 00  53 00 5c 00              121.1.72       
                                              51 00 5f 00  53 00 5c 00              121.1.80       
                                              54 00 5f 00  54 00 60 00              121.1.88       
                                              55 00 5e 00  51 00 60 00              121.1.96       
                                              4f 00 5f 00  53 00 5f 00              121.1.104      
                                              53 00 60 00  50 00 5d 00              121.1.112      
                                              51 00 5e 00  51 00 5e 00              121.1.120      
                                              51 00 5e 00  55 00 5f 00              121.1.128      
                                              53 00 5c 00  53 00 5e 00              121.1.136      
                                              54 00 5f 00  4f 00 60 00              121.1.144      
                                              50 00 5b 00  51 00 5e 00              121.1.152      
                                              52 00 5e 00  52 00 5e 00              121.1.160      
                                              50 00 5c 00  51 00 60 00              121.1.168      
                                              55 00 60 00  51 00 5e 00              121.1.176      
                                              52 00 60 00  53 00 5e 00              121.1.184      
                                              51 00 61 00  53 00 5e 00              121.1.192      
  10.2                             31  IN     1a 00 00 00  01 00 02 00   34us       122.1.0        
                                              31 84 00 01  04 00 3f 22              122.1.8        
                                              00 00 01 01  04 00 00 00              122.1.16       
                                              00 00 00 55  aa 55 aa                 122.1.24       
  10.0                                 CTL    40 ce 00 00  04 07 04 00  168ms       123.1.0        
  10.0                              4  OUT    32 00 00 00               934us       123.2.0        
  10.0                                 CTL    c0 b4 00 00  00 00 01 00   59us       124.1.0(2)     
  10.0                              1  IN     54                         84us       124.2.0        
  10.2                         524288  IN     62 01 4c 01  76 01 45 01   80ms       126.1.0        
                                              74 01 3d 01  6f 01 47 01              126.1.8        
                                              7a 01 3f 01  6f 01 4b 01              126.1.16       
                                              72 01 3b 01  7e 01 44 01              126.1.24       
                                              62 01 47 01  76 01 3c 01              126.1.32       
                                              7d 01 4b 01  79 01 64 01              126.1.40       
                                              85 01 4f 01  74 01 4b 01              126.1.48       
                                              70 01 58 01  87 01 5f 01              126.1.56       
                                              70 01 4a 01  7c 01 58 01              126.1.64       
                                              80 01 48 01  78 01 49 01              126.1.72       
                                              7e 01 41 01  60 01 5b 01              126.1.80       
                                              71 01 54 01  84 01 44 01              126.1.88       
                                              76 01 3d 01  68 01 54 01              126.1.96       
                                              7f 01 4f 01  80 01 49 01              126.1.104      
                                              82 01 56 01  7c 01 59 01              126.1.112      
                                              76 01 53 01  79 01 4b 01              126.1.120      
                                              7d 01 5c 01  80 01 57 01              126.1.128      
                                              67 01 4f 01  74 01 4a 01              126.1.136      
                                              79 01 50 01  7c 01 65 01              126.1.144      
                                              82 01 57 01  7a 01 53 01              126.1.152      
                                              7e 01 59 01  86 01 3d 01              126.1.160      
                                              5d 01 42 01  81 01 56 01              126.1.168      
                                              77 01 4a 01  80 01 57 01              126.1.176      
                                              78 01 58 01  7f 01 51 01              126.1.184      
                                              79 01 4a 01  70 01 5b 01              126.1.192      
  10.2                         524288  IN     67 01 37 01  61 01 24 01   12ms       127.1.0        
                                              53 01 29 01  5c 01 2b 01              127.1.8        
                                              4f 01 37 01  53 01 2b 01              127.1.16       
                                              59 01 35 01  6a 01 34 01              127.1.24       
                                              5c 01 42 01  60 01 27 01              127.1.32       
                                              5b 01 2c 01  5c 01 29 01              127.1.40       
                                              55 01 2d 01  5d 01 31 01              127.1.48       
                                              5e 01 29 01  50 01 27 01              127.1.56       
                                              5a 01 29 01  5b 01 35 01              127.1.64       
                                              62 01 34 01  53 01 2f 01              127.1.72       
                                              5c 01 2d 01  57 01 2b 01              127.1.80       
                                              58 01 34 01  5f 01 38 01              127.1.88       
                                              58 01 2d 01  55 01 27 01              127.1.96       
                                              5b 01 2b 01  54 01 23 01              127.1.104      
                                              65 01 2a 01  5a 01 31 01              127.1.112      
                                              53 01 27 01  55 01 1b 01              127.1.120      
                                              5e 01 2a 01  58 01 31 01              127.1.128      
                                              53 01 1f 01  5a 01 1f 01              127.1.136      
                                              5a 01 2d 01  5d 01 37 01              127.1.144      
                                              4a 01 27 01  5e 01 2d 01              127.1.152      
                                              67 01 2b 01  60 01 2f 01              127.1.160      
                                              62 01 2a 01  5d 01 29 01              127.1.168      
                                              57 01 37 01  52 01 31 01              127.1.176      
                                              5d 01 26 01  54 01 35 01              127.1.184      
                                              4e 01 2f 01  57 01 2f 01              127.1.192      
  10.2                         524288  IN     42 01 5f 01  37 01 66 01   13ms       128.1.0        
                                              31 01 6a 01  29 01 5a 01              128.1.8        
                                              21 01 64 01  35 01 62 01              128.1.16       
                                              2f 01 63 01  2f 01 5d 01              128.1.24       
                                              31 01 58 01  2d 01 76 01              128.1.32       
                                              33 01 5a 01  38 01 61 01              128.1.40       
                                              29 01 62 01  39 01 6b 01              128.1.48       
                                              3b 01 5f 01  3b 01 63 01              128.1.56       
                                              27 01 59 01  39 01 66 01              128.1.64       
                                              43 01 68 01  3c 01 5c 01              128.1.72       
                                              32 01 6f 01  2f 01 60 01              128.1.80       
                                              36 01 61 01  3c 01 65 01              128.1.88       
                                              27 01 61 01  30 01 5a 01              128.1.96       
                                              37 01 5c 01  36 01 5a 01              128.1.104      
                                              30 01 5e 01  2e 01 64 01              128.1.112      
                                              2d 01 65 01  32 01 62 01              128.1.120      
                                              2f 01 5c 01  2d 01 5e 01              128.1.128      
                                              36 01 5c 01  31 01 52 01              128.1.136      
                                              27 01 66 01  31 01 5f 01              128.1.144      
                                              30 01 69 01  3e 01 59 01              128.1.152      
                                              21 01 56 01  2c 01 5a 01              128.1.160      
                                              34 01 5e 01  31 01 5c 01              128.1.168      
                                              33 01 5f 01  32 01 5e 01              128.1.176      
                                              3e 01 5a 01  33 01 57 01              128.1.184      
                                              31 01 5f 01  37 01 68 01              128.1.192      
  10.2                         524288  IN     56 01 2b 01  64 01 2b 01   13ms       129.1.0        
                                              57 01 2b 01  63 01 2b 01              129.1.8        
                                              65 01 35 01  65 01 35 01              129.1.16       
                                              62 01 35 01  61 01 35 01              129.1.24       
                                              63 01 37 01  6a 01 36 01              129.1.32       
                                              68 01 21 01  58 01 30 01              129.1.40       
                                              5f 01 34 01  61 01 2d 01              129.1.48       
                                              57 01 33 01  5f 01 2a 01              129.1.56       
                                              68 01 39 01  60 01 2d 01              129.1.64       
                                              59 01 3c 01  67 01 30 01              129.1.72       
                                              71 01 2e 01  65 01 28 01              129.1.80       
                                              54 01 2d 01  56 01 2f 01              129.1.88       
                                              5e 01 35 01  5f 01 33 01              129.1.96       
                                              58 01 33 01  60 01 25 01              129.1.104      
                                              68 01 34 01  5b 01 31 01              129.1.112      
                                              5c 01 30 01  60 01 2f 01              129.1.120      
                                              5d 01 37 01  63 01 2e 01              129.1.128      
                                              5c 01 40 01  5c 01 43 01              129.1.136      
                                              53 01 2b 01  5d 01 26 01              129.1.144      
                                              5e 01 35 01  54 01 37 01              129.1.152      
                                              53 01 3e 01  64 01 31 01              129.1.160      
                                              64 01 2f 01  60 01 30 01              129.1.168      
                                              60 01 28 01  5b 01 25 01              129.1.176      
                                              62 01 2d 01  5a 01 33 01              129.1.184      
                                              5e 01 37 01  66 01 27 01              129.1.192      
  10.2                         524288  IN     34 01 54 01  29 01 64 01   12ms       130.1.0        
                                              38 01 66 01  33 01 5e 01              130.1.8        
                                              31 01 5c 01  30 01 5c 01              130.1.16       
                                              2a 01 63 01  2f 01 5e 01              130.1.24       
                                              39 01 58 01  37 01 63 01              130.1.32       
                                              37 01 5d 01  3b 01 64 01              130.1.40       
                                              30 01 56 01  30 01 60 01              130.1.48       
                                              33 01 5c 01  32 01 61 01              130.1.56       
                                              2e 01 62 01  2f 01 61 01              130.1.64       
                                              2e 01 5f 01  38 01 5b 01              130.1.72       
                                              25 01 64 01  3b 01 63 01              130.1.80       
                                              35 01 63 01  3c 01 57 01              130.1.88       
                                              35 01 6f 01  2f 01 5b 01              130.1.96       
                                              2d 01 57 01  2d 01 68 01              130.1.104      
                                              2b 01 68 01  2e 01 68 01              130.1.112      
                                              36 01 5e 01  2d 01 62 01              130.1.120      
                                              40 01 69 01  31 01 5d 01              130.1.128      
                                              37 01 58 01  37 01 6b 01              130.1.136      
                                              2d 01 6f 01  34 01 6b 01              130.1.144      
                                              27 01 58 01  34 01 5a 01              130.1.152      
                                              29 01 60 01  2b 01 5a 01              130.1.160      
                                              2e 01 62 01  25 01 6c 01              130.1.168      
                                              38 01 68 01  2c 01 63 01              130.1.176      
                                              27 01 55 01  2e 01 66 01              130.1.184      
                                              3e 01 73 01  2a 01 58 01              130.1.192      
  10.2                             31  IN     1a 00 00 00  01 00 02 00   37us       131.1.0        
                                              31 84 00 01  04 00 40 22              131.1.8        
                                              00 00 01 01  04 00 00 00              131.1.16       
                                              00 00 00 55  aa 55 aa                 131.1.24       
  10.2                         524288  IN     67 01 36 01  64 01 3f 01  249ms       132.1.0        
                                              77 01 4a 01  78 01 36 01              132.1.8        
                                              6e 01 44 01  64 01 49 01              132.1.16       
                                              7a 01 35 01  84 01 3f 01              132.1.24       
                                              70 01 48 01  6a 01 3b 01              132.1.32       
                                              82 01 47 01  6e 01 4b 01              132.1.40       
                                              88 01 51 01  71 01 42 01              132.1.48       
                                              71 01 55 01  86 01 5f 01              132.1.56       
                                              77 01 48 01  6f 01 4b 01              132.1.64       
                                              83 01 4b 01  67 01 47 01              132.1.72       
                                              84 01 48 01  6e 01 53 01              132.1.80       
                                              7a 01 53 01  7e 01 51 01              132.1.88       
                                              77 01 3a 01  6b 01 49 01              132.1.96       
                                              78 01 47 01  74 01 40 01              132.1.104      
                                              76 01 59 01  82 01 48 01              132.1.112      
                                              79 01 49 01  80 01 4f 01              132.1.120      
                                              7c 01 4b 01  84 01 45 01              132.1.128      
                                              6b 01 4a 01  75 01 43 01              132.1.136      
                                              78 01 4a 01  75 01 64 01              132.1.144      
                                              82 01 45 01  88 01 54 01              132.1.152      
                                              86 01 52 01  73 01 3d 01              132.1.160      
                                              68 01 41 01  8a 01 55 01              132.1.168      
                                              74 01 4c 01  7e 01 4c 01              132.1.176      
                                              6a 01 54 01  86 01 51 01              132.1.184      
                                              78 01 49 01  70 01 4f 01              132.1.192      
  10.2                         524288  IN     5c 01 2a 01  58 01 27 01   12ms       133.1.0        
                                              5e 01 32 01  64 01 2f 01              133.1.8        
                                              5a 01 2e 01  5a 01 30 01              133.1.16       
                                              53 01 20 01  5e 01 28 01              133.1.24       
                                              60 01 2b 01  58 01 2e 01              133.1.32       
                                              5c 01 29 01  5e 01 2f 01              133.1.40       
                                              55 01 37 01  68 01 29 01              133.1.48       
                                              65 01 27 01  55 01 30 01              133.1.56       
                                              5a 01 2e 01  51 01 36 01              133.1.64       
                                              59 01 39 01  61 01 31 01              133.1.72       
                                              60 01 33 01  64 01 31 01              133.1.80       
                                              63 01 33 01  4d 01 23 01              133.1.88       
                                              58 01 2e 01  4f 01 39 01              133.1.96       
                                              5f 01 2e 01  61 01 29 01              133.1.104      
                                              54 01 2a 01  69 01 23 01              133.1.112      
                                              4f 01 2f 01  5f 01 27 01              133.1.120      
                                              5c 01 27 01  5c 01 2b 01              133.1.128      
                                              61 01 25 01  5e 01 2c 01              133.1.136      
                                              5a 01 24 01  60 01 35 01              133.1.144      
                                              4a 01 29 01  5a 01 36 01              133.1.152      
                                              66 01 28 01  5e 01 3b 01              133.1.160      
                                              63 01 28 01  52 01 27 01              133.1.168      
                                              5c 01 35 01  5f 01 29 01              133.1.176      
                                              4e 01 32 01  59 01 2f 01              133.1.184      
                                              57 01 1e 01  4c 01 33 01              133.1.192      
  10.2                         524288  IN     52 01 5f 01  2b 01 5f 01   13ms       134.1.0        
                                              2b 01 61 01  28 01 5b 01              134.1.8        
                                              2d 01 60 01  35 01 5e 01              134.1.16       
                                              26 01 63 01  34 01 5c 01              134.1.24       
                                              31 01 68 01  35 01 67 01              134.1.32       
                                              34 01 66 01  22 01 68 01              134.1.40       
                                              29 01 62 01  33 01 6b 01              134.1.48       
                                              3d 01 6c 01  2c 01 5b 01              134.1.56       
                                              2f 01 61 01  2f 01 6a 01              134.1.64       
                                              36 01 5c 01  31 01 63 01              134.1.72       
                                              25 01 58 01  2d 01 52 01              134.1.80       
                                              2a 01 66 01  28 01 6a 01              134.1.88       
                                              2c 01 67 01  24 01 5b 01              134.1.96       
                                              40 01 62 01  2d 01 58 01              134.1.104      
                                              2f 01 5f 01  36 01 61 01              134.1.112      
                                              35 01 59 01  2d 01 63 01              134.1.120      
                                              35 01 64 01  36 01 5b 01              134.1.128      
                                              3a 01 68 01  37 01 68 01              134.1.136      
                                              2d 01 66 01  27 01 66 01              134.1.144      
                                              31 01 59 01  2b 01 68 01              134.1.152      
                                              28 01 64 01  2f 01 61 01              134.1.160      
                                              2d 01 5c 01  2d 01 60 01              134.1.168      
                                              30 01 60 01  2f 01 52 01              134.1.176      
                                              2b 01 5e 01  30 01 5a 01              134.1.184      
                                              34 01 61 01  32 01 59 01              134.1.192      
  10.2                         524288  IN     51 01 36 01  68 01 3b 01   13ms       135.1.0        
                                              5f 01 3e 01  68 01 33 01              135.1.8        
                                              62 01 29 01  5e 01 33 01              135.1.16       
                                              54 01 32 01  5c 01 32 01              135.1.24       
                                              69 01 38 01  63 01 2f 01              135.1.32       
                                              67 01 25 01  51 01 2b 01              135.1.40       
                                              5a 01 31 01  5a 01 2f 01              135.1.48       
                                              55 01 2b 01  5c 01 2f 01              135.1.56       
                                              69 01 31 01  60 01 3b 01              135.1.64       
                                              64 01 33 01  5d 01 25 01              135.1.72       
                                              58 01 35 01  60 01 3a 01              135.1.80       
                                              5e 01 35 01  55 01 2d 01              135.1.88       
                                              5e 01 34 01  5b 01 2c 01              135.1.96       
                                              67 01 2f 01  5b 01 2d 01              135.1.104      
                                              54 01 31 01  58 01 33 01              135.1.112      
                                              55 01 2b 01  5c 01 2f 01              135.1.120      
                                              4f 01 2f 01  63 01 32 01              135.1.128      
                                              67 01 37 01  65 01 39 01              135.1.136      
                                              55 01 36 01  59 01 34 01              135.1.144      
                                              51 01 30 01  56 01 29 01              135.1.152      
                                              55 01 30 01  5e 01 2d 01              135.1.160      
                                              5c 01 38 01  60 01 26 01              135.1.168      
                                              54 01 38 01  63 01 39 01              135.1.176      
                                              67 01 39 01  5f 01 2f 01              135.1.184      
                                              5d 01 35 01  5f 01 25 01              135.1.192      
  10.2                         524288  IN     36 01 69 01  2d 01 61 01   12ms       136.1.0        
                                              33 01 61 01  2f 01 64 01              136.1.8        
                                              3b 01 5c 01  31 01 6c 01              136.1.16       
                                              33 01 61 01  2d 01 5e 01              136.1.24       
                                              39 01 65 01  3b 01 5b 01              136.1.32       
                                              3a 01 5e 01  3d 01 65 01              136.1.40       
                                              2f 01 53 01  31 01 6b 01              136.1.48       
                                              25 01 5e 01  29 01 60 01              136.1.56       
                                              2b 01 61 01  3f 01 63 01              136.1.64       
                                              35 01 5f 01  3a 01 64 01              136.1.72       
                                              2d 01 4d 01  37 01 67 01              136.1.80       
                                              35 01 5c 01  37 01 63 01              136.1.88       
                                              2f 01 6c 01  39 01 57 01              136.1.96       
                                              29 01 5f 01  33 01 68 01              136.1.104      
                                              2d 01 6c 01  3d 01 5f 01              136.1.112      
                                              35 01 6b 01  34 01 53 01              136.1.120      
                                              2f 01 58 01  35 01 64 01              136.1.128      
                                              3f 01 5f 01  3d 01 5a 01              136.1.136      
                                              39 01 6e 01  2e 01 6a 01              136.1.144      
                                              34 01 65 01  27 01 5c 01              136.1.152      
                                              35 01 64 01  2a 01 6c 01              136.1.160      
                                              2b 01 66 01  33 01 6e 01              136.1.168      
                                              36 01 66 01  29 01 63 01              136.1.176      
                                              35 01 53 01  33 01 69 01              136.1.184      
                                              2f 01 71 01  37 01 61 01              136.1.192      
  10.2                             31  IN     1a 00 00 00  01 00 02 00   34us       137.1.0        
                                              31 84 00 01  04 00 41 22              137.1.8        
                                              00 00 01 01  04 00 00 00              137.1.16       
                                              00 00 00 55  aa 55 aa                 137.1.24       
  10.0                                 CTL    80 06 00 01  00 00 12 00  161ms       138.1.0        
  10.0                             18  IN     12 01 00 02  00 00 00 40   84us       138.2.0        
                                              48 44 70 56  40 1b 01 02              138.2.8        
                                              00 01                                 138.2.16       
  10.0                                 CTL    80 06 00 03  00 00 02 00   14us       139.1.0        
  10.0                              2  IN     04 03                      71us       139.2.0        
  10.0                                 CTL    80 06 00 03  00 00 04 00   10us       140.1.0        
  10.0                              4  IN     04 03 09 04                46us       140.2.0        
  10.0                                 CTL    80 06 01 03  09 04 02 00   10us       141.1.0        
  10.0                              2  IN     06 03                      70us       141.2.0        
  10.0                                 CTL    80 06 01 03  09 04 06 00   10us       142.1.0        
  10.0                              6  IN     06 03 54 00  33 00         71us       142.2.0        
  10.0                                 CTL    80 06 02 03  09 04 02 00   11us       143.1.0        
  10.0                              2  IN     1a 03                      66us       143.2.0        
  10.0                                 CTL    80 06 02 03  09 04 1a 00   10us       144.1.0        
  10.0                             26  IN     1a 03 52 00  48 00 31 00   66us       144.2.0        
                                              30 00 31 00  35 00 30 00              144.2.8        
                                              30 00 35 00  30 00 32 00              144.2.16       
                                              31 00                                 144.2.24       
  10.0                                 CTL    80 06 00 03  09 04 02 00    9us       145.1.0        
  10.0                              2  IN     04 03                      62us       145.2.0        
  10.0                                 CTL    80 06 00 03  09 04 04 00   10us       146.1.0        
  10.0                              4  IN     04 03 09 04                43us       146.2.0        
  10.0                                 CTL    80 06 02 03  09 04 02 00  612us       147.1.0        
  10.0                              2  IN     1a 03                      77us       147.2.0        
  10.0                                 CTL    80 06 02 03  09 04 1a 00   17us       148.1.0        
  10.0                             26  IN     1a 03 52 00  48 00 31 00   76us       148.2.0        
                                              30 00 31 00  35 00 30 00              148.2.8        
                                              30 00 35 00  30 00 32 00              148.2.16       
                                              31 00                                 148.2.24       
  10.0                                 CTL    80 06 01 03  00 00 20 00  156us       149.1.0        
  10.0                              6  IN     06 03 54 00  33 00         77us       149.2.0        
  10.0                                 CTL    c0 e1 00 00  00 00 04 00   22us       150.1.0        
  10.0                              4  IN     03 0b 00 00               1.5ms       150.2.0        
  10.0                                 CTL    c0 b4 00 00  00 00 01 00   23us       151.1.0(2)     
  10.0                              1  IN     54                         75us       151.2.0        
  10.0                                 CTL    c0 e1 00 00  04 00 40 00  102us       153.1.0        
  10.0                             64  IN     00 00 00 00  01 01 00 00  4.0ms       153.2.0        
                                              0f 44 61 68  65 6e 67 20              153.2.8        
                                              49 6d 61 67  69 6e 67 00              153.2.16       
                                              20 00 00 00  01 01 00 00              153.2.24       
                                              0f 4d 45 52  2d 31 33 30              153.2.32       
                                              2d 33 30 55  4d 2d 4c 00              153.2.40       
                                              80 00 00 00  01 01 00 00              153.2.48       
                                              0d 52 48 31  30 31 35 30              153.2.56       
  10.0                                 CTL    c0 b4 00 00  00 00 01 00   25us       154.1.0(2)     
  10.0                              1  IN     54                         79us       154.2.0        
  10.0                                 CTL    c0 e1 00 00  44 00 40 00   99us       156.1.0        
  10.0                             64  IN     30 35 30 32  31 00 90 00  4.0ms       156.2.0        
                                              00 00 01 01  00 00 03 36              156.2.8        
                                              37 00 04 01  00 00 01 01              156.2.16       
                                              00 00 0a 31  32 33 34 56              156.2.24       
                                              33 32 30 33  00 14 01 00              156.2.32       
                                              00 01 01 00  00 0e 31 2e              156.2.40       
                                              31 2e 31 33  30 35 2e 39              156.2.48       
                                              33 30 31 00  00 02 00 00              156.2.56       
  10.0                                 CTL    c0 b4 00 00  00 00 01 00   26us       157.1.0(2)     
  10.0                              1  IN     54                         77us       157.2.0        
  10.0                                 CTL    80 06 02 03  00 00 20 00  153us       159.1.0        
  10.0                             26  IN     1a 03 52 00  48 00 31 00   94us       159.2.0        
                                              30 00 31 00  35 00 30 00              159.2.8        
                                              30 00 35 00  30 00 32 00              159.2.16       
                                              31 00                                 159.2.24       
  10.0                                 CTL    80 06 00 01  00 00 12 00  793us       160.1.0        
  10.0                             18  IN     12 01 00 02  00 00 00 40   58us       160.2.0        
                                              48 44 70 56  40 1b 01 02              160.2.8        
                                              00 01                                 160.2.16       
  10.0                                 CTL    80 06 00 03  00 00 02 00   13us       161.1.0        
  10.0                              2  IN     04 03                      47us       161.2.0        
  10.0                                 CTL    80 06 00 03  00 00 04 00    9us       162.1.0        
  10.0                              4  IN     04 03 09 04                44us       162.2.0        
  10.0                                 CTL    80 06 01 03  09 04 02 00   19us       163.1.0        
  10.0                              2  IN     06 03                      80us       163.2.0        
  10.0                                 CTL    80 06 01 03  09 04 06 00    9us       164.1.0        
  10.0                              6  IN     06 03 54 00  33 00         77us       164.2.0        
  10.0                                 CTL    80 06 02 03  09 04 02 00    9us       165.1.0        
  10.0                              2  IN     1a 03                      65us       165.2.0        
  10.0                                 CTL    80 06 02 03  09 04 1a 00   11us       166.1.0        
  10.0                             26  IN     1a 03 52 00  48 00 31 00   66us       166.2.0        
                                              30 00 31 00  35 00 30 00              166.2.8        
                                              30 00 35 00  30 00 32 00              166.2.16       
                                              31 00                                 166.2.24       
  10.0                                 CTL    80 06 00 03  09 04 02 00   10us       167.1.0        
  10.0                              2  IN     04 03                      43us       167.2.0        
  10.0                                 CTL    80 06 00 03  09 04 04 00    9us       168.1.0        
  10.0                              4  IN     04 03 09 04                44us       168.2.0        
  10.0                                 CTL    80 06 02 03  09 04 02 00  567us       169.1.0        
  10.0                              2  IN     1a 03                      76us       169.2.0        
  10.0                                 CTL    80 06 02 03  09 04 1a 00    8us       170.1.0        
  10.0                             26  IN     1a 03 52 00  48 00 31 00   72us       170.2.0        
                                              30 00 31 00  35 00 30 00              170.2.8        
                                              30 00 35 00  30 00 32 00              170.2.16       
                                              31 00                                 170.2.24       
  10.0                                 CTL    80 06 01 03  00 00 20 00  152us       171.1.0        
  10.0                              6  IN     06 03 54 00  33 00         71us       171.2.0        
  10.0                                 CTL    c0 e1 00 00  00 00 04 00   19us       172.1.0        
  10.0                              4  IN     03 0b 00 00               1.5ms       172.2.0        
  10.0                                 CTL    c0 b4 00 00  00 00 01 00   21us       173.1.0(2)     
  10.0                              1  IN     54                         67us       173.2.0        
  10.0                                 CTL    c0 e1 00 00  04 00 40 00  122us       175.1.0        
  10.0                             64  IN     00 00 00 00  01 01 00 00  4.0ms       175.2.0        
                                              0f 44 61 68  65 6e 67 20              175.2.8        
                                              49 6d 61 67  69 6e 67 00              175.2.16       
                                              20 00 00 00  01 01 00 00              175.2.24       
                                              0f 4d 45 52  2d 31 33 30              175.2.32       
                                              2d 33 30 55  4d 2d 4c 00              175.2.40       
                                              80 00 00 00  01 01 00 00              175.2.48       
                                              0d 52 48 31  30 31 35 30              175.2.56       
  10.0                                 CTL    c0 b4 00 00  00 00 01 00   24us       176.1.0(2)     
  10.0                              1  IN     54                         78us       176.2.0        
  10.0                                 CTL    c0 e1 00 00  44 00 40 00  100us       178.1.0        
  10.0                             64  IN     30 35 30 32  31 00 90 00  4.0ms       178.2.0        
                                              00 00 01 01  00 00 03 36              178.2.8        
                                              37 00 04 01  00 00 01 01              178.2.16       
                                              00 00 0a 31  32 33 34 56              178.2.24       
                                              33 32 30 33  00 14 01 00              178.2.32       
                                              00 01 01 00  00 0e 31 2e              178.2.40       
                                              31 2e 31 33  30 35 2e 39              178.2.48       
                                              33 30 31 00  00 02 00 00              178.2.56       
  10.0                                 CTL    c0 b4 00 00  00 00 01 00   20us       179.1.0(2)     
  10.0                              1  IN     54                         89us       179.2.0        
  10.0                                 CTL    80 06 02 03  00 00 20 00  108us       181.1.0        
  10.0                             26  IN     1a 03 52 00  48 00 31 00   66us       181.2.0        
                                              30 00 31 00  35 00 30 00              181.2.8        
                                              30 00 35 00  30 00 32 00              181.2.16       
                                              31 00                                 181.2.24       
  10.2                         524288  IN     5e 01 3d 01  6e 01 37 01   63ms       182.1.0        
                                              6a 01 45 01  6d 01 3b 01              182.1.8        
                                              6d 01 48 01  7a 01 3e 01              182.1.16       
                                              68 01 39 01  72 01 43 01              182.1.24       
                                              61 01 45 01  6a 01 3d 01              182.1.32       
                                              74 01 49 01  73 01 5d 01              182.1.40       
                                              8b 01 4f 01  79 01 40 01              182.1.48       
                                              7c 01 47 01  7e 01 64 01              182.1.56       
                                              7b 01 42 01  72 01 56 01              182.1.64       
                                              7e 01 46 01  6b 01 40 01              182.1.72       
                                              76 01 57 01  64 01 40 01              182.1.80       
                                              78 01 62 01  92 01 5b 01              182.1.88       
                                              7c 01 41 01  7a 01 3d 01              182.1.96       
                                              79 01 4b 01  7a 01 4e 01              182.1.104      
                                              83 01 5e 01  83 01 49 01              182.1.112      
                                              7e 01 52 01  86 01 50 01              182.1.120      
                                              7e 01 5f 01  7e 01 3e 01              182.1.128      
                                              6c 01 46 01  7c 01 53 01              182.1.136      
                                              76 01 4c 01  7f 01 63 01              182.1.144      
                                              7d 01 4f 01  8c 01 4d 01              182.1.152      
                                              86 01 4f 01  70 01 47 01              182.1.160      
                                              6c 01 35 01  7b 01 61 01              182.1.168      
                                              72 01 51 01  77 01 53 01              182.1.176      
                                              78 01 49 01  86 01 54 01              182.1.184      
                                              77 01 48 01  74 01 58 01              182.1.192      
  10.2                         524288  IN     56 01 2b 01  5b 01 21 01   13ms       183.1.0        
                                              5e 01 2f 01  5d 01 29 01              183.1.8        
                                              59 01 35 01  54 01 32 01              183.1.16       
                                              56 01 30 01  5c 01 3a 01              183.1.24       
                                              5e 01 28 01  70 01 33 01              183.1.32       
                                              67 01 2e 01  52 01 2d 01              183.1.40       
                                              5f 01 2a 01  56 01 31 01              183.1.48       
                                              5a 01 29 01  51 01 25 01              183.1.56       
                                              60 01 3b 01  52 01 36 01              183.1.64       
                                              5c 01 35 01  67 01 2c 01              183.1.72       
                                              64 01 36 01  5e 01 30 01              183.1.80       
                                              55 01 29 01  49 01 29 01              183.1.88       
                                              52 01 2d 01  4a 01 26 01              183.1.96       
                                              5d 01 2a 01  5b 01 22 01              183.1.104      
                                              5a 01 27 01  5c 01 35 01              183.1.112      
                                              48 01 23 01  4e 01 29 01              183.1.120      
                                              5c 01 25 01  53 01 2b 01              183.1.128      
                                              4d 01 2f 01  58 01 29 01              183.1.136      
                                              5a 01 32 01  57 01 2c 01              183.1.144      
                                              4c 01 28 01  58 01 35 01              183.1.152      
                                              5e 01 27 01  5e 01 23 01              183.1.160      
                                              56 01 2f 01  52 01 2d 01              183.1.168      
                                              50 01 33 01  53 01 2f 01              183.1.176      
                                              52 01 1d 01  4b 01 1f 01              183.1.184      
                                              57 01 1b 01  4f 01 2d 01              183.1.192      
  10.2                         524288  IN     3f 01 5a 01  26 01 5c 01   13ms       184.1.0        
                                              2f 01 5a 01  2d 01 57 01              184.1.8        
                                              2d 01 5f 01  39 01 5b 01              184.1.16       
                                              2d 01 5e 01  2d 01 60 01              184.1.24       
                                              2c 01 5f 01  23 01 63 01              184.1.32       
                                              25 01 5f 01  32 01 62 01              184.1.40       
                                              32 01 5b 01  25 01 57 01              184.1.48       
                                              2d 01 65 01  36 01 56 01              184.1.56       
                                              25 01 5c 01  31 01 6a 01              184.1.64       
                                              31 01 62 01  2b 01 59 01              184.1.72       
                                              34 01 60 01  3c 01 5a 01              184.1.80       
                                              38 01 64 01  2d 01 60 01              184.1.88       
                                              30 01 59 01  2a 01 59 01              184.1.96       
                                              37 01 5c 01  2f 01 5b 01              184.1.104      
                                              2c 01 5f 01  2c 01 5c 01              184.1.112      
                                              33 01 53 01  31 01 5e 01              184.1.120      
                                              37 01 62 01  25 01 61 01              184.1.128      
                                              29 01 5c 01  29 01 58 01              184.1.136      
                                              2b 01 5b 01  31 01 56 01              184.1.144      
                                              2c 01 6a 01  33 01 58 01              184.1.152      
                                              2c 01 5b 01  2b 01 58 01              184.1.160      
                                              2f 01 64 01  30 01 59 01              184.1.168      
                                              33 01 5c 01  26 01 5b 01              184.1.176      
                                              30 01 5b 01  24 01 5b 01              184.1.184      
                                              29 01 58 01  1a 01 5c 01              184.1.192      
  10.2                         524288  IN     5c 01 3b 01  5c 01 31 01   13ms       185.1.0        
                                              5c 01 36 01  67 01 2f 01              185.1.8        
                                              53 01 35 01  58 01 39 01              185.1.16       
                                              60 01 35 01  68 01 35 01              185.1.24       
                                              5e 01 47 01  5e 01 31 01              185.1.32       
                                              6a 01 2e 01  57 01 30 01              185.1.40       
                                              60 01 2f 01  5e 01 33 01              185.1.48       
                                              5c 01 3d 01  6c 01 3b 01              185.1.56       
                                              6c 01 38 01  67 01 32 01              185.1.64       
                                              63 01 3d 01  5e 01 3d 01              185.1.72       
                                              65 01 3d 01  59 01 35 01              185.1.80       
                                              53 01 31 01  61 01 3d 01              185.1.88       
                                              5a 01 33 01  67 01 33 01              185.1.96       
                                              68 01 39 01  5b 01 39 01              185.1.104      
                                              53 01 36 01  56 01 2d 01              185.1.112      
                                              5d 01 34 01  62 01 33 01              185.1.120      
                                              6c 01 2b 01  66 01 32 01              185.1.128      
                                              57 01 32 01  68 01 3c 01              185.1.136      
                                              6a 01 2d 01  66 01 3f 01              185.1.144      
                                              66 01 2b 01  5b 01 30 01              185.1.152      
                                              69 01 35 01  62 01 35 01              185.1.160      
                                              5a 01 27 01  60 01 3b 01              185.1.168      
                                              63 01 32 01  64 01 39 01              185.1.176      
                                              65 01 3f 01  58 01 39 01              185.1.184      
                                              60 01 35 01  60 01 31 01              185.1.192      
  10.2                         524288  IN     35 01 64 01  2c 01 61 01   12ms       186.1.0        
                                              2d 01 6d 01  2f 01 64 01              186.1.8        
                                              38 01 62 01  23 01 60 01              186.1.16       
                                              35 01 54 01  3d 01 6b 01              186.1.24       
                                              36 01 5f 01  35 01 62 01              186.1.32       
                                              3e 01 61 01  40 01 67 01              186.1.40       
                                              36 01 6b 01  33 01 70 01              186.1.48       
                                              2b 01 64 01  39 01 55 01              186.1.56       
                                              32 01 66 01  3b 01 62 01              186.1.64       
                                              3e 01 64 01  35 01 6c 01              186.1.72       
                                              41 01 5a 01  31 01 62 01              186.1.80       
                                              39 01 6e 01  2e 01 64 01              186.1.88       
                                              3b 01 64 01  38 01 5e 01              186.1.96       
                                              34 01 63 01  33 01 62 01              186.1.104      
                                              3b 01 6e 01  29 01 60 01              186.1.112      
                                              29 01 63 01  25 01 59 01              186.1.120      
                                              3f 01 6c 01  37 01 68 01              186.1.128      
                                              38 01 61 01  33 01 57 01              186.1.136      
                                              30 01 75 01  31 01 60 01              186.1.144      
                                              3d 01 60 01  2f 01 61 01              186.1.152      
                                              2f 01 66 01  2f 01 60 01              186.1.160      
                                              2e 01 60 01  2e 01 6f 01              186.1.168      
                                              36 01 67 01  23 01 5c 01              186.1.176      
                                              2a 01 68 01  28 01 61 01              186.1.184      
                                              31 01 6e 01  32 01 68 01              186.1.192      
  10.2                             31  IN     1a 00 00 00  01 00 02 00   38us       187.1.0        
                                              31 84 00 01  04 00 42 22              187.1.8        
                                              00 00 01 01  04 00 00 00              187.1.16       
                                              00 00 00 55  aa 55 aa                 187.1.24       
  10.2                         524288  IN     65 01 40 01  68 01 41 01  251ms       188.1.0        
                                              67 01 3f 01  63 01 38 01              188.1.8        
                                              7a 01 44 01  73 01 3f 01              188.1.16       
                                              68 01 49 01  80 01 41 01              188.1.24       
                                              6c 01 4c 01  71 01 41 01              188.1.32       
                                              76 01 49 01  7e 01 49 01              188.1.40       
                                              88 01 5a 01  73 01 55 01              188.1.48       
                                              76 01 51 01  80 01 5e 01              188.1.56       
                                              85 01 47 01  7a 01 52 01              188.1.64       
                                              7c 01 57 01  6c 01 4a 01              188.1.72       
                                              7e 01 5c 01  74 01 4e 01              188.1.80       
                                              78 01 43 01  87 01 5e 01              188.1.88       
                                              6e 01 44 01  70 01 3f 01              188.1.96       
                                              7f 01 4f 01  73 01 4a 01              188.1.104      
                                              7e 01 61 01  72 01 4b 01              188.1.112      
                                              75 01 59 01  84 01 4f 01              188.1.120      
                                              81 01 49 01  81 01 4a 01              188.1.128      
                                              82 01 49 01  7c 01 51 01              188.1.136      
                                              84 01 56 01  7b 01 5b 01              188.1.144      
                                              86 01 4a 01  90 01 65 01              188.1.152      
                                              83 01 53 01  77 01 51 01              188.1.160      
                                              7d 01 3f 01  84 01 59 01              188.1.168      
                                              74 01 50 01  7c 01 5f 01              188.1.176      
                                              86 01 5d 01  8f 01 54 01              188.1.184      
                                              7b 01 44 01  7a 01 49 01              188.1.192      
  10.2                         524288  IN     5c 01 31 01  5e 01 2d 01   11ms       189.1.0        
                                              58 01 25 01  5e 01 35 01              189.1.8        
                                              5e 01 38 01  60 01 2b 01              189.1.16       
                                              5e 01 31 01  68 01 2b 01              189.1.24       
                                              6e 01 2f 01  5c 01 26 01              189.1.32       
                                              62 01 34 01  5a 01 34 01              189.1.40       
                                              5c 01 32 01  6a 01 28 01              189.1.48       
                                              64 01 33 01  5a 01 33 01              189.1.56       
                                              5e 01 36 01  5c 01 34 01              189.1.64       
                                              57 01 31 01  55 01 28 01              189.1.72       
                                              5c 01 2f 01  58 01 31 01              189.1.80       
                                              59 01 27 01  54 01 2c 01              189.1.88       
                                              5a 01 2d 01  64 01 33 01              189.1.96       
                                              60 01 39 01  58 01 1e 01              189.1.104      
                                              5c 01 22 01  6e 01 29 01              189.1.112      
                                              56 01 30 01  5a 01 2a 01              189.1.120      
                                              59 01 1f 01  52 01 2e 01              189.1.128      
                                              5a 01 2a 01  5a 01 3b 01              189.1.136      
                                              61 01 24 01  5b 01 33 01              189.1.144      
                                              5a 01 22 01  59 01 31 01              189.1.152      
                                              74 01 2b 01  56 01 21 01              189.1.160      
                                              58 01 30 01  4c 01 36 01              189.1.168      
                                              55 01 3e 01  57 01 28 01              189.1.176      
                                              6e 01 2c 01  62 01 26 01              189.1.184      
                                              52 01 27 01  54 01 37 01              189.1.192      
  10.2                         524288  IN     3c 01 52 01  2f 01 64 01   13ms       190.1.0        
                                              2f 01 5b 01  27 01 61 01              190.1.8        
                                              2d 01 60 01  2b 01 64 01              190.1.16       
                                              24 01 55 01  2c 01 5f 01              190.1.24       
                                              29 01 63 01  2b 01 67 01              190.1.32       
                                              39 01 5d 01  33 01 64 01              190.1.40       
                                              37 01 5c 01  32 01 63 01              190.1.48       
                                              3a 01 62 01  30 01 5e 01              190.1.56       
                                              3c 01 50 01  2f 01 67 01              190.1.64       
                                              2b 01 5e 01  30 01 5b 01              190.1.72       
                                              27 01 5a 01  33 01 54 01              190.1.80       
                                              33 01 5d 01  2f 01 67 01              190.1.88       
                                              27 01 5f 01  30 01 58 01              190.1.96       
                                              32 01 53 01  32 01 62 01              190.1.104      
                                              2d 01 66 01  29 01 5b 01              190.1.112      
                                              2d 01 60 01  2f 01 60 01              190.1.120      
                                              2f 01 56 01  27 01 5f 01              190.1.128      
                                              2a 01 5a 01  2c 01 59 01              190.1.136      
                                              29 01 69 01  35 01 54 01              190.1.144      
                                              39 01 56 01  25 01 60 01              190.1.152      
                                              37 01 5c 01  23 01 5f 01              190.1.160      
                                              3a 01 54 01  2b 01 66 01              190.1.168      
                                              31 01 52 01  30 01 59 01              190.1.176      
                                              32 01 5c 01  36 01 5d 01              190.1.184      
                                              33 01 5b 01  29 01 60 01              190.1.192      
  10.2                         524288  IN     5e 01 35 01  6a 01 2e 01   13ms       191.1.0        
                                              57 01 3b 01  6e 01 2b 01              191.1.8        
                                              5b 01 37 01  5a 01 31 01              191.1.16       
                                              64 01 41 01  5e 01 39 01              191.1.24       
                                              61 01 36 01  67 01 2f 01              191.1.32       
                                              5f 01 37 01  5c 01 33 01              191.1.40       
                                              66 01 3d 01  5a 01 2d 01              191.1.48       
                                              68 01 27 01  5b 01 2f 01              191.1.56       
                                              60 01 31 01  6f 01 36 01              191.1.64       
                                              54 01 37 01  64 01 30 01              191.1.72       
                                              66 01 2f 01  59 01 2f 01              191.1.80       
                                              5c 01 2d 01  60 01 2b 01              191.1.88       
                                              5c 01 35 01  70 01 38 01              191.1.96       
                                              67 01 35 01  60 01 37 01              191.1.104      
                                              5b 01 31 01  61 01 32 01              191.1.112      
                                              61 01 2f 01  60 01 2d 01              191.1.120      
                                              6d 01 2d 01  5d 01 33 01              191.1.128      
                                              5e 01 32 01  61 01 3b 01              191.1.136      
                                              67 01 31 01  72 01 38 01              191.1.144      
                                              57 01 34 01  53 01 3c 01              191.1.152      
                                              61 01 28 01  5b 01 31 01              191.1.160      
                                              5e 01 33 01  63 01 44 01              191.1.168      
                                              64 01 2f 01  67 01 31 01              191.1.176      
                                              6b 01 39 01  54 01 27 01              191.1.184      
                                              60 01 32 01  6a 01 31 01              191.1.192      
  10.2                         524288  IN     39 01 5e 01  36 01 5a 01   12ms       192.1.0        
                                              3a 01 67 01  2f 01 65 01              192.1.8        
                                              33 01 60 01  2d 01 63 01              192.1.16       
                                              3b 01 67 01  2f 01 5f 01              192.1.24       
                                              31 01 54 01  3b 01 5b 01              192.1.32       
                                              33 01 68 01  38 01 60 01              192.1.40       
                                              32 01 60 01  3d 01 60 01              192.1.48       
                                              2b 01 64 01  31 01 64 01              192.1.56       
                                              2e 01 62 01  3b 01 5e 01              192.1.64       
                                              33 01 61 01  34 01 5c 01              192.1.72       
                                              39 01 62 01  3b 01 66 01              192.1.80       
                                              2e 01 5a 01  2c 01 63 01              192.1.88       
                                              2d 01 65 01  3a 01 5a 01              192.1.96       
                                              35 01 60 01  37 01 63 01              192.1.104      
                                              37 01 6d 01  29 01 64 01              192.1.112      
                                              3b 01 6a 01  2f 01 52 01              192.1.120      
                                              3c 01 68 01  2f 01 69 01              192.1.128      
                                              38 01 5e 01  35 01 68 01              192.1.136      
                                              2b 01 69 01  33 01 57 01              192.1.144      
                                              30 01 64 01  32 01 5b 01              192.1.152      
                                              3b 01 5c 01  2b 01 63 01              192.1.160      
                                              36 01 64 01  2a 01 7c 01              192.1.168      
                                              39 01 67 01  25 01 5e 01              192.1.176      
                                              2f 01 5c 01  2b 01 4a 01              192.1.184      
                                              32 01 69 01  27 01 62 01              192.1.192      
  10.2                             31  IN     1a 00 00 00  01 00 02 00   41us       193.1.0        
                                              31 84 00 01  04 00 43 22              193.1.8        
                                              00 00 01 01  04 00 00 00              193.1.16       
                                              00 00 00 55  aa 55 aa                 193.1.24       
  10.2                         524288  IN     6a 01 4a 01  6c 01 52 01  249ms       194.1.0        
                                              6b 01 4f 01  76 01 3d 01              194.1.8        
                                              7a 01 47 01  71 01 47 01              194.1.16       
                                              74 01 3a 01  7c 01 39 01              194.1.24       
                                              6c 01 41 01  7a 01 46 01              194.1.32       
                                              76 01 51 01  6a 01 55 01              194.1.40       
                                              89 01 51 01  80 01 48 01              194.1.48       
                                              84 01 58 01  83 01 5f 01              194.1.56       
                                              7d 01 53 01  7c 01 57 01              194.1.64       
                                              7c 01 54 01  72 01 4d 01              194.1.72       
                                              80 01 51 01  6c 01 4f 01              194.1.80       
                                              76 01 55 01  80 01 4d 01              194.1.88       
                                              68 01 43 01  6e 01 53 01              194.1.96       
                                              8a 01 4d 01  7c 01 44 01              194.1.104      
                                              79 01 60 01  8a 01 48 01              194.1.112      
                                              7c 01 4f 01  89 01 59 01              194.1.120      
                                              86 01 45 01  79 01 38 01              194.1.128      
                                              74 01 4b 01  78 01 51 01              194.1.136      
                                              7e 01 57 01  7c 01 5c 01              194.1.144      
                                              88 01 53 01  7e 01 60 01              194.1.152      
                                              7e 01 55 01  86 01 47 01              194.1.160      
                                              72 01 3b 01  86 01 58 01              194.1.168      
                                              72 01 48 01  85 01 4c 01              194.1.176      
                                              74 01 58 01  98 01 5a 01              194.1.184      
                                              78 01 58 01  73 01 4e 01              194.1.192      
  10.2                         524288  IN     52 01 2c 01  5f 01 2e 01   12ms       195.1.0        
                                              59 01 34 01  53 01 26 01              195.1.8        
                                              53 01 34 01  62 01 28 01              195.1.16       
                                              58 01 2e 01  58 01 2e 01              195.1.24       
                                              58 01 22 01  5c 01 28 01              195.1.32       
                                              5b 01 29 01  57 01 31 01              195.1.40       
                                              61 01 2b 01  5f 01 26 01              195.1.48       
                                              78 01 2d 01  4c 01 32 01              195.1.56       
                                              68 01 39 01  64 01 30 01              195.1.64       
                                              55 01 31 01  54 01 2b 01              195.1.72       
                                              5a 01 29 01  5b 01 2b 01              195.1.80       
                                              4f 01 27 01  52 01 27 01              195.1.88       
                                              58 01 2b 01  55 01 25 01              195.1.96       
                                              56 01 29 01  56 01 21 01              195.1.104      
                                              5c 01 23 01  64 01 31 01              195.1.112      
                                              62 01 29 01  66 01 33 01              195.1.120      
                                              5a 01 28 01  5a 01 33 01              195.1.128      
                                              59 01 2d 01  54 01 2f 01              195.1.136      
                                              52 01 25 01  53 01 2b 01              195.1.144      
                                              54 01 1f 01  58 01 31 01              195.1.152      
                                              57 01 27 01  5e 01 33 01              195.1.160      
                                              60 01 2d 01  58 01 21 01              195.1.168      
                                              5a 01 32 01  48 01 23 01              195.1.176      
                                              59 01 2b 01  57 01 22 01              195.1.184      
                                              55 01 24 01  56 01 2a 01              195.1.192      
  10.2                         524288  IN     43 01 60 01  2f 01 5c 01   12ms       196.1.0        
                                              2b 01 5c 01  29 01 5c 01              196.1.8        
                                              31 01 66 01  2b 01 66 01              196.1.16       
                                              25 01 5e 01  32 01 56 01              196.1.24       
                                              2a 01 5b 01  28 01 64 01              196.1.32       
                                              2c 01 5c 01  3b 01 63 01              196.1.40       
                                              28 01 5d 01  2b 01 66 01              196.1.48       
                                              35 01 6e 01  2b 01 5a 01              196.1.56       
                                              2e 01 5c 01  35 01 6c 01              196.1.64       
                                              31 01 64 01  37 01 58 01              196.1.72       
                                              29 01 56 01  2b 01 5e 01              196.1.80       
                                              33 01 64 01  35 01 5b 01              196.1.88       
                                              2c 01 6b 01  29 01 59 01              196.1.96       
                                              2c 01 5a 01  2f 01 64 01              196.1.104      
                                              2f 01 5c 01  31 01 59 01              196.1.112      
                                              33 01 64 01  31 01 5c 01              196.1.120      
                                              28 01 58 01  2c 01 56 01              196.1.128      
                                              36 01 5d 01  34 01 59 01              196.1.136      
                                              34 01 5e 01  2c 01 62 01              196.1.144      
                                              2f 01 61 01  43 01 58 01              196.1.152      
                                              31 01 55 01  2f 01 5d 01              196.1.160      
                                              3d 01 51 01  3d 01 54 01              196.1.168      
                                              29 01 67 01  31 01 60 01              196.1.176      
                                              33 01 58 01  31 01 62 01              196.1.184      
                                              1d 01 59 01  38 01 5e 01              196.1.192      
  10.2                         524288  IN     5d 01 33 01  6a 01 39 01   13ms       197.1.0        
                                              61 01 32 01  69 01 37 01              197.1.8        
                                              61 01 2d 01  5e 01 37 01              197.1.16       
                                              60 01 39 01  5b 01 31 01              197.1.24       
                                              5e 01 3d 01  5c 01 37 01              197.1.32       
                                              5c 01 32 01  66 01 3f 01              197.1.40       
                                              5e 01 33 01  63 01 34 01              197.1.48       
                                              57 01 31 01  5e 01 41 01              197.1.56       
                                              61 01 3b 01  60 01 3a 01              197.1.64       
                                              63 01 3e 01  73 01 3a 01              197.1.72       
                                              6b 01 38 01  66 01 24 01              197.1.80       
                                              54 01 38 01  63 01 38 01              197.1.88       
                                              5b 01 33 01  64 01 37 01              197.1.96       
                                              5f 01 3b 01  5c 01 33 01              197.1.104      
                                              5e 01 3d 01  67 01 37 01              197.1.112      
                                              60 01 38 01  5f 01 2c 01              197.1.120      
                                              63 01 38 01  69 01 38 01              197.1.128      
                                              63 01 34 01  67 01 35 01              197.1.136      
                                              6d 01 33 01  60 01 2f 01              197.1.144      
                                              65 01 30 01  50 01 32 01              197.1.152      
                                              57 01 2f 01  61 01 2e 01              197.1.160      
                                              64 01 32 01  5b 01 30 01              197.1.168      
                                              5e 01 39 01  62 01 34 01              197.1.176      
                                              65 01 40 01  5c 01 33 01              197.1.184      
                                              67 01 37 01  68 01 2a 01              197.1.192      
  10.2                         524288  IN     2e 01 62 01  31 01 63 01   12ms       198.1.0        
                                              31 01 5e 01  3d 01 66 01              198.1.8        
                                              35 01 68 01  31 01 66 01              198.1.16       
                                              30 01 69 01  33 01 69 01              198.1.24       
                                              34 01 65 01  39 01 61 01              198.1.32       
                                              39 01 50 01  3b 01 63 01              198.1.40       
                                              35 01 5e 01  36 01 6e 01              198.1.48       
                                              3b 01 5e 01  37 01 5f 01              198.1.56       
                                              35 01 67 01  28 01 5a 01              198.1.64       
                                              30 01 66 01  3a 01 5b 01              198.1.72       
                                              32 01 63 01  49 01 61 01              198.1.80       
                                              39 01 64 01  3a 01 65 01              198.1.88       
                                              3a 01 66 01  40 01 64 01              198.1.96       
                                              3e 01 61 01  3b 01 6f 01              198.1.104      
                                              31 01 66 01  36 01 62 01              198.1.112      
                                              3b 01 61 01  3e 01 69 01              198.1.120      
                                              38 01 64 01  3d 01 61 01              198.1.128      
                                              3b 01 6d 01  3d 01 5f 01              198.1.136      
                                              3a 01 6f 01  3b 01 68 01              198.1.144      
                                              31 01 67 01  38 01 58 01              198.1.152      
                                              33 01 67 01  2d 01 5f 01              198.1.160      
                                              38 01 5e 01  2d 01 7b 01              198.1.168      
                                              35 01 75 01  30 01 5c 01              198.1.176      
                                              31 01 62 01  23 01 67 01              198.1.184      
                                              3b 01 7a 01  26 01 64 01              198.1.192      
  10.2                             31  IN     1a 00 00 00  01 00 02 00   42us       199.1.0        
                                              31 84 00 01  04 00 44 22              199.1.8        
                                              00 00 01 01  04 00 00 00              199.1.16       
                                              00 00 00 55  aa 55 aa                 199.1.24       
  10.2                         524288  IN     66 01 33 01  67 01 4d 01  249ms       200.1.0        
                                              6b 01 45 01  67 01 39 01              200.1.8        
                                              81 01 3b 01  6a 01 47 01              200.1.16       
                                              6e 01 3a 01  81 01 41 01              200.1.24       
                                              63 01 55 01  7c 01 47 01              200.1.32       
                                              6b 01 49 01  6f 01 51 01              200.1.40       
                                              7f 01 53 01  6d 01 3d 01              200.1.48       
                                              82 01 52 01  7c 01 57 01              200.1.56       
                                              79 01 3d 01  81 01 43 01              200.1.64       
                                              80 01 4a 01  6c 01 3f 01              200.1.72       
                                              74 01 4f 01  76 01 4e 01              200.1.80       
                                              72 01 3c 01  83 01 59 01              200.1.88       
                                              73 01 44 01  7f 01 38 01              200.1.96       
                                              7a 01 49 01  76 01 47 01              200.1.104      
                                              78 01 5c 01  7c 01 44 01              200.1.112      
                                              7c 01 4d 01  7d 01 55 01              200.1.120      
                                              83 01 4b 01  70 01 4a 01              200.1.128      
                                              72 01 46 01  7b 01 59 01              200.1.136      
                                              6f 01 4d 01  72 01 4e 01              200.1.144      
                                              8a 01 4c 01  82 01 66 01              200.1.152      
                                              8c 01 51 01  72 01 40 01              200.1.160      
                                              6a 01 3d 01  82 01 5a 01              200.1.168      
                                              6e 01 4b 01  88 01 50 01              200.1.176      
                                              77 01 5a 01  88 01 57 01              200.1.184      
                                              77 01 3d 01  76 01 3d 01              200.1.192      
  10.2                         524288  IN     59 01 2b 01  5e 01 30 01   13ms       201.1.0        
                                              54 01 30 01  5c 01 2b 01              201.1.8        
                                              5c 01 33 01  5e 01 29 01              201.1.16       
                                              5c 01 27 01  63 01 2b 01              201.1.24       
                                              52 01 28 01  56 01 22 01              201.1.32       
                                              62 01 2f 01  5a 01 2f 01              201.1.40       
                                              5e 01 27 01  60 01 1e 01              201.1.48       
                                              62 01 23 01  56 01 24 01              201.1.56       
                                              58 01 2f 01  59 01 25 01              201.1.64       
                                              58 01 3b 01  60 01 23 01              201.1.72       
                                              50 01 2f 01  53 01 29 01              201.1.80       
                                              5a 01 2b 01  5a 01 2d 01              201.1.88       
                                              57 01 21 01  5a 01 30 01              201.1.96       
                                              54 01 25 01  5d 01 26 01              201.1.104      
                                              5d 01 2f 01  5c 01 21 01              201.1.112      
                                              5f 01 15 01  58 01 28 01              201.1.120      
                                              56 01 1f 01  5a 01 2f 01              201.1.128      
                                              59 01 29 01  58 01 2d 01              201.1.136      
                                              5a 01 21 01  5d 01 2d 01              201.1.144      
                                              51 01 2b 01  57 01 28 01              201.1.152      
                                              5b 01 29 01  48 01 21 01              201.1.160      
                                              61 01 23 01  51 01 27 01              201.1.168      
                                              51 01 3a 01  52 01 24 01              201.1.176      
                                              53 01 30 01  53 01 2f 01              201.1.184      
                                              4e 01 21 01  59 01 2b 01              201.1.192      
  10.2                         524288  IN     4b 01 5c 01  35 01 5e 01   13ms       202.1.0        
                                              2e 01 5a 01  35 01 62 01              202.1.8        
                                              3a 01 54 01  37 01 5a 01              202.1.16       
                                              2c 01 5b 01  38 01 59 01              202.1.24       
                                              2f 01 5c 01  25 01 5b 01              202.1.32       
                                              2d 01 60 01  2b 01 6b 01              202.1.40       
                                              27 01 57 01  38 01 64 01              202.1.48       
                                              38 01 64 01  2f 01 5b 01              202.1.56       
                                              32 01 55 01  30 01 60 01              202.1.64       
                                              31 01 58 01  39 01 64 01              202.1.72       
                                              2b 01 63 01  2d 01 5f 01              202.1.80       
                                              31 01 5c 01  2b 01 60 01              202.1.88       
                                              28 01 56 01  31 01 62 01              202.1.96       
                                              3b 01 62 01  39 01 5a 01              202.1.104      
                                              3a 01 58 01  27 01 60 01              202.1.112      
                                              30 01 66 01  2c 01 57 01              202.1.120      
                                              2a 01 5e 01  31 01 5d 01              202.1.128      
                                              31 01 60 01  35 01 60 01              202.1.136      
                                              2d 01 64 01  24 01 64 01              202.1.144      
                                              2e 01 5d 01  2f 01 59 01              202.1.152      
                                              23 01 60 01  23 01 68 01              202.1.160      
                                              37 01 58 01  25 01 57 01              202.1.168      
                                              2a 01 5b 01  2f 01 61 01              202.1.176      
                                              2f 01 51 01  2f 01 5a 01              202.1.184      
                                              37 01 5c 01  2c 01 5c 01              202.1.192      
  10.2                         524288  IN     5b 01 2f 01  6d 01 36 01   12ms       203.1.0        
                                              55 01 3a 01  6f 01 2b 01              203.1.8        
                                              5d 01 37 01  5f 01 2d 01              203.1.16       
                                              5d 01 35 01  69 01 37 01              203.1.24       
                                              61 01 3e 01  5a 01 36 01              203.1.32       
                                              62 01 31 01  58 01 1d 01              203.1.40       
                                              60 01 35 01  64 01 2c 01              203.1.48       
                                              60 01 34 01  67 01 33 01              203.1.56       
                                              5f 01 3c 01  5f 01 2f 01              203.1.64       
                                              61 01 3e 01  63 01 32 01              203.1.72       
                                              68 01 33 01  64 01 2d 01              203.1.80       
                                              5d 01 30 01  5c 01 32 01              203.1.88       
                                              62 01 39 01  60 01 35 01              203.1.96       
                                              58 01 35 01  62 01 2e 01              203.1.104      
                                              60 01 3a 01  5e 01 30 01              203.1.112      
                                              5a 01 2f 01  67 01 31 01              203.1.120      
                                              67 01 27 01  6e 01 31 01              203.1.128      
                                              68 01 3e 01  65 01 3d 01              203.1.136      
                                              5e 01 33 01  66 01 3b 01              203.1.144      
                                              54 01 2e 01  54 01 35 01              203.1.152      
                                              69 01 2c 01  62 01 2f 01              203.1.160      
                                              64 01 33 01  5b 01 2d 01              203.1.168      
                                              64 01 37 01  68 01 29 01              203.1.176      
                                              72 01 38 01  4d 01 35 01              203.1.184      
                                              57 01 2b 01  5b 01 31 01              203.1.192      
  10.2                         524288  IN     35 01 57 01  33 01 5f 01   13ms       204.1.0        
                                              35 01 62 01  2f 01 59 01              204.1.8        
                                              2d 01 5f 01  38 01 66 01              204.1.16       
                                              31 01 52 01  2d 01 5d 01              204.1.24       
                                              34 01 66 01  41 01 57 01              204.1.32       
                                              2d 01 60 01  3f 01 67 01              204.1.40       
                                              2c 01 55 01  2f 01 6b 01              204.1.48       
                                              31 01 5e 01  2d 01 5a 01              204.1.56       
                                              2f 01 60 01  33 01 50 01              204.1.64       
                                              39 01 51 01  31 01 61 01              204.1.72       
                                              2d 01 5e 01  3d 01 5b 01              204.1.80       
                                              29 01 64 01  35 01 67 01              204.1.88       
                                              2c 01 5c 01  2c 01 60 01              204.1.96       
                                              21 01 65 01  29 01 71 01              204.1.104      
                                              31 01 4e 01  29 01 60 01              204.1.112      
                                              39 01 70 01  2d 01 54 01              204.1.120      
                                              32 01 58 01  39 01 59 01              204.1.128      
                                              30 01 61 01  39 01 60 01              204.1.136      
                                              31 01 6b 01  26 01 5e 01              204.1.144      
                                              38 01 5c 01  28 01 56 01              204.1.152      
                                              29 01 57 01  28 01 60 01              204.1.160      
                                              33 01 5b 01  30 01 6d 01              204.1.168      
                                              32 01 5c 01  29 01 5f 01              204.1.176      
                                              2b 01 58 01  2f 01 64 01              204.1.184      
                                              2b 01 7f 01  2b 01 54 01              204.1.192      
  10.2                             31  IN     1a 00 00 00  01 00 02 00   37us       205.1.0        
                                              31 84 00 01  04 00 45 22              205.1.8        
                                              00 00 01 01  04 00 00 00              205.1.16       
                                              00 00 00 55  aa 55 aa                 205.1.24       
  10.2                         524288  IN     6a 01 41 01  60 01 41 01  249ms       206.1.0        
                                              6c 01 4f 01  71 01 45 01              206.1.8        
                                              72 01 49 01  76 01 51 01              206.1.16       
                                              7c 01 3a 01  79 01 4d 01              206.1.24       
                                              72 01 38 01  72 01 41 01              206.1.32       
                                              6f 01 51 01  74 01 43 01              206.1.40       
                                              8d 01 4f 01  71 01 4a 01              206.1.48       
                                              7a 01 48 01  7f 01 52 01              206.1.56       
                                              7c 01 42 01  7a 01 4f 01              206.1.64       
                                              7e 01 52 01  6e 01 48 01              206.1.72       
                                              78 01 54 01  73 01 43 01              206.1.80       
                                              76 01 4a 01  81 01 44 01              206.1.88       
                                              6c 01 46 01  6b 01 44 01              206.1.96       
                                              71 01 47 01  74 01 4d 01              206.1.104      
                                              8e 01 5e 01  80 01 43 01              206.1.112      
                                              72 01 5a 01  7b 01 55 01              206.1.120      
                                              82 01 4c 01  7b 01 42 01              206.1.128      
                                              68 01 4f 01  80 01 4c 01              206.1.136      
                                              82 01 49 01  7a 01 4d 01              206.1.144      
                                              85 01 4e 01  85 01 51 01              206.1.152      
                                              7f 01 51 01  78 01 47 01              206.1.160      
                                              74 01 41 01  83 01 50 01              206.1.168      
                                              77 01 49 01  78 01 4b 01              206.1.176      
                                              7f 01 54 01  89 01 52 01              206.1.184      
                                              83 01 45 01  73 01 4d 01              206.1.192      
  10.2                         524288  IN     55 01 25 01  52 01 33 01   13ms       207.1.0        
                                              4e 01 30 01  5f 01 22 01              207.1.8        
                                              63 01 38 01  5a 01 2e 01              207.1.16       
                                              59 01 2c 01  54 01 2f 01              207.1.24       
                                              61 01 26 01  52 01 33 01              207.1.32       
                                              4f 01 2d 01  51 01 2c 01              207.1.40       
                                              62 01 32 01  56 01 2e 01              207.1.48       
                                              60 01 3a 01  57 01 2f 01              207.1.56       
                                              67 01 32 01  56 01 30 01              207.1.64       
                                              4f 01 36 01  52 01 2b 01              207.1.72       
                                              58 01 26 01  5e 01 24 01              207.1.80       
                                              59 01 3b 01  63 01 37 01              207.1.88       
                                              54 01 2a 01  5e 01 33 01              207.1.96       
                                              60 01 31 01  5e 01 2b 01              207.1.104      
                                              5e 01 2a 01  5c 01 2b 01              207.1.112      
                                              4b 01 25 01  59 01 33 01              207.1.120      
                                              5d 01 23 01  53 01 2a 01              207.1.128      
                                              5a 01 25 01  64 01 27 01              207.1.136      
                                              5e 01 27 01  57 01 32 01              207.1.144      
                                              55 01 20 01  5c 01 28 01              207.1.152      
                                              5b 01 1d 01  5c 01 2b 01              207.1.160      
                                              5a 01 26 01  52 01 27 01              207.1.168      
                                              51 01 30 01  57 01 2c 01              207.1.176      
                                              64 01 25 01  4d 01 2c 01              207.1.184      
                                              60 01 29 01  5b 01 32 01              207.1.192      
  10.2                         524288  IN     47 01 5d 01  2d 01 53 01   12ms       208.1.0        
                                              2d 01 6f 01  2d 01 64 01              208.1.8        
                                              36 01 64 01  3b 01 61 01              208.1.16       
                                              2f 01 63 01  25 01 61 01              208.1.24       
                                              2f 01 6e 01  32 01 6a 01              208.1.32       
                                              33 01 5c 01  35 01 62 01              208.1.40       
                                              3b 01 64 01  29 01 60 01              208.1.48       
                                              2e 01 64 01  3d 01 51 01              208.1.56       
                                              35 01 56 01  37 01 5f 01              208.1.64       
                                              2d 01 6b 01  33 01 62 01              208.1.72       
                                              2b 01 58 01  33 01 60 01              208.1.80       
                                              39 01 50 01  32 01 65 01              208.1.88       
                                              2a 01 5d 01  39 01 62 01              208.1.96       
                                              34 01 5c 01  2c 01 5f 01              208.1.104      
                                              34 01 5f 01  3b 01 54 01              208.1.112      
                                              32 01 59 01  38 01 5c 01              208.1.120      
                                              31 01 54 01  2b 01 62 01              208.1.128      
                                              29 01 61 01  36 01 54 01              208.1.136      
                                              31 01 61 01  2a 01 54 01              208.1.144      
                                              33 01 6a 01  2f 01 5c 01              208.1.152      
                                              3b 01 57 01  31 01 58 01              208.1.160      
                                              40 01 52 01  27 01 5d 01              208.1.168      
                                              33 01 5c 01  33 01 62 01              208.1.176      
                                              31 01 58 01  32 01 5a 01              208.1.184      
                                              27 01 4e 01  3b 01 5e 01              208.1.192      
  10.2                         524288  IN     57 01 3f 01  5f 01 37 01   13ms       209.1.0        
                                              5d 01 3f 01  5e 01 30 01              209.1.8        
                                              5e 01 2f 01  58 01 38 01              209.1.16       
                                              68 01 40 01  5e 01 4a 01              209.1.24       
                                              64 01 3e 01  67 01 31 01              209.1.32       
                                              5f 01 29 01  57 01 35 01              209.1.40       
                                              64 01 35 01  5e 01 3b 01              209.1.48       
                                              6a 01 36 01  61 01 2f 01              209.1.56       
                                              66 01 3d 01  62 01 38 01              209.1.64       
                                              6a 01 31 01  75 01 2e 01              209.1.72       
                                              57 01 31 01  5b 01 31 01              209.1.80       
                                              5b 01 29 01  5e 01 3d 01              209.1.88       
                                              62 01 35 01  66 01 3b 01              209.1.96       
                                              5a 01 33 01  68 01 29 01              209.1.104      
                                              57 01 41 01  52 01 2e 01              209.1.112      
                                              5b 01 33 01  68 01 36 01              209.1.120      
                                              64 01 3c 01  64 01 37 01              209.1.128      
                                              61 01 31 01  60 01 41 01              209.1.136      
                                              5c 01 3d 01  69 01 33 01              209.1.144      
                                              64 01 3a 01  60 01 39 01              209.1.152      
                                              67 01 31 01  6b 01 3a 01              209.1.160      
                                              62 01 31 01  5c 01 36 01              209.1.168      
                                              60 01 35 01  62 01 2d 01              209.1.176      
                                              67 01 2f 01  67 01 29 01              209.1.184      
                                              5f 01 27 01  5c 01 2f 01              209.1.192      
  10.2                         524288  IN     2d 01 61 01  32 01 5c 01   12ms       210.1.0        
                                              2b 01 69 01  31 01 68 01              210.1.8        
                                              37 01 5c 01  29 01 5f 01              210.1.16       
                                              36 01 5a 01  34 01 6b 01              210.1.24       
                                              2d 01 61 01  35 01 5e 01              210.1.32       
                                              2b 01 60 01  31 01 66 01              210.1.40       
                                              36 01 57 01  2b 01 66 01              210.1.48       
                                              33 01 58 01  39 01 58 01              210.1.56       
                                              28 01 60 01  2a 01 60 01              210.1.64       
                                              30 01 69 01  2a 01 5b 01              210.1.72       
                                              3e 01 5c 01  36 01 63 01              210.1.80       
                                              35 01 5b 01  35 01 68 01              210.1.88       
                                              3c 01 69 01  2d 01 5d 01              210.1.96       
                                              35 01 5c 01  2e 01 6c 01              210.1.104      
                                              3b 01 5e 01  35 01 63 01              210.1.112      
                                              31 01 5f 01  2b 01 59 01              210.1.120      
                                              39 01 5e 01  33 01 6c 01              210.1.128      
                                              39 01 5c 01  37 01 60 01              210.1.136      
                                              40 01 64 01  32 01 65 01              210.1.144      
                                              2e 01 64 01  2b 01 5e 01              210.1.152      
                                              29 01 5b 01  37 01 62 01              210.1.160      
                                              33 01 5e 01  32 01 71 01              210.1.168      
                                              38 01 60 01  37 01 70 01              210.1.176      
                                              2a 01 5d 01  33 01 54 01              210.1.184      
                                              2c 01 66 01  3a 01 6a 01              210.1.192      
  10.2                             31  IN     1a 00 00 00  01 00 02 00   35us       211.1.0        
                                              31 84 00 01  04 00 46 22              211.1.8        
                                              00 00 01 01  04 00 00 00              211.1.16       
                                              00 00 00 55  aa 55 aa                 211.1.24       
  10.2                         524288  IN     6e 01 3d 01  68 01 4c 01  250ms       212.1.0        
                                              74 01 4b 01  6c 01 43 01              212.1.8        
                                              77 01 41 01  7c 01 4d 01              212.1.16       
                                              75 01 33 01  7e 01 3b 01              212.1.24       
                                              68 01 4b 01  76 01 53 01              212.1.32       
                                              6e 01 56 01  7e 01 53 01              212.1.40       
                                              83 01 57 01  7f 01 4f 01              212.1.48       
                                              6f 01 4f 01  70 01 6b 01              212.1.56       
                                              74 01 4d 01  78 01 5b 01              212.1.64       
                                              83 01 5c 01  6b 01 50 01              212.1.72       
                                              7b 01 5d 01  70 01 51 01              212.1.80       
                                              8b 01 50 01  7b 01 51 01              212.1.88       
                                              6e 01 48 01  72 01 4a 01              212.1.96       
                                              81 01 49 01  86 01 54 01              212.1.104      
                                              86 01 69 01  7d 01 45 01              212.1.112      
                                              74 01 4b 01  7f 01 51 01              212.1.120      
                                              80 01 4a 01  8e 01 59 01              212.1.128      
                                              75 01 4e 01  78 01 50 01              212.1.136      
                                              8a 01 4b 01  7e 01 6b 01              212.1.144      
                                              82 01 53 01  79 01 5a 01              212.1.152      
                                              7b 01 53 01  76 01 48 01              212.1.160      
                                              6e 01 41 01  8b 01 4f 01              212.1.168      
                                              72 01 55 01  8b 01 52 01              212.1.176      
                                              7b 01 63 01  8e 01 4e 01              212.1.184      
                                              7e 01 4e 01  77 01 4a 01              212.1.192      
  10.2                         524288  IN     5c 01 32 01  5d 01 2b 01   12ms       213.1.0        
                                              59 01 2b 01  59 01 2d 01              213.1.8        
                                              58 01 2a 01  5c 01 2c 01              213.1.16       
                                              54 01 28 01  60 01 27 01              213.1.24       
                                              5c 01 24 01  57 01 29 01              213.1.32       
                                              53 01 30 01  57 01 2a 01              213.1.40       
                                              61 01 1f 01  5a 01 27 01              213.1.48       
                                              56 01 22 01  58 01 2c 01              213.1.56       
                                              5b 01 19 01  59 01 2a 01              213.1.64       
                                              57 01 35 01  59 01 31 01              213.1.72       
                                              58 01 29 01  59 01 23 01              213.1.80       
                                              61 01 2b 01  59 01 31 01              213.1.88       
                                              59 01 2a 01  67 01 29 01              213.1.96       
                                              61 01 26 01  58 01 2b 01              213.1.104      
                                              5f 01 2a 01  5c 01 33 01              213.1.112      
                                              58 01 27 01  57 01 23 01              213.1.120      
                                              4f 01 2f 01  55 01 29 01              213.1.128      
                                              5f 01 2e 01  59 01 22 01              213.1.136      
                                              60 01 1c 01  57 01 27 01              213.1.144      
                                              5b 01 29 01  5d 01 2f 01              213.1.152      
                                              5a 01 24 01  59 01 27 01              213.1.160      
                                              4c 01 27 01  44 01 24 01              213.1.168      
                                              5c 01 2d 01  5c 01 2d 01              213.1.176      
                                              50 01 2a 01  5d 01 23 01              213.1.184      
                                              4c 01 23 01  4c 01 2e 01              213.1.192      
  10.2                         524288  IN     3a 01 51 01  2d 01 5c 01   13ms       214.1.0        
                                              2f 01 60 01  2d 01 64 01              214.1.8        
                                              29 01 5a 01  2e 01 60 01              214.1.16       
                                              1f 01 5f 01  29 01 5b 01              214.1.24       
                                              27 01 58 01  30 01 67 01              214.1.32       
                                              2f 01 53 01  33 01 62 01              214.1.40       
                                              22 01 6e 01  2f 01 67 01              214.1.48       
                                              2e 01 60 01  33 01 67 01              214.1.56       
                                              35 01 5a 01  2c 01 72 01              214.1.64       
                                              3b 01 5c 01  2c 01 4e 01              214.1.72       
                                              2a 01 5d 01  34 01 69 01              214.1.80       
                                              2f 01 57 01  2e 01 64 01              214.1.88       
                                              23 01 54 01  2b 01 54 01              214.1.96       
                                              2c 01 5d 01  2e 01 60 01              214.1.104      
                                              31 01 6c 01  35 01 5a 01              214.1.112      
                                              2f 01 5a 01  35 01 5f 01              214.1.120      
                                              31 01 55 01  30 01 57 01              214.1.128      
                                              22 01 5f 01  26 01 58 01              214.1.136      
                                              34 01 5d 01  2f 01 58 01              214.1.144      
                                              2d 01 64 01  37 01 60 01              214.1.152      
                                              21 01 5b 01  34 01 5a 01              214.1.160      
                                              2d 01 4f 01  2d 01 70 01              214.1.168      
                                              29 01 5d 01  23 01 5a 01              214.1.176      
                                              2e 01 62 01  2b 01 66 01              214.1.184      
                                              31 01 52 01  2f 01 59 01              214.1.192      
  10.2                         524288  IN     62 01 2d 01  60 01 31 01   13ms       215.1.0        
                                              63 01 33 01  66 01 28 01              215.1.8        
                                              6c 01 2e 01  61 01 2b 01              215.1.16       
                                              60 01 35 01  64 01 3b 01              215.1.24       
                                              5f 01 31 01  5f 01 37 01              215.1.32       
                                              67 01 31 01  60 01 31 01              215.1.40       
                                              6f 01 2f 01  63 01 2e 01              215.1.48       
                                              5f 01 33 01  64 01 31 01              215.1.56       
                                              66 01 2f 01  69 01 3f 01              215.1.64       
                                              55 01 35 01  5f 01 2e 01              215.1.72       
                                              61 01 2e 01  66 01 33 01              215.1.80       
                                              66 01 3d 01  65 01 30 01              215.1.88       
                                              54 01 31 01  6a 01 3e 01              215.1.96       
                                              6c 01 3f 01  64 01 3c 01              215.1.104      
                                              53 01 31 01  64 01 2f 01              215.1.112      
                                              5f 01 39 01  6a 01 2e 01              215.1.120      
                                              62 01 30 01  6f 01 30 01              215.1.128      
                                              67 01 35 01  5f 01 33 01              215.1.136      
                                              55 01 2a 01  68 01 3a 01              215.1.144      
                                              5c 01 3a 01  5e 01 32 01              215.1.152      
                                              62 01 28 01  5e 01 2e 01              215.1.160      
                                              5e 01 2e 01  58 01 2c 01              215.1.168      
                                              5b 01 35 01  4c 01 37 01              215.1.176      
                                              62 01 3b 01  55 01 3f 01              215.1.184      
                                              57 01 2d 01  65 01 24 01              215.1.192      
  10.2                         524288  IN     2b 01 5c 01  36 01 5b 01   12ms       216.1.0        
                                              32 01 52 01  2f 01 59 01              216.1.8        
                                              2e 01 5d 01  2b 01 5f 01              216.1.16       
                                              28 01 67 01  25 01 59 01              216.1.24       
                                              31 01 61 01  33 01 60 01              216.1.32       
                                              2d 01 5c 01  3f 01 66 01              216.1.40       
                                              32 01 61 01  2f 01 58 01              216.1.48       
                                              2b 01 63 01  2d 01 6a 01              216.1.56       
                                              2e 01 6a 01  2b 01 67 01              216.1.64       
                                              3b 01 5e 01  37 01 5c 01              216.1.72       
                                              2f 01 6e 01  35 01 5c 01              216.1.80       
                                              2a 01 5e 01  2b 01 62 01              216.1.88       
                                              36 01 5d 01  31 01 5a 01              216.1.96       
                                              32 01 6d 01  28 01 62 01              216.1.104      
                                              36 01 5e 01  31 01 60 01              216.1.112      
                                              35 01 55 01  30 01 60 01              216.1.120      
                                              32 01 67 01  33 01 64 01              216.1.128      
                                              45 01 68 01  39 01 66 01              216.1.136      
                                              35 01 67 01  36 01 63 01              216.1.144      
                                              32 01 5f 01  2c 01 6a 01              216.1.152      
                                              35 01 6c 01  2b 01 4e 01              216.1.160      
                                              2f 01 5e 01  2d 01 74 01              216.1.168      
                                              39 01 73 01  31 01 65 01              216.1.176      
                                              2d 01 62 01  2f 01 59 01              216.1.184      
                                              33 01 7b 01  33 01 5c 01              216.1.192      
  10.2                             31  IN     1a 00 00 00  01 00 02 00   34us       217.1.0        
                                              31 84 00 01  04 00 47 22              217.1.8        
                                              00 00 01 01  04 00 00 00              217.1.16       
                                              00 00 00 55  aa 55 aa                 217.1.24       
  10.2                         524288  IN     60 01 40 01  60 01 3b 01  249ms       218.1.0        
                                              67 01 3a 01  77 01 41 01              218.1.8        
                                              7b 01 44 01  72 01 46 01              218.1.16       
                                              70 01 44 01  7e 01 49 01              218.1.24       
                                              6e 01 4b 01  73 01 4b 01              218.1.32       
                                              69 01 4f 01  70 01 4b 01              218.1.40       
                                              8c 01 58 01  6c 01 41 01              218.1.48       
                                              75 01 51 01  81 01 52 01              218.1.56       
                                              7e 01 43 01  77 01 4f 01              218.1.64       
                                              7f 01 4c 01  6e 01 48 01              218.1.72       
                                              78 01 5b 01  6f 01 41 01              218.1.80       
                                              73 01 4d 01  7f 01 51 01              218.1.88       
                                              67 01 32 01  6c 01 4b 01              218.1.96       
                                              6d 01 4d 01  83 01 4f 01              218.1.104      
                                              7b 01 67 01  7c 01 55 01              218.1.112      
                                              81 01 51 01  88 01 4f 01              218.1.120      
                                              81 01 50 01  86 01 42 01              218.1.128      
                                              6f 01 41 01  78 01 57 01              218.1.136      
                                              7c 01 4b 01  83 01 57 01              218.1.144      
                                              87 01 57 01  88 01 5b 01              218.1.152      
                                              80 01 5e 01  70 01 45 01              218.1.160      
                                              66 01 4f 01  84 01 57 01              218.1.168      
                                              6b 01 47 01  72 01 4d 01              218.1.176      
                                              76 01 5b 01  88 01 5f 01              218.1.184      
                                              77 01 4d 01  74 01 4f 01              218.1.192      
  10.2                         524288  IN     58 01 32 01  5b 01 24 01   12ms       219.1.0        
                                              5b 01 29 01  5e 01 27 01              219.1.8        
                                              5e 01 2c 01  53 01 33 01              219.1.16       
                                              53 01 2f 01  52 01 27 01              219.1.24       
                                              54 01 25 01  5f 01 29 01              219.1.32       
                                              5a 01 31 01  58 01 2a 01              219.1.40       
                                              54 01 39 01  60 01 28 01              219.1.48       
                                              5f 01 22 01  55 01 1e 01              219.1.56       
                                              5b 01 2f 01  52 01 26 01              219.1.64       
                                              51 01 37 01  60 01 2b 01              219.1.72       
                                              58 01 31 01  5c 01 2d 01              219.1.80       
                                              5b 01 23 01  50 01 2a 01              219.1.88       
                                              50 01 30 01  5d 01 2d 01              219.1.96       
                                              66 01 2a 01  4d 01 27 01              219.1.104      
                                              5d 01 25 01  5e 01 23 01              219.1.112      
                                              54 01 22 01  59 01 33 01              219.1.120      
                                              46 01 2f 01  57 01 2d 01              219.1.128      
                                              5f 01 27 01  52 01 35 01              219.1.136      
                                              57 01 1b 01  56 01 1b 01              219.1.144      
                                              54 01 29 01  57 01 28 01              219.1.152      
                                              57 01 34 01  66 01 2d 01              219.1.160      
                                              54 01 2c 01  48 01 23 01              219.1.168      
                                              53 01 34 01  5c 01 2d 01              219.1.176      
                                              56 01 2a 01  50 01 30 01              219.1.184      
                                              50 01 1e 01  4d 01 2d 01              219.1.192      
  10.2                         524288  IN     3b 01 62 01  26 01 62 01   12ms       220.1.0        
                                              2b 01 5a 01  2f 01 58 01              220.1.8        
                                              35 01 5e 01  29 01 63 01              220.1.16       
                                              27 01 6a 01  30 01 5d 01              220.1.24       
                                              3a 01 63 01  2e 01 62 01              220.1.32       
                                              31 01 5b 01  39 01 6b 01              220.1.40       
                                              2b 01 68 01  33 01 63 01              220.1.48       
                                              37 01 5e 01  33 01 5b 01              220.1.56       
                                              3a 01 5c 01  35 01 70 01              220.1.64       
                                              3f 01 62 01  35 01 5e 01              220.1.72       
                                              23 01 68 01  29 01 63 01              220.1.80       
                                              2a 01 5d 01  35 01 61 01              220.1.88       
                                              3b 01 60 01  33 01 60 01              220.1.96       
                                              31 01 62 01  39 01 65 01              220.1.104      
                                              38 01 60 01  2f 01 69 01              220.1.112      
                                              2d 01 59 01  2a 01 5d 01              220.1.120      
                                              24 01 59 01  28 01 57 01              220.1.128      
                                              33 01 60 01  31 01 53 01              220.1.136      
                                              34 01 66 01  2e 01 60 01              220.1.144      
                                              39 01 69 01  33 01 63 01              220.1.152      
                                              2f 01 6c 01  2a 01 52 01              220.1.160      
                                              37 01 57 01  34 01 60 01              220.1.168      
                                              2f 01 50 01  29 01 69 01              220.1.176      
                                              2f 01 5d 01  2d 01 64 01              220.1.184      
                                              36 01 63 01  43 01 64 01              220.1.192      
  10.2                         524288  IN     60 01 35 01  5e 01 35 01   13ms       221.1.0        
                                              5e 01 31 01  6f 01 2f 01              221.1.8        
                                              4f 01 2d 01  58 01 35 01              221.1.16       
                                              58 01 33 01  5c 01 33 01              221.1.24       
                                              5e 01 2c 01  5e 01 32 01              221.1.32       
                                              67 01 39 01  60 01 2f 01              221.1.40       
                                              60 01 26 01  59 01 37 01              221.1.48       
                                              5c 01 23 01  61 01 39 01              221.1.56       
                                              63 01 39 01  60 01 37 01              221.1.64       
                                              65 01 34 01  64 01 2b 01              221.1.72       
                                              66 01 33 01  6c 01 28 01              221.1.80       
                                              61 01 2b 01  54 01 34 01              221.1.88       
                                              5c 01 34 01  68 01 31 01              221.1.96       
                                              69 01 34 01  5b 01 34 01              221.1.104      
                                              58 01 43 01  5b 01 27 01              221.1.112      
                                              51 01 3a 01  62 01 31 01              221.1.120      
                                              64 01 31 01  74 01 2e 01              221.1.128      
                                              53 01 2d 01  63 01 37 01              221.1.136      
                                              60 01 31 01  62 01 39 01              221.1.144      
                                              52 01 2c 01  4c 01 23 01              221.1.152      
                                              5e 01 34 01  60 01 27 01              221.1.160      
                                              6e 01 2f 01  60 01 33 01              221.1.168      
                                              65 01 2f 01  62 01 32 01              221.1.176      
                                              57 01 23 01  63 01 34 01              221.1.184      
                                              62 01 3f 01  5a 01 2a 01              221.1.192      
  10.2                         524288  IN     2a 01 6b 01  34 01 53 01   14ms       222.1.0        
                                              35 01 5e 01  2c 01 5a 01              222.1.8        
                                              35 01 59 01  33 01 62 01              222.1.16       
                                              30 01 62 01  34 01 5a 01              222.1.24       
                                              30 01 5b 01  37 01 5c 01              222.1.32       
                                              3b 01 5f 01  39 01 57 01              222.1.40       
                                              27 01 5b 01  3a 01 62 01              222.1.48       
                                              29 01 5e 01  35 01 68 01              222.1.56       
                                              2b 01 5b 01  3b 01 60 01              222.1.64       
                                              27 01 64 01  37 01 60 01              222.1.72       
                                              34 01 60 01  36 01 5e 01              222.1.80       
                                              2b 01 5c 01  31 01 64 01              222.1.88       
                                              3a 01 66 01  39 01 5c 01              222.1.96       
                                              2d 01 5f 01  37 01 62 01              222.1.104      
                                              3b 01 61 01  31 01 6a 01              222.1.112      
                                              32 01 66 01  38 01 60 01              222.1.120      
                                              35 01 5b 01  31 01 5b 01              222.1.128      
                                              3b 01 63 01  37 01 6a 01              222.1.136      
                                              2c 01 67 01  2e 01 67 01              222.1.144      
                                              3c 01 59 01  37 01 63 01              222.1.152      
                                              3f 01 59 01  35 01 5c 01              222.1.160      
                                              39 01 68 01  2e 01 76 01              222.1.168      
                                              35 01 6b 01  22 01 56 01              222.1.176      
                                              2b 01 58 01  20 01 67 01              222.1.184      
                                              35 01 79 01  31 01 5e 01              222.1.192      
  10.2                             31  IN     1a 00 00 00  01 00 02 00   35us       223.1.0        
                                              31 84 00 01  04 00 48 22              223.1.8        
                                              00 00 01 01  04 00 00 00              223.1.16       
                                              00 00 00 55  aa 55 aa                 223.1.24       
  10.2                         524288  IN     64 01 47 01  6e 01 3e 01  248ms       224.1.0        
                                              6a 01 54 01  74 01 44 01              224.1.8        
                                              79 01 43 01  70 01 4b 01              224.1.16       
                                              6d 01 46 01  7b 01 37 01              224.1.24       
                                              74 01 49 01  7c 01 45 01              224.1.32       
                                              6c 01 44 01  71 01 55 01              224.1.40       
                                              8e 01 57 01  7f 01 49 01              224.1.48       
                                              85 01 58 01  78 01 5a 01              224.1.56       
                                              7f 01 44 01  78 01 53 01              224.1.64       
                                              88 01 49 01  6e 01 4d 01              224.1.72       
                                              83 01 4e 01  6e 01 4d 01              224.1.80       
                                              76 01 55 01  8a 01 58 01              224.1.88       
                                              7b 01 38 01  76 01 41 01              224.1.96       
                                              76 01 53 01  71 01 42 01              224.1.104      
                                              7c 01 55 01  86 01 3f 01              224.1.112      
                                              8d 01 4c 01  89 01 4f 01              224.1.120      
                                              7b 01 4f 01  7b 01 45 01              224.1.128      
                                              83 01 4b 01  7c 01 4c 01              224.1.136      
                                              7f 01 46 01  7c 01 4d 01              224.1.144      
                                              7a 01 55 01  82 01 4c 01              224.1.152      
                                              84 01 4a 01  7e 01 40 01              224.1.160      
                                              6a 01 45 01  7c 01 5b 01              224.1.168      
                                              77 01 51 01  7b 01 4f 01              224.1.176      
                                              73 01 65 01  8c 01 54 01              224.1.184      
                                              7c 01 51 01  7b 01 59 01              224.1.192      
  10.2                         524288  IN     5a 01 32 01  62 01 36 01   13ms       225.1.0        
                                              50 01 2b 01  52 01 31 01              225.1.8        
                                              5b 01 2c 01  63 01 29 01              225.1.16       
                                              65 01 35 01  5a 01 2f 01              225.1.24       
                                              5c 01 2d 01  53 01 2f 01              225.1.32       
                                              5c 01 36 01  5f 01 2b 01              225.1.40       
                                              58 01 32 01  60 01 2d 01              225.1.48       
                                              60 01 33 01  5d 01 2b 01              225.1.56       
                                              59 01 34 01  59 01 38 01              225.1.64       
                                              61 01 33 01  5b 01 2c 01              225.1.72       
                                              5e 01 2a 01  57 01 2e 01              225.1.80       
                                              56 01 2f 01  5c 01 28 01              225.1.88       
                                              59 01 31 01  52 01 34 01              225.1.96       
                                              66 01 29 01  59 01 24 01              225.1.104      
                                              62 01 29 01  59 01 2f 01              225.1.112      
                                              52 01 22 01  53 01 2c 01              225.1.120      
                                              54 01 2f 01  5c 01 2d 01              225.1.128      
                                              5d 01 2b 01  61 01 25 01              225.1.136      
                                              61 01 33 01  5b 01 38 01              225.1.144      
                                              60 01 2f 01  60 01 31 01              225.1.152      
                                              57 01 2f 01  60 01 2a 01              225.1.160      
                                              5b 01 37 01  5b 01 30 01              225.1.168      
                                              5c 01 33 01  5d 01 29 01              225.1.176      
                                              5c 01 2e 01  58 01 2f 01              225.1.184      
                                              55 01 1f 01  54 01 3f 01              225.1.192      
  10.2                         524288  IN     3d 01 5a 01  31 01 5c 01   12ms       226.1.0        
                                              32 01 6c 01  2b 01 64 01              226.1.8        
                                              31 01 66 01  3f 01 62 01              226.1.16       
                                              28 01 6c 01  2e 01 5c 01              226.1.24       
                                              30 01 57 01  28 01 63 01              226.1.32       
                                              2d 01 5c 01  32 01 64 01              226.1.40       
                                              32 01 66 01  34 01 6a 01              226.1.48       
                                              30 01 5c 01  41 01 5e 01              226.1.56       
                                              33 01 63 01  35 01 6a 01              226.1.64       
                                              2e 01 62 01  38 01 68 01              226.1.72       
                                              28 01 66 01  2d 01 62 01              226.1.80       
                                              29 01 5c 01  2c 01 5a 01              226.1.88       
                                              2e 01 5f 01  2e 01 69 01              226.1.96       
                                              31 01 5e 01  19 01 65 01              226.1.104      
                                              3b 01 65 01  31 01 5a 01              226.1.112      
                                              34 01 64 01  30 01 68 01              226.1.120      
                                              35 01 50 01  3d 01 68 01              226.1.128      
                                              25 01 60 01  2f 01 61 01              226.1.136      
                                              30 01 5f 01  28 01 63 01              226.1.144      
                                              3c 01 61 01  38 01 64 01              226.1.152      
                                              27 01 5c 01  32 01 62 01              226.1.160      
                                              32 01 66 01  2c 01 61 01              226.1.168      
                                              30 01 5f 01  32 01 67 01              226.1.176      
                                              30 01 66 01  37 01 63 01              226.1.184      
                                              29 01 61 01  31 01 67 01              226.1.192      
  10.2                         524288  IN     5d 01 2e 01  66 01 28 01   13ms       227.1.0        
                                              58 01 30 01  6d 01 37 01              227.1.8        
                                              67 01 33 01  53 01 3f 01              227.1.16       
                                              5c 01 2d 01  52 01 31 01              227.1.24       
                                              62 01 2b 01  62 01 24 01              227.1.32       
                                              66 01 39 01  5c 01 2e 01              227.1.40       
                                              5e 01 35 01  60 01 30 01              227.1.48       
                                              58 01 2b 01  63 01 31 01              227.1.56       
                                              65 01 43 01  5c 01 26 01              227.1.64       
                                              5e 01 3a 01  5c 01 3d 01              227.1.72       
                                              5c 01 2f 01  5c 01 31 01              227.1.80       
                                              5e 01 2a 01  5a 01 2c 01              227.1.88       
                                              61 01 32 01  6a 01 33 01              227.1.96       
                                              66 01 39 01  5a 01 34 01              227.1.104      
                                              5c 01 31 01  59 01 34 01              227.1.112      
                                              5f 01 30 01  5c 01 24 01              227.1.120      
                                              60 01 2e 01  69 01 2f 01              227.1.128      
                                              61 01 39 01  5f 01 3c 01              227.1.136      
                                              5e 01 29 01  5b 01 3b 01              227.1.144      
                                              62 01 37 01  56 01 2d 01              227.1.152      
                                              58 01 35 01  69 01 27 01              227.1.160      
                                              5e 01 27 01  5c 01 40 01              227.1.168      
                                              64 01 2f 01  64 01 39 01              227.1.176      
                                              64 01 32 01  5d 01 34 01              227.1.184      
                                              56 01 33 01  57 01 1e 01              227.1.192      
  10.2                         524288  IN     36 01 5c 01  2d 01 5c 01   12ms       228.1.0        
                                              36 01 63 01  37 01 64 01              228.1.8        
                                              37 01 5c 01  2a 01 64 01              228.1.16       
                                              37 01 69 01  2f 01 67 01              228.1.24       
                                              38 01 5c 01  34 01 57 01              228.1.32       
                                              3b 01 56 01  3d 01 60 01              228.1.40       
                                              35 01 60 01  2f 01 68 01              228.1.48       
                                              2d 01 5d 01  36 01 6a 01              228.1.56       
                                              2d 01 60 01  35 01 52 01              228.1.64       
                                              39 01 62 01  2d 01 66 01              228.1.72       
                                              29 01 5b 01  2b 01 68 01              228.1.80       
                                              33 01 63 01  39 01 6a 01              228.1.88       
                                              35 01 5c 01  35 01 58 01              228.1.96       
                                              2e 01 58 01  36 01 66 01              228.1.104      
                                              44 01 66 01  3a 01 66 01              228.1.112      
                                              2f 01 6c 01  35 01 5e 01              228.1.120      
                                              33 01 52 01  3b 01 5a 01              228.1.128      
                                              35 01 67 01  2c 01 66 01              228.1.136      
                                              38 01 62 01  34 01 6c 01              228.1.144      
                                              26 01 60 01  2a 01 53 01              228.1.152      
                                              37 01 5d 01  2c 01 69 01              228.1.160      
                                              37 01 60 01  21 01 70 01              228.1.168      
                                              3d 01 68 01  35 01 5e 01              228.1.176      
                                              25 01 5d 01  2c 01 64 01              228.1.184      
                                              33 01 7f 01  31 01 5f 01              228.1.192      
  10.2                             31  IN     1a 00 00 00  01 00 02 00   33us       229.1.0        
                                              31 84 00 01  04 00 49 22              229.1.8        
                                              00 00 01 01  04 00 00 00              229.1.16       
                                              00 00 00 55  aa 55 aa                 229.1.24       
  10.2                         524288  IN     73 01 3e 01  72 01 43 01  249ms       230.1.0        
                                              66 01 4f 01  72 01 4b 01              230.1.8        
                                              73 01 3f 01  73 01 48 01              230.1.16       
                                              76 01 3f 01  7e 01 49 01              230.1.24       
                                              5f 01 45 01  70 01 44 01              230.1.32       
                                              70 01 4c 01  73 01 4e 01              230.1.40       
                                              8a 01 58 01  6e 01 41 01              230.1.48       
                                              88 01 4d 01  84 01 5e 01              230.1.56       
                                              7e 01 4d 01  79 01 5d 01              230.1.64       
                                              81 01 51 01  78 01 49 01              230.1.72       
                                              7a 01 50 01  63 01 48 01              230.1.80       
                                              73 01 42 01  86 01 5b 01              230.1.88       
                                              73 01 43 01  76 01 49 01              230.1.96       
                                              7f 01 4d 01  7a 01 4f 01              230.1.104      
                                              79 01 57 01  83 01 46 01              230.1.112      
                                              7c 01 4c 01  83 01 4a 01              230.1.120      
                                              84 01 4e 01  7b 01 4d 01              230.1.128      
                                              7f 01 49 01  6b 01 4e 01              230.1.136      
                                              79 01 45 01  76 01 5a 01              230.1.144      
                                              7e 01 50 01  88 01 5c 01              230.1.152      
                                              7b 01 59 01  73 01 4a 01              230.1.160      
                                              6d 01 3f 01  84 01 4f 01              230.1.168      
                                              7b 01 4f 01  7e 01 4f 01              230.1.176      
                                              70 01 5d 01  84 01 4d 01              230.1.184      
                                              7c 01 47 01  80 01 57 01              230.1.192      
